,abstract,lead_paragraph,pub_date,document_type,section_name,type_of_material,headline,keywords
116,"Over 230 pieces went under the hammer, including sculptures by Rodin. The French actor — now dogged by allegations of sexual misconduct — once played the artist in a movie.","The near-entirety of an art collection belonging to Gérard Depardieu, the prolific French actor whose career was clouded in recent years by accusations of sexual assault and harassment, was sold at a two-day Paris auction this week that brought in 4 million euros, including fees, or about $4.2 million.",2023-09-27T19:09:47+0000,article,Arts,News,Gérard Depardieu’s Art Collection Sells for $4.2 Million at Paris Auction,"Depardieu, Gerard;Art;Paris (France);France;Collectors and Collections;Sex Crimes;Auctions;Sexual Harassment;Rodin, Auguste;Movies;Actors and Actresses"
117,"As French cultural counselor in New York, Gaëtan Bruel created artist residencies in the United States, museum curator exchanges and reimagined a poet’s studio.","It was a surprising diplomatic event on New York’s Upper East Side — one that started with an auspicious “bonsoir,” and ended with an unexpected “au revoir.”",2023-09-27T19:13:02+0000,article,Arts,News,"In New York, Creating a ‘Port of Entry’ for Young French Artists","Art;France;Bruel, Gaetan;United States International Relations;Manhattan (NYC)"
118,The first hearing in the impeachment inquiry comes as Republicans are grasping for evidence tying President Biden to his son’s foreign business dealings.,"Top House Republicans are eyeing potential impeachment charges of bribery and abuse of power against President Biden, according to senior House officials familiar with their plans, as they push forward with an inquiry that seeks to tie him to his son’s foreign business dealings.",2023-09-27T19:28:53+0000,article,U.S.,News,House Republicans Eye Bribery and Abuse of Power Charges Against Biden,"Biden, Joseph R Jr;Biden, Hunter;Impeachment;Ethics and Official Misconduct;Bribery and Kickbacks;Republican Party;House of Representatives;House Committee on Oversight and Government Reform;House Committee on Ways and Means;Comer, James R;Presidential Election of 2024;United States Politics and Government"
119,The confession at issue in the case came after the accused mastermind asked about a lawyer. He would not get to see one for 15 more months.,Prosecutors called a retired F.B.I. agent this week to testify that the man who is accused of orchestrating the Sept. 11 attacks freely discussed the deadly hijacking plot during four days of questioning in January 2007.,2023-09-27T20:01:42+0000,article,U.S.,News,"Man Accused of Leading 9/11 Plot Was Denied a Lawyer, Then Confessed","September 11 (2001);Terrorism;United States Defense and Military Forces;Confessions;Decisions and Verdicts;Detainees;Torture;Military Tribunals;AL QAEDA;Central Intelligence Agency;Mohammed, Khalid Shaikh;Guantanamo Bay Naval Base (Cuba)"
120,"With a Sept. 30 deadline looming, hard-right House Republicans have formed a wall of opposition to a temporary measure to fund the government.",Follow our live updates for a potential government shutdown.,2023-09-27T20:05:48+0000,article,U.S.,News,The Republicans Driving Congress Toward a Shutdown,"Federal Budget (US);House of Representatives;Republican Party;Gaetz, Matt;McCarthy, Kevin (1965- );Shutdowns (Institutional);United States Politics and Government"
121,"He drew a distinction between the facts we learn and the experiences we remember, which he argued are part of what makes us human.","Endel Tulving, whose insights into the structure of human memory and the way we recall the past revolutionized the field of cognitive psychology, died on Sept. 11 in Mississauga, Ontario. He was 96.",2023-09-27T20:11:04+0000,article,Science,Obituary (Obit),"Endel Tulving, Whose Work on Memory Reshaped Psychology, Dies at 96","Tulving, Endel (1927-2023);Deaths (Obituaries);Memory;Psychology and Psychologists;University of Toronto;Rotman Research Institute;Organization of Memory (Book)"
122,"Great skin is not simply a matter of DNA — your daily habits, in fact, have a big impact on what you see in the mirror. ","Great skin is not simply a matter of DNA — your daily habits, in fact, have a big impact on what you see in the mirror. But depending on which product reviews you read or doctors you consult, there is a dizzying number of opinions on everything from how to moisturize to how to protect yourself from UV rays. Ultimately, caring for your skin is simply personal. Here’s what you should keep in mind to sort through all the noise.",2023-09-27T20:33:40+0000,article,Guide,News,How to Build a Skin Care Routine,Skin;Cosmetics and Toiletries;Content Type: Service
123,Plus the new ChatGPT can ‘see’ and ‘talk.’,"Pvt. Travis King, the American soldier who crossed into North Korea on July 18, was released into U.S. custody yesterday after weeks of diplomacy mediated by the Swedish government, U.S. officials said.",2023-09-27T20:36:05+0000,article,Briefing,briefing,Thursday Briefing: U.S. Soldier Is Out of North Korea,"Far East, South and Southeast Asia and Pacific Areas;North Korea;Iraq;Trump, Donald J"
124,"Strength training is the key to flexibility, mobility, improved performance and lower injury risk. ","No matter your age or athletic ability, strength training is the key to flexibility, mobility, improved performance and lower injury risk. Anyone, at any fitness level, can and should strength train. And it doesn’t have to take hours at the gym to see results. We’ll teach you the basics of strength training in the comfort of your own home. It’ll take only nine minutes of exertion to complete a full-body strength-building workout. Grab a towel and get ready to feel strong.",2023-09-27T20:38:52+0000,article,Guide,News,The 9-Minute Strength Workout,Exercise;Muscles;Content Type: Service
125,"Students examine how chatbots are reshaping college admissions, look critically at what happens when they are given essay prompts, and formulate opinions about the questions raised by these tools.",Featured Article: “Ban or Embrace? Colleges Wrestle With A.I.-Generated Admissions Essays.” by Natasha Singer,2023-09-27T20:39:17+0000,article,The Learning Network,News,Lesson Plan: Applying to College in the Age of A.I.,
126,"If so, how? Tell us what you are thinking, and what practical and ethical questions these new A.I. tools raise for you.",Teachers: We also have a lesson plan that accompanies this Student Opinion forum.,2023-09-27T20:39:50+0000,article,The Learning Network,News,Should Students Let ChatGPT Help Them Write Their College Essays?,
127,"Originally published on Nov. 20, 2017","Would you like to improve your mental flexibility, learn a few interesting things every day and establish bragging rights among your friends? Solving crossword puzzles is like mental yoga — both challenging and relaxing at the same time. Plus, it’s fun, especially if you appreciate words and wordplay as much as I do. I believe that with patience and practice anyone can learn to solve crosswords. Once you master a few basic strategies, you’ll find that puzzle-solving is not only possible, but highly addictive. So let’s get solving!",2023-09-27T20:50:56+0000,article,Guide,News,How to Solve The New York Times Crossword,Crossword Puzzles;Content Type: Service
128,"Originally published on Mar. 27, 2017",,2023-09-27T20:58:04+0000,article,Guide,News,Yoga for Everyone,Yoga;Content Type: Service
129,"Originally published on Aug. 8, 2016",,2023-09-27T21:02:22+0000,article,Guide,News,How to Meditate,Content Type: Service;Meditation
130,"Originally published on Mar. 30, 2016","Running is a great way to get fit, feel better and even form new relationships with other runners. Starting a new running habit doesn’t have to be hard — all it takes is a comfortable pair of shoes and a willingness to move a little or a lot, all at your own pace. The Well Guide makes it easy to get started, get inspired and stay on track. Are you ready? Let’s go!",2023-09-27T21:05:20+0000,article,Guide,News,How to Start Running,Running;Content Type: Service;Marathon Running
131,"Originally published on Nov. 1, 2017","Getting older is inevitable (and certainly better than the alternative). While you can’t control your age, you can slow the decline of aging with smart choices along the way. From the foods you eat and how you exercise to your friendships and retirement goals — it all has an effect on how fast or slow your body ages. Keep reading for simple ways to keep your body tuned up and your mind tuned in. And the good news is that it’s never too late to get started.",2023-09-27T21:07:31+0000,article,Guide,News,How to Age Well,Longevity;Content Type: Service
132,"The trip to space was only supposed to last six months for Frank Rubio, but technical difficulties kept his crew in orbit for over a year.","A NASA astronaut safely returned to Earth on Wednesday after spending 371 days in space, a record in spaceflight for American astronauts.",2023-09-27T21:11:37+0000,article,Science,News,"Frank Rubio, NASA Astronaut, Returns Home After a Record Year-Plus in Space","Soyuz Project;Records and Achievements;Rocket Science and Propulsion;Rubio, Frank (1975- );National Aeronautics and Space Administration;Roscosmos;United States;Russia"
133,"Originally published on Nov. 15, 2017","Behavioral scientists have spent a lot of time studying what makes us happy (and what doesn’t). We know happiness can predict health and longevity, and happiness scales can be used to measure social progress and the success of public policies. But happiness isn’t something that just happens to you. Everyone has the power to make small changes in our behavior, our surroundings and our relationships that can help set us on course for a happier life.",2023-09-27T21:14:44+0000,article,Guide,News,How to Be Happy,Happiness;Content Type: Personal Profile
134,See the likely path and wind arrival times for Philippe.,See the likely path and wind arrival times for Philippe.,2023-09-27T21:15:30+0000,multimedia,U.S.,Interactive Feature,Tracking Tropical Storm Philippe,Hurricanes and Tropical Storms;Weather
135,"Originally published on Nov. 29, 2016","For runners, food is more than simple nutrition — food is fuel. What and when should you eat before, during and after your runs? What should you drink and how much? When you are training for a long race — 10K or more — you are going to have to change how you eat; we’ll show you how to make those changes.",2023-09-27T21:18:12+0000,article,Guide,News,How to Feed a Runner,Running;Diet and Nutrition;Content Type: Service;Food
136,"Originally published on Sep. 1, 2018","Everyone knows that exercise is one of the best things you can do for your health. But most people ignore one crucial component of it: resistance training. According to federal researchers, only 6 percent of adults do the recommended minimum amount of at least two muscle-strengthening workouts each week. Neglecting resistance training — any type of workout that builds strength and muscle — is a big mistake. It increases your metabolism, lowers your body fat and protects you from some of the leading causes of early death and disability. You don’t have to lift like a bodybuilder (or look like one) to benefit from resistance training. And it’s never too late to get started. Here is everything you need to know about resistance training, along with some simple, expert-approved workouts you can do at the gym or at home with minimal equipment.",2023-09-27T21:22:23+0000,article,Guide,News,How to Get Strong,Muscles;Exercise;Content Type: Service
137,"Most people know they need to eat right and exercise to be healthy. But what about sleep? We spend about one-third of our lives asleep, and sleep is essential to better health. ","Originally published on Nov. 11, 2016",2023-09-27T21:24:46+0000,article,Guide,News,How to Get a Better Night’s Sleep,Sleep;Content Type: Service
138,"Originally published on Mar. 9, 2018","If you’re like most Americans, you eat more sugar than is good for you. But it’s entirely possible to eat less sugar without sacrificing much — if any — of the pleasures of eating. Surprising as it may sound, many people who have cut back on sugar say they find their new eating habits more pleasurable than their old ones. This guide will walk you through why sugar matters, how you can make smart food choices to reduce sugar consumption, and how you can keep your life sweet, even without so many sweets.",2023-09-27T21:30:29+0000,article,Guide,News,How to Stop Eating Sugar,Content Type: Service;Sugar;Diet and Nutrition;Food
139,"Originally published on June 26, 2017",,2023-09-27T21:31:57+0000,article,Guide,News,How to Pack a Suitcase,Content Type: Service;Luggage and Packing;Travel and Vacations
140,"Originally published on Dec. 1, 2018","More and more, we live in bubbles. Most of us are surrounded by people who look like us, vote like us, earn like us, spend money like us, have educations like us and worship like us. The result is an empathy deficit, and it’s at the root of many of our biggest problems. It’s because of how homogeneous people’s social circles have become, and also because humans naturally hold biases. But researchers have discovered that far from being an immutable trait, empathy can be developed. There are steps people can take to acknowledge their biases and to move beyond their own worldviews to try to understand those held by other people. Bonus: You’ll make new friends along the way.",2023-09-27T21:33:52+0000,article,Guide,News,How to Be More Empathetic,Empathy;Content Type: Service
141,"Originally published on July 24, 2017","Stress is unavoidable in modern life, but it doesn’t have to get you down. Work, money and family all create daily stress, while bigger issues like the global pandemic and politics contribute to our underlying stress levels. But approach it the right way, and it won’t rule your life — it can even be good for you. Here are ways to deal with stress, reduce its harm and even use your daily stress to make you stronger.",2023-09-27T21:35:13+0000,article,Guide,News,How to Be Better at Stress,Content Type: Service;Anxiety and Stress
142,See who got the most speaking time and which subjects the candidates discussed most.,See who got the most speaking time and which subjects the candidates discussed most.,2023-09-27T21:35:23+0000,multimedia,U.S.,Interactive Feature,Which Candidates Got the Most Speaking Time in the Second Republican Debate,"Debates (Political);Republican Party;DeSantis, Ron;Christie, Christopher J;Haley, Nikki R;Scott, Timothy Eugene;Pence, Mike;Ramaswamy, Vivek (1985- );Burgum, Douglas"
143,"Originally published on May 4, 2018","Want a tighter core, solid arms and sculpted legs? Not only can yoga make you more flexible and reduce stress, it can also make your body strong. By starting with poses like dolphin push-ups and half handstand, you can build and tone muscles throughout the body, and your mind will get a workout too. Now roll out your yoga mat and get ready to sweat! You’ll be amazed by what you can do.",2023-09-27T21:38:36+0000,article,Guide,News,Yoga to Make You Strong,Content Type: Service;Yoga;Muscles
144,"The United Automobile Workers union said the strikes against General Motors, Ford and Stellantis could grow on Friday if negotiators don’t make enough progress.",The United Automobile Workers union said on Wednesday that it planned to expand its strike against the big three Michigan automakers on Friday if negotiators failed to make substantial progress on new contracts.,2023-09-27T21:40:30+0000,article,Business Day,News,U.A.W. Says It Could Expand Auto Strikes on Friday,"United Automobile Workers;General Motors;Ford Motor Co;Stellantis NV;Strikes;Organized Labor;Labor and Jobs;Wages and Salaries;Automobiles;Shutdowns (Institutional);Collective Bargaining;Factories and Manufacturing;Fain, Shawn;Michigan;Missouri;Toledo (Ohio)"
145,Learn how to tame the laundry beast (and stop using your ‘laundry chair’) with this guide. Figure out sorting your permanent press from your delicates and which clothes really need extra attention. ,"Originally published on April 5, 2018",2023-09-27T21:42:26+0000,article,Guide,News,How to Do Laundry,Laundry and Laundromats;Content Type: Service
146,New York’s attorney general sued the former president using a state law that grants her wide powers to pursue corporate wrongdoing.,"When a New York judge ruled on Tuesday that Donald J. Trump had committed fraud by inflating his assets, he was effectively saying that the facts at the heart of the case against Mr. Trump would not be subject to debate during a trial that could begin Monday.",2023-09-27T21:43:38+0000,article,New York,News,What We Know About a Judge’s Finding That Trump Committed Fraud,"Decisions and Verdicts;Attorneys General;Suits and Litigation (Civil);Frauds and Swindling;New York State Civil Case Against Trump (452564/2022);Engoron, Arthur F;James, Letitia;Kise, Christopher M;Trump, Donald J;New York State"
147,"Originally published on May 15, 2017","Every home — big, small, apartment or vacation home — gets dirty. And while there’s not just one way to clean your living space, there is a smarter way to get the job done. Take this guided tour of your home — from the kitchen and bathroom to the bedroom and living areas — to learn the basic rules of cleaning as well as some tips and short cuts that will help you clean thoroughly and efficiently, starting now.",2023-09-27T21:45:00+0000,article,Guide,News,A Smarter Way to Clean Your Home,"Hygiene and Cleanliness;Cleansers, Detergents and Soaps;Content Type: Service"
148,The Renaissance tour is a blueprint for how to cultivate pleasure and hold onto it at all costs.,"In late August, Beyoncé shared a story on Instagram: She asked those attending upcoming Renaissance World Tour dates to come dressed in silver. It was her birthday wish. “We’ll surround ourselves in a shimmering human disco ball each night,” she wrote. “Everybody mirroring each other’s joy.” It was a rare request from a woman who, in the last 10 years, has pulled back almost entirely from media interactions, preferring to speak only through her art.",2023-09-27T21:49:29+0000,article,Magazine,News,"A Silvery, Shimmering Summer of Beyoncé","Knowles, Beyonce;Renaissance (Album);Rap and Hip-Hop;Pop and Rock Music;Lemonade (Album);Jay-Z"
149,"Also, a looming government shutdown. Here’s the latest at the end of Wednesday.","Seven Republican presidential hopefuls will gather at 9 p.m. Eastern to face off in the party’s second debate of the year. While the performances of the candidates are still expected to be deeply consequential, tonight’s event feels like a race for second place. That’s because Donald Trump, who is skipping the debate, is polling about as well as any candidate in the modern history of contested primaries.",2023-09-27T21:55:14+0000,article,Briefing,News,The Second Republican Debate,Presidential Election of 2024;Primaries and Caucuses;Debates (Political);Republican Party
150,"Originally published on Aug. 1, 2018","Food labels can seem perplexing, and people often read them with an eye toward different things. Whether you are looking to limit your sugar, cut calories or increase your fiber intake, this guide will help you make sense of the numbers, ingredients and nutritional information packed onto that tiny box. Read on for the information you need to get through the supermarket with ease.",2023-09-27T21:59:40+0000,article,Guide,News,How to Read a Food Label,Diet and Nutrition;Food;Labeling and Labels (Product);Content Type: Service
151,"Originally published April 29, 2016","Think you’re too busy to work out? We have the workout for you. In minutes, high-intensity interval training (H.I.I.T.) will have you sweating, breathing hard and maximizing the health benefits of exercise without the time commitment. Best of all, it’s scientifically proven to work.",2023-09-27T22:03:33+0000,article,Guide,News,"Really, Really Short Workouts",Exercise;Content Type: Service
152,"Originally published on Jan. 18, 2017","Craving a new challenge? Try a triathlon, which incorporates swimming, biking and running all in one race. With more than 3.5 million participants worldwide, triathlons are more about personal goals than competition. A triathlon may seem intimidating, but the event has a reputation for being unusually welcoming and supportive to beginners. You’ll find everyone from the fastest finisher to the aging plodder cheering you to the finish line. The best part? If you’re already exercising regularly, it only takes six dedicated weeks of training to get you to race day.",2023-09-27T22:05:44+0000,article,Guide,News,Let’s Try a Triathlon,Content Type: Service;Triathlon
153,"Originally published on June 21, 2017","From the moment you’re expecting your first child, you are bombarded with messages about the importance of reading. For good reason: The benefits of reading at every stage of a child’s development are well documented. Happily, raising a reader is fun, rewarding and relatively easy.",2023-09-27T22:08:20+0000,article,Guide,News,How to Raise a Reader,Books and Literature;Children and Childhood;Parenting;Reading and Writing Skills (Education);Content Type: Service
154,"Originally published on June 1, 2016","Often, you run a first marathon just to finish. After that, you start thinking about the clock. According to Running USA, the median marathon finishing times in the United States are 4:20 for men and 4:45 for women, and many aim for a sub-four or sub-five hour marathon. The good news is that the same training strategies can be used to hit any marathon time goal. Whether you’re looking to get under the five-hour-mark or qualify for the Boston Marathon, this guide is for you.",2023-09-27T22:11:27+0000,article,Guide,News,How to Run a Faster Marathon,Marathon Running;Content Type: Service
155,"Originally published on Sept. 1, 2018","Want to get strong, but don’t have time for a gym? Strength training is key for increasing flexibility, reducing injury risk and maintaining an overall healthy body. The best part is that it doesn’t have to take long. Here we’ll teach you a simple nine-minute-long strength training program that you can complete in your own home. All you need is a set of dumbbells (or another type of weight), a clock and the goal of building a stronger body.",2023-09-27T22:16:09+0000,article,Guide,News,How to Build Muscle in 9 Minutes,Content Type: Service;Exercise;Muscles;Weight Lifting
156,"Originally published on April 1, 2018","Exercise can protect you from disease, slim your waistline and extend your lifespan. But doing it regularly is easier said than done. Work, stress, relationships and a lack of time can all stand in the way, which is why the vast majority of Americans don’t exercise nearly enough. But the right plan and knowledge about how to structure an exercise routine can help you make it a regular part of your life. Here are ways that you can start a fitness routine — and stick to it — so you can reap the vast benefits of exercise.",2023-09-27T22:17:47+0000,article,Guide,News,How to Start Working Out,Exercise;Content Type: Service
157,"Originally published on Nov. 30, 2018","Stress is ever-present. Fortunately, we’ve got yoga, which is proven to help reduce stress and the health effects it causes. The best part? You don’t need any prior experience to benefit from the practice. Whether you are at home, work or somewhere in between, yoga is always here to help you relax. We’ll show you how to get started.",2023-09-27T22:18:51+0000,article,Guide,News,Want to Relax? Try Yoga,Content Type: Service;Yoga
158,"Originally published on March 7, 2019","Your knee routinely feels the force of five to eight times your body weight with every step, making it the most taxed joint of the human body. A knee is designed to withstand millions of steps during a lifetime, but sometimes all that stress can cause your knees to break down. What can you do to prevent knee pain? And stop the pain you may already feel? We’ve designed our knee guide to teach you how to keep knees working for years to come.",2023-09-27T22:20:59+0000,article,Guide,News,A User Manual for Your Knees,Content Type: Service;Knees;Muscles;Exercise;Running;Sports Injuries
159,"Originally published on Nov. 1, 2018","Public speaking can tap into a viper’s nest of dread with seemingly infinite possibilities for messing up and creating scar-tissue embarrassment in front of a crowd. If you do a Google search with these four words — “public speaking scarier death” — you’ll get more than 50 million results, many of them about surveys noting that people list speaking in public as their No. 1 fear, with death coming in second. If you find yourself agreeing with those surveys, even reading these words may be causing your pulse to quicken or your palms to sweat (apologies for that). But here’s the good news: You can do this. We’ve broken down the art of public speaking to make it less overwhelming and potentially even rewarding. (Seriously.)",2023-09-27T22:22:30+0000,article,Guide,News,How to Speak in Public,Public Speaking;Content Type: Service
