,abstract,lead_paragraph,pub_date,document_type,section_name,type_of_material,headline,keywords
0,He was perhaps best known for playing a gangster-turned-police officer on daytime TV. He was also a voice on the video game “Call of Duty.”,"Kamar de los Reyes, an actor best known for playing the police officer Antonio Vega on the soap opera “One Life to Live” and for voicing the villain Raul Menendez in the video game franchise “Call of Duty,” died on Sunday in Los Angeles. He was 56.",2023-12-26T01:39:34+0000,article,Arts,Obituary (Obit),"Kamar de los Reyes, ‘One Life to Live’ Actor, Dies at 56","de los Reyes, Kamar (1967-2023);One Life to Live (TV Program);Call of Duty (Video Game);Actors and Actresses;Deaths (Obituaries)"
1,Neil Shook makes his New York Times debut.,Jump to: Today’s Theme | Tricky Clues,2023-12-26T03:00:08+0000,article,Crosswords & Games,News,Dental Concern,Crossword Puzzles;Games
2,"The strikes followed an attack hours earlier by members of Kataib Hezbollah and affiliated groups on Erbil air base in Iraq that injured three U.S. service members, officials said, one critically.","The United States conducted a new round of airstrikes early on Tuesday in Iraq, most likely killing militants and destroying three facilities used by Iranian proxies that had been targeting American and coalition troops, U.S. officials said.",2023-12-26T03:33:49+0000,article,U.S.,News,U.S. Strikes Iran-Backed Groups in Iraq After Attack on Base Injures 3 Americans,"Drones (Pilotless Planes);United States Defense and Military Forces;Deaths (Fatalities);United States Politics and Government;Defense Department;Kataib Hezbollah;Austin, Lloyd J III;Biden, Joseph R Jr;Erbil (Iraq);Iran"
3,"Corrections that appeared in print on Tuesday, Dec. 26, 2023.","An article on Friday about United States diplomacy in the Middle East misstated the voting record of two U.S. allies on the war in Gaza. Canada and Australia both support calls for a cease-fire, but are not members of the U.N. Security Council and therefore did not vote on a measure calling for additional humanitarian aid to Gaza.",2023-12-26T03:41:05+0000,article,Corrections,Correction,"Corrections: Dec. 26, 2023",
4,"Quotation of the Day for Tuesday, December 26, 2023.",“You’re bending steel. You’re Superman for the day.”,2023-12-26T03:49:11+0000,article,Corrections,Quote,Quotation of the Day: Hobbyist Are Drawn by Hammer and Fire,
5,Hamas’s brutal raid and taking of hostages has left Israelis deeply traumatized and is expected to reshape the country for years to come.,"The Oct. 7 attack on Israel has prompted soul-searching on the Israeli left, undermining faith in a shared future with Palestinians. It has created a crisis of confidence on the Israeli right, sapping support for Prime Minister Benjamin Netanyahu. It has drawn ultra-Orthodox Jews, often ambivalent about their relationship to the Israeli state, closer to the mainstream.",2023-12-26T05:02:25+0000,article,World,News,"As World’s Gaze Shifts to Gaza, Israel’s Psyche Remains Defined by Oct. 7 Attack","Israel-Gaza War (2023- );Politics and Government;Terrorism;Palestinians;Jews and Judaism;Orthodox Judaism;Polls and Public Opinion;Hamas;Likud Party (Israel);Netanyahu, Benjamin;Israel;Gaza Strip"
6,Benjamin Netanyahu’s vow to continue the war in Gaza.,"Prime Minister Benjamin Netanyahu visited Israeli troops fighting in the Gaza Strip yesterday, his second known trip to the territory since the war began. His visit came hours after Gazan health officials reported that a devastating overnight strike on a crowded neighborhood had killed dozens.",2023-12-26T05:16:11+0000,article,World,News,Tuesday Briefing,"Israel-Gaza War (2023- );Politics and Government;Netanyahu, Benjamin;Israel;Gaza Strip"
7,"Anophthalmus hitleri is a small, amber-colored beetle native to a few damp caves in Slovenia. It has one glaring problem.","Since the end of World War II, no scientific animal name has caused more of a stink than has Anophthalmus hitleri, a designation that describes a rare, amber-colored carabid beetle that dwells in a few damp caves in central Slovenia.",2023-12-26T06:00:20+0000,article,Science,News,What to Do With a Bug Named Hitler?,"Insects;Names, Personal;Holocaust and the Nazi Era;Animals;Endangered and Extinct Species;Wildlife Trade and Poaching;Caves and Caverns;Collectors and Collections;American Ornithological Society;Berenbaum, May R;Hitler, Adolf;Linnaeus, Carl;Slovenia;Yugoslavia;your-feed-science;your-feed-animals"
8,"In a traumatized nation, the library has had to rethink its role and adapt its programming.","Before Oct. 7, Hana Cooper downloaded everything from daily news reports to rabbinic blog posts, saving them for posterity in the Israeli National Library’s archive of the Israeli internet and the broader Jewish online world.",2023-12-26T06:15:41+0000,article,World,News,Israel’s National Library Reopens After Delay Caused by Hamas Attacks,Libraries and Librarians;Israel;Terrorism;Israel-Gaza War (2023- )
9,In case you need some puzzle help.,"Welcome to The Wordle Review. Be warned: This page contains spoilers for today’s puzzle. Solve Wordle first, or scroll at your own risk.",2023-12-26T08:00:02+0000,article,Crosswords & Games,News,Today’s Wordle Review,Wordle (Puzzle)
10,Feeling stuck on today’s puzzle? We can help.,"Hi busy bees! Welcome to today’s Spelling Bee forum. There are a number of terms that appear in both this article and other online discussions of the Spelling Bee; a glossary of those terms compiled by Monicat, a Times reader, can be found below.",2023-12-26T08:00:03+0000,article,Crosswords & Games,News,Spelling Bee Forum,Spelling Bee (Game)
11,In case you need some puzzle help.,"Good morning, dear connectors. Welcome to today’s Connections forum, where you can give and receive puzzle — and emotional — support.",2023-12-26T08:00:16+0000,article,Crosswords & Games,News,The Connections Companion,Crossword Puzzles;Connections (Game)
12,"Mayor Eric Adams said that the move would allow more outlets to cover the police, but critics said it was another blow to transparency.","Since the Police Department opened its headquarters at 1 Police Plaza in Manhattan in 1973, reporters have worked in offices inside the building. Their space, nicknamed “the shack,” provides easy access to department officials.",2023-12-26T08:00:20+0000,article,New York,News,A Plan to Move Police Reporters Into a Trailer Sets Off Complaints,Newspapers;Police;Freedom of Speech and Expression;Police Department (NYC);Associated Press
13,A new program would allow the city to direct money to new construction after a tax incentive favorable to developers lapsed last year.,New York City officials put forward a plan on Tuesday to direct public money toward mixed-income housing projects in wealthier neighborhoods — a proposal aimed at addressing the affordable housing shortage and spurring development after a lucrative property tax exemption lapsed last year.,2023-12-26T08:00:27+0000,article,New York,News,New York City Aims to Build Affordable Housing in Wealthier Neighborhoods,"Zoning;Tax Credits, Deductions and Exemptions;Real Estate and Housing (Residential);Affordable Housing;Homeless Persons;Real Estate Board of New York;Torres-Springer, Maria;New York City"
14,"With drones and infrared cameras, intrepid veterinarians are monitoring the health of wild orcas in the Pacific Northwest.","One day last September, a team of scientists clambered onto a small boat and set out into the Salish Sea, searching for an endangered population of orcas. The Southern Resident killer whales, one of several distinct orca communities that inhabit the Pacific Northwest, can be elusive, so the researchers were delighted to find a small pod of them. But as they drew closer, a putrid smell washed over the boat.",2023-12-26T08:00:31+0000,article,Science,News,These Vets Make House Calls for Killer Whales,Whales and Whaling;Veterinary Medicine;Animal Behavior;Drones (Pilotless Planes);Endangered and Extinct Species;National Oceanic and Atmospheric Administration;Pacific Northwestern States (US);your-feed-science;your-feed-animals
15,"More than 150,000 people have arrived in less than two years, throwing the city into crisis. Missed opportunities made things even harder.","Nearly 70,000 migrants crammed into hundreds of emergency shelters. People sleeping on floors, or huddled on sidewalks in the December cold. Families packed into giant tents at the edge of the city, miles from schools or services.",2023-12-26T08:01:05+0000,article,New York,News,"Chaos, Fury, Mistakes: 600 Days Inside New York’s Migrant Crisis","Asylum, Right of;Immigration and Emigration;Immigration Detention;Homeless Persons;Politics and Government;Federal-State Relations (US);City Council (NYC);Department of Social Services;Homeless Services Department (NYC);Adams, Eric L;Biden, Joseph R Jr;Hochul, Kathleen C;New York City;New York State;Abbott, Gregory W (1957- )"
16,"Older crafters across Britain speak to how knitting can help us heal, even at our most broken.","Older crafters across Britain speak to how knitting can help us heal, even at our most broken.",2023-12-26T09:55:00+0000,multimedia,Opinion,Video,Visible Mending,Knitting and Knit Goods;Elderly;Handicrafts;Wool and Woolen Goods
17,"As Israel’s ground campaign broadens in southern Gaza, thousands more people are pouring into areas that are struggling to offer shelter or security.","As Israel’s ground campaign broadens in southern Gaza, thousands more people are pouring into areas that are struggling to offer shelter or security.",2023-12-26T09:57:31+0000,multimedia,World,Interactive Feature,Nearly Two Million Crowd Into Gaza’s South as Fighting Intensifies,Israel-Gaza War (2023- );Rafah (Gaza Strip);Khan Younis (Gaza Strip);Gaza Strip;Hamas;Israel;Defense and Military Forces;Refugees and Displaced Persons;Palestinians
18,"The sobriety challenge can offer a mental and physical reset, and the chance to adopt healthier habits.",Dry January sounds like a simple proposition: No alcohol. For 31 days. And some enthusiasts jump in without much planning — perhaps  even hungover after a rowdy New Year’s Eve.,2023-12-26T10:00:03+0000,article,Well,News,Considering Dry January? Set Yourself Up for Success.,Alcoholic Beverages;New Year;Mental Health and Disorders
19,We cannot afford to dismiss anyone who aims to build housing in the Bay Area.,"A company backed by Silicon Valley’s most powerful investors, including the LinkedIn co-founder Reid Hoffman and the venture capitalist Marc Andreessen, assembled a land empire outside San Francisco and announced a bold vision to build a brand-new city — and was immediately castigated by the world’s urbanists.",2023-12-26T10:00:26+0000,article,Opinion,Op-Ed,Billionaire-Built Cities Would Be Better Than Nothing,"Flannery Associates;Area Planning and Renewal;Urban Areas;Real Estate and Housing (Residential);Productivity;Affordable Housing;San Francisco Bay Area (Calif);Solano County (Calif);Woodlands, The (Tex);Baltimore (Md);Columbia (Md)"
20,"A.I. generators can produce photorealistic images, which is either an extinction-level event for photographers or a fantastic opportunity. Or both.","John Szarkowski, the legendary former curator of the Museum of Modern Art, once described photography as “the act of pointing.” And for the nearly 200 years since its inception, photography has consisted of capturing a visual perspective from the physical world using light — first with light-sensitive plates, then film, then digital sensors. When digital cameras became widely available, many photographers lamented the move away from analog technology, but basically Szarkowski’s definition still held: Photography consists of pointing, as a reaction to something that exists in the world.",2023-12-26T10:00:43+0000,article,Opinion,Op-Ed,A.I. Is the Future of Photography. Does That Mean Photography Is Dead?,"Photography;Artificial Intelligence;Paglen, Trevor;Simmons, Laurie;Cartagena, Alejandro (1977- );Engman, Charlie"
21,"Travelers to the British capital can take part in the supper club scene, where home cooks and would-be restaurateurs create meals in their homes or other locales, and making friends is part of the experience.","Alone in London with a day to kill, Jon Martin was hungry for an off-the-cuff adventure when he decided to show up for a meal at a stranger’s home.",2023-12-26T10:00:55+0000,article,Travel,News,I Just Arrived in London. Can I Come to Dinner?,"Restaurants;Cooking and Cookbooks;Travel and Vacations;Food;London (England);Organizations, Societies and Clubs"
22,"Donald J. Trump plans to sharply expand his use of tariffs if he returns to power, risking disruption to the economy in an attempt to transform it.",Former President Donald J. Trump is planning an aggressive expansion of his first-term efforts to upend America’s trade policies if he returns to power in 2025 — including imposing a new tax on “most imported goods” that would risk alienating allies and igniting a global trade war.,2023-12-26T10:01:11+0000,article,U.S.,News,A New Tax on Imports and a Split From China: Trump’s 2025 Trade Agenda,"Trump, Donald J;Presidential Election of 2024;Lighthizer, Robert E;United States Economy;Customs (Tariff);International Trade and World Market;China;Factories and Manufacturing"
23,"In Northern Ireland, one couple grappled with a problem familiar to families everywhere: How to get more space without spending too much money.","In Northern Ireland, one couple grappled with a problem familiar to families everywhere: How to get more space without spending too much money.",2023-12-26T10:01:22+0000,multimedia,Real Estate,Slideshow,A ‘Terrible’ Fixer-Upper in Belfast,Real Estate and Housing (Residential);Restoration and Renovation;Interior Design and Furnishings;Home Repairs and Improvements;Belfast (Northern Ireland)
24,"Netflix’s sprawling drama has never been about revealing anything new, but instead speaks to several furtive truths about the British monarchy.","Over the last seven years, “The Crown” has been criticized by numerous prominent Britons on behalf of their royal family.",2023-12-26T10:01:34+0000,article,Arts,News,‘The Crown’ and What the U.K. Royal Family Would Like Us to Forget,The Crown (TV Program);Great Britain;Royal Families;Television
25,"In Northern Ireland, one couple grappled with a problem familiar to families everywhere: How to get more space without spending too much money.","As they awaited the arrival of their third child in Belfast, Northern Ireland, Kerri and Neil Beggs encountered a problem familiar to families everywhere: They needed more space, but didn’t have the budget for the kind of house they wanted.",2023-12-26T10:01:35+0000,article,Real Estate,News,The Belfast Victorian Was in ‘a Terrible State.’ Was It Worth the Risk?,Real Estate and Housing (Residential);Belfast (Northern Ireland);Interior Design and Furnishings;ARCHITECTURE;Restoration and Renovation;Home Repairs and Improvements;Content Type: Service;Northern Ireland
26,"Some states and resorts offer discounted passes for children and teens, knowing that those who start young tend to keep coming back.","Skiing is not a cheap sport. It requires a lot of gear and, depending on where you live, travel. For families, the expense mushrooms with each child, often before they can determine whether skiing — or snowboarding — is an activity the children actually like.",2023-12-26T10:02:19+0000,article,Travel,News,How to Take the Whole Family Skiing Without Going Broke,Families and Family Life;Travel and Vacations;Skiing;Budget Travel;Content Type: Service
27,Remarkable new books from established masters and promising debuts from brilliant young artists.,"Good graphic novels tend to appear in bookstores seemingly out of nowhere after years of rumors, scattershot serialization, “process” zines and snippets posted to social media. As literature, long-form comics are uniquely resistant to editing. As visual art, the cartoonist is in the weird position of having no access to the final product until it’s presented to the public. So it’s frankly miraculous when we get as many good comics as we do. This year there were remarkable new books from established masters and freshman graphic novels from brilliant young artists. Better still, a gratifyingly thick stratum of our 2023 stack was devoted to making us laugh. It’s a rich conversation, and one that promises to continue into next year and long beyond.",2023-12-26T10:02:21+0000,article,Books,News,The Year in Graphic Novels,"Two Thousand Twenty Three;Books and Literature;Comic Books and Strips;Clowes, Daniel;Monica (Book);Carroll, Emily (1983- )"
28,"We tackled congestion, constipation, coffee and more. Here’s the advice you need for a vigorous new year.","One thing I love about editing the Ask Well column is the camaraderie of it. Every week we answer a health question: Why am I so congested all the time? (I’ve wondered that, too!) Why does my sleep get worse as I age? (I’m right there with you.) Is my coffee habit in need of an intervention? (Pour me another while we figure it out.)",2023-12-26T10:02:21+0000,article,Well,News,"Your Top Health Questions of 2023, Answered",Content Type: Service;Medicine and Health
29,"Crafters across Britain speak to how knitting can help us heal, even at our most broken.","I started making this short documentary as a response to my mom developing dementia in her early 60s and forgetting how to read a knitting pattern. After years of having her knit for me, I taught myself how to knit by watching YouTube tutorials. As I learned more, and my mom’s health declined, I began to understand the solace that knitting brings.",2023-12-26T10:02:28+0000,article,Opinion,Op-Ed,Knitting Helps Us Embrace Life’s Messy Imperfections,Documentary Films and Programs;Knitting and Knit Goods;England;Dementia;Mental Health and Disorders
30,"Six months ago, Joe Faillace wasn’t sure his business could survive. He believes Phoenix’s clearing of a nearby homeless encampment saved his shop.","Joe Faillace looked out the front windows of his sandwich shop this month and barely recognized the neighborhood where he has worked for almost 40 years. There were no tents within view, no emergency sirens, no campfires, no drug users slumped over on his patio or the sidewalk. Instead, he saw customers walking down quiet, clean streets toward his restaurant in time for a lunch rush that now doubles his average daily sales from early in the year.",2023-12-26T10:02:42+0000,article,U.S.,News,A Once Despairing Sandwich Shop Owner Sees ‘a Miracle’,Homeless Persons;Restaurants;Small Business;Mental Health and Disorders;Phoenix (Ariz);Drug Abuse and Traffic;internal-great-read;internal-sub-only
31,"The musicals of Stephen Sondheim often struggled at the box office during his lifetime, but since his death several have become huge hits on Broadway.","Stephen Sondheim, the great musical theater composer and lyricist, was widely acclaimed as a genius, but during his lifetime he had a bumpy track record at the box office, with many of his shows losing money.",2023-12-26T10:03:17+0000,article,Theater,News,"Sondheim Was a Critical Darling. Since His Death, He’s a Hitmaker, Too.","Theater;Theater (Broadway);Box Office Sales;Sondheim, Stephen;Merrily We Roll Along (Play);Sweeney Todd: The Demon Barber of Fleet Street (Play);Here We Are (Play)"
32,A northern community in Mexico City cannot give up on the famous 1960s hippie-favorite Volkswagen.,"Rusted and stripped of their right seat, the cars parked in queues rounding street corners serve as the unofficial taxi in the hillside neighborhoods in Cuautepec in Mexico’s capital. The curvy symbol of the 1960s hippie era is admired — even decorated and named — by residents who say the car represents their resilience and work ethic.",2023-12-26T10:03:22+0000,article,World,News,"In This Mexican Neighborhood, Locals Say ¡Viva el Beetle!",Antique and Classic Cars;Volkswagen AG;Mexico City (Mexico);Mexico
33,"A Korean drink made locally, caramel galettes des rois and more food news.","Regardless of whether the concrete becomes a winter wonderland, fondue is having its moment this season. Jean-Georges Vongerichten’s new outdoor chalet, on Madison Avenue at the Mark Hotel, is serving fondue and other Swiss specialties to the Upper East Side. The Winter Chalet, a cozy new pop-up designed by Corey Damen Jenkins at the Hotel Indigo in Williamsburg, Brooklyn, through Feb. 29, serves cheese and chocolate fondues. Another, Partridge at The Standard, East Village, open until Dec. 31, features cheese fondue, and fondue has returned to Andrew Carmellini’s Lafayette, in NoHo. You can count on the simmering cheese-based communal dipping pot year-round at La Bonne Soupe, in Midtown; at the Lavaux Wine Bar, the three-year old Swiss establishment in the West Village, there are six varieties, including porcini, tomato and truffle, with Swiss wines to discover and chocolate fondue for dessert. And at the newly opened burger spot Cantiere Hambirreria, an Italian import parked in NoLIta, there are handmade bowls that are filled with cheese fondue. Williams-Sonoma now sells nine different fondue pots, $79.95 to $870 with various fuels and accessories.",2023-12-26T10:03:22+0000,article,Food,News,Live Out Your Chalet Fantasies With These Fondue Pop-Ups,Cooking and Cookbooks;Food;Chocolate;Caviar
34,"What if, instead of focusing on improving ourselves, we focused on improving the world?","New Year’s resolutions are penny-ante prayers. You are this way, but you hope to be that way. You used to want this, but now you want that.",2023-12-26T10:03:29+0000,article,Opinion,Op-Ed,"This Year, Make a Resolution About Something Bigger Than Yourself","New Year;Whitman, Walt"
35,"Polls have been pretty clear: If he is criminally convicted by a jury of his peers, voters are likely to punish him for it.",Recent general-election polling has generally shown Donald Trump maintaining a slight lead over President Biden. Yet many of those polls also reveal an Achilles’ heel for Mr. Trump that has the potential to change the shape of the race.,2023-12-26T10:03:30+0000,article,Opinion,Op-Ed,A Trump Conviction Could Cost Him Enough Voters to Tip the Election,"Presidential Election of 2024;Polls and Public Opinion;Jury System;Trump, Donald J;Biden, Joseph R Jr;Federal Criminal Case Against Trump (Documents Case);Federal Criminal Case Against Trump (2020 Election Case);Georgia Criminal Case Against Trump (2020 Election);New York State Criminal Case Against Trump (71543-23)"
36,Burgers & Beer offers an international lineup of burgers in the Village; Don Ceviche opens a full-service restaurant in the East Village; and more restaurant news.,,2023-12-26T10:03:39+0000,article,Food,News,Sixpoint Brewery Celebrates 20 Years With a Manhattan Taproom,Restaurants;Bars and Nightclubs;Sixpoint Brewery;New York City
37,"Over the past year, dance has shown its broader worth, from stage to film, #balletcore to music videos, TikTok tutorials to movement classes.","There’s been a lot of dance seemingly coming out of nowhere. A recent unexpected sighting — one of many this year — happened just this month on “Saturday Night Live,” when Chloe Fineman, dressed in a Santa coat, appeared on Weekend Update with an idea for a sexy present: re-enacting the dance that Julia Stiles performed at the end of “Save the Last Dance.” So random!",2023-12-26T10:03:41+0000,article,Arts,News,What if Dance Could Save the World?,Dancing;Social Media;Two Thousand Twenty Three;TikTok (ByteDance)
38,"Deadheads, ballerinas and Mick Jagger: As 2023 winds down, revisit a memorable handful of the thousands of images commissioned by our photo editors that capture the year in culture.",,2023-12-26T10:03:44+0000,article,Arts,News,2023 in Retrospect: 59 Photographs That Defined the Year in Arts,Two Thousand Twenty Three;Photography;Culture (Arts);vis-photo
39,"Ending off-year elections will make races more competitive, increasing voter power and diminishing the role of special interests.","In a rare bit of political good news in the final days of 2023, Gov. Kathy Hochul of New York has signed into law legislation aimed at increasing voter turnout.",2023-12-26T10:03:46+0000,article,Opinion,Editorial,How to Boost Voter Turnout With Just One Signature,"Law and Legislation;State Legislatures;Voting and Voters;Governors (US);Politics and Government;Hochul, Kathleen C;New York City;New York State;Elections"
40,"Meal-flavored cocktails, premium water and lots of snacks: Here’s what the next year holds for food and drinks.","No one can predict with certainty what we will eat and drink in the new year, but multitudes try.",2023-12-26T10:03:47+0000,article,Food,News,9 Predictions for How We’ll Eat in 2024,Food;Beverages;Soups;Snack Foods;Two Thousand Twenty Four
41,Analysts bullish on 2023 were largely right and expect more of the same in 2024. Bears caution that the Fed’s impact is yet to be determined.,"Twelve months ago, Tom Lee bet that 2023 was going to turn out just fine.",2023-12-26T10:04:45+0000,article,Business Day,News,"Downturn or Not? At Year’s End, Wall St. Is Split on What’s Ahead.","Stocks and Bonds;Standard & Poor's 500-Stock Index;United States Economy;Inflation (Economics);Russell 2,000 Stock Index"
