,abstract,lead_paragraph,pub_date,document_type,section_name,type_of_material,headline,keywords
0,Wall Street’s new favorite is far from a populist.,"It feels like years ago, but actually only a few months have passed since many big Republican donors seemed to believe that Ron DeSantis could effectively challenge Donald Trump for the Republican nomination. It has been an edifying spectacle — an object lesson in the reality that great wealth need not be associated with good judgment, about politics or anything else.",2023-11-28T00:00:09+0000,article,Opinion,Op-Ed,Nikki Haley Is Coming for Your Retirement,"Republican Party;Presidential Election of 2024;Social Security (US);Income Inequality;Income Tax;Retirement;Haley, Nikki R;DeSantis, Ron"
1,The New York schools chancellor promised disciplinary action but also called for understanding students’ viewpoint after hundreds at a Queens high school protested against a Jewish teacher.,"New York City officials are investigating after hundreds of Queens high school students protested against a pro-Israel teacher, who was moved to another part of the building during the demonstration, the schools chancellor said Monday.",2023-11-28T00:19:39+0000,article,New York,News,"After Students Target Pro-Israel Teacher, Officials Try to Quell Outrage","Education (K-12);Demonstrations, Protests and Riots;Teachers and School Employees;Palestinians;Israel-Gaza War (2023- );Jews and Judaism;Social Media;Threats and Threatening Messages;Education Department (NYC);Hillcrest High School (Queens, NY);Banks, David C (1962- );Katz, Melinda R;Gennaro, James F;Hillcrest (Queens, NY);Jamaica (Queens, NY);New York City"
2,"Quotation of the Day for Tuesday, November 28, 2023.","“When we meet them, we start with small chitchat while offering some snacks and coffee. We don’t go all alpha like the men, thus the situation never heightens.”",2023-11-28T00:41:31+0000,article,Corrections,Quote,"Quotation of the Day: As Rangers, Indonesian Women Guard the Forest They Live In",
3,"The retailer, founded in China, filed confidentially to take the company public in the U.S., a person familiar with the plans said.","Shein, the ultrafast-fashion retailer founded in China more than a decade ago, has filed confidentially for an initial public offering in the United States, according to a person familiar with the plans for the deal, who was not authorized to speak publicly about it.",2023-11-28T01:17:03+0000,article,Business Day,News,"Shein, the Fast-Fashion Giant, Is Said to Have Filed for an I.P.O.",Shopping and Retail;Fashion and Apparel;Forced Labor;Uighurs (Chinese Ethnic Group);Initial Public Offerings;Shein (Fashion Label);China;United States
4,You may detect shades of poetry in Gia Bosko’s puzzle.,Jump to: Today’s Theme | Tricky Clues,2023-11-28T03:00:11+0000,article,Crosswords & Games,News,Not Quite on Time,Crossword Puzzles;Games
5,The movie prize season kicks off with honors for the A24 drama and for the star of “The Unknown Country” (who’s better known for “Killers of the Flower Moon”).,"“Past Lives,” the elegiac drama about a young Korean immigrant and the romantic path not taken, won best feature at the 33rd annual Gotham Awards, which were handed out Monday night at Cipriani Wall Street in New York.",2023-11-28T03:00:37+0000,article,Movies,News,‘Past Lives’ and Lily Gladstone Win Big at the Gotham Awards,"Movies;Gladstone, Lily;Melton, Charles (1991- );Anatomy of a Fall (Movie);Four Daughters (Movie);May December (Movie);Past Lives (Movie);The Unknown Country (Movie)"
6,"The plan would put Yellow back on the road with thousands of unionized drivers, but would force the government to wait longer for a loan repayment.","When Yellow abruptly shuttered its operations in the summer and filed for bankruptcy protection, few thought that a buyer would emerge and try to revive the long-troubled trucking giant.",2023-11-28T04:58:13+0000,article,Business Day,News,"New Bidder Aims to Save Bankrupt Trucking Firm, if Creditors Go Along","Trucks and Trucking;Labor and Jobs;YRC Worldwide Inc;International Brotherhood of Teamsters;Treasury Department;Freight (Cargo);Bankruptcies;Federal Aid (US);Jack Cooper Transport Co Inc;Riggs Amico, Sarah"
7,Effective drugs that have made the disease curable have yet to reach most  of the region.,"For seven years, Sulemana Musah put almost every bit of money that came his way into his war with hepatitis C.",2023-11-28T05:00:41+0000,article,Health,News,Egypt Wiped Out Hepatitis C. Now It Is Trying to Help the Rest of Africa.,Hepatitis;Medicine and Health;International Relations;Developing Countries;World Health Organization;AFRICA;Egypt;Ghana;your-feed-healthcare;your-feed-science
8,"The electric carmaker sued the agency to deliver license plates for its cars, the latest escalation as a labor fight enters its second month.","Tesla sued Sweden’s Transport Agency on Monday over a strike by postal workers that has blocked delivery of license plates for Tesla cars, the latest escalation of a widening battle between Sweden’s labor unions and the U.S. manufacturer of electric vehicles.",2023-11-28T05:01:30+0000,article,Business Day,News,Tesla Sues Swedish Transport Agency in Dispute Over License Plates,"Tesla Motors Inc;Sweden;Musk, Elon;Strikes;Electric and Hybrid Vehicles;Automobile Registration and License Plates;Organized Labor;Suits and Litigation (Civil);Automobiles"
9,The strategies used by the Indigenous community policing alternative are in stark contrast to more muscular tactics pitched by the incoming government.,"As tempers flared on a recent evening in a nightlife district in Auckland, New Zealand’s largest city, Joanne Paikea sensed an altercation — or even an arrest — brewing.",2023-11-28T05:01:45+0000,article,World,News,"In New Zealand’s Crackdown on Crime, What Part Can Maori Wardens Play?","New Zealand;Crime and Criminals;Politics and Government;Youth;National Party (New Zealand);Luxon, Christopher"
10,Longevity drugs for our canine companions are moving closer to reality. They also raise questions about what it might mean to succeed.,"The life of a pet dog follows a predictable trajectory. Over time, the floppy-eared puppy that keeps falling asleep in his food bowl will become a lanky-legged adolescent with an insatiable interest in squirrels — before eventually settling into adulthood as a canine creature of habit, with a carefully chosen napping location and a well-rehearsed greeting ritual.",2023-11-28T05:01:45+0000,article,Science,News,Could a Drug Give Your Pet More Dog Years?,your-feed-science;your-feed-animals;Pets;Dogs;Clinical Trials;Drugs (Pharmaceuticals);Veterinary Medicine;Longevity;Loyal (Cellular Longevity Inc);Food and Drug Administration;Regulation and Deregulation of Industry
11,"Chinese families are sending money overseas, a sign of worry about the country’s economic and political future. But a cheaper currency is also helping exports.","Affluent Chinese have moved hundreds of billions of dollars out of the country this year, seizing on the end of Covid precautions that had almost completely sealed China’s borders for nearly three years.",2023-11-28T05:01:46+0000,article,Business Day,News,Gold Bars and Tokyo Apartments: How Money Is Flowing Out of China.,Economic Conditions and Trends;Foreign Investments;Banking and Financial Institutions;Gold;Currency;China;Hong Kong;Savings;Real Estate and Housing (Residential)
12,Here’s what you need to know.,"Israel and Hamas agreed to extend by two days a cease-fire that has brought a measure of calm to the Gaza Strip after seven weeks of intense warfare, the Qatari government said. The two sides struck a deal to exchange more hostages and prisoners and to allow more aid into the beleaguered area.",2023-11-28T05:34:36+0000,article,Briefing,briefing,Tuesday Briefing,
13,"The Netherlands, where rural areas are losing physicians, bus stops and schools while urban areas thrive, is fertile ground for a demagogue.","A country where depopulating rural areas are losing physicians, bus stops and elementary schools while urban areas thrive is fertile ground for a demagogue — say, a politician who crusades against Islam, immigrants and the forces of globalization.",2023-11-28T06:00:09+0000,article,Opinion,Op-Ed,How Geert Wilders Won,"Netherlands;Wilders, Geert;People's Party for Freedom and Democracy (Netherlands);Party for Freedom (Netherlands);Rural Areas;Urban Areas;Politics and Government;Elections;Immigration and Emigration;Legislatures and Parliaments;Right-Wing Extremism and Alt-Right"
14,"The law, celebrated as a model for other countries, would have eventually made tobacco illegal.",New Zealand’s new right-wing government has said it will repeal a law that would have gradually banned all cigarette sales in the country over the course of several decades.,2023-11-28T06:29:48+0000,article,World,News,New Zealand’s New Government Says It Will Scrap Smoking Ban,"Labour Party (New Zealand);National Party (New Zealand);Smoking and Tobacco;Law and Legislation;Ardern, Jacinda;New Zealand"
15,This word has appeared in 77 articles on NYTimes.com in the past year. Can you use it in a sentence?,"The word overture has appeared in 77 articles on NYTimes.com in the past year, including on Aug. 2 in “Hollywood Studios Signal New Strategy by Talking With Writers” by Brooks Barnes and John Koblin:",2023-11-28T07:00:01+0000,article,The Learning Network,News,Word of the Day: overture,
16,In case you need some puzzle help.,"Welcome to The Wordle Review. Be warned: This page contains spoilers for today’s puzzle. Solve Wordle first, or scroll at your own risk.",2023-11-28T08:00:02+0000,article,Crosswords & Games,News,Today’s Wordle Review,Wordle (Puzzle)
17,In case you need some puzzle help.,"Good morning, dear connectors. Welcome to today’s Connections forum, where you can give and receive puzzle — and emotional — support.",2023-11-28T08:00:05+0000,article,Crosswords & Games,News,The Connections Companion,Crossword Puzzles;Connections (Game)
18,Feeling stuck on today’s puzzle? We can help.,"Hi busy bees! Welcome to today’s Spelling Bee forum. There are a number of terms that appear in both this article and other online discussions of the Spelling Bee; a glossary of those terms compiled by Monicat, a Times reader, can be found below.",2023-11-28T08:00:12+0000,article,Crosswords & Games,News,Spelling Bee Forum,Spelling Bee (Game)
19,How can you give back this year?,"Nov. 28 this year is known as Giving Tuesday, a day when you are invited to take a break from buying things, and, instead, show generosity to others.",2023-11-28T08:00:15+0000,article,The Learning Network,News,Giving Tuesday,
20,"Hydrilla, a rapidly spreading invasive plant, is choking New England’s longest river. Government scientists are fighting back.",The Connecticut River faces a crisis: An aggressive invasive plant that grows in thick underwater mats is spreading swiftly.,2023-11-28T08:00:18+0000,article,New York,News,Will Dyeing the Connecticut River Help Keep It Alive?,Connecticut River;Dyes and Dyestuffs;Defoliants and Herbicides;Invasive Species
21,"A majority of those who backed President Biden in 2020 say today’s economy is fair or poor, ordinarily a bad omen for incumbents seeking re-election.",Presidents seeking a second term have often found the public’s perception of the economy a pivotal issue. It was a boon to Ronald Reagan; it helped usher Jimmy Carter and George H.W. Bush out of the White House.,2023-11-28T08:00:19+0000,article,Business Day,News,Even Most Biden Voters Don’t See a Thriving Economy,"Presidential Election of 2024;Polls and Public Opinion;United States Economy;Biden, Joseph R Jr;Democratic Party;Inflation (Economics);United States Politics and Government;New York Times/Siena College Poll;Trump, Donald J;audio-neutral-informative"
22,"Rex Heuermann is accused of killing three women. Where some saw depravity, others saw a chance to make a show.","After Rex Heuermann was arrested in July and accused of slaughtering women found bound in burlap and buried along a desolate stretch of Gilgo Beach, his family was left reeling and destitute.",2023-11-28T08:00:24+0000,article,New York,News,Wife of Gilgo Beach Suspect Gets a Documentary Deal,"Serial Murders;Video Recordings, Downloads and Streaming;Documentary Films and Programs;Television;Peacock Services;National Broadcasting Co;Police Department (Suffolk County, NY);Ellerup, Asa;Heuermann, Rex (1963- );Gilbert, Shannan;Gilgo Beach (NY);Massapequa Park (NY);audio-neutral-informative"
23,"On Achill Island in Ireland, Cian hopes to spend the summer playing soccer with his friends. But his grandfather thinks it’s about time to pass down a family tradition.","On Achill Island in Ireland, Cian hopes to spend the summer playing soccer with his friends. But his grandfather thinks it’s about time to pass down a family tradition.",2023-11-28T09:55:01+0000,multimedia,Opinion,Video,Ramboy,Agriculture and Farming;Youth;Ireland
24,"On Achill Island in Ireland, Cian hopes to spend the summer playing soccer with his friends. But his grandfather thinks it’s about time to pass down a family tradition.","Ever since we were children, we’ve been fascinated by pastoralism. We both come from families with farming roots but grew up in the city. This enthusiasm brought us to Achill Island, off the west coast of Ireland, where sheep graze over the grassland.",2023-11-28T10:00:18+0000,article,Opinion,Op-Ed,‘We Don’t Want to Let It Go’: A Family Farm in Ireland Prevails,Documentary Films and Programs;Teenagers and Adolescence;Ireland;Sheep;Livestock;Achill Island (Ireland);Agriculture and Farming;Family Business
25,"Why your short-term memory falters, and how to make it better.",Q: Some thoughts vanish from my brain as soon as I think of them. Why can’t I remember things I just knew? And how can I improve my short-term memory?,2023-11-28T10:00:19+0000,article,Well,News,"Now, What Was I Looking For?",Content Type: Service;Memory;Brain
26,Delphine de Vigan’s “Kids Run the Show” skewers the phenomenon of parents exposing their children to the world for personal gain.,"“You have to see it to believe it,” a police officer says of a mom vlogger’s YouTube channel in Delphine de Vigan’s agenda-setting literary thriller, which shines a light on the murky ethics of putting your family on social media. “Seriously, do people even know this exists?” It’s a pertinent question, because unless you have children, and carefully monitor their digital consumption, this billion-dollar industry could easily fly under your radar.",2023-11-28T10:00:20+0000,article,Books,Review,A French Thriller About a Kidfluencer Gone Missing,"Books and Literature;Social Media;de Vigan, Delphine;Anderson, Alison (Author)"
27,"We asked 46 artists, filmmakers, chefs and other creative people to forecast next year’s cultural trends. (Spoiler: We’re all going to be wearing a lot of brown.)","“Brown — the more ‘off,’ the better. It’s subtle and confrontational: Not a lot of colors have that versatility.” — Thebe Magugu, 30, fashion designer",2023-11-28T10:00:45+0000,article,T Magazine,News,The T Predictor: What We’ll Be Obsessing Over in 2024,Fashion and Apparel;Art;Design;Flowers and Plants;Culture (Arts);Sustainable Living;Color;Food
28,"In the food-obsessed port city of Belém, sweet, savory and sometimes addictive dishes are made with fresh ingredients that are tough to come by in Rio de Janeiro, let alone outside Brazil.","A foreign visitor walking through Praça Brasil, a leafy square in the Amazonian port city of Belém, might think that the whirring blenders at a dozen nearby food carts were creating the most authentic açaí bowls on earth.",2023-11-28T10:00:53+0000,article,Travel,News,Where the Flavors of the Amazon Rainforest Delight,Belem (Brazil);AMAZON JUNGLE;Brazil;Seafood;Food;Restaurants;Food Trucks and Vendors
29,"“We need protection,” one migrant at the U.S. border said. But the legal system for refugees never envisioned the millions displaced by global warming.","First came the hurricanes — two storms, two weeks apart in 2020 — that devastated Honduras and left the country’s most vulnerable in dire need. In distant villages inhabited by Indigenous people known as the Miskito, homes were leveled and growing fields were ravaged.",2023-11-28T10:00:55+0000,article,U.S.,News,They Fled Climate Chaos. Asylum Law Made Decades Ago Might Not Help,"Migrants (Environmental);Asylum, Right of;Global Warming;Immigration and Emigration;Illegal Immigration;Indigenous People;Honduras;Matamoros (Mexico);United States Politics and Government;United States International Relations"
30,The Aral Sea’s demise matters to us all.,Walking toward the shrinking remnants of what used to be the Aral Sea in Uzbekistan was like entering hell.,2023-11-28T10:00:56+0000,article,Opinion,Op-Ed,"A Giant Inland Sea Is Now a Desert, and a Warning for Humanity",Oceans and Seas;Water;ARAL SEA;Uzbekistan;Environment;Irrigation
31,"The unusual piano, made in Belgium, will make its debut in Manhattan tonight. It’s more than a foot longer than a Steinway grand.","Good morning. It’s Tuesday. We’ll find out about the unusual-looking piano that will make its Carnegie Hall debut tonight. We’ll also find out about a poll that went to big spenders, as the United States Tennis Association considers whether to build suites costing $175,000 per person at the U.S. Open.",2023-11-28T10:01:04+0000,article,New York,briefing,A Piano With a Curved Keyboard Will Star at Carnegie Hall,"New York City;internal-storyline-no;Classical Music;Luxury Goods and Services;Tennis;United States Open (Tennis);Pianos;Ashe, Arthur, Stadium;Carnegie Hall;United States Tennis Assn;Biss, Jonathan;Belgium"
32,Voters could go to the polls in 2024 without knowing whether one of the candidates is criminally responsible for trying to overturn the last one.,"If Donald Trump is the Republican nominee for president in 2024, it’s now clear he will likely still have criminal indictments hanging over his head on Election Day. It’s possible that his criminal liability for the events leading up to the Jan. 6 riot at the Capitol will remain unresolved.",2023-11-28T10:01:05+0000,article,Opinion,Op-Ed,Why Judges in the Trump Jan. 6 Trial Need a Rocket Docket,"Federal Criminal Case Against Trump (2020 Election Case);Presidential Election of 2024;Courts and the Judiciary;Watergate Affair;Chutkan, Tanya S;Trump, Donald J;Nixon, Richard Milhous;Supreme Court (US)"
33,Congress has a chance to eliminate hepatitis C in the United States.,"A little over a decade ago, I watched my brother in-law Rick Boterf die of complications from infection with the hepatitis C virus that took his health, his vibrant energy and ultimately his life.",2023-11-28T10:01:08+0000,article,Opinion,Op-Ed,We Are Squandering One of the Most Important Medical Advances of the 21st Century,"Hepatitis;Liver;Drugs (Pharmaceuticals);Welfare (US);United States Politics and Government;Collins, Francis S;Biden, Joseph R Jr;House of Representatives;Senate"
34,"Illegal deforestation for avocado crops points to a blood-soaked trade with the United States involving threats, abductions and killings.","First the trucks arrived, carrying armed men toward the mist-shrouded mountaintop. Then the flames appeared, sweeping across a forest of towering pines and oaks.",2023-11-28T10:01:15+0000,article,U.S.,News,Americans Love Avocados. It’s Killing Mexico’s Forests.,Avocados;Agriculture and Farming;Mexico;Land Use Policies;Forests and Forestry;Conservation of Resources;International Trade and World Market;Wildfires;Michoacan (Mexico);Politics and Government;United States
35,What makes you laugh these days?,It is often said that laughter is the best medicine. Do you agree? Why or why not?,2023-11-28T10:01:36+0000,article,The Learning Network,News,What Role Does Humor Play in Your Life?,
36,The government is preparing to present its energy transition plan at the U.N. climate talks as it intensifies a crackdown on environmental advocates.,"When Vietnam was awarded a multibillion-dollar deal by a group of nine wealthy nations last year to work on reducing its use of coal, it agreed to regularly consult with nongovernmental organizations.",2023-11-28T10:01:47+0000,article,World,News,Vietnam Relied on Environmentalists to Secure Billions. Then It Jailed Them.,Vietnam;Communist Party of Vietnam;International Relations;Politics and Government;Political Prisoners;Human Rights and Human Rights Violations;United Nations Framework Convention on Climate Change;Environment;Alternative and Renewable Energy;Coal;Just Energy Transition Partnership
37,"It would be tempting to allow my son to believe in a world that will never betray him, but I want him to know better.","Last summer, I lost my heart to a peevish storybook turtle. This turtle — genderless, though for the sake of ease I’ll use “he” pronouns — might be forgiven for his mood. His days are riddled with mortal peril. In the watercolor milieu where he abides, boulders have a habit of plummeting from the sky, and a time-traveling Cyclopian monster roams the land.",2023-11-28T10:01:51+0000,article,Magazine,News,Kids’ Books That Don’t Ignore the Dark Side of Life,"Books and Literature;Parenting;Klassen, Jon"
38,"The flow of students between the countries has been a mainstay of their relationship, even when ties have soured. Now these exchanges, too, are under threat.","On a cool Saturday morning, in a hotel basement in Beijing, throngs of young Chinese gathered to do what millions had done before them: dream of an American education.",2023-11-28T10:01:55+0000,article,World,News,Can U.S.-China Student Exchanges Survive Geopolitics?,China;United States International Relations;International Study and Teaching;Colleges and Universities;Graduate Schools and Students;Politics and Government;Chinese-Americans;Visas;Duke University
39,"The directors, who are part of an art collective, wind up stretching architecture’s net in so many directions that it begins to fray.","Faheem Majeed, a member of the art collective the Floating Museum and one of the artistic directors of this year’s Chicago Architecture Biennial, was standing on a patch of soil on the South Side on a brisk, sunny afternoon last month. Next to him was the artist Erika Allen, a founder and the chief executive of Urban Growers Collective.",2023-11-28T10:02:04+0000,article,Arts,News,"At the Chicago Architecture Biennial, Artists Run Free","ARCHITECTURE;Chicago Architecture Center;Floating Museum (Art Collective);Chicago (Ill);Young, Avery R"
40,American officials have told the Israelis that a major bombardment risks sparking a humanitarian crisis that overwhelms the world’s capacity to respond.,"The United States has warned Israel that it must fight more surgically and avoid further mass displacement of Palestinians in its war against Hamas to avoid a humanitarian crisis that overwhelms the world’s ability to respond, according to senior Biden administration officials.",2023-11-28T10:02:17+0000,article,U.S.,News,"U.S. Has Warned Israel to Fight More Surgically in Gaza, Officials Say","Biden, Joseph R Jr;United States International Relations;Israel-Gaza War (2023- );Israel;Defense and Military Forces;Gaza Strip;Palestinians;Civilian Casualties;Refugees and Displaced Persons;Humanitarian Aid;Hamas;Terrorism"
41,"In Las Vegas, the answer is a resounding yes — and why not throw in a wedding chapel and a bar, too?","Fat Mike likes to be on time — to “put the punk in punctual,” as he says. So he was mildly distressed to be a few minutes late meeting me at the new Punk Rock Museum in Las Vegas, of which he is a founder and the public face. I had pleasantly cooled my heels at the museum’s bar, the Triple Down. At the Triple Down, you can order a Fletcher, a double rum and Coke served in an emptied Pringles can, named for Fletcher Dragge, guitarist for the band Pennywise and a member of the museum’s governing “Punk Collective.” (You get the chips on the side.) Or you might choose a Double Fatty, honoring Fat Mike himself: a double shot of Tito’s vodka, served with lime-flavored Liquid Death sparkling water and also a shot of Jameson. Fat Mike, as he told me within five minutes of his arrival, was a first-round investor in Liquid Death.",2023-11-28T10:02:21+0000,article,Magazine,News,I Wanna Be Curated: Can You Really Put Punk in a Museum?,"internal-sub-only;Pop and Rock Music;Museums;NOFX;Music;Vans Warped Tour (Music Event);Indecency, Obscenity and Profanity;Styrene, Poly;internal-great-read;Against Me! (Music Group);Blink 182"
42,"Former President Jimmy Carter emerged from hospice care to join a cast of political heavyweights paying tribute to Mrs. Carter, who died at 96 last week at her home in Plains, Ga.","Her journey took her from the smallest of small towns in rural Georgia to the majesty of the White House, from the campaign trails of Iowa and New Hampshire to refugee camps in Asia and impoverished villages in Africa.",2023-11-28T10:02:27+0000,article,U.S.,News,"Memorial Celebrates Rosalynn Carter’s Life, a ‘Public Love Story’","First Ladies (US);Funerals and Memorials;United States Politics and Government;Content Type: Personal Profile;Carter, Jimmy;Carter, Rosalynn;Atlanta (Ga);Plains (Ga)"
