,abstract,lead_paragraph,pub_date,document_type,section_name,type_of_material,headline,keywords
0,The rivals for the Republican presidential nomination — minus Donald Trump — appeared at a “faith and family” event and talked in more personal terms.,"Casey DeSantis recounted a few humorous interactions between her husband, Gov. Ron DeSantis of Florida, and their children. Then she spoke in more sober tones about her fight against cancer.",2023-12-10T00:01:46+0000,article,U.S.,News,"Days After Heated Debate, G.O.P. Candidates Take a Gentler Tone in Iowa","DeSantis, Ron;Feenstra, Randy;Iowa;Presidential Election of 2024;Republican Party;Haley, Nikki R;Ramaswamy, Vivek (1985- )"
1,"The Iowa Republican Party reminded supporters that only residents can vote in the first-in-the-nation caucuses, which will be held on Jan. 15.","Casey DeSantis, the wife of Gov. Ron DeSantis of Florida, drew criticism on Saturday from the rival campaign of former President Donald J. Trump for seeking to recruit out-of-state supporters to participate in the nation’s first Republican nominating contest.",2023-12-10T00:23:19+0000,article,U.S.,News,Casey DeSantis Invited Outsiders to Caucus in Iowa. The State Party Said No.,"Iowa;Republican Party;Primaries and Caucuses;Presidential Election of 2024;United States Politics and Government;Voting Rights, Registration and Requirements;Rumors and Misinformation;DeSantis, Casey;DeSantis, Ron;Trump, Donald J"
2,"Mr. Whitmire, a state senator, prevailed over U.S. Representative Sheila Jackson Lee to lead the nation’s fourth-largest city.","John Whitmire, a moderate Democrat who has served in the Texas State Senate since 1983, won a runoff election on Saturday to become mayor of Houston, according to The Associated Press, defeating Representative Sheila Jackson Lee, a prominent congressional Democrat, in the nonpartisan race.",2023-12-10T01:44:35+0000,article,U.S.,News,"John Whitmire, a Moderate Democrat, Wins Runoff for Houston Mayor","Mayors;Elections, Mayors;Jackson Lee, Sheila;Whitmire, John;Houston (Tex);Texas"
3,Some of those who spent weeks in captivity addressed the cameras for the first time.,"Sitting on a couch next to a crocheted blanket, Adina Moshe introduced herself in a video as having been released from the captivity of Hamas.",2023-12-10T01:50:02+0000,article,World,News,"‘I left my good friends’: In videos shown in Tel Aviv, freed hostages share their stories.",Israel-Gaza War (2023- );Kidnapping and Hostages;Hamas;Gaza Strip;War and Armed Conflicts;vis-video
4,"Anton Thomas, a New Zealander in Melbourne, Australia, has given three years of his life to a hand-drawn map of our planet and its animal inhabitants.",A self-taught artist-cartographer and outdoorsman spent three years on an obsessive labor of love with few parallels.,2023-12-10T05:01:20+0000,article,World,News,"A World Map With No National Borders and 1,642 Animals","Maps;Content Type: Personal Profile;Thomas, Anton (Artist);Animals;Art;Earth"
5,President Abdel Fattah el-Sisi of Egypt grew increasingly unpopular amid a deep economic crisis. But the war in neighboring Gaza has given him a vital role on the international stage.,"President Abdel Fattah el-Sisi of Egypt woke up on Oct. 7 remarkably unpopular for someone considered a shoo-in for a third term — guaranteed by his authoritarian grip on the country to dominate elections that begin on Sunday, but badly damaged by a slow-motion economic collapse.",2023-12-10T05:01:28+0000,article,World,News,Gaza War Has Buoyed Egypt’s Leader Ahead of Presidential Vote,"Egypt;Israel-Gaza War (2023- );Sisi, Abdel Fattah el-;Elections;Politics and Government;Boycotts;International Monetary Fund;el-Tantawy, Ahmed (1979- );Economic Conditions and Trends"
6,"Corrections that appeared in print on Sunday, Dec. 10, 2023.","An article on Page 1 this weekend about a group that is trying to make synthesizers more accessible misstates the surname of a member of Synth Library. She is Mónica Torres-Ortiz, not Mónica Torres.",2023-12-10T05:53:36+0000,article,Corrections,News,"Corrections: Dec. 10, 2023",
7,"Quotation of the Day for Sunday, December 10, 2023.",“It’s like asking someone who played basketball if Michael Jordan influenced them.”,2023-12-10T07:02:08+0000,article,Corrections,Quote,Quotation of the Day: Lear Brought a Fuller View of Black Life Into America’s Living Rooms,
8,In case you need some puzzle help.,"Welcome to The Wordle Review. Be warned: This page contains spoilers for today’s puzzle. Solve Wordle first, or scroll at your own risk.",2023-12-10T08:00:07+0000,article,Crosswords & Games,News,Today’s Wordle Review,Wordle (Puzzle)
9,Feeling stuck on today’s puzzle? We can help.,"Hi busy bees! Welcome to today’s Spelling Bee forum. There are a number of terms that appear in both this article and other online discussions of the Spelling Bee; a glossary of those terms compiled by Monicat, a Times reader, can be found below.",2023-12-10T08:00:10+0000,article,Crosswords & Games,News,Spelling Bee Forum,Spelling Bee (Game)
10,"Morning coffee in Brooklyn, a captive audience on the subway and more reader tales of New York City in this week’s Metropolitan Diary.",Dear Diary:,2023-12-10T08:00:17+0000,article,New York,News,‘We Met in the Morning a Few Days Later and Talked for Five Hours’,New York City
11,In case you need some puzzle help.,"Good morning, dear connectors. Welcome to today’s Connections forum, where you can give and receive puzzle — and emotional — support.",2023-12-10T08:00:28+0000,article,Crosswords & Games,News,The Connections Companion,Crossword Puzzles;Connections (Game)
12,"There is no medical examiner’s office in the world like the one in Los Angeles County, where investigations of sudden celebrity deaths come with the territory.","In most places, it is a trade of little glamour. Transporting bodies, performing autopsies — the role of a coroner’s office tends to be dismissed as a macabre necessity.",2023-12-10T08:00:48+0000,article,New York,News,"In Los Angeles, the ‘Coroner to the Stars’ Has the Last Word","Forensic Science;Autopsies;Celebrities;Perry, Matthew;Monroe, Marilyn;Los Angeles (Calif);Los Angeles County (Calif)"
13,"A camera emerged from the ice, with possible clues about a mountain-climbing tragedy. Could a Times reporter take a look?",I got a message in 2020 from a photographer and climber in Argentina named Pablo Betancourt. He had read something I had written years earlier and had discovered something that he thought might make for a good story.,2023-12-10T08:01:24+0000,article,Times Insider,News,A 3-Year Odyssey in Pursuit of a Mountain Mystery in Argentina,Photography;Mountaineering;ANDES MOUNTAINS;ARGENTINA;Mendoza (Argentina)
14,Prime Minister Benjamin Netanyahu gambled that a strong Hamas (but not too strong) would keep the peace and reduce pressure for a Palestinian state.,"Just weeks before Hamas launched the deadly Oct. 7 attacks on Israel, the head of Mossad arrived in Doha, Qatar, for a meeting with Qatari officials.",2023-12-10T08:01:25+0000,article,World,News,‘Buying Quiet’: Inside the Israeli Plan That Propped Up Hamas,"Israel-Gaza War (2023- );Israel;Netanyahu, Benjamin;Politics and Government;Defense and Military Forces;Gaza Strip;Palestinians;Hamas;Terrorism;Espionage and Intelligence Services;Mossad;Palestinian Authority;Qatar;International Relations;Foreign Investments"
15,"Since early October, an ecosystem of barbers, vendors and chefs has sprung up outside one of the city’s largest migrant shelters at Randall’s Island Athletic Field 83.",Dusk was falling on a chilly fall day on Randall’s Island and a small crowd of people from around the world were milling around New York City’s newest pop-up market. Latin music played as the day’s last shoppers bought their dinners and vendors began packing up their tables.,2023-12-10T08:01:25+0000,article,New York,News,Low Prices and High Hopes at a Pop-Up Market on Randall’s Island,"Barbers and Barbering;Migrant Labor (Non-Agriculture);Homeless Persons;Immigration and Emigration;Adams, Eric L;New York City;Randalls Island (Manhattan, NY);Pop-Up Stores and Restaurants"
16,Communities across the U.S. are fueling a secondary arms market by giving seized and surrendered guns to disposal services that destroy one part and resell the rest.,"When Flint, Mich., announced in September that 68 assault weapons collected in a gun buyback would be incinerated, the city cited its policy of never reselling firearms.",2023-12-10T08:01:25+0000,article,U.S.,News,"The Guns Were Said to Be Destroyed. Instead, They Were Reborn.",Firearms;Gun Control;Recycling of Waste Materials;Salvage;E-Commerce;Government Contracts and Procurement;Police;United States;Gunbusters LLC
17,"Under the plan, the universities, which do not pay property taxes, would have to make payments to the City University of New York.","State lawmakers will unveil legislation on Tuesday that would eliminate enormous property tax breaks for Columbia University and New York University, which have expanded to become among New York City’s top 10 largest private property owners.",2023-12-10T08:01:37+0000,article,New York,News,Columbia and N.Y.U. Would Lose $327 Million in Tax Breaks Under Proposal,"Colleges and Universities;Law and Legislation;Property Taxes;Tax Credits, Deductions and Exemptions;City University of New York;Columbia University;New York University;Cornell University;New York City;New York State"
18,"The satire was only slightly less awkward than the real thing, in a freewheeling episode hosted by Adam Driver. Olivia Rodrigo was the musical guest.","Sometimes even an up-to-the-minute comedy show like “Saturday Night Live” can’t quite stay ahead of the news cycle. Hours after it was announced that Elizabeth Magill, the president of the University of Pennsylvania, was resigning after an appearance before Congress in which she appeared to evade questions about whether students should be punished for calling for the genocide of Jews, “S.N.L.” led its broadcast with a satirical recreation of the Tuesday hearing.",2023-12-10T09:18:49+0000,article,Arts,News,‘S.N.L.’ Invites University of Phoenix to the House Antisemitism Hearing,"Television;Saturday Night Live (TV Program);Driver, Adam;Rodrigo, Olivia (2003- );Gay, Claudine;Kornbluth, Sally A;Magill, Elizabeth;Harvard University;Massachusetts Institute of Technology;University of Pennsylvania"
19,Her solution? A packaging business that sells ideas for commercial genre fiction featuring characters from broadly diverse backgrounds.,"One evening this fall, a crowd of writers and publishing professionals mingled in a speakeasy-style lounge in Midtown Manhattan. The party, hosted by a new company called Electric Postcard Entertainment, was the kind of lavish affair that’s become rare for the book business in an era of corporate consolidation and cuts.",2023-12-10T10:00:31+0000,article,Books,News,The Book World Still Isn’t Diverse. Dhonielle Clayton Is Trying to Change That.,"Clayton, Dhonielle;Book Trade and Publishing;Diversity Initiatives;Race and Ethnicity;Writing and Writers;Books and Literature;Black People;Blacks;Minorities;Intellectual Property;Content Type: Personal Profile;Electric Postcard Entertainment;Cake Creative LLC;genre-books-young-adult"
20,"The eccentric pro-tech movement known as “Effective Accelerationism” wants to unshackle powerful A.I., and party along the way.","On a Monday night last month, a few hours after OpenAI held an event for developers in downtown San Francisco, hundreds of artificial intelligence aficionados packed into a three-story nightclub several blocks away to celebrate a looser, less corporate vision of the A.I. future.",2023-12-10T10:00:33+0000,article,Technology,News,"This A.I. Subculture’s Motto: Go, Go, Go",Artificial Intelligence;Social Media;Open-Source Software;Philosophy;OpenAI Labs;San Francisco Bay Area (Calif)
21,"Raglan, fluted, leg o’ mutton, bishop, puffed, balloon — whatever you want to call them, we wore them.","When Holly Waddington, the costume designer for “Poor Things,” Yorgos Lanthimos’s much heralded phantasmagorical film about a young women’s psychological and sexual awakening that opened on Friday, began thinking about what her heroine would wear, she said she was thinking “skinny arms and these kind of straight skirts with the big bustle.”",2023-12-10T10:00:34+0000,article,Style,News,The Year of the Mega Sleeve,Fashion and Apparel;Costumes;Movies;Poor Things (Movie);your-feed-fashion
22,"Pro sports franchises are increasingly providing much of their value as anchors for larger business enterprises, including entertainment complexes.",The sales of most professional sports teams are fairly predictable.,2023-12-10T10:00:36+0000,article,Business Day,News,"Bought as an N.B.A. Team, the Mavericks Are Being Sold as Much More","Dallas Mavericks;Las Vegas Sands Corp;National Basketball Assn;Adelson, Miriam;Cuban, Mark;Basketball;Gambling;Stadiums and Arenas;Casinos;audio-neutral-immersive"
23,"“It’s all about me, me, me. That’s what you think, but everything you’re saying is coming from people around you,” says the musician.","“It’s all about me, me, me. That’s what you think, but everything you’re saying is coming from people around you,” says the musician.",2023-12-10T10:00:36+0000,multimedia,Magazine,Interactive Feature,"David Byrne Isn’t Himself. Or Any Self, Really.","Byrne, David;Pop and Rock Music;Theater (Broadway)"
24,Shahnaz Habib’s “irreverent history” takes a lively and sometimes ruthless look at who gets to go where and what gets papered over in their accounts.,"Like exercise, flossing and college, travel has long been held up as an incontrovertible good — an essential part of the modern human experience. Lately, though, there’s been some pushback from the smart set, if not the jet set.",2023-12-10T10:00:37+0000,article,Books,Review,"In ‘Airplane Mode,’ Not All Travelers Head in the Same Direction","Travel and Vacations;Books and Literature;Immigration and Emigration;Content Type: Personal Profile;Airplane Mode: An Irreverent History of Travel (Book);Habib, Shahnaz"
25,A federal jury will be selected to decide how much Rudolph Giuliani should pay for spreading lies about two Georgia election workers as he fought to keep Donald Trump in office.,There will be no good news — only shades of bad — for Rudolph W. Giuliani when he appears in court on Monday for a trial to determine how much he will have to pay two Georgia election workers he lied about after the 2020 presidential race.,2023-12-10T10:01:01+0000,article,U.S.,News,Giuliani to Go on Trial for Damages in Defamation Case,"Presidential Election of 2020;United States Politics and Government;Giuliani, Rudolph W;Howell, Beryl A;Freeman, Ruby;Moss, Shaye;Voter Fraud (Election Fraud);Compensation for Damages (Law);Libel and Slander"
26,"With the publication of a new book about their influential teen drama, which debuted in 2003, Josh Schwartz and Stephanie Savage have learned to love “The O.C.” again.","“We didn’t know anything,” Josh Schwartz said. “We didn’t know the rules and we were making it up as we went along. That’s something that you learn from.”",2023-12-10T10:01:03+0000,article,Arts,News,‘The O.C.’ Creators Are Right Back Where They Started From,"Books and Literature;Welcome to the OC: The Oral History (Book);Savage, Stephanie;Schwartz, Josh;Sepinwall, Alan;The O.C. (TV Program);Television;Content Type: Personal Profile"
27,"In bitter debates from Israel to Africa to America, invoking a brutal history has become a powerful accusation.","The colonial era entered its death throes after World War II. From 1945 through the 1960s, a global order in which European powers took political control of other countries — occupying them with settlers, subjugating the local populations and exploiting the land and its inhabitants for economic gain — unraveled. Dozens of states in Asia and Africa threw off colonial overlords. Colonialism, once equated by the West with civilizing progress, became synonymous with iniquity.",2023-12-10T10:01:03+0000,article,World,News,Who’s a ‘Colonizer’? How an Old Word Became a New Weapon,Colonization;Israel-Gaza War (2023- );International Relations;Politics and Government
28,"Tragic tellings of the Shoah are all too common. The directors of “The Zone of Interest,” “Origin” and “Occupied City” refuse to let it live in the past.","In the British comedy “Extras,” Kate Winslet, who appears as a version of herself, is playing a nun in a film about the Holocaust. When commended for using her platform to bring attention to the atrocities, she replies callously, “I’m not doing it for that. I mean, I don’t think we really need another film about the Holocaust, do we?” She explains that she took the role because if you do a movie about the Holocaust, you’re “guaranteed an Oscar.”",2023-12-10T10:01:04+0000,article,Movies,News,Can the Holocaust Movie Be Revelatory Again? 3 Filmmakers Say Yes.,"Movies;Documentary Films and Programs;Holocaust and the Nazi Era;The Zone of Interest (Movie);Glazer, Jonathan;Origin (Movie);Caste: The Origins of Our Discontents (Book);DuVernay, Ava;Occupied City (Movie);Stigter, Bianca;McQueen, Steve (Filmmaker)"
29,"From the halls of Congress to America’s streets and universities, a once largely academic issue has roiled national discourse, inciting accusations of bigotry and countercharges of bullying.","The brutal shedding of Jewish blood on Oct. 7, followed by Israel’s relentless military assault on Gaza, has brought a fraught question to the fore in a moment of surging bigotry and domestic political gamesmanship: Is anti-Zionism by definition antisemitism?",2023-12-10T10:01:04+0000,article,U.S.,News,Is Anti-Zionism Always Antisemitic? A Fraught Question for the Moment.,Israel-Gaza War (2023- );Jews and Judaism;Zionism;Anti-Semitism;United States Politics and Government;audio-neutral-informative;Colleges and Universities
30,"Republicans have been attacking elite universities for years. After a tense congressional hearing last week, many on the left are joining them.","For years, conservatives have struggled to persuade American voters that the left-wing tilt of higher education is not only wrong but dangerous. Universities and their students, they’ve argued, have been increasingly clenched by suffocating ideologies — political correctness in one decade, overweening “social justice” in another, “woke-ism” most recently — that shouldn’t be dismissed as academic fads or harmless zeal.",2023-12-10T10:01:35+0000,article,U.S.,News,"As Fury Erupts Over Campus Antisemitism, Conservatives Seize the Moment","Israel-Gaza War (2023- );Colleges and Universities;Anti-Semitism;Discrimination;Censorship;Conspiracy Theories;Freedom of Speech and Expression;Race and Ethnicity;Conservatism (US Politics);Liberalism (US Politics);Democratic Party;Republican Party;Harvard University;University of Pennsylvania;Massachusetts Institute of Technology;Gay, Claudine;Kornbluth, Sally A;Magill, Elizabeth;Stefanik, Elise;Haley, Nikki R;DeSantis, Ron;United States"
31,"Earlier this year, mathematicians discovered a unique shape. Now do-it-yourselfers have found ingenious ways to put it to use.","It’s been a year of endless einsteins. In March, a troupe of mathematical tilers announced that they had discovered an “aperiodic monotile,” a shape that can tile an infinite flat surface in a pattern that does not repeat — “einstein” is the geometric term of art for this entity. David Smith, a shape hobbyist in England who made the original discovery and investigated it with three collaborators possessing mathematical and computational expertise, nicknamed it “the hat.” (The hat tiling allows for reflections: the hat-shaped tile and its mirror image.)",2023-12-10T10:02:17+0000,article,Science,News,What Can You Do With an Einstein?,Mathematics;Origami;London (England);your-feed-science
32,The race is on to put hotels in space and neighborhoods on the moon. Here’s some of what we know about how Earthlings fare beyond the safety of our home world.,"As an incubator of life, Earth has a lot going for it, something we often fail to appreciate fully from within its nurturing bounds. Merely sending probes and rovers to the moon and Mars won’t do. For various reasons — adventure! apocalypse! commerce! — we insist upon taking our corporeal selves off-world too. Multiple private companies have announced plans to put hotels in space soon. NASA is aiming to 3-D-print lunar neighborhoods within a couple of decades. And while it will probably take longer than that to build and populate an outpost on Mars, preparations are being made: This summer, four NASA crew members began a 378-day stay in simulated Martian housing at the Johnson Space Center in Houston. Here’s some of what we know about how Earthlings fare beyond the safety of our home world.",2023-12-10T11:00:02+0000,article,Podcasts,News,The Sunday Read: ‘The Bodily Indignities of the Space Life’,audio-neutral-informative;Titan (Saturn Moon);Mars (Planet);3-D Devices and Effects;Moon;National Aeronautics and Space Administration;Houston (Tex);Space and Astronomy
33,Help with housing costs eased the transition to a new home in Phoenix.,"Twenty-three years ago, Abwe Songolo made the fateful decision to keep moving. It was August of 2000, and he had spent hours sailing across Lake Tanganyika from his hometown in the Democratic Republic of Congo to the city of Kigoma in Tanzania, where he had to live on the streets. He had escaped the war engulfing Congo, but Tanzania still felt too close to home. “I wanted to go as far as possible from Congo because of what I’d experienced,” he said. “Because I would have flashbacks of it.”",2023-12-10T12:00:11+0000,article,Opinion,Editorial,A Refugee Finds Stability After Years of Flashbacks,Refugees and Displaced Persons;Philanthropy;International Rescue Committee;New York Times Communities Fund;Mozambique;United States
34,A behind-the-scenes guide to Cookie Week.,"Hi, everyone! I’m Vaughn, a supervising video producer for New York Times Cooking. And today, we’re talking all about cookies. Specifically, what separates the humdrum from the ho-ho-ho, the blasé from the trailblazing, the “just fine” from the “those were the best I’ve ever had.”",2023-12-10T12:44:37+0000,article,Briefing,briefing,Cookies for the Holidays,internal-storyline-no;Cookies;Holidays and Special Occasions;New York Times
35,"Look closely at this image, stripped of its caption, and join the moderated conversation about what you and other students see.","Note: We’ll publish our next image on Jan. 7 to discuss with live moderation on Monday, Jan. 8, 2024.",2023-12-10T13:00:02+0000,article,The Learning Network,News,"What’s Going On in This Picture? | Dec. 11, 2023",
36,"At the ceremony in Oslo, the Iranian activist’s twins also read a speech from their mother calling for a “globalization of peace and human rights.”","Iran’s most prominent human rights activist, Narges Mohammadi, was supposed to be handed the Nobel Peace Prize at a ceremony in Oslo on Sunday.",2023-12-10T13:12:07+0000,article,World,News,Children of Jailed Narges Mohammadi Accept Her Nobel Peace Prize,"Nobel Prizes;Mohammadi, Narges (1972- );Iran;Human Rights and Human Rights Violations;Demonstrations, Protests and Riots;PEN American Center;Political Prisoners;Women's Rights"
37,"Meatless menus used to be an oddity in Germany’s capital. Today, Berlin is bursting with creative vegan options, including Spanish tapas, Berliner-style doughnuts and even fast food.","When Tran Mai Huy Thong was growing up as a vegetarian in West Germany, his peers couldn’t comprehend his choice to not eat meat.",2023-12-10T13:17:41+0000,article,World,News,"Vegan Food, Once Tough to Find in Berlin, Is Now Flourishing",Berlin (Germany);Veganism;Germany;Food;Restaurants;Doughnuts;Vegetarianism
38,The proper response to censorship is not more censorship.,"As I watched the presidents of Harvard, M.I.T. and the University of Pennsylvania struggle last week to respond to harsh congressional questioning about the prevalence of antisemitism on their campuses, I had a singular thought: Censorship helped put these presidents in their predicament, and censorship will not help them escape.",2023-12-10T14:00:05+0000,article,Opinion,Op-Ed,What the University Presidents Got Right and Wrong About Antisemitic Speech,"Israel-Gaza War (2023- );Colleges and Universities;Censorship;Anti-Semitism;Freedom of Speech and Expression;First Amendment (US Constitution);Harvard University;University of Pennsylvania;Massachusetts Institute of Technology;Stefanik, Elise;Kornbluth, Sally A;Gay, Claudine;Magill, Elizabeth"
39,"Rachel Goldberg’s adult son is still being held hostage by Hamas. “I have no clue how I am able to function,” she says.","Rachel Goldberg’s 23-year-old son, Hersh, was abducted by Hamas at a music festival in southern Israel on Oct. 7. In this interview with the Opinion editor Sarah Wildman, Ms. Goldberg reflects on the past two months of the crisis, the recent pause in fighting and the brief moments of “delicious, thankful respite” she felt as hostages returned home — even as her son remains captive. And she argues the hostage plight should be treated as a humanitarian crisis, not a political one.",2023-12-10T14:00:11+0000,article,Opinion,Op-Ed,My Son Has Been Held Hostage by Hamas for 65 Days and Counting,"audio-neutral-informative;Israel;Gaza Strip;Hamas;Terrorism;Kidnapping and Hostages;Israel-Gaza War (2023- );Goldberg-Polin, Hersh"
