,abstract,lead_paragraph,pub_date,document_type,section_name,type_of_material,headline,keywords
76,Young adults are struggling to keep up their credit scores and paying an increasing amount of disposable income servicing their debts.,"Jade Canney didn’t expect to move back into her parents’ home after renting her own apartment for about a year, but the 22-year-old felt that she had no choice after “drowning” in debt that dragged down her credit score.",2023-09-27T13:00:07+0000,article,Business Day,News,Gen Z Is Poised to Spend More on Debt Than Others. It Could Derail Retirement.,Generation Z;Credit and Debt;Credit Scores;Personal Finances;Retirement;Youth;Interest Rates;Credit Cards;Student Loans;Fair Isaac Corporation;United States
77,"At a Los Angeles diner that became a haven for Hollywood writers during the strike, many say they’re eager to get back to work.","The Writers Guild of America, the union that represents more than 11,000 screenwriters, reached a tentative deal with entertainment companies Sunday night to resolve a lengthy strike that had consumed Hollywood and had helped kick off a summer of high-profile labor actions. The strike officially ended just after midnight last night.",2023-09-27T13:05:38+0000,article,U.S.,briefing,"With Deal Reached, Screenwriters Are Feeling Optimistic",California
78,His four years as the senior military adviser to two presidents spanned an unusually chaotic period.,"At midnight on Sept. 30, Gen. Mark A. Milley’s turbulent term as chairman of the Joint Chiefs of Staff will end.",2023-09-27T13:13:39+0000,article,U.S.,News,"Wars, Pandemic, Insurrection, U.F.O.s: Gen. Mark Milley’s Term Had It All","Content Type: Personal Profile;United States Defense and Military Forces;Presidential Election of 2020;Russian Invasion of Ukraine (2022);Coronavirus (2019-nCoV);Afghanistan War (2001- );Storming of the US Capitol (Jan, 2021);Appointments and Executive Changes;Defense Department;Joint Chiefs of Staff;Austin, Lloyd J III;Biden, Joseph R Jr;Milley, Mark A;AFGHANISTAN;Kabul (Afghanistan)"
79,"A go-ahead for a long-delayed $9.4 billion drilling project is expected to support the oil industry and provide energy security, but environmental advocates were outraged.","The British government on Wednesday gave a go-ahead to develop a large offshore oil field known as Rosebank, a move that is expected to provide a modest boost to the country’s oil and gas industry but prompted outrage from environmental groups.",2023-09-27T13:17:47+0000,article,Business Day,News,"Britain to Allow Big North Sea Oil Field, Despite Climate Concerns",Oil (Petroleum) and Gasoline;Environment;Global Warming;Offshore Drilling and Exploration;Equinor ASA;Friends of the Earth;Ithaca Energy Incorporated;Great Britain
80,"A nurse of nearly four decades and the wife of the retiring chairman of the Joint Chiefs of Staff, Mrs. Milley’s commitment to her work has paralleled that of Gen. Mark A. Milley during his dramatic tenure.","On an unseasonably warm night in February, dinner guests at Gen. Mark A. Milley’s Virginia home were wondering, a bit nervously, what could possibly be going on.",2023-09-27T13:30:11+0000,article,U.S.,News,Hollyanne Milley’s Career Presses On as Her Husband’s Wraps Up,"Milley, Mark A;United States Defense and Military Forces;Veterans;Appointments and Executive Changes;Nursing and Nurses;Content Type: Personal Profile;Joint Chiefs of Staff;AMERICAN RED CROSS"
81,,,2023-09-27T14:13:39+0000,multimedia,,,The Best Comforters,
82,Our new documentary explores the recent allegations that shook the legacy institution and questions whether the pageant has outlived its relevance.,"Watch our new documentary on FX and Hulu starting Friday, Sept. 29, at 10 p.m. Eastern.",2023-09-27T14:27:53+0000,article,The New York Times Presents,News,How Miss USA Was Crowned in Chaos,Beauty Contests;Contests and Prizes;Miss Universe Organization
83,"Now that the U.S. government has stepped back from issuing vaccines, long-term care operators have yet to start administering shots to protect one of the most vulnerable populations.","“Covid is not pretty in a nursing home,” said Deb Wityk, a 70-year-old retired massage therapist who lives in one called Spurgeon Manor, in rural Iowa. She has contracted the disease twice, and is eager to get the newly approved vaccine because she has chronic leukemia, which weakens her immune system.",2023-09-27T14:30:11+0000,article,Health,News,"As Covid Infections Rise, Nursing Homes Are Still Waiting for Vaccines",Disease Rates;Coronavirus (2019-nCoV);Nursing Homes;Vaccination and Immunization;Health Insurance and Managed Care;Medicare;Retirement Communities and Assisted Living;Centers for Disease Control and Prevention
84,"Breaking down Doja Cat’s surprising new album, “Scarlet,” plus: Swift’s foray into football and Hasan Minhaj’s fibs.","This week’s episode of Popcast (Deluxe), the weekly culture roundup show on YouTube hosted by Jon Caramanica and Joe Coscarelli, includes segments on:",2023-09-27T14:39:16+0000,article,Arts,News,Popcast (Deluxe): Doja Cat’s Rap Renaissance + Taylor Swift & Travis Kelce,"audio-neutral-informative;Swift, Taylor;Kelce, Travis;Minhaj, Hasan (1985- );Music"
85,"By “pizza chicken,” we mean skillet chicken with tomatoes, pancetta and mozzarella, and by “surefire weeknight winner,” we mean five stars and over 4,000 ratings.","Pizza chicken! Just the sound of it makes my mouth water. The actual recipe title is skillet chicken with tomatoes, pancetta and mozzarella, but that lacks the lilting pizazz of “pizza chicken,” which is what my family calls this weeknight favorite.",2023-09-27T15:00:08+0000,article,Food,Letter,Pizza Chicken Is a Surefire Weeknight Winner,Cooking and Cookbooks;Content Type: Service
86,"Consider it good news, physicists say: “The opposite result would have had big implications.”",Antimatter just lost a little more pizazz.,2023-09-27T15:00:11+0000,article,Science,News,"Nothing’s the Matter With Antimatter, New Experiment Confirms",Physics;Gravitation and Gravity;CERN;Nature (Journal)
87,This overlooked concept has been linked to better relationships — with oneself and others.,"Gordon Flett came across the term “mattering” as a psychology graduate student. Sitting at his desk in 1987, poring over a textbook, “I immediately knew what mattering was,” he said.",2023-09-27T15:08:40+0000,article,Well,News,Want to Believe in Yourself? ‘Mattering’ Is Key.,Content Type: Service;Psychology and Psychologists;Mental Health and Disorders
88,"The term may be popular in an age of blurring lines between platforms, but the Hollywood strikes have shown how the phrase can devalue creative work.","Over the past couple of years, I’ve spent a disproportionate amount of time thinking about a scene from the 1986 Rodney Dangerfield vehicle “Back to School.” He stars as Thornton Melon, a self-made millionaire entrepreneur who, per the title, returns to finish his university education alongside his freshman son. On the first day of his intro to business course, Professor Philip Barbay (Paxton Whitehead) explains that they’ll spend the semester creating and running a fictional manufacturing company. “What’s the product?” asks the pragmatic Melon, who won’t let the point drop.",2023-09-27T15:30:39+0000,article,Movies,News,Emma Thompson Is Right: The Word ‘Content’ Is Rude,"Television;Movies;Thompson, Emma;Language and Languages"
89,"White House and Wall Street estimates suggested the economy could withstand a brief shutdown, with risks mounting the longer it lasts.",Follow our live updates for a potential government shutdown.,2023-09-27T15:32:42+0000,article,U.S.,News,U.S. Government Shutdown Is Unlikely to Cause an Immediate Recession,Shutdowns (Institutional);United States Economy;United States Politics and Government;Recession and Depression;Government Bonds;Strikes;Organized Labor;Consumer Confidence (Economic Indicator);Gross Domestic Product;Inflation (Economics);Government Employees
90,"As part of its push to stage more contemporary works, the company has turned to one of the most widely produced operas of the 21st century.","“Dead Man Walking,” which opened the Metropolitan Opera’s season on Tuesday, is about a man trying to put off his execution. And with this show, the Met is doing its best to avoid a fatal moment of its own.",2023-09-27T15:37:20+0000,article,Arts,Review,Review: ‘Dead Man Walking’ Opens a Met Season Heavy on the New,"Opera;Metropolitan Opera;DiDonato, Joyce;Graham, Susan;Heggie, Jake;McKinny, Ryan;Nezet-Seguin, Yannick;McNally, Terrence;Prejean, Helen;van Hove, Ivo;Dead Man Walking (Opera)"
91,"Israel’s tourism minister went to Saudi Arabia, and a Saudi envoy toured the Israeli-occupied West Bank. The trips reflected how the two countries are moving toward normalizing their relationship.",Parallel visits this week by an Israeli minister to Saudi Arabia and a Saudi envoy to the Israeli-occupied West Bank have highlighted the fast-warming ties between the Jewish state and the most powerful Arab country.,2023-09-27T15:39:20+0000,article,World,News,"Once Inconceivable, Officials’ Visits Highlight Warming Saudi-Israeli Ties",Israel;Saudi Arabia;International Relations;Politics and Government;Palestinians;Palestinian Authority;West Bank;United States International Relations
92,"Almost everyone agrees on the need for changes, but there is little agreement on what to do and nearly insuperable hurdles to doing anything.","For more than a week, world leaders gathered at the United Nations General Assembly to debate the world’s most pressing problems: war in Ukraine, poverty, a warming planet and pandemics.",2023-09-27T15:45:38+0000,article,World,News,"The World Has Changed, but Can the U.N.? Don’t Hold Your Breath.","International Relations;Russian Invasion of Ukraine (2022);Developing Countries;Human Rights and Human Rights Violations;Guterres, Antonio;Security Council (UN);United Nations"
93,"In the ending of the FX comedy-drama, preserving the bonds among generations is a radical, magical act.","Where do you find enlightenment? In a meditation room? On a solitary mountaintop? The series finale of “Reservation Dogs,” FX’s astonishing series about Native teens and elders in rural Oklahoma, dispenses a great truth of life from a prison vending machine.",2023-09-27T16:00:10+0000,article,Arts,News,‘Reservation Dogs’ Was a Coming-of-All-Ages Masterpiece,"Television;Reservation Dogs (TV Program);FX (TV Network);Harjo, Sterlin;Waititi, Taika;Alexis, Paulina (2001- );Woon-A-Tai, D'Pharaoh;Jacobs, Devery;Factor, Lane"
94,A state judge in Montana was the latest to weigh in on whether laws restricting transition care for minors infringed on fundamental rights.,"A state judge in Montana on Wednesday temporarily blocked a law that would have banned transition care for children under 18 starting on Sunday, while a lawsuit filed by patients and medical professionals proceeds.",2023-09-27T16:02:52+0000,article,U.S.,News,Montana’s Ban on Transition Care for Minors Is Blocked,"Transgender;Montana;Zephyr, Zooey;Law and Legislation;Decisions and Verdicts;Suits and Litigation (Civil)"
95,"Shawn Fain, the president of the United Automobile Workers union, said he was opposed to meeting the former president during his visit to Michigan on Wednesday.","The leader of the United Automobile Workers union ruled out meeting former President Donald J. Trump, the 2024 Republican front-runner, when he visits Michigan on Wednesday, casting him as an out-of-touch billionaire who has been hostile toward the industry’s workers, who are currently on strike.",2023-09-27T16:17:38+0000,article,U.S.,News,U.A.W. Leader Says He Sees ‘No Point’ in Meeting With Trump,"Fain, Shawn;Trump, Donald J;United Automobile Workers;Organized Labor;Presidential Election of 2024;Strikes;Labor and Jobs"
96,Test your knowledge of the Republican presidential primary.,Test your knowledge of the Republican presidential primary.,2023-09-27T16:17:51+0000,multimedia,U.S.,Interactive Feature,The G.O.P. Debate Is Tonight. How Much Do You Know About the Race?,Presidential Election of 2024;Debates (Political);Content Type: Quiz
97,Reaction to a finding that he had inflated his assets’ value. Also: Reducing gun violence; Kevin McCarthy; financing the arts; Russian performers; Chinese truth tellers.,To the Editor:,2023-09-27T16:30:10+0000,article,Opinion,Letter,The Fraud Ruling Against Trump,"Trump, Donald J;Engoron, Arthur F;Decisions and Verdicts;Frauds and Swindling;Presidential Election of 2024;United States Politics and Government;McCarthy, Kevin (1965- );Jeffries, Hakeem;Biden, Joseph R Jr;Gun Control;Firearms;New York State Criminal Case Against Trump (71543-23);Culture (Arts);Netrebko, Anna;Russian Invasion of Ukraine (2022);China"
98,"Stephen Colbert, Jimmy Fallon, Jimmy Kimmel and Seth Meyers said their shows will return on Monday after a five-month hiatus.","After a five-month hiatus, most late night shows will return with new episodes next week now that the 148-day screenwriters’ strike has been resolved, the hosts announced on social media on Wednesday morning.",2023-09-27T16:31:58+0000,article,Business Day,News,"With Strike Over, Late Night Shows Will Return Next Week",Television;Strikes;Organized Labor;Writing and Writers;Writers Guild of America
99,"Analysts have raised their forecasts for oil prices, as they try to understand Saudi Arabia’s intentions with recent production cuts.","Many energy analysts think that oil prices will soon rise above $100 a barrel for the first time in more than a year, since the turmoil that followed Russia’s invasion of Ukraine. The price of Brent crude, the international benchmark, has gained about 30 percent since the start of July, trading at about $96.50 a barrel on Wednesday.",2023-09-27T16:50:53+0000,article,Business Day,News,Oil Prices ‘Melt Up’ in a March Toward $100 a Barrel,"Oil (Petroleum) and Gasoline;Prices (Fares, Fees and Rates);Saudi Arabia;Inflation (Economics);Organization of the Petroleum Exporting Countries;Abdulaziz bin Salman, Prince of Saudi Arabia"
100,"A statement on the musician’s social media said he is continuing to recover from peptic ulcer disease, and will resume shows in 2024.","Bruce Springsteen has postponed the remaining dates of his tour this year with the E Street Band while he continues to recover from peptic ulcer disease, a few weeks after he postponed eight shows for the same reason.",2023-09-27T16:56:12+0000,article,Arts,News,Bruce Springsteen Postpones Remaining 2023 Tour Dates,"Pop and Rock Music;E Street Band;Springsteen, Bruce"
101,The new $500 headset lets people see the outside world while immersed in virtual reality. The benefits are to be determined.,"Last week, I spent several hours trying Meta’s latest goggles, the Quest 3. They ship next month. The headset runs virtual reality games with a novel twist: While shooting a blaster gun, snatching bats from midair and controlling a robot, I could see the real world through built-in cameras.",2023-09-27T17:03:10+0000,article,Technology,News,"With Meta’s Quest 3, Mixed Reality Is Here. So Now What?",Virtual Reality (Computers);Headphones and Headsets;Computers and the Internet;Cameras;Meta Platforms Inc
102,"Divorce, death, a big move, illness: Food may not fix anything, but a lovingly prepared meal can bring some much-needed comfort and nourishment.","When your world feels like it’s falling to pieces — and just dragging yourself out of bed and into the kitchen to shove a few Oreos into your mouth can feel like a herculean task — shopping for and cooking something can feel downright impossible. If your friend or family member is going through a terrible ordeal, making something delicious and delivering it to their door with a sweet little note may not scare away the monsters, but it can provide sustenance for the hard (and hopefully healing) days ahead. These are the dishes New York Times Cooking editors, writers and more like to make for their loved ones.",2023-09-27T17:32:50+0000,article,Food,News,16 Dishes to Make for Someone Going Through a Hard Time,Recipes;Cooking and Cookbooks
103,"If the government shuts down, air traffic controllers and Transportation Security Administration officers will continue to work, but they will not be paid until the shutdown is over.",Follow our live updates for a potential government shutdown.,2023-09-27T17:51:47+0000,article,U.S.,News,Biden Administration Warns That Government Shutdown Could Disrupt Air Travel,"AIRLINES AND AIRPLANES;AIR TRAFFIC CONTROL;Airport Security;Buttigieg, Pete (1982- );Federal Aviation Administration;Transportation Security Administration;Transportation Department (US);Shortages;Delays (Transportation);House of Representatives;Republican Party;United States Politics and Government"
104,"Gov. Greg Abbott of Texas, a Republican, has sent buses of migrants to New York. In a Manhattan speech, he said the city’s situation seemed orderly compared with his own state.","Gov. Greg Abbott of Texas, who for the last year has bused migrants from his home state to New York City, used an appearance in Manhattan on Wednesday to voice what have become familiar complaints about the effect of the Biden administration’s immigration policy on the southern border.",2023-09-27T17:57:12+0000,article,New York,News,"N.Y. Migrant Crisis Is ‘Calm’ Compared With Ours, Texas Governor Says","Immigration and Emigration;Refugees and Displaced Persons;Abbott, Gregory W (1957- );Adams, Eric L;New York City;Texas;United States Politics and Government"
105,"The climate establishment is declaring war on fossil fuels, demanding we keep them in the ground.","On the same day this month that the head of the International Energy Agency confidently declared that fossil fuel demand would peak this decade, the climate advocacy group Oil Change International found that the United States would be responsible for over one-third of all planned fossil fuel expansion through 2050. The following week, as President Biden emphatically called climate change an “existential threat” and announced the creation of a climate conservation corps, the United States broke a record for oil production.",2023-09-27T18:00:03+0000,article,Opinion,Op-Ed,How Long Can America’s Climate Hypocrisy Last?,internal-sub-only-nl;Greenhouse Gas Emissions;Global Warming;Oil (Petroleum) and Gasoline;Natural Gas;Alternative and Renewable Energy;Coal
106,The raids were the second such action in about a week and came about 10 months after the authorities foiled what they described as a far-right plot to topple the government.,"The authorities in Germany on Wednesday banned a relatively small far-right group and raided the homes of its members in a coordinated sweep, the latest in a series of moves against extremist organizations in the country.",2023-09-27T18:02:32+0000,article,World,News,Germany Cracks Down on Another Far-Right Group,"Fringe Groups and Movements;Neo Nazi Groups;Right-Wing Extremism and Alt-Right;Anti-Semitism;Race and Ethnicity;Faeser, Nancy;Germany"
107,"Meta introduced artificially intelligent characters based on Jane Austen, Snoop Dogg and others into Instagram, Facebook and WhatsApp, as the race to lead the technology heats up.","In a WhatsApp text conversation this week, we asked Jane Austen — yes, the 19th-century British author — how she felt about Mr. Darcy, a character from one of her most famous works, “Pride and Prejudice.”",2023-09-27T18:07:20+0000,article,Technology,News,Meet the A.I. Jane Austen: Meta Weaves A.I. Throughout Its Apps,"Meta Platforms Inc;Artificial Intelligence;Instant Messaging;Search Engines;Social Media;Computers and the Internet;ChatGPT;Software;Rumors and Misinformation;Mobile Applications;Advertising and Marketing;Character.AI;Facebook Inc;Instagram Inc;OpenAI Labs;Snap Inc;WhatsApp Inc;Austen, Jane;Zuckerberg, Mark E"
108,"Instagram, Facebook, Snapchat and several newcomers are betting on artificial intelligence to rejuvenate the fun, interactivity and whimsy of creating and sharing images.","Myuri Thiruna, a freelance photographer in Toronto, used to post frequently on Instagram and discuss photography with other users. But she said she had stopped two years ago, feeling “drained” by the demands of social media and the pursuit of followers and trends.",2023-09-27T18:09:15+0000,article,Technology,News,"To Bring Socializing Back to Social Networks, Apps Try A.I. Imagery",Mobile Applications;Artificial Intelligence;Social Media;Computers and the Internet;Photography;Creativity;Start-ups;Facebook Inc;Instagram Inc;Snap Inc;TikTok (ByteDance)
109,"The image-recognition feature could have many uses, and the voice feature is even more intriguing.","ChatGPT — viral artificial intelligence sensation, slayer of boring office work, sworn enemy of high school teachers and Hollywood screenwriters alike — is getting some new powers.",2023-09-27T18:09:35+0000,article,Technology,News,The New ChatGPT Can ‘See’ and ‘Talk.’ Here’s What It’s Like.,Artificial Intelligence;ChatGPT;Computer Vision;Voice and Speech;Mobile Applications;OpenAI Labs
110,"A day after President Biden appeared on a union picket line, the former president spoke at an auto parts factory in Michigan.","Seeking more of the voters who paved his way to the White House in 2016, former President Donald J. Trump rallied at a Michigan auto parts factory on Wednesday night, vying for the support of blue-collar workers one day after President Biden appeared on a picket line with striking United Automobile Workers.",2023-09-27T18:28:04+0000,article,U.S.,News,Trump Tries to Court Blue-Collar Workers at a Nonunion Factory,"Trump, Donald J;Presidential Election of 2024;Organized Labor;Strikes;Fain, Shawn;United Automobile Workers;Biden, Joseph R Jr;Debates (Political)"
111,"With the number of asylum seekers rising, along with support for the far right, the government has come under increasing pressure to act.","The German government on Wednesday announced that it was strengthening controls along its border with Poland and the Czech Republic, responding to increasing political pressure to deal with the rising number of people it said are crossing illicitly into the country’s east.",2023-09-27T18:48:39+0000,article,World,News,Germany Puts in Place Tougher Checks to Control Migration,"Asylum, Right of;Illegal Immigration;International Relations;Politics and Government;Smuggling;Right-Wing Extremism and Alt-Right;Immigration and Emigration;Refugees and Displaced Persons;Alternative for Germany;Free Democratic Party (Germany);Social Democratic Party (Germany);Europe;Germany"
112,The pressure felt in one Texas city reflects an increasingly untenable situation all along the border with Mexico.,"The city of El Paso, a West Texas way station long accustomed to migrants arriving from Mexico, has begun to buckle under the pressure of thousands upon thousands of people coming over the border, day after day.",2023-09-27T18:57:37+0000,article,U.S.,News,"In El Paso, Migrants With Nowhere to Go Strain a Welcoming City",Illegal Immigration;Border Patrol (US);El Paso (Tex);Texas;Refugees and Displaced Persons
113,The judge overseeing the case said there would be no fast answers about the fate of the Trump Organization and its nearly dozen New York properties.,Trump Tower on Fifth Avenue. The 72-story office building in the heart of the financial district. The Trump International Hotel overlooking Central Park.,2023-09-27T18:59:58+0000,article,New York,News,Will a Judge’s Fraud Ruling Dismantle Trump’s New York Empire?,"New York State Civil Case Against Trump (452564/2022);Trump Organization;Frauds and Swindling;Real Estate (Commercial);Appraisals and Valuation (Property);Engoron, Arthur F;James, Letitia;Trump, Donald J;Trump, Donald J Jr;Trump, Eric F (1984- );Attorneys General;Decisions and Verdicts;New York State"
114,Youth has seemingly become the phase of life when mental health suffers most.,"Sian Leah Beilock was playing goalkeeper for an elite soccer team in California, part of the Olympic development program, when she became aware that one of the national coaches was standing behind the net, scrutinizing her performance. Soon after, she let a ball get by her into the net. Her team lost. “I choked under the pressure of those evaluative eyes on me,” she recounted in a TEDMed talk in 2017.",2023-09-27T19:00:03+0000,article,Opinion,Op-Ed,People in Their 20s Aren’t Supposed to Be This Unhappy,internal-sub-only-nl;Mental Health and Disorders;Depression (Mental);Anxiety and Stress;Centers for Disease Control and Prevention;Dartmouth College;Social Media;Smartphones;Unemployment
115,"Bucking the rules, and the canon, Jacolby Satterwhite remakes the Met’s Great Hall with his multimedia “A Metta Prayer.” It draws on Titian and video games.","From the soaring Beaux-Arts architecture to the pristine flower arrangements, the Great Hall of the Metropolitan Museum of Art can be a humbling, even intimidating entry point for visitors.",2023-09-27T19:07:54+0000,article,Arts,News,"With a Love Poem and Acid Beat, a Grand Space Feels the Heat","Art;Museums;Dancing;Computer and Video Games;Geffen, David, Hall (Manhattan, NY);Metropolitan Museum of Art;Adams, Derrick (Artist);Satterwhite, Jacolby"
