,abstract,lead_paragraph,pub_date,document_type,section_name,type_of_material,headline,keywords
46,The act of working needs to become more affordable and accessible.,"The economy is growing. Wages are up. Unemployment is low. Income inequality is narrowing. The fearmongering about inflation proved to be, well, wrong. According to many economy watchers, Americans should be sending the Biden administration a gift basket full of positive vibes — and votes.",2023-12-11T10:03:25+0000,article,Opinion,Op-Ed,This Economy Has Bigger Problems Than ‘Bad Vibes’,"Polls and Public Opinion;United States Economy;Income Inequality;Child Care;Poverty;Labor and Jobs;American Rescue Plan (2021);Presidential Election of 2024;Biden, Joseph R Jr;United States;Consumer Behavior"
47,"Outside the negotiating rooms, COP28 is part trade fair, part lobbyist jamboree and part debate tournament.","There are two climate summits taking place in Dubai. One is the gathering of bleary-eyed, sharp-tongued diplomats parsing over every word and comma in the international declaration that is expected in the coming days.",2023-12-11T10:03:26+0000,article,Climate,News,"The Climate Summit Scene: 70,000 People and a Nightly Light Show","Global Warming;Greenhouse Gas Emissions;United Nations Framework Convention on Climate Change;Conventions, Fairs and Trade Shows;United Nations;Dubai (United Arab Emirates)"
48,"Bernardo Arévalo, the most progressive leader to get this far in decades, faces a barrage of legal attacks aimed at preventing an orderly transfer of power.","When the anticorruption crusader Bernardo Arévalo won a landslide victory in Guatemala’s presidential race, voters streamed into the capital of Central America’s most populous country to celebrate. But as Mr. Arévalo’s foes intensify efforts to bar the president-elect from taking office just weeks from now, the mood on the streets has changed.",2023-12-11T10:03:26+0000,article,World,News,Guatemala’s Antigraft Crusader Won in a Landslide. Will He Actually Take Office?,"Guatemala;Arevalo, Bernardo (1958- );Corruption (Institutional);Demonstrations, Protests and Riots;Politics and Government;Giammattei, Alejandro;Curruchiche, Rafael"
49,Even in Washington.,"Gail Collins: Hey, Bret, would you hate it if I asked for a couple of predictions for 2024?",2023-12-11T10:03:38+0000,article,Opinion,Op-Ed,There’s a Limit to How Much Weaseling Around You Can Do,"Presidential Election of 2024;Trump, Donald J;Biden, Joseph R Jr;Colleges and Universities;Freedom of Speech and Expression;Anti-Semitism;Israel-Gaza War (2023- );Gay, Claudine;Magill, Elizabeth;Stefanik, Elise;Kornbluth, Sally A;Biden, Hunter;Tax Evasion;United States Politics and Government;Democratic Party;Republican Party"
50,"Argentina’s new leader, Javier Milei, is a right-wing populist with a radical economic plan.",Warning: this episode contains strong language.,2023-12-11T11:00:08+0000,article,Podcasts,News,Can an ‘Anarcho-Capitalist’ President Save Argentina’s Economy?,"Politics and Government;United States Economy;New York State Criminal Case Against Trump (71543-23);Appointments and Executive Changes;Economic Conditions and Trends;Presidential Election of 2024;Conspiracy Theories;Elections;Milei, Javier;Trump, Donald J;ARGENTINA"
51,Hear the news in five minutes.,"The New York Times Audio app is home to journalism and storytelling, and provides news, depth and serendipity. If you haven’t already, download it here — available to Times news subscribers on iOS — and sign up for our weekly newsletter.",2023-12-11T11:10:10+0000,article,Podcasts,News,"Gazans Mass at Border, and Pressure Rises on Harvard’s President",Colleges and Universities;Deaths (Fatalities);Mass Shootings;Harvard University;Maine
52,What’s behind America’s unique problem with vehicle crashes?,"For most of the automobile’s first century of existence, it became safer.",2023-12-11T11:27:31+0000,article,Briefing,briefing,The Rise in U.S. Traffic Deaths,internal-storyline-no;Deaths (Fatalities);Traffic Accidents and Safety;United States;Driver Distraction and Fatigue;Sidewalks;Marijuana;Sun Belt States (US)
53,The outages have raised widespread concerns in a country already grappling with discontent over a worsening economic situation.,"Kenya’s government said on Monday that it was gradually restoring power after the country’s third major blackout in four months, adding to rising discontent with President William Ruto over a worsening economic situation and his policies since taking office 15 months ago.",2023-12-11T11:47:12+0000,article,World,News,Kenya Suffers Third Major Power Blackout in Four Months,"Kenya;Nairobi (Kenya);Ruto, William;Power Failures and Blackouts;Jomo Kenyatta International Airport"
54,"Are you in need of another Christmas tradition, and a bit of fun? Enter: “Whamageddon.”","Listening to Christmas music can bring people together. Not listening to a particular Christmas song, it turns out, can have the same effect.",2023-12-11T11:51:03+0000,article,Arts,News,"This Christmas, ‘Whamageddon’ Will Save You From Tears",Christmas;Wham! (Music Group)
55,The Russian opposition leader had been scheduled to appear before a district court via a video link on Monday. His spokeswoman said his allies had not heard from him for more than five days.,"Aleksei A. Navalny, Russia’s most prominent opposition leader, who is currently serving a 19-year sentence in a Russian penal colony, missed another court date on Monday as his allies expressed concern at not having heard from him for more than five days.",2023-12-11T11:55:04+0000,article,World,News,"Navalny Misses Court Date, Raising Alarm Among His Supporters","Prisons and Prisoners;Navalny, Aleksei A;Russia;Political Prisoners"
56,The Ukrainian leader will be appealing for more military support from the United States as an emboldened Russia steps up its attacks on his country.,"As President Volodymyr Zelensky of Ukraine heads to Washington on an urgent mission to rally flagging Western support for his nation, the Russian military on Monday targeted the Ukrainian capital with the most intense salvo of ballistic missiles in months.",2023-12-11T12:13:22+0000,article,World,News,"As Zelensky Heads to Washington, Russia Targets Kyiv With Missiles","United States International Relations;International Relations;Defense and Military Forces;Russian Invasion of Ukraine (2022);Putin, Vladimir V;Zelenska, Olena;Zelensky, Volodymyr;Biden, Joseph R Jr;Ukraine;United States"
57,Mr. Trump has a commanding lead over his rivals five weeks before the first-in-the-nation caucuses.,"Multiple Republicans have ended their presidential campaigns over the past two months, narrowing the field against former President Donald J. Trump — but the only person who has gained much ground in the first voting state is Mr. Trump, according to a new poll.",2023-12-11T12:25:20+0000,article,U.S.,News,"Trump Gains in Iowa Poll, and DeSantis Holds Off Haley for a Distant Second","Polls and Public Opinion;Presidential Election of 2024;United States Politics and Government;Des Moines Register;DeSantis, Ron;Haley, Nikki R;Trump, Donald J;Christie, Christopher J;Ramaswamy, Vivek (1985- );Iowa"
58,"“Barbie” led the nominations with nine, followed by “Oppenheimer” with eight. In the television categories, “Succession” had the most with nine.","To many, the Golden Globe Awards are a perfect example of Hollywood’s two faces.",2023-12-11T12:30:07+0000,article,Movies,News,Golden Globes 2024 Nominations: ‘Barbie’ and ‘Oppenheimer’ in Front,Golden Globes (Awards);Movies;Television
59,The prime minister testified at an official inquiry into the Covid pandemic on Monday while also defending a flagship immigration policy from rebels in his own party.,"Prime Minister Rishi Sunak of Britain embarked on one of the most politically fraught weeks of his tenure on Monday, facing a mutiny against his flagship immigration policy while testifying before an official inquiry into the coronavirus pandemic about whether he had contributed to driving up infections.",2023-12-11T12:35:36+0000,article,World,News,Why Sunak Faces One of His Toughest Weeks as U.K. Leader,"Coronavirus (2019-nCoV);Politics and Government;Immigration and Emigration;Illegal Immigration;Fringe Groups and Movements;Conservative Party (Great Britain);Sunak, Rishi (1980- );Great Britain"
60,"In the wake of a controversy at the University of Pennsylvania and Harvard over antisemitism, a debate has arisen over whether academics are best suited to lead big schools.","After weeks of criticism from alumni, donors and public officials — and disastrous testimony on Capitol Hill — Liz Magill stepped down as the University of Pennsylvania’s president on Saturday over her stance on combating antisemitism. Meanwhile, the heads of Harvard and M.I.T. remain under pressure, with some of their fiercest critics continuing to call for them to resign, too.",2023-12-11T12:38:21+0000,article,Business Day,News,Who Should Run Universities?,"internal-storyline-no;Colleges and Universities;University of Pennsylvania;Harvard University;Magill, Elizabeth;Gay, Claudine;Anti-Semitism"
61,"The progressive publication will move to the new schedule in January, and each issue will be 84 pages instead of 48.","The Nation, the progressive magazine that has published since 1865, will publish monthly instead of every other week starting in January.",2023-12-11T13:00:08+0000,article,Business Day,News,The Nation Magazine to Become Monthly,"Advertising and Marketing;Magazines;Nation, The (Magazine);Guttenplan, D D;Sunkara, Bhaskar;Vanden Heuvel, Katrina"
62,A global update from the leading authority on the status of species shows that climate change is compounding other threats to plants and animals.,"A quarter of the world’s freshwater fish are at risk of extinction, according to the first comprehensive assessment of the animals by the world’s leading scientific authority on the status of species.",2023-12-11T13:00:17+0000,article,Climate,News,"A Quarter of Freshwater Fish Are at Risk of Extinction, a New Assessment Finds",International Union for Conservation of Nature;Endangered and Extinct Species;Fish and Other Marine Life;Biodiversity;Global Warming;Greenhouse Gas Emissions;Water Pollution;United Nations Convention on Biological Diversity;Dubai (United Arab Emirates)
63,Toasted spices and ground peanuts turn a pantry staple into the base of a plush panang curry.,"A jar or can of Thai curry paste is a pungent gateway to so many excellent weeknight meals. Mixed with coconut milk and simmered with vegetables, tofu or meat, it’s one of those ebullient pantry hacks that breathes extra life into any ingredient it touches.",2023-12-11T13:04:15+0000,article,Food,Letter,This Easy Dish Takes a Can of Curry Paste and Runs With It,Cooking and Cookbooks;Content Type: Service
64,"In 2023, 90 puzzle makers will have their first New York Times Crossword published.","As the end of the year approaches, it’s fun to look back at our debut puzzle makers. We’re scheduled to publish 90 new constructors by the end of the year, which is nearly a record.",2023-12-11T14:00:02+0000,article,Crosswords & Games,News,2023’s Crossword Constructor Debuts,Crossword Puzzles;Scholarships and Fellowships
65,"A conversation with Judson Jones, a New York Times meteorologist and reporter, about the state’s “pretty astonishing” precipitation throughout 2023.","It’s Monday. We talk to Judson Jones, a New York Times meteorologist, about California’s “pretty astonishing” precipitation throughout 2023. Plus, in Los Angeles, the “coroner to the stars” has the last word. ",2023-12-11T14:00:13+0000,article,U.S.,briefing,Unpacking California’s Wild Weather Year,California;Weather
66,"Some people are using artificial intelligence chatbots to create avatars of departed loved ones. It’s a source of comfort for some, but it makes others a little squeamish.","Dr. Stephenie Lucas Oney is 75, but she still turns to her father for advice. How did he deal with racism, she wonders. How did he succeed when the odds were stacked against him?",2023-12-11T14:03:51+0000,article,Technology,News,Using A.I. to Talk to the Dead,"Artificial Intelligence;Death and Dying;Voice and Speech;Grief (Emotion);Asner, Ed;HereAfter AI;StoryFile Inc"
67,"The move is aimed at drawing $9 billion in corporate investment, as New York jockeys to host a new national semiconductor technology center.","Gov. Kathy Hochul of New York announced on Monday a plan to invest $1 billion to expand chip research activities in Albany, N.Y., as the state aims to continue as a global semiconductor center.",2023-12-11T14:33:36+0000,article,Technology,News,New York Plans to Invest $1 Billion to Expand Chip Research,"Computer Chips;Research;Factories and Manufacturing;States (US);Computers and the Internet;ASML Holding NV;International Business Machines Corporation;State University of New York at Albany;Hochul, Kathleen C;Albany (NY)"
68,"A new study on tirzepatide, the compound in Mounjaro and Zepbound, gives an early indication.","Zepbound, the newly approved weight loss drug, hit the market this month. People seeking out the medication may have to stay on it for the foreseeable future — potentially, for the rest of their lives — if they want to keep the weight off, new research confirms.",2023-12-11T15:00:08+0000,article,Well,News,How Much Weight Comes Back After You Stop Using a Weight-Loss Drug?,Research;Obesity;Diabetes;Semaglutide (Drug);Diet and Nutrition;Weight
69,A family in a small town in New York holds a world record for having the most lights on a residential property to the dismay of some neighbors and the delight of others.,"On a winding country road, four miles from the nearest traffic light in rural Dutchess County, N.Y., the holiday lights appear like a carnival fun house shattering the darkness.",2023-12-11T15:00:19+0000,article,Real Estate,News,‘Are You Going to Be the One to Get Rid of Santa?’,Union Vale (NY);Christmas;Lighting;Records and Achievements;Philanthropy;Real Estate and Housing (Residential);Content Type: Personal Profile;Guinness World Records;internal-sub-only;internal-great-read;audio-neutral-immersive
70,"Members of Airman Jack Teixeira’s unit failed to take proper action after becoming aware of his intelligence-seeking activities, an inspector general inquiry found.","The Air Force has disciplined 15 military personnel for dereliction of duties after an inquiry into Jack Teixeira, an Air National Guardsman who was accused this year of posting classified documents online.",2023-12-11T15:00:48+0000,article,U.S.,News,Air Force Disciplines Personnel After Teixeira Investigation,"United States Air Force;Inspectors General;Ethics and Official Misconduct;US Intelligence Documents Leak (2023);Teixeira, Jack;United States Politics and Government"
71,"The European Union and Sweden have called for the immediate release of Johan Floderus, who has been detained in Tehran for about 600 days.","Iran has put a European Union official from Sweden on trial for allegations that include spying for Israel and a charge that could carry the death penalty, according to Iranian state media, prompting renewed calls for his release.",2023-12-11T15:17:56+0000,article,World,News,Iran Puts E.U. Official From Sweden on Trial,"International Relations;Kidnapping and Hostages;European Union;Floderus, Johan;Iran;Sweden;Europe"
72,"Despite being bumped down the presidential calendar, Democrats in the state are planning a write-in campaign for the president, who won’t be on New Hampshire primary ballots.","New Hampshire Democrats were furious at President Biden when he shook up the party’s nominating calendar last year, diminishing their state’s political importance by pushing its primary election behind South Carolina’s.",2023-12-11T15:22:33+0000,article,U.S.,News,"Still Annoyed at Biden, New Hampshire Democrats Gear Up to Help Him","Biden, Joseph R Jr;New Hampshire;Presidential Election of 2024;Primaries and Caucuses;Democratic Party;Democratic National Committee;United States Politics and Government;Phillips, Dean B;Williamson, Marianne"
73,"Parliament shot down a new government proposed by the caretaker prime minister, Mateusz Morawiecki, whose party, Law and Justice, lost its parliamentary majority in an October election.",Poland’s newly elected Parliament torpedoed a long-shot effort by right-wing forces to stay in power and chose the opposition leader Donald Tusk as the nation’s new prime minister on Monday. The decision ushers the biggest and most populous country on the European Union’s formerly communist eastern flank into a new era.,2023-12-11T15:26:09+0000,article,World,News,Donald Tusk Chosen as Poland’s Prime Minister After Rival Is Rejected,"Politics and Government;Appointments and Executive Changes;Elections;Law and Justice (Poland);Civic Coalition (Poland);Duda, Andrzej (1972- );Tusk, Donald;Poland"
74,"“Born in Synanon” and “Love Has Won: The Cult of Mother God” join a crowded field of cult documentaries, but diverge from the usual template.","One week it’s a pair of online matchmaking hucksters, the next, a group of zonked-out seekers waiting for the spaceships to arrive. There are sex cults (“The Vow”), and doomsday cults (“Waco: American Apocalypse”), and cults that seem to exist for no obvious reason other than being cults. Turn on a TV or fire up a streaming service and you will encounter a docu-series about a group of desperate people rallying around a charismatic and often deranged leader.",2023-12-11T15:31:40+0000,article,Arts,News,"Synanon and Love Has Won, Two Cults With New Docs","Television;Paramount Plus;Home Box Office;Carlson, Amy (Lia) (1975- 2021);Gandbhir, Geeta;Olson, Hannah;Dederich, Charles E;Born in Synanon (TV Program);Love Has Won: The Cult of Mother God (TV Program)"
75,Try this short literary geography quiz that tests your knowledge of books with college connections.,Try this short literary geography quiz that tests your knowledge of books with college connections.,2023-12-11T16:00:33+0000,multimedia,Books,Interactive Feature,Do You Know These Novels With Academic Settings?,Books and Literature;Colleges and Universities
76,"Pediatricians are hesitating to prescribe medicines like Wegovy, citing their newness and uncertainties around them.","Dr. Edward Lewis, a pediatrician in Rochester, N.Y., has seen hundreds of children with obesity over the years in his medical practice. He finally may have a treatment for their medical condition — the powerful weight loss drug Wegovy.",2023-12-11T16:03:08+0000,article,Health,News,"New Drugs Can Fix Teenage Obesity, but Young People Don’t Get Them",Semaglutide (Drug);Obesity;Teenagers and Adolescence;Doctors;Drugs (Pharmaceuticals);Diet and Nutrition;Research
77,The oil company said it would buy CrownRock for $12 billion just weeks after Exxon Mobil and Chevron announced acquisitions.,"Occidental Petroleum on Monday joined the consolidation wave that is sweeping the U.S. oil industry by offering to buy CrownRock, a privately owned oil producer, for $12 billion.",2023-12-11T16:04:35+0000,article,Business Day,News,Occidental Is Latest Oil Company to Buy a Smaller Producer,"Oil (Petroleum) and Gasoline;Mergers, Acquisitions and Divestitures;Occidental Petroleum Corporation;CrownRock LP;Hydraulic Fracturing;Drilling and Boring;Natural Gas;Shale;Permian Basin (North America);Global Warming;Production;Carbon Capture and Sequestration;Prices (Fares, Fees and Rates);Hollub, Vicki (1960- );Houston (Tex)"
78,"The Korean American drama from Celine Song got four nominations, while Swift’s concert film got one. “The Color Purple” was overlooked for best musical.","The nominations for the 81st Golden Globes, announced Monday morning, brought good tidings for box-office titans “Barbie” and “Oppenheimer,” though some of the other contenders hoping to break through were dealt an early setback.",2023-12-11T16:11:57+0000,article,Movies,News,"Golden Globes 2024 Snubs and Surprises: ‘Past Lives,’ Taylor Swift and More","Golden Globes (Awards);Movies;Academy Awards (Oscars);Anatomy of a Fall (Movie);Barbie (Movie);May December (Movie);Oppenheimer (Movie);Past Lives (Movie);Taylor Swift: The Eras Tour (Movie);The Color Purple (Movie);The Holdovers (Movie);The Taste of Things (Movie);Wonka (Movie);Barrino, Fantasia;Brooks, Danielle;Carmichael, Jerrod;Fraser, Brendan;Gerwig, Greta;Haynes, Todd;Lee, Greta;Payne, Alexander;Song, Celine;Swift, Taylor"
79,The working draft made public at the U.N. summit in Dubai would not commit nations to phasing out the fossil fuels that are dangerously heating the planet.,"Environmental groups and negotiators from countries that are most vulnerable to climate disasters assailed a draft of a final agreement, made public at the United Nations climate talks on Monday, that fell short of calling for a phaseout of fossil fuels.The long-awaited draft said nations “could” take actions to slash greenhouse gas emissions, including “reducing both consumption and production of fossil fuels” by 2050, in line with what the science says must be done to avert the worst consequences of global warming.",2023-12-11T16:15:49+0000,article,Climate,News,Countries Most at Risk Call Proposed Climate Agreement a ‘Death Warrant’,"Global Warming;Greenhouse Gas Emissions;United Nations Framework Convention on Climate Change;Al Jaber, Sultan (1973- );International Relations;United Nations;Dubai (United Arab Emirates);United Arab Emirates;Oil (Petroleum) and Gasoline;Organization of the Petroleum Exporting Countries;Saudi Arabia"
80,"Washington State, like more than 20 other states, bars licensed therapists from trying to change the sexual orientation or gender identity of minors in their care.",The Supreme Court said on Monday that it would not hear a First Amendment challenge to a Washington State law banning professional counseling services intended to change a minor’s gender identity or sexual orientation.,2023-12-11T16:19:46+0000,article,U.S.,News,Supreme Court Turns Away Challenge to Law Banning Conversion Therapy,Therapy and Rehabilitation;Alliance Defending Freedom;Supreme Court (US);Religion-State Relations;Homosexuality and Bisexuality;Freedom of Speech and Expression;First Amendment (US Constitution);Psychiatry and Psychiatrists;Washington (State)
81,Marvin Haynes has long maintained he was wrongfully convicted in a 2004 homicide. Prosecutors recently concluded he was right.,"Moments after a Minneapolis jury found Marvin Haynes guilty of the May 2004 killing of a flower shop clerk, he cried out in protest.",2023-12-11T16:21:22+0000,article,U.S.,News,Minneapolis Man Is Freed After Serving 19 Years on Murder Charge,"False Arrests, Convictions and Imprisonments;Decisions and Verdicts;Murders, Attempted Murders and Homicides;Klobuchar, Amy;Minneapolis (Minn);Haynes, Marvin;Black People;Blacks;Floyd, George (d 2020)"
82,"The six-foot-long fossil could offer new clues about the pliosaur, known as the largest carnivorous reptile to ever live.","In the spring of 2022, Philip Jacobs, an artist and fossil hunter, was walking along the Jurassic Coast in southern England when he came across a snout.",2023-12-11T16:56:10+0000,article,Science,News,Skull of Ancient ‘Sea Monster’ With Dagger-Like Teeth Discovered in England,"Fossils;Paleontology;England;Dinosaurs;Skull (Body Part);Oceans and Seas;Etches, Steve (1949- )"
83,The Joyce Theater’s spring/summer season will feature a new work by Ronald K. Brown and a tribute to Chicago house music from Rennie Harris.,"The Joyce Theater will honor the drummer, composer and activist Max Roach with a centennial celebration as part of its spring/summer season, the theater announced on Monday.",2023-12-11T17:00:06+0000,article,Arts,News,Joyce Season to Include Commemoration of Max Roach,"Dancing;Joyce Theater;New York City;Roach, Max"
84,"Mr. Stillwell, known as SB or Shannon Jackson, is among the six defendants currently on trial in the racketeering and gang conspiracy case underway in Atlanta.","Shannon Stillwell, a co-defendant of the superstar rapper Young Thug in the racketeering and gang conspiracy case currently underway in Atlanta, was stabbed in jail on Sunday night, a lawyer for Mr. Stillwell said, delaying the blockbuster trial.",2023-12-11T17:36:41+0000,article,Arts,News,"YSL Defendant Shannon Stillwell Is Stabbed, Delaying Young Thug Trial","Assaults;Rap and Hip-Hop;Prisons and Prisoners;Young Slime Life (YSL);Williams, Jeffery Lamar (Young Thug);Stillwell, Shannon;Racketeering and Racketeers;Gangs"
85,"Readers react to an essay that acknowledged the system is broken and offered solutions. Also: Campus protests; glamorizing guns; Times issue No. 60,000.",To the Editor:,2023-12-11T17:46:56+0000,article,Opinion,Letter,Can Recycling’s Problems Be Fixed?,"Recycling of Waste Materials;Waste Materials and Disposal;Sustainable Living;Plastics;Plastics Industry Assn;Israel-Gaza War (2023- );Demonstrations, Protests and Riots;Colleges and Universities;Zionism;Goldberg, Michelle (1975- );Chemicals;Firearms;Environmental Protection Agency;Hamas;New York Times;Newspapers"
86,"An announcement was expected on Tuesday about the future of Claudine Gay, the university’s president, who some donors and alumni say should be removed.","Harvard’s governing board on Monday was nearing a resolution that would allow its president, Claudine Gay, to remain in her job, according to two people with knowledge of the discussions. But those discussions were ongoing as of late Monday night.",2023-12-11T17:48:36+0000,article,U.S.,News,Harvard’s Governing Board Nears Resolution on President’s Future,"Harvard University;Anti-Semitism;Gay, Claudine;Colleges and Universities;Israel-Gaza War (2023- );Appointments and Executive Changes"
