,abstract,lead_paragraph,pub_date,document_type,section_name,type_of_material,headline,keywords
82,"The 2022 Flying Spur could reach 60 miles per hour in four seconds. The couple who died inside were business owners from a town near Niagara Falls, N.Y.","The car that exploded this week at a border bridge in Niagara Falls, N.Y., was a 2022 Bentley Flying Spur, the authorities said on Friday, an ultraluxury model capable of reaching a speed of 60 miles per hour in four seconds.",2023-11-24T19:06:53+0000,article,New York,News,Bentley in Border Bridge Crash Was a Luxury Car Packed With Power,Automobiles;Traffic Accidents and Safety;Bridges and Tunnels;Bentley Motors Ltd;Niagara Falls (NY);Rainbow Bridge (Niagara Falls)
83,The rap mogul denied a rape accusation made in a new lawsuit that was filed days after Mr. Combs settled another suit in which the R&B artist Cassie had accused him of abuse.,"The producer and music mogul Sean Combs was accused of sexually assaulting a woman in 1991 in a lawsuit she filed on Thursday, a week after he settled a suit that accused him of raping and physically abusing Cassie, an R&B singer once signed to his label.",2023-11-24T19:48:03+0000,article,Arts,News,Sean Combs Accused of Sexual Assault by a Second Woman,"Suits and Litigation (Civil);Sex Crimes;Combs, Sean;New York City;Dickerson-Neal, Joi"
84,"The magazine’s Ethicist columnist on how to show up for loved ones, even when we don’t agree with their choices.","My 100-year-old father is about to marry a 75-year-old woman who is a three-time widow. He met her in church, and after one month I believe she pressured him to get married. My siblings and I are all against the wedding. I’ve spent more time with our father than my siblings have over the past five months, during their courtship, and I’ve seen firsthand many red flags. For example, my father loves tennis (he played on his 100th birthday), but now, because his girlfriend is jealous of him playing with other women, he’s stopped doing so, and is beginning to show signs of decline. We’ve discussed the potential problems associated with a 25-year age difference, but he doesn’t believe that his girlfriend would do anything to harm him because she is religious.",2023-11-24T20:00:02+0000,article,Magazine,News,Can I Skip My 100-Year-Old Father’s Wedding? He’s Making a Big Mistake.,Ethics (Personal);Marriages;Families and Family Life;Weddings and Engagements;internal-sub-only-nl
85,"The aide, Brittany Commisso, is bringing the case under the Adult Survivors Act, which permits people who say they were abused long ago to seek redress. Mr. Cuomo denied wrongdoing.","Brittany Commisso, a former aide to Gov. Andrew M. Cuomo of New York who accused him of groping her in late 2020, is suing him under the state’s Adult Survivors Act for what she described as “pervasive abusive conduct,” according to court papers.",2023-11-24T20:42:39+0000,article,New York,News,Andrew Cuomo Faces Sex Abuse Suit From Ex-Aide Who Says He Groped Her,"Cuomo, Andrew M;Commisso, Brittany;Sexual Harassment;Workplace Hazards and Violations;Sex Crimes;Politics and Government;#MeToo Movement;New York State;Suits and Litigation (Civil)"
86,"Asked if he trusts Hamas to uphold its end of the deal, Mr. Biden said, “I don’t trust Hamas to do anything right. I only trust Hamas to respond to pressure.”","President Biden called the release of 24 hostages by Hamas on Friday “only a start, but so far it’s gone well.”",2023-11-24T20:59:24+0000,article,U.S.,News,Biden says ‘the chances are real’ that the pause could open the door to a longer cease-fire.,Israel-Gaza War (2023- );United States Politics and Government;Kidnapping and Hostages;Palestinians;Hamas
87,"She brought a relentless management style to the wire service’s sports department for 21 years, supervising its coverage of sports around the world.","Terry Taylor, who as the first — and only — woman to be named the sports editor of The Associated Press brought a tireless management style to covering the Olympics, the World Cup and leagues and teams worldwide, died on Nov. 14 at her home in Paoli, Pa. She was 71.",2023-11-24T21:05:35+0000,article,Sports,Obituary (Obit),"Terry Taylor, First Woman Named Sports Editor of The A.P., Dies at 71","Deaths (Obituaries);Athletics and Sports;Associated Press;Women and Girls;News and News Media;Taylor, Terry Rosalind"
88,"Of the 13 Israeli hostages released from Gaza on Friday night, 12 were from a single farming village: Kibbutz Nir Oz.","All but one of the 13 Israeli hostages released on Friday were abducted from Kibbutz Nir Oz, an Israeli village close to the Gaza border where Hamas militants took more than 70 people on Oct. 7.",2023-11-24T21:45:22+0000,article,World,News,"For Tiny Village Near Gaza, Some Hostages Return, but More Are Still Missing",Israel-Gaza War (2023- );Israel;Hamas;Terrorism;Kidnapping and Hostages
89,"Internal documents show companies like Airbnb, Coca-Cola and Microsoft have halted ads, or may do so, after Elon Musk’s endorsement of an antisemitic conspiracy theory.","X, the social media company formerly known as Twitter, could lose as much as $75 million in advertising revenue by the end of the year as dozens of major brands pause their marketing campaigns after its owner, Elon Musk, endorsed an antisemitic conspiracy theory this month.",2023-11-24T22:00:51+0000,article,Business Day,News,X May Lose Up to $75 Million in Revenue as More Advertisers Pull Out,"Twitter;Online Advertising;Social Media;Company Reports;Musk, Elon;Yaccarino, Linda;Anti-Semitism"
90,President Biden expressed hope that the four-day truce between Israel and Hamas could open the door to a longer cease-fire.,President Biden expressed hope that the four-day truce between Israel and Hamas could open the door to a longer cease-fire.,2023-11-24T22:11:34+0000,multimedia,World,Video,"First Group of Hostages Released by Hamas Is ‘Only a Start,’ Biden Says","Biden, Joseph R Jr;Kidnapping and Hostages;Hamas;Israel"
91,He was the unsung investigator whose dogged undercover probe exposed the “Dirty 30” scandal in a Harlem precinct.,"William M. Casey, a former New York City deputy police chief who was the unheralded hero of the “Dirty 30” corruption investigation, which ensnared one-sixth of the officers assigned to a West Harlem precinct, died on Nov. 9 at his home in Pleasantville, N.Y. He was 78.",2023-11-24T22:15:28+0000,article,New York,Obituary (Obit),"William Casey, Who Uncovered Police Corruption, Is Dead at 78","Casey, William M (1945-2023);Deaths (Obituaries);Police Department (NYC);Police Brutality, Misconduct and Shootings;Corruption (Institutional);Harlem (Manhattan, NY)"
92,"At the brand’s annual Sadie Hawkins Winter Formal, guests and entertainers paid tribute to Chris Printup, who died this year.","“I was inspired by Miami and Sour Patch Kids Watermelon,” said Cliftun, a musician and artist who was in a vibrant pink and green ensemble with some elegant fur. He added, “Spanto always commented on how I always came with crazy fur, so this is for my guy.”",2023-11-24T23:04:39+0000,article,Style,News,L.A. Pays Stylish Tribute to Born X Raised Founder,"Printup, Chris (Spanto);Fashion and Apparel;Parties (Social);Born X Raised (Fashion Label)"
93,Families that waited outside a prison for the release of people detained by Israel said the conflict in Gaza and the rising death toll had cast a pall over any celebration.,It was the moment the crowd outside the gates of Ofer prison just outside the West Bank city of Ramallah had awaited for hours: A large white bus carrying Palestinian prisoners and detainees exited the prison gates and made its way through the crowd around 8 p.m. Friday.,2023-11-24T23:04:45+0000,article,World,News,"In West Bank, Cheers and Worries After Prisoners Are Released",Israel-Gaza War (2023- );Palestinians;Prisons and Prisoners;Refugees and Displaced Persons;West Bank;Israel;Nablus (West Bank);Ramallah (West Bank);Gaza Strip;Hamas;Foreign Aid
