,abstract,lead_paragraph,pub_date,document_type,section_name,type_of_material,headline,keywords
78,"This week’s properties are five-bedroom homes in Westport, Conn., and White Plains, N.Y.","A five-bedroom, three-full-and-two-half-bath, 4,498-square-foot house built circa 1929, with a screened front porch; a kitchen with an island and high-end appliances; a great room with high ceilings, wood beams, a Rumford stone fireplace and porch access; a primary en suite bedroom with high ceilings, walk-in closets and a bathroom with radiant-heat floors and double sinks; a wing with a kitchenette, living area and en suite bedroom; a mudroom, laundry room and office; a basement with a cedar closet and a Pilates room; a landscaped yard, a three-car attached garage with an EV charging station and a radiant-heat driveway, on 0.45 acres on a cul-de-sac. Michael Chait, William Pitt Julia B Fee Sotheby’s International, 203-243-1995; williampitt.com",2023-08-31T13:00:20+0000,article,Real Estate,News,Homes for Sale in Connecticut and New York,Real Estate and Housing (Residential);Westport (Conn);White Plains (NY)
79,How a New York homeowner and a pair of gay architects turned a midcentury Sears catalog kit house in the Pines into a contemporary refuge that looks nothing like its neighbors.,"THERE’S A DISTINCT palette to Fire Island Pines, the gay beach getaway a two-hour train ride from New York City. Boxy houses and boardwalks made of untreated cedar have gone gray from the salt air. Pale sand dunes covered in sea grass and holly trees are muted against the men in neon swim briefs who wander through them. But one house stands out amid the uniformity: a modest, 1,100-square-foot white two-bedroom with a gently peaked roof, its walls filled with colorful contemporary art. Architecturally, it looks like it belongs in Palm Springs; its contents would be at home in any Manhattan gallery.",2023-08-31T13:00:28+0000,article,T Magazine,News,"On Fire Island, a Home for Art — and the Artists Who Make It","ARCHITECTURE;Fire Island (NY);Art;Langberg, Doron"
80,"Lavoie, which makes high-end scooters based on McLaren’s Formula 1 technology, acquired the trendy e-bike brand that had gained a zealous following.","VanMoof, the Dutch e-bike maker that gained a zealous following but declared bankruptcy last month, has been acquired by Lavoie, an upscale electric scooter company, the firms announced on Thursday.",2023-08-31T13:15:25+0000,article,Business Day,News,Dutch E-Bike Brand VanMoof Bought Out of Bankruptcy by Scooter Maker,"Electric Bicycles, Motorcycles and Scooters;Mergers, Acquisitions and Divestitures;Bankruptcies;VanMoof BV;Lavoie (McLaren Applied Ltd)"
81,A Guggenheim exhibition shines a light on a remarkable but lesser-known art scene in South Korea that thrived in the tumult of the 1960s and 1970s.,"The 1960s and 1970s were tumultuous in South Korea, with a military dictatorship pushing breakneck economic growth and suppressing civil rights. In the midst of this upheaval, young artists pursued radical projects.",2023-08-31T13:20:01+0000,article,Arts,News,Ephemeral but Unforgettable: Korean Experimental Art Is Having a Star Turn,"Art;Content Type: Personal Profile;Nineteen Hundred Sixties;Nineteen Hundred Seventies;Only the Young: Experimental Art in Korea, 1960s-1970s (Exhibit);Lee Kun-Yong (1942- );Sung Neung Kyung (1944- );Seung-taek Lee (1932- );Lee Kang-So (1943- );South Korea;Guggenheim, Solomon R, Museum;Manhattan (NYC)"
82,"Plus: a recycled cashmere capsule collection, a new Brooklyn haunt inspired by Korean cafe culture — and more recommendations from T Magazine.","The Brazilian artist Wanda Pimentel’s “Envolvimento” paintings (1968-84) are hard-edged domestic vignettes — kitchens, bathrooms, the insides of cars — rendered in a lean, almost festive palette of mostly reds, greens and yellows. In these claustrophobic spaces, feminine-seeming thighs, ankles, feet and hands make fetishistic cameos, jutting out at awkward angles or lingering near water puddles and toilet-paper rolls. Sometimes, they’re framed by thick, windowpane-like lines that cast the viewer as a peeping Tom. “The house is not only a space of intimacy but also of fear,” says Alexandre Gabriel of São Paulo’s Fortes D’Aloia & Gabriel gallery, which will present Pimentel’s work at the Independent 20th Century art fair in New York City next month.",2023-08-31T14:00:08+0000,article,T Magazine,News,"In Detroit, a French Brasserie That Feels Like a Portal to Paris","French Food (Cuisine);Thompson, Mildred (1936-2003);Bread;Loro Piana;Art"
83,A London revival of the hit musical brings extra warmth to the story of a woman in psychological free fall.,"A mind in torment is making for some terrific theater at the moment in London, where the Pulitzer Prize-winning musical “Next to Normal” is belatedly having its British debut 14 years after it opened to acclaim on Broadway. The local premiere at the intimate but important Donmar Warehouse runs through Oct. 7, and this engagement looks unlikely to be its last.",2023-08-31T14:28:14+0000,article,Theater,Review,"Review: ‘Next to Normal’ Is Back, With Extra Pathos","Theater;Next to Normal (Play);Donmar Warehouse Theater;Longhurst, Michael"
84,"Justices Clarence Thomas and Samuel A. Alito Jr. had asked for extensions on their annual forms that show travel, gifts and other financial information.","Justice Clarence Thomas reported a luxury trip, private jet flights and a real estate transaction with a Texas billionaire in his annual financial disclosure form, which was released on Thursday morning.",2023-08-31T14:34:12+0000,article,U.S.,News,Justice Thomas Reports Private Trips With Harlan Crow,"Thomas, Clarence;Crow, Harlan;Gifts to Public Officials;Supreme Court (US);United States Politics and Government"
85,"Making plant-based meals the default has reduced food-related greenhouse gas emissions by 36 percent, the mayor’s office said. Just don’t say “vegan.”","On the menu at New York City’s 11 public hospitals is pasta with Bolognese sauce, without the meat. Or Sancocho, a Latin American beef stew, minus the beef. Or maybe a black-eyed peas casserole with cornbread made without butter or eggs.",2023-08-31T14:59:05+0000,article,Climate,News,How New York’s Public Hospitals Cut Carbon Emissions: More Vegetables,"Hospitals;Veganism;Greenhouse Gas Emissions;Food;Meat;Adams, Eric L;New York City;Global Warming;Health and Hospitals Corp"
86,"A joyful, bumpy musical version of Shakespeare’s late romance closes the Delacorte Theater before an 18-month renovation.","“The isle is full of noises,” sings Caliban, and on Tuesday night it certainly was. Helicopters, radios, sirens and birdsong were competing to be heard in the Manhattan air.",2023-08-31T15:28:35+0000,article,Theater,Review,"Review: In Central Park, ‘The Tempest’ Sings Farewell to Magic","Theater;Theater (Off Broadway);Public Theater;Delacorte Theater;The Tempest (Play);Shakespeare, William;Woolery, Laurie;Goldsberry, Renee Elise"
87,Peter Salovey has increased the university’s endowment and its diversity. But the school faces the end of affirmative action and a push to end legacy admissions.,"Peter Salovey, the president of Yale, announced Thursday that he will step down in June after 11 years in office, during which he increased the university’s endowment,  student enrollment, and its racial, ethnic and economic diversity.",2023-08-31T15:38:02+0000,article,U.S.,News,Yale’s President Announces He Will Step Down,"Colleges and Universities;Appointments and Executive Changes;Ivy League;Yale University;Salovey, Peter;New Haven (Conn)"
88,This month's highlights.,This month's highlights.,2023-08-31T15:39:24+0000,multimedia,Science,Interactive Feature,7 Spectacular Space Images From August,Space and Astronomy;Private Spaceflight;Research;James Webb Space Telescope;Hubble Space Telescope;Moon;Stars and Galaxies;Meteors and Meteorites;Indian Space Research Organization;Virgin Galactic;National Aeronautics and Space Administration;India
89,"The 19 defendants in the election interference case are sparring with prosecutors over when a trial might start, and whether it will be in state or federal court.",Former President Donald J. Trump pleaded not guilty on Thursday and waived his arraignment in the Georgia criminal case charging him and 18 of his allies with interfering in the 2020 election. ,2023-08-31T15:46:55+0000,article,U.S.,News,"Trump, Waiving Arraignment, Pleads Not Guilty in Georgia Case","Georgia Criminal Case Against Trump (2020 Election);Trump, Donald J;Willis, Fani T;Fulton County (Ga);Presidential Election of 2020"
90,"We’re not done: Savor these last few weeks of summer with dance parties, a vegan festival and more.","Here’s the bad news: On Aug. 11, the sun in New York City set at 8 p.m. It will not set that late again until 2024.",2023-08-31T16:00:06+0000,article,New York,News,The End (of Summer) Is Nigh. Let’s Enjoy It!,New York City;Summer (Season);Labor Day;Museums;Dancing;Veganism;Art;Music;Parks and Other Recreation Areas;Parades;Central Park Summerstage
91,"The stakes are high for Bethesda’s newest role-playing game. Microsoft needs an Xbox hit, and players are hungry for an expansive and satisfying space adventure.","Starfield almost immediately nudges its players to the edges of the cosmos. In the opening hours of the role-playing video game, it’s possible to land your spaceship on Earth’s moon or zip 16 light-years to Alpha Centauri. When you open your map and zoom out from a planet, you can behold its surrounding solar system; zoom out again, and you’re scrolling past luminous stars and the mysterious worlds that orbit them.",2023-08-31T16:01:30+0000,article,Arts,News,"Starfield’s 1,000 Planets May Be One Giant Leap for Game Design",Computer and Video Games;Xbox (Video Game System);Space and Astronomy
