,abstract,lead_paragraph,pub_date,document_type,section_name,type_of_material,headline,keywords
43,Tuesday’s election on an abortion-related ballot initiative could have consequences beyond the state.,"By Nov. 7, my fellow Ohioans will cast votes on Issue 1, a ballot initiative that would secure access to reproductive health care, including abortion. It is the only statewide election specifically about reproductive rights in 2023. Whichever way the vote goes, both sides of the debate are likely to draw lessons about abortion-related strategy for next year, when several more ballot initiatives are expected.",2023-11-05T14:00:12+0000,article,Opinion,Op-Ed,Abortion Rights Have Been Winning. Ohio Leaders Are Trying to Change That.,Abortion;Referendums;Ohio
44,Almost everything John Lennon and Paul McCartney felt — and they felt a lot — was poured into their music.,"Sixty-one years after releasing their first single, “Love Me Do,” the Beatles have released their last. “Now and Then” mirrors, in the three beats of its title, its antecedent, which is on the other side. The single accompanies a new version of the group’s Red and Blue greatest hits albums.",2023-11-05T14:00:13+0000,article,Opinion,Op-Ed,"‘Now and Then, I Miss You’: The Love Story at the Heart of the Last Beatles Song","Beatles, The;Lennon, John;McCartney, Paul;Now and Then (Song);Friendship;Pop and Rock Music"
45,It’s time to talk about the extraterrestrial birds and the bees.,"Wherever you are on this planet, you’ve probably given some thought to leaving it. Space is looking more promising every day. There’s no political corruption on Mars, no war on the moon, no juvenile jokes on Uranus.",2023-11-05T14:00:14+0000,article,Opinion,Op-Ed,Space Billionaires Should Spend More Time Thinking About Sex,"Private Spaceflight;Space and Astronomy;Moon;Mars (Planet);Space Exploration Technologies Corp;Musk, Elon;Gravitation and Gravity;National Aeronautics and Space Administration;Sex;Reproduction (Biological)"
46,It seems the left has a hard time holding space for both Jewish and Palestinian civilians.,"On Oct. 24 my brother and I went to the United Nations to watch an emergency Security Council meeting in response to the war in Israel and Gaza. As the Israeli minister of foreign affairs listed the names and held up photos of some of the Israeli children who were taken hostage by Hamas, a white woman in her 30s stood up near us in the gallery to protest. She held up a handmade “Free Palestine” sign.",2023-11-05T14:00:14+0000,article,Opinion,Op-Ed,Six Members of My Family Are Hostages in Gaza. Does Anyone Care?,Hamas;Israel-Gaza War (2023- );Kidnapping and Hostages;Israel;Gaza Strip
47,The speaker needs to consult his Bible more carefully.,"There are two moments from Mike Johnson’s early days as speaker of the House that almost perfectly encapsulate the broken way that so many Republican evangelicals approach politics. The first occurred just after the House elected Johnson. ABC’s Rachel Scott started to ask Johnson about his efforts to overturn the 2020 election. But before she could finish, Johnson’s Republican colleagues started to shout her down. Johnson simply shook his head. “Next question,” he said, as if the query wasn’t worth his time. It was the kind of conduct that led the Florida Republican Matt Gaetz to dub the new speaker “MAGA Mike Johnson.”",2023-11-05T14:00:14+0000,article,Opinion,Op-Ed,‘MAGA Mike Johnson’ and Our Broken Christian Politics,"United States Politics and Government;Bible;Christians and Christianity;Evangelical Movement;Conservatism (US Politics);Republican Party;Johnson, Mike (1972- );House of Representatives;Rumors and Misinformation"
48,"Researchers said they had discovered a new line of mosasaur, a giant sea-dwelling creature that lived alongside the dinosaurs. Its name, Jormungandr walhallaensis, draws on Norse mythology.","In Norse mythology, a monstrous sea serpent wrapped itself around the world’s waters. Its name was Jormungandr.",2023-11-05T14:00:22+0000,article,Science,News,This Ancient Sea Creature Prowled the Waters Over North Dakota,Paleontology;Fish and Other Marine Life;Reptiles;Fossils;Endangered and Extinct Species;Dinosaurs;AMERICAN MUSEUM OF NATURAL HISTORY;Research
49,"Sheinelle Jones of the “Today” show, the actress Patina Miller and Matt James of “The Bachelor” were among the notable names participating.","The celebrities registered to run in this year’s marathon may not all be A-listers, but that doesn’t stop everyone else from comparing their times.",2023-11-05T14:18:45+0000,article,New York,News,These Are the Celebrities Who Ran in the New York Marathon,Running;New York City Marathon;Celebrities
50,The creators of the western drama based on the life of a Black deputy U.S. marshal were inspired by the challenge of filling in the lost history of the famous lawman.,"Perhaps the best advice ever given in a western came courtesy of a journalist in John Ford’s “The Man Who Shot Liberty Valance”: “When the legend becomes fact, print the legend.” The words ring particularly wise when verifiable facts are scarce, as is the case with the subject of the new series “Lawmen: Bass Reeves” (premiering Sunday on Paramount+).",2023-11-05T15:00:14+0000,article,Arts,News,"In ‘Lawmen: Bass Reeves,’ Fiction Fills In Where Tall Tales Leave Off","Black People;Blacks;Television;Paramount Plus;Oyelowo, David;Feehan, Chad;Reeves, Bass;Lawmen: Bass Reeves (TV Program)"
51,"Dozens were taken to nearby Al-Aqsa Martyrs Hospital, where a photographer for The New York Times saw the injured crowding the hallways and the lifeless being prepared for burial.","An explosion overnight in a densely populated part of the central Gaza Strip destroyed several buildings and appeared to have killed and wounded many people, photos and videos from the scene on Sunday showed.",2023-11-05T15:17:20+0000,article,World,News,Explosion Gazans Say Was Airstrike Leaves Many Casualties in Dense Neighborhood,Israel-Gaza War (2023- );Palestinians;Hamas;United Nations Relief and Works Agency;Gaza Strip;Maghazi Refugee Camp (Gaza Strip);Civilian Casualties;Israel;Refugees and Displaced Persons
52,"Troops were killed as they gathered in a southern village for a military commemoration, officials said.","President Volodymyr Zelensky of Ukraine said Sunday that criminal proceedings had been initiated over an episode in which Russian missiles struck a group of Ukrainian soldiers at an award ceremony in the south of the country, killing some and leaving others wounded.",2023-11-05T15:22:31+0000,article,World,News,"Russian Strike on Soldiers at Ceremony Was a Crime, Zelensky Says",Deaths (Fatalities);Defense and Military Forces;Russian Invasion of Ukraine (2022);Ukraine
53,"Nearly $900,000 will be awarded to the top finishers of the New York City Marathon, with the winners of the elite men’s and women’s divisions receiving $100,000 each.","Nearly $900,000 is guaranteed to be awarded to the top finishers in this year’s New York City Marathon, and additional prize money could be distributed if athletes break course records.",2023-11-05T15:29:59+0000,article,New York,News,How much prize money will the winners get?,"New York City Marathon;Obiri, Hellen;Tola, Tamirat;Debrunner, Catherine (1995- );Hug, Marcel (1986- );New York City;Marathon Running"
54,"The Himalayan country is far behind in enforcing construction codes despite sitting on the fault lines of two major tectonic plates, experts say.","Officials in Nepal were still assessing the extent of the damage on Sunday from the earthquake that struck the country’s west two nights earlier, leaving at least 150 people dead and thousands either homeless or afraid to sleep indoors.",2023-11-05T15:37:14+0000,article,World,News,Deadly Quake in Nepal Renews Fears of an Even Deadlier One,Earthquakes;Nepal;Deaths (Fatalities);Politics and Government;Developing Countries;Regulation and Deregulation of Industry;Building (Construction)
55,The move is a big win for the Florida governor — and a snub to Donald Trump — just months before the Iowa caucuses.,"Gov. Kim Reynolds of Iowa is expected to endorse Gov. Ron DeSantis of Florida in the Republican presidential primary on Monday, throwing her significant clout in the state behind him as he tries to make up ground against former President Donald J. Trump before the state’s caucuses in January.",2023-11-05T15:40:50+0000,article,U.S.,News,"Kim Reynolds, Iowa’s Influential Governor, Expected to Endorse DeSantis","Presidential Election of 2024;Iowa;Reynolds, Kimberly (1959- );Trump, Donald J;DeSantis, Ron;Endorsements;Republican Party"
56,Marcel Hug won his record sixth New York City Marathon while Catherine Debrunner won her debut and set a course record.,"Marcel Hug and Catherine Debrunner, both from Switzerland, won the men’s and women’s wheelchair races in the New York City Marathon on Sunday. Hug won a record sixth victory on New York’s course, while Debrunner set a course record in her debut in the race.",2023-11-05T15:45:41+0000,article,New York,News,Marcel Hug and Catherine Debrunner Win Marathon’s Wheelchair Races,"Hug, Marcel (1986- );Debrunner, Catherine (1995- );New York City Marathon;Records and Achievements;Disabilities;Wheelchairs;New York City;Switzerland"
57,,,2023-11-05T15:59:49+0000,article,New York,News,Images from today’s race so far.,
58,"It’s the sort of tangy, sweet, fiery and crunchy dish you want to assemble rather than cook after a busy day.","Good morning. We were out on the water last weekend, chasing striped bass in the Lower Bay south of the Verrazzano-Narrows Bridge; along Midland Beach on Staten Island; at Sandy Hook and Romer Shoal in New Jersey; off Breezy Point, in Queens, then east along the Rockaway Peninsula to the beach club we call the Cabanas and finally back into Jamaica Bay.",2023-11-05T16:00:03+0000,article,Food,Letter,Chaat Party Has Entered the Party Chat,Cooking and Cookbooks;Content Type: Service
59,"Readers respond to an essay by Adam Grant. Also: Trump lackeys; not true “conservatives""; saving the New York skyline.",To the Editor:,2023-11-05T16:05:02+0000,article,Opinion,Letter,"Student and Teacher, Moving Up Together","Education (K-12);Teachers and School Employees;Trump, Donald J;United States Politics and Government;Conservatism (US Politics);Presidential Election of 2024;Manhattan (NYC);Empire State Building (Manhattan, NY);Historic Buildings and Sites;ARCHITECTURE"
60,"“X: The Life and Times of Malcolm X,” from 1986, receives its grandest treatment yet, in a production expected to play on opera stages from coast to coast.","The epigraph of Anthony Davis’s opera “X: The Life and Times of Malcolm X” is a quote from an interview in which, asked about the cost of freedom, Malcolm responds, “The cost of freedom is death.”",2023-11-05T16:22:41+0000,article,Arts,Review,Review: Anthony Davis’s Malcolm X Opera Finally Arrives at the Met,"Opera;Metropolitan Opera;Abdullah, Kazem (1979- );Bryce-Davis, Raehann;Davis, Anthony (1951- );Davis, Thulani;Liverman, Will;O'Hara, Robert;X: The Life and Times of Malcolm X (Opera);Davis, Christopher (1965- )"
61,"“Walter is a good shooter until the fourth period,” one coach said of Davis, a standout in both college and the N.B.A. “Then he becomes a great shooter.”","Walter Davis, whose smooth shooting propelled him to basketball stardom with the University of North Carolina and the Phoenix Suns, but who late in his career struggled with drug addiction, died on Thursday while visiting family in Charlotte, N.C. He was 69.",2023-11-05T16:33:07+0000,article,Sports,Obituary (Obit),"Walter Davis, Basketball Star With a Velvet Touch, Dies at 69","Davis, Walter (1954-2023);Deaths (Obituaries);Basketball;Basketball (College);Olympic Games (1976);Drug Abuse and Traffic;Phoenix Suns;University of North Carolina;National Basketball Assn;National Collegiate Athletic Assn;Smith, Dean (1931-2015)"
62,Yaniv Zaguri skipped a run with his club on Oct. 7 because he was tired from training for the marathon. Two members who went were killed by Hamas.,"Yaniv Zaguri, an Israeli athlete, was so tired from a 22-mile run that was part of his training for the New York City Marathon that he decided to skip an early morning run with his club, the Sderot Front Runners, on Oct. 7.",2023-11-05T16:39:12+0000,article,New York,News,An Israeli runner mourns members of his run club.,
63,"Barfoot, of New Zealand, says he has run dozens of marathons, but this is his first time running New York’s.",Garth Barfoot’s training regimen has been fairly straightforward: daily runs to his favorite coffee shop and back home.,2023-11-05T16:59:49+0000,article,New York,News,"Garth Barfoot, 87, Is the Oldest Runner in the New York City Marathon",New York City Marathon;Running;New Zealand;New York City
64,Times reporters will answer readers’ questions about new polling on next year’s presidential race.,New polling by The New York Times and Siena College finds former President Donald J. Trump leading President Biden in five of six crucial swing states one year ahead of the 2024 presidential election.,2023-11-05T17:11:07+0000,article,Briefing,News,Have a Question About the Times/Siena 2024 Poll? Ask It Here,Presidential Election of 2024;Polls and Public Opinion
65,"As an anime phenomenon comes to a close, the story’s original creator, Hajime Isayama, breaks down a conclusion that “was pretty much there from the beginning.”",This interview contains spoilers for the finale of “Attack on Titan.”,2023-11-05T17:27:18+0000,article,Arts,News,‘Attack on Titan’ Ends How Its Creator Always Envisioned,"Television;Attack on Titan (TV Program);Isayama, Hajime (1986- );Animated Films;Content Type: Personal Profile"
66,Tyson said it had received complaints from consumers about finding small metal pieces in the product. Federal regulators said one “minor oral injury” had been reported.,"Tyson Foods is recalling nearly 30,000 pounds of its dinosaur-shaped chicken nuggets after some consumers said they found small metal pieces in them, federal officials said.",2023-11-05T17:49:53+0000,article,Business Day,News,"Tyson Recalls Nearly 30,000 Pounds of Chicken Nuggets Over Metal Pieces",Recalls and Bans of Products;Food Contamination and Poisoning;Poultry;Food;Food Safety and Inspection Service;Tyson Foods Inc;AGRICULTURE DEPARTMENT
67,The Republican presidential candidate’s defeat in a largely Black South Carolina district in 1996 derailed his promise as someone who could expand the party’s appeal.,"On a balmy, overcast October afternoon in South Carolina, Tim Scott, the state’s junior senator and current Republican presidential hopeful, worked his way from the back of the Corner Perk Brunch Cafe to a makeshift stage at the front of the crowded room. He stopped to hug and greet adoring supporters in his path. Mr. Scott, who grew up idolizing professional wrestlers, looked the part of the fan favorite on his way to the ring.",2023-11-05T17:55:11+0000,article,U.S.,News,"When Tim Scott Tried to Appeal to Black Voters, and Lost","Scott, Timothy Eugene;Republican Party;North Carolina"
68,"The attack, in which four of the 18 people killed were Deaf, resurfaced previous traumas and came after decades of efforts to be recognized.","As residents across Maine sat riveted to their TVs on Oct. 27, waiting anxiously for updates on the manhunt for a gunman who had killed 18 people, state officials opened their news briefing with a stern directive for the cameras in the room.",2023-11-05T17:55:42+0000,article,U.S.,News,"After Lewiston Shooting, Maine’s Deaf Community Seeks to Rise Above, Again","Deafness;Lewiston, Maine, Shootings (2023);Sign Language;Lewiston (Me);Maine;Governor Baxter School for the Deaf"
69,The former president will testify Monday in a trial that threatens the business empire that created his public persona. He will be out of his element and under oath.,Follow live updates on the civil fraud trial against Donald Trump.,2023-11-05T18:57:38+0000,article,New York,News,"Trump’s Credibility, Coherence and Control Face Test on Witness Stand","New York State Civil Case Against Trump (452564/2022);Presidential Election of 2024;Attorneys General;Engoron, Arthur F;Trump, Donald J;James, Letitia;Manhattan (NYC);Trump: The Art of the Deal (Book);Trump Organization"
70,"“Joy and performance are not mutually exclusive,” said Alexi Pappas. She was one of many runners standing out at the starting line of the New York City Marathon.","As 7 a.m. approached on Sunday, a crowd of runners stumbled blearily off the Staten Island Ferry in fleece blankets and body glitter. The blankets were for warmth, and the body glitter for morale to help them through the 26.2 miles that lay ahead.",2023-11-05T19:14:29+0000,article,Style,News,Forget Aerodynamics: Running the Marathon in Style,New York City Marathon;Fashion and Apparel;New York City
71,"William J. Burns’s visit comes as the United States tries to prod Israel to pursue a more targeted approach to attacking Hamas, allow pauses in the fighting and do more to avoid civilian casualties.","William J. Burns, the C.I.A. director, arrived in Israel on Sunday for discussions with leaders and intelligence officials, the first stop in a multicountry trip in the region, according to U.S. officials.",2023-11-05T19:54:49+0000,article,U.S.,News,C.I.A. Director Visits Israel and the Middle East Amid Israel-Hamas War,"Israel-Gaza War (2023- );Civilian Casualties;International Relations;United States International Relations;Palestinians;United States Politics and Government;Central Intelligence Agency;Hamas;ABDULLAH II, KING OF JORDAN;Biden, Joseph R Jr;Burns, William J;Netanyahu, Benjamin;Gaza Strip;Israel;Jordan;Middle East"
72,A top Haitian police official was grocery shopping when he recognized another customer: a man wanted for questioning in the assassination of President Jovenel Moïse.,A senior Haitian police official was shopping at his local supermarket on a recent weekday when someone caught his eye: the country’s most wanted man.,2023-11-05T20:00:16+0000,article,World,News,A Chance Encounter and a Fugitive Linked to a President’s Killing Is Caught,"Moise, Jovenel (1968- );Henry, Ariel;Haiti;Assassinations and Attempted Assassinations;Politics and Government"
73,This year’s race saw a course record broken and a dramatically close women’s contest.,"A decorated women’s field had slowly come unglued over the final few miles of the New York City Marathon on Sunday, to the point where just two runners remained in the hunt for the title.",2023-11-05T20:33:59+0000,article,New York,News,Tamirat Tola and Hellen Obiri Win New York City Marathon,"New York City Marathon;Marathon Running;Obiri, Hellen;Tola, Tamirat;Gidey, Letesenbet;New York City;Records and Achievements;Ethiopia;Kenya"
74,Plus the rise of space junk.,"The U.S. secretary of state, Antony Blinken, made an unannounced visit yesterday to Baghdad, showing support for Iraq’s prime minister, Mohammed Shia Al-Sudani, and sending a message to Iran about the Biden administration’s commitment to defending its personnel.",2023-11-05T21:13:41+0000,article,Briefing,briefing,Monday Briefing: Antony Blinken Visits the Middle East,
75,"Israel wants 24,000 assault rifles. Itamar Ben-Gvir, a far-right minister overseeing the police, has given rifles to civilians and is forming “security squads.”","An Israeli government request for 24,000 assault rifles from the United States is drawing scrutiny from American lawmakers and some State Department officials who fear the weapons might end up in the hands of settlers and civilian militias trying to force Palestinians from land in the West Bank, where violence has been surging, U.S. officials say.",2023-11-05T21:23:37+0000,article,U.S.,News,U.S. Officials Fear American Guns Ordered by Israel Could Fuel West Bank Violence,"Israel-Gaza War (2023- );Israeli Settlements;Terrorism;Arms Trade;Right-Wing Extremism and Alt-Right;United States International Relations;Palestinian Authority;Ben-Gvir, Itamar;Netanyahu, Benjamin;Biden, Joseph R Jr;Blinken, Antony J;Gaza Strip;West Bank;Israel"
76,"Amid concerns that the conflict in Gaza could spill across the Middle East, the U.S. secretary of state, Antony J. Blinken, met with Iraqi officials and U.S. personnel to reaffirm the United States’ commitment to protecting its partners.","Amid concerns that the conflict in Gaza could spill across the Middle East, the U.S. secretary of state, Antony J. Blinken, met with Iraqi officials and U.S. personnel to reaffirm the United States’ commitment to protecting its partners.",2023-11-05T21:42:01+0000,multimedia,World,Video,Blinken Visits Iraq in Hopes of Containing Israel-Hamas War,"Israel-Gaza War (2023- );Blinken, Antony J;Iraq;International Relations"
77,"A stunning advancement in a long history of stargazing, the James Webb telescope reveals light where once we saw only darkness. Our view of the universe will never be the same.","A stunning advancement in a long history of stargazing, the James Webb telescope reveals light where once we saw only darkness. Our view of the universe will never be the same.",2023-11-05T21:53:55+0000,multimedia,Magazine,Interactive Feature,A Beginner’s Guide to Looking at the Universe,Space and Astronomy;James Webb Space Telescope;Stars and Galaxies;Solar System;Saturn (Planet)
78,President Biden’s team emphasized that polls have failed to predict the results of elections when taken a year ahead of time.,"White House officials on Sunday shrugged off weekend polling that showed President Biden trailing former President Donald J. Trump, even as Democrats said they were increasingly worried about Mr. Biden’s chances in 2024.",2023-11-05T22:45:33+0000,article,U.S.,News,Democrats Express Deep Anxiety as Polls Show Biden Trailing Trump,"Polls and Public Opinion;Presidential Election of 2024;United States Politics and Government;Democratic Party;Axelrod, David;Biden, Joseph R Jr;Trump, Donald J;Chavez Rodriguez, Julie;New York Times/Siena College Poll"
79,Desirée Penner and Jeff Sinnock make their New York Times debut.,Jump to: Today’s Theme | Tricky Clues,2023-11-05T23:00:07+0000,article,Crosswords & Games,News,Towel Holders,Crossword Puzzles
