,abstract,lead_paragraph,pub_date,document_type,section_name,type_of_material,headline,keywords
44,Scott Von Doviak’s novel “Lowdown Road” evokes “The Dukes of Hazzard” — in a good way.,"Scott Von Doviak has done the unthinkable: made me take the television show “The Dukes of Hazzard” more seriously. His latest novel, LOWDOWN ROAD (Hard Case Crime, 287 pp., paperback, $15.95) — with its hapless good ol’ boy antiheroes clad in aviator sunglasses, crotch-hugging Levis and Lynyrd Skynyrd T-shirts — clearly takes inspiration from the series.",2023-07-05T09:01:11+0000,article,Books,News,"250 Pounds of Pot, a Taco Truck and a Cross-Country Road Trip","Books and Literature;Mejia, Mindy (Author);Lowdown Road (Book);Von Doviak, Scott;Ford, Kelly J;The Hunt (Book);To Catch a Storm (Book);The Bitter Past (Book);Bourgos, Bruce;genre-books-mystery"
45,"Wie West, one of the savviest stars women’s golf has ever had, intends to step away after the U.S. Women’s Open at Pebble Beach. She could be done as soon as Friday.","You could see the head tilts and darting glances when people peered around Pebble Beach's Gallery Cafe, or as visitors sat on the patio that looks toward the cypress-guarded 18th green by Stillwater Cove. They surfaced at a luncheon with Brandi Chastain and Kristi Yamaguchi, and during a climb up a flight of stairs, and a stroll through a lobby.",2023-07-05T09:01:11+0000,article,Sports,News,Michelle Wie West Wants One More Crack at a Major,"Golf;Wie, Michelle;United States Women's Open (Golf);Ladies Professional Golf Assn;Content Type: Personal Profile;Pebble Beach (Calif)"
46,"If you can create a native garden that looks at home on the grounds of a historic Philadelphia Main Line estate, you can do it anywhere.",The task facing anyone designing a garden: “We’re predicting the future — we’re seeing what’s not there.”,2023-07-05T09:01:12+0000,article,Real Estate,News,"Formal Landscaping With Native Plants? Yes, It’s Possible.","Real Estate and Housing (Residential);Gardens and Gardening;Flowers and Plants;Stoneleigh (Villanova, Pa)"
47,"With good schools and relatively low property taxes, this Morris County community is popular with buyers. No surprise, then, that the market is tight.","With good schools and relatively low property taxes, this Morris County community is popular with buyers. No surprise, then, that the market is tight.",2023-07-05T09:01:13+0000,multimedia,Real Estate,Slideshow,"Living In ... Hanover, N.J.",Real Estate and Housing (Residential);Hanover Township (NJ)
48,The White House wanted South Carolina to vote first in 2024. The Democratic National Committee obliged. It hasn’t gone according to plan.,"Last December,  the 30-odd members of the Democratic Party’s rules and bylaws committee filed in to the Omni Shoreham, the glittering resort hotel that once hosted Franklin D. Roosevelt’s inaugural ball. All of the Democrats, many of them gray-haired habitués of the rubber-chicken circuit, knew they had come to Washington to hash out, after months of debate, what the presidential-primary calendar would look like come 2024. ",2023-07-05T09:01:15+0000,article,Magazine,News,The D.N.C. Has a Primary Problem,"Democratic National Committee;Democratic Party;Primaries and Caucuses;Harrison, Jaime R (1976- );Presidential Election of 2024;Presidential Election of 2020;United States Politics and Government;Biden, Joseph R Jr;Perez, Thomas E;Ellison, Keith;South Carolina;Iowa;New Hampshire"
49,Justina Machado and Aaron Mark went uptown to sample the savory pastries that play a central role in their new horror-comedy — minus the mystery meat.,You know those days when you would kill for an empanada? Well.,2023-07-05T09:01:15+0000,article,Arts,News,"In ‘The Horror of Dolores Roach,’ the Empanadas Are to Die For","Television;Blumhouse Television LLC;Amazon.com Inc;Machado, Justina;Mark, Aaron (1987- );Washington Heights (Manhattan, NY);The Horror of Dolores Roach (TV Program)"
50,"With good schools and relatively low property taxes, this Morris County community is popular with buyers. No surprise, then, that the market is tight.","Tired of the scorching weather and the constant threat of wildfires, Andrew and Carolyn Trexler decided early this year that it was time to abandon their five-year experiment of living in Northern California. So they left to return to their home turf of North Jersey. The only problem was securing a house in a highly competitive market.",2023-07-05T09:01:15+0000,article,Real Estate,News,"Hanover Township, N.J.: ‘A Nice, Family-Oriented Place’",Real Estate and Housing (Residential);MORRIS COUNTY (NJ);Whippany (NJ);Cedar Knolls (NJ);Hanover Township (NJ)
51,"Christina Quarles discusses representation, trades and protein shakes.","Growing up in Los Angeles as the fair-skinned daughter of a Black father and a white mother, Christina Quarles, 38, can recall the first time her sense of identity was challenged: “In elementary school, there was this book of famous Black people throughout history and my nana was in there,” she said. (Her paternal grandmother, Norma Quarles, was one of the first Black TV journalists.) “I would show the other kids that was my grandmother in the book but get told, ‘No, you’re not Black.’ It was this disconnect between how I was raised with my own personal sense of my biography, and then to be met with such resistance when I would express that to people.”",2023-07-05T09:01:17+0000,article,T Magazine,News,An Artist Whose Language Is Painting,"Quarles, Christina (1985- );Content Type: Personal Profile;Art"
52,Heavy rains and heat waves have affected parts of China and the Asia Pacific region this week. More of the same was in the forecast.,"China and several other Asia Pacific countries were reeling from monsoonal floods and stultifying temperatures on Wednesday, the latest disruptions in what forecasters say could be a long summer and autumn of extreme weather around the world.",2023-07-05T09:36:19+0000,article,World,News,A Drone and a Crane Save the Day as China Reels From Extreme Weather,"Heat and Heat Waves;Weather;Floods;Rain;Global Warming;El Nino Southern Oscillation;Cambodia;China;Chongqing (China);Far East, South and Southeast Asia and Pacific Areas;Taiwan;Japan"
53,"Exclusively from New York Times Audio, our new app.","The New York Times Audio app is home to journalism and storytelling, and provides news, depth and serendipity. If you haven’t already, download it here — available to Times news subscribers on iOS — and sign up for our weekly newsletter.",2023-07-05T09:45:02+0000,article,Podcasts,News,"Today’s Top News: Israel’s Deadly Operation in the West Bank, and More","Israel;Palestinians;West Bank;Social Media;Biden, Joseph R Jr;Yellen, Janet L;China"
54,The social media megastar regularly goes viral for giving away money in extremely extravagant and colorful ways.,"Jimmy Donaldson, better known as MrBeast, has become a sensation on YouTube for ostentatious and sometimes absurd acts of altruism.",2023-07-05T10:00:13+0000,article,Podcasts,News,How MrBeast Became the Willy Wonka of YouTube,"audio-neutral-informative;Altruism;Philanthropy;Video Recordings, Downloads and Streaming;YouTube.com;Donaldson, Jimmy (Mr Beast) (1998- )"
55,"Allison Mack, the former “Smallville” actress, was sentenced to three years in prison in 2021.","Allison Mack, the “Smallville” actress who recruited women to the cultlike group Nxivm and assisted prosecutors in convicting its leader of sex trafficking and other crimes, was released from a federal prison this week after serving two years of a three-year sentence on racketeering and racketeering conspiracy charges.",2023-07-05T10:20:00+0000,article,U.S.,News,‘Smallville’ Actress Who Recruited Women for Nxivm Is Released From Prison,"Actors and Actresses;Sex Crimes;Prisons and Prisoners;Racketeering and Racketeers;Raniere, Keith;Mack, Allison;Nxivm"
56,Class diversity has been a blind spot for many colleges. Will that now change?,"The University of Virginia, one of the country’s top public universities, enrolls a strikingly affluent group of students: Less than 15 percent of recent undergraduates at UVA have come from families with incomes low enough to qualify for Pell Grants, the largest federal financial aid program.",2023-07-05T10:51:04+0000,article,Briefing,briefing,Social Class Is Not About Only Race,internal-storyline-no;Colleges and Universities;Discrimination;Affirmative Action
57,"Robert F. Kennedy Jr. is getting a lot of play, but his views are in the minority.","With Robert F. Kennedy Jr.’s bid for the Democratic presidential nomination, vaccine skepticism has been back in the headlines. Though Kennedy has said he isn’t anti-vaccine and that his children have had vaccines, and his campaign manager (the former Democratic congressman and presidential candidate Dennis Kucinich) says calling Kennedy “anti-vax” is a “left-handed smear,” Kennedy continues to suggest a link between vaccines and autism — a link that has leaned heavily on flawed and retracted science. He’s also been a vocal opponent of Covid vaccines.",2023-07-05T12:00:03+0000,article,Opinion,Op-Ed,Pro-Vaccine Views Are Winning. Don’t Fear the Skeptics.,"internal-sub-only-nl;Kennedy, Robert F Jr;Vaccination and Immunization;Primaries and Caucuses;Polls and Public Opinion;Presidential Election of 2024;Democratic Party;Republican Party"
58,A judge’s decision to limit how the administration can interact with platforms could chill the White House’s efforts to utilize and police big tech.,Government efforts to interact with social media platforms took a major hit on Tuesday when a federal judge restricted the Biden administration from communicating with tech companies about a broad array of online content.,2023-07-05T12:41:21+0000,article,Business Day,News,A New Ruling Could Complicate Biden’s Policy on Social Media,"internal-storyline-no;Social Media;Computers and the Internet;Democratic Party;Federal Bureau of Investigation;Google Inc;Health and Human Services Department;Meta Platforms Inc;Republican Party;Twitter;Biden, Hunter;Biden, Joseph R Jr;Doughty, Terry A;Kennedy, Robert Francis;Musk, Elon;Trump, Donald J"
59,Get some help on the Friday crossword puzzle.,"Friday crosswords are among the hardest of the week. They are themeless, which means you can’t rely on that extra level of context to solve the puzzle, and the clues are written with a higher level of wit and wordplay. We know this can be daunting for newer solvers. If you need a little hint to unlock the puzzle, we’ve provided easy clues you can use. We recommend ctrl + f the number of the clue you’re looking for. You can also play a digital version of this puzzle with easy clues by signing up for our Easy Mode newsletter.",2023-07-05T13:00:02+0000,article,Crosswords & Games,News,"Easy Mode: Clues for Friday, July 7, 2023",internal-sub-only-games
60,"After ending a yearslong extramarital affair, a reader worries about a coming dinner party that will be attended by both the former lover and the reader’s spouse.","I had an extramarital affair for several years. It ended recently — abruptly and unpleasantly — and I blocked all digital and telephonic communication with my ex to ensure that I don’t weaken and get involved again. The affair was fulfilling sexually and emotionally, but it was also taboo: We are both otherwise happily married and socialize together as couples. Now, I am apprehensive about future encounters. Recently, we all juggled our calendars to attend a small, upcoming dinner party at a third couple’s home. How should I handle this? I don’t want to reach out and ask for a truce; my emotions are still too raw — with hurt and anger not far from the surface. I don’t know how to justify canceling the dinner to my spouse, but I’m afraid I may lose it if I go.",2023-07-05T13:00:03+0000,article,Style,News,I Had an Affair With Someone My Spouse and I See Socially. Help!,"Customs, Etiquette and Manners;Content Type: Service"
61,"Sgah’gahsowáh, the artist behind the one-man band, combines the genre’s traditional heavy sounds with a focus on nature. His new album, “Blackbraid II,” is out Friday.","Black metal has long been associated with the gray skies, snowy landscapes and Norse mythology of Scandinavia. Most people know it, if at all, as the musical genre associated with church burnings and gory homicides in early 1990s Norway. (Those events were documented in the book “Lords of Chaos,” which was adapted into a 2019 feature starring Rory Culkin as the misanthropic, occultist musician Euronymous.)",2023-07-05T13:00:17+0000,article,Arts,News,"Meet Blackbraid, a Black Metal Musician With Native American Roots",Sgah'gahsowah (Blackbraid);Pop and Rock Music;Native Americans;Content Type: Personal Profile;Blackbraid II (Album)
62,"This season has seen excessive heat, violent storms and hazardous smoke already, but you can prepare for future events with a few apps and tools.","Summer is in full swing now, but along with vacation trips, camp and lazy days, extreme weather has arrived for many parts of the country. If you live in an area that’s prone to such conditions, it helps to be ready. Here are some tips to help you use your tech through major meteorological moments — sometimes, even when power and cell service are shaky.",2023-07-05T13:00:24+0000,article,Technology,News,A Tech Checklist for the Dark Side of Summer Weather,Smartphones;Mobile Applications;Android (Operating System);iOS (Operating System);Content Type: Service;Weather;Wildfires;Disasters and Emergencies;Summer (Season)
63,"A conversation with Christopher Cox, who wrote about the near-failure of the Oroville Dam and whether it could happen again.","Perhaps you’ve heard that climate change in California is exacerbating what’s sometimes called “weather whiplash”: Dry periods are stretching longer, interrupted by storms that are growing bigger and more furious.",2023-07-05T13:03:03+0000,article,U.S.,briefing,How Extreme Weather Could Threaten California’s Dams,California
64,Guram Gvasalia of Vetements revealed that he had been making the costumes for Madonna’s postponed tour right in the middle of couture week. It was a classic move.,"Of all the many Madonna-related posts that have appeared on social media since it was revealed that the artist had been taken ill and forced to postpone her “Celebration” tour, one in particular stood out — not just because of what it said, but because of what it showed.",2023-07-05T13:30:20+0000,article,Style,News,The Man Who Wants to Be the Biggest Thing in Fashion,"Gvasalia, Guram;Vetements (Fashion Label);Content Type: Personal Profile;Fashion and Apparel;Fashion Shows;Georgia (Georgian Republic);Paris (France);Social Media;Gvasalia, Demna"
65,"He was brilliant, quirky and intensely private — and also, she now suspects, an anonymous dissident blogger who had won fame for years of evading the surveillance state.","It wasn’t as if Bei Zhenying didn’t know that her husband was unusual, or even that he had some secrets.",2023-07-05T14:00:14+0000,article,World,News,China Took Her Husband. She Was Left to Uncover His Secret Cause.,China;Ruan Xiaohuan;Blogs and Blogging (Internet);Surveillance of Citizens by Government;Political Prisoners;Computers and the Internet;Human Rights and Human Rights Violations;Communist Party of China;internal-sub-only;audio-neutral-immersive
66,"This fall, Americans will be urged to get shots against the flu, Covid and, if they’re older, R.S.V.","To prevent a repeat of last winter’s “tripledemic” of respiratory illnesses, Americans will be encouraged to roll up their sleeves not just for flu shots but for two other vaccines, one of them entirely new.",2023-07-05T14:08:36+0000,article,Health,News,Federal Officials Hatch a Three-Pronged Defense Against Another ‘Tripledemic’,your-feed-science;Vaccination and Immunization;Deaths (Fatalities);Elderly;Coronavirus (2019-nCoV);Guillain-Barre Syndrome;Respiratory Syncytial Virus (RSV);Influenza;Winter (Season);GSK PLC;Pfizer Inc;Clinical Trials
67,"Here’s who should get the flu, Covid and R.S.V. vaccines, and when.","Most Americans have had one or more shots of the flu and Covid vaccines. New this year are the first shots to protect older adults from respiratory syncytial virus, a lesser-known threat whose toll in hospitalizations and deaths may rival that of flu.",2023-07-05T14:10:41+0000,article,Health,News,Three Vaccines for Fall: What You Need to Know,Vaccination and Immunization;Coronavirus (2019-nCoV);Influenza;Respiratory Syncytial Virus (RSV);Elderly;Immune System;Moderna Inc;Novavax Inc;Pfizer Inc;Content Type: Service;your-feed-science
68,"Creating a new A.I. system requires lots of money and lots of computing power, which is controlled by the industry’s giants.","The tech industry loves its garage start-up stories. From Hewlett-Packard to Google, the tales of bootstrapped companies that have turned into giants have inspired generations of entrepreneurs.",2023-07-05T14:41:36+0000,article,Business Day,News,"In the Age of A.I., Tech’s Little Guys Need Big Friends",Artificial Intelligence;Start-ups;Cohere Inc;OpenAI Labs;ChatGPT;Google Inc;Computers and the Internet
69,"Amazon, Box, Salesforce, Oracle and others have recently rolled out A.I.-related products to help workplaces become more efficient and productive.","Earlier this year, Mark Austin, the vice president of data science at AT&T, noticed that some of the company’s developers had started using the ChatGPT chatbot at work. When the developers got stuck, they asked ChatGPT to explain, fix or hone their code.",2023-07-05T14:41:55+0000,article,Technology,News,"As Businesses Clamor for Workplace A.I., Tech Companies Rush to Provide It",Artificial Intelligence;Productivity;Computers and the Internet;Enterprise Computing;ChatGPT;Software;Engineering and Engineers;Advertising and Marketing;Box Inc;Amazon.com Inc;Cisco Systems Inc;Cohere Inc;Microsoft Corp;OpenAI Labs;Oracle Corporation;Salesforce.com Inc;AT&T Inc
70,A video posted on Telegram and geolocated by The New York Times shows an explosion in Makiivka.,A video posted on Telegram and geolocated by The New York Times shows an explosion in Makiivka.,2023-07-05T14:49:13+0000,multimedia,World,Video,Large Explosion in Russian-Occupied Makiivka,Makiivka (Ukraine);Russian Invasion of Ukraine (2022);Ukraine
71,"Jack Cole, 16, reflects on his 648 days of playing the popular New York Times game.","Our annual Summer Reading Contest invites teenagers around the world to tell us what New York Times pieces get their attention and why. This week, the second of 10, we received 753 entries. Thank you to everyone who participated, and congratulations to our winner, Jack Cole, as well as to the runners-up and honorable mentions we honor below.",2023-07-05T14:52:07+0000,article,The Learning Network,News,"‘Until Tomorrow, Wordle!’: The Week 2 Winner of Our Summer Reading Contest",
72,“It’s like Mexican street corn and cornbread had a baby.”,"Hi. It’s me, Kim Severson! It’s that time of the summer when everyone but me goes on vacation. This means I get to talk about something my friends and family are tired of hearing, which is how much reporting power fuels everything we do over here in the best section of The New York Times.",2023-07-05T15:00:03+0000,article,Food,Letter,A Corn Pudding That Tastes Like Elotes,Cooking and Cookbooks;Content Type: Service
73,Readers respond to a column by David French. Also: Banning nuclear weapons; premature book reviews; walking in the city.,To the Editor:,2023-07-05T15:00:34+0000,article,Opinion,Letter,Transgender Athletes in Women’s Sports,"Transgender;Women and Girls;Athletics and Sports;Discrimination;Swimming;College Athletics;Law and Legislation;Thomas, Lia (1999- );Nuclear Weapons;Books and Literature;Walking;Urban Areas;Censorship"
74,The magazine’s Ethicist columnist on the fairness of selling a scarce good at an exorbitant price.,"My sister was lucky enough to get six tickets to the Taylor Swift concert in New Jersey for face value ($130) through Ticketmaster Verified Fans. She is using three of them for me, herself and my megafan daughter, and then decided recently to sell the remaining three. She looked at ticket prices online and seats in our section were being offered for around $3,000 each, plus the $900 in fees added on the last page of checkout.",2023-07-05T15:19:52+0000,article,Magazine,News,Can I Resell My Taylor Swift Concert Tickets for Thousands of Dollars?,"internal-sub-only-nl;Ethics (Personal);Ticket Scalping;Prices (Fares, Fees and Rates)"
75,"The shooting, which left four dead and seven wounded, was one of several in multiple cities since Friday.","As the long Fourth of July weekend drew to a close, a final spasm of gun violence close to midnight left four people dead and seven others wounded at an outdoor party in Shreveport, La., following earlier shootings in Philadelphia, Baltimore, Fort Worth and other cities.",2023-07-05T15:21:28+0000,article,U.S.,News,Deadly Louisiana Shooting Caps a Holiday Weekend of Violence,Mass Shootings;Shreveport (La);Independence Day (US) (July 4)
76,Laura Trethewey’s “The Deepest Map” explores the new world of oceanic exploration — and its dangers.,"In the past days, the world has been riveted by the story of the Titan submersible, which we now know imploded some 1,600 feet from the wreckage of the Titanic, killing all aboard. Beyond the human tragedy — and the macabre fact that James Cameron’s blockbuster is trending online — comes an opportunity for serious reflection.",2023-07-05T16:00:14+0000,article,Books,Review,In Too Deep,"Books and Literature;Oceans and Seas;Maps;Philanthropy;Submarines and Submersibles;Metals and Minerals;Mines and Mining;Maritime Accidents and Safety;Trethewey, Laura"
77,"General Motors, Toyota and other automakers sold more trucks and sport utility vehicles as supply chain problems eased and demand remained strong despite rising interest rates.","Some of the country’s biggest automakers reported big sales increases for the second quarter on Wednesday, the strongest sign yet that the auto industry was bouncing back from parts shortages and overcoming the effects of higher interest rates.",2023-07-05T16:02:42+0000,article,Business Day,News,New Car Sales Jumped in the Second Quarter,"General Motors;Company Reports;Automobiles;Electric and Hybrid Vehicles;Production;Stocks and Bonds;Prices (Fares, Fees and Rates);United States Economy;Shortages;Sports Utility Vehicles and Light Trucks;Supply Chain;Interest Rates;Stellantis NV;Rivian Automotive LLC;Tesla Motors Inc;Toyota Motor Corp"
78,"The proposed package foresees spending about 6 percent less in 2024 from this year, in a return to financial austerity. But the severity of the cuts to social services drew sharp criticism.","Germany plans to slash social benefits and rein in government debt but increase the amount spent on the military in 2024, according to a federal budget approved Wednesday by the government of Chancellor Olaf Scholz.",2023-07-05T16:05:53+0000,article,Business Day,News,"German Government Slashes Spending, Except on the Military","Politics and Government;Defense and Military Forces;Scholz, Olaf (1958- );Germany;North Atlantic Treaty Organization"
79,Defense Secretary Lloyd J. Austin ordered the assessment after accusations that an Air National Guardsman disclosed sensitive information.,"The Pentagon’s security and oversight measures have failed to keep pace with the proliferation of military facilities that handle classified information and the personnel who work there, but the Defense Department does not have a systemic problem in keeping its secrets secret, a new review made public on Wednesday concludes.",2023-07-05T16:09:54+0000,article,U.S.,News,Pentagon Review Faults Oversight of Classified Information,"US Intelligence Documents Leak (2023);Classified Information and State Secrets;United States Defense and Military Forces;AIR NATIONAL GUARD;Austin, Lloyd J III;Teixeira, Jack"
80,"An assailant dressed in a ski mask and body armor killed five people and injured two others, the authorities said, in what officials are treating as a random attack.","An attacker using a military-style rifle killed five people and injured two children during a shooting spree in a Philadelphia neighborhood on Monday, firing shots on the open street and bringing terror to passers-by before being caught by the police. Officials said they are treating the shooting as a random attack.",2023-07-05T16:18:17+0000,article,U.S.,News,Mass Shooting in Philadelphia: What to Know,"Mass Shootings;Murders, Attempted Murders and Homicides;Krasner, Larry (1961- );Philadelphia (Pa)"
81,"While this one was purely ceremonial, it offered the king a chance to mend fences with a nation that is not hugely enamored of him or the monarchy.","For most royals, one coronation would be enough.",2023-07-05T16:33:01+0000,article,World,News,"With the Stone of Destiny and Mary’s Crown, Scotland Names Charles King","Royal Families;Buckingham Palace;Scottish National Party;Charles III, King of the United Kingdom;Camilla, Queen Consort of the United Kingdom;Sturgeon, Nicola;Edinburgh (Scotland);Scotland;Great Britain"
