,abstract,lead_paragraph,pub_date,document_type,section_name,type_of_material,headline,keywords
43,"Thanks to a series of pivoting panels, the home can be reconfigured for remote work or parties: “We only have one door, and that’s our front door.”","Thanks to a series of pivoting panels, the home can be reconfigured for remote work or parties: “We only have one door, and that’s our front door.”",2023-11-28T10:02:45+0000,multimedia,Real Estate,Slideshow,A Convertible Apartment in Geneva,Real Estate and Housing (Residential);Interior Design and Furnishings;Restoration and Renovation;Home Repairs and Improvements;Design;ARCHITECTURE;Geneva (Switzerland);Content Type: Service
44,"Thanks to a series of pivoting panels, the Geneva apartment can be reconfigured for remote work or parties: “We only have one door, and that’s our front door.”","As their careers took them to various cities in Europe, the United States and Asia, Stef Claes and Michiel De Meulemeester, who are both Belgian, were used to leasing whatever lackluster apartments they could find. But when Mr. Claes, an architect, and Mr. De Meulemeester, a business executive who manages Mr. Claes’s firm, settled down in Geneva, they began thinking about creating a more appealing home.",2023-11-28T10:02:48+0000,article,Real Estate,News,A Swiss Home So Well Designed It Needs Just One Door,Real Estate and Housing (Residential);Interior Design and Furnishings;Home Repairs and Improvements;Restoration and Renovation;ARCHITECTURE;Geneva (Switzerland);Design;Content Type: Service
45,"The piece evokes a 1938 interlocking gold cuff designed by the house’s then creative director, Jeanne Toussaint.","In 1847, Louis-François Cartier opened a modest jewelry workshop in Paris where he sold crystal bracelets, strands of pearls and brooches with floral motifs. Over the decades, his three grandsons, particularly the eldest, Louis Cartier, became known for mixing Old World craftsmanship and new techniques, as in the 1904 Santos pilot’s watch, named for a pioneering Brazilian aviator and decorated with tiny screws resembling airplane rivets; or the so-called mystery clock, a timepiece popularized by the brand in 1912 with jeweled hands that appeared to float (its rack-and-pinion gear system was hidden in the base).",2023-11-28T10:03:18+0000,article,T Magazine,News,A Cartier Ring Inspired by the Work of a 20th-Century Style Icon,"Cartier SA;Jewels and Jewelry;Fashion and Apparel;Toussaint, Jeanne"
46,"Tens of thousands of Gazans are making the most difficult of choices, leaving their homes behind to survive.",Follow live news updates on the Israel-Hamas war.,2023-11-28T10:12:02+0000,article,World,News,"Fearful, Humiliated and Desperate: Gazans Heading South Face Horrors",Israel-Gaza War (2023- );Israel;Defense and Military Forces;Gaza Strip;Palestinians;Civilian Casualties;Refugees and Displaced Persons;Hamas;Jabaliya Refugee Camp (Gaza Strip);Khan Younis (Gaza Strip)
47,The philanthropy will add to its ongoing initiative to tell diverse stories with new monuments in public spaces over the next five years.,"Since 2020, the Andrew W. Mellon Foundation has spent nearly $173 million on 80 completed or ongoing monument projects across 37 states, supporting a broader and more diverse range of stories in the nation’s public spaces. On Tuesday, the arts and humanities philanthropy announced it would double its original commitment of $250 million over the next five years, pledging a total of $500 million for its Monuments Project.",2023-11-28T10:30:16+0000,article,Arts,News,"Mellon Foundation Doubles Funding for U.S. Monuments, Pledging a Total $500 Million","Black People;Blacks;Philanthropy;Monuments and Memorials (Structures);Mellon Foundation;Monument Lab (Philadelphia, Pa, Public Art Studio);Washington National Cathedral;Alexander, Elizabeth (1962- );Gates, Theaster"
48,"After repeated mechanical setbacks, the operation turned to trained miners using manual tools to clear the final stretch of debris.","After a 17-day effort to free dozens of Indian construction workers trapped inside a Himalayan road tunnel, rescuers finally cleared a path through debris on Tuesday and pulled the men out, ending an excruciating wait for the workers and their families.",2023-11-28T10:35:45+0000,article,World,News,"After More Than 2 Weeks, Rescue Arrives for Workers Trapped in Indian Tunnel",Accidents and Safety;Bridges and Tunnels;Landslides and Mudslides;Rescues;Uttarakhand (India)
49,"The decision means that the journalist, Evan Gershkovich, who has denied the espionage charge against him, will remain in custody until Jan. 30.","A Moscow court on Tuesday extended the pretrial detention of Evan Gershkovich, an American reporter for The Wall Street Journal who has been held in Russia for nearly eight months on an espionage charge that he, his newspaper and the U.S. government vehemently reject.",2023-11-28T10:45:14+0000,article,World,News,Russian Court Extends Detention of American Reporter,"International Relations;Freedom of the Press;Gershkovich, Evan;Griner, Brittney;United States International Relations;Russia;Moscow (Russia);United States;Wall Street Journal"
50,"Plus, how money is flowing out of China and scientists are one step closer to a drug extending the lives of dogs.","The New York Times Audio app is home to journalism and storytelling, and provides news, depth and serendipity. If you haven’t already, download it here — it’s available to Times news subscribers on iOS — and sign up for our weekly newsletter.",2023-11-28T11:00:09+0000,article,Podcasts,News,"Israel-Hamas Truce Appears to Enter Another Day, and More",Peace Process;United States Politics and Government;Drugs (Pharmaceuticals);International Relations;Pets;Hamas;Israel;Israel-Gaza War (2023- );China
51,"William J. Burns, the C.I.A. head, and David Barnea, who leads the Mossad, Israel’s spy service, are scheduled to meet with officials in Qatar, which has been mediating talks between Israel and Hamas.","William J. Burns, the C.I.A. director, arrived in Doha, Qatar, on Tuesday for a new round of negotiations aimed at freeing more hostages held in Gaza, according to U.S. officials.",2023-11-28T11:00:10+0000,article,U.S.,News,C.I.A. Director Arrives in Qatar for Talks on Hostage Releases,"Israel-Gaza War (2023- );Kidnapping and Hostages;United States International Relations;Palestinians;Biden, Joseph R Jr;Burns, William J;Doha (Qatar);Israel;Gaza Strip"
52,How a grass-roots campaign for the return of hostages managed to pause the war in Gaza.,"Hostages are at the heart of the fragile cease-fire between Israel and Hamas, now in its fifth day. As of Monday night, 50 Israeli hostages had been released, as had 150 Palestinian prisoners. More releases were expected on Tuesday, under what Qatari mediators said was a deal to extend the cease-fire by two days.",2023-11-28T11:00:10+0000,article,Podcasts,News,Israel and Hamas’s Fragile Cease-Fire,"audio-neutral-informative;Israel-Gaza War (2023- );Peace Process;Terrorism;Amnesties, Commutations and Pardons;Defense and Military Forces;Palestinians;Politics and Government;Humanitarian Aid;International Relations;Kidnapping and Hostages;Hamas;Gaza Strip;Israel;Jerusalem (Israel)"
53,"Speaking on a podcast this week, the director said Paul McCartney and Elton John will appear in the film, among other real musical stars.","The director Rob Reiner has said that an upcoming sequel to his 1984 documentary parody “This Is Spinal Tap” is scheduled to begin shooting in late February and will feature Paul McCartney, Elton John and Garth Brooks, among other stars.",2023-11-28T11:30:09+0000,article,Movies,News,Rob Reiner Teases Details of ‘Spinal Tap’ Sequel,"Movies;This Is Spinal Tap (Movie);Comedy and Humor;Pop and Rock Music;Reiner, Rob"
54,Israel’s leaders have big reasons to extend the temporary cease-fire — and big reasons to resume fighting.,Israel and Hamas have extended their truce for two days — through tomorrow — which will bring the pause in fighting to six days. The deal is a sign that both sides have benefited from it.,2023-11-28T11:55:48+0000,article,Briefing,briefing,A Strategic Dilemma,internal-storyline-no
55,"Chancellor Olaf Scholz pledged financial support for economic modernization and Ukraine, but will need backing for new borrowing to fill a spending gap.","Chancellor Olaf Scholz urged lawmakers on Tuesday to override Germany’s borrowing limits for a fourth consecutive year, allowing his government to take on billions of euros in fresh debt to modernize his country’s economy despite a budget crisis triggered by a constitutional court ruling.",2023-11-28T12:02:52+0000,article,World,News,"Germany to Override Debt Limit, Again, to Resolve Budget Crisis","Germany;Scholz, Olaf (1958- );Politics and Government;Economic Conditions and Trends;Budgets and Budgeting;Defense and Military Forces;Christian Democratic Union (Germany);Social Democratic Party (Germany);Ukraine"
56,"The fast-fashion giant is betting it can break the logjam of underperforming new listings, even as it continues to draw scrutiny from Washington.","In filing confidentially for an initial public offering, Shein, the ultrafast-fashion retailer, is showing ambition on two fronts.",2023-11-28T12:43:26+0000,article,Business Day,News,Shein’s Big I.P.O. Test,"internal-storyline-no;Shein (Fashion Label);Initial Public Offerings;Xinjiang (China);Forced Labor;Start-ups;Birkenstock Footprint Sandals;ARM Holdings PLC;Instacart;Reddit Inc;Rubio, Marco"
57,Have you been paying attention to the news recently? See how many of these 11 questions you can get right.,Have you been paying attention to the news recently? See how many of these 11 questions you can get right.,2023-11-28T13:15:29+0000,multimedia,The Learning Network,Interactive Feature,"Weekly Student News Quiz: Cease Fire, Sam Altman, C.T.E.",
58,These new works of fiction and nonfiction vividly render the state’s past and present.,"Believe it or not, the end of 2023 is approaching.",2023-11-28T14:00:10+0000,article,U.S.,briefing,The 10 Best California Books of 2023,California
59,The staff of The New York Times Book Review choose the year’s standout fiction and nonfiction.,"Every year, starting in the spring, we spend months debating the most exceptional books that pass across our desks: the families we grow to love, the narrative nonfiction that carries us away, the fictional universes we can’t forget. It’s all toward one goal — deciding the best books of the year.",2023-11-28T14:01:53+0000,article,Books,News,The 10 Best Books of 2023,"Books and Literature;Two Thousand Twenty Three;Adjei-Brenyah, Nana Kwame;de Kerangal, Maylis (1967- );Evangelista, Patricia (1985- );Smith, Zadie;Murray, Paul (1975- );Rosen, Jonathan (Author);Woo, Ilyon;Fire Weather: A True Story from a Hotter World (Book);The Bee Sting: A Novel (Book);Eastbound (Book);The Best Minds: A Story of Friendship, Madness, and the Tragedy of Good Intentions (Book);Chain Gang All Stars (Book);Mason, Daniel;North Woods (Book);Some People Need Killing: A Memoir of Murder in My Country (Book);Bottoms Up and the Devil Laughs: A Journey Through the Deep State (Book);Howley, Kerry;Vaillant, John;The Fraud (Book)"
60,Three New York Times Book Review editors share books from the “Best Books of 2023” list.,Three New York Times Book Review editors share books from the “Best Books of 2023” list.,2023-11-28T14:02:15+0000,multimedia,Books,Video,Inside Our List,Books and Literature
61,"Corrections that appeared in print on Tuesday, Nov. 28, 2023.","A photo with an article on Monday about congressional retirements was published in error. The image of Carl Wilson, a former member of the Oregon House of Representatives, was included where an image of Representative Earl Blumenauer should have appeared.",2023-11-28T14:23:06+0000,article,Corrections,News,"Corrections: Nov. 28, 2023",
62,The support will give Ms. Haley more organizational strength in the field as she battles Gov. Ron DeSantis of Florida for the No. 2 spot in the Republican presidential race.,"The political network founded by the billionaire industrialist brothers Charles and David Koch has endorsed Nikki Haley in the Republican presidential nominating contest, giving her organizational muscle and financial heft as she battles Gov. Ron DeSantis of Florida to be the top rival to former President Donald J. Trump.",2023-11-28T14:27:35+0000,article,U.S.,News,Koch Network Endorses Nikki Haley in Bid to Push G.O.P. Past Trump,"Haley, Nikki R;Presidential Election of 2024;Primaries and Caucuses;Republican Party;Endorsements;Campaign Finance;Political Action Committees;Americans for Prosperity;Koch, Charles G;Koch, David H;United States Politics and Government;DeSantis, Ron;Trump, Donald J"
63,"Battle, the artistic director who brought Alvin Ailey American Dance Theater into a new century, resigned just before the company’s new City Center season.","When Alvin Ailey American Dance Theater opens its annual season at New York City Center on Wednesday, it will be missing an important person: Robert Battle, the company’s jovial artistic director.",2023-11-28T14:43:44+0000,article,Arts,News,Robert Battle Had a Wide Vision of What Alvin Ailey Could Be,"Dancing;Ailey, Alvin, American Dance Theater;Battle, Robert;Appointments and Executive Changes;Content Type: Personal Profile"
64,All 10 skaters on the ice got a game misconduct in the Senators-Panthers game on Monday night in Ottawa.,"Hockey is one of the most physical sports, and referees try to keep it in line by assessing penalties when a push or a trip goes too far. But on Monday night in Ottawa, the officials had enough.",2023-11-28T15:00:17+0000,article,Sports,News,Everybody’s Ejected After an N.H.L. Fight,"Hockey, Ice;Officiating (Sports);Florida Panthers;Ottawa Senators"
65,"Marianna Budanova, whose husband is the director of military intelligence, is recovering in a hospital, the officials said. Her husband has long accused Russia of trying to kill him.","The wife of Ukraine’s military intelligence chief has been poisoned and is recovering in a hospital, Ukrainian intelligence officials said on Tuesday, an incident that has led to widespread speculation that Russia was stepping up efforts to target Ukraine’s senior leadership.",2023-11-28T15:02:47+0000,article,World,News,"Wife of Ukraine’s Spy Chief Was Poisoned, Officials Say","Russian Invasion of Ukraine (2022);Ukraine;Budanov, Kyrylo;Assassinations and Attempted Assassinations;Poisoning and Poisons;Espionage and Intelligence Services;Politics and Government;International Relations;Russia"
66,"The Republican chairman of the Oversight Committee quickly rejected the offer, saying the president’s son must first provide testimony behind closed doors.","Hunter Biden, the president’s son, who is the subject of an investigation by House Republicans into his family, told Congress on Tuesday that he was willing to testify — but only publicly so that Republicans cannot twist or selectively leak what he says.",2023-11-28T15:25:05+0000,article,U.S.,News,"Hunter Biden Offers to Testify in House Inquiry, but Only in Public","United States Politics and Government;Foreign Investments;Ethics and Official Misconduct;House Committee on Oversight and Government Reform;Biden, Hunter;Republican Party;Biden, James Brian;Comer, James R;Ukraine;China"
67,"Continued American funding for Ukraine was a key concern for leaders in the military alliance, who met as the current allocation was running down and a Ukrainian counteroffensive appeared stalled.","With Republicans in Congress stalling on granting Ukraine more military aid, NATO’s top diplomat warned on Tuesday that it would be “dangerous” to curtail support to the war, as member countries tried to pin down the United States on its commitments to Kyiv and as the conflict in Gaza sapped Washington’s attention.",2023-11-28T15:32:01+0000,article,World,News,NATO Leaders Try to Pin Down U.S. on Ukraine Aid as Republicans Waver,International Relations;United States Politics and Government;North Atlantic Treaty Organization;House of Representatives;Kurdistan Workers' Party;Europe
68,The former president’s lawyers in his federal trial on charges of trying to overturn the election are asking to collect a wide range of evidence — including on unrelated issues like Hunter Biden.,Lawyers for former President Donald J. Trump said in court papers that they planned to question the findings of several government agencies that the 2020 election was conducted fairly as part of their efforts to defend Mr. Trump against federal charges that he sought to overturn the results of the race.,2023-11-28T15:34:51+0000,article,U.S.,News,Trump Seeks to Use Trial to Challenge Findings That 2020 Election Was Fair,"Federal Criminal Case Against Trump (2020 Election Case);Presidential Election of 2024;Presidential Election of 2020;Voter Fraud (Election Fraud);Rumors and Misinformation;Federal Bureau of Investigation;Trump, Donald J;Justice Department;Smith, Jack (Attorney);Chutkan, Tanya S;Biden, Joseph R Jr;Biden, Hunter;United States Politics and Government"
69,"A leaked document has talking points for the president of the United Nations climate conference, who is an oil executive in the United Arab Emirates, to advance oil and gas deals.","As the host of global climate talks that begin this week, the United Arab Emirates is expected to play a central role in forging an agreement to move the world more rapidly away from coal, oil and gas.",2023-11-28T15:44:18+0000,article,Climate,News,Files Suggest Climate Summit’s Leader Is Using Event to Promote Fossil Fuels,"United Nations Framework Convention on Climate Change;Global Warming;Oil (Petroleum) and Gasoline;Natural Gas;Abu Dhabi National Oil Co (ADNOC);Al Jaber, Sultan (1973- );United Nations;United Arab Emirates;Lobbying and Lobbyists;Politics and Government"
70,They’re here!,"It’s that time of year: After months of reading, arguing and (sometimes) happily agreeing, the Book Review’s editors have come up with their picks for the 10 Best Books of 2023. On this week’s podcast, Gilbert Cruz reveals the chosen titles — five fiction, five nonfiction — and talks with some of the editors who participated in the process.",2023-11-28T15:46:27+0000,article,Books,News,Talking About the 10 Best Books of 2023,Books and Literature
71,A Toronto teenager who killed a woman in a massage business was sentenced on Tuesday to life in prison. The case was the first time gender-based violence in the country was labeled terrorism.,The teenager was lying next to his bloodied sword when the police captured him outside a Toronto massage business where one woman had been stabbed to death and another seriously injured.,2023-11-28T15:46:40+0000,article,World,News,"In Canada, a Judge Sentences an Incel Killer as a Terrorist","Terrorism;Decisions and Verdicts;Murders, Attempted Murders and Homicides;Women and Girls;Hate Crimes;Carleton University;University of British Columbia;Canada"
72,"A New Hampshire couple was quite happy when a rare N.C. Wyeth work they stumbled upon sold for so much at auction. But when the buyer reneged, the sale and their vacation dreams were undone.","To Tracy Donahue, the whole thing had felt like winning the lottery. And in a sense, she and her husband, Tom, had.",2023-11-28T16:00:08+0000,article,Arts,News,"Did That $4 Thrift Shop Painting Really Sell for $191,000? Nope.","Art;Auctions;Thrift Shops;Bonhams 1793 Ltd;New Hampshire;Wyeth, Andrew;internal-storyline-no"
73,Soba noodles in ginger broth and jerk chicken meatballs are satisfying swerves from the creamy casseroles and slow bakes of Thanksgiving.,"Hello, fellow home cooks. Genevieve here, filling in for Emily in the post-Thanksgiving, pre-holidays quiet.",2023-11-28T16:00:21+0000,article,Food,News,Bold Flavors in Fast Dishes,Cooking and Cookbooks;Content Type: Service;Recipes
74,"After sparring twice with Sean Hannity, Gov. Gavin Newsom of California will jump into the ring this week with Gov. Ron DeSantis of Florida. The stakes are high for both men.",Gavin Newsom has a scant history of tough debates over his two decades as governor and lieutenant governor of California and mayor of San Francisco.,2023-11-28T16:00:34+0000,article,U.S.,News,Gavin Newsom Wants Fox News Viewers to Hear Him Out,"Newsom, Gavin;DeSantis, Ron;Debates (Political);Presidential Election of 2024;Democratic Party;Republican Party;Primaries and Caucuses;Hannity, Sean;Trump, Donald J;Television;News and News Media;United States Politics and Government;California;Florida"
75,"The author of “The Jemima Code” has distilled 200 years of African American drinking know-how into her new “Juke Joints, Jazz Clubs and Juice.”","While many in the world of cocktails are familiar with Tom Bullock, renowned for his juleps and long considered the first African American bartender to publish a cocktail manual, fewer know the work of Atholene Peyton, a home economics teacher whose 1906 “Peytonia Cook Book” predated Bullock’s by a decade.",2023-11-28T16:18:05+0000,article,Food,News,"For Her Next Round, Toni Tipton-Martin Orders Up a Book of Cocktails","Books and Literature;Juke Joints, Jazz Clubs and Juice: Cocktails From Two Centuries of African American Cookbooks (Book);Tipton-Martin, Toni;Black People;Blacks;Cocktails and Mixed Drinks;Alcoholic Beverages;Cooking and Cookbooks;United States"
76,"The unusual event, between a Republican presidential candidate and a high-profile Democratic governor who has been a surrogate for the Biden administration, will be moderated by Sean Hannity.","Fox News will host a 90-minute debate between Gov. Ron DeSantis of Florida and Gov. Gavin Newsom of California, starting at 9 p.m. Eastern time on Thursday.",2023-11-28T16:37:27+0000,article,U.S.,News,How to Watch the DeSantis-Newsom Debate,"DeSantis, Ron;Newsom, Gavin;Fox News Channel;Republican Party;Presidential Election of 2024;United States Politics and Government;Debates (Political)"
77,"Helped by its millennial-pink hue and the rise of the charcuterie board, the Italian specialty is winning a new fan base of American chefs and consumers.","By the standards of Bologna, Simona Scapin is a mortadella upstart. That’s not only because she’s young and the sole local producer of certified organic mortadella. Nor is it just because her family has been making mortadella for a mere four decades in the city where the recipe was ordained by papal authority in 1661.",2023-11-28T16:44:55+0000,article,Food,News,How Mortadella Went From Cold Cut to Hot Item,Cooking and Cookbooks;Restaurants;Butchers and Butchering;Meat;Italian Food (Cuisine)
78,"Last time the top jobs at some of the country’s most prestigious art institutions came up, many went to foreign candidates. This time, that’s unlikely.","For the past several weeks, dozens of candidates have been facing a five-person committee in a dark, book-lined room at Italy’s Culture Ministry, hoping to convince the panel that they should be selected to direct some of Italy’s top museums, including the Uffizi in Florence, the Capodimonte in Naples, the Brera in Milan and seven others.",2023-11-28T16:46:02+0000,article,Arts,News,"Italy Searches for Museum Leaders, With Nationalism in the Air","Italy;Museums;Art;Appointments and Executive Changes;Politics and Government;Ministry of Cultural Heritage and Tourism (Italy);Capodimonte Museum;Uffizi Gallery;Brera Museum (Milan, Italy);Nationalism (Theory and Philosophy)"
79,"Responses to a Page 1 investigation. Also: An Oct. 7 observation; President Biden and the Israel-Gaza war; father, son and Jan. 6; planet Earth’s survival.",To the Editor:,2023-11-28T16:53:26+0000,article,Opinion,Letter,Helping Homeless People Who Are Mentally Ill,"Homeless Persons;Public and Subsidized Housing;Mental Health and Disorders;New York City;Coalition for the Homeless;Friedman, Thomas L;Israel-Gaza War (2023- );Israel;Hamas;Biden, Joseph R Jr;United States Politics and Government;Storming of the US Capitol (Jan, 2021);Mock, Brian (1979- );Mock, AJ (2002- );Earth"
80,"Nearly 50 Jewish actors, playwrights and directors gathered at Broadway’s Lyceum Theater in September for T’s group portrait and reflected on what Jewish theater means to them.","Nearly 50 Jewish actors, playwrights and directors gathered at Broadway’s Lyceum Theater in September for T’s group portrait and reflected on what Jewish theater means to them.",2023-11-28T17:01:50+0000,multimedia,T Magazine,Video,The Stage Is Ours,
81,Amazon has been racing to shake off the perception that it is lagging in the push to take advantage of artificial intelligence.,"OpenAI has ChatGPT. Google has the Bard chatbot. Microsoft has its Copilots. On Tuesday, Amazon joined the chatbot race and announced an artificial intelligence assistant of its own: Amazon Q.",2023-11-28T17:34:51+0000,article,Technology,News,"Amazon Introduces Q, an A.I. Chatbot for Companies",Amazon.com Inc;Artificial Intelligence;Computers and the Internet;Cloud Computing;ChatGPT
82,"After a city crackdown this summer, the vendors of Corona Plaza in Queens will return with far fewer stalls and hopes to expand.","Four months after New York City disbanded a celebrated but largely illegal street market in Queens that had exploded in popularity during the pandemic, the vendors are expected to return this week with far fewer stalls and, for now, none of the food that brought them acclaim.",2023-11-28T17:44:04+0000,article,New York,News,"A Celebrated Street Food Market Will Return, in a Diminished State","Food Trucks and Vendors;Street Vendor Project;Corona (Queens, NY);Corona Plaza (Queens, NY);New York City"
