,abstract,lead_paragraph,pub_date,document_type,section_name,type_of_material,headline,keywords
0,"Kim Kardashian hosted the shunned socialite to her birthday party, then posted the photos for her 364 million followers.","Over the weekend, something happened to Ivanka Trump that hasn’t occurred since before her father was elected president: Celebrities were willing to be seen with her.",2023-10-25T00:06:29+0000,article,Style,News,Who Invited Ivanka?,"Kardashian, Kim;Trump, Ivanka;Parties (Social);Celebrities"
1,"The Department of Investigation inquiry focuses on a violent exchange that the adviser, Timothy Pearson, had with security guards at a migrant shelter.","One of Mayor Eric Adams’s closest advisers is being formally investigated over a violent incident at a Manhattan migrant center, people with knowledge of the matter said on Tuesday.",2023-10-25T00:23:59+0000,article,New York,News,Top Adviser to Mayor Adams Is Being Investigated Over Altercation,"Pearson, Timothy;Adams, Eric L;Department of Investigation (NYC);Ethics and Official Misconduct;Guards;Manhattan (NYC);New York City"
2,The playwright Renae Simone Jarrett makes her professional stage debut with a surreal reworking of a Greek myth about a river nymph.,"A crying baby pulled from a kitchen cabinet, a woman abruptly exiting a house via a window and a banged-up finger that turns into bark: The new play “Daphne” is chock-full of magical surprises and mystical transformations, but its surreal elements leave the audience with too many unanswered questions.",2023-10-25T00:24:21+0000,article,Theater,Review,"Review: In ‘Daphne,’ Remaking a Myth, With Mixed Results","Theater (Off Broadway);Theater;Lincoln Center Theater;Batchelor, Jasmine;Lorrain, Naomi;McQuail, Keilly;Daphne (Play);Jarrett, Renae Simone;Hughes, Sarah (Theater Director);LCT3"
3,American intelligence agencies released no new declassified imagery or other new evidence to make their case. Officials said their strengthened assessment was based on video evidence.,"American intelligence officials said Tuesday they now had “high confidence” that the blast at Al-Ahli Arab Hospital in Gaza last week was the result of a Palestinian rocket that broke up mid-flight, and that no Israeli weapon was involved in the explosion.",2023-10-25T00:38:17+0000,article,U.S.,News,U.S. Cites ‘High Confidence’ That Palestinian Rocket Caused Hospital Blast,Israel-Gaza War (2023- );Israel;Hospitals;Al Ahli Arab Hospital (Gaza Strip);Civilian Casualties;Gaza Strip;Hamas;Palestinian Islamic Jihad;Palestinians
4,"Quotation of the Day for Wednesday, October 25, 2023.","“If you’re going to sell a store-branded apple cinnamon ice cream, it had better be the best apple cinnamon ice cream you’ve ever had.”",2023-10-25T01:10:29+0000,article,Corrections,Quote,Quotation of the Day: Those Doritos Too Expensive? Stores Offer Their Own Version.,
5,"Corrections that appeared in print on Wednesday, Oct. 25, 2023.","An article on Tuesday about Gov. Gavin Newsom’s efforts to export California’s climate policies misstated the share of jobs linked to oil drilling in California. It is 0.2 percent, not 2 percent.",2023-10-25T01:11:00+0000,article,Corrections,Correction,"Corrections: Oct. 25, 2023",
6,"While indelibly tied to the role that made him famous in 1971, he remained active for more than four decades afterward.","Richard Roundtree, the actor who redefined African American masculinity in the movies when he played the title role in “Shaft,” one of the first Black action heroes, died on Tuesday at his home in Los Angeles. He was 81.",2023-10-25T01:51:01+0000,article,Movies,Obituary (Obit),"Richard Roundtree, Star of ‘Shaft,’ Is Dead at 81","Roundtree, Richard;Deaths (Obituaries);Shaft (Movie);Actors and Actresses;Movies;Television;Black People;Blacks"
7,Aimee Lucido ensnares our attention.,Jump to: Today’s Theme | Tricky Clues,2023-10-25T02:00:08+0000,article,Crosswords & Games,News,It’s a Must,Crossword Puzzles
8,Health officials have revised their recommendations on which children should receive the new drug.,Pediatricians and parents are having difficulty accessing a new immunization used to prevent severe respiratory syncytial virus infections in infants.,2023-10-25T02:15:02+0000,article,Well,News,An R.S.V. Shot for Infants Is in Short Supply. Here’s What to Know.,Drugs (Pharmaceuticals);Vaccination and Immunization;Babies and Infants;Respiratory Syncytial Virus (RSV);Shortages;Sanofi SA;Centers for Disease Control and Prevention;AstraZeneca PLC;AMERICAN ACADEMY OF PEDIATRICS
9,"A widely cited missile video does not shed light on what happened, a Times analysis concludes.","The video shows a projectile streaking through the darkened skies over Gaza and exploding in the air. Seconds later, another explosion is seen on the ground.",2023-10-25T03:06:07+0000,article,World,News,A Close Look at Some Key Evidence in the Gaza Hospital Blast,Israel-Gaza War (2023- );Israel;Al Ahli Arab Hospital (Gaza Strip);Civilian Casualties;Palestinians;Hospitals;Defense and Military Forces;Missiles and Missile Defense Systems;Gaza Strip;Hamas;Palestinian Islamic Jihad;Terrorism;your-feed-visual-investigations;vis-video
10,"Some women participating in a conference on sensitive church issues said they feel heartened by the discussions taking place, though change may remain slow.","When Helena Jeppesen-Spuhler, an advocate for the ordination of women, joined a major Vatican meeting this month, she was skeptical that an institution dominated by men for 2,000 years was ready to listen to women like her.",2023-10-25T04:01:09+0000,article,World,News,Women Will Vote at a Vatican Meeting for the First Time,"Priests;Cardinals (Roman Catholic Prelates);Discrimination;Nuns;Women's Rights;Women and Girls;Roman Catholic Church;Francis;Becquart, Nathalie"
11,The U.N. calls for a cease-fire in Israel and Gaza.,"The United Nations secretary general, António Guterres, called yesterday for a humanitarian cease-fire in Israel and Gaza in an address to the U.N. Security Council. He said that the attacks by Hamas that had left 1,400 people dead in Israel on Oct. 7 were “appalling” but that they did not justify the “collective punishment” of civilians in the Gaza Strip, where the Israeli military significantly stepped up its bombardment.",2023-10-25T04:05:29+0000,article,Briefing,News,Wednesday Briefing,
12,A sense of fatalism surrounds Britain’s prime minister.,"When Rishi Sunak became prime minister of Britain a year ago, there was little sense of celebration. The markets were in free fall after the disastrous 49-day tenure of his predecessor, Liz Truss, and the government was in disarray. Mr. Sunak, who had been rejected by Conservative Party members earlier in the year, was inserted by lawmakers in the desperate hope he could calm the crisis. Given that the party had just ousted two leaders in quick succession, it was unclear how long he would even stay in the post.",2023-10-25T05:00:09+0000,article,Opinion,Op-Ed,Rishi Sunak Is Trying His Best. He’s Probably Still Doomed.,"Great Britain;Conservative Party (Great Britain);Sunak, Rishi (1980- );Elections;Starmer, Keir;Labour Party (Great Britain)"
13,"“This morning, I didn’t even know who Tom Emmer was,” Kimmel said about a short-lived candidate for House speaker. “Now, I still don’t. I have no idea.”","Welcome to Best of Late Night, a rundown of the previous night’s highlights that lets you sleep — and lets us get paid to watch comedy. Here are the 50 best movies on Netflix right now.",2023-10-25T05:58:30+0000,article,Arts,News,Jimmy Kimmel: ‘Altoids Last Longer Than These Republican Nominees’,"Television;Fallon, Jimmy;Kimmel, Jimmy;Late Night with Seth Meyers (TV Program);Late Show with Stephen Colbert (TV Program);The Tonight Show (TV Program);Jimmy Kimmel Live (TV Program);Colbert, Stephen;Meyers, Seth;The Daily Show with Trevor Noah (TV Program)"
14,This word has appeared in 48 articles on NYTimes.com in the past year. Can you use it in a sentence?,"The word mélange has appeared in 48 articles on NYTimes.com in the past year, including on March 21 in “Matthew Macfadyen Has Mixed Feelings About the End of ‘Succession’” by Sarah Lyall:",2023-10-25T06:00:02+0000,article,The Learning Network,News,Word of the Day: mélange,
15,In case you need some puzzle help.,"Welcome to The Wordle Review. Be warned: This page contains spoilers for today’s puzzle. Solve Wordle first, or scroll at your own risk.",2023-10-25T07:00:02+0000,article,Crosswords & Games,News,Today’s Wordle Review,Wordle (Puzzle)
16,Feeling stuck on today’s puzzle? We can help.,"WEDNESDAY — Hi busy bees! Welcome to today’s Spelling Bee forum. There are a number of terms that appear in both this article and other online discussions of the Spelling Bee; a glossary of those terms compiled by Monicat, a Times reader, can be found below.",2023-10-25T07:00:04+0000,article,Crosswords & Games,News,Spelling Bee Forum,Spelling Bee (Game)
17,"Wyna Liu, Connections editor, answered reader questions about the game in the comments section of this article.","Editor’s note: Wyna Liu,  Connections editor, answered reader questions about the game in the comments section of this article. Read the conversation here.",2023-10-25T07:00:08+0000,article,Crosswords & Games,News,The Connections Companion,Crossword Puzzles;Connections (Game)
18,A new plan unveiled this month aims to make way for new housing and ease the pressures that drive up rents and home prices. Whether it will work is less clear.,"Last month, Mayor Eric Adams unveiled a big plan to tackle New York City’s housing shortage and make the city more affordable.",2023-10-25T07:00:12+0000,article,New York,News,New York City Has a Bold Plan to Fix Its Housing Crisis. Will It Work?,"Zoning;Real Estate and Housing (Residential);Affordable Housing;State Legislatures;City Council (NYC);Adams, Eric L;New York City"
19,The Times’s Food team has eaten its way through cities across the country so you don’t have to … but we highly recommend you do.,"In 2021, when patrons were wary but excited to return to restaurants after long Covid-19 shutdowns, the Food section at The New York Times published its first national restaurant list. After months of visiting hallowed establishments and plucky upstarts across the country, reporters and editors chose the 50 restaurants in the United States they were “most excited about.”",2023-10-25T07:00:17+0000,article,Times Insider,News,Your Guide Through America’s Dining Scene,Restaurants;Food;Los Angeles (Calif);New Orleans (La);Philadelphia (Pa);Seattle (Wash);San Francisco (Calif);United States
20,Would you want to live in a house on the water?,"As sea levels rise and storms worsen, threatening the planet’s coastlines, some architects and developers are looking to “push cities into the water” by creating floating homes and other structures.",2023-10-25T07:00:18+0000,article,The Learning Network,News,Floating Home,
21,"With clothes inspired by Martha Stewart, heritage tools and colorful clogs, the couple behind Gardenheir cater to actual and want-to-be gardeners alike.","Alan Calpe and Christopher Crawford set out to make a shoe for gardeners. But the bulbous clogs they designed for their brand, Gardenheir, quickly found a wider audience after being introduced in 2021.",2023-10-25T07:00:18+0000,article,Style,News,Gifts for Gardeners? They’ve Got Them in Spades.,Gardenheir (Fashion Label);Fashion and Apparel;Gardens and Gardening;Shopping and Retail;Windham (NY)
22,Social media demands that you’re with us or against us.,Social media demands that you’re with us or against us.,2023-10-25T08:50:06+0000,multimedia,Opinion,Video,Pick a Side. Pick a Side. Pick a Side. Now.,Palestinians;Anti-Semitism;Social Media;Jews and Judaism;Bullies;your-feed-opinionvideo
23,"In “The Greatest Capitalist Who Ever Lived,” Ralph Watson McElvenny and Marc Wortman show how Oedipal battles fueled the company’s technological triumphs in the 1960s and beyond.","Thomas J. Watson Jr. seemed, from a young age, to be destined for failure. Born in 1914, he was an angry and often depressed young boy. Neighbors called him “Terrible Tommy.” He barely gained his high school diploma after attending three different schools. His father, Watson Sr., the head of IBM, was a domineering man who subjected his son to a classic combination of emotional distance and cruelty. Watson Jr. responded by becoming a rebel and wastrel.",2023-10-25T09:00:13+0000,article,Books,Review,The Father-Son Struggle That Helped Ensure IBM’s Success,"Books and Literature;Computers and the Internet;Antitrust Laws and Competition Issues;Content Type: Personal Profile;The Greatest Capitalist Who Ever Lived: Tom Watson Jr and the Epic Story of How IBM Created the Digital Age (Book);International Business Machines Corporation;McElvenny, Ralph Watson;Wortman, Marc;Watson, Thomas J Jr;Watson, Thomas J Sr (1874-1956)"
24,"Four terrifying, unnerving picks across television, film and podcast.","It’s the time of year when I tend to push the boundaries of how many scary stories I can stomach. That includes horror movies, but also, true crime offerings that I may have skipped. Of course, with true crime, that self-soothing mantra of “at least it’s not real” doesn’t apply, which makes it all the more haunting. Here are four picks that shook me to my core.",2023-10-25T09:00:28+0000,article,Arts,News,"The Best True Crime to Stream: Stories That Are Very Scary, and Real",Television;Documentary Films and Programs;Crime and Criminals;Podcasts;Beware the Slenderman (Movie);John Wayne Gacy: Devil in Disguise (TV Program);Dr Death (Radio Program);In the Dark (Radio Program)
25,"These underappreciated plants attract a “hungry throng” of beneficial insects. They’re not bad to look at, either.",To see a field of common milkweed in midsummer — a sea of a thousand nodding pink flower heads — you would not imagine that anything could ever stand in the way of the genus Asclepias.,2023-10-25T09:00:57+0000,article,Real Estate,News,"If You Plant Milkweed, They Will Come. (And Not Just the Butterflies.)",Flowers and Plants;Gardens and Gardening;Insects;Butterflies and Moths;Content Type: Service
26,Views of the Empire State Building are being obscured by a new 860-foot luxury tower rising just blocks away. Should New York regulate its skyline?,Sometimes New York’s a downer. I had an appointment the other day near Madison Square Park.,2023-10-25T09:01:06+0000,article,Arts,News,When the Skyscraper You Hate Blocks the Skyscraper You Love,"ARCHITECTURE;Buildings (Structures);Real Estate (Commercial);Empire State Building (Manhattan, NY);Manhattan (NYC);Zoning;Regulation and Deregulation of Industry"
27,"Before creating Five Nights at Freddy’s, whose jump scares will soon target moviegoers, Scott Cawthon was making indie video games like Noah’s Ark and The Pilgrim’s Progress.","Many times, in many ways, for many reasons, the “Five Nights at Freddy’s” movie almost never happened. It always came down to Scott Cawthon.",2023-10-25T09:01:06+0000,article,Arts,News,A Reclusive Horror Designer Pivoted From Religious Games,"Movies;Computer and Video Games;Content Type: Personal Profile;Five Nights at Freddy's (Movie);Five Nights at Freddy's (Video Game);Cawthon, Scott;Tammi, Emma"
28,"The country is in the middle of a cable-car bonanza, much of it driven by the over-the-top developments of the Sun Group, which feature giant Buddhas, ersatz European enclaves and selfie spots galore.","We are inside a glass box of a gondola, part of the longest passenger cable car in the world, flying silently along on a nearly five-mile ride, and some 50 stories above a sapphire sea just off the coast of Phu Quoc Island in southern Vietnam. On this bright March afternoon, hundreds of colorful wooden fishing boats speckle the crystalline water below as we sail toward Hon Thom Island.",2023-10-25T09:01:06+0000,article,Travel,News,"If You Can Take the Cable Car to the Colosseum, You’re in Vietnam",Cable Cars and Trams;Travel and Vacations;Environment;Vietnam;Sun Group
29,"For years, a local businessman paid off officials in exchange for lucrative contracts. The system he exploited has been left largely unchanged.","After a major contracting scandal broke out in Hawaii last year, the mayor of Maui County appeared on television to express outrage and announce a sweeping audit of contracts awarded to a corrupt businessman.",2023-10-25T09:01:07+0000,article,U.S.,News,Hawaii Bribery Scandal Casts a Shadow Over Lahaina’s Ruins,"Government Contracts and Procurement;Bribery and Kickbacks;Choy, Milton;Stant, Stewart Olani;Maui County (Hawaii);Lahaina (Hawaii);Wildfires;Hawaii;Corruption (Institutional);internal-open-access"
30,"A shoving in the subway renewed old fears, even though crime is down underground.",Good morning. It’s Wednesday. We’ll look at why a violent attack last week renewed attention on ways to make subway platforms safer.,2023-10-25T09:01:49+0000,article,New York,briefing,"A New Subway Attack, and New Pressure for Protective Gates","New York City;internal-storyline-no;Subways;Metropolitan Transportation Authority;Adams, Eric L;Manhattan (NYC)"
31,Fan edits — short montages of films and television shows like “Bottoms” and “Succession” set to music — have become a staple of online life.,"By day, Emily McLaughlin pours pumpkin spice lattes as a Starbucks barista. By night, she roams the internet as a self-described “fictional gay-people enthusiast,” tirelessly posting about and promoting her favorite queer movies and television shows.",2023-10-25T09:01:51+0000,article,Style,News,Why Do Fan-Made Trailers Rule the Internet?,"Television;Movies;Fans (Persons);Advertising and Marketing;Bottoms (Movie);Succession (TV Program);The Bear (TV Program);Social Media;Video Recordings, Downloads and Streaming"
32,A primer on how to minimize your risk and know when you’re in the clear after an exposure.,We want to be done with Covid. But the virus isn’t done with us.,2023-10-25T09:01:53+0000,article,Well,News,It’s Covid Season. What Are the New Rules for Staying Safe?,Coronavirus (2019-nCoV);Coronavirus Risks and Safety Concerns;Tests (Medical);Vaccination and Immunization;Quarantines;Masks;Content Type: Service
33,"Support groups formed to help thousands of new widows see a dual role in healing their nation. “Our society was not ready to face such scale of grief,” one widow said.","Maria and her husband, Artem, dreamed of visiting the Grand Canyon. Alyona and Ilya fantasized about building a bar, with a stage for local musicians. Yulia and Oleksandr talked about taking a road trip in the mountains.",2023-10-25T09:01:58+0000,article,World,News,"As Ukraine War Grinds On, Widows Try to See Life After Loss",Russian Invasion of Ukraine (2022);Death and Dying;Grief (Emotion)
34,Open enrollment reminds us how easy it is to lose coverage.,"A few days before New Year’s Eve, an unfamiliar health insurance card for me arrived in the mail. I assumed there must have been an error and called the human resources department of the medical center where I’m employed as a doctor.",2023-10-25T09:02:02+0000,article,Opinion,Op-Ed,It Shouldn’t Be This Easy to Lose Your Health Insurance,Health Insurance and Managed Care;United States
35,"A Times writer says, in the age of TikTok, we need to reassess the rules of engagement. What do you think?","A person stops a stranger on the street to ask a question. Another performs an act of kindness. Another plays a prank. Another makes fun of someone without the person knowing. All of these interactions are recorded and then posted online, without the consent of the subject.",2023-10-25T09:02:07+0000,article,The Learning Network,News,Is It Ever OK to Use Strangers as Content for Social Media?,
36,"For their adaptation of “Sabbath’s Theater,” John Turturro and Ariel Levy sought to preserve “the nasty side of existence” evoked in the book.","For John Turturro, it was time to honor Philip Roth. Turturro, the veteran actor, had been friends with the novelist for nearly a quarter-century when Roth died in 2018 at 85. They first met, Turturro recalled, after Roth saw his performance in the 1994 film “Quiz Show” and picked him to star in a one-man stage adaptation of “Portnoy’s Complaint,” Roth’s 1969 best seller about a young man with a penchant for self-pleasure.",2023-10-25T09:02:08+0000,article,Theater,News,How Philip Roth’s Raunchiest Novel Made It to the Stage,"Theater;Theater (Off Broadway);Books and Literature;Sabbath's Theater (Play);New Group Theater Co;Turturro, John;Levy, Ariel;Bonney, Jo;Writing and Writers;Roth, Philip;Sabbath's Theater (Book);Pershing Square Signature Theater"
37,This earthy-sweet Nigerian dish is worthy of occasion.,"When the Nigerian writer Yemisi Aribisala craves jollof rice, a West African staple, she doesn’t cook it. She asks her sister to send her a bowl. They live about an hour apart, so it is not a casual delivery. Nevertheless, this is how things must be. “Mine is simply not good enough,” Aribisala says.",2023-10-25T09:02:09+0000,article,Magazine,News,A Luxurious Squash and Lamb Stew for the Holidays,Cooking and Cookbooks;Great Britain;Nigeria;Recipes
38,Television celebrates older people — but only for seeming like sexy young ones.,"In the first episode of ABC’s “The Golden Bachelor” — the new 60-plus addition to the decades-old “Bachelor” franchise — Gerry Turner, 72, puts in his hearing aids, dons a tuxedo and cries within the first three minutes of airtime. Gerry, our Golden Bachelor, has been widowed for six years. His wife, Toni, died suddenly, of an infection, and in describing her passing he cannot contain his grief. We see photos of their lives together, from young marrieds to parents, from middle-aged partners to retirees enjoying themselves on a boat. Gerry is uncommonly slim and good-looking and seems to have been so throughout these various life stages. Toni, whose age is not specified, ages less magically. Her waist and eyeglasses thicken, as these things tend to. Clearly these changes did not dampen Gerry’s adoration. The type of tears he sheds on camera over her passing reveal what looks like a deep and enduring love — the thing every contestant on the set of “The Golden Bachelor” is now competing to find with him.",2023-10-25T09:02:11+0000,article,Magazine,News,Why ‘The Golden Bachelor’ Terrifies Me,"Television;The Bachelor (TV Program);Dating and Relationships;Age, Chronological;Elderly"
39,"The classicist Mary Beard examines the excesses and tedium of imperial rule, sorting fact from gossip and tall tales.","If social media is to be believed, men can’t stop thinking about the Roman Empire, particularly its “alpha male” elements. Anyone similarly obsessed would do well to pick up a copy of “Emperor of Rome,” an erudite and entertaining new book by the redoubtable classics scholar and feminist Mary Beard.",2023-10-25T09:02:11+0000,article,Books,Review,Rose Petals and Peacock Brains: What It Took to Be an ‘Emperor of Rome’,"Books and Literature;Roman Civilization;Emperor of Rome: Ruling the Ancient Roman World (Book);Beard, Mary (1955- );Rome (Italy);Caesar, Julius;Caligula (12-41 AD);Nero (37-68 AD);Severus, Alexander"
40,The task of the Palestinian is to audition for empathy and compassion. To prove that we deserve it.,"I’ve moved back to the United States twice since my birth. Once as a child, after the Iraqi invasion of Kuwait. Then again for graduate school. I’d had the privilege of a youth — adolescence and young adulthood — in countries where being Palestinian was fairly common. The identity could be heavy, but it wasn’t a contested one. I hadn’t had to learn the respectability politics of being a Palestinian adult. I learned quickly.",2023-10-25T09:02:31+0000,article,Opinion,Op-Ed,The Palestine Double Standard,Palestinians;Israel-Gaza War (2023- );Gaza Strip;Civilian Casualties;Defense and Military Forces;Israel
41,"Sublime and vulgar all at once, his diaphanous stains of color have come together in a once-in-a-generation show in Paris.","Melt the world away, lose its details, dissolve its borders; it doesn’t sound like such an unwelcome prospect right now. The most substantial Mark Rothko retrospective in a generation has opened at the Fondation Louis Vuitton, and it is a show of monumental dispersion: a pull-out-all-the-stops blockbuster where life passes into vapor.",2023-10-25T09:02:32+0000,article,Arts,News,"Mark Rothko at Full Scale, and in Half Light","Rothko, Mark;Content Type: Personal Profile;Art;Museums;Louis Vuitton Foundation for Creation;Rothko, Christopher"
42,"As the government wraps up its case in the landmark monopoly trial, it has built a picture of how Google became dominant in online search — and the harms that it says resulted.","Since Sept. 12., the Department of Justice and a group of state attorneys general have questioned more than 30 witnesses as they try to prove that Google broke antitrust laws, in a landmark monopoly trial that may affect the power of the technology industry.",2023-10-25T09:02:34+0000,article,Technology,News,What the U.S. Has Argued in the Google Antitrust Trial,Computers and the Internet;Search Engines;Antitrust Laws and Competition Issues;States (US);Attorneys General;Web Browsers;Mobile Applications;Privacy;Online Advertising;DuckDuckGo;Expedia Inc;Apple Inc;Google Inc;Justice Department;Microsoft Corp;VRBO.com
