,abstract,lead_paragraph,pub_date,document_type,section_name,type_of_material,headline,keywords
0,"Dana L. McIntyre, who owned a pizzeria in a Boston suburb, defrauded the federal government out of more than $660,000, the Justice Department said.","When the coronavirus pandemic slowed business at Dana L. McIntyre’s already flailing Boston-area pizzeria in early 2020, he, like millions of other Americans, applied for pandemic relief.",2023-08-31T01:13:01+0000,article,U.S.,News,Man Gets 2 Years in Prison for Spending Pandemic Money on Alpaca Farm,Alpacas;Coronavirus (2019-nCoV);Stimulus (Economic);Money Laundering;Justice Department;Boston (Mass);Massachusetts;United States;Vermont
1,Freddie Cheng admits that there are some things he simply does not know.,Jump to: Today’s Theme | Tricky Clues,2023-08-31T02:00:07+0000,article,Crosswords & Games,News,Follower of November,"Crossword Puzzles;Cheng, Freddie (Crossword Constructor)"
2,"The Cold War-era Leopard 1A5 may be old, but it is still effective, Germany says. The country is now training Ukrainian troops to operate the weapons.","Their old diesel engines roaring, the Cold War-era battle tanks bobbed through the verdant Germany countryside as the Ukrainian commander radioed an order to his unit to fire. The gunners’ task was to aim and shoot the 105-millimeter cannon at green pop-up targets as far as 1,500 yards away.",2023-08-31T04:01:14+0000,article,World,News,An Obsolete German Tank Seeks a Second Life on Ukraine’s Front Lines,International Relations;Defense and Military Forces;Cold War Era;Military Vehicles;Politics and Government;Germany;Ukraine
3,"After 12 years of conflict, anger over growing economic hardships has boiled over. Protesters are demanding the ouster of the authoritarian President Bashar al-Assad and an end to the war.","Rare protests in Syria calling for the ouster of the authoritarian government have gathered momentum over the past two weeks, in scenes reminiscent of the Arab Spring uprising that began more than 12 years ago and morphed into a multisided war.",2023-08-31T04:01:16+0000,article,World,News,Rare Protests in Syria Summon Echoes of Arab Spring,"Demonstrations, Protests and Riots;Politics and Government;Druse (Sect);Middle East and North Africa Unrest (2010- );Minorities;Human Rights and Human Rights Violations;War and Armed Conflicts;Religion-State Relations;Assad, Bashar al-;Syria"
4,"As the Scottish nationalists stumble, a by-election near Glasgow this fall will test support for the opposition Labour party ahead of Britain’s coming general election.","For Britain’s opposition Labour Party, the road to 10 Downing Street is likely to run through Scotland. And the first steps on that road lie in a cluster of commuter towns southeast of Glasgow, where Labour is trying to win over swing voters like Cara Scott, in a closely watched parliamentary vote that will test the party’s appeal ahead of a coming general election.",2023-08-31T04:01:50+0000,article,World,News,A Resurgent Labour Party Sees Scotland as a Springboard to Power,"Politics and Government;Elections;Legislatures and Parliaments;Scottish National Party;Labour Party (Great Britain);Starmer, Keir;Glasgow (Scotland);Great Britain;Scotland"
5,"Michelsen, a 19-year-old American who passed on the University of Georgia to turn pro, has raced up the rankings since January and should break into the top 100 after his run in New York.","Things some teenagers do that make adults crazy: spending too much time on devices, leaving dirty dishes in the sink and sending hard backhands down the line.",2023-08-31T04:01:50+0000,article,Sports,News,"At the U.S. Open, Alex Michelsen Is Growing Up Fast","Tennis;United States Open (Tennis);Content Type: Personal Profile;Michelsen, Alex (2004- )"
6,"Gina Raimondo, the U.S. commerce secretary, and her Chinese counterparts agreed to continue economic talks, but such dialogues have a disheartening record.","When Gina Raimondo, the commerce secretary, visited China this week, she joined a long line of U.S. politicians who have come to the country to try to sway Chinese officials to open their market to foreign businesses and buy more American exports, in addition to other goals.",2023-08-31T04:01:50+0000,article,Business Day,News,The U.S. and China Are Talking Again. Where It Will Lead Is Unclear.,"United States International Relations;Commerce Department;Biden, Joseph R Jr;Raimondo, Gina M;China;United States;International Trade and World Market"
7,"By exaggerating the risks from Japan’s discharge of treated wastewater, Beijing hopes to cast Japan and its allies as conspirators in malfeasance, analysts say.","In Guangdong Province, on China’s southern coast, a woman posted a photo of a boxed-up Japanese-brand air-conditioner that she planned to return in protest. In southwest China, the owner of a Japanese pub posted a video of himself ripping down anime posters and smashing bottles, saying he planned to reopen the business as a Chinese bistro.",2023-08-31T04:10:38+0000,article,World,News,China’s Disinformation Fuels Anger Over Fukushima Water Release,International Relations;Radiation;Water;Nuclear Energy;Japan Earthquake and Tsunami (2011);Rumors and Misinformation;Tokyo Electric Power Co;Fukushima Daiichi Nuclear Power Plant (Japan);International Atomic Energy Agency;China;Fukushima (Japan)
8,"The Egyptian-columned marble lobby at 60 Wall Street has many fans, but it is likely to be replaced by a neutral, minimalist interior.",Good morning. It’s Thursday. Today we’ll take last looks at some doomed architecture.,2023-08-31T04:19:48+0000,article,New York,briefing,The Final Days of Wall Street’s Beloved ‘Tacky’ ’80s Lobby,"New York City;internal-storyline-no;Nineteen Hundred Eighties;ARCHITECTURE;Privately Owned Public Spaces;Real Estate (Commercial);City Planning Commission (NYC);Landmarks Preservation Commission;Roche, Kevin"
9,"Quotation of the Day for Thursday, August 31, 2023.",“This river is in the emergency room with a pile of doctors trying everything they can to keep that patient alive.”,2023-08-31T04:24:47+0000,article,Corrections,Quote,"Quotation of the Day: In a Storied River on Vancouver Island, Fish Are Dying in Droves",
10,"Corrections that appeared in print on Thursday, Aug. 31, 2023.","The puzzle on Aug. 26 included an incorrect clue for 39-Down. While the author J.R.R. Tolkien had considered using 39-Down as the language spoken by characters in Middle-earth, according to “The Book of Lost Tales,” he did not use it in his “Lord of the Rings” series.",2023-08-31T04:25:26+0000,article,Corrections,News,"Corrections: Aug. 31, 2023",
11,Drone attacks in the war in Ukraine.,"Exploding drones were launched into six regions of Russia overnight on Wednesday, Russian officials said, damaging military cargo planes at an airfield 30 miles from the border with Estonia, a NATO member, in an apparent sign that Ukraine was increasingly capable of striking back deep inside Moscow’s territory.",2023-08-31T04:29:14+0000,article,Briefing,briefing,Thursday Briefing,
12,This word has appeared in 87 articles on NYTimes.com in the past year. Can you use it in a sentence?,"The word disingenuous has appeared in 87 articles on NYTimes.com in the past year, including on July 2 in “‘American Made’ T-Shirts Are Having Their Best Year Yet” by Jordyn Holman:",2023-08-31T06:00:02+0000,article,The Learning Network,News,Word of the Day: disingenuous,
13,Feeling stuck on today’s puzzle? We can help.,"THURSDAY — Hi busy bees! Welcome to today’s Spelling Bee forum. There are a number of terms that appear in both this article and other online discussions of the Spelling Bee; a glossary of those terms compiled by Monicat, a Times reader, can be found below. For more Spelling Bee conversation, check out Deb Amlen’s weekly humor column, “Diary of a Spelling Bee Fanatic.”",2023-08-31T07:00:04+0000,article,Crosswords & Games,News,Spelling Bee Forum,Spelling Bee (Game)
14,"Remember the live-action, English-language “Cowboy Bebop”?","With “One Piece,” Netflix repeats history, and there isn’t much evidence that it paid attention to what happened the first time around.",2023-08-31T07:00:11+0000,article,Arts,Review,‘One Piece’ Review: Netflix Tries to Translate the Anime Magic (Again),"Television;One Piece (TV Program);Netflix Inc;Oda, Eiichiro"
15,Our columnist reviews the day’s puzzle. Warning: Contains spoilers!,"Welcome to The Wordle Review. Be warned: This article contains spoilers for today’s puzzle. Solve Wordle first, or scroll at your own risk.",2023-08-31T07:00:13+0000,article,Crosswords & Games,News,Today’s Wordle Review,Crossword Puzzles;Wordle (Puzzle)
16,The smell of marijuana is drifting over Court 17. The explanation appears to have nothing to do with tennis.,"Those familiar with New York City know it’s a place where you will occasionally be confronted with the smell of marijuana. But when some of the world’s most elite tennis players caught a whiff of weed during opening day of the U.S. Open in Queens, an investigation was launched to find the possible source.",2023-08-31T07:00:20+0000,article,New York,News,Weed at the U.S. Open? Some Players Swear They Can Smell It,"Tennis;Marijuana;Billie Jean King National Tennis Center;Sakkari, Maria (1995- );Flushing Meadows-Corona Park (Queens, NY);United States Open (Tennis);Smells and Odors"
17,Three New York Times technology reporters recently buckled up for a ride in Waymo’s autonomous vehicles.,"On Aug. 21, Waymo, a self-driving car company owned by Alphabet, Google’s parent company, began letting people pay for rides in its driverless Jaguar cars in San Francisco.",2023-08-31T07:00:20+0000,article,Times Insider,News,"Along for the Ride, With No One Behind the Wheel",Automobiles;Traffic Accidents and Safety;Driverless and Semiautonomous Vehicles;Automobile Safety Features and Defects;Waymo;Golden Gate Park (San Francisco);San Francisco (Calif)
18,"At 80 years old, the longtime television personality found himself unexpectedly unemployed after more than half a century. So he steered his boat toward the Erie Canal, seeking one last adventure.","The 36-foot luxury motorboat, with its polished mahogany hull and American flag waving from the stern, set off from East Hampton on a recent Sunday morning, heading toward the tip of downtown Manhattan and passing beneath airplanes, bridges, thunderstorms and, eventually, a glorious blue sky. The trip would take the boat, named Belle, within view of the Statue of Liberty en route to the Hudson River and, finally, Lake Erie.",2023-08-31T07:00:25+0000,article,New York,News,"After Fox News, Geraldo Rivera Boats Into the Sunset (via Cleveland)","News and News Media;internal-sub-only;Fox News Channel;Rivera, Geraldo;Erie Canal (NYS);The Five (TV Program);internal-great-read;audio-neutral-informative;audio-positive-escape"
19,"The Metropolitan Transportation Authority has vowed to make the city’s public transit system easier to navigate, but said it will take 32 years. For disabled New Yorkers, the subway is still a nightmare.","New York City’s subway system is a maze of obstructions for people who have difficulty walking. About one out of 15 New Yorkers has an ambulatory disability, according to Census Bureau data, but the vast majority of stations lack elevators and ramps, making much of the city hard to access for the hundreds of thousands of residents who rely on them.",2023-08-31T07:00:34+0000,article,New York,News,Elevators at Most Subway Stations? ‘I’ll Believe It When I See It.’,Disabilities;Wheelchairs;Elevators and Escalators;Commuting;Subways;AMERICANS WITH DISABILITIES ACT;Metropolitan Transportation Authority;New York City
20,Heather and David Durst’s children have set up a GoFundMe to help them rebuild their lives.,Heather and David Durst’s children have set up a GoFundMe to help them rebuild their lives.,2023-08-31T07:41:25+0000,multimedia,Climate,Video,They Prepared for Idalia’s Floods But Lost Their Home in a Fire,Hurricane Idalia (2023);Florida;Floods;Fires and Firefighters;GoFundMe
21,"The blaze consumed an abandoned five-story building that had become a sprawling informal settlement, officials said.","The blaze consumed an abandoned five-story building that had become a sprawling informal settlement, officials said.",2023-08-31T08:17:43+0000,multimedia,World,Video,Building Fire in Johannesburg Kills Dozens,Johannesburg (South Africa);Fires and Firefighters;Accidents and Safety;Renting and Leasing (Real Estate);Deaths (Fatalities)
22,One thing that drew Leigh Bardugo to the Avengers as a girl was that their turnover rate meant they were always hiring.,"I bought my comics from a newsstand just a few blocks from our apartment in the San Fernando Valley. As a kid, I thought it was a big deal to walk those few blocks and buy something on my own. The newsstand was wedged between a pizza place and a beauty supply called the Bee Hive, and it was a little seedy. You were just as likely to see guys buying issues of Hustler as you were kids snapping up “X-Men.” But mostly you’d see men and women arrayed in a line, magazines in hand, backs slightly bowed, heads hanging as if too heavy for their necks.",2023-08-31T09:00:09+0000,article,Books,News,"Falling in Love With the Avengers, America’s Most Toxic Work Force",Comic Books and Strips;Books and Literature;Content Type: Personal Profile;Marvel Comics
23,Design experts say a surprising number of them have stood the test of time.,"In 1868, the designer Charles Eastlake published “Hints on Household Taste,” a popular guide to outfitting the home in good taste, from the street front to the china cupboard and all the rooms in between.",2023-08-31T09:00:14+0000,article,Real Estate,News,Some Old-Fashioned Home-Design Manuals Are Worth Revisiting,"Books and Literature;ARCHITECTURE;Museums;Design;Interior Design and Furnishings;Furniture;Children's Museum of the Arts;Cooper Hewitt, Smithsonian Design Museum;Wheeler, Candace (1827-1923);Palladio, Andrea;Conran, Terence"
24,"For a growing number of designers, dealers and collectors in their thirties, American antiques are hot.","Scroll through Erick J. Espinoza’s Instagram feed, and you might think you’ve traveled back in time to the 1930s — not the Art Deco version, but the version filled with hooked rugs, weathervanes and candlesticks betokening the era’s American Colonial Revival, perhaps with the color saturation cranked way up.",2023-08-31T09:00:15+0000,article,Style,News,Millennials Embrace Bicentennial Style,"Furniture;Handicrafts;Antiques;Collectors and Collections;Millennial Generation;Design;Interior Design and Furnishings;Culture (Arts);Ross, Betsy"
25,The marks and scars of difficult work underpin four new design books.,"Some forms of architecture and design, produced through arduous or even backbreaking labor, can be thought-provoking or perhaps even discomfiting to study, while also enduring as role models. Four new books explore such places and objects, while paying tribute to 18th-century Austrian quarrymen, enslaved workers before the Civil War, Tunisian beachcombers and modern weavers.",2023-08-31T09:00:46+0000,article,Style,News,"Books About Labors of Love, Cruelty and Destruction","Books and Literature;Design;Rock and Stone;Historic Buildings and Sites;Slavery (Historical);Dyes and Dyestuffs;Textiles;Liebes, Dorothy (1897-1972);McGill, Joseph (1961- )"
26,A show of commercial Art Deco posters opens later this month in Manhattan.,"Between the 1920s and World War II, illustrators and designers slashed bands of color across advertisements to tempt consumers with ever faster modes of travel and cleverer machinery. The era’s frenetic pace of change is vividly represented in posters hung throughout the homes of the collectors William and Elaine Crouse, and they have partly denuded their walls to lend 58 pieces to “Art Deco: Commercializing the Avant-Garde,” an exhibition that opens Sept. 28 at Poster House in New York City.",2023-08-31T09:01:02+0000,article,Arts,News,When Advertisements Were Art,Advertising and Marketing;Posters;Art;Museums;Design;Poster House
27,Designers and fabricators are finding new forms for the ornamental material.,"If Beth Cayre had to move, she would regret leaving the dining room ceiling, with its plaster cherry blossom branches hand molded by the ceramics artist Matthew Solomon. And who could blame her?",2023-08-31T09:01:45+0000,article,Arts,News,Look! Up on the Wall! It’s a Golf Ball! It’s a Starfish! It’s Plaster!,"ARCHITECTURE;Design;Pennoyer, Peter;Art"
28,"The house, a historical landmark that was built in 1933 with cedar shingles and Douglas fir paneling, receives a respectful kitchen addition.","Six years ago, Sonya Schneider and her husband, Stuart Nagae, bought a federally designated historical landmark in Seattle, a 5,000-square-foot, two-story home sheathed in dark, old-growth Western cedar shingles, with multiple gables, dormer windows and a cedar-shake roof. It sat on an unusually large three-quarter-acre lot with mature maples, Douglas fir and a hemlock tree, in Ballard, an old Seattle neighborhood on Puget Sound.",2023-08-31T09:02:05+0000,article,Real Estate,News,"A Ship Captain’s House in Seattle, via Norway, Finds New Life",ARCHITECTURE;Interior Design and Furnishings;Real Estate and Housing (Residential);Historic Buildings and Sites;Seattle (Wash);Restoration and Renovation;Wood and Wood Products;Kitchens
29,Experts suggest a few recent products that may stick around for generations to come.,"What makes a design a classic? New products flood the market every year, yet very few have long lives and lasting impact. The lounge chair designed by Charles and Ray Eames is as coveted today as it was in 1956, the year it was introduced. (Probably even more so.) Richard Sapper’s Tizio table lamp has illuminated the work spaces of thousands of users who were born after it made its first appearance in 1971. Both products are enshrined in museums.",2023-08-31T09:02:25+0000,article,Style,News,Design Classics of the Future,"Furniture;ARCHITECTURE;Design;Cooper Hewitt, Smithsonian Design Museum;Jasper Morrison Ltd;Muji (Retailer);Casely-Hayford, Gus;Malouin, Philippe;Sapper, Richard (1932-2015)"
30,His failure is a template for the inevitable disasters if Trump returns to the White House.,"On Monday, Mark Meadows, a former White House chief of staff, testified in an effort to move the Georgia racketeering case against his former boss Donald Trump and co-defendants to federal court. On the stand, he said that he believed his actions regarding the 2020 election fell within the scope of his job as a federal official.",2023-08-31T09:02:37+0000,article,Opinion,Op-Ed,Mark Meadows Is a Warning About a Second Trump Term,"Georgia Criminal Case Against Trump (2020 Election);Presidential Election of 2020;Presidents and Presidency (US);Ethics and Official Misconduct;Federal Courts (US);Baker, James A III;Eisenhower, Dwight David;Ford, Gerald Rudolph Jr;Haldeman, H R;Meadows, Mark R (1959- );Rumsfeld, Donald H;Trump, Donald J;Georgia"
31,"To counter the signs of aging or treat acne, start slow and be patient.","Over-the-counter retinol products are popular for good reason: In addition to helping to control acne, they can improve the overall appearance of skin and lessen the signs of aging. They “are perfect for reducing fine lines and large pores, improving skin texture and evening out skin tone,” said Dr. Hope Mitchell, a dermatologist in Perrysburg, Ohio.",2023-08-31T09:02:46+0000,article,Well,News,Retinol Has Many Skin Benefits. Here’s How to Use It.,Retinol;Skin;Cosmetics and Toiletries;Content Type: Service;ACNE
32,Prae Pupityastaporn is one of 10 artists featured in Frieze Seoul’s Focus Asia section. Her landscape diptychs are being shown by the Thai gallery Nova Contemporary.,"Sometimes a painting can be adjusted slightly and suddenly take on a new meaning for the artist. For Prae Pupityastaporn, a Thai landscape painter whose works are being presented at Frieze Seoul by the Nova Contemporary gallery in Bangkok, working with two similar paintings side by side can depict the delicate balance between memory and the present moment. An image can change ever so slightly, and ever so profoundly.",2023-08-31T09:02:48+0000,article,Arts,News,An Emerging Thai Artist Explores the Subjectivity of Memory,Frieze Art Fair;Art;Bangkok (Thailand)
33,"Elizabeth Graziolo is a Black female classical architect and owns her own firm. Thanks to her influence, she may soon have more company.","The University of Notre Dame is known for producing top-notch classically trained young architects, and every year the principals of architecture firms that work in traditional styles make pilgrimages to a spring career fair at the Indiana school to vie for the new talent.",2023-08-31T09:02:58+0000,article,Style,News,An Architect Who Forges Ahead in Her Own Lane,ARCHITECTURE;Women and Girls;Black People;Blacks;Minorities;Design;Content Type: Personal Profile;Real Estate and Housing (Residential)
34,"“I have music and rhythm to help me get my point across,” says the singer and songwriter, whose new memoir is “Talking to My Angels.” “But real poets do it all just with the language and the lines. That’s a gift.”",What books are on your night stand?,2023-08-31T09:02:59+0000,article,Books,News,Melissa Etheridge’s ‘First Love’ as a Reader Was Poetry,"Books and Literature;Writing and Writers;Pop and Rock Music;Content Type: Personal Profile;Etheridge, Melissa"
35,"In “Fortune’s Frenzy,” Eilene Lyon traces the hardship and misery endured by Henry Jenkins, a stalwart Indiana farmer who, along with thousands of others, journeyed to California in 1851.","How do we remember the forty-niners? The hundreds of thousands of gold miners who flooded California, displaced Indigenous people, remade the landscape and laid the ground for statehood? Perhaps we picture a grizzled prospector panning for gold, broke and desperate, praying for the mother lode. Whatever we imagine, according to a new book by Eilene Lyon, the reality was much worse.",2023-08-31T09:03:00+0000,article,Books,Review,All That Glitters: A Fresh Look at the California Gold Rush,"Books and Literature;Gold;Mines and Mining;Fortune's Frenzy: A California Gold Rush Odyssey (Book);Lyon, Eilene;California"
36,"On feel-good desk chairs, stylish laundry rooms and game tables you don’t have to banish to the basement.","I’m looking for a new, ergonomically correct desk chair — but I want it to look nice. Is that too much to ask?",2023-08-31T09:03:09+0000,article,Style,News,Advice for Making the Practical Pretty,Tables;Furniture;Chairs;Lamps and Lampshades;Billiards;Ergonomics;Herman Miller Inc
37,"Healthy eating might help protect your brain, experts say, but other factors play in as well.","If you’re concerned about developing dementia later in life, it’s natural to wonder if you might be able to prevent it.",2023-08-31T09:03:10+0000,article,Well,News,Does the MIND Diet Prevent Dementia?,Diet and Nutrition;Dementia;Clinical Trials;Research;Alzheimer's Disease;Fruit;Vegetables;Preventive Medicine;Brain;Rush University Medical Center;New England Journal of Medicine;University of Southern California
38,"The Dutch capital is busier and more sanitized than you remember, but visitors can find glimpses of Amsterdam where the city’s creative spirit is still brimming.","The Dutch capital is busier and more sanitized than you remember, but visitors can find glimpses of Amsterdam where the city’s creative spirit is still brimming.",2023-08-31T09:03:12+0000,multimedia,Travel,Interactive Feature,36 Hours in Amsterdam,"Art;Restaurants;Comedy and Humor;Historic Buildings and Sites;Museums;Travel and Vacations;Classical Music;Bicycles and Bicycling;Bars and Nightclubs;Boom Chicago (Netherlands);Frank, Anne, House;Rijksmuseum;Royal Concertgebouw Orchestra;Van Gogh Museum;van Gogh, Vincent;van Rijn, Rembrandt Harmenszoon;AMSTERDAM (NETHERLANDS);Netherlands;Content Type: Service"
39,Is it rude to accommodate your own preference for toppings?,"My husband’s family rarely has cheese for burgers at cookouts. One or two family members (out of eight to 10 who are normally at any gathering) do not like cheese, so it’s not readily kept around. I love a good cheeseburger. My husband agrees that the lack of cheese is weird but says it would be rude if I brought my own. Please rule that I can bring my own cheese to these cookouts.",2023-08-31T09:03:13+0000,article,Magazine,News,Judge John Hodgman on Bringing Your Own Cheese to the Cookout,"Customs, Etiquette and Manners"
40,"The agony of running ultramarathons is bearable, she discovered — even instructive, if you think about it the right way. And she learned how to win as few have ever won before.","After running for 60 miles through snow, up steep, root-filled switchbacks with thousands of feet of elevation gain, Courtney Dauwalter entered what she calls her pain cave. For the next 40 miles of the Western States 100-Mile Endurance Run through California’s Sierra Nevada, she imagined she was holding a chisel and chipping away at the furthest reaches of her pain, while staying focused on every step she took. By the time Dauwalter crossed the finish line in 15 hours, 29 minutes and 33 seconds, she had obliterated the women’s course record by more than an hour and had run the 23rd-fastest time, by anyone, in the race’s 45-year history.",2023-08-31T09:03:21+0000,article,Sports,News,What Courtney Dauwalter Learned in the Pain Cave,"Running;Ultramarathon Running;Content Type: Personal Profile;Dauwalter, Courtney;Leadville (Colo)"
