,abstract,lead_paragraph,pub_date,document_type,section_name,type_of_material,headline,keywords
0,"The Pentagon said the decision was because of military readiness, but it comes as the Republican senator from Alabama has held up military promotions to protest an abortion access policy.","The Pentagon announced on Monday that President Biden had canceled an order by former President Donald J. Trump to move the United States Space Command headquarters to Alabama, prompting an outcry from Republicans who accused him of acting out of political spite amid a fierce partisan standoff over the Pentagon’s abortion access policies.",2023-08-01T00:27:55+0000,article,U.S.,News,Biden Cancels Space Command Move to Alabama Amid Tuberville Feud,"United States Politics and Government;United States Defense and Military Forces;Abortion;United States Space Force;Biden, Joseph R Jr;Tuberville, Tommy;Alabama;Colorado Springs (Colo)"
1,He played dozens of memorable roles on big and small screens throughout his career. We’ve rounded up what to watch and where to watch it.,"Paul Reubens, who died on Sunday at age 70, will always be remembered for his beloved alter ego, the perpetually childlike Pee-wee Herman — a character so popular that it was able to carry a stage show, movies and a TV series. But Reubens also made memorable impressions playing a variety of supporting characters of the big and small screens — like Penguin’s father in “Batman Returns” and the turtleneck-wearing fixer Mr. Vargas in “The Blacklist,” just to name a few out of dozens.",2023-08-01T01:15:10+0000,article,Arts,News,Paul Reubens Was More Than Pee-wee. Here are 8 Great Performances.,"Television;Movies;Reubens, Paul;Pee-wee's Playhouse (TV Program);Pee-wee's Big Adventure (Movie);Mosaic (TV Program);30 Rock (TV Program);Buffy the Vampire Slayer (TV Program);Portlandia (TV Program);The Nightmare Before Christmas (Movie);Flight of the Navigator (Movie);Actors and Actresses"
2,Kathryn Ladner branches out.,Jump to: Today’s Theme | Tricky Clues | Solving Tip,2023-08-01T02:00:07+0000,article,Crosswords & Games,News,"Crunch Muscles, for Short",Crossword Puzzles
3,The scramble to cover legal bills for former President Donald J. Trump and his associates has prompted what appears to be the largest refund in federal campaign finance history.,"Former President Donald J. Trump’s political action committee, which began last year with $105 million, now has less than $4 million left in its account after paying tens of millions of dollars in legal fees for Mr. Trump and his associates.",2023-08-01T03:00:04+0000,article,U.S.,News,"After Paying Lawyers, Trump’s PAC Is Nearly Broke","Campaign Finance;Presidential Election of 2024;Federal Criminal Case Against Trump (Documents Case);Political Action Committees;United States Politics and Government;Trump, Donald J;Save America PAC;Make America Great Again Inc;Republican Party"
4,The details of Ukraine’s drone strikes.,"A Times investigation found evidence that at least three different Ukrainian-made drone models had been used in attacks inside Russia, including Moscow, indicating a Ukrainian role in strikes that Kyiv has denied carrying out or declined to claim responsibility for. Ukraine is racing to scale up its drone fleet, and to attack more frequently in Russia.",2023-08-01T03:39:08+0000,article,Briefing,briefing,Tuesday Briefing,
5,Anthropologists are finding that women in modern foraging societies have played a major role in catching game.,"It’s often viewed as a given: Men hunted, women gathered. After all, the anthropological reasoning went, men were naturally more aggressive, whereas the slower pace of gathering was ideal for women, who were mainly focused on caretaking.",2023-08-01T04:01:13+0000,article,Science,News,"Move Over, Men: Women Were Hunters, Too",your-feed-science;Archaeology and Anthropology;Women and Girls;Hunting and Trapping;PLoS One (Journal);Peru;internal-open-access-from-nl
6,"A new law underscores how Vladimir V. Putin is increasingly using the war in Ukraine as justification for greater restrictions on L.G.B.T.Q. life, portraying it as a consequence of deviant Western values.","Jan Dvorkin had raised and nurtured his adopted son in Moscow for seven years until, one day in May, the Russian authorities notified him they were revoking custody. A woman Mr. Dvorkin knew had filed an official complaint, saying that because he was transgender and gay, he was an unfit parent.",2023-08-01T04:01:14+0000,article,World,News,Putin’s Crackdown Leaves Transgender Russians Bracing for Worse,"Russia;Putin, Vladimir V;Homosexuality and Bisexuality;Transgender;Discrimination;Law and Legislation;Russian Invasion of Ukraine (2022);Politics and Government;Propaganda;Ukraine"
7,"Quotation of the Day for Tuesday, August 1, 2023.",“That’s the interest of science. You end somewhere you didn’t presume.”,2023-08-01T04:10:40+0000,article,Corrections,Quote,"Quotation of the Day: Scientists Revive Two Roundworms That Were Encased in Siberian Permafrost for 46,000 Years",
8,"Corrections that appeared in print on Tuesday, Aug. 1, 2023.","A picture caption with an article on Friday about the 70th anniversary of the armistice that halted the Korean War misstated the length of that conflict. It lasted about three years and one month, not less than three years.",2023-08-01T04:18:36+0000,article,Corrections,News,"Corrections: Aug. 1, 2023",
9,"Responses from a survey of 1,329 registered voters nationwide, including an oversample of 818 registered Republican voters, conducted July 23-27, 2023","Responses from a survey of 1,329 registered voters nationwide, including an oversample of 818 registered Republican voters, conducted July 23-27, 2023",2023-08-01T04:19:08+0000,multimedia,U.S.,Interactive Feature,Topline Results: July 2023 Times/Siena Poll of Registered Voters,internal-open-access;New York Times/Siena College Poll
10,"President Biden and former President Donald J. Trump are tied in a 2024 rematch among all registered voters, according to a poll conducted by The New York Times and Siena College from July 23 to 27, 2023.","President Biden and former President Donald J. Trump are tied in a 2024 rematch among all registered voters, according to a poll conducted by The New York Times and Siena College from July 23 to 27, 2023.",2023-08-01T04:19:09+0000,multimedia,U.S.,Interactive Feature,Cross-Tabs: July 2023 Times/Siena Poll of the 2024 Race and National Issues,New York Times/Siena College Poll;internal-open-access
11,Residents near the company’s location in downtown San Francisco complained of “intense” flashing lights and feared for their safety.,"Workers on Monday dismantled a giant “X” sign that was only briefly displayed on the roof of Twitter’s headquarters in San Francisco after residents complained and the city issued a violation notice for lacking proper permits, according to local officials.",2023-08-01T04:24:49+0000,article,U.S.,News,"After Investigation and Complaints, Twitter Removes ‘X’ on Headquarters","Twitter;Signs and Signage;Logos;Social Media;Roofs;Real Estate (Commercial);Accidents and Safety;Musk, Elon;San Francisco (Calif)"
12,"DocGo, which was awarded a $432 million contract by New York City, moved migrants upstate. Some complained about how they were treated.",Good morning. It’s Tuesday. Today we’ll look at how a company that conducted Covid tests during the pandemic came to move hundreds of asylum seekers out of New York City — and what has happened since the migrants arrived in upstate communities.,2023-08-01T05:51:00+0000,article,New York,briefing,The Covid Test Company That Got Into the Migrant Business,"New York City;Asylum, Right of;Coronavirus (2019-nCoV);Government Contracts and Procurement;DocGo Inc;Adams, Eric L;Albany (NY)"
13,"Typhoon Khanun was hovering near Okinawa Prefecture days after an earlier tropical cyclone, Doksuri, brought death and destruction to China and the Philippines.","As wind and rain from a powerful tropical cyclone continued to lash southern Japan on Thursday, the authorities said the storm had left at least two people dead, injured at least 60 others and knocked out power to around 150,000 homes.",2023-08-01T06:06:09+0000,article,World,News,Tropical Cyclone Kills 2 in Southern Japan,"Typhoons;Hurricanes and Tropical Storms;Military Bases and Installations;Rain;Cyclones;Floods;Beijing (China);Kadena Air Base (Okinawa, Japan);Okinawa and Other Ryukyu Islands (Japan);Philippines"
14,"The civilian leader, who was ousted in a coup in 2021, had six years cut from a 33-year prison sentence and five of her 19 convictions overturned, state television said.","The military government in Myanmar has reduced the prison sentence for Daw Aung San Suu Kyi, the Southeast Asian nation’s ousted civilian leader, by six years, a military spokesman said on Tuesday.",2023-08-01T06:25:26+0000,article,World,News,Aung San Suu Kyi’s Prison Sentence Reduced in Myanmar,Myanmar;Aung San Suu Kyi;Political Prisoners;Politics and Government;Civilian Casualties;Coups D'Etat and Attempted Coups D'Etat;Decisions and Verdicts
15,Our columnist reviews the day’s puzzle. Warning: Contains spoilers!,"Welcome to The Wordle Review. Be warned: This article contains spoilers for today’s puzzle. Solve Wordle first, or scroll at your own risk.",2023-08-01T07:00:02+0000,article,Crosswords & Games,News,Today’s Wordle Review,Crossword Puzzles;Wordle (Puzzle)
16,A Times/Siena poll suggests a slight Biden edge among voters who don’t like either candidate.,"After Democrats fared well against MAGA candidates in the midterms last year, it might have been reasonable to think that President Biden would have a clear advantage in a rematch against Donald J. Trump.",2023-08-01T07:00:04+0000,article,The Upshot,News,"Can the Race Really Be That Close? Yes, Biden and Trump Are Tied.","Polls and Public Opinion;Presidential Election of 2024;Biden, Joseph R Jr;Trump, Donald J;internal-sub-only-nl;United States Politics and Government;Presidential Election of 2020"
17,Suffolk County’s district attorney personally appeared at a brief session for the man accused of murder in three cases and named as the prime suspect in a fourth.,"The voices of those seated in a Long Island courtroom fell to a whisper on Tuesday as Rex Heuermann shuffled in, his hair rumpled, his wrists handcuffed and his mouth drawn tight.",2023-08-01T07:00:07+0000,article,New York,News,Suspect in Gilgo Beach Killings Hears Catalog of Evidence Against Him,"Serial Murders;Heuermann, Rex (1963- );Gilgo Beach (NY);Massapequa Park (NY);Suffolk County (NY)"
18,Feeling stuck on today’s puzzle? We can help.,"TUESDAY — Hi busy bees! Welcome to today’s Spelling Bee forum. There are a number of terms that appear in both this article and other online discussions of the Spelling Bee; a glossary of those terms compiled by Monicat, a Times reader, can be found below. For more Spelling Bee conversation, check out Deb Amlen’s weekly humor column, “Diary of a Spelling Bee Fanatic.”",2023-08-01T07:00:08+0000,article,Crosswords & Games,News,Spelling Bee Forum,Spelling Bee (Game)
19,"Unlike her husband, Nadine Menendez has lived a mainly private life. Investigators appear focused on the possibility that she or the senator received undisclosed gifts.","In early 2019, Senator Bob Menendez of New Jersey and his new girlfriend, Nadine Arslanian, were riding high.",2023-08-01T07:00:14+0000,article,New York,News,A Senator’s New Wife and Her Old Friends Draw Prosecutors’ Attention,"Menendez, Robert;Menendez, Nadine;Gifts to Public Officials;Ethics and Official Misconduct;Hana, Wael;IS EG Halal;Halal Foods and Products;Senate;New Jersey;Federal Bureau of Investigation;United States Politics and Government"
20,"The share of Republicans saying the former president has committed “serious federal crimes” has grown modestly, according to a new poll from The New York Times and Siena College.",Donald J. Trump famously marveled during his first presidential campaign that he could shoot someone on Fifth Avenue and he would not lose any support.,2023-08-01T07:00:19+0000,article,U.S.,News,More Republicans Say Trump Committed Crimes. But They Still Support Him.,"Polls and Public Opinion;United States Politics and Government;New York Times/Siena College Poll;Republican Party;Trump, Donald J;Classified Information and State Secrets;Presidential Election of 2024;Federal Criminal Case Against Trump (Documents Case);Federal Criminal Case Against Trump (2020 Election Case);New York State Criminal Case Against Trump (71543-23)"
21,A New York Times/Siena College poll found that President Biden is on stronger footing than he was a year ago — but he is neck-and-neck in a possible rematch against Donald Trump.,"President Biden is heading into the 2024 presidential contest on firmer footing than a year ago, with his approval rating inching upward and once-doubtful Democrats falling into line behind his re-election bid, according to a New York Times/Siena College poll.",2023-08-01T07:00:21+0000,article,U.S.,News,"Biden Shores Up Democratic Support, but Faces Tight Race Against Trump","Biden, Joseph R Jr;Trump, Donald J;Democratic Party;Republican Party;Presidential Election of 2024;New York Times/Siena College Poll;Polls and Public Opinion;United States Politics and Government;Primaries and Caucuses"
22,"Four of the 13 books that will compete for the prestigious literary award are debuts, in a longlist that the judges said was “defined by its freshness.”","A graceful novel about a squash prodigy battling grief on court, a dystopia that reimagines Ireland as a totalitarian state and a coming-of-age tale about a neurodiverse teenager are among 13 titles longlisted for this year’s Booker Prize.",2023-08-01T08:00:12+0000,article,Books,News,New Voices Dominate Booker Prize Nominations,"Man Booker Prize;Books and Literature;Barry, Sebastian;Escoffery, Jonathan;Harding, Paul;Maroo, Chetna;Murray, Paul (1975- );If I Survive You (Book);The Bee Sting: A Novel (Book)"
23,The Japanese subsidiary of Warner Bros. criticized what it called insensitive promotion of “Barbie” by the company’s headquarters.,"To Americans eager for signs of life in an ailing cinema culture, the simultaneous box office success of the “Barbie” movie and the biopic “Oppenheimer” has been cause for celebration, with filmgoers embracing the jarring juxtaposition of the two very different blockbusters.",2023-08-01T08:33:20+0000,article,World,News,‘Barbenheimer’ Isn’t Funny in Nuclear-Scarred Japan,Movies;Barbie (Movie);Oppenheimer (Movie);Japan;Box Office Sales;Social Media;Warner Brothers;Nuclear Weapons
24,These men have spent their entire adult lives in prison. How much punishment is enough?,These men have spent their entire adult lives in prison. How much punishment is enough?,2023-08-01T08:50:07+0000,multimedia,Opinion,Video,They Know What They Did. They’d Like You to Know Who They’ve Become.,Content Type: Service;Criminal Justice;Crime and Criminals;Sentences (Criminal);your-feed-opinionvideo
25,These men have spent their entire adult lives in prison. How much punishment is enough?,"Listening to the men in the short Opinion Video above is like encountering visitors from another planet. They are serving life sentences at Angola prison, in rural Louisiana, with little to no hope for release. Many are elderly; they have not seen the outside world, or their families, for decades.",2023-08-01T09:00:13+0000,article,Opinion,Op-Ed,They Know What They Did. They’d Like You to Know Who They’ve Become.,Prisons and Prisoners;Sentences (Criminal);your-feed-opinionvideo;Louisiana State Penitentiary;Criminal Justice;United States;Louisiana
26,"The economic journalist on the “shifts,” “shocks” and “fragilities” shaping this global economic moment.",The world economy has experienced many shocks over the past few years: A pandemic. Russia’s invasion of Ukraine. Skyrocketing inflation. These are the stories that have dominated headlines — and for good reason.,2023-08-01T09:00:18+0000,article,Opinion,Op-Ed,How Martin Wolf Understands This Global Economic Moment,"audio-neutral-informative;United States Economy;International Trade and World Market;International Relations;Economic Conditions and Trends;United States International Relations;Alternative and Renewable Energy;Wolf, Martin;China;Europe;United States;The Crisis of Democratic Capitalism (Book)"
27,"In “Flirting With Danger,” Janet Wallach tells the story of Marguerite Harrison, who traded a life of privilege to become America’s first international female spy.","Anyone complaining about a canceled Delta flight would do well to channel Marguerite Harrison. The United States’ first international female spy, Harrison crisscrossed the globe by rickshaw, propeller plane, camel, inflated goatskin raft and rail freight car and once brightly described a trans-Siberian voyage, in which she was wedged between sacks of tea and oats on the back of a troika in a blizzard, as “a rare and delightful experience.”",2023-08-01T09:00:23+0000,article,Books,Review,Being Underestimated Was Her Secret Weapon,"Harrison, Marguerite (1879-1967);Espionage and Intelligence Services;Books and Literature;Political Prisoners;Berlin (Germany);Moscow (Russia);Content Type: Personal Profile;Wallach, Janet;Flirting With Danger: The Mysterious Life of Marguerite Harrison, Socialite Spy (Book)"
28,"In Elizabeth Acevedo’s new novel, a family grapples with life and grief after their sister, who can predict death, decides to host a wake for herself.","Family is very often a fraught business, but make it a group of Dominican women with special gifts that include “an affinity for herbalism” and “an ear for the tenor of truth,” and family becomes a power tribe of ancestral legionnaires. These are the Marte sisters — Matilde, Flor, Pastora and Camila — who live at the center of Elizabeth Acevedo’s prismatic new novel, “Family Lore,” a labyrinthine tale of sisterhood and the chaos of love.",2023-08-01T09:00:29+0000,article,Books,Review,"‘Family Lore’ Is a Tender Tale of Sisterhood, With a Magical Twist","Books and Literature;Acevedo, Elizabeth (Poet)"
29,"In his memoir, “Waiting to Be Arrested at Night,” the poet Tahir Hamut Izgil evokes the fear and danger of daily life for a Chinese ethnic minority that has been the target of a brutal crackdown.","The Uyghur poet Tahir Hamut Izgil’s new memoir, “Waiting to Be Arrested at Night,” is an outlier among books about human rights. There are no scenes of torture, no violence and few sweeping proclamations about genocide. Izgil writes with calculated restraint. As his title suggests, the terror is in the anticipation.",2023-08-01T09:00:30+0000,article,Books,Review,A Uyghur’s Lament for a Persecuted People,"Books and Literature;Izgil, Tahir Hamut;Uighurs (Chinese Ethnic Group);Poetry and Poets;Political Prisoners;Muslims and Islam;Urumqi (China);Content Type: Personal Profile"
30,"In theory, there is no branch in the American constitutional system that exists above or beyond the reach of the others.","In theory, there is no branch in the American constitutional system that exists above or beyond the reach of the others.",2023-08-01T09:00:32+0000,article,Opinion,Op-Ed,The Arrogance of Samuel Alito,"Law and Legislation;Ethics and Official Misconduct;Conflicts of Interest;Constitution (US);Conservatism (US Politics);United States;Supreme Court (US);Wall Street Journal;ALITO, SAMUEL A JR"
31,Making a few tweaks to your fitness habits — and mind-set — as you hit middle age can set you up for long-term mobility with less pain.,"Getting older doesn’t have to mean moving less. The key to longstanding fitness, experts say, is envisioning the kind of athlete you want to be 20, 30, even 40 years from now, and training smartly in the present for that future.",2023-08-01T09:00:33+0000,article,Well,News,How You Should Change Your Workout Once You Hit 40,"Exercise;Content Type: Service;Muscles;Longevity;Age, Chronological;Habits and Routines (Behavior);Physical Therapy;internal-sub-only-except-search"
32,"In Kyle Dillon Hertz’s novel, “The Lookback Window,” a victim of child sexual abuse questions what healing looks like when a law gives him the chance to press charges against his assailants.","“I didn’t yet have the words for what happened to me,” says Dylan, the narrator of “The Lookback Window,” Kyle Dillon Hertz’s gripping and savagely beautiful debut novel. But he has covered himself with language. There are tattoos all over his body. Only a few can be made out clearly: “PARADISE” on his navel, “NO DEATH” across his collarbone, knucklebangers proclaiming “FOREVER.” People always want to know what they mean, but the meaning isn’t the point. The tattoos “felt like armor,” Dylan says.",2023-08-01T09:00:33+0000,article,Books,Review,"Is It Justice or a Journey Into Hell, or Both?","Books and Literature;Hertz, Kyle Dillon"
33,"In “Time’s Mouth,” a time traveler forms a cult for pregnant women in the woods of Northern California.","In Edan Lepucki’s third novel, “Time’s Mouth,” a runaway named Sharon finds herself pregnant, alone and in semi-permanent possession of a sprawling Victorian in the woods outside Ben Lomond, Calif. By now she has changed her name to Ursa. She turns the house into a refuge for pregnant women who come to be called “the mamas.” She bans all males other than sons. She also forms a cult around her ability to go back in time, a practice referred to as “transporting” or “tunneling.” Magical stones and a mint tea ritual are involved.",2023-08-01T09:00:34+0000,article,Books,Review,Edan Lepucki’s Third Novel Makes the ‘Cult of Motherhood’ Literal,"Books and Literature;Lepucki, Edan"
34,"Reading Claude Anet’s provocative 1920 novel “Ariane: A Russian Girl,” the reader may yearn for a little less conversation.","It would be nice if we had put to bed, so to speak, witless and reductive double standards about female promiscuity. Have you heard the one that goes, “A key that opens many locks is a master key, yet a lock that is opened by many keys” is … unprintably bad? Me neither — until I saw it on TikTok.",2023-08-01T09:00:36+0000,article,Books,Review,"Talking About Love in the Afternoon, Morning, Evening and Night","Books and Literature;Anet, Claude;Ariane: A Russian Girl (Book)"
35,"A memoir by Tahir Hamut Izgil, a Uyghur intellectual who escaped China, explores the corrosive effect of repression and surveillance on his community.","Tahir Hamut Izgil watched as parks emptied of people, naan bakeries boarded up their windows and, one after another, his friends were taken away.",2023-08-01T09:00:38+0000,article,Books,News,A Poet Captures the Terror of Life in an Authoritarian State,"Books and Literature;Uighurs (Chinese Ethnic Group);Poetry and Poets;Content Type: Personal Profile;Surveillance of Citizens by Government;Xinjiang (China);Izgil, Tahir Hamut"
36,"In a summer of deadly heat for hikers in the Southwest, rangers at Grand Canyon National Park use a pioneering approach of aggressive messaging and outreach to prevent disaster on the trails.","Watching weary day hikers start the long uphill hike from Phantom Ranch, a ranger station at the bottom of the Grand Canyon, Jeff Schwartz has learned to look for telltale warning signs.",2023-08-01T09:00:40+0000,article,Travel,News,"Saving Lives at the Grand Canyon, One Salty Snack at a Time","Grand Canyon National Park;Emergency Medical Treatment;Rescues;Heat and Heat Waves;Heatstroke;Hikes and Hiking;Travel and Vacations;Summer (Season);Deaths (Fatalities);National Parks, Monuments and Seashores"
37,What the resurgence of the cruise industry says about Americans’ desperate need to have fun right now.,"I’ve hiked the Himalayas, scaled dunes in Namibia, gotten lost on Japan’s back roads in a blizzard. I enjoy travel with an element of chaos and unpredictability because that’s where the excitement lies.",2023-08-01T09:00:41+0000,article,Opinion,Op-Ed,I Gave Up and Went on a Trip With Several Thousand of My Closest Friends,Travel and Vacations;Coronavirus (2019-nCoV);Cruises
38,Why does it feel so good to cry this hard?,"I’m mobbing through Bushwick, Brooklyn, in the back of a cab, listening to Lady Wray’s “Piece of Me” for the 12th time in a row, and I’m crying — very, very hard — and no, it’s not ugly crying. In fact, I’m pretty sure I look beautiful right now.",2023-08-01T09:00:41+0000,article,Magazine,News,I’ve Listened to This Breakup Song a Million Times,"Pop and Rock Music;Wray, Nicole (Lady Wray);Dating and Relationships;Homosexuality and Bisexuality;Black People;Blacks"
39,We are holding dogs to standards they cannot possibly understand.,"Any dog can bite. It is the special misfortune of dogs living in the most famous house in the United States to have their bites widely publicized, amplified and scrutinized. And so when Commander, the German shepherd who lives with President and Jill Biden, began biting, his behavior made headlines.",2023-08-01T09:01:00+0000,article,Opinion,Op-Ed,Consider This Before You Judge Commander (or Any Other Dog),United States Politics and Government;Dogs;Breeding of Animals;Champ (Dog);Major (Dog);Commander (Dog);Animal Cognition;Pets
