,abstract,lead_paragraph,pub_date,document_type,section_name,type_of_material,headline,keywords
83,A new musical from National Yiddish Theater Folksbiene stitches together music written and performed in Eastern Europe in the 1930s and ’40s.,"With the war between Israel and Hamas keeping much of the world on tenterhooks, and the tide of antisemitism evidently rising, now is either a perfect time, or far too painful a time, for “Amid Falling Walls,” a new Yiddish-language musical set during the Holocaust.",2023-11-28T17:44:19+0000,article,Theater,Review,‘Amid Falling Walls’ Review: Songs of Resilience From the Holocaust Era,"Theater;Amid Falling Walls (Play);Theater (Off Broadway);Yiddish Language;Museum of Jewish Heritage;National Yiddish Theater-Folksbiene;Didner, Motl;Mlotek, Zalmen;Schreier, Dan Moses;Skybell, Steven"
84,"The 91st annual celebration will take place on Wednesday and feature performances by Cher, Barry Manilow, Keke Palmer and others.","The Christmas tree at Rockefeller Center will be illuminated by more than 50,000 multicolored lights on Wednesday, kicking off a Midtown Manhattan holiday tradition that dates back to the 1930s.",2023-11-28T18:01:11+0000,article,New York,News,How to Watch the Rockefeller Center Christmas Tree Lighting,"Christmas Trees;Content Type: Service;NBCUniversal;Rockefeller Center (Manhattan, NY);Lighting;Christmas"
85,"Relations have deteriorated markedly since Russia’s invasion of Ukraine, and the Finns accuse Moscow of orchestrating a flow of migrants in retaliation for Finland joining NATO.",Finland said Tuesday it was temporarily closing its only remaining open border crossing with Russia to stem an influx of asylum seekers that it accuses Moscow of orchestrating in retaliation for Finland’s decision to join NATO.,2023-11-28T18:01:11+0000,article,World,News,Finland to Close the Last Border Crossing With Russia for Two Weeks,Europe;Finland;Russia;Russian Invasion of Ukraine (2022);European Union;North Atlantic Treaty Organization;Frontex;Migrants (Environmental)
86,"The West African nation has not identified the military officials and one civilian it arrested after attacks in the capital on Sunday that left 20 people dead and more than 2,000 prisoners on the loose.","The small West African nation of Sierra Leone announced on Tuesday that it had arrested 13 military officials and one civilian in connection with a thwarted coup attempt on Sunday, when 20 people were killed and more than 2,000 prisoners were let loose.",2023-11-28T18:19:19+0000,article,World,News,Sierra Leone Announces Arrest of 13 Military Officials in ‘Attempted Coup’,"Bio, Julius Maada;Sierra Leone;AFRICA;Economic Community of West African States (Ecowas);Coups D'Etat and Attempted Coups D'Etat;Civilian Casualties;Freetown (Sierra Leone)"
87,"Partridge brings holiday cheer to the Standard, East Village, bars pop up for the holiday and more restaurant news.","Imagine if, after publishing her flagship tomes, Julia Child had opened a French restaurant. George Motz has done something along those lines. The genial, whiskered filmmaker, a Long Island native, has spent decades chronicling the hamburger on TV, in guidebooks and cookbooks. He can now be seen pressing and seasoning onion-thatched portions of ground beef on the griddle at his first Hamburger America, a sunny restaurant with counter seats, booths and takeout, in SoHo. The restaurant’s name is that of his 2004 documentary film, a project that took him around the country researching hamburgers, and subsequent guidebook. In partnership with the owners of the Schnipper’s casual American restaurants, he serves a flattened fried onion burger with American cheese, and a classic smashburger with optional cheese and condiments, $7.25 for a single on a toasted, buttered potato roll, or $11.50 for a double. The meat is prime chuck, 75 percent lean. As for why the smashed burgers, they go back to what he says were the original hamburgers sold in the United States for more than 100 years. “I like history,” he said. There are fries, a few sandwiches, flavored milks including a chocolate egg cream, and Miller High Life, as well. Early next year he will invite guest hamburger makers from around the country on a monthly basis to serve their specialties. (Opens Wednesday)",2023-11-28T18:22:50+0000,article,Food,News,"Hamburger America, From a Burger Documentarian, Opens in the Village",Restaurants;Hamburgers;New York City
88,"The comedian Alex Edelman, the playwright Paula Vogel and the actor and writer Harvey Fierstein share their favorite jokes.","The comedian Alex Edelman, the playwright Paula Vogel and the actor and writer Harvey Fierstein share their favorite jokes.",2023-11-28T18:34:44+0000,multimedia,T Magazine,Video,Three Jewish Stage Luminaries Tell T a Joke,
89,"The company says it will start purging accounts, including services like Gmail and YouTube, that have been idle for two years or more.","If you have not used one of your Google accounts for a long time, you might want to this week. Inactive accounts will start vanishing on Dec. 1.",2023-11-28T18:55:27+0000,article,Technology,News,"Make Sure Your Google Accounts Are Active, or They Might Be Deleted",Computers and the Internet;Google Inc;E-Mail
90,Stocks and bonds were buoyed after even inflation-focused Federal Reserve officials suggested that rates may stay steady.,"Federal Reserve officials appear to be dialing back the chances of future interest rate increases, after months in which they have carefully kept the possibility of further policy changes alive for fear that inflation would prove stubborn.",2023-11-28T18:57:41+0000,article,Business Day,News,"Fed Officials Hint That Rate Increases Are Over, and Investors Celebrate","Interest Rates;Prices (Fares, Fees and Rates);Inflation (Economics);Gross Domestic Product;Bowman, Michelle;Waller, Christopher (1959- );Federal Reserve System;Stocks and Bonds;Standard & Poor's 500-Stock Index"
91,A family struggles to pull their mom away from the call of the sea. ,"Sarah writes: My mother sails every weekend and often throughout the week. It’s not uncommon to try to plan a family event, only for her to ask that it be rescheduled to a time she wouldn’t prefer to be sailing, like nighttime or during a storm. Such events include my brother’s 40th birthday, baby showers and even my wedding. Please ask her to stop this.",2023-11-28T18:59:04+0000,article,Magazine,News,Judge John Hodgman on the Sailor Mother,Comedy and Humor;Sailboats and Sailing
92,The poem’s repetitions evoke the grim repetitions of history. ,"In Divya Victor’s “Settlement,” the poem’s repetitions evoke the grim repetitions of history. Even the poem’s prepositions are heavy and hard to bear. The string of “overs” that begin the poem are the “overs” of domination. The “we” of the poem are the “settled” who have become willfully insensate to history. They are left with the stark culmination of the Thanksgiving feast: a broken bone with no meat. ",2023-11-28T18:59:30+0000,article,Magazine,News,Poem: Settlement,"Poetry and Poets;Victor, Divya"
93,"“Rockstar,” the country icon’s new double album of rock songs, is now the highest charting LP of her career. But her history with the genre runs deep.","At age 77, and with nearly 50 (!) solo studio releases to her name, Dolly Parton just scored the highest charting album of her career, the mammoth double LP “Rockstar,” which debuted on this week’s Billboard 200 at No. 3. (Darn those young whippersnappers Drake and Taylor Swift for standing in the way of Parton’s first No. 1!)",2023-11-28T19:00:03+0000,article,Arts,News,Dolly Parton (Really) Rocks,"Pop and Rock Music;Country Music;Parton, Dolly"
94,"This month, writer Suleika Jaouad revisits her second bone marrow transplant in the documentary “American Symphony.”","In the months following Suleika Jaouad’s second bone marrow transplant, her TikTok algorithm started serving her videos of bearded dragons shedding their skin. For a writer whose work deals in ambiguities, that metaphor was tidier than she’d have preferred.",2023-11-28T19:00:25+0000,article,Style,News,"A Tragedy, a Symphony, a Love Story","Books and Literature;Jaouad, Suleika;Batiste, Jon (1986- );Documentary Films and Programs"
95,The workers were trapped for more than two weeks after a landslide caused part of the tunnel they were building to collapse.,The workers were trapped for more than two weeks after a landslide caused part of the tunnel they were building to collapse.,2023-11-28T19:04:36+0000,multimedia,World,Video,Rescuers Free 41 Workers Trapped in a Collapsed Indian Tunnel,India;Rescues;Bridges and Tunnels;Landslides and Mudslides;Accidents and Safety
96,Some hosts do not appreciate the gesture.,"Adam writes: When we entertain, I tell people to bring nothing. What are we going to do with a bottle of wine? I don’t drink, and my husband prefers cocktails. When guests come proudly clutching some stupid gift, I berate them and force them to leave it in the car. My husband thinks this is severe.",2023-11-28T19:04:38+0000,article,Magazine,News,Judge John Hodgman on Bringing Wine to a Party,"Customs, Etiquette and Manners;Parties (Social);Gifts;Wines"
97,A government anti-smoking plan also includes costlier cigarettes and a ban on disposable vapes. Smoking is the leading cause of avoidable deaths in France.,"France will ban smoking on beaches, near public buildings like schools and in public parks and forests next year, the French government said on Tuesday, as it unveiled plans to curb the habit by making it slightly more expensive and far less attractive, especially to younger people.",2023-11-28T19:13:29+0000,article,World,News,"France to Ban Smoking in Forests, on Beaches and Near Schools",France;Smoking and Tobacco;Medicine and Health;Paris (France);Fines (Penalties)
98,Winning the rights to host the major global event is a coup for Crown Prince Mohammed bin Salman’s efforts to remake the kingdom’s international image.,"Saudi Arabia won the bid to host the World Expo 2030 in a landslide on Tuesday, delivering a triumph to Crown Prince Mohammed bin Salman, the kingdom’s de facto ruler, as he seeks to reshape the authoritarian country’s international image — and his own.",2023-11-28T19:15:57+0000,article,World,News,"Saudi Arabia to Host World Expo 2030, in Victory for Crown Prince","Saudi Arabia;Conventions, Fairs and Trade Shows;Mohammed bin Salman (1985- );International Relations;Italy;South Korea;Politics and Government;Human Rights and Human Rights Violations"
99,President Biden is facing deep anger over his solidarity with Israel among supporters and even from some staff members who have said they feel disenchanted with the president.,Follow live news updates on the Israel-Hamas war.,2023-11-28T19:33:59+0000,article,U.S.,News,Biden Navigates Divisions Over Gaza Inside the White House and Beyond,"Biden, Joseph R Jr;Polls and Public Opinion;Israel-Gaza War (2023- );Muslim Americans;Palestinian-Americans;Israel;Jews and Judaism;ARAB-AMERICANS;Gaza Strip;Palestinians;Terrorism;Hamas;Civilian Casualties;United States Politics and Government;United States International Relations"
100,A Democratic resolution to expel Representative George Santos aims to prevent Republican leadership from delaying action on the embattled congressman.,"House Democrats on Tuesday moved to force a vote this week on whether to expel Representative George Santos of New York from office, a strategic effort to prevent Republican leadership from slow-rolling any bid to push one of their own out of office.",2023-11-28T19:40:09+0000,article,New York,News,Democrats Pressure Republicans to Vote This Week to Expel Santos,"Santos, George (1988- );Goldman, Daniel S;Guest, Michael (1970- );Ethics and Official Misconduct;House of Representatives;Democratic Party;Republican Party;United States Politics and Government;New York State"
101,"Small businesses and risky borrowers face rising costs from the Federal Reserve’s moves, but the biggest companies have avoided taking a hit.","The prediction was straightforward: A rapid rise in interest rates orchestrated by the Federal Reserve would confine consumer spending and corporate profits, sharply reducing hiring and cooling a red-hot economy.",2023-11-28T19:50:23+0000,article,Business Day,News,Corporate America Has Dodged the Damage of High Rates. For Now.,Banking and Financial Institutions;Small Business;Private Equity;Interest Rates;Corporations;Inflation (Economics);Junk Bonds;United States Economy;Credit and Debt;Credit Ratings and Credit Rating Agencies;Federal Reserve System
102,Her anthem of female strength topped the Billboard R&B chart and reached No. 2 on the pop chart in 1971. Its appeal has endured.,"Jean Knight, a soul singer whose memorable single “Mr. Big Stuff,” a brassy anthem of female strength, rose to No. 1 on Billboard’s rhythm and blues chart in 1971, died on Wednesday in Tampa, Fla. She was 80.",2023-11-28T19:54:29+0000,article,Arts,Obituary (Obit),"Jean Knight, Who Struck Platinum With ‘Mr. Big Stuff,’ Dies at 80","Deaths (Obituaries);Rhythm and Blues (Music);New Orleans Jazz and Heritage Festival;Knight, Jean (1943-2023);Mr Big Stuff (Song);Stax Records"
103,"Modern Love in miniature, featuring reader-submitted stories of no more than 100 words.","When we lost our apartment, my job and your nest egg in the 2008 recession, you suggested we move into your van and drive south to stretch the paycheck you earned online. It was just you, me and our dog. Then I got pregnant in Peru, and we continued on with our baby in tow to Patagonia. We’d lost the American dream, but through life’s twists, we found a different one, on the road. After 14 years, 23 countries and four continents, we ditched the van but are still chasing new horizons, redefining what it means to be “better-off.” — Stevie Trujillo",2023-11-28T20:00:44+0000,article,Style,News,Tiny Love Stories: ‘We’d Lost the American Dream’,"Love (Emotion);Modern Love (Times Column);Dating and Relationships;Divorce, Separations and Annulments;Subprime Mortgage Crisis;Sneakers;Homosexuality and Bisexuality"
104,"Eitan Yahalomi, 12, was beaten and forced to watch videos from the Oct. 7 Hamas attack on Israel, his aunt, Deborah Cohen, says.","Eitan Yahalomi, 12, was beaten and forced to watch videos from the Oct. 7 Hamas attack on Israel, his aunt, Deborah Cohen, says.",2023-11-28T20:16:43+0000,article,World,News,Relatives describe the trauma of child hostages freed by Hamas.,
105,"The mayor had previously suggested that he had no intention of replacing the fund-raiser, Brianna Suggs.","Mayor Eric Adams of New York said on Tuesday that the 25-year-old woman he had chosen to manage his political fund-raising was no longer working in that role, weeks after a search of her home by the F.B.I. revealed a federal investigation into his campaign and plunged his administration into turmoil.",2023-11-28T20:29:23+0000,article,New York,News,Eric Adams’s Top Fund-Raiser Is Out Amid F.B.I. Scrutiny and Raid,"New York City;Suggs, Brianna;Adams, Eric L;Mayors;Politics and Government;Campaign Finance;Appointments and Executive Changes;Ethics and Official Misconduct"
106,A growing fraction of the progressive left is making common cause with some of the worst people on earth.,"Do the people chanting “Free Palestine” and “From the river to the sea, Palestine will be free” have any idea of the irreparable harm they’re doing to any hope of Palestinian sovereignty?",2023-11-28T20:31:48+0000,article,Opinion,Op-Ed,The Left Is Dooming Any Hope for a Palestinian State,Israel-Gaza War (2023- );Palestinians;Liberalism (US Politics);Politics and Government;Israel;West Bank;Gaza Strip;Hamas;Arab-Israeli War (1948)
107,"The group of 12 hostages, most of them Israelis, is the first to be released under the extended cease-fire agreement between Israel and Hamas.","Hamas released a group of 12 hostages on Tuesday, most of them Israelis or dual nationals but also including two Thai nationals, all of whom had been kidnapped during the Hamas-led Oct. 7 terrorist attacks in Israel.",2023-11-28T20:32:19+0000,article,World,News,Here’s What We Know About the Hostages Released on Tuesday,Kidnapping and Hostages;Israel-Gaza War (2023- );Hamas
108,The debate over a candidate’s photo reflects concerns among states over selfies of ballots and of people showing how they vote.,A Wisconsin judge on Monday dismissed a felony charge against a  school board candidate who had posted a photograph on Facebook of a ballot with his name filled in.,2023-11-28T20:56:15+0000,article,U.S.,News,Wisconsin Judge Dismisses Felony Charge in ‘Ballot Selfie’ Case,"Law and Legislation;Voter Fraud (Election Fraud);Freedom of Speech and Expression;American Civil Liberties Union;Milwaukee Journal Sentinel;Kaul, Josh;Malloy, Paul V;Wisconsin"
109,"Yes, workers are better off than they were a few years ago.","Ten finance guys are drinking in a bar. Nine of them are Masters of the Universe — wheeler-dealers who make many millions of dollars every year. The tenth is what Gordon Gekko, in the movie “Wall Street,” called a “$400,000-a-year working Wall Street stiff.”",2023-11-28T20:56:28+0000,article,Opinion,Op-Ed,Bidenomics and the Guys in the Bar,Economics (Theory and Philosophy);internal-sub-only-nl;United States Economy
110,"Both Israel and Hamas are reaping benefits from the cease-fire, but as the hostage-for-prisoner exchanges continue, Israeli leaders may feel growing pressure to resume the war.","The decision by Israel and Hamas to extend their brief truce has created short-term benefits for both sides but amplified uncertainty about how, when and whether Israel will continue its invasion of the Gaza Strip.",2023-11-28T20:59:15+0000,article,World,News,A Gaza Truce Aids Both Sides. Until the Calculus Changes.,Israel-Gaza War (2023- );Israel;Defense and Military Forces;Kidnapping and Hostages;Gaza Strip;Hamas;Terrorism;Palestinians;Prisons and Prisoners;Civilian Casualties;Espionage and Intelligence Services;Peace Process
111,Saying “they wants” instead of “they want” could make our new usage of “they” easier to handle.,"I have a proposal about our new usage of “they” to refer to individual people, as in, “Irene? Oh, they left an hour ago” or “Bernard cut themselves by accident.”",2023-11-28T21:00:02+0000,article,Opinion,Op-Ed,Knowing When ‘They’ Means One,English Language;Transgender;Grammar
112,"How Dyson’s cordless stick became a status symbol, a trophy of domesticity and a generational must-have.","When you imagine a life of luxury, what comes to mind? A mansion filled with walk-in closets the size of bedrooms? Garages housing sleek vehicles with German and Italian names?",2023-11-28T21:00:16+0000,article,Style,News,What Makes a Vacuum Cleaner Sexy?,Vacuum Cleaners;Dyson;Generation Z;Millennial Generation;Design;Advertising and Marketing
113,Plus how New Zealand’s Maori Wardens keep the peace.,"Two facts loom over the COP28 U.N. climate talks, which begin tomorrow in Dubai: Earth is careening toward climate disaster, and governments are acting too slowly to avert it.",2023-11-28T21:05:35+0000,article,Briefing,briefing,Wednesday Briefing: What to Watch at the U.N. Climate Talks,"Far East, South and Southeast Asia and Pacific Areas;Global Warming;Israel;Hamas;China"
114,The venerable magazine has experienced management upheaval and staff complaints in recent years. Now there’s a question over who wrote product reviews on its site.,"Three years ago, journalists at Sports Illustrated were worried that the venerable magazine’s new owners and operators were drastically lowering its standards. They noted reports of plagiarism, and worried about substandard writing and the use of freelance reporters with little due diligence. The journalists also wanted better pay, greater transparency during the hiring process and a guarantee that all work published on the Sports Illustrated website would be edited.",2023-11-28T21:07:28+0000,article,Business Day,News,"For Sports Illustrated, Report About Fake Authors Is Latest Stumble",Sports Illustrated;Authentic Brands Group;TheMaven Inc;News and News Media;Artificial Intelligence;Magazines
115,"Days after the pontiff was forced to slow down because of a flu, his doctors advised him to not travel to Dubai for COP28. Francis has made climate activism a hallmark of his papacy.","Pope Francis, following his doctor’s orders, will not attend the United Nations climate summit in Dubai later this week, the Vatican said Tuesday.",2023-11-28T21:19:31+0000,article,World,News,Pope Francis Cancels Trip to U.N. Climate Summit on Doctor’s Orders,Francis;Roman Catholic Church;United Nations;United Nations Framework Convention on Climate Change;Popes;Dubai (United Arab Emirates);Vatican City;Global Warming
116,"A billionaire himself, he was the witty vice chairman of Mr. Buffett’s powerhouse investment firm Berkshire Hathaway. But he had far more influence than his title suggested.","Charles T. Munger, who quit a well-established law career to be Warren E. Buffett’s partner and maxim-spouting alter-ego as they transformed a struggling New England textile company into the spectacularly successful investment firm Berkshire Hathaway, died on Tuesday in Santa Barbara, Calif. He was 99.",2023-11-28T21:29:41+0000,article,Business Day,Obituary (Obit),"Charles T. Munger, Much More Than Warren Buffett’s No. 2, Dies at 99","Munger, Charles T;Deaths (Obituaries);Berkshire Hathaway Inc;Buffett, Warren E;Omaha (Neb);Stocks and Bonds;Daily Journal Corporation"
117,Word of the action against Cardinal Raymond Burke came after the prelate’s increasingly pointed critiques of the reform-minded pope.,"Almost as soon as Pope Francis became the head of the Roman Catholic church in 2013, Raymond Burke, an American cardinal, emerged as his leading critic from within the church, becoming a de facto antipope for frustrated traditionalists who believed Francis was diluting doctrine.",2023-11-28T21:31:14+0000,article,World,News,Reports Say Pope Francis Is Evicting U.S. Cardinal From His Vatican Home,"Roman Catholic Church;Francis;Popes;Cardinals (Roman Catholic Prelates);Burke, Raymond L;Vatican City"
118,"The agreement, which includes an increase in compensation of about 22 percent over three years, ends months of tense negotiations.","After months of wrangling, New York City Ballet and the union representing its musicians announced on Tuesday they had reached a deal for a new contract.",2023-11-28T21:59:57+0000,article,Arts,News,New York City Ballet and Its Orchestra Reach Contract Deal,Dancing;Classical Music;Finances;New York City Ballet;Lincoln Center for the Performing Arts
119,"Through her scholarship and her teaching, she made it possible for women in abusive relationships to claim self-defense when fighting back.","Holly Maguigan, a law professor who drew on her years as a criminal defense lawyer to revolutionize the legal tools available to women who defend themselves against abusive partners, died on Nov. 15 in Manhattan. She was 78.",2023-11-28T22:08:55+0000,article,U.S.,Obituary (Obit),"Holly Maguigan, Who Fought for the Rights of Battered Women, Dies at 78","Deaths (Obituaries);Women's Rights;Domestic Violence;Self-Defense;Law and Legislation;Maguigan, Holly;New York University"
120,"United (mostly) in black, their differences were in the details.","In any other circumstance it would have been a shocking sight. But it was only fitting that in her death Rosalynn Carter, the pioneering woman who turned the role of first lady into a job, did one final thing no one else has been able to do this year: lure Melania Trump out of Mar-a-Lago and back into the public eye. Not only that, but she created a situation in which Mrs. Trump was seated right next to Michelle Obama.",2023-11-28T22:28:47+0000,article,Style,News,"Rare Gathering of Former First Ladies Shows Style, and Subtle Differences","First Ladies (US);Funerals and Memorials;Fashion and Apparel;Carter, Rosalynn;Biden, Jill Tracy Jacobs;Bush, Laura;Clinton, Hillary Rodham;Obama, Michelle;Trump, Melania"
121,"‘Everything is just so fragile,’ said a cousin of the first two hostages freed last month.","Hostages freed by Hamas are experiencing bursts of euphoria followed by emotional crashes as they emerge from weeks of paralyzing fear in captivity, according to Israeli relatives who spoke to journalists at the Israeli Embassy in London on Tuesday.",2023-11-28T22:38:18+0000,article,World,News,"Freed Israeli Hostages Feel Cycles of Emotion After Captivity, Families Say",Israel-Gaza War (2023- );Kidnapping and Hostages;Hamas;Gaza Strip;War and Armed Conflicts
122,"Also, the Koch brothers’ political group endorsed Nikki Haley. Here’s the latest at the end of Tuesday.","Twelve hostages who had been held captive by Hamas since its Oct. 7 attack on Israel were released today, as the cease-fire entered a fifth day and appeared to be holding. Not long afterward, the Israeli authorities said they had released another 30 imprisoned Palestinians.",2023-11-28T22:52:02+0000,article,Briefing,News,More Hostages Were Released From Gaza,
123,"The decision came three years after the publication ended its storied print edition, which began in 1872. It will still publish articles and videos on its website.","In yet another sign of its decline, Popular Science has stopped publishing its online magazine, three years after it shut its storied print edition, which began in 1872.",2023-11-28T22:55:20+0000,article,Business Day,News,Popular Science Shuts Online Magazine in Another Sign of Decline,Shutdowns (Institutional);Layoffs and Job Reductions;Magazines;Consumer Behavior;Science and Technology;News and News Media;Popular Science
