,abstract,lead_paragraph,pub_date,document_type,section_name,type_of_material,headline,keywords
38,"Memoirs by Barbra Streisand, Patrick Stewart, Jada Pinkett Smith; hotly anticipated books on Elon Musk and Sam Bankman-Fried; and plenty more.","A historian turns her eye to the country of her birth in this political history of the German Democratic Republic, which existed from 1949 to 1990. Contrary to common depictions, Hoyer presents a picture of a vibrant society that weathered intense state suppression but also enacted solidarity.",2023-09-04T09:02:34+0000,article,Books,News,33 Nonfiction Books to Read This Fall,"Books and Literature;Bankman-Fried, Sam;Baron, Martin D;Bass, Gary J;Bezos, Jeffrey P;Cather, Willa;Chast, Roz;Daugherty, Tracy (1955- );Friedman, Milton;Isaacson, Walter;Winkler, Henry;Washington, Kerry;Ullrich, Volker;Land, Stephanie;Lewis, Michael;Musk, Elon;Nguyen, Viet Thanh (1971- );Safina, Carl;Sinclair, Safiya;Smith, Jada Pinkett;Smith, Tracy K;Stewart, Patrick;Streisand, Barbra;Thrall, Nathan;Beyond the Wall: Art and Artifacts From the GDR (Book);Meltzer, Marisa;McMurtry, Larry;Raban, Jonathan;Chase, Jefferson (Translator);Lukianoff, Greg;Madonna;Gabriel, Mary (1955- );Shakur, Tupac;Romney, Mitt;Tweedy, Jeff;Wilco (Music Group);Taylor, Benjamin (1952- )"
39,The Roman Empire is both an illuminating precedent and a cautionary tale.,"America likes to think of itself in garlanded terms. The shining city on a hill. The indispensable nation. The land of the free. There’s something to each sobriquet, to be sure. But there’s another phrase, not always so flattering, that also applies to the United States: global empire.",2023-09-04T09:02:35+0000,article,Opinion,Op-Ed,America Is an Empire in Decline. That Doesn’t Mean It Has to Fall.,Roman Civilization;United States;China;United States International Relations
40,"The effort to help the Texas attorney general, whose impeachment trial starts Tuesday, is part of an ongoing struggle over the Republican Party’s future.","With television ads and text messages, direct mail and billboards, supporters of the embattled Texas attorney general, Ken Paxton, have embarked on an escalating campaign of political pressure, backed by hard-right billionaires, aimed at trying to sway the outcome of Mr. Paxton’s upcoming impeachment trial.",2023-09-04T09:02:42+0000,article,U.S.,News,A Conservative Push to Save Ken Paxton,"Impeachment;State Legislatures;Ethics and Official Misconduct;Attorneys General;Conservatism (US Politics);Texans for Lawsuit Reform;Empower Texans;Paxton, Ken;Perry, Rick;Bannon, Stephen K;Texas;Republican Party"
41,"Still pitching herself as a political outsider, Ms. Haley now has a political résumé that includes a stint in the Trump administration. Then there’s Mr. Trump himself.","Nikki Haley was polling in the low digits, fighting for oxygen among better-known and better-funded rivals in a contest clouded by scandal and involving the man whose job they all sought.",2023-09-04T09:02:53+0000,article,U.S.,News,"Nikki Haley Has a Playbook for Winning Tough Races, but 2024 Is Different","Presidential Election of 2024;United States Politics and Government;Republican Party;Haley, Nikki R;South Carolina;Ramaswamy, Vivek (1985- );Trump, Donald J;Primaries and Caucuses"
42,"A midcentury-modern house in Los Angeles, a Craftsman bungalow in Sacramento and a three-bedroom townhouse in Mountain View.","This Woodland Hills house was designed by Charles Du Bois, a prolific local architect who worked as a set designer for MGM early in his career. It was recently renovated and has new electrical and plumbing systems; new interior and exterior lighting; and new windows.",2023-09-04T09:02:55+0000,article,Real Estate,News,$2.2 Million Homes in California,Real Estate and Housing (Residential);Los Angeles (Calif);Sacramento (Calif);Mountain View (Calif)
43,The first high school seniors to apply to college since the Supreme Court’s landmark decision are trying to sort through a morass of conflicting guidance.,"On a Friday afternoon in July, 87 teenagers with name tags swinging around their necks converged in the dining hall at Nazareth University in Rochester, N.Y. They whizzed between the pizza counter and soda machines before setting their plates on tables, the chorus of the lunchroom growing louder by the minute. The students — rising high school seniors, nearly all Black or Latino — had come for a five-day workshop hosted by PeerForward, a nonprofit organization that helps promising students from low-income communities prepare to apply to college. But this year’s workshop was taking place in something of a changed world: Two weeks earlier, in a pair of high-profile cases challenging Harvard’s and the University of North Carolina’s use of affirmative action, the Supreme Court declared all race-conscious admission programs across the United States to be unlawful, and no one knew what that would mean for students like the ones sitting now in the Nazareth dining hall — least of all them. ",2023-09-04T09:03:11+0000,article,Magazine,News,Affirmative Action Is Over. Should Applicants Still Mention Their Race?,Colleges and Universities;Discrimination;Admissions Standards;Affirmative Action;Supreme Court (US);University of Kentucky;University of Missouri;Massachusetts Institute of Technology;Bronx (NYC)
44,"A new generation of cheaper and more flexible vessels could be vital in any conflict with China, but the Navy remains lashed to big shipbuilding programs driven by tradition, political influence and jobs.","A symphony of sorts echoed through the sprawling shipyard on the Gulf Coast of Mississippi — banging, hissing, beeping, horns, bells and whistles — as more than 7,000 workers hustled to fill orders fueled by the largest shipbuilding budget in the Navy’s history.",2023-09-04T09:03:15+0000,article,U.S.,News,"Faced With Evolving Threats, U.S. Navy Struggles to Change",United States Navy;United States Defense and Military Forces;Defense Department;Defense Contracts;Federal Budget (US);United States Politics and Government;Huntington Ingalls Industries Inc;Saildrone Inc;Drones (Pilotless Planes);Submarines and Submersibles;Lobbying and Lobbyists;Aircraft Carriers;Bahrain;vis-photo
45,City centers may have to be reimagined to solve the problem of vacant storefronts.,"Downtown San Francisco’s office buildings have been quieted by some of the highest vacancy rates and slowest return-to-office trends in the country. But when walking around the area, what makes it feel still so uninhabited is a different but related phenomenon downstairs from all those empty offices: the vacant ground floor.",2023-09-04T09:03:17+0000,article,The Upshot,News,The Ground-Floor Window Into What’s Ailing Downtowns,Real Estate (Commercial);Mixed-Use Developments;San Francisco (Calif);Shopping and Retail;Area Planning and Renewal;Restaurants
46,"Tracy Daugherty’s new biography is the first comprehensive account of the prolific novelist who brought us “Lonesome Dove,” “The Last Picture Show” and more.","When the art critic Dave Hickey learned that Tracy Daugherty was writing a biography of his friend Larry McMurtry (all three men are Texans), he said to Daugherty: “Knowing Larry, it’s going to be a real episodic book.” Episodic this biography is. It’s also vastly entertaining.",2023-09-04T09:03:24+0000,article,Books,Review,"Larry McMurtry, a Critter of the American West Who Rejected Its Mythos","Books and Literature;Writing and Writers;Content Type: Personal Profile;Daugherty, Tracy (1955- );McMurtry, Larry;Texas;Larry McMurtry: A Life (Book)"
47,A reader wonders how to wear retro pieces without looking dated.,"It is true that when we think about vintage clothing these days, we often think about it as a young person’s game: Gen Z rediscovering the ’90s (or the ’80s or the early 2000s) and finding the joy in low-slung cargo pants, cropped tops and mini backpacks as everyone celebrates them as champions of sustainability; or fresh-faced celebrities looking hip in midcentury haute couture.",2023-09-04T09:03:27+0000,article,Style,News,Are You Ever Too Old to Wear Vintage?,Fashion and Apparel;Content Type: Service;internal-open-access-from-nl
48,New research points to the limits of education as a path to upward mobility for Black workers.,Education has long been hailed as the path to upward mobility in America. But new research points to limits of education as an economic escalator for Black workers.,2023-09-04T09:03:29+0000,article,Business Day,News,"Occupational Segregation Drives Persistent Inequality, Study Says",Discrimination;Wages and Salaries;Black People;Blacks;Careers and Professions;Income Inequality;National Bureau of Economic Research;Opportunity@Work (Nonprofit)
49,"Climate. Refugees. Crime. With an election looming next year, the prime minister and his party are turning to populist issues.","When Greenpeace activists draped Prime Minister Rishi Sunak’s baronial country house in black fabric last month to protest his energy policies, public reaction focused on the troubling lapse in security. But on another level, the stunt showed that Mr. Sunak’s brand of hard-edge politics was hitting home in Britain.",2023-09-04T09:03:30+0000,article,World,News,"Rishi Sunak, Behind in U.K. Polls, Embraces Divisive Politics","Sunak, Rishi (1980- );Conservative Party (Great Britain);Labour Party (Great Britain);Politics and Government;Fuel Emissions (Transportation);Global Warming;Illegal Immigration"
50,"An investigation into the Navy’s efforts to modernize — to better prepare for a potential conflict with China — took me on a long journey from Pascagoula, Miss., to the Middle East.","An investigation into the Navy’s efforts to modernize — to better prepare for a potential conflict with China — took me on a long journey from Pascagoula, Miss., to the Middle East.",2023-09-04T09:03:31+0000,multimedia,U.S.,Interactive Feature,From Mississippi to Bahrain to See the Future of the Navy,United States Defense and Military Forces;Ships and Shipping;United States Navy;Bahrain;Mississippi
51,"A big obstacle is the lack of loans, a subject of intense disagreement between richer and poorer countries. But in Congo, a hard-fought solar investment shows a possible path forward.","The world is racing ahead with enormous investments in renewable energy, for the first time this year plowing more money into solar power than oil.",2023-09-04T09:03:43+0000,article,Climate,News,Clean Energy Projects Are Booming Everywhere. Except in Poor Nations.,"Alternative and Renewable Energy;Developing Countries;Goma (Congo, Democratic Republic of);International Relations;Global Warming;Electric Light and Power;Foreign Investments;Philanthropy;Greenhouse Gas Emissions;Banking and Financial Institutions"
52,Our state’s Republican supermajority has again done nothing in the face of the slaughter of our children.,"“No Significant Action Taken on TN Gun Laws” read the headline of The Tennessean on Wednesday, the day after the Tennessee General Assembly ended a special legislative session on gun safety. To call that headline an understatement is itself an understatement.",2023-09-04T09:06:49+0000,article,Opinion,Op-Ed,I Put My Money on the Weeping Mothers at the Tennessee State Capitol,"Gun Control;Children and Childhood;Covenant School, Nashville, Tenn, Shooting (2023);Tennessee;Republican Party;State Legislatures"
53,The detention of Ihor Kolomoisky came as Ukraine steps up efforts to punish graft and make its case for closer integration with the European Union.,"The arrest over the weekend of Ihor Kolomoisky, one of Ukraine’s richest men, has been seen as a sign of Ukrainian authorities’ drive to root out corruption and curb the influence of oligarchs.",2023-09-04T10:16:03+0000,article,World,News,Ukraine’s Arrest of Powerful Oligarch Is Latest Sign of Anti-Corruption Efforts,"Kolomoisky, Igor V;Russian Invasion of Ukraine (2022);Ukraine;Oil (Petroleum) and Gasoline;Zelensky, Volodymyr"
54,"After days of torrential rain, an exodus from the Nevada desert site began on Monday. The festival’s fiery climax, postponed twice, finally took place.",Tens of thousands of people who had spent days stranded at the Burning Man festival in a rain-gorged stew of mud and slop began to pack up their camps on Monday and stream away from the sprawling site in remote northwest Nevada.,2023-09-04T10:18:35+0000,article,U.S.,News,Burning Man Attendees Begin to Leave Soggy Festival Site,Festivals;Burning Man Festival;Weather;Black Rock Desert (Nev)
55,It took an icebreaker ship and two long-range helicopters to evacuate the staff member from an Australian research base to advanced medical care.,"When a staff member fell ill at Australia’s Antarctic research station and couldn’t be treated locally, the team tasked with rescuing them faced a daunting endeavor rife with obstacles.",2023-09-04T10:39:53+0000,article,World,News,"Perilous, Icy Mission Rescues Sick Worker in Antarctica",Rescues;ANTARCTIC REGIONS;Oceans and Seas;Australia
56,The potential for hurricanes in the coming months.,"In a typical Atlantic Ocean hurricane season, August is the ramp-up to September’s peak. This season came to life almost overnight in mid-August, producing a record four named storms in less than 48 hours.",2023-09-04T10:50:41+0000,article,Briefing,briefing,What’s Next for Hurricane Season,internal-storyline-no;Hurricane Idalia (2023)
57,"The removal of the defense minister highlights the enduring challenge of corruption in Ukraine, which has emerged as a rare area of criticism of President Volodymyr Zelensky’s leadership.",The removal of Ukraine’s minister of defense after a flurry of reports of graft and financial mismanagement in his department underscores a pivotal challenge for President Volodymyr Zelensky’s wartime leadership: stamping out the corruption that had been widespread in Ukraine for years.,2023-09-04T10:58:44+0000,article,World,News,‘Where Is the Money?’ Military Graft Becomes a Headache for Ukraine,"Corruption (Institutional);Defense and Military Forces;Russian Invasion of Ukraine (2022);Zelensky, Volodymyr;Ukraine;Russia;Reznikov, Oleksii"
58,"Beck Bennett stars in this funny, familiar Comedy Central sports movie, but Joel McHale steals the show.","“Office Race,” a ribald comedy from Jared Lapidus about an inveterate deadbeat reluctantly training for a marathon, understands one of the great unspoken truths about running: that it is a miserable, arduous, soul-destroying pastime, and also deeply, profoundly rewarding.",2023-09-04T11:00:09+0000,article,Movies,Review,‘Office Race’ Review: Slow and Not So Steady,"Movies;McHale, Joel;Office Race (Movie);Lapidus, Jared;Bennett, Beck"
59,Xi Jinping has never missed the annual Group of 20 gathering since taking power in 2012. Beijing would not explain his apparent decision to forgo the event in New Delhi.,"China indicated on Monday that its top leader, Xi Jinping, would skip the Group of 20 summit meeting in New Delhi this weekend, dealing a blow to India, the event’s host nation, and raising questions about Mr. Xi’s profile as a global statesman.",2023-09-04T11:08:35+0000,article,World,News,China’s Leader Looks Set to Skip G20 Summit in Snub to India,"International Relations;Politics and Government;Territorial Disputes;United States International Relations;Social Media;Maps;Communist Party of China;Jaishankar, Subrahmanyam;Li Qiang (1959- );Biden, Joseph R Jr;Xi Jinping;Modi, Narendra;Arunachal Pradesh (India);China;Delhi (India);New Delhi (India);United States;Group of Twenty"
60,"The suspect, Leo F. Burt, has evaded capture since the anti-Vietnam War bombing at the University of Wisconsin, which was considered the largest act of domestic terrorism at the time.","In the more than 50 years since a bomb ripped through a mathematics center at the University of Wisconsin, killing a graduate student and injuring several others in what was considered an attack protesting the Vietnam War, the F.B.I. has received hundreds of tips about the whereabouts of one of the suspects, Leo F. Burt.",2023-09-04T11:36:02+0000,article,U.S.,News,He’s Wanted in a 1970 Bombing. The F.B.I. Aged His Photo to Seek Tips.,"Terrorism;Burt, Leo F;Fugitives;Federal Bureau of Investigation;University of Wisconsin;Madison (Wis);Murders, Attempted Murders and Homicides;Vietnam War"
61,"When New York City movers clear out an apartment, they leave with a whole lot more than furniture.","A young woman in a U-Haul arrived in New York City nearly four years ago, ready to get settled into her new place in the West Village. She hired movers from Big Apple Moving to help her unload, Karl Osman, one of the company’s owners, recently recalled.",2023-09-04T12:00:09+0000,article,Style,News,"Movers See All, and They Have Thoughts on Your Relationship",Dating and Relationships;Moving and Moving Industry;New York City
62,"Entries for the week of Aug. 28, 2023.","This is Diary of a Spelling Bee Fanatic, a weekly review of the game that drives me out of my hive mind. In a good way. Sometimes. It is probably also worth mentioning that the Diary is a work of fiction.",2023-09-04T13:00:03+0000,article,Crosswords & Games,News,Diary of a Spelling Bee Fanatic,Spelling Bee (Game);Games;Puzzles
63,Women urge retailers to better meet the needs and tastes of a range of customers. Also: Trump supporters; ChatGPT plagiarism; China’s economic woes; the value of college.,To the Editor:,2023-09-04T14:00:07+0000,article,Opinion,Letter,Plus-Size Female Shoppers ‘Deserve Better’,"Shopping and Retail;Women and Girls;Fashion and Apparel;Colleges and Universities;Economic Conditions and Trends;ChatGPT;International Trade and World Market;Education (K-12);International Relations;Presidential Election of 2024;Trump, Donald J;China"
64,"A new scientific report offers the most exhaustive look yet at how nonnative plants and animals can drive extinctions, disrupt food systems and harm human health.","Thousands of invasive species introduced to new ecosystems around the world are causing more than $423 billion in estimated losses to the global economy every year by harming nature, damaging food systems and threatening human health, a wide-ranging scientific report published on Monday has found.",2023-09-04T14:17:12+0000,article,Climate,News,"Invasive Species Are Costing the Global Economy Billions, Study Finds",Invasive Species;Biodiversity;Intergovernmental Science-Policy Platform on Biodiversity and Ecosystem Services;Research;Endangered and Extinct Species;Conservation of Resources;Wildlife Trade and Poaching;Food;United Nations Convention on Biological Diversity
65,Looking for a new way to discover books? More than a dozen titles are hidden within this short section of text and the reading list grows as you correctly click on each one.,Looking for a new way to discover books? More than a dozen titles are hidden within this short section of text and the reading list grows as you correctly click on each one.,2023-09-04T14:30:04+0000,multimedia,Books,Interactive Feature,Can You Find These 14 Hidden Children’s Book Titles?,Books and Literature;Children and Childhood
66,"Some experts believe this 17th-century work now up for sale was originally stolen by the Nazis, but no clues to its prewar owner have turned up in years of searching.","It has become a familiar scenario in the art world: the heirs of a Jewish collector spot a painting in an auction catalog that was stolen from their relative in the Nazi era. They contact the auction house and, if all goes well, reach a settlement with the seller that ensures they receive a share of the revenue from the sale.",2023-09-04T14:34:41+0000,article,Arts,News,"A Painting Looted at Least Once, From Hitler, Is on the Block","Arts and Antiquities Looting;Holocaust and the Nazi Era;Frans Francken the Younger (1581-1642);Auctions;Neumeister Auctions;Gurlitt, Cornelius;Gurlitt, Hildebrand (1895-1956);Hitler, Adolf;Munich (Germany)"
67,The singer’s website said he had Merkel cell carcinoma for four years and died at his home on Long Island.,"Jimmy Buffett died of skin cancer at his home in Sag Harbor, N.Y., on Long Island, according to a statement on the singer-songwriter’s website.",2023-09-04T14:43:30+0000,article,Arts,News,Jimmy Buffett Died of Rare Form of Skin Cancer,"Buffett, Jimmy;Skin Cancer;Pop and Rock Music"
68,"The prime minister was warned in his past job as finance chief, an official said, that hundreds of schools contained dangerously weak concrete. Now classrooms are having to shut.","Prime Minister Rishi Sunak faced a mounting crisis over Britain’s crumbling schools after a former government official said on Monday that Mr. Sunak had refused to rebuild more schools while he was head of the Treasury, despite warnings that lightweight concrete used in hundreds of buildings was a risk to life.",2023-09-04T14:58:10+0000,article,World,News,"In U.K. Crisis Over Unsafe Schools, Ex-Official Pins Blame on Sunak","Education (K-12);Concrete;Politics and Government;Conservative Party (Great Britain);Labour Party (Great Britain);Sunak, Rishi (1980- );England;Great Britain;London (England)"
69,"And a six-ingredient, 20-minute, five-star salmon recipe that one reader calls “life-changing.”","Hello! Mia again, here with you for one more Cooking newsletter adventure before Melissa returns on Wednesday.",2023-09-04T15:00:03+0000,article,Food,Letter,Baked Spaghetti Is a 9x13 Pan of Comfort,Cooking and Cookbooks;Content Type: Service
70,"A warming climate could make cities even less hospitable to wild mammals, according to new research.","Don’t let the rats fool you. Although the pizza-pilfering vagabonds — and a variety of other creatures — thrive in cities, for many wild animals urban environments are unappealing homes, covered in concrete and carved up by car traffic. As buildings go up and roads are laid down, some species seem to vanish from the landscape, and animal communities often become less diverse, scientists have found.",2023-09-04T15:00:18+0000,article,Science,News,"Urban Animals Can’t Take the Heat, Study Finds",your-feed-science;your-feed-animals;Animals;Foxes;Urban Areas;Biodiversity;Global Warming;Environment;Mammals;Mountain Lions and Cougars
71,"He was a founding member of the band, which broke out in the late 1990s with hit songs like “Walkin’ on the Sun” and “All Star.”","Steve Harwell, the former lead singer of the rock band Smash Mouth, which was best known for its 1999 hit “All Star,” died on Monday. He was 56.",2023-09-04T15:14:44+0000,article,Arts,Obituary (Obit),"Steve Harwell, Voice of the Band Smash Mouth, Is Dead at 56","Harwell, Steve;Smash Mouth (Music Group);All Star (Song);Pop and Rock Music;Deaths (Obituaries)"
72,"Francis called relations with Beijing “very respectful,” though few clergy or Catholics from China went to see him during a visit to Mongolia, seemingly fearing reprisals.","The small group of Chinese Catholics who crossed the border to see Pope Francis covered their faces for fear of reprisal. Church officials blamed the Communist government for preventing mainland China’s bishops from coming to see the pope. And diplomats said that China had watched the pope’s activities closely, and warily.",2023-09-04T15:18:36+0000,article,World,News,"When It Comes to China, Pope Francis Keeps Criticism in Check","Francis;China;Roman Catholic Church;Mongolia;International Relations;Politics and Government;Religion-State Relations;Cardinals (Roman Catholic Prelates);Popes;Christians and Christianity;Mongols (Ethnic Group);Russian Invasion of Ukraine (2022);Putin, Vladimir V;Xi Jinping;Chow, Stephen;Russia"
73,The story of her life with the rock star lacks major musical moments because the singer’s estate wouldn’t support the warts-and-all treatment.,"You may not think there’s a need for two big Elvis Presley movies in back-to-back years, but it’s hard to imagine a pair of filmmakers with sensibilities as different as Baz Luhrmann, who directed “Elvis” (2022), and Sofia Coppola, who came to the Venice Film Festival on Monday to debut “Priscilla,” about the rocky marriage between Priscilla Presley and her famous beau.",2023-09-04T16:44:44+0000,article,Movies,News,Priscilla Presley’s Emotional Reaction to Sofia Coppola’s New Elvis Film,"Movies;Pop and Rock Music;Coppola, Sofia;Elordi, Jacob;Presley, Elvis;Presley, Priscilla;Priscilla (Movie);Venice International Film Festival"
74,"For decades, mystery has surrounded the fate of the missing bass that accompanied the Beatles as they rocketed to fame. A new campaign is trying to find it.","Before Beatlemania, there was the distinctive Höfner violin bass — the first guitar that Paul McCartney bought after becoming the bassist for the Beatles.",2023-09-04T17:00:35+0000,article,World,News,Have You Seen Paul McCartney’s Lost Bass Guitar? Tips Welcome.,"McCartney, Paul;Beatles, The;Guitars;Lost and Found Property;Pop and Rock Music;Great Britain;London (England)"
75,"He spent decades working on artificial intelligence, striving to create computers that could replicate common sense.","Douglas Lenat, an artificial intelligence researcher who spent nearly 40 years trying to build common sense into computers, recreating human judgment one logical rule at a time, died on Thursday in Austin, Texas. He was 72.",2023-09-04T18:04:26+0000,article,Technology,Obituary (Obit),"Douglas Lenat, Who Tried to Make A.I. More Human, Dies at 72","Artificial Intelligence;Lenat, Douglas (1950-2023);Stanford University;Deaths (Obituaries)"
