,abstract,lead_paragraph,pub_date,document_type,section_name,type_of_material,headline,keywords
82,"Elizabeth Tsurkov, an Israeli researcher, was seized in late March by an Iraqi Shiite group shortly after leaving a Baghdad cafe. The office of the Israeli prime minister confirmed she was being held.","An Israeli researcher missing for months in Iraq is being held by a Shiite militia, according to a statement from the office of Prime Minister Benjamin Netanyahu.",2023-07-05T16:54:36+0000,article,World,News,Israeli Woman Held for Months in Iraq by Shiite Militia Linked to Iran,"Kidnapping and Hostages;Defense and Military Forces;War and Armed Conflicts;Kataib Hezbollah;Princeton University;Hezbollah;Islamic Revolutionary Guards Corps;Suleimani, Qassim;Baghdad (Iraq);Iraq;Iran;Israel"
83,"Until fairly recently, that would have seemed like a peculiar question. But many experts on American history and political science say U.S. democracy is relatively young.",How old were you when the United States became a democracy?,2023-07-05T16:56:26+0000,article,World,News,When Did the U.S. Become a Democracy?,internal-sub-only-nl;Democracy (Theory and Philosophy);Voting Rights Act (1965);United States
84,"The magazine took down the story on David Zaslav without any explanation, an unusual move for a publication.","The article on the GQ website was a fierce critique of David Zaslav, comparing the Warner Bros. Discovery chief executive to the ruthless business tycoon played by Richard Gere in “Pretty Woman.”",2023-07-05T17:01:48+0000,article,Business Day,News,GQ Removes Article Critical of Warner Bros. Discovery C.E.O.,"GQ;Zaslav, David M;Warner Bros Discovery;Magazines;News and News Media;Conde Nast Publications Inc;Bailey, Jason (Journalist)"
85,"The war has illuminated one of the biggest ideological divides within the Republican Party: between members who see a significant global role for the United States, and a more isolationist wing.","Few issues have been more divisive among the Republican presidential candidates than the war in Ukraine and how, if at all, the United States should be involved.",2023-07-05T17:05:17+0000,article,U.S.,News,Where the Republican Candidates Stand on Ukraine,Presidential Election of 2024;United States Politics and Government;Republican Party;Russian Invasion of Ukraine (2022);Ukraine
86,Mr. Salaam was one of the Central Park Five who were wrongly convicted and then exonerated in the rape and assault of a jogger in Central Park in 1989.,"Yusef Salaam, one of five Black and Latino men whose convictions were overturned in the 1989 rape and assault of a female jogger in Central Park, cemented his victory in a highly contested City Council primary race in Harlem, according to The Associated Press on Wednesday.",2023-07-05T17:34:48+0000,article,New York,News,Yusef Salaam Is Declared Winner of Harlem City Council Primary Race,"Salaam, Yusef;Elections, City Councils;Primaries and Caucuses;False Arrests, Convictions and Imprisonments;Central Park Jogger Case (1989);Politics and Government;Harlem (Manhattan, NY);New York City"
87,Federal Reserve officials are debating how high to raise interest rates to fully wrangle inflation. The debate was in focus at their meeting last month.,"Federal Reserve officials were concerned about sluggish progress toward lower inflation and wary about the surprising staying power of the American economy at their June meeting — so much so that some even wanted to raise rates last month, instead of holding them steady as the central bank ultimately did, minutes from the gathering showed.",2023-07-05T18:10:48+0000,article,Business Day,News,Fed Officials Were Wary About Slow Inflation Progress at June Meeting,"United States Economy;Interest Rates;Prices (Fares, Fees and Rates);Inflation (Economics);Consumer Behavior;Powell, Jerome H;Federal Reserve System"
88,"Nasser al-Khelaifi, the president of Paris St.-Germain, was introducing the team’s new coach when he turned to tough talk on the future of his team’s biggest star.",It was at the unveiling of yet another new coach that Paris St.-Germain’s president made his first public statement on the future of his team’s best player. He did not equivocate and left little room for compromise.,2023-07-05T18:11:32+0000,article,Sports,News,P.S.G. Says Mbappé Must Sign a New Deal or Leave the Club,"Soccer;Paris St-Germain FC (Soccer Team);Mbappe, Kylian (1998- );al-Khelaifi, Nasser;Enrique, Luis (1970- );Coaches and Managers"
89,"A man who etched his initials and those of his girlfriend in a wall of the nearly 2,000-year-old monument wrote a letter of apology, and his lawyer says he is hoping for a plea bargain.","A man seen on video last month using his keys to etch his love for his girlfriend on a wall in the Colosseum in Rome has written a letter of apology, saying he had no idea the nearly 2,000-year-old monument was so ancient.",2023-07-05T18:16:45+0000,article,World,News,Who Knew the Colosseum Was So Old? Tourist Apologizes for Defacement.,Vandalism;Apologies;Colosseum (Rome);Travel and Vacations;Archaeology and Anthropology;Fines (Penalties)
90,The project in the waters southeast of Atlantic City marks the third major wind farm authorized by the Biden administration.,"The U.S. Bureau of Ocean Energy Management on Wednesday approved the construction of up to 98 wind turbine generators off the coast of Atlantic City, N.J., as part of a Biden administration plan to install offshore wind sites along the country’s coasts.",2023-07-05T18:19:26+0000,article,Climate,News,Commercial-Scale Wind Farm Off New Jersey Coast Approved,"Global Warming;Greenhouse Gas Emissions;Wind Power;Fish and Other Marine Life;Coastal Areas;Energy and Power;Alternative and Renewable Energy;Whales and Whaling;Bureau of Ocean Energy Management, Regulation and Enforcement"
91,"In an Oval Office meeting, President Biden again backed the plan for Sweden to join the military alliance, but movement has been stalled by Turkey’s opposition.","President Biden told Prime Minister Ulf Kristersson of Sweden on Wednesday that he was “anxiously looking forward” to the country’s acceptance into NATO, reiterating their shared goal of strengthening the Western alliance against the Russian invasion of Ukraine.",2023-07-05T18:26:19+0000,article,U.S.,News,Biden Says He Is ‘Anxiously’ Waiting for Sweden to Join NATO,"United States Politics and Government;Terrorism;Defense and Military Forces;United States International Relations;Kurdistan Workers' Party;Biden, Joseph R Jr;Erdogan, Recep Tayyip;Kristersson, Ulf;Russia;Russian Invasion of Ukraine (2022);Sweden;Turkey;North Atlantic Treaty Organization"
92,"A baggie that was confirmed to contain cocaine was found in the guest lobby of the West Wing on Sunday evening, an agency spokesman said.","The Secret Service is looking to find out who brought a baggie of cocaine that was discovered on Sunday evening into a guest lobby of the West Wing of the White House, an agency spokesman said on Wednesday.",2023-07-05T18:30:12+0000,article,U.S.,News,Secret Service Investigating Who Brought Cocaine Into the White House,"Cocaine and Crack Cocaine;White House Building (Washington, DC);United States Politics and Government;Secret Service"
93,"The Fisher Center at Bard has become an incubator for commercially promising new work like Justin Peck’s “Illinois,” while holding tight to its experimental roots.","On a recent Saturday night, a group of young people were gathered in this bucolic hamlet in the Hudson Valley, building a campfire of sorts. There were no matches or flames, but there were lanterns, chirping crickets, fir trees swirled with haze and, at one point, a zombie attack.",2023-07-05T18:32:56+0000,article,Theater,News,"At 20, an Upstate Arts Haven Keeps Breaking New Ground","Theater;Dancing;Music;Bard College;Fisher, Richard B, Center for the Performing Arts at Bard College;LESTER, GIDEON;Peck, Justin;Tanowitz, Pam;Botstein, Leon;Four Quartets (Dance);Illinois (Dance)"
94,"I’m a health and science reporter for The Times. Here are five things I’ve been watching, reading and listening to.","I’m a health and science reporter for The Times. Here are five things I’ve been watching, reading and listening to.",2023-07-05T18:36:39+0000,multimedia,Arts,Interactive Feature,What’s in Our Queue? ‘The Diplomat’ and More,"The Diplomat (2023) (TV Program);Rush, Norman;Armatrading, Joan;Park, Ina"
95,Israelis and Palestinians said the armed groups that were the targets of the military raid would quickly rebuild and the Israeli soldiers would be back soon.,"Before 8 a.m. on Wednesday, the Israeli military said it had finished its incursion into the West Bank city of Jenin, aimed at curbing attacks on Israelis by armed Palestinians. Barely five hours later, about 25 miles away, shots fired from a car with Palestinian plates hit an Israeli police vehicle, causing damage but no casualties.",2023-07-05T18:55:59+0000,article,World,News,Israel’s Major Incursion in the West Bank Is Over. Did It Solve Anything?,Jenin (West Bank);Defense and Military Forces;Israel;Deaths (Fatalities);Palestinians;Palestinian Authority;Hamas;Palestinian Islamic Jihad;War and Armed Conflicts;Terrorism;Politics and Government;Drones (Pilotless Planes);Peace Process;Gaza Strip;West Bank
96,"Seattle, New York City and Los Angeles were among the places with high air quality indexes after fireworks celebrations.","The air quality index Wednesday morning reached the “unhealthy” benchmark in cities across the United States including Seattle, Los Angeles and Pittsburgh. Millions of Americans have felt the effects of thick smoke from Canadian wildfires in recent weeks, but experts said the smog this time was likely to be a combination of Fourth of July fireworks, stagnant air and, in some areas, West Coast wildfires.",2023-07-05T18:58:45+0000,article,U.S.,News,Holiday Fireworks Worsen Air Quality Nationwide,Independence Day (US) (July 4);Fireworks;Air Pollution;National Weather Service;California;Long Island (NY);Connecticut;New York City
97,"At the helm of Soho Rep, Benson presided over a long streak of ambitious, thought-provoking works. As she heads out the door, she reflects on her vision for theater’s future and plans for her own.","Contemporary American theater would not be the same without a 65-seat theater tucked away on a quiet TriBeCa side street. Founded in 1975, Soho Rep has produced new, often boundary-pushing plays, including, in recent years, Branden Jacobs-Jenkins’s “An Octoroon,” in 2014, and Jackie Sibblies Drury’s Pulitzer Prize-winning “Fairview,” in 2018.",2023-07-05T19:07:58+0000,article,Theater,News,Sarah Benson Thinks Audiences Want a Challenge,"Theater;Content Type: Personal Profile;Benson, Sarah (Theater Director);Soho Rep"
98,"A man charged with plotting to storm the Capitol is the latest to use baseless assertions as a defense, leading prosecutors to warn of “a circuslike atmosphere.”","Almost from the moment that a pro-Trump mob stormed into the Capitol on Jan. 6, 2021, conspiracy theories have ricocheted from the fringes of the internet to the corridors of Congress. Republican officials and others on the right have dismissed the attack as the work of mere tourists, or sought to depict it as a false-flag operation by shadowy leftist groups — or even the federal government.",2023-07-05T19:16:57+0000,article,U.S.,News,Prosecutors Face Conspiracy Theories in Jan. 6 Trial,"Storming of the US Capitol (Jan, 2021);Conspiracy Theories;Right-Wing Extremism and Alt-Right;United States Politics and Government;American Phoenix Project;Three Percenters;Justice Department;Hostetter, Alan"
99,Gerson Fuentes agreed to a plea deal after he was charged with raping a 9-year-old Ohio girl who later traveled to Indiana for an abortion.,"Last year, the story of a 10-year-old girl in Ohio who had traveled to Indiana for an abortion became a flashpoint in the nationwide abortion debate. On Wednesday, the Ohio man who had been charged with raping the girl pleaded guilty and was sentenced to life in prison with the possibility of parole.",2023-07-05T19:26:31+0000,article,U.S.,News,Man Gets Life Sentence in Rape of Child Who Traveled for Abortion,"Child Abuse and Neglect;Sex Crimes;Abortion;Fuentes, Gerson (1995- );Ohio"
100,,,2023-07-05T19:29:48+0000,multimedia,,,The Best Early Prime Day Deals of 2023,
101,,,2023-07-05T19:30:00+0000,multimedia,,,"‘Elemental’ Review: In Pixar’s New Movie, Sparks Fly",
102,,,2023-07-05T19:30:27+0000,multimedia,,,Sweet Cold Foam Recipe,
103,"In 2020, Iranian missiles struck a Ukraine Airlines flight, killing all 176 people on board. Four countries have filed suit in The Hague demanding a credible account and full compensation.","On a clear January morning in 2020, Ukraine Airlines Flight 752 was struck by two Iranian missiles just three minutes after leaving an airport in Tehran, killing all 176 passengers.",2023-07-05T19:50:56+0000,article,World,News,"Years After Iranian Missiles Downed a Passenger Jet, a Suit Seeks Answers","Iran;Aviation Accidents, Safety and Disasters;Defense and Military Forces;International Court of Justice (UN);Ukraine;Canada;Great Britain;Sweden;Suits and Litigation (Civil);International Relations"
104,President Recep Tayyip Erdogan of Turkey has blocked Sweden’s NATO membership bid.,President Recep Tayyip Erdogan of Turkey has blocked Sweden’s NATO membership bid.,2023-07-05T19:59:39+0000,multimedia,U.S.,Video,"U.S. ‘Fully’ Supports Sweden’s Bid to Join NATO, Biden Says","Kristersson, Ulf;Biden, Joseph R Jr;Sweden;North Atlantic Treaty Organization;United States;United States Politics and Government;Politics and Government"
105,The hole left by generations of absentee fathers is filled by a powerful matriarchy.,"Kema Christian-Coates’s childhood was filled with “holiday men,” absentee fathers — including her own — who returned each year around Christmas only to disappear again. Her father’s absence left a hole in her life and the fear that she, like her mother and grandmother, would never find a man she could rely on.",2023-07-05T20:00:10+0000,article,Podcasts,News,The Gift of Holiday Men,Love (Emotion);Dating and Relationships;Men and Boys
106,A new study finds that people have a very difficult time finding doctors in their networks under the private-sector policies.,"People with private Medicare coverage may not be getting the mental health services they need because they cannot find a psychiatrist within their plan’s network, according to a new study. ",2023-07-05T20:00:11+0000,article,Health,News,Medicare Advantage Plans Offer Few Psychiatrists,Research;Health Insurance and Managed Care;Medicare;Psychiatry and Psychiatrists;Mental Health and Disorders;Medicare Advantage;Elderly
107,"Donald Felix Zampach, 65, received more than $830,000 in payments from the government intended for his late mother. He also took possession of her home while it was still in her name.","A California man has admitted that he hid his mother’s death from the federal government for over three decades so that he could collect more than $800,000 in benefits intended for her, prosecutors said.",2023-07-05T20:23:52+0000,article,U.S.,News,California Man Hid Mother’s Death for 3 Decades to Collect Her Benefits,Social Security (US);Securities and Commodities Violations;Identity Theft
108,"Also, fatal floods in China and other Asian countries.","Israel’s military said yesterday that it had withdrawn from the occupied West Bank city of Jenin after a large-scale incursion that killed at least 12 Palestinians, left one Israeli soldier dead and sent thousands fleeing from their homes over the past two days.",2023-07-05T21:34:48+0000,article,Briefing,briefing,Your Thursday Briefing: Israel’s West Bank Raid Ends,"Far East, South and Southeast Asia and Pacific Areas;China;Israel;Jenin (West Bank);West Bank;East Asia;Ukraine;Ruan Xiaohuan;Wham! (Music Group);Surveillance of Citizens by Government;Pop and Rock Music;International Relations;Palestinians"
109,"Also, a flurry of gun violence. Here’s the latest at the end of Wednesday.",President Biden welcomed Prime Minister Ulf Kristersson of Sweden at the White House today to emphasize America’s support for the Nordic nation’s swift acceptance into NATO.,2023-07-05T21:41:58+0000,article,Briefing,News,"Biden Backed NATO Expansion, but It Won’t Be Easy",
110,"After his wrongful conviction as one of the Central Park Five was overturned, Mr. Salaam found it hard to rebuild his life. Now he stands to take office next year.","This week, 34 years after he and four other teenage boys who barely knew one another were bound together by notorious failures of justice, Yusef Salaam was officially declared the winner in the Democratic primary for a seat in New York’s City Council, having received almost 64 percent of the vote. Given that more than three-quarters of voters in the district identify as Democrats, we can assume that beginning in January, he will represent Harlem, where he grew up, was arrested and returned after serving nearly seven years in prison for a crime he did not commit.",2023-07-05T21:44:42+0000,article,New York,News,"For Yusef Salaam, a Landslide Just Might Be the Best Revenge","Elections, City Councils;Primaries and Caucuses;Content Type: Personal Profile;Central Park Jogger Case (1989);City Council (NYC);Salaam, Yusef;Jordan, Kristin Richardson (1987- );Harlem (Manhattan, NY);Democratic Party;New York City"
111,"The Florida governor, who has yet to demonstrate himself as a campaigner on a national stage, has been plagued by a series of unforced errors and has yet to make a strong case against Donald Trump.","Gov. Ron DeSantis of Florida, looking to shift his run for president into a higher gear after an early series of missteps, spent the last two weeks rolling out an immigration policy and holding town halls with voters. But rather than correcting course, he stumbled again this week, raising questions about where his campaign is heading.",2023-07-05T21:47:29+0000,article,U.S.,News,DeSantis Campaign Continues to Struggle to Find Its Footing,"DeSantis, Ron;Republican Party;Primaries and Caucuses;Presidential Election of 2024;United States Politics and Government;Polls and Public Opinion;Trump, Donald J"
112,Nancy Yao was to lead a Smithsonian museum about the influence of American women. Her withdrawal came amid a review of how she had handled sexual harassment complaints in an earlier post.,"The Smithsonian’s choice for the founding director of its developing American Women’s History Museum has withdrawn from the role, the institution said Wednesday.",2023-07-05T21:51:57+0000,article,Arts,News,"Director of New Women’s History Museum Withdraws, Citing Family Issues","Yao, Nancy;Smithsonian American Women's History Museum;Museums;Appointments and Executive Changes;Sexual Harassment;Workplace Hazards and Violations;Museum of Chinese in America;Washington (DC)"
113,"Want to see new art in New York this weekend? Check out Behjat Sadr’s earthy canvases in Greenwich Village or rafa esparza’s portraits in TriBeCA. And don’t miss John Fahey’s works on paper in Greenpoint, Brooklyn.","Want to see new art in New York this weekend? Check out “Luxe, Calme, Volupté” on the Lower East Side or “Reclamation” at Hudson Yards. And don’t miss Rachel Rossin’s “mechs” in Chinatown. ",2023-07-05T22:11:01+0000,article,Arts,News,What to See in N.Y.C. Galleries in July,"Art;Sculpture;Calel, Edgar;SculptureCenter;Hurley, Denzil;Canada Gallery (Manhattan, NY);Marrow, Michael Lawrence (Phase 2);ACA Gallery;von Bonin, Cosima (1962- );Petzel Gallery;New York City;Esparza, Rafa (1981- )"
114,Plus: “Barbie” memes and the Grimace Shake attacks.,"This week’s episode of Popcast (Deluxe), the weekly culture roundup show on YouTube hosted by Jon Caramanica and Joe Coscarelli, includes segments on:",2023-07-05T22:38:29+0000,article,Arts,News,"Popcast (Deluxe): Olivia Rodrigo Returns, Fall Out Boy Denies History","Pop and Rock Music;Robbie, Margot;Fall Out Boy (Music Group);Rodrigo, Olivia (2003- );Joel, Billy;The Hills (TV Program);Vampire (Song);We Didn't Start the Fire (Song);Barbie (Movie);audio-neutral-informative"
115,They said a restriction on government interaction with social media companies could impede efforts to curb false claims about vaccines and voter fraud.,"A federal judge’s decision this week to restrict the government’s communication with social media platforms could have broad side effects, according to researchers and groups that combat hate speech, online abuse and disinformation: It could further hamper efforts to curb harmful content.",2023-07-05T22:43:51+0000,article,Business Day,News,Disinformation Researchers Fret About Fallout From Judge’s Order,"Social Media;Computers and the Internet;Rumors and Misinformation;Freedom of Speech and Expression;Hate Speech;Research;Courts and the Judiciary;Doughty, Terry A;Decisions and Verdicts"
116,"Former Mayor Bill de Blasio of New York City and his wife, Chirlane McCray, announced they were separating after growing apart. Here’s what experts advise if you’re wondering about your own relationship.","Former Mayor Bill de Blasio of New York City and his wife, Chirlane McCray, announced that they were separating after nearly 30 years in an interview with The New York Times on Wednesday. Their story begins with an “aha” moment in the midst of what the article calls yet another “stale Saturday night of binge-watching television” together.",2023-07-05T22:52:35+0000,article,Well,News,How to Talk About Marital Unhappiness Before It’s Too Late,"Marriages;Therapy and Rehabilitation;Content Type: Service;de Blasio, Bill;McCray, Chirlane;Divorce, Separations and Annulments"
117,Here’s what to know about Instagram’s new app for public conversations and how it differs from Twitter.,"After months of speculation and secrecy, Mark Zuckerberg’s long-rumored competitor app to Twitter is here.",2023-07-05T23:00:10+0000,article,Technology,News,"Threads, Instagram’s ‘Twitter Killer,’ Has Arrived","Threads (Mobile App);Meta Platforms Inc;Zuckerberg, Mark E;Social Media;Mosseri, Adam;Mobile Applications;Instagram Inc;Musk, Elon;Twitter"
118,"Ukrainian and Russian officials differed on whether a military or civilian area had been struck. Earlier in the war, Russia lost dozens of soldiers, if not hundreds, in a strike on the city.","Ukraine’s military launched an overnight strike on the Russian-occupied city of Makiivka, showing that it could still attack targets deep behind Russian lines as its troops fight in grueling trench warfare in a counteroffensive to reclaim land.",2023-07-05T23:00:15+0000,article,World,News,"Ukraine Strikes a Russian-Occupied City, Igniting a Huge Blast",Russian Invasion of Ukraine (2022);Defense and Military Forces;Makiivka (Ukraine);Ukraine;Russia;Deaths (Fatalities);Bombs and Explosives
119,"By striking down affirmative action, justices take the absurd position that racism must be ignored for racism to be overcome.",There is a recurrent theme in American history: the clawing back of hard-won progress. And the Supreme Court last week used the most specious of arguments to do so with affirmative action.,2023-07-05T23:05:08+0000,article,Opinion,Op-Ed,The Supreme Court Didn’t Put Racism on a Leash. It Granted It License.,"Colleges and Universities;Discrimination;Black People;Blacks;Race and Ethnicity;Admissions Standards;Affirmative Action;Jackson, Ketanji Brown (1970- );Roberts, John G Jr;Thomas, Clarence;Decisions and Verdicts;Supreme Court (US)"
120,"A pop star across Asia by her early 20s, Ms. Lee reached international recognition with an Oscar-nominated song in 2001.","Coco Lee, a Chinese American singer and songwriter best known for performing an Oscar-nominated song in the hit film “Crouching Tiger, Hidden Dragon,” died on Wednesday in a hospital in Hong Kong. She was 48.",2023-07-05T23:09:58+0000,article,Arts,Obituary (Obit),"Coco Lee, ‘Crouching Tiger’ and ‘Mulan’ Singer, Dies at 48","Lee, Coco (1975-2023);Deaths (Obituaries);Chinese-Americans;Pop and Rock Music;Movies;Mulan (Movie);Crouching Tiger, Hidden Dragon (Movie)"
121,The attacker faces sentencing after pleading guilty to federal hate crimes charges. “Why is it us in pain and not you?” asked one survivor of the rampage that killed 23.,"Emotional testimony from survivors and victims’ families began on Wednesday in the federal sentencing hearing for the gunman who killed 23 people and injured dozens more at a Walmart store in El Paso, one of the deadliest attacks targeting Latinos in modern U.S. history.",2023-07-05T23:41:38+0000,article,U.S.,News,El Paso Gunman Is Confronted by Victims’ Families at Sentencing,"Murders, Attempted Murders and Homicides;Mass Shootings;Hate Crimes;Hispanic-Americans;El Paso, Tex, Shooting (2019);Crusius, Patrick (1998- );El Paso (Tex);Texas"
122,People who lived with the suspect told investigators that he was wearing a bulletproof vest around the house in the days before five people were gunned down.,"As the streets outside his home echoed with pops, Darryl Steplight thought it was fireworks on the eve of the Fourth of July. He quickly learned otherwise. A man in body armor, and carrying an AR-15-style rifle, had opened fire at random in the neighborhood, killing five and wounding two, including a 2-year-old.",2023-07-05T23:53:38+0000,article,U.S.,News,"Suspect Showed Troubling Signs Before Philadelphia Rampage, D.A. Says","Mass Shootings;Philadelphia (Pa);Carriker, Kimbrady"
