,abstract,lead_paragraph,pub_date,document_type,section_name,type_of_material,headline,keywords
43,"After her daughter was killed in a mass shooting in Uvalde, Kimberly Mata-Rubio figured it was time to get answers and help her city heal.","On a recent Saturday morning, a day after what would have been Lexi Rubio’s 12th birthday, dozens gathered in the Texas city of Uvalde for a run in her honor. Blasting Lexi’s playlist, Kimberly Mata-Rubio, her mother, took off from under a towering mural of Lexi, one of 19 children and two teachers killed in a shooting at her school last year.",2023-10-25T09:02:38+0000,article,U.S.,News,‘We Still Don’t Have Answers’: A Uvalde Mother Is Running for Mayor,"Uvalde, Tex, Shooting (May 24, 2022);Elections, Mayors;Mass Shootings;Hispanic-Americans;School Shootings and Armed Attacks;Gun Control;Robb Elementary School (Uvalde, Tex);Rubio, Lexi (2011-22);Texas;Uvalde (Tex)"
44,"The largest trees on the planet can’t easily ‘migrate’ — but in a warming world, some humans are helping them try to find new homes.","When Philip Stielstra retired from Boeing in 2012, he needed something purposeful to do. He and his wife, Gay, were casual golfers, but Stielstra, an antiwar activist in college who refused to fight in Vietnam — he worked in a post office instead — wanted a pastime with bigger stakes. Before leaving his job, he received an email from the city of Seattle: The Parks and Recreation Department needed “tree ambassadors.” Tree canopy cover had receded in the city, and the department was responding by promoting an appreciation for its remaining trees. The volunteer ambassadors would learn about these trees and lead residents on walking tours to marvel at them. Stielstra, despite being a self-described introvert, signed up. ",2023-10-25T09:02:38+0000,article,Magazine,News,Can We Save the Redwoods by Helping Them Move?,Trees and Shrubs;Seattle (Wash);Forests and Forestry;Conservation of Resources;Global Warming;Endangered and Extinct Species;Drought;Big Sur (Calif);California;Eugene (Ore);Sequoia National Park
45,"A Craftsman house in Oklahoma City, a two-bedroom bungalow in North Charleston and a renovated 1850s cottage in New Orleans.","This house is on a tree-lined street near downtown, less than a 10-minute drive from the Oklahoma City Museum of Art and the bustling Oklahoma River waterfront. It is a few blocks from Lyric Theatre, a performing arts venue in a historic theater, and Plaza Walls, an outdoor arts space with murals by local artists. A public elementary school is less than a mile away, and a public high school is five minutes away by car.",2023-10-25T09:02:45+0000,article,Real Estate,News,"$400,000 Homes in Oklahoma, South Carolina and Louisiana",Real Estate and Housing (Residential);New Orleans (La);Oklahoma City (Okla);North Charleston (SC)
46,"With a free library card and the right app, you can check out e-books, audiobooks and more from your local branch.","Public libraries have lent e-books to patrons for more than 20 years, but many have widened their electronic offerings with digital audiobooks, magazines, comics, videos and other services, even before the pandemic helped shift collections online. If you are curious about what your local library can lend from its digital shelves but never got around to signing up for a free library card — or connecting your existing card to an account — here’s how to get started.",2023-10-25T09:03:01+0000,article,Technology,News,Visit the Library From the Comfort of Your Own Phone,Books and Literature;Libraries and Librarians;Mobile Applications;Smartphones;Computers and the Internet;Content Type: Service;Archives and Records
47,"In her most recent book, “The Comfort of Crows,” Renkl puts her admirable powers of perception to use, offering readers respite, and reason for hope, in a turbulent world.","The yard grows wild with pollinator blooms. It’s early October in Nashville and the scorching summer just relinquished its relentless hold. Many of the black-eyed Susans, sunflowers, and zinnias have been picked dry by birds and insects. The caretaker of this garden, the author and essayist Margaret Renkl, leads me to her leaf-strewn deck out back, to show me a glimmer of hope.",2023-10-25T09:03:02+0000,article,Books,News,Margaret Renkl Writes in the Space Between Grief and Hope,"Books and Literature;Writing and Writers;Content Type: Personal Profile;Gardens and Gardening;Seasons and Months;Global Warming;Biodiversity;Renkl, Margaret (1961- );The Comfort of Crows: A Backyard Year (Book);Patchett, Ann;Late Migrations: A Natural History of Love and Loss (Book)"
48,The responsibility Israel’s prime minister bears for Oct. 7.,"Since Hamas’s horrific attacks, Israelis have been asking themselves how such an atrocity could have happened. In this audio essay, Gershom Gorenberg says the better question is: How did Israel’s leaders — specifically Prime Minister Benjamin Netanyahu — let it happen? The government was “complacent, overconfident, committed to misconceptions and has failed,” he says. Gorenberg believes it’s time for Netanyahu to step down.",2023-10-25T09:03:11+0000,article,Opinion,Op-Ed,Netanyahu Must Go,"audio-neutral-informative;Israel-Gaza War (2023- );Israel;Gaza Strip;Netanyahu, Benjamin;Hamas;Jerusalem (Israel);Palestinians;Politics and Government;International Relations;Defense and Military Forces;Palestinian Authority"
49,"This 1.5-mile-long island has “a beach on almost every block” and a close community. But while it feels like small-town New England, it’s not.","This 1.5-mile-long island has “a beach on almost every block” and a close community. But while it feels like small-town New England, it’s not.",2023-10-25T09:03:26+0000,multimedia,Real Estate,Slideshow,"Living In ... City Island, the Bronx","Real Estate and Housing (Residential);City Island (Bronx, NY)"
50,"This 1.5-mile-long island, with “a beach on almost every block,” may feel like small-town New England, but it’s part of the city.","When Wendy Yang Clark first arrived on City Island, a place she had never heard of, it was early-morning dark. A costume designer, she was there to work on the HBO series “Boardwalk Empire” in this narrow, 1.5-mile-long section of the Bronx.",2023-10-25T09:03:29+0000,article,Real Estate,News,City Island: A ‘Little Magical Wonderland’ in the Bronx,"Real Estate and Housing (Residential);City Island (Bronx, NY)"
51,Social media demands that you’re with us or against us.,"There is precious little space on social media for nuance or neutrality when it comes to the war between Israel and Hamas. No matter what you think of the conflict, expressions of solidarity aren’t just appreciated; they are expected.",2023-10-25T09:03:44+0000,article,Opinion,Op-Ed,Pick a Side. Pick a Side. Pick a Side. Now.,Israel-Gaza War (2023- );Social Media;Cancel Culture;Polls and Public Opinion;Israel;Palestinians;Terrorism;Hamas;your-feed-opinionvideo
52,"Heather Sellers thought she made peace with her estranged father years ago. But as she’s gotten older, she’s realized that complete forgiveness was never really on the table.","Heather Sellers wrote her Modern Love essay in 2013, about reconnecting with her elderly, estranged father. Although their relationship was painful, Heather made sure that her last words to her father were “I love you.” And at the time, that felt like closure.",2023-10-25T09:03:45+0000,article,Podcasts,News,"I Wrote This Essay, but Then Changed My Mind",Love (Emotion);Dating and Relationships;Families and Family Life;Television
53,The Republican Party’s “lunge toward extremism” shows no sign of abating.,Jim Jordan’s bid last week to become speaker of the House — together with the withdrawal on Tuesday of Thomas Emmer from his campaign for the same job — revealed not only how far House Republicans have moved to the right but also how weak the intraparty forces for moderation have become.,2023-10-25T09:03:51+0000,article,Opinion,Op-Ed,‘Chaos Doesn’t Scare Me. American Decline Does.’,"United States Politics and Government;Presidential Election of 2024;Right-Wing Extremism and Alt-Right;Presidential Election of 2020;Polls and Public Opinion;Democracy (Theory and Philosophy);Republican Party;Jordan, Jim (1964- );Trump, Donald J"
54,The Fulton County district attorney often uses her state’s racketeering law to pressure lower-rung defendants to cooperate and exert pressure on her main targets.,"Fani T. Willis, the district attorney of Fulton County, Ga., had no shortage of doubters when she brought an ambitious racketeering case in August against former president Donald J. Trump and 18 of his allies. It was too broad, they said, and too complicated, with so many defendants and multiple, crisscrossing plot lines for jurors to follow.",2023-10-25T09:03:56+0000,article,U.S.,News,"With Plea Deals in Georgia Trump Case, Fani Willis Is Building Momentum","Georgia Criminal Case Against Trump (2020 Election);Racketeering and Racketeers;Willis, Fani T;Fulton County (Ga);District Attorneys;Ellis, Jenna (Attorney);Trump, Donald J;Giuliani, Rudolph W;Chesebro, Kenneth;Powell, Sidney (Attorney);Georgia;Presidential Election of 2020;Voter Fraud (Election Fraud)"
55,House Republicans turned on themselves as they immolated yet another of their leaders in the bonfires of the speaker fight. Then they chose their next nominee.,"It was clear from the start that House Republicans would struggle to govern this year given their deep ideological divisions, narrow majority and myriad personal feuds and grudges. But even the most pessimistic of predictions could not have captured the remarkable, drawn-out Republican self-own now raging on Capitol Hill.",2023-10-25T09:04:03+0000,article,U.S.,News,Another Day of G.O.P. Chaos Winds Up With Speaker Nominee No. 4,"United States Politics and Government;House of Representatives;Republican Party;Emmer, Tom;Johnson, Mike (1972- );Conservatism (US Politics)"
56,"PEPFAR, created by President George W. Bush in 2003 to combat the disease, faces an uncertain future now that its authorizing legislation has lapsed.","The institute founded by President George W. Bush issued an urgent call on Wednesday for Congress to renew the global AIDS program known as PEPFAR, a centerpiece of Mr. Bush’s foreign policy legacy that has become a victim of abortion politics on Capitol Hill.",2023-10-25T09:04:03+0000,article,U.S.,News,Bush’s Institute Issues an Urgent Plea for Congress to Renew His AIDS Program,"United States Politics and Government;Acquired Immune Deficiency Syndrome;United States International Relations;Abortion;House of Representatives;President's Emergency Plan for AIDS Relief;Republican Party;Senate;Birx, Deborah L;Bush, George W"
57,It’s hard to know what to make of the guilty pleas in Georgia.,"On Tuesday morning, Jenna Ellis became the third Donald Trump-allied lawyer to plead guilty in Fulton County, Ga., to state criminal charges related to his efforts to overturn the results of the 2020 presidential election in Georgia. She joins Sidney Powell and Kenneth Chesebro in similar pleas, with each of them receiving probation and paying a small fine and each of them cooperating with the prosecution in its remaining cases against Trump and his numerous co-defendants.",2023-10-25T09:04:07+0000,article,Opinion,Op-Ed,Trump’s Lawyers Are Going Down. Is He?,"Georgia Criminal Case Against Trump (2020 Election);Presidential Election of 2020;United States Politics and Government;Legal Profession;Republican Party;Chesebro, Kenneth;Ellis, Jenna (Attorney);Powell, Sidney (Attorney);Willis, Fani T;Trump, Donald J;Fulton County (Ga);Federal Criminal Case Against Trump (2020 Election Case)"
58,"More than two weeks after the attack by Hamas, Israeli troops are still massing near the Gaza border.","Almost immediately after Israel was attacked on Oct. 7, it began preparing for a ground invasion of Gaza, drafting hundreds of thousands of its citizens and amassing forces along its southern border.",2023-10-25T10:00:09+0000,article,Podcasts,News,Why Israel Is Delaying the Ground Invasion,audio-neutral-informative;Israel-Gaza War (2023- )
59,The Republican Party is in disarray.,"In the past three weeks, House Republicans have dumped their party leader — Speaker Kevin McCarthy — and repeatedly failed to elect the candidate whom they had nominated to replace McCarthy.",2023-10-25T10:24:24+0000,article,Briefing,News,Chaos in the House,House of Representatives;Republican Party
60,"The 2024 Summer Games have pushed the iconic bike race out of its traditional finish in Paris. The Tour will instead end in Nice, in the south of France.",Everything makes way for the Olympics. Even an event as important to the host nation as the Tour de France.,2023-10-25T10:40:58+0000,article,Sports,News,"Tour de France Route Steers Clear of Olympics, and Paris","Tour de France (Bicycle Race);Cycling, Road;Paris (France);France;Nice (France);Olympic Games (2024)"
61,"A huge religious carnival shows that India remains a country of diverse political and social beliefs, despite the right-wing national government’s dominance.","Purbasha Roy held her 9-year-old daughter’s hand and pointed toward the towering art installation: blooming pink buds symbolizing embryos, menstrual cups shaped to form a bouquet, fallopian tubes descending from corners of the ceiling.",2023-10-25T11:05:03+0000,article,World,News,A Hindu Goddess Festival Where Indian Progressivism Is Alive and Well,Hinduism;Right-Wing Extremism and Alt-Right;Women and Girls
62,"From his Los Angeles home, Mohammed Abujayyab has sought to help his grandmother and other relatives survive the Israeli bombardment. Memories of displacement are never far.",Mohammed Abujayyab was at his wits’ end.,2023-10-25T11:05:03+0000,article,World,News,"For a Grandmother in Gaza, History Is Scarier Than Airstrikes",Israel-Gaza War (2023- );Israel;Defense and Military Forces;Gaza Strip;Palestinians;Refugees and Displaced Persons;Border Barriers;Hamas;Immigration and Emigration;United States
63,The Supreme Court declared unconstitutional a legal clause requiring transgender people to undergo sterilization to legally change their gender identity.,"Japan’s Supreme Court ruled on Wednesday that requiring transgender people to undergo sterilization in order to legally change their gender identity is unconstitutional, a step forward for L.G.B.T.Q. rights in a nation that has been slow to recognize them.",2023-10-25T11:48:35+0000,article,World,News,Transgender Ruling Is Step Forward for L.G.B.T.Q. Rights in Japan,Japan;Transgender;Discrimination;Sterilization (Reproductive);Law and Legislation;Decisions and Verdicts;Politics and Government
64,Endless scripting and too much control are helping destroy children’s sense of independence.,"I started hearing about the Switch Witch a few years ago. If you’re not in the know, she’s the Halloween cousin of that narc, Elf on the Shelf, a symbol of the rank combination of child surveillance and endless materialism that dictates so much of mainstream American parenting.",2023-10-25T12:00:17+0000,article,Opinion,Op-Ed,Stop Micromanaging Halloween — Let Your Kids Be Free,"internal-sub-only-nl;Children and Childhood;Parenting;Halloween;Candy;Finland;Diet and Nutrition;Olen, Helaine (1965- )"
65,The latest quarterly results from Microsoft and Alphabet show that their big investments in artificial intelligence are on different trajectories.,"The Nasdaq composite index looks set to open in the red on Wednesday, after investors got a split-screen view of how two tech giants, Microsoft and Alphabet, were doing in efforts to profit from artificial intelligence.",2023-10-25T12:07:09+0000,article,Business Day,News,"Long on Hype, A.I. Is No Guarantee for Profits",internal-storyline-no;Artificial Intelligence;Microsoft Corp;Alphabet Inc;Google Inc;OpenAI Labs;Meta Platforms Inc;Company Reports;Stocks and Bonds;Facebook Inc;Instagram Inc;Antitrust Laws and Competition Issues;Law and Legislation
66,"“It was really terrifying,” said one visitor who was attending a mining convention in the Mexican city.","Hurricane Otis interrupted tropical vacations for some visitors and put a stop to a mining convention in Acapulco, Mexico, as the storm bore down on the city early Wednesday.",2023-10-25T12:12:34+0000,article,World,News,A traveler stranded in Acapulco recounts horrific conditions.,vis-video;ACAPULCO (MEXICO);Hurricane Otis (2023)
67,The California governor is on a weeklong visit to China aimed at negotiating climate partnerships.,"Gavin Newsom, the governor of California, met with China’s leader, Xi Jinping, in Beijing on Wednesday, as part of an ambitious weeklong mission to negotiate climate partnerships.",2023-10-25T12:26:28+0000,article,World,News,"Gavin Newsom, on Climate Mission to China, Gets an Audience With Xi","International Relations;Politics and Government;United States International Relations;Governors (US);Global Warming;Asia-Pacific Economic Cooperation;Communist Party of China;Global Times;Newsom, Gavin;Wang Yi;Xi Jinping;California;China"
68,"A new wife is eager to join in the fun after her husband and brother-in-law wrap up their weekly jam sessions, but she’s reluctant to impose on her sister-in-law.","My new husband and his brother get together most weekends to play music with friends. They meet up in my brother-in-law’s large basement. These get-togethers turn into daylong events, culminating in dinners at local bars or drinks at my brother-in-law’s house. The problem: I’m often not invited! Since I don’t play music, I feel that my sister-in-law has to invite me to hang out with her while the boys jam. But her invitations are far less frequent than the gatherings. I appreciate that she has a busy life, but she usually ends up joining the others for drinks or dinner. And I feel left out: My husband, our friends and my in-laws are sharing meals every week while I sit at home alone because my sister-in-law doesn’t want to spend the day with me. Any advice for navigating this disappointing dynamic?",2023-10-25T13:00:03+0000,article,Style,News,How Can I Get Myself Invited to My Husband’s Family Parties?,"Customs, Etiquette and Manners"
69,"So far, 2023 has been a relatively mild fire year for the state, but the final few months on the calendar have often proved to be dangerous ones.",Anyone looking at data from California’s fire season this year may be tempted to breathe a sigh of relief.,2023-10-25T13:00:16+0000,article,U.S.,briefing,Is California’s Fire Season Over?,California
70,"She will leave her post as the Institute of Contemporary Art’s director in 2024, but isn’t sure what’s next. “I don’t think I am capable of real retirement,” Medvedow said.","After nearly 25 years as the director for the Institute of Contemporary Art in Boston, Jill Medvedow has decided to move on.",2023-10-25T13:30:08+0000,article,Arts,News,"Jill Medvedow, Who Remade ICA Boston, to Depart","Art;Museums;Appointments and Executive Changes;Institute of Contemporary Art;Medvedow, Jill;Boston (Mass)"
71,"“Roughing the Princess,” an erotic e-book inspired by an actual relationship, veered too close to reality for many of Taylor Swift’s fans.","She’s a beloved blonde pop star with the initials T.S. He’s a handsome N.F.L. player with a popular podcast and the initials T.K. Together, they have fused America’s obsession with pop stars and athletes into a celebrity pairing so incandescent it’s almost celestial.",2023-10-25T13:45:13+0000,article,Style,News,The Taylor and Travis Fan Fiction That’s Tearing TikTok Apart,"Books and Literature;Pop and Rock Music;Social Media;Kelce, Travis;Swift, Taylor"
72,"Residents wait in line for hours for bread and water, with fights sometimes breaking out. The United Nations has called the situation a humanitarian catastrophe.","Mohammed Aborjela, 27, used to document daily life in the Gaza Strip on his Instagram account before the war, videos about a crab dish prepared along the seaside or pigeon racing in the coastal enclave.",2023-10-25T14:05:48+0000,article,World,News,Thirst and Hunger Grow in Besieged Gaza Amid Israeli Bombardment,Israel-Gaza War (2023- );Gaza Strip;Palestinians;Water;Food Insecurity;Shortages;Humanitarian Aid;Hamas;Khan Younis (Gaza Strip);Israel;Defense and Military Forces
73,Maybe!,"Southern California has been on a fairly extraordinary winning streak. The streak itself is small, but the numbers involved are big: billions-of-dollars big.",2023-10-25T14:11:57+0000,article,U.S.,News,Will Playing the Lottery in Southern California Turn You Into a Billionaire?,Lotteries;California;Los Angeles (Calif)
74,Storms don’t normally go from a tropical storm to a Category 5 hurricane in a day.,"On Tuesday morning, few meteorologists were talking about Tropical Storm Otis.",2023-10-25T14:13:53+0000,article,World,News,Why Hurricane Otis Caught Many By Surprise,Hurricanes and Tropical Storms;Weather;Satellites;National Hurricane Center;ACAPULCO (MEXICO)
75,Some Jane Austen and a tennis rom-com are just right the right relief when news of fighting and war takes a toll.,"It has been an intense couple of weeks here at Interpreter HQ. “India’s Daughters,” the special newsletter series that I created with my colleagues Emily Schmall and Shalini Venugopal Bhagat, premiered last week. There will be a new chapter on Friday, and you can catch up with the first installment here if you missed it.",2023-10-25T14:32:27+0000,article,World,News,What I Read and Watch to Decompress,"internal-sub-only-nl;Books and Literature;Israel-Gaza War (2023- );War Crimes, Genocide and Crimes Against Humanity;Tennis;Soccer;Austen, Jane;Beckham, David;Documentary Films and Programs"
76,The FTX founder’s plan to take the witness stand sets up a dramatic few days of testimony at the federal courthouse in Manhattan.,Follow live coverage of Sam Bankman-Fried’s testimony in the FTX fraud case.,2023-10-25T14:40:43+0000,article,Technology,News,Sam Bankman-Fried Set to Testify at His Fraud Trial,"Virtual Currency;Frauds and Swindling;Money Laundering;Witnesses;Computers and the Internet;HK FTX Trading Ltd (Futures Exchange);Bankman-Fried, Sam"
77,"Share them, and we’ll try to give answers.","Donald Trump is facing an array of legal threats in the months ahead, with cases that span multiple jurisdictions and include dozens of charges. Sorting through the investigations and understanding what they mean for Trump, and for the country, can be baffling. But we’re here to help.",2023-10-25T14:47:17+0000,article,New York,News,Do You Have Questions About the Trump Trials?,"New York State Criminal Case Against Trump (71543-23);New York State Civil Case Against Trump (452564/2022);Federal Criminal Case Against Trump (Documents Case);Federal Criminal Case Against Trump (2020 Election Case);Georgia Criminal Case Against Trump (2020 Election);Trump, Donald J;internal-reader-callout"
78,A gorgeous one-pot chicken and rice from Yewande Komolafe’s new cookbook.,"Since the minute my colleague Yewande Komolafe told me she was working on a cookbook about Nigerian cuisine, I’ve been longing for the day I could read and cook from it, cover to cover. The wait is finally over! “My Everyday Lagos,” an exploration of the richness and diversity of Nigerian food, is out in the world — and it’s out of this world.",2023-10-25T15:00:04+0000,article,Food,Letter,"Iwuk Edesi, Bright and Savory and Satisfying",Cooking and Cookbooks;Content Type: Service
79,The discovery helped to show why the red planet’s core is not as large as earlier estimates had suggested it might be.,"In 2021, it seemed as if Mars had a surprisingly big heart. Scientists had been using InSight, a robotic lander to study the planet’s insides. The spacecraft had listened to enough marsquakes to develop a picture of the layer-cake nature of the Martian underworld.",2023-10-25T15:00:07+0000,article,Science,News,A Radioactive Sea of Magma Hides Under the Surface of Mars,Mars (Planet);Geology;Mars InSight (Spacecraft);Space and Astronomy;Research;Nature (Journal)
80,"The president has previously drawn down the Strategic Petroleum Reserve to ease price pressures, but that could be more difficult now","Biden administration officials, worried that a growing conflict in the Middle East could send global oil prices soaring, are looking for ways to hold down American gasoline prices if such a jump occurs.",2023-10-25T15:09:00+0000,article,Business Day,News,Biden Seeks to Tame Oil Prices if Mideast Conflict Sends Them Soaring,"Oil (Petroleum) and Gasoline;Prices (Fares, Fees and Rates);Politics and Government;United States Politics and Government;Israel-Gaza War (2023- );United States Economy;Production;Strategic Petroleum Reserve (US);Russian Invasion of Ukraine (2022);Energy and Power"
81,"Exxon Mobil and Chevron are spending tens of billions of dollars buying oil and gas assets, betting that the International Energy Agency’s predictions of declining oil demand are wrong.","Exxon Mobil and Chevron, the two largest U.S. oil companies, this month committed to spending more than $50 billion each to buy smaller companies in deals that would let them produce more oil and natural gas for decades to come.",2023-10-25T15:14:11+0000,article,Business Day,News,"Chasing Big Mergers, Oil Executives Dismiss Peak Oil Concerns","Oil (Petroleum) and Gasoline;Natural Gas;Mergers, Acquisitions and Divestitures;Alternative and Renewable Energy;Production;Global Warming;Greenhouse Gas Emissions;Stocks and Bonds;Prices (Fares, Fees and Rates);Electric and Hybrid Vehicles;Batteries;Solar Energy;Automobiles;Carbon Capture and Sequestration;Chevron Corporation;Exxon Mobil Corp;Hess Corporation;Pioneer Natural Resources Company;International Energy Agency"
