,abstract,lead_paragraph,pub_date,document_type,section_name,type_of_material,headline,keywords
44,"He escaped as a teenager and later became one of the Ritchie Boys, a secret Army program that recruited refugees to gather battlefield intelligence.","Guy Stern, who fled rising antisemitism in Nazi Germany at 15 for a new life in the United States but returned to Europe during World War II as a member of a military intelligence program that trained him to interrogate prisoners of war, died on Dec. 7 in West Bloomfield, Mich. He was 101.",2023-12-17T17:17:24+0000,article,World,Obituary (Obit),"Guy Stern, Who Fled Germany and Then Interrogated Nazis, Dies at 101","Stern, Guy (1922-2023);Holocaust and the Nazi Era;World War II (1939-45);Prisoners of War;Defense and Military Forces;Jews and Judaism;United States Military Academy;Germany;Ritchie Boys;Deaths (Obituaries)"
45,"When Jessica Vincent bought a vase at a Goodwill store in Virginia, she had no idea it was designed by Carlo Scarpa, a renowned Italian architect.","Jessica Vincent made her way in June through a busy Goodwill thrift store in Hanover County, Va., passing VCRs, lamps and glassware commonly sold at big-box retailers. Nothing really caught her eye until she saw an iridescent glass vase.",2023-12-17T19:10:20+0000,article,U.S.,News,"Vase Bought at Goodwill for $3.99 Sells for More Than $100,000","Auctions;Glass;Thrift Shops;Art;Collectors and Collections;Goodwill Industries;Scarpa, Carlo;Glassware;Hanover County (Va)"
46,No purchase necessary.,NO PURCHASE NECESSARY. A PURCHASE OR PAYMENT OF ANY KIND WILL NOT INCREASE YOUR CHANCES OF WINNING.,2023-12-17T19:17:33+0000,article,Crosswords & Games,News,The New York Times 2023 Mega Crossword Contest Official Rules,Crossword Puzzles;Puzzles
47,"The party on Sunday removed almost all the authority of Christian Ziegler, who faces a criminal investigation and has resisted calls to resign.","The embattled chairman of the Republican Party of Florida was censured and stripped of his duties and salary on Sunday, decisions that all but ousted him from the party’s top post as he faces a criminal investigation into an accusation that he sexually assaulted a woman.",2023-12-17T19:49:35+0000,article,U.S.,News,Florida Republicans Strip Powers of Embattled Party Chairman,"Moms for Liberty;Republican Party;Ziegler, Bridget (1982- );Ziegler, Christian (1983- );DeSantis, Ron;Florida;Orlando (Fla);Pinellas County (Fla);Sarasota (Fla)"
48,The killing of three hostages in Gaza by Israeli soldiers adds domestic pressure on Benjamin Netanyahu as he resists international calls for a cease-fire.,"In the face of increasing pressure from the United States, Britain and Germany, Prime Minister Benjamin Netanyahu has doubled down on his opposition to what these allies see as the future of Gaza: an interim government overseen by the Palestinian Authority and an eventual Palestinian state existing alongside Israel.",2023-12-17T20:41:24+0000,article,World,News,Hostage Deaths Fuel Israelis’ Doubts About Netanyahu,"Israel-Gaza War (2023- );Netanyahu, Benjamin;Civilian Casualties;Hamas;Palestinian Authority;Gaza Strip;Israel;Palestinians;Politics and Government"
49,Plus a dance protest craze spreads in Iran.,"Prime Minister Benjamin Netanyahu of Israel vowed to “fight to the end” in Gaza as anguish continued to spread over the killings of three hostages last week. The hostages were accidentally shot by the Israeli military as they were waving a white flag, and their deaths have raised new questions about how Netanyahu’s government is prosecuting the war.",2023-12-17T21:13:02+0000,article,Briefing,briefing,Monday Briefing: U.S. to Push Israel to Scale Back,"Far East, South and Southeast Asia and Pacific Areas;China;Congo, Democratic Republic of (Congo-Kinshasa);Israel;Hamas"
50,"At the Beacon, the comic took a different tack after posting a video rebutting a New Yorker article on fabrications in his work. The crowd went wild.","Finishing a story about a girl cheating on him in 11th grade, Hasan Minhaj turned to the audience at the Beacon Theater in Manhattan during the first of two shows on Friday night and said, “Don’t fact-check me.”",2023-12-17T21:17:35+0000,article,Arts,News,Was a Scandal the Best Thing to Happen to Hasan Minhaj?,"Comedy and Humor;Minhaj, Hasan (1985- );New Yorker"
51,"The students were killed when a gunman opened fire on campus in East Lansing, Mich., on Feb. 13.",Michigan State University has reached a $15 million settlement with the families of three students who were killed in a shooting on campus in February.,2023-12-17T21:31:20+0000,article,U.S.,News,Michigan State to Pay $15 Million to Families of Three Slain Students,"Michigan State University Shooting (Feb 13, 2023);Colleges and Universities;Compensation for Damages (Law);Murders, Attempted Murders and Homicides;Michigan State University;Anderson, Arielle Diamond (d 2023);Fraser, Brian (d 2023);Verner, Alexandria (d 2023);McRae, Anthony D (1979-2023);Michigan;East Lansing (Mich)"
52,The vote in Pirna fits into the Alternative for Germany party’s strategy of “normalization.”,"Voters in eastern Germany on Sunday elected a far-right city mayor, a reflection of the surging popularity of the nationalist party Alternative for Germany, or AfD.",2023-12-17T22:24:22+0000,article,World,News,"Germans Elect Far-Right City Mayor, a Boost for the AfD","Right-Wing Extremism and Alt-Right;Alternative for Germany;Germany;SAXONY (GERMANY);Pirna (Germany);Elections, Mayors"
53,The move came two days after a court upheld the Federal Trade Commission’s challenge to the deal on antitrust grounds.,"Illumina, the leading producer of gene-sequencing machines, announced Sunday that it would sell Grail, a cancer test developer that it purchased for $7.1 billion in 2021.",2023-12-17T22:26:12+0000,article,Business Day,News,Gene-Sequencing Company Illumina to Sell Cancer Test Developer,"Genetic Engineering;Tests (Medical);Antitrust Laws and Competition Issues;Decisions and Verdicts;Mergers, Acquisitions and Divestitures;Regulation and Deregulation of Industry;European Union;Federal Trade Commission;Grail Inc;Illumina Inc"
54,"For the second time in less than two years, Chileans voted thumbs down on a new national charter, and few seem to have the energy to try again.","Chileans on Sunday rejected a new constitution that would have pulled the country to the right, likely ending a turbulent four-year process to replace their national charter with little to show for it.",2023-12-17T22:42:57+0000,article,World,News,"Chile's Voters Reject a New, Conservative Constitution","Constitutions;Referendums;Boric, Gabriel;Bachelet, Michelle;Pinochet Ugarte, Augusto;Chile;Latin America"
55,Joe Marquez makes his New York Times debut.,Jump to: Today’s Theme | Tricky Clues,2023-12-17T23:00:10+0000,article,Crosswords & Games,News,Put Into Power,Crossword Puzzles;Games
56,"The two election workers who sued Rudolph W. Giuliani for defamation won’t be paid right away, and the judge could change the amount awarded by the jury.","A federal jury in Washington ordered Rudolph W. Giuliani last week to pay $148 million in damages to two former Georgia election workers he defamed by spreading baseless claims that they tried to steal votes from Donald J. Trump on Nov. 3, 2020.",2023-12-17T23:01:43+0000,article,U.S.,News,Giuliani Was Ordered to Pay $148 Million. What Happens Now?,"Giuliani, Rudolph W;Libel and Slander;Compensation for Damages (Law);Suits and Litigation (Civil);Freeman, Ruby;Howell, Beryl A;Moss, Shaye;Presidential Election of 2020;Rumors and Misinformation;United States Politics and Government;Voter Fraud (Election Fraud)"
57,The Israeli military took reporters on a tour of what it says is the biggest Hamas tunnel it has found since invading the Gaza Strip.,"The tunnel in the northern Gaza Strip is wide enough for a large car to pass through, reinforced with concrete and fitted with electrical wiring. And at least one section of the tunnel — which Israel says is the largest it has discovered in Gaza so far — is within walking distance of an Israeli border crossing.",2023-12-17T23:55:00+0000,article,World,News,"In Gaza, Israelis Display Tunnel Wide Enough to Handle Cars","Israel-Gaza War (2023- );Bridges and Tunnels;Defense and Military Forces;Al Shifa Hospital (Gaza Strip);Hamas;Sinwar, Yehya;Gaza Strip;Israel"
