,abstract,lead_paragraph,pub_date,document_type,section_name,type_of_material,headline,keywords
39,"Cities hoped for new businesses and housing on former military sites. But many are still waiting for poisonous pollution to be cleaned up, a wait that for some may never come.","For much of the 20th century, Fort Ord was one of the largest light infantry training bases in the country, a place where more than a million U.S. Army troops were schooled in the lethal skills of firing a mortar and aiming a rifle — discharging thousands of rounds a day into the scenic sand dunes along the coast of central California.",2023-09-27T09:01:19+0000,article,U.S.,News,"Decades Later, Closed Military Bases Remain a Toxic Menace","Fort Ord (Calif);United States Defense and Military Forces;Hazardous and Toxic Substances;Military Bases and Installations;Environment;Defense Department;United States Army;United States Navy;California;Seaside (Calif);Marina (Calif);Hunters Point Naval Shipyard (Calif);Bayview-Hunters Point (San Francisco, Calif);Area Planning and Renewal"
40,The front-runner’s position remains largely dominant. Is the primary approaching being over?,"Frank Bruni, a contributing Opinion writer, hosted a written online conversation with Josh Barro, who writes the newsletter Very Serious, and Sarah Isgur, a senior editor at The Dispatch, to discuss their expectations for the second Republican debate on Wednesday night. They also dig into and try to sort out a barrage of politics around President Biden’s sagging approval numbers, an impeachment inquiry, a potential government shutdown and shocking political rhetoric from former President Trump.",2023-09-27T09:01:45+0000,article,Opinion,Op-Ed,‘Trump Is Scaring the Hell Out of Me’: Three Writers Preview the Second G.O.P. Debate,"Presidential Election of 2024;United States Politics and Government;Debates (Political);Polls and Public Opinion;Impeachment;Primaries and Caucuses;Shutdowns (Institutional);Abortion;Storming of the US Capitol (Jan, 2021);Inflation (Economics);Democratic Party;Republican Party;House of Representatives;Supreme Court (US);Biden, Hunter;Biden, Joseph R Jr;Christie, Christopher J;DeSantis, Ron;Harris, Kamala D;McCarthy, Kevin (1965- );Menendez, Robert;Milley, Mark A;Ramaswamy, Vivek (1985- );Scott, Timothy Eugene;Trump, Donald J;United States"
41,Here’s what we’re learning about this debilitating symptom and how to manage it.,"Of all the classic Covid symptoms (the dry cough, the stinging throat, the achiness), fatigue may be one of the most debilitating, persistent and confounding.",2023-09-27T09:01:46+0000,article,Well,News,The Mystery Around Covid Fatigue,Coronavirus (2019-nCoV);Long Covid;Fatigue;Chronic Condition (Health)
42,Chickpeas and plantains get a piquant punch with a vinegar-rich escabeche.,"Picture an experiment: You are handed a clear, odorless liquid of mysterious flavor and asked to drink. (Shades of “Alice in Wonderland.”) You are then directed toward an image of a balloon on a computer screen. With each click of the mouse, the balloon inflates. The bigger it swells, the more cash you’ll receive — but if it pops, all is lost. You must decide when to stop.",2023-09-27T09:01:54+0000,article,Magazine,News,Want to Eat Less Meat? Try Something Sour.,Cooking and Cookbooks;Vegetarianism;Puerto Rico;Recipes
43,"In his latest book, the German historian Volker Ullrich describes a nation buffeted by poverty, hyperinflation and political extremism, but managing — for the moment — to thwart Hitler’s ascent.","The insurrection failed. The system held — at least for a time. In November 1923, when a young demagogue named Adolf Hitler tried to start a Nazi revolution from a Munich beer hall, his attempted coup was so disorganized that it swiftly degenerated into bumbling confusion. One participant later testified that the operation was such a farce that he whispered to others, “Play along with this comedy.”",2023-09-27T09:01:56+0000,article,Books,Review,‘Germany 1923’: When Democracy Held Nazism at Bay,"Books and Literature;Germany 1923: Hyperinflation, Hitler's Putsch, and Democracy in Crisis (Book);Ullrich, Volker;Chase, Jefferson (Translator);Politics and Government;Germany;Holocaust and the Nazi Era;Hitler, Adolf"
44,"Despite their intent to make coastal communities safer, Florida’s building codes can actually complicate long-term resilience efforts.","When Hurricane Ian, the costliest storm in Florida’s history, made landfall nearly a year ago, a storm surge as high as 15 feet left the town of Fort Myers Beach nearly submerged for several hours.",2023-09-27T09:01:56+0000,article,Opinion,Op-Ed,"If Hurricane Rebuilding Is Affordable Only for the Wealthy, This Is the Florida You Get",Hurricanes and Tropical Storms;Florida;Floods;High Net Worth Individuals;Coastal Areas;Hurricane Ian (2022);Fort Myers Beach (Fla);Building (Construction);Travel and Vacations;Hotels and Travel Lodgings;Real Estate and Housing (Residential)
45,Why Lina Khan and the F.T.C. must prevail in their long-awaited lawsuit against Amazon.,"The Federal Trade Commission’s chair, Lina Khan, has brought her long-awaited, audacious case against Amazon, signaling the Biden administration’s determination to restore an approach to competition law that has been in decline since the Carter administration. This will doubtless draw fresh criticism about her supposed overreach. But Amazon is precisely the kind of company that Congress had in mind in enacting America’s many antitrust laws.",2023-09-27T09:01:57+0000,article,Opinion,Op-Ed,Amazon Is the Apex Predator of Our Platform Era,"Amazon.com Inc;Antitrust Laws and Competition Issues;Federal Trade Commission;Computers and the Internet;E-Commerce;Prices (Fares, Fees and Rates);Copyrights and Copyright Violations;Book Trade and Publishing;Workplace Hazards and Violations;Regulation and Deregulation of Industry;Khan, Lina;Bezos, Jeffrey P"
46,"Sondheim said days before his death in 2021 that he did not know when it would be finished, but the musical, now called “Here We Are,” begins performances Thursday.","Stephen Sondheim, asked days before his death if he had any sense of when his final musical would be finished, offered a simple answer: “No.”",2023-09-27T09:01:57+0000,article,Theater,News,How Complete Was Stephen Sondheim’s Final Musical?,"Theater;Theater (Off Broadway);Here We Are (Play);Sondheim, Stephen;Shed (Manhattan, NY);Ives, David;Mantello, Joe"
47,"A renovated Cape Cod-style house on Monhegan Island, an Edwardian home in Evanston and an 1890 rowhouse in Washington.","Monhegan, an island about 10 miles off the coast of Maine, has long attracted artists inspired by the rugged landscape, including Edward Hopper, George Bellows and Rockwell Kent. Today, there are a handful of art galleries on Main Street, along with a small grocery store and a cafe. These businesses and several bed-and-breakfast inns are less than a 10-minute walk from the house.",2023-09-27T09:02:07+0000,article,Real Estate,News,"$1.4 Million Homes in Maine, Illinois and the District of Columbia",Real Estate and Housing (Residential);Evanston (Ill);Washington (DC);Monhegan Island (Me)
48,"“Time pressure rewards students who think fast and shallow — and punishes those who think slow and deep,” writes an Opinion contributor. Do you agree?","Have you ever had to take a timed test, such as the SAT, the ACT, a pop quiz or a final exam? If so, what was the experience like? Did you worry about running out of time to complete all the questions? Did the stress distract you and cause you to make mistakes? Or did the time constraint not affect you? Did you finish the exam?",2023-09-27T09:02:20+0000,article,The Learning Network,News,Is It Time to Get Rid of Timed Tests?,
49,"Dozens of leaders, mostly from Western states, have asked the Supreme Court to overturn lower court decisions that restrict enforcement against public camping.","Garbage, feces and needles run through the rivers in Missoula, Mont. On the streets of San Francisco, tents are so thick that sidewalks in the Tenderloin neighborhood have become “unofficial open-air public housing.” In Portland, Ore., a blaze shut down an on-ramp to the Steel Bridge for several days in March after campers tunneled through a cinder block wall and lit a campfire to stay warm.",2023-09-27T09:02:27+0000,article,U.S.,News,"In Rare Alliance, Democrats and Republicans Seek Legal Power to Clear Homeless Camps","Homeless Persons;Supreme Court (US);Western States (US);Democratic Party;Republican Party;Local Government;Newsom, Gavin;GRANTS PASS (ORE);Boise (Idaho);Missoula (Mont);San Francisco (Calif);Portland (Ore);Politics and Government"
50,The columnist Pamela Paul argues that the conservative contender is “superficial” and “incoherent.”,"All eyes are on Donald Trump’s top rivals ahead of Wednesday night’s second G.O.P. primary debate. And according to the Opinion columnist Pamela Paul, it is a disappointing lineup — Nikki Haley especially. Paul argues that Haley is not the moderate anti-Trump alternative she is touted to be but rather is an opportunist, pandering to both sides and lacking “a core philosophy and a commitment.” As a candidate, she promises to bring back the old Reaganesque Republican values, but Paul believes that Haley is a hypocrite whose loyalty resides exclusively with her personal agenda.",2023-09-27T09:02:28+0000,article,Opinion,Op-Ed,Think Nikki Haley Is the Right G.O.P. Candidate? Think Again.,"audio-neutral-informative;United States;United States Politics and Government;Republican Party;Haley, Nikki R;Presidential Election of 2024;Debates (Political)"
51,"Repair work was agreed but never finished and Derna paid the price. Experts say infrastructure projects have long been neglected, with officials focusing instead on lining their own pockets.","For years, the two aging dams loomed in the mountains above the Libyan city of Derna, riddled with cracks and fissures, threatening the thousands of people living in the valley below.",2023-09-27T09:02:29+0000,article,World,News,"Years of Graft Doomed 2 Dams in Libya, Leaving Thousands in Muddy Graves","Derna (Libya);Levees and Dams;Floods;Dbeiba, Abdul Hamid;Qaddafi, Muammar el-;Libya;Bribery and Kickbacks;Infrastructure (Public Works);Corruption (Institutional);Politics and Government"
52,"This shape-shifting desert city is in the middle of a reinvention that involves sports stadiums, Formula 1 and the Sphere: a 360-foot-tall, high-tech, traffic-stopping amphitheater clad in 1.2 million LED screens.","It’s just past dusk on the Las Vegas Strip and traffic has come to a standstill. That’s usual for a weekend night, but this is Monday.",2023-09-27T09:02:29+0000,article,Travel,News,"Las Vegas and Its Big, Big Ambitions",Travel and Vacations;Las Vegas (Nev);Formula One;Madison Square Garden
53,"Home prices are way up in this Columbia County town, which is luring artists and writers from the city with its bucolic views and chic Main Street.","Home prices are way up in this Columbia County town, which is luring artists and writers from the city with its bucolic views and chic Main Street.",2023-09-27T09:02:36+0000,multimedia,Real Estate,Slideshow,"Living In ... Germantown, N.Y.",Real Estate and Housing (Residential);Germantown (NY)
54,"Home prices are way up in this Columbia County town, which is luring artists and writers from the city with its bucolic views and chic Main Street.","Germantown was supposed to be Jamil Hoskins’s second home. After he, his wife and their two young children spent the first year of the pandemic in the Columbia County town, they returned to Brooklyn for the 2021 school year. But city life seemed too fast and dangerous.",2023-09-27T09:02:38+0000,article,Real Estate,News,"Germantown, N.Y.: An Upstate Haven That Beckons Creatives",Real Estate and Housing (Residential);Germantown (NY);Columbia County (NY);Catskill Mountains;Hudson River Valley (NY)
55,"FTX’s demise and its leader’s upcoming trial haven’t stopped a major lobbying push by the industry this week, but the events have changed its tone.","Cryptocurrency lobbyists were riding so high in early 2022 that an FTX executive felt comfortable directly emailing Jerome H. Powell, the chair of the Federal Reserve, to ask him to meet with Sam Bankman-Fried, the soon-to-be-disgraced founder of the cryptocurrency exchange.",2023-09-27T09:02:38+0000,article,Business Day,News,FTX Chief Once Met With Powell. Now D.C. Crypto Lobbyists Are Struggling.,"Virtual Currency;Regulation and Deregulation of Industry;Lobbying and Lobbyists;Federal Reserve System;Commodity Futures Trading Commission;HK FTX Trading Ltd (Futures Exchange);Coinbase Inc;Bankman-Fried, Sam;Powell, Jerome H;Wetjen, Mark P;Brainard, Lael"
56,Why should Democrats be worrying? Why should Republicans?,"I recently sent out a list of questions about the 2024 elections to political operatives, pollsters and political scientists.",2023-09-27T09:02:43+0000,article,Opinion,Op-Ed,‘This Is Going to Be the Most Important Election Since 1860’,"Presidential Election of 2024;Polls and Public Opinion;Abortion;Right-Wing Extremism and Alt-Right;United States Politics and Government;Democratic Party;Republican Party;Biden, Joseph R Jr;Trump, Donald J"
57,"Striking autoworkers are demanding an end to the 40-hour week. It’s a change that would be good for everyone else, too.","The autoworkers picketing factories across America aren’t just seeking higher pay. They are also, audaciously, demanding the end of the standard 40-hour workweek. They want a full week’s pay for working 32 hours across four days. And we’ll all benefit if they succeed.",2023-09-27T09:03:49+0000,article,Opinion,Editorial,The Magic Number: 32 Hours a Week,"Automobiles;United Automobile Workers;Organized Labor;Working Hours;Wages and Salaries;Factories and Manufacturing;Strikes;Biden, Joseph R Jr;United States Politics and Government"
58,South Korea’s vital semiconductor sector depends on China. A deadline looms for how it could be affected by U.S. efforts to control China’s tech advance.,"Samsung and SK Hynix, the semiconductor titans of South Korea, have spent over $52 billion to build up their operations in China. Business with China has long made up a sizable portion of their sales.",2023-09-27T09:23:41+0000,article,Business Day,News,What the U.S.-China Chip War Means for a Critical American Ally,International Relations;Computer Chips;Foreign Investments;Data Storage;Supply Chain;Factories and Manufacturing;Hynix Semiconductor;Samsung Group;China;South Korea;United States
59,Can you find Albania on a map? What else do you know about this Southeastern European nation with almost three million people?,Can you find Albania on a map? What else do you know about this Southeastern European nation with almost three million people?,2023-09-27T09:30:00+0000,multimedia,The Learning Network,Interactive Feature,How Much Do You Know About Albania?,ALBANIA
60,"Exclusively from New York Times Audio, our new app.","The New York Times Audio app is home to journalism and storytelling, and provides news, depth and serendipity. If you haven’t already, download it here — available to Times news subscribers on iOS — and sign up for our weekly newsletter.",2023-09-27T09:45:10+0000,article,Podcasts,News,"Today’s Top News: Biden Joins Autoworkers on Picket Line, and More","Organized Labor;United Automobile Workers;Biden, Joseph R Jr;Amazon.com Inc;E-Commerce;Antitrust Laws and Competition Issues;Menendez, Robert;Menendez, Nadine;Bribery and Kickbacks"
61,How one of the longest strikes in the history of movies and television ended in a tentative deal.,"After 148 days on strike, writers of movies and television are returning to work on Wednesday with an agreement in hand that amounts to a major win for organized labor in Hollywood.",2023-09-27T10:00:06+0000,article,Podcasts,News,Did Hollywood Writers Get Their Happy Ending?,Organized Labor;Strikes;Movies;Writers Guild of America
62,The finding by a judge in a New York civil case that Donald Trump committed fraud in valuing his real estate properties undermined the narrative of the business career that launched him in politics.,"Nearly every aspect of Donald J. Trump’s life and career has been under scrutiny from the justice system over the past several years, leaving him under criminal indictment in four jurisdictions and being held to account in a civil case for what a jury found to be sexual abuse that he committed decades ago.",2023-09-27T10:00:08+0000,article,U.S.,News Analysis,Ruling Against Trump Cuts to the Heart of His Identity,"New York State Civil Case Against Trump (452564/2022);Trump, Donald J;Trump Organization;Frauds and Swindling;Appraisals and Valuation (Property);Engoron, Arthur F;Decisions and Verdicts;Polls and Public Opinion;New York State"
63,"The former editor of French Vogue and renowned stylist discusses fashion week debuts, sex on the runway and why she finally got her first tattoos.","There are some people in fashion with such distinctive personal style trademarks that you can recognize them from their silhouettes. Karl Lagerfeld was one (remember the Diet Coke bottles?). Anna Wintour is another. And then, with her sky-high heels, narrow pencil skirts, shaggy bob and permanent presence on the front row of fashion week for more than 30 years, there is Carine Roitfeld.",2023-09-27T10:00:18+0000,article,Style,News,Many People Have Retired by 69. Not Carine Roitfeld.,"Fashion and Apparel;Magazines;Roitfeld, Carine;CR Fashion Book;Paris Fashion Week;Milan Fashion Week;French Vogue;Perfumes and Fragrances;Gucci;ANISTON, JENNIFER;Ford, Tom;Kardashian, Kim;Milan (Italy);Paris (France);your-feed-fashion"
64,The senator for New Jersey’s indictment on corruption charges raised a sometimes tricky question: When should a politician resign?,Under what circumstances should an elected politician resign?,2023-09-27T10:47:50+0000,article,Briefing,briefing,Should Menendez Quit?,"Ethics and Official Misconduct;Politics and Government;United States Politics and Government;Law and Legislation;Menendez, Robert"
65,"A selection of correspondence between FTX and the Federal Reserve, pulled from a series of Freedom of Information Requests submitted by The New York Times.","A selection of correspondence between FTX and the Federal Reserve, pulled from a series of Freedom of Information Requests submitted by The New York Times.",2023-09-27T11:07:30+0000,multimedia,U.S.,Interactive Feature,Read the emails,
66,"The conductor, an acclaimed Wagnerian, was named to replace Barenboim, who stepped down in January after three decades because of health problems.","For months, the Berlin State Opera, one of the world’s premier opera houses, has been in a state of uncertainty. Its revered leader, the conductor and pianist Daniel Barenboim, resigned in January after three decades in charge because of health problems. Musicians and cultural leaders questioned whether anyone would be able to match his impact and influence.",2023-09-27T11:07:31+0000,article,Arts,News,Christian Thielemann to Succeed Daniel Barenboim at Berlin State Opera,"Classical Music;Berlin State Opera;Barenboim, Daniel;Thielemann, Christian;Opera;Berlin (Germany)"
67,Pvt. Travis T. King dashed across the inter-Korean Demilitarized Zone in July. North Korea expelled him after finding him guilty of “illegally intruding” into its territory.,"Pvt. Travis T. King, the American soldier who crossed into North Korea on July 18, was released into U.S. custody on Wednesday after weeks of diplomacy mediated by the Swedish government, American officials said.",2023-09-27T11:14:54+0000,article,World,News,American Soldier Who Crossed Into North Korea in July Is in U.S. Custody,"North Korea;King, Travis T;Desertion (Military);Defectors (Political);United States Defense and Military Forces;United States International Relations"
68,"The latest video, and comments published in Russian news outlets, appeared to be an effort by Moscow to end speculation over the admiral’s status.","Russia released new videos on Wednesday of a Russian admiral Ukraine claimed to have killed, with the footage showing him apparently alive and well, hoisting a trophy into the air to celebrate a soccer victory and stoically telling a local interviewer that “life goes on.”",2023-09-27T11:26:42+0000,article,World,News,Russia Puts Out New Video of Admiral Ukraine Claims to Have Killed,Russian Invasion of Ukraine (2022);Russia;Ukraine;Defense and Military Forces;Propaganda;Crimea (Ukraine);Sevastopol (Ukraine)
69,"The U.S. allowed Israel into its visa-waiver program after a summer test run that gave U.S. citizens, including Palestinian Americans, visa-less entry into Israel.","The Biden administration announced on Wednesday that it would allow Israeli citizens to enter the United States without a visa, a step toward improving relations between the two nations at a time when President Biden is engaged in complex diplomacy with Israel on a range of issues.",2023-09-27T12:00:08+0000,article,U.S.,News,Biden Administration Says Israelis Can Travel to U.S. Without a Visa,"Palestinians;Visas;United States International Relations;Discrimination;Peace Process;Senate;Biden, Joseph R Jr;Netanyahu, Benjamin;Israel"
70,"‘Glossy,’ a new book about the beauty brand Glossier and its founder, Emily Weiss, provides a cleareyed look at ambition and power.","I’ve read and watched many stories about the most heralded business leaders of the past few centuries. I’m not immune to the inherent drama of an arrogant rise, a spectacular fall or both. But usually — especially with books like Walter Isaacson’s biographies of Steve Jobs and Elon Musk and the screenwriter Aaron Sorkin’s portrayals of Jobs and Mark Zuckerberg — I’m so appalled by the gratuitous cruelty of these (usually) men that I need to hit pause on the movie or put the book down in disgust.",2023-09-27T12:00:55+0000,article,Opinion,Op-Ed,C.E.O.s Don’t Need to Be Monsters,"internal-sub-only-nl;Cosmetics and Toiletries;Teen Vogue;Into the Gloss Inc;Isaacson, Walter;Musk, Elon;Jobs, Steven P;Sorkin, Aaron"
71,"The F.T.C. chair, who published an influential law school paper on the e-commerce giant, is now fighting the company over its market dominance.","Lina Khan’s career has come full circle. The F.T.C., which she chairs, and 17 states sued Amazon on Tuesday, accusing the tech giant of using illegal practices to maintain its monopoly position in e-commerce.",2023-09-27T12:07:23+0000,article,Business Day,News,What to Watch as Lina Khan Finally Takes On Amazon,"internal-storyline-no;E-Commerce;Antitrust Laws and Competition Issues;Amazon.com Inc;Federal Trade Commission;Khan, Lina"
72,"Five decades ago, an award-winning Malian author disappeared from public life after being accused of plagiarism. Now, his ambiguous novel is being released, and evaluated, in new light.","In 1968, a young Malian author living in Paris published his first book to the highest praise: Critics called it a “great African novel,” and awarded it one of France’s most prestigious literary prizes. But soon, his rise gave way to a devastating fall from grace.",2023-09-27T12:10:48+0000,article,Books,News,Plagiarist or Master? The Tortured Legacy of Yambo Ouologuem,"Plagiarism;Books and Literature;Book Trade and Publishing;Editions du Seuil;Other Press;Sarr, Mohamed Mbougar;Mali;Senghor, Leopold Sedar"
73,Hurricane Lee brought warblers and other colorful species rarely seen in Britain and Ireland for what will most likely be a temporary visit.,"More than a dozen species of North American birds rarely seen in Britain and Ireland have been spotted along the countries’ western shores after being blown off their usual migration routes by remnants of Hurricane Lee and surviving the perilous journey across the Atlantic, experts said.",2023-09-27T12:54:39+0000,article,U.S.,News,Storm Delivers a Trans-Atlantic Gift: North American Birds,Birds;Animal Migration;Birdwatching;Hurricanes and Tropical Storms;Great Britain;Ireland;Isles of Scilly (England);Pembrokeshire (Wales);North America
74,"A reader is dreading his son’s engagement party, where he expects to encounter not only his estranged ex-wife, but a constellation of former in-laws.","My son, 27, and his fiancée are having an engagement party soon. Some background: Fourteen years ago, I came out as gay, and my marriage ended. My then wife and I were in our 50s. She and I are still estranged, but I have maintained loving relationships with our three children. They will all be at the party for about 25 guests, along with my new partner of 12 years, my ex-wife (who is still single), her parents, my former brother- and sister-in-law, and their adult kids. There is no love lost between me and my ex-wife’s family, and I am thrilled not to have been in contact with them for years. I am not looking forward to a three-hour party with them. I have no desire to say much more than hello, and they probably feel the same way. Any advice?",2023-09-27T13:00:02+0000,article,Style,News,"After Coming Out as Gay, I’m on the Outs With My Ex-Wife’s Family. Help!","Customs, Etiquette and Manners;Content Type: Service"
75,"Starting with the next academic year, the drama school will eliminate an “unrealistic burden” for graduate acting students.","The Juilliard School, one of the world’s most elite conservatories, is making its top-notch graduate acting program tuition-free.",2023-09-27T13:00:07+0000,article,Theater,News,Juilliard’s Top-Tier Graduate Acting Program Is Going Tuition-Free,"Colleges and Universities;Tuition;Theater;Philanthropy;Juilliard School;McClelland, Stephanie P;Gore, John (1962- )"
