,abstract,lead_paragraph,pub_date,document_type,section_name,type_of_material,headline,keywords
40,Brando Skyhorse’s novel is the subtly dystopian story of a Mexican American woman who realizes that America has become less welcoming to people like her.,"In Brando Skyhorse’s second novel, a conservative Mexican American woman in an unnamed border state rebuilds her life after divorce, in an America that has become an increasingly dangerous white supremacist society.",2023-08-01T09:01:03+0000,article,Books,Review,"In ‘My Name Is Iris,’ a Mother Learns the Limits of Protectiveness","Books and Literature;Skyhorse, Brando;My Name Is Iris (Book)"
41,"Driven by the climate crisis, the post-pandemic surge in visitors and a growing interest in making tourism work for local communities, European cities are finding new ways to tax visitors.","When Hester Van Buren, a deputy mayor of Amsterdam, recently proposed a 1 percentage point increase to the city’s tourist accommodation tax — which is already among the highest in Europe — her City Council colleagues responded with a single criticism: They wanted the increase to be even bigger.",2023-08-01T09:01:05+0000,article,Travel,News,Planning to Visit Barcelona or Dubrovnik? It’s Going to Cost You.,Travel and Vacations;Taxation;Barcelona (Spain);Europe;Manchester (England);AMSTERDAM (NETHERLANDS);Dubrovnik (Croatia)
42,The Oscar-nominated actor’s new memoir is at once a Hollywood air kiss and a moving tribute to a happy marriage that ended too soon.,"Richard E. Grant is a wonderful actor and, it seems, a rather wonderful (goofy, talented, loving) man. His new memoir, written in diary form, is about his terrific 35-year marriage-of-opposites to Joan Washington (he the eternal adolescent, star-struck optimist and gifted actor, she a sharp-tongued, no-nonsense and equally gifted dialect coach) and her painful death from cancer. (It is she who, while dying, instructs him to seek a “pocketful of happiness” every day after she is gone.)",2023-08-01T09:01:10+0000,article,Books,Review,Richard E. Grant Fights Grief With ‘A Pocketful of Happiness’,"Books and Literature;Actors and Actresses;Grant, Richard E;Washington, Joan (1946-2021);Content Type: Personal Profile"
43,Many eras coexist inside the studio of the Emmy-winning costume designer Donna Zakowska.,"Clothes hold a visceral thrill for Donna Zakowska. “There’s a sensuality and a tactile aspect to fashion,” she said. “I’m always thinking about the quality of the garment, the fabric, the way it plays with light and air and movement — about the emotional impact of color.”",2023-08-01T09:01:10+0000,article,Style,News,The Sorcerer of Costumes,"Zakowska, Donna;Costumes;Fashion and Apparel;Television;The Marvelous Mrs Maisel (TV Program);Content Type: Personal Profile"
44,"In the essay collection “Dark Days,” Roger Reeves tries to sidestep mainstream arguments to engage deeply with the way people actually live and think.","Consider the Black Square. In the summer of 2020, not long after George Floyd’s murder in Minneapolis and a few months into pandemic lockdown, people who felt galvanized to act took to Instagram or Facebook, replacing their profile pictures with a plain black box to signal their support for Black victims of racism. The Square epitomized that moment’s sometimes-futile rhetoric around race and Blackness. Its content-less status — political speech as the absence of any actual speech — drove home how hemmed in we were by platforms that commodified our expressions into repetitive, thoughtless forms. We swapped out ideas and conversation for memes that illuminated nothing. Everybody was talking; few of us were saying anything.",2023-08-01T09:01:10+0000,article,Books,Review,Is There a Right Way to Talk About Black Culture?,"Books and Literature;Black People;Blacks;Reeves, Roger (1980- );Dark Days: Fugitive Essays (Book)"
45,Fear of crime is a self-fulfilling prophecy.,"Violent crime — homicides, robberies, gun assaults — has begun to fall from pandemic-era levels. But people are scared. According to the Pew Research Center, almost 60 percent of Americans today say that violent crime is a “very big problem.” In New York State, four out of ten residents tell pollsters they’ve “never been this worried about my personal safety.”",2023-08-01T09:01:11+0000,article,Opinion,Op-Ed,People Get Scared and Buy a Gun. Here’s What Happens Next.,Firearms;Fear (Emotion);Crime and Criminals;Police;Robberies and Thefts;Polls and Public Opinion;United States
46,Shifting hormones can make hair go haywire. Experts say there are ways to manage it.,"Q: Since going through menopause, I’ve noticed changes to my scalp and hair texture — my scalp is dry and flaky, and my hair is dry and falling out. What’s going on, and is there anything I can do to address it?",2023-08-01T09:01:16+0000,article,Well,News,Is Menopause Changing My Hair?,Menopause;Hair;Women and Girls;Content Type: Service;Vitamin D;Research
47,"In “Shipwrecked,” the historian Jonathan W. White tells the story of an outlaw mariner who worked for the Confederacy and against the Klan.","Who was Appleton Oaksmith? One contemporary described him as a “good seaman, & a bold & daring officer.” His enemies, President Abraham Lincoln among them, judged him a scoundrel and a traitor. Oaksmith, writing six years after the Civil War, wasn’t sure what to think: “I look upon myself sometimes with a sort of doubt as to my own identity.”",2023-08-01T09:01:16+0000,article,Books,Review,The Sea Captain Who Ran From Abraham Lincoln,"Civil War (US) (1861-65);Ships and Shipping;Slavery (Historical);Prison Escapes;Lincoln, Abraham;Seward, William Henry (1801-72);Confederate States of America;Havana (Cuba);Books and Literature;White, Jonathan W;Shipwrecked: A True Civil War Story of Mutinies, Jailbreaks, Blockade-Running, and the Slave Trade (Book)"
48,"The global industry is cutting some ties to China, but its exposure to forced labor remains high and companies are less transparent, a new report found.","Global supply chains for solar panels have begun shifting away from a heavy reliance on China, in part because of a recent ban on products from Xinjiang, a region where the U.S. government and United Nations accuse the Chinese government of committing human rights violations.",2023-08-01T09:01:24+0000,article,Business Day,News,Solar Supply Chain Grows More Opaque Amid Human Rights Concerns,Solar Energy;Forced Labor;Human Rights and Human Rights Violations;Supply Chain;International Trade and World Market;Factories and Manufacturing;JA Solar Holdings Company Ltd;China;Xinjiang (China)
49,A new exhibition at the Franklin D. Roosevelt Presidential Library explores the president’s “mixed” record on civil rights — and the charged debate over racism in the New Deal.,"In October 1935, President Franklin D. Roosevelt had his administration send letters to thousands of clergy across the country, asking if the New Deal was helping their communities.",2023-08-01T09:01:26+0000,article,Arts,News,"At the Roosevelt Library, an Unflinching Look at Race","Roosevelt, Franklin D, Presidential Library and Museum;New Deal (1930's);Black People;Blacks;Discrimination;Civil Rights and Liberties;Museums;Roosevelt, Eleanor;Roosevelt, Franklin Delano"
50,"As mass shootings multiply, relatives of the dead find support in “the worst club imaginable.” One child’s parents are on a road trip to connect them.","Manuel and Patricia Oliver had already been on the road for more than a week when they pulled their school bus bearing an American flag into a city park in Uvalde, Texas. They were unsure of just how many people would greet them on that sweltering day.",2023-08-01T09:01:26+0000,article,U.S.,News,"A School Bus Crosses U.S., Linking Families of Mass Shooting Victims","Mass Shootings;School Shootings and Armed Attacks;Uvalde, Tex, Shooting (May 24, 2022);Parkland, Fla, Shooting (2018);March for Our Lives Inc;Uvalde (Tex);El Paso (Tex);audio-neutral-informative"
51,A religious public charter school would be an affront to taxpayers everywhere.,Something deeply un-American is underway in the state of Oklahoma.,2023-08-01T09:01:26+0000,article,Opinion,Op-Ed,Christian Nationalists Can’t Wait for This School in Oklahoma to Open,"Religion-State Relations;Private and Sectarian Schools;Education (K-12);Charter Schools;Freedom of Religion;Education;Constitution (US);AMERICANS UNITED FOR SEPARATION OF CHURCH AND STATE;Republican Party;Roman Catholic Church;Drummond, Gentner;Jefferson, Thomas;Oklahoma"
52,A federal gun law passed last year gave the Biden administration a powerful new tool to increase background checks on “private” firearms sales. Will the administration use it?,"Another school week had just begun at Central Visual and Performing Arts High School in St. Louis when Orlando Harris, armed with a recently purchased AR-15-style rifle and 600 rounds of ammunition, burst into the building with a declaration: “You are all going to die!”",2023-08-01T09:01:26+0000,article,U.S.,News,"A Craigslist for Guns, With No Background Checks","Gun Control;E-Commerce;Regulation and Deregulation of Industry;Law and Legislation;Murders, Attempted Murders and Homicides;BUREAU OF ALCOHOL, TOBACCO, FIREARMS AND EXPLOSIVES;St Louis, Mo, Shooting (2022);St Louis (Mo);United States;United States Politics and Government"
53,"Taking the monster truck concept to deadly new realms, cartels are modifying pickups with gun turrets, steel armoring and battering rams.","In the United States, some truck owners delight in modifying their rigs with oversized wheels, heavy-duty suspension kits and soot-spewing exhaust systems, turning them into the monster trucks that stalk organized events like demolition derbies and mud bogs.",2023-08-01T09:01:26+0000,article,World,News,Mexico’s ‘Monster’ Trucks Show Cartels Taking Drug War to Next Level,"Mexico;Drug Cartels;Sports Utility Vehicles and Light Trucks;Jalisco New Generation Cartel;Oseguera Cervantes, Nemesio"
54,"When he’s not performing in “Here Lies Love,” this Broadway star finds refuge in the Hamptons.","When he’s not performing in “Here Lies Love,” this Broadway star finds refuge in the Hamptons.",2023-08-01T09:01:28+0000,multimedia,Real Estate,Slideshow,At Home With Jose Llana,"Real Estate and Housing (Residential);Llana, Jose;Byrne, David;Interior Design and Furnishings;Hamptons (NY);Content Type: Personal Profile;Theater (Broadway);Marcos, Ferdinand E;Marcos, Imelda R"
55,"When he’s not performing in “Here Lies Love,” a musical about the Philippines’s infamous first couple, this Broadway star finds refuge outside the city.","It’s a few days after the Broadway opening of “Here Lies Love,” the David Byrne/Fatboy Slim poperetta that charts the rise and fall of the Philippines’s infamous first couple, Ferdinand and Imelda Marcos. And here sits Jose Llana — he plays Ferdinand — in the kitchen of the Hamptons, N.Y., weekend house he shares with his husband, Erik Rose, a real estate executive.",2023-08-01T09:01:30+0000,article,Real Estate,News,Jose Llana (a.k.a. Ferdinand Marcos) Makes a Home in the Hamptons,"Llana, Jose;Real Estate and Housing (Residential);Interior Design and Furnishings;Hamptons (NY);Actors and Actresses;Theater;Theater (Broadway);Here Lies Love (Play);Content Type: Personal Profile"
56,At least seven heat-related deaths are suspected in state and national parks during a record-breaking heat wave.,"For hikers in the American Southwest, this searing hot summer has been an exceptionally dangerous one.",2023-08-01T09:03:24+0000,article,U.S.,News,A Deadly Summer for Hikers in the Southwest,"Heatstroke;Deaths (Fatalities);Heat and Heat Waves;National Parks, Monuments and Seashores;Hikes and Hiking;National Park Service;Big Bend National Park (Tex);Death Valley National Park;Grand Canyon National Park;Southwestern States (US)"
57,"The choreography of finding and clearing unexploded, decades-old munitions has become routine on Germany’s northern coast.","In the wake of the war in Ukraine, the port at Wilhelmshaven has emerged as a critical hub for German efforts to break the country’s dependence on Russian energy. It is there, on the North Sea coast, that officials would like to build a giant new terminal to import liquefied natural gas from other sources.",2023-08-01T09:18:24+0000,article,World,News,Construction to Break German Dependence on Russian Gas Hits a Snag: Wartime Bombs,Germany;Natural Gas;Hazardous and Toxic Substances;Russian Invasion of Ukraine (2022);Wilhelmshaven (Germany);World War II (1939-45);Building (Construction);North Sea
58,"Exclusively from New York Times Audio, our new app.","The New York Times Audio app is home to journalism and storytelling, and provides news, depth and serendipity. If you haven’t already, download it here — available to Times news subscribers on iOS — and sign up for our weekly newsletter.",2023-08-01T09:45:02+0000,article,Podcasts,News,"Today’s Top News: Biden’s Poll Numbers Get Stronger, and More","Polls and Public Opinion;Biden, Joseph R Jr;Trump, Donald J;Myanmar;National Football League;Watson, Deshaun (1995- )"
59,How the N.R.A. became a lobbying juggernaut.,"How did the National Rifle Association, America’s most influential gun-rights group, amass its power?",2023-08-01T10:00:05+0000,article,Podcasts,News,The Secret History of Gun Rights,"audio-neutral-informative;Lobbying and Lobbyists;Law and Legislation;Gun Control;United States Politics and Government;News Sources, Confidential Status of;Presidential Election of 2024;Elections, House of Representatives;National Rifle Assn;Democratic Party"
60,"Exciting debuts from Naoise Dolan, Megan Nolan and Nicole Flattery suggested a new direction in Irish literature. Now, where will they take it?","In recent years, Irish novelists, and particularly Irish women novelists, have published some of the most compelling English-language literary fiction.",2023-08-01T10:16:56+0000,article,Books,News,3 Young Irish Writers and Their ‘Difficult Second Books’,"Books and Literature;Writing and Writers;Dolan, Naoise;Flattery, Nicole;Nolan, Megan (1990- )"
61,Looking more closely at the registered voters who don’t support Biden or Trump.,"The first Times poll of the 2024 election cycle shows a dead heat between President Biden and Donald Trump. If those two men are the presidential nominees next year, 43 percent of registered voters say they will support Biden, and 43 percent say they will back Trump.",2023-08-01T10:42:36+0000,article,Briefing,briefing,"Biden 43%, Trump 43%","internal-storyline-no;Presidential Election of 2024;Trump, Donald J;Biden, Joseph R Jr"
62,The company’s growth decelerated as the rebound from the pandemic normalized and its freight business declined. It also swung to a profit.,"Uber’s revenue increased 14 percent in its most recent quarter, the company reported on Tuesday, but the growth was its slowest since the coronavirus pandemic began easing last year.",2023-08-01T10:55:10+0000,article,Technology,News,Uber Posts 14% Rise in Revenue as Growth Slows,Uber Technologies Inc;Company Reports;Layoffs and Job Reductions;Car Services and Livery Cabs;Computers and the Internet
63,"The winners, who are sanitation co-workers in India, each make just a few dollars a day. The jackpot will help them pay off crippling debts.","In June, 11 women who work together as sanitation laborers in India pooled their money to buy the equivalent of a $3 lottery ticket because they could not afford the cost individually.",2023-08-01T10:58:07+0000,article,World,News,11 Women Pooled Money for a $3 Lottery Ticket. They Won $1.2 Million.,Lotteries;Caste Systems;Kerala (India);Women and Girls;India
64,"Nikki Haley, the former South Carolina governor and United Nations ambassador, has been struggling to gain traction in a crowded Republican field dominated by Donald Trump.",A super PAC supporting Nikki Haley’s presidential campaign said on Tuesday that it had reserved more than $13 million in television and digital ads in Iowa and New Hampshire starting in August. The outlay is the first major advertising push in support of Ms. Haley since she became the first Republican to challenge former President Donald J. Trump this year.,2023-08-01T11:15:09+0000,article,U.S.,News,Pro-Haley Group Plans $13 Million Ad Push in Iowa and New Hampshire,"Haley, Nikki R;Republican Party;Presidential Election of 2024;Political Advertising;Primaries and Caucuses;Political Action Committees;Iowa;New Hampshire"
65,"The York fire, in the southeastern part of the state, has consumed more than 77,000 acres of the Mojave National Preserve and crossed into Nevada, officials said.","California’s largest wildfire this year has swept across thousands of acres in the Mojave Desert since the weekend, and has been so powerful that it has produced spinning columns of fire, officials said.",2023-08-01T11:26:39+0000,article,U.S.,News,California’s Largest Wildfire of the Year Sweeps Across the Mojave,Wildfires;Deserts;California;Mojave National Preserve;Nevada;San Bernardino County (Calif)
66,Tensions were rising in the West African nation over demands by African and Western countries to reinstate a president ousted in a military takeover.,"More than 250 Europeans were evacuated from the West African nation of Niger on Tuesday on a plane sent by France, nearly a week after a coup threatened to set off a regional conflict.",2023-08-01T11:37:04+0000,article,World,News,Europeans Evacuate Niger Amid Risks of Wider Conflict,"Politics and Government;International Relations;Coups D'Etat and Attempted Coups D'Etat;Defense and Military Forces;Economic Community of West African States (Ecowas);Bazoum, Mohamed (1960- );Niger"
67,"Reed Jobs, 31, is starting an investment firm to focus on new cancer treatments, continuing a yearslong focus on a disease that hits close to home.","Reed Jobs is stepping into the spotlight: The 31-year-old son of Steve Jobs and Laurene Powell Jobs is starting a venture capital firm to invest in new cancer treatments, DealBook is the first to report. It’s an area that hits close to home, since his father, the iconic Apple co-founder, died from complications of pancreatic cancer in 2011.",2023-08-01T11:58:36+0000,article,Business Day,News,Steve Jobs’s Son Gets Into Venture Capital,"Jobs, Reed;Venture Capital;Cancer;Emerson Collective;Jobs, Steven P;Jobs, Laurene Powell;internal-storyline-no"
68,The nation’s most populous state is a vast and complex place. Fiction and nonfiction suggested by readers can help make sense of it.,"Although I grew up in California, my assigned reading in school didn’t offer much of a Golden State-specific education.",2023-08-01T13:00:13+0000,article,U.S.,briefing,The Books That Explain California,California
69,"Their buildings have expanded and expenses have surged, even as attendance slowed. Art lovers will bear the cost: The Guggenheim is the latest to increase its price of admission to $30 — the new normal.","Audience sizes just aren’t what they used to be at the Guggenheim Museum, where membership — once a dependable source of income — has declined by nearly 16 percent since 2019, and attendance in June slumped by 26 percent, from 89,600 to 65,900, over the same time frame. What has increased is the cost of running the institution. A newly unionized work force has bumped up salary expenses, while inflation is driving up the cost of everything from heating to shipping artworks, according to senior museum officials.",2023-08-01T13:00:14+0000,article,Arts,News,$30 Entrance Fees: Are America’s Art Museums Only for the Wealthy?,"Museums;Finances;Prices (Fares, Fees and Rates);Art;Guggenheim, Solomon R, Museum;Metropolitan Museum of Art;United States"
70,"An adaptation of Michael Haneke’s 2012 movie at the Salzburg Festival eschews cinematic realism, instead taking a highly stylized approach.","“How can I speak of love when I’m dead?” runs a powerful line in “Amour,” a stage adaptation of Michael Haneke’s 2012 film that premiered on Sunday at the Salzburg Festival, in Austria.",2023-08-01T13:03:38+0000,article,Theater,Review,"Review: In ‘Amour,’ Putting a Palme d’Or Winner Onstage","Theater;Movies;Actors and Actresses;Munchner Kammerspiele;Salzburg Festival;Haneke, Michael;Henkel, Karin"
71,The United Nations’ culture agency is warning of twin perils to the historic city from mass tourism and climate change.,"To protect its fragile ecosystem and stunning architecture, Venice has taken bold steps. In recent years, it has banned cruise ships from its lagoon and built sea walls to keep out high tides.",2023-08-01T13:09:32+0000,article,World,News,Venice Faces an Unwelcome Honor: Joining the Endangered Places List,Travel and Vacations;Historic Buildings and Sites;Global Warming;Water Pollution;Pollution;Cruises;Ships and Shipping;United Nations;Italy;Venice (Italy)
72,This word has appeared in 57 articles on NYTimes.com in the past year. Can you use it in a sentence?,"The word octogenarian has appeared in 57 articles on NYTimes.com in the past year, including on April 8 in “At 81, Ann-Margret Is Finally Living Her Rock ’n’ Roll Dream” by Jim Farber:",2023-08-01T13:19:12+0000,article,The Learning Network,News,Word of the Day: octogenarian,
73,"Nathaniel Tok, 16, writes about his love of Marvel movies — and how we, the audience, should support the writers and actors who are striking.","Our annual Summer Reading Contest invites teenagers around the world to tell us what New York Times pieces get their attention and why. This week, the sixth of our 10-week challenge, we received 1,006 entries. Thank you to everyone who participated, and congratulations to our winner, Nathaniel Tok, as well as to the runners-up and honorable mentions we honor below.",2023-08-01T13:34:12+0000,article,The Learning Network,News,‘Now Is Our Time to Assemble’: The Week 6 Winner of Our Summer Reading Contest,
74,"Borrowing its powers from Greek and Yoruba mythologies, Inua Ellams’s play tells the story of a demigod who becomes an N.B.A. superstar.","Turning verse into action is tricky, especially with ideas as lofty as the ones in Inua Ellams’s epic poem “The Half-God of Rainfall,” now appearing in theatrical guise at New York Theater Workshop.",2023-08-01T13:43:41+0000,article,Theater,Review,‘The Half-God of Rainfall’ Review: Basketball Under the Heavens,"Theater (Off Broadway);Basketball;The Half-God of Rainfall (Play);Ellams, Inua;Magar, Taibi;Theater"
75,How to play Wordle and a glossary of important terms,Thanks to reader Outside Observer for compiling this glossary of common terms people use when talking about Wordle.,2023-08-01T14:00:03+0000,article,Crosswords & Games,News,How to Talk About Wordle,Wordle (Puzzle)
76,"A close call against Portugal at the Women’s World Cup gave the United States a chance to consider what might have been, and then move past it.","From where she stood, the ball looked to be headed straight into the goal, and Megan Rapinoe cursed loudly in her head.",2023-08-01T14:10:55+0000,article,Sports,News,"Back From the Edge, U.S. Tries to Focus on What Comes Next","Soccer;Women's World Cup (Soccer);United States Women's National Soccer Team;Rapinoe, Megan;Portugal"
77,"Openings were little changed, but hiring and quitting both declined.","Job turnover decreased in June, the Labor Department reported on Tuesday, suggesting that the American labor market continues to slow down from its meteoric ascent after the pandemic lockdowns.",2023-08-01T14:41:39+0000,article,Business Day,News,Job Turnover Eased in June as the Labor Market Cooled,United States Economy;Labor and Jobs;Layoffs and Job Reductions;Hiring and Promotion;Federal Reserve System;Labor Department (US);Unemployment;Shortages
78,"With the addition of Woods, players will outnumber independent directors, giving them the final say in the tour’s plan to form a partnership with Saudi Arabia’s sovereign wealth fund.","Infuriated after being blindsided by the PGA Tour’s pact with Saudi Arabia’s sovereign wealth fund, a band of leading golfers has won a series of concessions from the beleaguered circuit’s commissioner — including the elevation of Tiger Woods to the tour’s board — in a star-driven rebuke of the tour.",2023-08-01T14:47:05+0000,article,Sports,News,Tiger Woods Joins PGA Tour Board in Concession to Player Demands,"Golf;Boards of Directors;Woods, Tiger;PGA Tour Inc;LIV Golf;Public Investment Fund (Saudi Arabia);Sovereign Wealth Funds;Monahan, Jay W (1970- );Saudi Arabia"
79,"Marinate your chicken thighs in pickled jalapeño brine, then toss the peppers with fresh summer corn and lime for a dinner that’s spicy, sweet, salty and sour.","It’s cruel that the best time of year to bake is also when you’re least likely to want to turn on the oven, and yet every summer I heat up the kitchen baking cherry pie and blueberry crisp. Desserts made with peak fruit are irresistible, and I mean that literally: I can’t resist them. I know we’re here to talk dinner, but if you have some spare time in low-key August, then you might want to know about these: peach cobbler, blueberry pie and lemon-blackberry shortcakes.",2023-08-01T15:00:03+0000,article,Food,Letter,Summer Done Simply: Sheet-Pan Chicken With Basil and Spicy Corn,Cooking and Cookbooks;Content Type: Service;Recipes
