,abstract,lead_paragraph,pub_date,document_type,section_name,type_of_material,headline,keywords
76,"Russia seeks more weaponry for its war in Ukraine, and a North Korean delegation recently traveled to Russia by train to plan for Mr. Kim’s visit this month, officials say.","Kim Jong-un, the leader of North Korea, plans to travel to Russia this month to meet with President Vladimir V. Putin to discuss the possibility of supplying Russia with more weaponry for its war in Ukraine and other military cooperation, according to American and allied officials.",2023-09-04T18:06:41+0000,article,U.S.,News,Kim Jong-un and Putin Plan to Meet in Russia to Discuss Weapons,"Putin, Vladimir V;Kim Jong-un;Russia;North Korea;Arms Trade;Defense and Military Forces;International Relations;United States International Relations;Classified Information and State Secrets;Russian Invasion of Ukraine (2022)"
77,"The festival opened this weekend with fewer stars, who were wary of breaking union rules about promoting films while two strikes have shut down much of Hollywood.","Majestic vistas, burbling brooks and sanguine festival goers are the hallmarks of the Telluride Film Festival, a showcase for the most prestigious films of the year. But no amount of natural beauty can overcome the low-level of anxiety that coursed through this mountain town over Labor Day weekend. With dual strikes raging in Hollywood — the writers’ strike just hit four months — no one wants to appear out of step with these unprecedented times.",2023-09-04T18:12:22+0000,article,Business Day,News,"Telluride Film Festival Goes On, Despite Anxiety Over Strikes",Movies;Strikes;Organized Labor;Telluride Film Festival;Actors and Actresses;ALLIANCE OF MOTION PICTURE AND TELEVISION PRODUCERS;SAG-AFTRA
78,"She embodied the glamour and the hardship of being married to an American hero. Her husband, Jim Lovell, was the commander of the ill-fated Apollo 13 mission in 1970.","Marilyn Lovell, who, as an object of fascination for the news media, the inspiration for movie and TV characters and a figure in history books, incarnated for many Americans the hardships and glamour of being an astronaut’s wife, died on Aug. 27 in Lake Forest, Ill. She was 93.",2023-09-04T18:18:16+0000,article,U.S.,Obituary (Obit),"Marilyn Lovell, Astronaut’s Wife in the Spotlight, Is Dead at 93","Lovell, Marilyn (1930-2023);Space and Astronomy;Deaths (Obituaries);Apollo Project;Lovell, James A Jr;internal-open-access-from-nl"
79,Blum was the dealer who introduced the West Coast to Pop Art and Lichtenstein’s works in the 1960s. Now he’s showing his friend’s rarely seen sculptures.,"The art dealer Irving Blum remembers walking into Leo Castelli’s New York gallery in 1965 and being taken by Roy Lichtenstein’s painting of a composition book, because he himself had carried one throughout grade school.",2023-09-04T18:50:50+0000,article,Arts,News,Roy Lichtenstein and Irving Blum: They Go Way Back,"Art;Museums;Sculpture;Gagosian Gallery;Lichtenstein, Roy;Blum, Irving (1930- )"
80,"The labor market is more vulnerable than it looks, so the Federal Reserve should tread carefully.","Economic growth has weakened considerably, but it’s still relatively easy for people to find jobs. That’s puzzling economists, who are used to seeing job offers disappear when growth slows. In other words, it’s a happy day for labor.",2023-09-04T19:00:03+0000,article,Opinion,Op-Ed,A Strong Job Market Doesn’t Mean the Economy Is Recession-Proof,internal-sub-only-nl;Inflation (Economics);Unemployment;Recession and Depression;Labor and Jobs;United States Economy;Interest Rates;Federal Reserve System
81,People filled Eastern Parkway to celebrate Caribbean culture at the annual J’Ouvert celebration and the West Indian American Day Parade.,"A rainbow crested over Brooklyn early on Monday morning as revelers gathered to send off the summer in the annual J’Ouvert celebration, and then march down Eastern Parkway in a whirl of flags and feathers in the city’s West Indian American Day parade.",2023-09-04T19:32:26+0000,article,New York,News,Brooklyn Waves Goodbye to Summer in a Whirl of Feathers and Flags,West Indian-Americans;Parades;West Indian-American Day;Police;Brooklyn (NYC);internal-open-access-from-nl
82,"Gen. Sergei Surovikin, who was seen as an ally of the mercenary leader Yevgeny V. Prigozhin, has re-emerged in public.","A top Russian general detained in the aftermath of the mutiny by the mercenary tycoon Yevgeny V. Prigozhin has been released, according to two U.S. officials and a person close to the Russian Defense Ministry.",2023-09-04T20:10:56+0000,article,World,News,Top Russian General Detained After Wagner Mutiny Is Released,"Russian Invasion of Ukraine (2022);Surovikin, Sergei;Wagner Group;Prigozhin, Yevgeny V;Putin, Vladimir V;Mercenaries and Private Military Contractors;Defense and Military Forces;Shoigu, Sergei K;Russia;Ukraine"
83,"Many athletes take their quirks and superstitions with them into competition, but Tiafoe has taken changing his damp shirt midmatch to an unusual level.","During a changeover 26 minutes into his second-round match against Sebastian Ofner, Frances Tiafoe reached into his bag, pulled out a fresh top and changed his shirt. Twenty-four minutes later, up by 4-1 in the second set, he swapped that shirt for a clean one again.",2023-09-04T20:32:44+0000,article,Sports,News,No Sweat. Frances Tiafoe Would Like a Fresh Shirt Now.,"Tennis;United States Open (Tennis);Sweating;Ashe, Arthur, Stadium;Mannarino, Adrian (1988- );Shelton, Ben (2002- );Tiafoe, Frances (1998- );Tien, Learner (2005- );United States"
84,"Also, Xi Jinping might skip the Group of 20 summit.","Kim Jong-un, North Korea’s leader, plans to travel to Russia this month to meet with its president, Vladimir Putin, to discuss military cooperation, including the possibility of supplying Russia with more weaponry for its war in Ukraine, according to U.S. and allied officials.",2023-09-04T21:02:10+0000,article,Briefing,briefing,Tuesday Briefing: Kim and Putin Plan to Meet in Russia,
85,"“You are my voice in English,” Gabriel García Márquez told her. She insisted that her name appear on the covers of books she translated, including with that of Cervantes.","Edith Grossman, whose acclaimed translations of “Love in the Time of Cholera” by Gabriel García Márquez and “Don Quixote” by Miguel de Cervantes raised the profile of the often-overlooked role of the translator, died on Monday at her home in Manhattan. She was 87.",2023-09-04T21:08:04+0000,article,Books,Obituary (Obit),"Edith Grossman, Who Elevated the Art of Translation, Dies at 87","Books and Literature;Spanish Language;Deaths (Obituaries);Writing and Writers;Grossman, Edith;Garcia Marquez, Gabriel;Love in the Time of Cholera (Book);Don Quixote (Book);Translation and Interpreters"
86,"The track, sung by Steve Harwell, took a winding path to evergreen status that illustrates how social media and fan-made content have transformed the music business.","Long before it became a soundtrack nugget and an internet meme, it was just a rock band’s attempt to land a radio hit.",2023-09-04T21:17:43+0000,article,Arts,News,How Smash Mouth’s ‘All Star’ Got a Second Wind From Memes,"Harwell, Steve;All Star (Song);Smash Mouth (Music Group);Pop and Rock Music;Social Media;Fans (Persons);Shrek (Movie);Movies"
87,"Here’s what to know about the singles match between Shelton and Tiafoe, two of the three American men remaining in the U.S. Open.",The men’s semifinals at the U.S. Open are guaranteed to include at least one American.,2023-09-04T21:24:45+0000,article,Sports,News,Ben Shelton and Frances Tiafoe Set for All-American Quarterfinal,"Tennis;United States Open (Tennis);Alcaraz, Carlos (2003- );Djokovic, Novak;Fritz, Taylor Harry (1997- );Karatsev, Aslan;Mannarino, Adrian (1988- );Paul, Tommy (1997- );Shelton, Ben (2002- );Thiem, Dominic;Tien, Learner (2005- );Townsend, Taylor;United States"
88,"Here’s what to know about the singles match between Gauff and Ostapenko, and Gauff’s return to the U.S. Open quarterfinals.","Coco Gauff, a 19-year-old American who has had an outstanding summer, will take on Jelena Ostapenko of Latvia in the quarterfinals of the U.S. Open on Tuesday.",2023-09-04T21:28:32+0000,article,Sports,News,How Coco Gauff Can Beat Jelena Ostapenko in the U.S. Open Quarterfinals,"Tennis;United States Open (Tennis);Gauff, Cori (2004- );Ostapenko, Jelena;Content Type: Service"
89,“Doppelganger” is a brilliant examination of a berserk political moment.,"I’ve been raving about Naomi Klein’s “Doppelganger” since I read an advance copy this summer, and when I tell people about it, some of them are baffled: You mean Klein wrote a whole book about being confused with the writer Naomi Wolf? The central conceit of “Doppelganger” sounds more like the premise for a surreal Charlie Kaufman film than a work by an earnest lefty who usually writes about overweening corporate power. Klein herself is apologetic about it. “In my defense, it was never my intent to write this book,” she says in its first line.",2023-09-04T21:54:34+0000,article,Opinion,Op-Ed,"Naomi Klein, Naomi Wolf and the Political Upside Down","Klein, Naomi;Wolf, Naomi;Doppelganger (Book);Coronavirus (2019-nCoV);Books and Literature;Right-Wing Extremism and Alt-Right;Writing and Writers"
90,"The star pitcher was charged after a physical altercation on Sunday evening at a soccer stadium in South Los Angeles and later freed on $50,000 bail, the authorities said.","The Dodgers pitcher Julio Urias was arrested late Sunday night and charged with a domestic violence felony after a physical altercation with his wife at a stadium in South Los Angeles, the authorities said on Monday.",2023-09-04T22:03:31+0000,article,Sports,News,Dodgers’ Julio Urias Arrested on Domestic Violence Felony,"Baseball;Domestic Violence;Los Angeles Dodgers;Urias, Julio (1996- );Los Angeles (Calif)"
91,Any notion that President Recep Tayyip Erdogan of Turkey might be shifting away from his friendly ties with the Kremlin appeared to evaporate on Monday.,"Just two months ago, many in the West thought President Recep Tayyip Erdogan of Turkey could be shifting away from what they considered his overly close relationship with President Vladimir V. Putin of Russia.",2023-09-04T22:10:57+0000,article,World,News,Friendly Putin-Erdogan Meeting Keeps West Guessing,"Russian Invasion of Ukraine (2022);Grain;North Atlantic Treaty Organization;Erdogan, Recep Tayyip;Putin, Vladimir V;Black Sea;Sochi (Russia);Turkey"
92,"Unseeded Matteo Arnaldi rolled into the fourth round at the U.S. Open, but that’s where his terrific run ended.","Matteo Arnaldi, an unheralded Italian player, was having a lovely time in New York, knocking off one opponent after another on his way to the fourth round at the U.S. Open.",2023-09-04T23:40:21+0000,article,Sports,News,A Young Player’s Future Looks Bright Until He Runs Into Carlos Alcaraz,"Tennis;United States Open (Tennis);Alcaraz, Carlos (2003- );Content Type: Personal Profile;Ashe, Arthur, Stadium;Arnaldi, Matteo (2001- )"
