,abstract,lead_paragraph,pub_date,document_type,section_name,type_of_material,headline,keywords
0,"The decision by Justice Arthur F. Engoron is a major victory for Attorney General Letitia James in her lawsuit against Mr. Trump, effectively deciding that no trial was needed to determine that he had fraudulently secured favorable terms on loans and insurance deals.","The decision by Justice Arthur F. Engoron is a major victory for Attorney General Letitia James in her lawsuit against Mr. Trump, effectively deciding that no trial was needed to determine that he had fraudulently secured favorable terms on loans and insurance deals.",2023-09-27T00:14:11+0000,multimedia,U.S.,Interactive Feature,Read the Judge’s Ruling in the Trump Fraud Case,
1,A New York judge ruled that Donald J. Trump committed fraud by inflating the value of his assets and stripped the former president of control over some of his properties. Here is the judge’s legal reasoning.,,2023-09-27T00:28:08+0000,article,New York,News,Read the Judge’s Ruling in the Trump Fraud Case,"Decisions and Verdicts;Frauds and Swindling;Suits and Litigation (Civil);New York State Civil Case Against Trump (452564/2022);Attorneys General;Courts and the Judiciary;Politics and Government;Engoron, Arthur F;James, Letitia;Trump, Donald J;New York State;Trump Organization"
2,The leadership of the Writers Guild of America voted to end a 148-day strike. Members will start voting on the deal’s ratification next week.,"After 148 days on strike, television and movie writers will begin returning to work on Wednesday.",2023-09-27T00:42:30+0000,article,Business Day,News,TV and Movie Writers to Begin Returning to Work on Wednesday,Organized Labor;Strikes;Writing and Writers;Movies;Writers Guild of America;Television;ALLIANCE OF MOTION PICTURE AND TELEVISION PRODUCERS
3,"Pava LaPere, 26, had been heralded in the city as a rising businesswoman devoted to her community. Officials said the suspect, a sex offender released from prison last fall, was armed and dangerous.","The founder and chief executive of a Baltimore tech start-up who was acclaimed as a rising entrepreneur in the city was found dead on Monday, the police said, prompting a manhunt on Tuesday for a suspect considered to be armed and dangerous.",2023-09-27T01:21:12+0000,article,U.S.,News,Baltimore Police Search for Suspect in Killing of Tech C.E.O.,"LaPere, Pava;Fugitives;Murders, Attempted Murders and Homicides;Johns Hopkins University;Baltimore (Md);EcoMap Technologies;Billingsley, Jason Dean"
4,Scott Koenig puts silly thoughts to bed with a clever crossword.,Jump to: Today’s Theme | Tricky Clues,2023-09-27T02:00:08+0000,article,Crosswords & Games,News,"Talk, Talk, Talk",Crossword Puzzles
5,"Quotation of the Day for Tuesday, September 26, 2023.",“It was not enough for him to imprison me and send me into exile in addition to stigmatizing me as a terrorist and traitor.”,2023-09-27T03:42:59+0000,article,Corrections,Quote,"Quotation of the Day: In Nicaragua, ‘Traitors’ Lose Their Citizenship, and Now Their Houses",
6,"Corrections that appeared in print on Wednesday, Sept. 27, 2023.","An article on Sept. 7 about a missile strike on a street market in Kostyantynivka, Ukraine,  overstated what is known about the origin of the missile. While President Volodymyr Zelensky attributed the strike to Russia, which had shelled the town in recent months, evidence uncovered later suggests an errant Ukrainian missile may have hit the market. A spokesman for Ukraine’s armed forces said the country’s security service was investigating the episode.",2023-09-27T03:43:04+0000,article,Corrections,Correction,"Corrections: Sept. 27, 2023",
7,"The law, aimed at forcing social media giants to adopt new policies to curb harmful content, is expected to face blowback from Elon Musk, who owns X.","The Facebook page in Slovakia called Som z dediny, which means “I’m from the village,” trumpeted a debunked Russian claim last month that Ukraine’s president had secretly purchased a vacation home in Egypt under his mother-in-law’s name.",2023-09-27T04:00:11+0000,article,Technology,News,E.U. Law Sets the Stage for a Clash Over Disinformation,"Law and Legislation;Social Media;Rumors and Misinformation;Freedom of Speech and Expression;General Data Protection Regulation (GDPR);Censorship;Regulation and Deregulation of Industry;European Commission;Caputova, Zuzana;Slovakia;Europe"
8,The first matchup last month fueled momentum for Nikki Haley and a slide in standing for Ron DeSantis. What it didn’t do is diminish Donald Trump’s lead.,"Seven Republican presidential hopefuls not named Donald J. Trump will gather on Wednesday at the Ronald Reagan Presidential Library in Simi Valley, Calif., with the pressing task of securing second place in the Republican Party’s nominating race — and the ultimate mission of actually challenging the front-runner, Mr. Trump.",2023-09-27T04:01:13+0000,article,U.S.,News,Here’s what to watch for tonight.,"United States Politics and Government;Presidential Election of 2024;Debates (Political);Primaries and Caucuses;Republican Party;Reagan, Ronald, Presidential Library and Museum;Christie, Christopher J;DeSantis, Ron;Haley, Nikki R;Pence, Mike;Ramaswamy, Vivek (1985- );Scott, Timothy Eugene;Trump, Donald J"
9,"The nation’s current crisis can be traced back, in ways large and small, to the outsize personality of its longest-serving prime minister.","Flanked by two bickering ministers, Benjamin Netanyahu appeared to shrivel in his seat. It was late July in the Knesset, the last week before the summer recess, but there was no anticipatory buzz in the air. While lawmakers were preparing to vote, anti-government protesters, walled off from Parliament by newly installed barbed wire, chanted “Busha!” — “Shame!” ",2023-09-27T04:01:28+0000,article,Magazine,News,"Benjamin Netanyahu’s Two Decades of Power, Bluster and Ego","Netanyahu, Benjamin;Israel;International Relations;Israeli Settlements;Palestinians;Terrorism;Levin, Yariv (1969- );Iran;Netanyahu, Sara;Obama, Barack;Hasidism"
10,"After decades of wars and tense stalemates, almost no one saw it coming: Azerbaijan seized Nagorno-Karabakh from Armenian control seemingly overnight.","Tens of thousands died fighting for and against it, destroying the careers of two presidents — one Armenian, one Azerbaijani — and tormenting a generation of American, Russian and European diplomats pushing stillborn peace plans. It outlasted six U.S. presidents.",2023-09-27T04:01:38+0000,article,World,News,"A Stunningly Sudden End to a Long, Bloody Conflict in the Caucasus","vis-photo;Territorial Disputes;War and Armed Conflicts;Refugees and Displaced Persons;Secession and Independence Movements;Armenians;Aliyev, Ilham H;Pashinyan, Nikol;Nagorno-Karabakh;Azerbaijan;Armenia;Russia;USSR (Former Soviet Union)"
11,"Numerous witnesses said flares fired toward the ceiling as the bride and groom danced started the fire, which quickly engulfed the building.","Numerous witnesses said flares fired toward the ceiling as the bride and groom danced started the fire, which quickly engulfed the building.",2023-09-27T04:07:36+0000,multimedia,World,Video,Deadly Fire in Iraq Reduces Wedding Hall to Charred Debris,Nineveh (Iraq);Fires and Firefighters;Weddings and Engagements;Fireworks;Iraq
12,Uncertainty over the fate of a Russian admiral.,"A day after announcing that Viktor Sokolov, a top Russian admiral, was among 34 officers killed in an audacious strike deep behind enemy lines, Ukrainian officials acknowledged yesterday that there might be some uncertainty. It came after Moscow released a video purporting to show the admiral attending a meeting earlier in the day.",2023-09-27T04:16:24+0000,article,Briefing,briefing,Wednesday Briefing,
13,"A 15-story office building has been planted inside the old brick walls of the former Domino’s sugar refinery. Also, Senator Robert Menendez loses support in his own party.",Good morning. It’s Wednesday. Today we’ll look at the building-within-a-building that is giving new life to an old sugar refinery. We’ll also find out about the chorus of Democrats in the Senate calling for Robert Menendez to resign.,2023-09-27T04:20:04+0000,article,New York,briefing,New Life for an Old Building in Williamsburg,"New York City;internal-storyline-no;Brick and Tile;Sugar;Hermes International SA;Democratic Party;Menendez, Robert;Brooklyn (NYC)"
14,"Unions representing 60,000 workers across Nevada have been in talks with the resorts since April. The vote is a crucial step toward a walkout.","Hospitality workers in Las Vegas have voted overwhelmingly to authorize a strike against major resorts along the Strip, a critical step toward a walkout as the economically challenged city prepares for major sporting events in the months ahead.",2023-09-27T05:20:46+0000,article,Business Day,News,Las Vegas Hospitality Workers Authorize Strike at Major Resorts,Strikes;Organized Labor;Labor and Jobs;Culinary Workers Union;Las Vegas (Nev);Unite Here;Economic Conditions and Trends;Hotels and Travel Lodgings
15,This word has appeared in 33 articles on NYTimes.com in the past year. Can you use it in a sentence?,"The word buoyancy has appeared in 33 articles on NYTimes.com in the past year, including on March 31 in “From Flip-Flops to the Final Four, Georgia Amoore Commands the Court” by Remy Tumin:",2023-09-27T06:00:02+0000,article,The Learning Network,News,Word of the Day: buoyancy,
16,Feeling stuck on today’s puzzle? We can help.,"WEDNESDAY — Hi busy bees! Welcome to today’s Spelling Bee forum. There are a number of terms that appear in both this article and other online discussions of the Spelling Bee; a glossary of those terms compiled by Monicat, a Times reader, can be found below. For more Spelling Bee conversation, check out Deb Amlen’s weekly humor column, “Diary of a Spelling Bee Fanatic.”",2023-09-27T07:00:05+0000,article,Crosswords & Games,News,Spelling Bee Forum,Spelling Bee (Game)
17,"Whether blasting through gender barriers or writing at superhuman speed, here are five moments when New York Times sportswriters went the extra mile for the news.","At the first modern Olympics, in Athens in 1896, The New York Times was there to chronicle the presence of the king of Greece and the duke of Sparta, the hills “black with spectators” too poor to pay for tickets and the triumph of American athletes (“they won their victories with much apparent ease”).",2023-09-27T07:00:14+0000,article,Times Insider,News,Scenes From More Than a Century of Sports,Athletics and Sports;New York Times
18,"Senator Robert Menendez and his wife, Nadine, were freed after posting personal recognizance bonds. He can travel out of the country, but only on official business.","Senator Robert Menendez of New Jersey and his wife, Nadine Menendez, pleaded not guilty on Wednesday to bribery charges, marking the second time in eight years he has stood before a federal judge accused of trading his political influence for cash and luxury items.",2023-09-27T07:00:18+0000,article,New York,News,"Side by Side, Menendez and His Wife Plead Not Guilty to Bribery Charges","Menendez, Robert;Menendez, Nadine;Hana, Wael;Daibes, Fred;Bribery and Kickbacks;Politics and Government;New Jersey;Egypt"
19,"What songs, albums and concerts are you looking forward to?","Olivia Rodrigo’s new album had a blockbuster opening at No. 1 on Billboard’s chart last week. “Guts,” the second LP by the 20-year-old, became her second No. 1 album.",2023-09-27T07:00:22+0000,article,The Learning Network,News,Fall Music,
20,The New Jersey Democrat broke barriers for Latinos. But prosecutors circled for decades before charging him with an explosive new bribery plot.,"Robert Menendez’s education in political corruption came unusually early. In 1982, he turned against his mentor, Mayor William V. Musto of Union City, N.J., the popular leader of their gritty hometown.",2023-09-27T07:00:26+0000,article,New York,News,"As Menendez’s Star Rose, Fears of Corruption Cast a Persistent Shadow","Menendez, Robert;Gifts to Public Officials;Bribery and Kickbacks;Ethics and Official Misconduct;Content Type: Personal Profile;Corruption (Institutional);Hudson County (NJ);Union City (NJ);New Jersey;House of Representatives;Politics and Government;United States Politics and Government;Musto, William V;audio-neutral-informative"
21,Our columnist reviews the day’s puzzle. Warning: Contains spoilers!,"Welcome to The Wordle Review. Be warned: This article contains spoilers for today’s puzzle. Solve Wordle first, or scroll at your own risk.",2023-09-27T07:00:27+0000,article,Crosswords & Games,News,Today’s Wordle Review,Crossword Puzzles;Wordle (Puzzle)
22,The former president will be making a campaign stop in Michigan on Wednesday amid the United Automobile Workers’ strike. He has both appeased unions and sought to circumvent them.,"As a businessman, Donald J. Trump at first tried to circumvent labor unions, then spent decades largely appeasing them to avoid costly strikes.",2023-09-27T07:00:28+0000,article,U.S.,News,"Trump, Weighing In on Auto Strike, Has a Mixed Legacy on Unions","Organized Labor;Strikes;Automobiles;Presidential Election of 2024;United States Politics and Government;Real Estate (Commercial);Trump, Donald J;United Automobile Workers;Trump Organization"
23,Justice Arthur F. Engoron’s finding that the former president committed fraud has major implications for his businesses. But Mr. Trump still has cards left to play.,"A New York State Supreme Court judge issued a ruling on Tuesday that, if it stands, would have major consequences for Donald J. Trump.",2023-09-27T07:00:29+0000,article,New York,News,Six Takeaways From a New York Judge’s Ruling Against Donald J. Trump,"Decisions and Verdicts;Suits and Litigation (Civil);New York State Civil Case Against Trump (452564/2022);Ethics and Official Misconduct;United States Politics and Government;Trump Organization;Engoron, Arthur F;James, Letitia;Trump, Donald J;New York State"
24,"As the bride and groom danced, witnesses said, flares were set off at the venue in northern Iraq, starting a fire that spread with astonishing speed and killed more than 100 people.","The bride and groom had just swept onto the dance floor — her dress billowing around her — for the traditional “slow dance” while people lit flares to add excitement to the romantic moment. But the flames shot upward, igniting the decorations draped over the chandeliers and hung from the ceiling, turning a night of celebration into a time of mourning.",2023-09-27T07:39:09+0000,article,World,News,"As Hundreds Were Celebrating a Wedding, It Turned Into an Inferno",Iraq;Fires and Firefighters;Weddings and Engagements;Deaths (Fatalities);Christians and Christianity
25,Saint Laurent and Dior play it safe in Paris.,"In the middle of the Champ de Mars, not far from the foot of the Eiffel Tower silhouetted in the evening sky like a power postcard, Anthony Vaccarello of Saint Laurent constructed a monumental faux-marble platform, the better to showcase his spring collection. Austin Butler arrived and embraced his “Elvis” director, Baz Luhrmann, who was sitting next to Anna Wintour. Hailey Bieber posed with Kate Moss. Smartphones flashed. On the sea of grass below, a sea of onlookers gawked.",2023-09-27T07:39:34+0000,article,Style,News,Where Are the Big Ideas?,"Fashion and Apparel;Paris Fashion Week;Christian Dior SA;Chiuri, Maria Grazia;Yves Saint Laurent;Vaccarello, Anthony;your-feed-fashion"
26,"After his so-so Helmut Lang debut in New York, Peter Do unveiled his own line in Paris. And it was great.","For years in fashion, it was trendy for one designer to helm two brands: their own, usually a relatively small one, and a big heritage house at which they acted as, essentially, talent for hire. John Galliano did it, so did Alexander McQueen, Alexander Wang and Karl Lagerfeld (well, he actually ran three brands).",2023-09-27T08:22:31+0000,article,Style,News,Can One Designer Serve Two Masters?,"Fashion and Apparel;Do, Peter;Lang, Helmut;Paris Fashion Week;your-feed-fashion"
27,"Travelers who require short-term visas to visit Europe say they face monthslong delays, jeopardizing their travel plans and making an already unpredictable system worse.","For most travelers from the United States, going to Europe is a relatively smooth experience, without the need to apply for visas or pay steep fees for short visits.",2023-09-27T09:00:13+0000,article,Travel,News,Need a Visa to Go to Europe? Get in (a Very Long) Line.,Travel and Vacations;Europe;Visas;Passports;Politics and Government
28,Why hasn’t the federal government stepped in to remove his cattle from federal land?,"Nine years ago, a 68-year-old rancher named Cliven Bundy issued a call to arms from his spread in southern Nevada near the small desert town of Bunkerville. Mr. Bundy rallied supporters to join him in defending his cattle from the “overreach” of federal officials.",2023-09-27T09:00:16+0000,article,Opinion,Op-Ed,Cliven Bundy and His Cows Continue to Flout the Law,"Fringe Groups and Movements;Federal Lands;Cattle;Endangered and Extinct Species;Deserts;Storming of the US Capitol (Jan, 2021);Right-Wing Extremism and Alt-Right;Ranches;Trespassing;National Parks, Monuments and Seashores;Bureau of Land Management;Center for Biological Diversity;Forest Service;Las Vegas Sun (Newspaper);Three Percenters;Biden, Joseph R Jr;Bundy, Cliven;Trump, Donald J;Gold Butte National Monument (Nev);Las Vegas (Nev);Malheur National Wildlife Refuge (Oregon);Nevada;United States;Western States (US)"
29,"I have struggled with the collision of racial consciousness and spiritual doubt, but Christianity remains my home.","Discarding a belief in God can feel like an intellectual rite of passage to adulthood. Just as our bodies develop and change, so can our relationship to things spiritual, leading us sometimes to set aside organized religion. For African Americans, in particular, adult faith is complicated by the way certain understandings of Christianity were used to justify our ancestors’ enslavement.",2023-09-27T09:00:16+0000,article,Opinion,Op-Ed,How the Faith That Arose From the Cotton Fields Challenges Me,Christians and Christianity;Black People;Blacks;Slavery (Historical)
30,"The chair of the Federal Trade Commission wants to disrupt Amazon, whose founder built a trillion-dollar firm by disrupting retail.",Jeff Bezos made his fortune with one truly big idea: What if a retailer did everything possible to make customers happy?,2023-09-27T09:00:29+0000,article,Technology,News,Lina Khan vs. Jeff Bezos: This Is Big Tech’s Real Cage Match,"Amazon.com Inc;Federal Trade Commission;Bezos, Jeffrey P;Khan, Lina;E-Commerce;Antitrust Laws and Competition Issues;Computers and the Internet;Shopping and Retail;Regulation and Deregulation of Industry;Law and Legislation;audio-neutral-informative"
31,"As autoworkers strike across the country, “Hillbilly Highway” and “Black Folk” offer two views of the search for a better life by working-class migrants in the middle of the 20th century.","Between 1900 and 1970, millions of Americans left the South for the North, West and Midwest. Max Fraser’s “Hillbilly Highway” traces the movement of about eight million of them, poor whites from the “Upper South” — states such as Arkansas, Tennessee, Kentucky — to industrial parts of the Midwest, cities such as Detroit, Cincinnati and Chicago. In “Black Folk,” Blair LM Kelley ties the exodus of another six million or so to a moving memoir of Black family migration, as well as to the wider sweep of time from slavery to the present. Together, these two migrations have helped shape two sides of our current perilous political moment.",2023-09-27T09:00:41+0000,article,Books,Review,The Black and White Southerners Who Changed the North,"Books and Literature;Black People;Blacks;Labor and Jobs;Factories and Manufacturing;Strikes;Whites;Organized Labor;Republican Party;Democratic Party;Randolph, A Philip;Southern States (US);Midwestern States (US);Black Folk: The Roots of the Black Working Class (Book);Hillbilly Highway: The Transappalachian Migration and the Making of a White Working Class (Book);Kelley, Blair LM;Fraser, Max (Author)"
32,"For years, the director puzzled over an adaptation of “The Wonderful Story of Henry Sugar.” Then he let the characters say things they weren’t meant to.","Fifteen years ago, while the director Wes Anderson was adapting Roald Dahl’s “Fantastic Mr. Fox” into a stop-motion animated film, the author’s widow, Felicity, asked whether he saw cinematic potential in any of Dahl’s other tales. One came immediately to Anderson’s mind: “The Wonderful Story of Henry Sugar,” a short Dahl published in 1977 about a wealthy gambler who learns a secret meditation technique that allows him to see through playing cards.",2023-09-27T09:00:41+0000,article,Movies,News,Wes Anderson Finally Found a Way Into His New Roald Dahl Film,"Movies;Content Type: Personal Profile;ANDERSON, WES;Dahl, Roald;The Wonderful Story of Henry Sugar (Movie)"
33,"How hotshot directors are reimagining “Cats,” “Evita,” “Jesus Christ Superstar” and “Sunset Boulevard.”","The closing of “The Phantom of the Opera” last spring left a chandelier-sized hole in New York. And as of this summer, for the first time in 44 years, there is no Andrew Lloyd Webber musical running on Broadway.",2023-09-27T09:00:42+0000,article,Theater,News,"Andrew Lloyd Webber, Darling of the Avant-Garde?","Theater;Cannold, Sammi;Levingston, Zhailon;Lloyd Webber, Andrew;Lloyd, Jamie;Rauch, Bill;van Hove, Ivo;Cats (Play);Evita (Play);Jesus Christ Superstar (Play);Sunset Boulevard (Play)"
34,"The art business can be unpredictable, especially in New York. We asked several art dealers how they stay afloat — and how much it costs to do so.","​​Without galleries — the point of entry for both artists and buyers — there would be no art market. But these businesses are also legendary for their lack of transparency. Information, especially about finances, seems opaque ​and secretive by design​.",2023-09-27T09:00:42+0000,article,T Magazine,News,How to Start a Gallery,"JTT Gallery (Manhattan, NY);Uffner, Rachel, Gallery (Manhattan, NY);New York City"
35,Workers who sign training repayment agreements can owe their employers thousands of dollars if they leave their jobs early. Regulators are starting to crack down on the practice.,"Drew Lakey quit her job as a physician assistant at the Skin and Cancer Institute in Delano, Calif., in November. She gave four months’ notice.",2023-09-27T09:01:01+0000,article,Business Day,News,They Quit Their Jobs. Their Ex-Employers Sued Them for Training Costs.,Labor and Jobs;Hiring and Promotion;Vocational Training;Personal Finances;National Labor Relations Board;Suits and Litigation (Civil);Regulation and Deregulation of Industry;United States
36,"In Georgia, Texas and Washington, D.C., three Black women are working to preserve desecrated African American burial grounds and the stories they hold.","The child’s headstone is inscribed simply “Nannie,” marking the grave of a 7-year-old girl who died on May 18, 1856. She is buried in one of Washington’s oldest Black cemeteries, in a neglected corner of Georgetown. For years she has touched visitors who have left toys, dolls and birthday cards at her grave.",2023-09-27T09:01:03+0000,article,U.S.,News,America’s Black Cemeteries and Three Women Trying to Save Them,"Cemeteries;Black People;Blacks;Tombs and Tombstones;Historic Buildings and Sites;Philanthropy;Women and Girls;Restoration and Renovation;Slavery (Historical);Texas;Georgia;Washington (DC);Georgetown (Washington, DC);Vandalism;internal-sub-only;internal-great-read;vis-photo"
37,"Powerful figures in Mississippi, including the attorney general, two judges and a future congressman, learned how a sheriff lied to spy on his girlfriend. They all kept his secret.","In 2014, Bryan Bailey, the sheriff of Rankin County, Miss., made what seemed like a series of routine requests of the local district attorney’s office.",2023-09-27T09:01:10+0000,article,U.S.,News,"The Sheriff, His Girlfriend and His Illegal Subpoenas","Bailey, Bryan (Rankin County, Miss, Sheriff);Police Brutality, Misconduct and Shootings;Sheriffs;Rankin County (Miss);Subpoenas;Politics and Government;internal-open-access"
38,"Gerry Turner, 72, is the lead of ABC’s new dating show — and ready to look for love again.","Women keep approaching Gerry Turner in airports, asking to pose for pictures with him. This is not something that ever happened in the first seven decades of his life. But a lot has changed since Mr. Turner, 72, signed up to date 22 women on a reality television show.",2023-09-27T09:01:16+0000,article,Style,News,He’s the First ‘Golden Bachelor.’ Just Don’t Call Him a Silver Fox.,Reality Television;The Bachelor (TV Program);Dating and Relationships;Content Type: Personal Profile;audio-neutral-informative
