,abstract,lead_paragraph,pub_date,document_type,section_name,type_of_material,headline,keywords
83,Congress should promptly approve a military aid package that includes crucial support for Ukraine and Israel.,"The Biden administration has asked Congress to approve a $105 billion military aid package, mostly to Israel and Ukraine, and lawmakers appear to be at an impasse over the border security measures included in it. It is essential that Congress overcome this opposition and approve it promptly, as an investment in America’s security goals.",2023-12-08T13:34:39+0000,article,Opinion,Editorial,An Aid Package That Invests in American Security Goals,"Foreign Aid;Russian Invasion of Ukraine (2022);Israel-Gaza War (2023- );Ukraine;Israel;Arms Trade;Defense and Military Forces;Biden, Joseph R Jr;United States Politics and Government;United States International Relations;Senate;House of Representatives;Republican Party;Illegal Immigration"
84,"Keong Sim reads the audiobook version of the author’s second posthumous collection, “Songs on Endless Repeat.”","As you download the audiobook version of Anthony Veasna So’s second posthumously published book, you might wonder how he’d have felt about “Songs on Endless Repeat” being in the public eye (and ear).",2023-12-08T13:52:18+0000,article,Books,Review,Breathing Life Into the Everlasting Words of Anthony Veasna So,"Audiobooks;So, Anthony Veasna (1992-2020)"
85,"Investors who want to lock in safe income may be hurt over the long haul if they don’t also hold stocks, our columnist says.",“All investments involve taking on risk.” That’s a standard Securities and Exchange Commission warning.,2023-12-08T14:00:09+0000,article,Business Day,News,"If You Hate Investment Risk, High Interest Rates Are Great. With a Catch.",Stocks and Bonds;ANNUITIES;Interest Rates;Inflation (Economics);Mutual Funds;Content Type: Service;Personal Finances
86,"Cashless tolls have reduced traffic jams, but they can also lead to hefty bills for out-of-state drivers. One piece of advice: Promptly pay the bill you get in the mail.","Remember when you used to have to keep a pile of quarters nearby to pay highway tolls? Cashless tolls have eliminated most of the long, time-eating lines at highway tollbooths, but they have a downside: They can lead to hefty bills for drivers on unfamiliar roads.",2023-12-08T14:00:11+0000,article,Your Money,News,Tips for Avoiding Surprise Bills From Electronic Toll Roads,"Automobiles;Prices (Fares, Fees and Rates);Content Type: Service;E-ZPass;Tolls;Personal Finances;Roads and Traffic;International Bridge, Tunnel and Turnpike Assn"
87,"Lean into the sunny, beachy winter vibes.",The days are shorter. I’m often admiring Christmas trees sparkling through home windows. Rain visited parts of the state this week.,2023-12-08T14:00:12+0000,article,U.S.,briefing,Introducing Our California Holiday Playlist,California
88,Prosecutors abruptly dropped charges against a man arrested by an instructor who was featured in a scathing report by New Jersey’s comptroller.,"Brad Gilmore, an instructor with Street Cop Training, a private police training company at the center of a far-reaching investigation by the New Jersey comptroller, was featured in videos made public on Wednesday in which he boasted about his success seizing large quantities of drugs.",2023-12-08T14:01:25+0000,article,New York,News,Drug Case Linked to Trainer at Vulgar ‘Street Cop’ Conference Is Dismissed,"Street Cop Training;Police Brutality, Misconduct and Shootings;Gilmore, Brad (Bergen County, NJ, Police Officer);Discrimination;Drug Abuse and Traffic;Search and Seizure;Walsh, Kevin D;Bergen County (NJ);New Jersey"
89,"President Emmanuel Macron had vowed to rebuild within five years from a blaze that marred the famed Paris cathedral. So far, the schedule is on track.","President Emmanuel Macron of France was in the heart of Paris on Friday to check on progress in the restoration of an 860-year-old limestone landmark: Notre-Dame Cathedral, whose familiar silhouette is rising once again on the skyline of the French capital.",2023-12-08T14:11:11+0000,article,World,News,"After Toppling in the 2019 Fire, Notre-Dame’s Spire Rises Again","Notre Dame Cathedral (Paris, France);Fires and Firefighters;Restoration and Renovation;ARCHITECTURE;Churches (Buildings);Historic Buildings and Sites;Paris (France);Macron, Emmanuel (1977- );Politics and Government;France;vis-video"
90,The Times’s economics team is looking for reader input on what you’re going through financially and what you see in your community.,"The economics team at The New York Times covers everything having to do with your financial well-being: jobs, inflation, wages, taxes, inequality, government regulations, the social safety net, small businesses, large businesses, the cost of college, housing, transportation and more.",2023-12-08T14:49:53+0000,article,Business Day,News,How Has the Economy Affected You? We Want to Know.,internal-reader-callout;Labor and Jobs
91,"Before his death in September, the renowned artist reflected on his life, legacy and visual philosophy.","This interview is part of a series called Turning Points, in which writers explore what critical moments from this year might mean for the year ahead. You can read more by visiting the Turning Points series page.",2023-12-08T15:00:20+0000,article,Special Series,News,Fernando Botero: ‘Art Was Created to Give Pleasure’,Art;Sculpture;Museum of Modern Art;Colombia
92,Two off-duty police officers and two tourists stopped a woman from setting fire to the home where Martin Luther King Jr. was born in Atlanta.,Two off-duty police officers and two tourists stopped a woman from setting fire to the home where Martin Luther King Jr. was born in Atlanta.,2023-12-08T15:15:59+0000,multimedia,U.S.,Video,Citizens Block Arson Attempt at Martin Luther King Jr.’s Birthplace,"Arson;King, Martin Luther Jr;Black People;Blacks;Historic Buildings and Sites;Atlanta (Ga)"
93,Rebuses are crossword elements where solvers are asked to write multiple letters in the same square. Here’s how to do that on your devices.,"Some solvers love them, some solvers hate them, but rebus elements pop up fairly often in late-week crosswords. A rebus can be a letter, a number or a symbol that represents a word, but in many crosswords, the rebus will be a word or group of letters that needs to be written inside a single square.",2023-12-08T15:19:33+0000,article,Crosswords & Games,News,"Yes, You Can Write More Than One Letter in a Square",Crossword Puzzles;Puzzles
94,The news network said it would host a Republican primary debate in New Hampshire at Saint Anselm College. That was news to Saint Anselm.,"With great fanfare this week, CNN announced it would host the network’s first debate of the 2024 presidential campaign, gathering the Republican candidates for a marquee event on Jan. 21 at Saint Anselm College in New Hampshire.",2023-12-08T15:27:34+0000,article,Business Day,News,‘What the Heck?’ CNN’s Debate Plans Leave New Hampshire Officials Confused.,CNN;Debates (Political);Television;News and News Media;Republican Party;Primaries and Caucuses;Presidential Election of 2024;United States Politics and Government;New Hampshire;Saint Anselm College;Colleges and Universities;ABC News;WMUR-TV
95,"The French fashion house took its Métiers d’Art show to the north of England and the home of soccer, Coronation Street and Northern soul.","Manchester is a city of glory and grit. Set among the damp northwest hills of England, it’s the rain-spattered home of Northern soul and legendary bands like Joy Division, New Order and Oasis; two world famous soccer clubs; the cradle of the industrial revolution; and one of the most vibrant nightlife scenes on the planet. Style and swagger? This proud city has them in spades. But most people would not consider it a capital of high fashion.",2023-12-08T15:34:47+0000,article,Style,News,Mad for It: What Happened When Chanel Came to Manchester,Fashion and Apparel;Fashion Shows;Chanel SA;Manchester (England)
96,Workers who load and unload cargo planes at DHL’s hub near Cincinnati walked out after months of negotiations failed to produce a contract.,"More than 1,100 workers at DHL Express’s global air cargo hub at Cincinnati/Northern Kentucky International Airport went on strike on Thursday after months of failed negotiations with the parcel carrier.",2023-12-08T15:49:50+0000,article,Business Day,News,DHL Workers at Kentucky Air Cargo Hub Go on Strike,Strikes;Labor and Jobs;Organized Labor;Freight (Cargo);Delivery Services;Deutsche Post DHL;International Brotherhood of Teamsters;Kentucky
97,"Eerie found footage, limited sunlight and unlimited zombies in this month’s horror picks.","Beth (Niamh Carolan) spends her days — or is it nights? — patrolling her small Canadian town where sunlight no longer exists and where zombielike humans called strays wander the snow-covered streets. To fight malaise, townspeople are supposed to take happy pills, but Beth has stopped doing so, apparently immune to whatever is causing her neighbors to turn rabid. As she increasingly has nightmares about a pustule-covered version of herself who turns people into strays, Beth starts to wonder if she may be the affliction’s cause — and cure.",2023-12-08T16:00:10+0000,article,Movies,News,Five Horror Movies to Stream Now,Movies
98,He sacrificed his grandmaster dreams to become one of the game’s most popular personalities.,"“Ladies and gentlemen!” Levy Rozman began, in his familiar faux-pretentious manner. “There are many ways to practice the wonderful game of chess. You can watch YouTube videos. You can buy courses. You can read books. And in terms of actually playing games, you can play against your friends. Maybe at the bar, maybe at the library. Maybe at your local chess club, maybe in tournaments. Online, offline! Or — ” he paused for emphasis “ — against bots.”",2023-12-08T16:05:10+0000,article,Magazine,News,"‘Starting Soon, Nerds’: Levy Rozman Wants to Teach You Chess","Rozman, Levy (1995- );Chess;internal-sub-only;internal-great-read;Video Recordings, Downloads and Streaming;Computers and the Internet;Brooklyn (NYC);Content Type: Personal Profile"
99,The director Yorgos Lanthimos narrates a sequence from the film featuring Emma Stone and Mark Ruffalo.,The director Yorgos Lanthimos narrates a sequence from the film featuring Emma Stone and Mark Ruffalo.,2023-12-08T16:33:59+0000,multimedia,Movies,Video,‘Poor Things’ | Anatomy of a Scene,"Movies;Stone, Emma;Lanthimos, Yorgos;Ruffalo, Mark;Poor Things (Movie)"
100,The director Yorgos Lanthimos narrates this sequence that puts the star and Mark Ruffalo awkwardly on the dance floor.,"In “Anatomy of a Scene,” we ask directors to reveal the secrets that go into making key scenes in their movies. See new episodes in the series on Fridays. You can also watch our collection of more than 150 videos on YouTube and subscribe to our YouTube channel.",2023-12-08T16:35:17+0000,article,Movies,News,Watch Emma Stone Do a Carefree Dance in ‘Poor Things’,"Movies;Lanthimos, Yorgos;Ruffalo, Mark;Macras, Constanza;Stone, Emma;Poor Things (Movie)"
101,"British American Tobacco, the parent company of Camel and Lucky Strike, said the rise of vaping was a big reason it was writing down the value of its brands.","British American Tobacco, the parent company of Camel and Lucky Strike, said the rise of vaping was a big reason it was writing down the value of its brands.",2023-12-08T16:36:21+0000,multimedia,Business Day,Interactive Feature,The Big Number: $31.5 Billion,Smoking and Tobacco;Company Reports;E-Cigarettes;Youth;Economic Conditions and Trends;British American Tobacco PLC
102,A decision by the International Olympic Committee paves the way for individuals from the two countries to take part over the objections of Ukraine and others.,"Individual athletes from Russia and Belarus who successfully qualify for next summer’s Paris Olympics will be allowed to compete in the Games, the International Olympic Committee announced on Friday, ending talk of a blanket ban on competitors from the two nations over the war in Ukraine.",2023-12-08T16:39:02+0000,article,World,News,Athletes From Russia and Belarus Are Cleared to Compete at Paris Olympics,"Russian Invasion of Ukraine (2022);Athletics and Sports;Olympic Games;International Olympic Committee;Bach, Thomas;Paris (France);Belarus;Russia;Ukraine"
103,"People with the genetic disease have new opportunities to eliminate their symptoms, but the treatments come with obstacles that limit their reach.","On Friday, the Food and Drug Administration approved the first gene editing therapy ever to be used in humans, for sickle cell disease, a debilitating blood disorder caused by a single mutated gene.",2023-12-08T16:39:05+0000,article,Health,News,"F.D.A. Approves Sickle Cell Treatments, Including One That Uses CRISPR",Sickle Cell Anemia;Food and Drug Administration;Crispr (DNA);Genetic Engineering;CRISPR Therapeutics;Vertex Pharmaceuticals Inc;Drugs (Pharmaceuticals)
104,"The company has disciplined union supporters and fired one in recent weeks, ahead of a trial that will weigh their right to interact with co-workers.","More than a year and a half after Amazon workers on Staten Island voted to form the company’s first union in the United States, the company appears to be taking a harder line toward labor organizing, disciplining workers and even firing one who had been heavily involved in the union campaign.",2023-12-08T16:44:09+0000,article,Business Day,News,"Amazon Is Cracking Down on Union Organizing, Workers Say",Amazon.com Inc;Workplace Hazards and Violations;Organized Labor;Amazon Labor Union;National Labor Relations Board;United States
105,Why did soccer’s richest league step back from streaming? Maybe because the status quo still pays.,"The technical term might be “vertical integration.” Or, on reflection, perhaps that is not quite right, and it would — in the jargon — be known as “synergy.” Maybe those are the same thing. Either way, the concept is best encapsulated by Jack Donaghy, the vulpine executive portrayed by Alec Baldwin in the presumably now problematic sitcom “30 Rock.”",2023-12-08T16:45:27+0000,article,World,News,The Missing Piece of the Premier League’s TV Rights Deal,"Soccer;English Premier League;Vela, Carlos;Major League Soccer;Sky PLC;NBC Sports;Sinclair, Christine (1983- )"
106,"When the U.S.’s largest Spanish-language network ran a friendly interview with the former president, Democrats cried foul. Executives say they’re seeking more balance.","The howls of protest against Univision began as soon as its interview with Donald J. Trump aired. A month later, they still haven’t stopped.",2023-12-08T16:55:28+0000,article,Business Day,News,Conundrum of Covering Trump Lands at Univision’s Doorstep,"Univision;Television;News and News Media;Hispanic-Americans;Spanish Language;Ratings (Audience Measurement);United States Politics and Government;Presidential Election of 2024;Grupo Televisa SAB;Trump, Donald J;Acevedo, Enrique (1978- );Coronell, Daniel;Democratic Party;Republican Party;Voting and Voters;Polls and Public Opinion"
107,The best bottles are not the ones that meet certain technical standards. They tell unforgettable stories and create enduring images.,"Every December, as I think back on the wines I most enjoyed over the course of the year, I wrestle with the word “best.”",2023-12-08T17:11:00+0000,article,Food,News,The Most Memorable Wines of 2023,Wines;Two Thousand Twenty Three
108,"Because the United Nations requires hosts to be chosen by consensus, next year’s climate summit is mired in wartime political tensions.","At the annual United Nations climate summit, governments are supposed to reach a consensus around how to avert catastrophic climate change.",2023-12-08T17:14:33+0000,article,Climate,News,"One After Another, Russia Blocks Candidates to Host Next Climate Summit",Global Warming;Greenhouse Gas Emissions;United Nations Framework Convention on Climate Change;Russian Invasion of Ukraine (2022);United Nations;Azerbaijan;Caucasus (Russia);Dubai (United Arab Emirates);Eastern Europe
109,"There was plenty of news this week for the late night hosts to riff on, including the fourth Republican presidential primary debate and Time magazine naming its person of the year: Taylor Swift. Here’s what the hosts had to say.","There was plenty of news this week for the late night hosts to riff on, including the fourth Republican presidential primary debate and Time magazine naming its person of the year: Taylor Swift. Here’s what the hosts had to say.",2023-12-08T17:18:31+0000,multimedia,Arts,Interactive Feature,The Best of Late Night This Week,
110,"The president, Claudine Gay, told the campus newspaper that she “should have had the presence of mind” to answer differently.",Harvard’s president apologized for her testimony before Congress about how she responded to antisemitism on campus — another sign that the controversy over her remarks and similar comments by the presidents of M.I.T. and the University of Pennsylvania was not going away.,2023-12-08T17:48:19+0000,article,U.S.,News,Harvard President Apologizes for Congressional Testimony on Antisemitism,"Colleges and Universities;Apologies;Anti-Semitism;Harvard Crimson;Harvard University;Gay, Claudine;Ackman, William A"
111,Readers discuss a judge’s ruling in a case in which the fetus had a fatal condition. Also: Aid to Ukraine; a threat to the media; teaching civics.,To the Editor:,2023-12-08T17:49:46+0000,article,Opinion,Letter,A Texas Court’s Approval of an Abortion Request,"Abortion;Decisions and Verdicts;United States Politics and Government;Foreign Aid;Russian Invasion of Ukraine (2022);Ukraine;News and News Media;Trump, Donald J;Education (K-12);Democracy (Theory and Philosophy);Threats and Threatening Messages;Women's Rights"
112,"Hear tracks by Tems, Idles, Adrianne Lenker and others.","Every Friday, pop critics for The New York Times weigh in on the week’s most notable new tracks. Just want the music? Listen to the Playlist on Spotify here (or find our profile: nytimes). Like what you hear? Let us know at theplaylist@nytimes.com and sign up for our Louder newsletter, a once-a-week blast of our pop music coverage, and The Amplifier, a twice-weekly guide to new and old songs.",2023-12-08T17:57:01+0000,article,Arts,News,"Nicki Minaj and Drake Reunite, and 10 More New Songs","Pop and Rock Music;Rap and Hip-Hop;Jazz;Idles (Music Group);Iyer, Vijay Trio;Drake (Rapper);Iyer, Vijay;McLamb, Eliza;Minaj, Nicki;Tems (1995- );Usher;Wilson, Gabriella (HER);Sorey, Tyshawn;Oh, Linda May Han"
113,"The Fans First Act would require disclosures about fees and the location of tickets, strengthen a law banning bots and set stiff penalties for violations.","The United States Senate introduced a long-awaited bill on Friday promising consumer protections for tickets to live entertainment events, after more than a year of complaints about high fees, out-of-control prices and deceptive selling practices in the entertainment world.",2023-12-08T18:03:15+0000,article,Arts,News,Senate Introduces Long-Awaited Bill Promising Changes for Ticket Buying,"Law and Legislation;Prices (Fares, Fees and Rates);Ticket Scalping;Music;Consumer Protection;Ticketmaster;StubHub;SeatGeek Inc;Anschutz Entertainment Group (AEG) Live;Live Nation Entertainment Inc"
114,"The National Retail Federation had said that nearly half of the industry’s $94.5 billion in missing merchandise in 2021 was the result of organized theft. It was likely closer to 5 percent, experts say.","A national lobbying group has retracted its startling estimate that “organized retail crime” was responsible for nearly half the $94.5 billion in store merchandise that disappeared in 2021, a figure that helped amplify claims that the United States was experiencing a nationwide wave of shoplifting.",2023-12-08T18:07:36+0000,article,Business Day,News,Retail Group Retracts Startling Claim About ‘Organized’ Shoplifting,"Shopping and Retail;Robberies and Thefts;Organized Crime;Shoplifting and Employee Theft (Retail);Lobbying and Lobbyists;News and News Media;Law and Legislation;United States Economy;United States Politics and Government;Black Markets;Company Reports;Computer and Communications Industry Assn;National Retail Federation;Trump, Donald J;Newsom, Gavin;DeSantis, Ron;Police Department (San Francisco, Calif);California;New York City;internal-storyline-no;internal-storyline-inline-no"
115,Party leaders have vowed not to repeat the vetting mistakes they made with the expelled congressman. But getting to yes is proving messy.,"If New York Republicans had hoped to quickly and cleanly turn the page on the embarrassing saga of George Santos, the week since his expulsion from Congress has not exactly gone as planned.",2023-12-08T18:19:41+0000,article,New York,News,Finding a Santos Successor Is Proving No Simple Task for Republicans,"Elections, House of Representatives;Republican Party;New York State;Nassau County (NY);Queens (NYC);Long Island (NY);LiPetri, Michael J (1990- );Pilip, Mazi Melesa;Sapraicone, Mike;Cairo, Joseph;Santos, George (1988- );United States Politics and Government;Democratic Party;Suozzi, Thomas R"
116,"“Linie 1” has been running since 1986 and just celebrated its 2,000th performance. Its cast of kooky dreamers and misfits still capture something special about Berlin.","On April 30, 1986, “Linie 1” (“Line 1”), a rock musical set in Berlin’s subway, premiered at a 367-seat theater in what was then West Berlin. In a rave review of the show, the newspaper Der Tagesspiegel praised the show, about a small-town girl who arrives in Berlin in search of her rocker boyfriend, as both “cosmopolitan and exportable.”",2023-12-08T18:24:47+0000,article,Theater,Review,Berlin’s Subway Musical Captures the Soul of the City,Theater;Linie 1 (Play);GRIPS Theater (Theater Co);Berlin (Germany)
117,"Released into the wild, the humble goldfish can grow to a monstrous size and destroy habitats for native species. Canadian researchers are tracking the fish, so that they might be culled.","Inside a fishbowl, the goldfish — a species of carp native to East Asia, bred for aesthetic delight and traditionally believed to bring good fortune — is hardly more than home décor. Usually just a few inches long, it is among the easiest of pets to keep.",2023-12-08T18:31:58+0000,article,Science,News,Once They Were Pets. Now Giant Goldfish Are Menacing the Great Lakes.,Carp (Fish);Invasive Species;Conservation of Resources;Lake Ontario;Journal of Great Lakes Research;Research
118,The interest in Petty’s breezy “Love Is a Long Road” has surged after its appearance in the video game’s debut trailer.,One of the simple pleasures of Grand Theft Auto: Vice City was listening to the radio.,2023-12-08T18:46:59+0000,article,Arts,News,"For Florida Vibes, Grand Theft Auto VI Turned to Tom Petty","Pop and Rock Music;Computer and Video Games;Rockstar Games;Petty, Tom;Grand Theft Auto VI (Video Game);Florida;audio-positive-escape;audio-positive-nostalgic"
119,Excavations in the ancient ruins have unearthed a cramped space where enslaved workers and donkeys performed their grueling tasks.,"Archaeologists excavating parts of the ancient city of Pompeii made public new discoveries on Friday that provide a grim glimpse into the bleak existence of enslaved people two millenniums ago, including the existence of a “bakery-prison.”",2023-12-08T18:49:14+0000,article,World,News,Life for the Lowest Class in Ancient Pompeii? It Was Awful.,"Archaeology and Anthropology;Forced Labor;Donkeys;Zuchtriegel, Gabriel;Mount Vesuvius (Italy);Pompeii (Italy)"
120,A playlist of 124 songs from our three critics’ lists to experience however you wish.,"In the spirit of holiday excess and end-of-the-year summation, we’re about to make Amplifier history. Because today’s newsletter features — can I get a drumroll? And maybe an effect on my voice that makes me sound like one of those announcers at a monster truck rally? — our longest playlist everrrrr.",2023-12-08T19:00:03+0000,article,Arts,News,Hear the Best Albums and Songs of 2023,"internal-sub-only-nl;Two Thousand Twenty Three;Pop and Rock Music;Rap and Hip-Hop;Country Music;Rhythm and Blues (Music);100 gecs (Music Group);NewJeans (Music Group);Speedy Ortiz (Music Group);Aespa (Music Group);Central Cee (1998- );Ololade, Ahmed (Asake);Rodrigo, Olivia (2003- );Russell, Allison (Singer);Zimmerman, Bailey"
121,A study of DNA from half a million volunteers supports an old evolutionary theory about why our bodies eventually wear out.,Why do we grow old and die?,2023-12-08T19:00:08+0000,article,Science,News,"Genes That Boost Fertility Also Shorten Our Life, Study Suggests",your-feed-science;Research;Genetics and Heredity;Longevity;Evolution (Biology);Reproduction (Biological);Science Advances (Journal)
122,A 75-million-year-old Gorgosaurus fossil is the first tyrannosaur skeleton ever found with a filled stomach.,"Some 75.3 million years ago, a dinosaur swallowed the Cretaceous equivalent of a turkey drumstick. It would turn out to be the predator’s final feast.",2023-12-08T19:00:14+0000,article,Science,News,"A Tyrannosaur Was Found Fossilized, and So Was Its Last Meal",Paleontology;Fossils;Dinosaurs;Stomach;Science Advances (Journal);Research;ALBERTA (CANADA);your-feed-science;your-feed-animals
