,abstract,lead_paragraph,pub_date,document_type,section_name,type_of_material,headline,keywords
39,"Monetochka was one of Russia’s most discussed pop stars. Now, like other antiwar acts in exile, she’s having to retool her career.","Before Moscow’s invasion of Ukraine, Monetochka was on her way to becoming a superstar in Russia.",2023-11-24T10:02:36+0000,article,World,News,"For Russia’s Pop Star Exiles, a Moral Stand and a Creative Climb","Content Type: Personal Profile;Pop and Rock Music;Russian Invasion of Ukraine (2022);Face (Rapper);Putin, Vladimir V;Gyrdymova, Elizaveta (Monetochka);Russia;Ukraine"
40,"A selection of entertainment highlights this weekend, including “Maestro,” Bradley Cooper’s biopic on Leonard Bernstein.","A selection of entertainment highlights this weekend, including “Maestro,” Bradley Cooper’s biopic on Leonard Bernstein.",2023-11-24T10:03:22+0000,multimedia,Arts,Interactive Feature,5 Things to Do This Weekend,"Dancing;Movies;Theater;Pop and Rock Music;New York City Ballet;Public Theater;Bernstein, Leonard;Cooper, Bradley;Miyazaki, Hayao;Mulligan, Carey;Phair, Liz;New York City;The Nutcracker (Ballet)"
41,"Most of us have faced the green-eyed monster before, but the feeling has benefits, experts say.",I have an acquaintance whom I’ve followed for years on social media — even though most of her posts fill me with envy. She always seems to be on a different tropical vacation. How many beaches can a person visit?,2023-11-24T10:03:23+0000,article,Well,News,How to Make Envy Work for You,internal-sub-only-nl;Jealousy and Envy;Content Type: Service;Emotions
42,"The anime master is a creature of habit who talks every day with his longtime producer, and keeps it more hands off with his regular composer.",News of Hayao Miyazaki’s retirement can’t ever be trusted.,2023-11-24T10:03:37+0000,article,Movies,News,What’s It Like to Work With Hayao Miyazaki? Go Behind the Scenes.,"Animated Films;Miyazaki, Hayao;Suzuki, Toshio;Hisaishi, Joe;Studio Ghibli;Content Type: Personal Profile;Music;Japan"
43,"Years of economic quagmire created an upside-down economy in Argentina. Javier Milei, a far-right populist, won the presidency this week by promising to blow it all up.",Marcelo Capobianco was inspecting the calf carcass he had just hung from a hook in his small butcher shop outside Buenos Aires on Tuesday when he admitted that the premium-grade beef would hardly earn him anything.,2023-11-24T10:03:39+0000,article,World,News,"In Country Where Houses Are Bought in $100 Bills, Plans for Sweeping Change","ARGENTINA;Economic Conditions and Trends;Inflation (Economics);Currency;US Dollar (Currency);Milei, Javier;Politics and Government"
44,"After a five-year renovation, some of the museum’s grandest galleries have reopened. Our critic frames six artworks you cannot miss.","Let the light in. Five years after the Metropolitan Museum of Art set off on a major renovation of its galleries for European painting, the super-prime real estate at the top of its grand staircase is open again. Up in the attic, the architects Beyer Blinder Belle have replaced 30,000 square feet of skylights for the first time since the Truman administration. Down in the galleries, the Met’s designers have widened the rooms, rearranged the sightlines, shellacked the walls purple and blue. The curators have reassembled the whole painting collection for the first time since 2018, shuffled across 45 new galleries and bathed in beautifully tempered light.",2023-11-24T10:03:51+0000,article,Arts,Review,"700 Paintings, 45 Galleries: A Guide to the Met’s New European Wing","Art;Museums;Restoration and Renovation;Metropolitan Museum of Art;Fifth Avenue (Manhattan, NY);New York City"
45,"In 2014, nine truces came and went during a 51-day conflict and more than 2,000 people were killed before there was a lasting agreement to halt the fighting.","Israel and Hamas have agreed to a four-day truce — but if the past is any indication, there is no guarantee that the pause in fighting will hold, much less lead to lasting peace.",2023-11-24T10:58:19+0000,article,World,News,Past Israel-Hamas Cease-Fires Have Proved Fragile,War and Armed Conflicts;Israel-Gaza War (2023- );Hamas;Israel;Defense and Military Forces;Peace Process
46,"The South African sprinter, who garnered global headlines after killing his girlfriend in 2013, will be released in January after meeting the requirements for parole.","Oscar Pistorius, a once-inspirational figure who gained international fame as an Olympic sprinter for South Africa before he was convicted of murdering his girlfriend, will be released on parole, the authorities said on Friday. ",2023-11-24T11:37:26+0000,article,World,News,"Oscar Pistorius, Olympic Athlete Convicted of Murder, to Be Paroled","Pistorius, Oscar;Murders, Attempted Murders and Homicides;Probation and Parole;Decisions and Verdicts;Steenkamp, Reeva;Olympic Games (2012);South Africa"
47,What if we actually succeed in addressing the crisis?,"There’s no shortage of reasons to be alarmed by climate change these days. This year is almost certain to be the hottest in recorded history. Extreme weather is wreaking havoc around the globe. Fossil fuel production and emissions are still rising, and world leaders are not moving fast enough.",2023-11-24T11:55:59+0000,article,Briefing,briefing,A Different Approach to Climate Action,internal-storyline-no
48,"This week, Asher and Whitney inflict their chaos upon people who never asked for their charity but are now reliant on it.","Near the beginning of this week’s episode of “The Curse,” a scene opens in an elementary school classroom. At the center of the frame is a boy we have never seen before. He is white and attentive, and the camera zooms in on him. He raises his hand, and gets permission to seemingly go to the bathroom.",2023-11-24T12:00:02+0000,article,Arts,News,"‘The Curse’ Season 1, Episode 3 Recap: Missing Chicken",Television;The Curse (TV Program)
49,The split over a proposed joint ticket bolsters the governing party candidate’s chances in the coming presidential election. That won’t please Beijing.,"For weeks, Taiwan’s two main opposition parties were edging toward a coalition, in a bid to unseat the island democracy’s governing party in the coming presidential election, an outcome that Beijing would welcome. The election, one elder statesman from Taiwan’s opposition said, was a choice between war and peace.",2023-11-24T12:12:20+0000,article,World,News,"Taiwan Opposition Cracks Apart, and Invites the Cameras In","Taiwan;Politics and Government;Elections;Chinese Nationalist Party (Taiwan);Democratic Progressive Party (Taiwan);United States International Relations;Gou, Terry (1950- );Hou Yu-ih (1957- );Ma Ying-jeou;Ko Wen-je;China;Communist Party of China"
50,The violence in Ireland’s capital on Thursday night was fueled by far-right agitators who spread rumors online about an attack on three children earlier that day.,"Soon after three children and a woman were wounded in a knife attack outside a Dublin school on Thursday, rumors about the perpetrator’s nationality began to proliferate online.",2023-11-24T12:48:54+0000,article,World,News,‘It Snowballed’: How a Knife Attack in Dublin Led to a Riot,"Demonstrations, Protests and Riots;Police;Rumors and Misinformation;Attacks on Police;Dublin (Ireland);Ireland"
51,"Specifically: turkey soup, turkey pho and Kenji López-Alt’s Thanksgiving Hot Pockets.","Good morning. How’d it go? I’m hoping really well, for the lot of us: beautifully cooked turkeys and plentiful side dishes, everyone reasonably happy, excellent pies. I hope no one got weird.",2023-11-24T13:00:03+0000,article,Food,Letter,Let’s Talk Leftovers,Cooking and Cookbooks;Content Type: Service
52,The British sci-fi show is celebrating its 60th anniversary with three specials featuring some familiar faces.,It’s rare for a television show to celebrate its 60th anniversary. It’s even rarer for a show to be entering a new era on its 60th anniversary.,2023-11-24T13:05:54+0000,article,Arts,News,‘Doctor Who’ Is Back. Here’s What to Know.,"Television;Science Fiction;Actors and Actresses;Disney Plus;Davies, Russell T;Gatwa, Ncuti;Tennant, David;Doctor Who (TV Program)"
53,"The company said it would build three electric models at its plant in northeast England, bolstering the future of Britain’s auto industry.",Nissan said Friday that it would invest an additional 1.1 billion pounds (about $1.4 billion) to make three new electric models at its plant in Sunderland in northeast England.,2023-11-24T13:44:38+0000,article,Business Day,News,Nissan Will Build More Electric Cars in England,Automobiles;Electric and Hybrid Vehicles;Factories and Manufacturing;Batteries;Envision AESC Group;Nissan Motor Co;Great Britain;Sunderland (England)
54,"A fishing town that was evacuated this month will probably be spared, but residents can’t return until all danger has passed.","The likelihood that a volcanic eruption will engulf the fishing town of Grindavik, Iceland, is decreasing by the day, officials said on Friday, even as they continued to warn that an eruption could still occur.",2023-11-24T13:53:09+0000,article,World,News,"Volcano’s Eruption Threat Is Ebbing, but Iceland Continues to Wait",Iceland;Volcanoes;Earthquakes;Evacuations and Evacuees;Grindavik (Iceland)
55,"Like the holiday season itself, the nostalgia that Christmas music evokes can be emotionally charged.","It’s been a little over one year since the Backstreet Boys released their Christmas album, “A Very Backstreet Christmas,” and Francine Biondo has had it on repeat ever since.",2023-11-24T14:00:08+0000,article,Arts,News,Why You Love (or Love to Hate) Christmas Music,Christmas;Music
56,"There’s new evidence that market timing doesn’t work. Your odds of success are better if you just hang on and aim for average returns, our columnist says.","Selling all of your stock just before the market falls, and buying shares just before the market rises, is a brilliant strategy.",2023-11-24T14:00:08+0000,article,Business Day,News,"In the Stock Market, Don’t Buy and Sell. Just Hold.",Content Type: Service;Asset Allocation (Personal Finances);Personal Finances;Mutual Funds;Dimensional Fund Advisors;S & P Dow Jones Indices
57,"After she was finally hired by the studio, Fawn Veerasunthorn worked her way up the ranks, and has applied that lesson of perseverance to her new film.","At the turn of the century, a young medical student in Thailand mailed a handwritten letter to a Disney animator in Florida.",2023-11-24T14:00:26+0000,article,Movies,News,Disney Rejected Her a Few Times. The ‘Wish’ Director Just Kept Trying.,"Animated Films;Content Type: Personal Profile;Walt Disney Company;Lee, Jennifer (1971- );Zootopia (Movie);Despicable Me 2 (Movie);Frozen II (Movie);Raya and the Last Dragon (Movie);Moana (Movie);Wish (Movie);Veerasunthorn, Fawn"
58,"An illustrated look at how the pressed sandwich became storied in Tampa, Fla., Miami and beyond.","Follow New York Times Cooking on Instagram, Facebook, YouTube, TikTok and Pinterest. Get regular updates from New York Times Cooking, with recipe suggestions, cooking tips and shopping advice.",2023-11-24T14:11:01+0000,article,Food,News,The History of the Cuban Sandwich,Sandwiches;Miami (Fla);Tampa (Fla);Cuba
59,"A new map illustrating 42 years of marijuana arrests documents the way that New York disproportionately targeted working-class, Black and Hispanic people for decades.","For young Black men like Justin Sullivan, growing up in Harlem in the 2000s came with regular harassment from the police, making it risky to use marijuana. But when he started making white friends who also smoked weed, he learned that they were not under the same scrutiny.",2023-11-24T14:17:40+0000,article,New York,News,How 1.2 Million Marijuana Arrests Will Shape New York’s Legal Market,"Marijuana;Minorities;Police;New York City;Black People;Blacks;Hispanic-Americans;Discrimination;Racial Profiling;Police Department (NYC);Harlem (Manhattan, NY);Search and Seizure"
60,"This easy braise has a little heat and a lot to rave about, especially when paired with a simple avocado salad and a cozy rice pudding in this David Tanis menu.","For a cool-weather meal that feeds a crowd, consider a braise. Slow simmered and deeply flavored, it has a number of attractive qualities. For one thing, it benefits from steeping in its own juices; cooking it several hours ahead of serving, even a day before, is ideal. The flavors intensify, mature, strengthen.",2023-11-24T14:49:01+0000,article,Food,News,Chicken and Potatoes Everyone Will Love,"Cooking and Cookbooks;Poultry;Salads;Rice;Pudding;La Taza de Oro (Manhattan, NY, Restaurant);New York City"
61,Cost-conscious shifts in strategy and a changed political landscape have stoked fears about the groups’ ability to keep delivering victories for Democrats.,"Since 2020, Democratic strategists and activists have fixated on how to expand their gains in Georgia, once a Republican stronghold and now a true battleground.",2023-11-24T14:56:20+0000,article,U.S.,News,Georgia’s Liberal Organizers Warn of a Cash Crunch and Apathy,"Georgia;Presidential Election of 2024;Democratic Party;Campaign Finance;Polls and Public Opinion;Voting and Voters;Black People;Blacks;Black Voters Matter;Biden, Joseph R Jr;Politics and Government;United States Politics and Government"
62,Many law enforcement agencies have curbed pursuits because of their inherent danger. But some Texas authorities see them as necessary for border security.,"Jairo Lerma and several of his relatives placed a wooden cross in the dry grass along a Texas highway where his parents, on their way from Georgia to Mexico, died suddenly in a fiery crash with an oncoming car that was carrying migrants and fleeing a sheriff’s deputy.",2023-11-24T15:21:19+0000,article,U.S.,News,"High-Speed Police Chases Rise Near Texas Border, Leaving Locals on Edge","Texas;Traffic Accidents and Safety;Deaths (Fatalities);Police;Public Safety Department (Tex);Illegal Immigration;Human Trafficking;Smuggling;Abbott, Gregory W (1957- )"
63,"French critics considered Ridley Scott’s new biopic lazy, pointless, boring, migraine-inducing, too short and historically inaccurate. And that’s just to start.",The French do not like an Englishman’s rendition of Napoleon.,2023-11-24T15:39:08+0000,article,Arts,News,France Scoffs at an Englishman’s ‘Napoleon’,"Movies;Napoleon (2023) (Movie);Scott, Ridley;Phoenix, Joaquin;France;Bonaparte, Napoleon;Content Type: Personal Profile;Polls and Public Opinion;News and News Media"
64,"More than 24,000 Chinese citizens have been apprehended crossing into the United States from Mexico in the past year. That is more than in the preceding 10 years combined.",The surge of migrants entering the United States across the southern border increasingly includes people from a surprising place: China.,2023-11-24T15:57:46+0000,article,U.S.,News,Growing Numbers of Chinese Migrants Are Crossing the Southern Border,"China;United States;Illegal Immigration;Asylum, Right of;Mexico;United States International Relations;Visas;Coronavirus (2019-nCoV);Xi Jinping;Politics and Government"
65,"A rom-com in space, a coming-of-age quest and a high-tech birthing plan are among the films worth checking out this month.","After three years of buddy banter and watching the same movies over and over, astronauts Adam and Jane, marooned on a busted ship, accept the fact that they won’t get back to Earth and finally give in to their mutual attraction. Of course that’s when their navigation system starts working again, enabling them to return home — where their spouses are waiting. Uh-oh. Does it count as cheating if you thought you were doomed?",2023-11-24T16:00:02+0000,article,Movies,News,Five Science Fiction Movies to Stream Now,Movies
66,"Attention education is the most powerful thing we can do for ourselves, for one another, for democracy.","The lament is as old as education itself: The students aren’t paying attention. But today, the problem of flighty or fragmented attention has reached truly catastrophic proportions. High school and college teachers overwhelmingly report that students’ capacity for sustained, or deep attention has sharply decreased, significantly impeding the forms of study — reading, looking at art, round-table discussions — once deemed central to the liberal arts.",2023-11-24T16:00:09+0000,article,Opinion,Op-Ed,Powerful Forces Are Fracking Our Attention. We Can Fight Back.,Education (K-12);Colleges and Universities;Teachers and School Employees
67,Electric vehicles really are better for the environment than hybrid vehicles that have both gas and electric motors.,"It has been a bumpy few weeks for carmakers who sell electric vehicles, which are moving more slowly off the lot than they were earlier this year. What’s going on? It seems that American drivers may be more hesitant about E.V.s than automakers expected.",2023-11-24T16:00:09+0000,article,Opinion,Op-Ed,"Relax, Electric Vehicles Really Are the Best Choice for the Climate",Electric and Hybrid Vehicles;Automobiles;Sustainable Living;Factories and Manufacturing;Automobile Service and Charging Stations;Metals and Minerals;Mines and Mining;Inflation Reduction Act of 2022;Alternative and Renewable Energy;Road Trips;Batteries;Cobalt;Fuel Emissions (Transportation);Lithium (Metal);Tesla Motors Inc;Volkswagen AG;United States
68,New psychological studies shed light on the matter.,"As the holiday season approaches, many parents find themselves facing a tricky problem: how to talk about Santa Claus with their young children, especially as those children begin to develop doubts about Santa’s existence. When does a fun, fanciful tradition risk becoming harmful deception? How can parents — who typically play a large and active role in fostering a belief in Santa Claus — ease the transition to disbelief?",2023-11-24T16:00:10+0000,article,Opinion,Op-Ed,There Are Better Ways to Talk With Your Kids About Santa,Santa Claus;Christmas;Parenting;Children and Childhood;Psychology and Psychologists;Research
69,"If you’re laughing, it’s working.",All politicians lie. So many people consider that idea self-evident that I’ve heard it deployed as both a defense of lying and a reason to disengage from our democratic system entirely.,2023-11-24T16:00:11+0000,article,Opinion,Op-Ed,The Very Good Reason People Like George Santos Lie About Nonsense,"Lying;United States Politics and Government;Ethics and Official Misconduct;Adams, Eric L;Trump, Donald J;Santos, George (1988- );Polls and Public Opinion"
70,"They could lead to fewer hospital-acquired infections, more kidneys available for transplantation and fewer greenhouse gases.","I’ll wager that the event of 2023 that will change our lives the most in coming years is not the sighting of a Chinese spy balloon, the failure of Silicon Valley Bank, the fall of Kevin McCarthy’s speakership or any of the other eruptions that transfixed us this year.",2023-11-24T16:00:21+0000,article,Opinion,Op-Ed,What Am I Thankful for This Year? Amazing Scientific Discoveries.,Science and Technology;Artificial Intelligence;Transplants;Kidneys;Turkeys;Thanksgiving Day;Two Thousand Twenty Three;internal-sub-only-nl
71,Fiscal reality is finally hitting the city. Will Mayor Adams make the right choices when cutting the budget?,"After years of heady spending, the budget cuts announced by Mayor Eric Adams last week hit New York City like a punch to the gut: Most libraries would be closed on Sundays. The expansion of the city’s signature prekindergarten program would be delayed. So would efforts to improve New York’s notoriously dirty streets and keep rats at bay. The city’s police force would be pared down in coming years.",2023-11-24T16:00:23+0000,article,Opinion,Editorial,New York’s Era of Overspending Ends With a Shudder,"New York City;Budgets and Budgeting;Politics and Government;Mayors;Education (Pre-School);Police;City Council (NYC);Adams, Eric L"
72,"These two hardworking ingredients are at their best in this weeknight meal, laden with chile, lemon and garlic.","Whenever I decide to cook straight from the pantry, one of two things usually results: pasta or beans.",2023-11-24T16:08:47+0000,article,Food,News,This Easy Pantry Meal Puts Dreamy Pasta and Beans Front and Center,Cooking and Cookbooks;Pasta;Content Type: Service
73,Readers discuss a column by Charles M. Blow. Also: Expanding Advanced Placement classes; election lessons; America’s love of outlaws.,To the Editor:,2023-11-24T16:11:15+0000,article,Opinion,Letter,"Debates Over Words Amid War: ‘Antisemitism,’ ‘Anti-Zionism,’ ‘Apartheid’","Israel-Gaza War (2023- );Zionism;Anti-Semitism;Apartheid (Policy);Jews and Judaism;Blow, Charles M;Tests and Examinations;Education (K-12);Colleges and Universities;Presidential Election of 2024;Elections;Trump, Donald J;Israel;United States Politics and Government"
74,"Israel had warned Gazans not to move from the south to the north during the cessation of hostilities, feeding their fears of permanent displacement.","When the cease-fire in Gaza took effect early Friday morning, Palestinians across the Gaza Strip prepared to go back to the homes they fled to see if they were still intact, to check on relatives left behind and in some cases, to finally bury their dead.",2023-11-24T16:51:47+0000,article,World,News,"As Cease-Fire Takes Hold, Some Gazans Attempt a Treacherous Return Home",Israel-Gaza War (2023- );Israel;Defense and Military Forces;Gaza Strip;Palestinians;Civilian Casualties;Terrorism;Hamas;Humanitarian Aid
75,"Consumer spending has been strong this year, but retailers worry about shoppers' mood this holiday season.","Consumer spending has been strong this year, but retailers worry about shoppers' mood this holiday season.",2023-11-24T17:30:08+0000,multimedia,Business Day,Interactive Feature,The Big Number: $985,Consumer Behavior;Shopping and Retail;Holidays and Special Occasions;E-Commerce;Student Loans;Black Friday and Cyber Monday (Shopping);Inflation (Economics);Personal Finances
76,"No corrections  appeared in print on Friday, Nov. 24, 2023.",,2023-11-24T17:58:30+0000,article,Corrections,News,"No Corrections: Nov. 24, 2023",
77,"For many in the Caribbean diaspora, there is no substitute for this deeply flavorful fruitcake.","By Thanksgiving week, every surface of Marva Adams-Miller’s Brooklyn home is crowded with bags of flour and brown sugar, bottles of spices and dried fruits soaking in buckets of liquor. Ms. Adams-Miller is one of an elite group baking Caribbean black cake in late fall and the Christmas holiday season and turning cultural need into entrepreneurial opportunity. From the end of October to Christmas week, Ms. Adams-Miller normally bakes black cakes eight to 10 hours daily, outside of her full-time job working with city youth.",2023-11-24T17:59:06+0000,article,Food,News,"The Best Black Cake, a West Indian Delight, Starts at Home",Cakes;Cooking and Cookbooks;Holidays and Special Occasions;Bakeries and Baked Products;JAMAICAN-AMERICANS;Caribbean Area
78,The country’s central bank increased rates by 5 percentage points in an attempt to deal with the soaring cost of household necessities and the devaluing of the lira.,"Turkey’s central bank has raised interest rates to 40 percent, its highest level in nearly two decades, in a significant move to tame the country’s runaway inflation after the country’s president, Recep Tayyip Erdogan, had previously defied economic convention by cutting rates to slow price increases.",2023-11-24T18:01:32+0000,article,Business Day,News,Turkey Raises Interest Rates to 40 Percent to Tame Runaway Inflation,"Turkey;Erdogan, Recep Tayyip;Economic Conditions and Trends;Interest Rates;Inflation (Economics)"
79,Allowing clubs to block rule changes and money to delay punishments feeds the perception that the same rules do not apply to everyone.,"Pete Rozelle’s immediate reaction could not accurately be described as unbridled enthusiasm. He was 33. He had, for the last three years, been the general manager of the Los Angeles Rams. He was suave, charming and well liked. But he was nevertheless starting to wonder whether running an N.F.L. football team was really the job for him.",2023-11-24T18:08:43+0000,article,World,News,The Premier League Needs a Commissioner,"Soccer;English Premier League;Liverpool (Soccer Team);Manchester City (Soccer Team);Messi, Lionel;Ronaldo, Cristiano"
80,"She trawled 56 boxes of forgotten archives, bringing to life mysterious figures from early expeditions on the world’s highest peak.","Audrey Salkeld, a pioneering historian of Mount Everest who herself made it to within 8,000 feet of the summit, died on Oct. 11 in Bristol, England. She was 87.",2023-11-24T18:30:31+0000,article,World,Obituary (Obit),"Audrey Salkeld, Pioneering Historian of Everest, Dies at 87","Salkeld, Audrey (1936-2023);Deaths (Obituaries);Mountaineering;Archives and Records;Writing and Writers;Mallory, George Leigh;Irvine, Andrew (Film Director);Riefenstahl, Leni;Mount Everest;Mount Kilimanjaro (Tanzania)"
81,"The first group of 13 Israeli hostages — all women and children — were handed over to Israeli officials on Friday, joining five others released or rescued earlier in the fighting.","After nearly seven weeks in captivity, 13 Israeli hostages abducted by Hamas and other groups during the Oct. 7 attacks on Israel were released on Friday as part of a deal that paused the fighting in the Gaza Strip.",2023-11-24T18:56:18+0000,article,World,News,Here’s what we know about the released Israeli hostages.,Israel;Hamas;Gaza Strip;War and Armed Conflicts;Kidnapping and Hostages
