,abstract,lead_paragraph,pub_date,document_type,section_name,type_of_material,headline,keywords
41,Andrew Raftery’s ceramics and wallpaper energize the laborious art of engraving to explore contemporary life.,"When Andrew Raftery, a master engraver and professor of printmaking at the Rhode Island School of Design, decided to make wallpaper, he chose an 18th-century French format called domino — small sheets printed on a letterpress, which were originally produced by stationers as shelf paper and box liners.",2023-08-31T09:03:21+0000,article,Style,News,How an Engraver Straddles the Centuries,Wallpaper;Ceramics and Pottery;Collectors and Collections;Content Type: Personal Profile;Interior Design and Furnishings
42,"A selection from Hyperion’s now-streaming catalog, the Pittsburgh Symphony Orchestra’s Tchaikovsky and Yunchan Lim’s Liszt are among the highlights.","Hyperion has for decades been one of the most respected labels in classical music. But we’ve never been able to include it in this monthly column because its albums have not been available to stream — until now. After being acquired by Universal earlier this year, the company began putting past and fresh titles on Spotify and other platforms at the end of July.",2023-08-31T09:03:22+0000,article,Arts,News,5 Classical Music Albums You Can Listen to Right Now,"Classical Music;Dvorak, Antonin;Coleridge-Taylor, Samuel;Takacs Quartet;Tchaikovsky, Peter Ilyich;Honeck, Manfred;Pittsburgh Symphony Orchestra;Explore Ensemble (Music Group);Telegraph Quartet (Music Group);Liszt, Franz;Lim, Yunchan;ALSOP, MARIN"
43,"Everyone loves a bargain. But can anyone survive the entirety of the 127 Yard Sale, an annual four-day event that stretches from Michigan to Alabama?","To the visitor driving in from out of state, the 127 Yard Sale seems like a kind of Ironman for thrifters. The “world’s longest yard sale” is a test of endurance and attention. Spanning six states, 690 miles and thousands of stalls, it traverses dramatic landscapes, delicate cultural terrain and two time zones. Seeing it all in the four allotted days — Aug. 3 to 6 this year — is enough to induce vertigo in even the most stable-minded deal hunter. But some of us are foolish enough to try anyway.",2023-08-31T09:03:22+0000,article,Travel,News,"4 Days, 690 Miles, Countless Stalls: Behold the ‘World’s Longest Yard Sale’",Tag Sales;Tableware;Dresses;Factories and Manufacturing;Labor and Jobs;Alabama;Tennessee;Ohio;Michigan;Kentucky;Georgia
44,But not enough is being done to stop it.,"The global H5N1 avian flu outbreak, already devastating wild birds and poultry, keeps spreading to mammals, bringing it one step closer to a potential human outbreak.",2023-08-31T09:03:23+0000,article,Opinion,Op-Ed,Cats With Bird Flu? The Threat Grows.,Avian Influenza;Fur;International Relations;Cats;Law and Legislation;Minks (Animals);Finland;Poland
45,A domestic scene where the home is not a place of safety or comfort but a site of labor. ,"This selection from a longer poem by Lotte L.S. conjures a domestic scene, emerging out of memory. A home’s tattered, broken and neglected objects accumulate, and as they do, the demands of these objects become apparent. A mess is not inert. Dirty dishes make demands. The home here is not a place of safety or comfort but a site of labor. Yet there is no strike — only escape. Selected by Anne Boyer",2023-08-31T09:03:25+0000,article,Magazine,News,Poem: From ‘This Energy Wasted by Flight —’,"Poetry and Poets;LS, Lotte (Poet)"
46,"You know those battered, tattered recipe collections put out by Rotary Clubs, bridge groups and P.T.A.s across the country? They inspired this TikTok star’s best seller.","If you’re looking for dessert ideas for a late-summer picnic, B. Dylan Hollis has you covered. The Bermuda-born, piano-playing, kitsch-collecting TikTok sensation would like to recommend a few alternatives — or perhaps accompaniments — to Popsicles. Consider Kiskadee Fantasy Pie, a 1950s classic named for the yellow-bellied songbird, consisting of whipped cream, pineapple and meringue layered on a saltine cracker crust; or Banana Marlow, a marshmallow-based ice-cream confection that was all the rage in the 1930s; or Grasshopper Pie. Think crème de cacao, crème de menthe, cream cheese, green food coloring and crushed Oreos served on 1960s Melmac.",2023-08-31T09:03:35+0000,article,Books,News,B. Dylan Hollis is Bananas for Vintage Self-Published Cookbooks,"Cooking and Cookbooks;Bakeries and Baked Products;Recipes;Collectors and Collections;Content Type: Personal Profile;Hollis, B Dylan;Baking Yesteryear: The Best Recipes from the 1900s to the 1980s (Book);United States"
47,"For a group of men in a Texas prison, the fantasy game became a lifeline — to their imaginations, and to one another.","The first time Tony Ford played Dungeons & Dragons, he was a wiry Black kid who had never seen the inside of a prison. His mother, a police officer in Detroit, had quit the force and moved the family to West Texas. To Ford, it seemed like a different world. Strangers talked funny, and El Paso was half desert. But he could skateboard in all that open space, and he eventually befriended a nerdy white kid with a passion for Dungeons & Dragons. Ford fell in love with the role-playing game right away; it was complex and cerebral, a saga you could lose yourself in. And in the 1980s, everyone seemed to be playing it.",2023-08-31T09:03:40+0000,article,Magazine,News,The Dungeons & Dragons Players of Death Row,"Dungeons & Dragons (Game);Capital Punishment;Prisons and Prisoners;Texas;Marshall Project, The"
48,Her recent victories redefine all the others.,Simone Biles entered the 2020 Olympic Games with a record 25 World Championship medals and four moves so difficult that she alone out of all the world’s gymnasts could perform them.,2023-08-31T09:03:41+0000,article,Opinion,Op-Ed,"It’s Simone Biles’s Most Daring Move — and You Can Do It, Too","Olympic Games (2020);Gymnastics;Athletics and Sports;USA Gymnastics;Biles, Simone"
49,We’re past the “fairy tale stage” of the war in Ukraine. How does it end?,"It’s been 18 months since Russia invaded Ukraine. No true negotiations have happened. As the stalemate continues, what role should the United States play in the fight?",2023-08-31T09:03:42+0000,article,Opinion,Op-Ed,Is It Time to Negotiate With Putin?,"Putin, Vladimir V;Russian Invasion of Ukraine (2022);Polls and Public Opinion;Yo! MTV Raps (TV Program);Wagner Group;Prigozhin, Yevgeny V;Russia;Ukraine;United States;Mexico;Mercenaries and Private Military Contractors;Defense and Military Forces;United States Politics and Government;Presidential Election of 2024;Biden, Joseph R Jr;Republican Party;China"
50,"New research indicates that, relative to their size, the snakes that can gulp down the largest meals are harmless and three feet long.","Snakes can’t really unhinge their jaws, but for some, that doesn’t get in the way of swallowing absurdly large prey.",2023-08-31T09:03:54+0000,article,Science,News,This Tiny Snake Has a Big Mouth,Snakes;Jaw (Body Part);Research;Animal Behavior;3-D Devices and Effects;Journal of Zoology;your-feed-science
51,"A fight over Green’s books in his home state of Indiana reflects a broader cultural debate over what books are appropriate for young readers, and who gets to decide.","For about as long as he’s been a published author, John Green has faced efforts to censor his books. His debut novel, “Looking for Alaska,” a coming-of-age story that includes references to drug use and sex, has been challenged in schools for at least 15 years, and has frequently landed on the American Library Association’s most banned books list. Last year, it received more than 50 challenges in schools across the country.",2023-08-31T09:03:55+0000,article,Books,News,"For John Green, the Battle Over Access to Books has Gotten Personal","Books and Literature;Green, John (1977- );Libraries and Librarians;Book Bans;Censorship;genre-books-young-adult"
52,"A look at design-world events, products and people.","The approximately 40 designers represented in “Life Cycles: The Materials of Contemporary Design,” which opens at the Museum of Modern Art on Saturday, work with materials that can repair themselves, or be transformed from waste into refined objects, or represent a marriage of advanced technology and traditional craft. Their goal is to narrow the gap between the ideals of design and the realities of mass manufacturing, with its many human and environmental threats.",2023-08-31T09:03:57+0000,article,Arts,News,A Panorama of Design,"Interior Design and Furnishings;Art;Culture (Arts);Museums;Cultural Landscape Foundation, The;Nichols, Tyre (d 2023);Little, James (1952- )"
53,"Amid a relentless heat wave, some migrants are succumbing to heat exhaustion. More than 500 people have died of various causes this year while trying to cross from Mexico.","On patrol in the harsh brush along the border in South Texas, Deputy Don White of the Brooks County Sheriff’s Office paused to study some empty water jugs, torn clothing and several indistinct footprints, looking for signs of migrants who might have been lost in the scorching heat.",2023-08-31T09:03:57+0000,article,U.S.,News,Scorching Heat Is Contributing to Migrant Deaths,Illegal Immigration;Deaths (Fatalities);Heat and Heat Waves;Immigration and Emigration;Border Patrol (US);Texas
54,"Figuring they didn’t have an ‘elevator budget,’ two renters focused on walk-ups for sale on the Lower East Side and in the East Village. Here’s what they found.","Figuring they didn’t have an ‘elevator budget,’ two renters focused on walk-ups for sale on the Lower East Side and in the East Village. Here’s what they found.",2023-08-31T09:03:57+0000,multimedia,Real Estate,Interactive Feature,"Lower Manhattan for Less Than $500,000? A Young Couple Knew They’d Need to Compromise.","Real Estate and Housing (Residential);Content Type: Personal Profile;Lower East Side (Manhattan, NY);East Village (Manhattan, NY)"
55,The G.O.P. candidates may disagree about Ukraine but they’re united in who they think the real enemy is.,"At first glance, last week’s Republican presidential debate revealed a party fractured over America’s role in the world. Ron DeSantis said he wouldn’t support additional aid to Ukraine unless Europe does more. Vivek Ramaswamy said he wouldn’t arm Ukraine no matter what. Chris Christie, Mike Pence and Nikki Haley, all staunch defenders of Kyiv, pounced. Within minutes, the altercations were so intense that the moderators struggled to regain control.",2023-08-31T09:03:58+0000,article,Opinion,Op-Ed,Republicans Are Neither Internationalist nor Isolationist. They’re Asia First.,"International Relations;Presidential Election of 2024;Debates (Political);Defense and Military Forces;Christians and Christianity;Conservatism (US Politics);Evangelical Movement;John Birch Society;Republican Party;Pew Research Center;North Atlantic Treaty Organization;Biden, Joseph R Jr;Carlson, Tucker;Christie, Christopher J;Haley, Nikki R;Trump, Donald J;Xi Jinping;Pence, Mike;Chiang Kai-shek;China;Taiwan;Ukraine"
56,"While it’s tempting to downplay or dismiss these efforts as the pathetic machinations of crackpots and fringe figures, that would be a mistake.","While it’s tempting to downplay or dismiss these efforts as the pathetic machinations of crackpots and fringe figures, that would be a mistake.",2023-08-31T09:03:59+0000,multimedia,Opinion,Interactive Feature,"The Key Players in Trump’s Plot to Upend the Election, Mapped","Georgia Criminal Case Against Trump (2020 Election);Presidential Election of 2020;Trump, Donald J;Meadows, Mark R (1959- );Storming of the US Capitol (Jan, 2021);Federal Criminal Case Against Trump (2020 Election Case)"
57,Here’s how to connect with verified aid groups working in the areas affected by the storm.,"Hurricane Idalia made landfall in Florida on Wednesday, causing devastating flooding. It then moved on to bring surging water into Charleston, S.C., before heading toward North Carolina on Thursday.",2023-08-31T09:29:03+0000,article,U.S.,News,How to Help Hurricane Idalia Victims,Hurricane Idalia (2023);Hurricanes and Tropical Storms;Floods;Disasters and Emergencies;AMERICAN RED CROSS;Charity Navigator;Florida;Content Type: Service
58,"Exclusively from New York Times Audio, our new app.","The New York Times Audio app is home to journalism and storytelling, and provides news, depth and serendipity. If you haven’t already, download it here — available to Times news subscribers on iOS — and sign up for our weekly newsletter.",2023-08-31T09:45:01+0000,article,Podcasts,News,"Today’s Top News: Idalia Brings Less Damage Than Feared, and More","Hurricane Idalia (2023);Florida;McConnell, Mitch;Chile;Pinochet Ugarte, Augusto"
59,"Prices rose at an annual rate of 5.3 percent, defying expectations of a slowdown. The news may bolster the case for another European Central Bank interest rate increase.","Consumer prices in the eurozone rose 5.3 percent in August compared with a year earlier, sticking at the same pace as the previous month and defying economists’ expectations for a slowdown, according to an initial estimate by the statistics agency of the European Union.",2023-08-31T09:59:48+0000,article,Business Day,News,Inflation Rate in Eurozone Holds Steady,"Inflation (Economics);Interest Rates;Economic Conditions and Trends;Prices (Fares, Fees and Rates);European Central Bank;Eurozone"
60,A negotiation program is projected to save the government tens of billions of dollars in the coming years.,"A year ago, Congress overhauled how drugs for older Americans are paid for, giving Medicare the power to bargain with drug makers over prices. It’s the biggest change to health care for more than a decade, and this week, the Biden administration began to implement it.",2023-08-31T10:00:14+0000,article,Podcasts,News,A Major Overhaul of Prescription Drug Prices,"audio-neutral-informative;Drugs (Pharmaceuticals);Health Insurance and Managed Care;Medicare;Prices (Fares, Fees and Rates);Elderly;Biden, Joseph R Jr;United States"
61,Cities and states run by Republicans do not actually have less crime.,"Republican politicians often treat it as an established fact: Where they are in power, crime is low. Where Democrats are in power, crime is high.",2023-08-31T10:57:50+0000,article,Briefing,briefing,Crime Is Nonpartisan,internal-storyline-no;Crime and Criminals
62,"Jose formed on Thursday morning. It’s now the third named storm in the Atlantic, along with Idalia and Franklin.","As the remnants of Hurricane Idalia battered the Carolina coast, and as Hurricane Franklin churned far off in the Atlantic, Tropical Storm Jose formed early Thursday, becoming the latest named storm of the 2023 Atlantic hurricane season.",2023-08-31T10:59:38+0000,article,U.S.,News,Tropical Storm Jose Is Expected to Be Absorbed by Hurricane Franklin,Hurricanes and Tropical Storms;Wind;Rain;Weather
63,"In this drama directed by and starring Thomas Salvador, an urbanite plunges into treacherous conditions.","Thomas Salvador’s “The Mountain” is a lightweight parable about a man who abandons modernity to connect with the earth. On impulse, a Parisian robotics engineer named Pierre (Salvador, who also wrote the script with Naïla Guiguet), extends a work trip to scale France’s snow-capped Mont Blanc. “I can’t resist,” he says, and for a while the film plays like a silent comedy about a transcendence junkie itching for a fix. Pierre’s cable car is too crowded, his new ice crampons look silly alongside other tourists in tees, his scenic glacier-top tent is hemmed-in by more tents. Nevertheless, he prefers not to rejoin civilization — he’s Bartleby the Backpacker, holding out for something he can’t explain.",2023-08-31T11:00:12+0000,article,Movies,Review,‘The Mountain’ Review: Stone-Faced in Nature’s Splendors,"Movies;The Mountain (Movie);Salvador, Thomas (1973- )"
64,"This interactive Netflix rom-com lets viewers make choices on behalf of the main character, changing the story. But each path is banal.","Netflix’s latest interactive movie, “Choose Love,” is an attempt to apply a dating simulator experience to a standard-issue rom-com. Its choose-your-own-adventure interface — like the one in the 2019 “Black Mirror” movie “Bandersnatch,” another Netflix production — allows viewers to make decisions for Cami Conway (Laura Marano), a young woman who suddenly finds herself having to choose between three suitors. The choices that viewers select with the click of a button (Should Cami kiss this man or dodge his advances? Should she wear this dress or that one?) will ultimately inform which guy she ends up with.",2023-08-31T11:00:15+0000,article,Movies,Review,‘Choose Love’ Review: Pick Your Own Cliché,"Movies;McDonald, Stuart (Film Director);Marano, Laura (1995- );Foster, Scott Michael;Jogia, Avan Tudor (1992- );Choose Love (Movie);Webber, Jordi"
65,"This dry, understated film follows a young Afghan refugee looking for connection in her new home, the San Francisco Bay Area.","“Fremont” takes its title from the Bay Area city of the same name. Often called Little Kabul, it’s home to one of the largest enclaves of Afghans in the United States, with many immigrants gravitating toward it for a sense of community. That’s what Donya (Anaita Wali Zada) is searching for: Community. Connection. Love. These are difficult pursuits for anyone in these atomized times, but especially for Donya, a young refugee and former translator for the American military.",2023-08-31T11:00:17+0000,article,Movies,Review,‘Fremont’ Review: Rapid Transit,"Movies;Fremont (Movie);Jalali, Babak;Wali Zada, Anaita;Cavalli, Carolina (Film Director)"
66,This documentary explores a narrow genre of direct-to-VHS soft-core thrillers that found a niche with the advent of video rentals and home viewing.,"If “Boogie Nights” had a villain, it was videotape. For the characters, the arrival of that technology put an end to a golden age of pornographic movies and spoiled the illusion that they were making art.",2023-08-31T11:00:21+0000,article,Movies,Review,‘We Kill for Love’ Review: What They Did in Hollywood’s Shadows,"Documentary Films and Programs;Video Releases (Entertainment);Penta, Anthony"
67,The delightful odd couple of the Oscar-nominated French film head to the mountains in ‘A Trip to Gibberitia.’ Every frame brims with painterly detail.,"One of the many enduring pleasures of “Ernest & Celestine,” the 2014 French film about the unlikely bond between a bear and a mouse, is its rhapsodic bridging of music and imagery. The tale (based on books by Gabrielle Vincent) is rendered with gossamer line drawings so wedded to their accompanying score that the images sometimes ripple, swell and curl in tandem with the musical notes.",2023-08-31T11:00:30+0000,article,Movies,Review,"Review: In the ‘Ernest & Celestine’ Sequel, a Prodigal Cub Returns","Movies;Ernest & Celestine: A Trip to Gibberitia (Movie);Chheng, Julien;Roger, Jean-Christophe"
68,"Employees, the business owner and some of his relatives were among the dead at the shop near Manila. The cause of the blaze was unknown.","A fire in a house that was being used as a T-shirt printing shop in the Philippines killed at least 15 people on Thursday, including its workers, the business owner and his family members, officials said.",2023-08-31T11:00:44+0000,article,World,News,Fire in a Garment Printing Shop Kills at Least 15 in the Philippines,Fires and Firefighters;Deaths (Fatalities);Manila (Philippines);Philippines
69,"Mr. Wallace, a former soldier, had come to symbolize Britain’s steadfast support for Ukraine in the war against Russia.","The British government said on Thursday that it would replace its departing defense secretary, Ben Wallace, a former soldier who was respected in the White House and Pentagon and came to symbolize Britain’s steadfast support for Ukraine in the war against Russia.",2023-08-31T11:25:59+0000,article,World,News,U.K. Replaces Defense Secretary Ben Wallace With Grant Shapps,"Great Britain;Ukraine;Defense and Military Forces;Wallace, Ben"
70,The blaze struck an abandoned building that had become a crowded squatter settlement. The authorities were investigating the cause.,"A fire consumed a crowded five-story building in downtown Johannesburg early on Thursday, tearing through an informal settlement of homeless people in what was being described as one of the deadliest blazes in South African history.",2023-08-31T11:35:27+0000,article,World,News,Scenes From Johannesburg: A Deadly Fire Downtown Kills Scores,Fires and Firefighters;Abandonment (Property);Squatters;Real Estate and Housing (Residential);Disasters and Emergencies;Johannesburg (South Africa);vis-photo;South Africa
71,The Swiss bank’s sharply discounted takeover of Credit Suisse led to a paper gain that gave it the biggest quarterly profit by a bank in history.,"When UBS agreed to buy its archrival, Credit Suisse, for a little over $3 billion this spring at the Swiss government’s behest, analysts and investors said that price represented a steep discount. UBS’s latest financial results reflect just how much of a steal it was.",2023-08-31T11:45:54+0000,article,Business Day,News,UBS Gets a $29 Billion Bump From M.&A. Accounting,"internal-storyline-no;Banking and Financial Institutions;Mergers, Acquisitions and Divestitures;ACCOUNTING AND ACCOUNTANTS;Credit Suisse Group AG;UBS AG"
72,A study examined 311 complaints to isolate the ZIP codes with the most.,"People complain about garbage, and who can blame them? A new study by HouseFresh aimed to find the “dirtiest” cities in the United States by analyzing 12.3 million sanitation-related complaints made to 311 systems across the country. The complaints, made from Oct. 23, 2021 to Oct. 23, 2022, were tallied in cities with populations of more than 250,000, with adequate 311 data that could be mapped to specific ZIP codes. This left out some large cities — Denver, Las Vegas and Phoenix among them. The remaining 26 cities were ranked based on the number of sanitation complaints per 100,000 residents.",2023-08-31T12:00:03+0000,article,Real Estate,News,The Dirtiest Corners of New York City,Real Estate and Housing (Residential);Sanitation Department (NYC);Pollution;New York City;Three-One-One (311) (NYC Hot Line)
73,A theatrical version of the billion-dollar tour — a cultural juggernaut that just ended its North American leg — opens Oct. 13.,"Taylor Swift’s Eras Tour, the billion-dollar juggernaut that has dominated the cultural calendar this year, may be on a break before picking up internationally, but its momentum will only rest so long: The show is coming to movie theaters this fall.",2023-08-31T12:30:11+0000,article,Arts,News,Taylor Swift Eras Tour Concert Film Coming to Movie Theaters,"Documentary Films and Programs;Pop and Rock Music;Swift, Taylor;Taylor Swift: The Eras Tour (Movie)"
74,"Overall inflation climbed to 3.3 percent, from 3 percent previously, underscoring the Fed’s long road back to 2 percent price increases.","The Federal Reserve has warned for months that wrestling rapid inflation back to a normal pace was likely to be a bumpy process, a reality underscored by fresh data on Thursday that showed a closely watched inflation gauge picking back up in July.",2023-08-31T12:36:07+0000,article,Business Day,News,Inflation and Consumers Show Staying Power as Fed Eyes Another Rate Move,"United States Economy;Inflation (Economics);Interest Rates;Prices (Fares, Fees and Rates);Consumer Price Index;Federal Reserve System;Powell, Jerome H"
75,Pro tip: Don’t sleep on the red and orange properties. Players land on them the most.,"When I look back at my child-rearing years, one of the most enduring emotions I felt — besides intense love and sleep deprivation — was absolute dread when my kids brought out the Monopoly set.",2023-08-31T13:00:07+0000,article,Crosswords & Games,News,How to Win at Monopoly,Games;Monopoly (Game)
76,"This week’s properties are in Murray Hill, on the Lower East Side and in Parkchester.","A two-bedroom, one-bath, roughly 1,000-square-foot apartment that has a galley kitchen with a service entrance, an entry closet, a corner primary bedroom with a walk-in closet, a windowed bathroom with heated floors connecting the two bedrooms, herringbone oak floors, a wood-burning fireplace, built-in bookshelves and a complimentary storage unit, on the eighth floor of a 16-story prewar doorman building with a live-in resident manager, an elevator operator and shared laundry. Mary Barbrack, Michelle Flikerski and Julia Hoagland, Compass, 646-522-3080; compass.com",2023-08-31T13:00:16+0000,article,Real Estate,News,Homes for Sale in Manhattan and the Bronx,"Real Estate and Housing (Residential);Murray Hill (Manhattan, NY);Lower East Side (Manhattan, NY);Parkchester (Bronx, NY)"
77,"The Smith River Complex, covering more than 75,000 acres, has closed roads, forced power outages and delayed the start of school for thousands of students.",The largest wildfire currently burning in the United States is raging in California’s densely forested northwest corner.,2023-08-31T13:00:16+0000,article,U.S.,briefing,A Cluster of Wildfires Is Burning in California’s Northwest Corner,California
