,abstract,lead_paragraph,pub_date,document_type,section_name,type_of_material,headline,keywords
40,"Ministers should encourage people to do what our faith tells us to do over and over, which is to see the humanity in everyone, even our enemies.","I am ordained, but I do not pastor a church. Still, I am often invited to be a guest speaker or lecturer in congregations and universities. Lately, when people ask me questions afterward, they want to know my opinion about the war between Israel and Hamas. I am happy to answer them. Members of the clergy aren’t shut off from the world, and I don’t think our words should be either — we can be a force for good.",2023-12-10T14:00:11+0000,article,Opinion,Op-Ed,The Theological Truth We Must Press During War,"Israel-Gaza War (2023- );Clergy;Christians and Christianity;Civilian Casualties;Defense and Military Forces;Palestinians;Humanitarian Aid;Hamas;King, Martin Luther Jr;Gaza Strip;Israel"
41,The OpenAI debacle illustrates the way the tech world continues to squabble about the wrong things and chase misframed goals.,"The near implosion of OpenAI, a world leader in the burgeoning field of artificial intelligence, surfaced a conflict within the organization and the broader community about the speed with which development of the technology should continue and whether slowing it down would aid in making it safer.",2023-12-10T14:00:12+0000,article,Opinion,Op-Ed,Should A.I. Accelerate? Decelerate? The Answer Is Both.,Computers and the Internet;Artificial Intelligence;OpenAI Labs;Regulation and Deregulation of Industry;Research
42,Why the court should not give favorable tax treatment to the wealthy.,"Last week, the wealthiest Americans had their day in court. The case before the Supreme Court, Moore v. United States, is a challenge to an obscure and narrow provision of the tax code, in Donald Trump’s Tax Cuts and Jobs Act, that taxes certain assets held abroad.",2023-12-10T14:00:12+0000,article,Opinion,Op-Ed,Want to Tax the Rich for Real? Pay Attention to This Supreme Court Case.,"Conservatism (US Politics);Income Tax;Tax Cuts and Jobs Act (2017);Federal Budget (US);Constitution (US);Supreme Court (US);ALITO, SAMUEL A JR;HARLAN, JOHN MARSHALL (1833-1911);Ryan, Paul D Jr;Trump, Donald J;Warren, Elizabeth;United States;High Net Worth Individuals"
43,"The online retailer said that a shadowy organization bribed Amazon employees to help carry out fraudulent returns of expensive electronics, luxury goods and gold.","Amazon has accused an international organization, including customers and several former employees, of conspiring to steal millions of dollars in online products through fraudulent refunds.",2023-12-10T14:00:20+0000,article,Business Day,News,Amazon Suit Claims International Ring Stole Millions in Fraudulent Refunds,E-Commerce;Robberies and Thefts;Shopping and Retail;Frauds and Swindling;Suits and Litigation (Civil);Amazon.com Inc;United States
44,"Parts of central Connecticut into Massachusetts and northwestern Rhode Island could get as much as seven inches of rain, forecasters said. In New York City, a travel advisory was issued.","A powerful storm system was moving through the Northeast on Monday, prompting flood and wind alerts as well as travel advisories while some areas braced for power outages and up to six inches of rain, forecasters said.",2023-12-10T14:56:44+0000,article,U.S.,News,"Storm Moves Into Northeast, Bringing Heavy Rains and High Winds",Floods;Rain;Wind;Weather;National Weather Service;New York City;Northeastern States (US)
45,"The world’s leading oil exporter has become the most forceful opponent of a new agreement at the U.N. climate summit, according to people inside the talks.","Saudi Arabia, the world’s leading exporter of oil, has become the biggest obstacle to an agreement at the United Nations climate summit in Dubai, where countries are debating whether to call for a phaseout of fossil fuels in order to fight global warming, negotiators and other officials said.",2023-12-10T15:08:32+0000,article,Climate,News,"Saudi Arabia Is Trying to Block a Global Deal to End Fossil Fuels, Negotiators Say",Global Warming;Greenhouse Gas Emissions;United Nations Framework Convention on Climate Change;International Relations;Oil (Petroleum) and Gasoline;Alternative and Renewable Energy;Organization of the Petroleum Exporting Countries;United Nations;Saudi Arabia
46,Elemental comfort cooking.,"Good morning. Remember when you weren’t that good at this business of preparing food for yourself, your family, your friends?",2023-12-10T16:00:03+0000,article,Food,Letter,Chicken on Bread in Sauce in a Skillet,Cooking and Cookbooks;Content Type: Service
47,"The severe storms also injured dozens, caused electrical flashes and explosions, knocked out power for tens of thousands and left buildings in ruin.","The severe storms also injured dozens, caused electrical flashes and explosions, knocked out power for tens of thousands and left buildings in ruin.",2023-12-10T16:42:46+0000,multimedia,U.S.,Video,Several People Dead After Tornadoes Strike Tennessee,Tornadoes;Tennessee;Power Failures and Blackouts;Deaths (Fatalities)
48,"It was the first call in weeks between the two leaders, whose relationship has been strained since the start of the Israel-Hamas war.","Prime Minister Benjamin Netanyahu of Israel and President Vladimir V. Putin of Russia spoke by telephone on Sunday for the first time in weeks, offering sharply different accounts of what was said in a reflection of the strained relationship between the two leaders since the outbreak of war between Israel and Hamas.",2023-12-10T16:49:57+0000,article,World,News,"Netanyahu and Putin Speak, and Offer Different Versions of What Was Said","International Relations;Israel-Gaza War (2023- );Russian Invasion of Ukraine (2022);Netanyahu, Benjamin;Putin, Vladimir V;Israel;Russia"
49,"Forty years ago, Black women convened to discuss how race affected their health, inspiring remarkable changes.",This article is also a weekly newsletter. Sign up for Race/Related here.,2023-12-10T17:07:38+0000,article,U.S.,News,Inside the Three Days That Reframed Black Women’s Health,Medicine and Health;Women's Rights;Race and Ethnicity;Mental Health and Disorders
50,"Renowned for his professionalism and attention to detail, he worked for Republicans from Nixon to Trump. He was by Ronald Reagan’s side when he was shot in 1981.","Though Rick Ahearn was just a few feet from John Hinckley Jr. when he opened fire on Ronald Reagan and his entourage outside the Washington Hilton on March 30, 1981, he was most likely among the last people in the city to know that the president had been shot.",2023-12-10T17:24:42+0000,article,U.S.,Obituary (Obit),"Rick Ahearn, Advance Man for Candidates and Presidents, Dies at 74","Ahearn, Rick;Deaths (Obituaries);United States Politics and Government;Republican Party;Reagan, Ronald Wilson;Presidents and Presidency (US);Assassinations and Attempted Assassinations"
51,The company has publicly released its latest technology so people can build their own chatbots. Rivals like OpenAI and Google argue that approach can be dangerous.,"Mistral AI, a Paris start-up founded seven months ago by researchers from Meta and Google, has raised 385 million euros, or about $415 million, in yet another sign of feverish interest in a new kind of artificial intelligence that drives online chatbots.",2023-12-10T17:30:14+0000,article,Technology,News,"Mistral, French A.I. Start-Up, Is Valued at $2 Billion in Funding Round",Mistral AI SAS;Venture Capital;Artificial Intelligence;Start-ups;Open-Source Software;Meta Platforms Inc;Andreessen Horowitz;Lightspeed Venture Partners;France
52,Readers respond to the college leaders’ remarks at a House hearing. Also: Homeless on the subway; Jewish women playwrights; baby names.,To the Editor:,2023-12-10T17:59:12+0000,article,Opinion,Letter,The Fallout From the College Presidents’ Antisemitism Testimony,"Homeless Persons;Subways;New York City;Theater;Women and Girls;Jews and Judaism;Books and Literature;Adams, Eric L;Babies and Infants;Names, Personal;Colleges and Universities;Anti-Semitism;War Crimes, Genocide and Crimes Against Humanity;House of Representatives;University of Pennsylvania;Magill, Elizabeth"
53,"Mozart’s opera, tailored to families in this staging, is big on spectacle and let’s-put-on-a-show verve. What shines? Kathryn Lewek as Queen of the Night.",The evolution of Julie Taymor’s production of “Die Zauberflöte” from long-running hit to children’s-theater show at the Metropolitan Opera is now complete.,2023-12-10T18:12:50+0000,article,Arts,Review,Review: This ‘Magic Flute’ at the Met Lacks Some Luster,"Opera;Classical Music;Mozart, Wolfgang Amadeus;Taymor, Julie;The Magic Flute (Opera)"
54,"A teacher and rabbi, he forged alliances across all branches of Judaism, and his scholarship confronted questions of Jewish tradition and modernity.","Rabbi David Ellenson, a scholar who wrestled with the interplay of tradition and modernity in Judaism and who shaped a generation of Reform rabbis as a teacher and later as the president of Hebrew Union College-Jewish Institute of Religion, died on Thursday at his home in Manhattan. He was 76.",2023-12-10T18:38:29+0000,article,U.S.,Obituary (Obit),"David Ellenson, 76, Who Guided a Generation of Reform Rabbis, Dies","Jews and Judaism;Rabbis;Deaths (Obituaries);Orthodox Judaism;Hebrew Union College-Jewish Institute of Religion;Ellenson, David"
55,"One day after the resignations of the university president and chairman, students and professors reflected on the continuing division at the school.","One day after the president of the University of Pennsylvania resigned over criticism that she did not condemn antisemitism forcefully enough, state leaders showed solidarity with Jews at a Philadelphia rally, while students and professors lamented the ongoing rift on campus.",2023-12-10T18:48:02+0000,article,U.S.,News,"At Penn, Vacancies in Leadership, and Anguish on Campus","Israel-Gaza War (2023- );Jews and Judaism;Terrorism;Demonstrations, Protests and Riots;Palestinians;Casey, Robert P Jr;Magill, Elizabeth;Shapiro, Josh (1973- );Gaza Strip;Israel;Pennsylvania;Philadelphia (Pa)"
56,"Ms. Redstone waged a bitter battle for control of National Amusements, the parent company of MTV, CBS and the Paramount movie studio. Now, she’s considering a sale.","The media mogul Shari Redstone is in talks to sell a controlling stake in National Amusements, the parent company of the sprawling news and entertainment empire that includes the Paramount movie studio, CBS and MTV, according to three people familiar with the talks.",2023-12-10T18:51:46+0000,article,Business Day,News,Shari Redstone Is Said to Be in Talks to Sell Her Stake in Media Empire,"Media;National Amusements Inc;Mergers, Acquisitions and Divestitures;Redstone, Shari;Television;Movies;Video Recordings, Downloads and Streaming;Cable Television;Paramount Pictures;CBS Corporation;Comcast Corporation;MTV Networks;Netflix Inc;Warner Bros Discovery;Ellison, David (1983- );Skydance Productions LLC;Paramount Global"
57,Some border communities in the U.S. and Mexico are suddenly cut off from each other after a border crossing closed to cope with large numbers of migrants.,"Like many people in the tiny town of Why, Ariz., Stephanie Fierro’s life revolves around the nearby border crossing. She works at a roadside café serving enchiladas to American tourists passing through on their way to beach resorts in Mexico. Her husband, a Mexican citizen, lives on the other side.",2023-12-10T19:06:18+0000,article,U.S.,News,"To Handle a Surge of Illegal Crossings, Border Officials Stop Legal Ones","Arizona;Illegal Immigration;Immigration and Emigration;Border Barriers;Border Patrol (US);Hobbs, Kathleen M;Biden, Joseph R Jr;Why (Ariz);Ajo (Ariz);Mexican-Americans;United States Politics and Government"
58,The tap dancer Caleb Teicher and the beatboxer Chris Celiz have expanded an earlier collaboration into an evening-length work at the Joyce Theater.,"The acclaimed tap dancer Caleb Teicher and the world-champion beatboxer Chris Celiz might seem to belong to very different tribes. But when they met a few years ago while separately performing at a conference in Miami, they got to talking about what their art forms had in common.",2023-12-10T19:30:29+0000,article,Arts,News,‘Bzzz’ Turns Art Forms of Solo Virtuosity Into a Group Affair,"Dancing;Joyce Theater;Bzzz (Dance);Celiz, Chris (Musician);Teicher, Caleb"
59,"Despite government efforts to silence her, she drew global attention to an epidemic that devastated rural China and killed tens of thousands.","Gao Yaojie, a Chinese doctor who defied government pressure in exposing an AIDS epidemic that spread across rural China through reckless blood collection, died on Sunday at her home in Upper Manhattan. She was 95. ",2023-12-10T19:41:42+0000,article,World,Obituary (Obit),"Dr. Gao Yaojie, Who Exposed AIDS Epidemic in Rural China, Dies at 95",Gao Yaojie;Deaths (Obituaries);Blood Donation;Acquired Immune Deficiency Syndrome;Henan Province (China);China;Rural Areas
60,The Los Angeles Dodgers are betting $700 million that Shohei Ohtani can deliver championships and help increase revenue. But the economics of sports can be fickle.,"Japanese baseball players are taught to keep a low profile and let their performances do the talking. Yet for more than a decade, Shohei Ohtani has been willing to make waves.",2023-12-10T19:50:48+0000,article,Business Day,News,Ohtani’s Contract Goes Beyond Dollars and Sense,"Ohtani, Shohei;Los Angeles Dodgers;Baseball;Wages and Salaries;Japan"
61,"Scammers have used QR codes to steal personal information by imitating legitimate companies or sending deceptive emails and text messages, the Federal Trade Commission said.","QR codes, the square bar codes that can be scanned and read by smartphones, are seemingly used everywhere: to board flights, enter concerts and look at restaurant menus.",2023-12-10T20:22:16+0000,article,Business Day,News,"That QR Code You’re About to Scan Could Be Risky, F.T.C. Warns",Bar Codes;Computer Security;Smartphones;Privacy;Mobile Applications;Text Messaging;Federal Trade Commission;Consumer Protection
62,The president was back on the fund-raising trail in Los Angeles this weekend after a hiatus because of the writers’ and actors’ strikes.,"President Biden is facing multiple wars, economic anxieties, the indictment of his son and flagging poll numbers. But he was received in California this weekend like a superstar, headlining the hottest events in Los Angeles.",2023-12-10T20:26:50+0000,article,U.S.,News,Biden Steps Out in Tinsel Town and the Big Donors Show Up,"Biden, Joseph R Jr;Katzenberg, Jeffrey;Campaign Finance;Trump, Donald J;Presidential Election of 2024;Democratic Party"
63,Donald J. Trump has changed his mind about returning to the witness stand on Monday to testify in his own defense.,"Donald J. Trump has decided not to return to the witness stand to testify on Monday as he had planned, setting up an abrupt and anticlimactic ending to the defense’s case in his civil fraud trial in Manhattan.",2023-12-10T20:30:15+0000,article,New York,News,Trump Will Not Testify as Scheduled in Civil Fraud Trial,"New York State Civil Case Against Trump (452564/2022);Frauds and Swindling;Deutsche Bank AG;Engoron, Arthur F;James, Letitia;Trump, Donald J;New York State"
64,"Plus, Shohei Ohtani’s $700 million contract","U.N. officials warned yesterday that pressure was mounting near Gaza’s border with Egypt, where tens of thousands of Palestinians have tried to flee Israel’s military campaign.",2023-12-10T20:52:46+0000,article,Briefing,briefing,Monday Briefing: The U.N. and W.H.O.’s Dire Gaza Warnings,
65,"Storms and tornadoes left a swath of destruction that included parts of Clarksville, where three people died, and near Nashville, where three others were killed.","Reed Arnold was watching TV on Saturday at his home in Clarksville, Tenn., when he saw a warning on his phone. He stepped outside and filmed the swiftly moving clouds and a looming tornado. Minutes later, the twister hit his neighborhood.",2023-12-10T21:07:41+0000,article,U.S.,News,Six Dead and More Than 60 Injured After Severe Weather in Tennessee,Weather;Deaths (Fatalities);Tornadoes;Clarksville (Tenn);Davidson County (Tenn);Jackson (Miss);Mississippi;Tennessee
66,"A former liberal government official, he saw little chance of full reconciliation with Palestinians in “the foreseeable future” but nevertheless sought to ease tensions.","Shlomo Avineri, an Israeli political scientist, historian and former government official whose pessimism about resolving the conflict with Palestinians did not stop him from advocating measures to ease it, died on Nov. 30 in Jerusalem. He was 90.",2023-12-10T21:56:46+0000,article,World,Obituary (Obit),"Shlomo Avineri, Israeli Scholar Skeptical About Peace, Dies at 90","AVINERI, SHLOMO;Deaths (Obituaries);International Relations;Palestinians;Israel-Gaza War (2023- );Israel;Haaretz;Books and Literature;Writing and Writers"
67,Officials announced that the Ukrainian president would travel to Washington on Tuesday for a last-ditch lobbying effort with President Biden and members of Congress.,"President Volodymyr Zelensky of Ukraine will travel to Washington on Tuesday for a last-ditch lobbying effort with President Biden and members of Congress aimed at securing billions of dollars of U.S. aid, officials said on Sunday.",2023-12-10T22:45:36+0000,article,U.S.,News,Zelensky to Visit Washington With U.S. Aid to Ukraine in Doubt,"United States Politics and Government;Russian Invasion of Ukraine (2022);United States International Relations;Biden, Joseph R Jr;Zelensky, Volodymyr;Johnson, Mike (1972- );Russia;Ukraine"
68,The special counsel Jack Smith told the judge she should keep the trial’s start date in March and continue making decisions as the former president appeals one of her rulings.,Federal prosecutors on Sunday asked the judge handling former President Donald J. Trump’s trial on charges of plotting to overturn the 2020 election to reject his request to freeze the case in its entirety as Mr. Trump appeals her recent ruling that he is not immune from prosecution.,2023-12-10T23:34:48+0000,article,U.S.,News,Prosecutors Ask Judge to Deny Trump’s Request to Freeze Election Case,"Federal Criminal Case Against Trump (2020 Election Case);Presidential Election of 2020;Special Prosecutors (Independent Counsel);United States Politics and Government;Justice Department;Chutkan, Tanya S;Smith, Jack (Attorney);Trump, Donald J;Windom, Thomas P"
69,Luke K. Schreiber makes his New York Times debut.,Jump to: Today’s Theme | Tricky Clues,2023-12-10T23:56:34+0000,article,Crosswords & Games,News,Big Commotion,Crossword Puzzles;Games
