,abstract,lead_paragraph,pub_date,document_type,section_name,type_of_material,headline,keywords
82,John Drake Jr. was accused of shooting two police officers outside a Dollar General store on Saturday. Officials said he was found dead on Tuesday night.,"The Nashville police chief’s estranged son, who was recently identified as a suspect in the shooting of two police officers outside a Dollar General store in La Vergne, Tenn., was found dead on Tuesday night, officials said.",2023-10-25T15:17:02+0000,article,U.S.,News,"Nashville Chief’s Son, Wanted in Shooting of Two Officers, Is Found Dead","Attacks on Police;Fugitives;Police;Murders, Attempted Murders and Homicides;Dollar General Corp;Police Department (Nashville, Tenn);Drake, John C Jr;Nashville (Tenn);Tennessee"
83,"In a city thick with spectacles and showmen, Beverly Shaw arrived from Indiana with a desperate plea.","The short, slender woman clutches two leashes in her right hand. At their ends are two goats, Marshmallow and Brownie. The three of them stand in the human jet stream of Rockefeller Center, and people stop to take pictures or pet the animals.",2023-10-25T15:24:22+0000,article,New York,News,"Among New York’s Sidewalk Sideshows, 2 Goats and a Story of Despair","Goats;internal-sub-only;Nursing Homes;Elder Care;Rockefeller Center (Manhattan, NY);Shelby County (Ind);internal-great-read"
84,"Republicans turned to a little-known Louisiana lawmaker who led congressional efforts to overturn the 2020 election, ending a weekslong deadlock that paralyzed the House.","Representative Mike Johnson of Louisiana won election on Wednesday to become the 56th speaker of the House of Representatives, as Republicans worn down by three weeks of infighting and dysfunction turned to a little-known conservative hard-liner beloved by the far right to end their paralysis.",2023-10-25T15:30:39+0000,article,U.S.,News,"House Elects Mike Johnson as Speaker, Embracing a Hard-Right Conservative","Johnson, Mike (1972- );Republican Party;House of Representatives;United States Politics and Government;Trump, Donald J;Conservatism (US Politics)"
85,A selection of recently published books.,"HOW FIRE DESCENDS: New and Selected Poems, by Serhiy Zhadan. Translated by Virlana Tkacz and Wanda Phipps. (Yale University Press, paperback, $18.) In these poems, compiled from 2016 to 2022, the Ukrainian poet commemorates the plight of his compatriots in the face of Russian imperialism and mourns their deaths, “limited / by the silence that comes with it.”",2023-10-25T15:35:49+0000,article,Books,News,"Newly Published Poetry, From Katy Lederer to The Shining",Books and Literature
86,The magazine’s Ethicist columnist on whether parental responsibility should outweigh a person’s well-being.,"I’m a nearly 70-year-old single mother living with an adult son of 40 who has schizoaffective disorder, which is a combination of schizophrenia and bipolar conditions. I testified at a juried trial that for over 10 years he has been averse to staying on antipsychotic meds, and that, as a result, he has been jailed, and that he has attacked me repeatedly in outbursts of rage. But two of 12 jurors didn’t agree that my son should be obliged to stay on meds. As a result, he has just been released from a medication mandate. Now, for the umpteenth time, distant family members are urging me to boot my mentally disabled son out of the apartment we share.",2023-10-25T15:44:40+0000,article,Magazine,News,My Son Poses a Threat to My Safety. Should I Evict Him?,Ethics (Personal);internal-sub-only-nl;Parenting;Mental Health and Disorders;Accidents and Safety;Schizophrenia;Bipolar Disorder
87,"An all-American at Purdue, he was the youngest member of the gold medal-winning 1960 U.S. Olympic team. He later became a top N.B.A. rookie.","Terry Dischinger, one of the greatest players in Purdue University basketball history and the youngest member of the U.S. Olympic team that won a gold medal in Rome in 1960, died on Oct. 9 in Lake Oswego, Ore. He was 82.",2023-10-25T15:48:21+0000,article,Sports,Obituary (Obit),"Terry Dischinger, College and N.B.A. Star and Olympian, Dies at 82",Deaths (Obituaries);Basketball;Basketball (College);OLYMPIC GAMES (1960);National Basketball Assn;Purdue University;Detroit Pistons
88,"Sankai Juku, an all-male Butoh company, returns to New York with a program of greatest hits that too often feels tedious.","Men with shaved heads, their bodies caked in white powder, move with exacting slowness. Their motions and poses are often inscrutable, but their faces are sometimes telegraphic, contorting into open-mouthed expressions of amusement or agony as readable as the masks of comedy and tragedy.",2023-10-25T15:59:26+0000,article,Arts,Review,Review: Slow Poses and Clouds of White Powder,"Dancing;Sankai Juku;Joyce Theater;AMAGATSU, USHIO;Kosa (Dance)"
89,"Representative Mike Johnson of Louisiana was nominated for speaker in a secret-ballot vote by his peers, hours after Representative Tom Emmer of Minnesota withdrew his bid in the face of swift party backlash.","Representative Mike Johnson of Louisiana was nominated for speaker in a secret-ballot vote by his peers, hours after Representative Tom Emmer of Minnesota withdrew his bid in the face of swift party backlash.",2023-10-25T15:59:59+0000,multimedia,U.S.,Video,Republicans Nominate Louisiana’s Mike Johnson for House Speaker,"Johnson, Mike (1972- );Emmer, Tom;House of Representatives;Republican Party"
90,"Across the country, public schools, like colleges and universities, are facing backlash as they try to respond to the Hamas attacks and war in Gaza.","In Atlanta, Jewish parents criticized the school district’s statement on “the violence facing children and families in the Middle East” for never using the word “terrorism.”",2023-10-25T16:02:01+0000,article,New York,News,Public Schools Struggle to Say the Right Thing About the Israel-Hamas War,Israel-Gaza War (2023- );Education (K-12);Freedom of Speech and Expression;Palestinians;Muslim Americans;Jews and Judaism;Hamas;Terrorism;Anti-Semitism;New York City;Montgomery County (Md);Los Angeles (Calif);Cherry Hill (NJ);United States;audio-neutral-informative
91,"In his explorations of black, Pierre Soulages found a link to our sorrows, despair, regrets — our deepest selves.","“Some darknesses refuse to fade,” the poet Danielle DeTiberus observed after contemplating “Judith Beheading Holofernes” by Artemisia Gentileschi. Having recently seen the dark paintings by Pierre Soulages at Lévy Gorvy Dayan gallery, in Manhattan, the poet’s lyric resonated.",2023-10-25T16:13:30+0000,article,Arts,Review,A Giant of Painting Sheds New Light on Darkness,"Art;SOULAGES, PIERRE;Levy Gorvy Gallery;Manhattan (NYC);Content Type: Personal Profile"
92,Gills Onions recalled packages of diced onions after the company was notified of an investigation. Public health officials said 15 people were treated at hospitals.,"A salmonella outbreak linked to packages of diced onions has sickened at least 73 people across 22 states, 15 of whom were treated at hospitals, public health officials said.",2023-10-25T16:16:59+0000,article,Business Day,News,Salmonella Outbreak Linked to Packaged Onions Sickens 73,Food Contamination and Poisoning;Salmonella (Bacteria);Centers for Disease Control and Prevention;Food and Drug Administration;California;Arizona;Montana;Mexico;Washington (State)
93,"“Creepshow,” “The Fall of the House of Usher” and other shows serve up humor with their horror.","Sorting through the seasonal bounty of horror and supernatural television series timed to Halloween, I have focused on shows that approach the grim task with a sense of humor. Here, in alphabetical order, are five series released this month that put more emphasis on wit than on sheer terror.",2023-10-25T16:24:57+0000,article,Arts,News,Five TV Treats for Halloween,Television;30 Coins (TV Program);Creepshow (TV Program);Shining Vale (TV Program);The Fall of the House of Usher (TV Program);Wolf Like Me (TV Program);Halloween
94,"Outside Donald J. Trump’s civil fraud trial, the former president made comments to reporters that the judge found were an attack on a court employee.","A Manhattan judge on Wednesday ordered Donald J. Trump to the witness stand, questioned him personally, found that his answers were not believable and fined him $10,000.",2023-10-25T16:29:58+0000,article,New York,News,"Trump Told to Pay $10,000 in New Punishment for Breaking Gag Order","New York State Civil Case Against Trump (452564/2022);Trump, Donald J;Trump Organization;Appraisals and Valuation (Property);Frauds and Swindling;Cohen, Michael D (1966- );Engoron, Arthur F;Fines (Penalties)"
95,"They are set to start their defense on Thursday, with the FTX founder planning to testify in his criminal fraud trial. Hurdles include what Mr. Bankman-Fried’s former associates said on the stand.", Follow live coverage of Sam Bankman-Fried’s testimony in the FTX fraud case.,2023-10-25T16:46:37+0000,article,Technology,News,The Challenges Facing Sam Bankman-Fried’s Lawyers,"HK FTX Trading Ltd (Futures Exchange);Bankman-Fried, Sam;Virtual Currency;Alameda Research LLC;Frauds and Swindling;Legal Profession;Banking and Financial Institutions;Computers and the Internet;Ellison, Caroline (1994- );Singh, Nishad;Kaplan, Lewis A"
96,"As people try to walk away with goods, it’s “like the Wild West,” says one store owner, whose employees have been hit and bitten on the job.","Stashing six bottles of wine into a bag, a man wearing a dark jacket and beanie heads straight to the store exit without paying, barging by a female shop worker who blocks his way and only stopping when her colleague overpowers him just outside the doorway.",2023-10-25T16:47:40+0000,article,World,News,"Shoplifting Surges in U.K., Putting Workers in Scary Situations",Shoplifting and Employee Theft (Retail);Assaults;Supermarkets and Grocery Stores;Convenience Stores;Workplace Hazards and Violations;Great Britain;England
97,"The company was faulted for the practice, which it said was an effort to help schools navigate new laws restricting books about racism and L.G.B.T.Q. identities.","The children’s book publisher Scholastic, which had begun separating some books about race, gender and sexuality at school book fairs, said this week it was halting the new practice after pointed criticism from some authors, educators and parents.",2023-10-25T16:54:07+0000,article,U.S.,News,Publisher Scholastic Backtracks on Isolating Works on Race and Gender,Scholastic Corporation;Books and Literature;Children and Childhood;Freedom of Speech and Expression;Censorship;Book Fairs;Education (K-12)
98,"Loved in her day, the French painter Marie Laurencin depicted a dreamy vision of a world of women. What does she have to say to audiences now?","“If you want what is commonly accepted as ‘a straight answer to a straight question,’ don’t go to Marie Laurencin to get it,” Dorothy Todd, the British magazine editor, wrote in 1928. If answers from Laurencin — one of the most notable female painters in interwar France — were anything like her work, of course they wouldn’t be straight, but coy, queer, covert and very pretty.",2023-10-25T17:00:07+0000,article,Style,News,The Exhibition Making the Case for Art Without Men,"Art;Homosexuality and Bisexuality;Women and Girls;Content Type: Personal Profile;Laurencin, Marie;Paris (France);Barnes Foundation;Philadelphia (Pa)"
99,"The Mint Theater revives Elizabeth Baker’s charming 1917 comedy, which offers a gentle reminder about work-life balance.","Find a job that you love and you’ll work every day of your life. So warns “Partnership,” the third Elizabeth Baker play to be staged by the Mint Theater Company, which has long nurtured the works of forgotten playwrights. Baker’s play premiered in 1917 in London, but the way it tackles the issue of work-life balance seems to speak more to the Great Resignation than to the Great War.",2023-10-25T17:04:33+0000,article,Theater,Review,‘Partnership’ Review: A Lost Tale of Ambition That Resonates,"Theater;Theater (Off Broadway);Mint Theater Co;Partnership (Play);Baker, Elizabeth (1876-1962);Gay, Jackson;Theater Row (Manhattan, NY, Theater)"
100,The new speaker played a pivotal role in congressional efforts to overturn the 2020 election and opposes abortion rights and gay marriage.,"When Representative Mike Johnson of Louisiana wanted to make the case against abortion rights last year during a Capitol Hill committee hearing, he grilled a witness in graphic fashion.",2023-10-25T17:06:30+0000,article,U.S.,News,"In Johnson, House Republicans Elevate One of Their Staunchest Conservatives","Johnson, Mike (1972- );House of Representatives;Republican Party;Right-Wing Extremism and Alt-Right;Conservatism (US Politics);United States Politics and Government"
101,How do you cope with tricky relationships and thorny topics? We want to hear your stories.,"The holiday season is around the corner, and there are so many beloved rituals and traditions to look forward to.",2023-10-25T17:10:12+0000,article,Well,News,Let’s Talk About Holiday Family Drama,internal-reader-callout;Thanksgiving Day;Christmas;Hanukkah;Families and Family Life
102,"Impress your friends without much effort with this menu from David Tanis: a spiced carrot soup, a roasted fish with lemon and a lovely orange-pomegranate finish.","A few things to consider when planning a November dinner party: It’s important to celebrate the newly arrived fall produce and the change in weather. It’s time for all manner of warming, homey fare. But also: The month signals the start of “the holiday season” and all its various temptations.",2023-10-25T17:13:27+0000,article,Food,News,This Showstopping Three-Course Dinner Is as Easy and Light as It Gets,Cooking and Cookbooks;Parties (Social);Content Type: Service;Seasons and Months
103,"During an appearance with the Australian prime minister, President Biden pledged that the United States would provide Israel with what it needed to defend itself against Hamas.",President Biden expressed forceful support for Israel on Wednesday and cautioned that the country should do everything in its power to protect civilians but added that their deaths were ultimately “the price of waging a war.”,2023-10-25T17:17:39+0000,article,U.S.,News,Biden Reaffirms Support for Israel but Calls for Protection of Civilians,"Israel-Gaza War (2023- );Defense and Military Forces;United States Politics and Government;United States International Relations;Law and Legislation;Hamas;United States Navy;Biden, Joseph R Jr;Albanese, Anthony (1963- );Australia;China;Israel;Submarines and Submersibles;Nuclear Weapons;International Trade and World Market;Russian Invasion of Ukraine (2022);Papua New Guinea;Middle East"
104,"Dr. Connor Bowman was charged with murder after investigators found that his wife, Betty Bowman, was poisoned with a drug that he had researched online.","A Minnesota doctor who the authorities said had worked as a poison specialist was arrested on Friday and charged in the death of his wife, Betty Bowman, who died in August from poisoning.",2023-10-25T17:18:16+0000,article,U.S.,News,"Poison Specialist Accused in Wife’s Death, Authorities Say","Bowman, Betty (1990-2023);Murders, Attempted Murders and Homicides;Poisoning and Poisons;Doctors;Bowman, Connor;Rochester (Minn)"
105,"Representative Mike Johnson recruited House Republicans to back a lawsuit to overturn the results, and he was a key architect of his party’s objections to certifying President Biden’s victory.","If Representative Jim Jordan of Ohio was the most prominent public face of the congressional effort to fight the results of the 2020 election, his mentee, the newly elected Speaker Mike Johnson of Louisiana, was a silent but pivotal partner.",2023-10-25T17:30:59+0000,article,U.S.,News,Johnson Played Leading Role in Effort to Overturn 2020 Election,"Johnson, Mike (1972- );House of Representatives;Republican Party;United States Politics and Government;Presidential Election of 2020;Louisiana;Voter Fraud (Election Fraud);Rumors and Misinformation"
106,"The pop superstar’s new version of her 2014 blockbuster is due Friday, following a summer of media saturation and her 10th No. 1 hit.","Taylor Swift’s “1989” has been a fixture in the Top 20 of Billboard’s album chart for months. Stuffed with some of the singer’s biggest pop hits, like “Shake It Off” and “Blank Space,” the LP was a gargantuan hit when it was released in 2014, and this year Swift has been performing its songs on her record-breaking Eras Tour.",2023-10-25T17:41:01+0000,article,Arts,News,Taylor Swift’s ‘1989’ May Be Her Biggest Rerecording Yet. Here’s Why.,"Pop and Rock Music;Swift, Taylor;1989 (Taylor's Version) (Album);1989 (Album);Shamrock Capital Advisors;audio-neutral-informative"
107,"The city adopted a state-approved plan in January to build 82,000 new housing units in eight years. It’s already failing.","A scathing new report has found that it takes longer and costs more to build housing in San Francisco than anywhere else in California, exacerbating the state’s homelessness crisis and preventing many workers from being able to live in the city.",2023-10-25T18:00:10+0000,article,U.S.,News,California Slams San Francisco for ‘Egregious’ Barriers to Housing Construction,Real Estate and Housing (Residential);Affordable Housing;Law and Legislation;Local Government;Building (Construction);Homeless Persons;San Francisco Board of Supervisors;San Francisco (Calif);California
108,A modified version of the classic mirror test suggested that roosters recognize their reflections.,"The idea of a chicken running around with its head cut off, inspired by a real-life story, may make it seem like the bird doesn’t have much going on upstairs. But Sonja Hillemacher, an animal behavior researcher at the University of Bonn in Germany, always knew that chickens were more than mindless sources of wings and nuggets.",2023-10-25T18:00:14+0000,article,Science,News,A Mirror Reveals a Surprise About Bird Brains,Animal Cognition;Animal Behavior;Chickens;Research;PLoS One (Journal);your-feed-science;your-feed-animals
109,"A conversation about the week in popular culture, including “The Woman in Me,” the new book by Spears, and “Killers of the Flower Moon,” Martin Scorsese’s latest film.","This week’s episode of Popcast (Deluxe), the weekly culture roundup show on YouTube hosted by Jon Caramanica and Joe Coscarelli, includes segments on:",2023-10-25T18:19:02+0000,article,Arts,News,Popcast (Deluxe): Britney Spears Tells … Some?,"audio-neutral-informative;Spears, Britney;The Woman in Me (Book);Scorsese, Martin;Killers of the Flower Moon: The Osage Murders and the Birth of the FBI (Book);DiCaprio, Leonardo;De Niro, Robert"
110,"The justice failed to repay much, perhaps all, of the $267,230 loan. His benefactor wiped the slate clean, with ethical and potential tax consequences.","The terms of the private loan were as generous as they were clear: With no money down, Justice Clarence Thomas could borrow more than a quarter of a million dollars from a wealthy friend to buy a 40-foot luxury motor coach, making annual interest-only payments for five years. Only then would the principal come due.",2023-10-25T18:21:10+0000,article,U.S.,News,"Justice Thomas’s R.V. Loan Was Forgiven, Senate Inquiry Finds","Thomas, Clarence;Supreme Court (US);Gifts to Public Officials;Ethics and Official Misconduct;Recreational Vehicles;Luxury Goods and Services;Welters, Anthony;Senate Committee on Finance;Marathon Coach Inc;United States Politics and Government"
111,Readers agree with Pamela Paul about bringing back those classes. Also: Donald Trump’s provocations; mental health and TikTok; Israel and Ukraine.,To the Editor:,2023-10-25T18:50:59+0000,article,Opinion,Letter,Teaching Practical Skills Like Home Ec and Shop in School,"Education (K-12);Home Economics;Computers and the Internet;Trump, Donald J;Storming of the US Capitol (Jan, 2021);United States Politics and Government;Mental Health and Disorders;TikTok (ByteDance);Israel-Gaza War (2023- );Israel;Hamas;Putin, Vladimir V;Russia;Ukraine;Russian Invasion of Ukraine (2022)"
112,"The only male child of the actor Yul Brynner, he built a peripatetic career as a historian, novelist, playwright — and roadie for the Band.","Rock Brynner, whose life as a road manager for the Band, bodyguard for Muhammad Ali, farmer, pilot, street performer, novelist and professor of constitutional history overshadowed what, for a lesser mortal, might be a more than sufficient laurel on which to rest — he was the son of the actor Yul Brynner — died on Oct. 13 in Salisbury, Conn. He was 76.",2023-10-25T18:52:12+0000,article,Books,Obituary (Obit),"Rock Brynner, 76, Son of Hollywood Royalty Who Cut His Own Path, Dies","Brynner, Rock;Deaths (Obituaries);Books and Literature;Writing and Writers;Celebrities;Band, The (Music Group);Hard Rock Cafe;Brynner, Yul;Russia"
113,The conflict has raised questions about how much state aid the ultra-Orthodox and settlers receive.,"While the world’s eyes are on Gaza, another drama is unfolding in Jerusalem. There, lawmakers and government ministers are tussling over how to pay for the war against Hamas. There’s a debate over how much, if any, of the money should come from special allotments that were made earlier this year to the ultra-Orthodox and to settlers in the West Bank.",2023-10-25T19:00:03+0000,article,Opinion,Op-Ed,How Will Israel Pay for Its War?,"internal-sub-only-nl;Israel;Palestinians;Israeli Settlements;Orthodox Judaism;Smotrich, Bezalel (1980- );Netanyahu, Benjamin;Ben-Gvir, Itamar;Gaza Strip;West Bank;Jerusalem (Israel)"
114,"A lawyer for Peter Nygard, a former fashion executive accused of sexually assaulting five women, described their testimony as “revisionist history.’’","Peter Nygard, the former fashion executive behind a now defunct Canadian clothing brand, took the stand at a Toronto courthouse on Wednesday to counter what his lawyer called the “revisionist history” put forth by five women who have accused him of sexual assault.",2023-10-25T19:13:34+0000,article,World,News,A Once Powerful Fashion Executive Testifies in His Sexual Assault Trial,"Sex Crimes;Fashion and Apparel;Courts and the Judiciary;Nygard, Peter;Canada"
115,"The museum had commissioned the work for its annual Día de los Muertos celebrations, but decided not to display it after the artists included a Palestinian flag in it.","El Museo del Barrio, a Manhattan museum dedicated to Puerto Rican and Latin American art, decided not to display an artwork it had commissioned for its annual Día de los Muertos celebrations this month after the artists included a Palestinian flag in it.",2023-10-25T19:14:21+0000,article,Arts,News,El Museo del Barrio Rejects Artwork Featuring Palestinian Flag,"Art;Museums;Palestinians;Israel-Gaza War (2023- );Censorship;El Museo del Barrio;Baizan, Roy;Burgoa, Odalys;Manhattan (NYC)"
116,"The new speaker, Mike Johnson, is virtually unknown to most Americans, but he can be expected to press a hard-right social and fiscal agenda.","In the end, Republican hard-liners got their man.",2023-10-25T19:16:48+0000,article,U.S.,News,The Far Right Gets Its Man of the House,"Johnson, Mike (1972- );House of Representatives;Republican Party;United States Politics and Government;Conservatism (US Politics);Right-Wing Extremism and Alt-Right"
117,"The G.O.P. field, including former President Trump, has been wading into the emotional debate among students playing out over the deadly war between Hamas and Israel.","As tensions mount on U.S. college campuses over the war in Gaza, several Republican presidential candidates are proposing a crackdown on students and schools that express opposition to Israel, appear to express support for the deadly Hamas attacks or fail to address antisemitism.",2023-10-25T19:20:19+0000,article,U.S.,News,G.O.P. Candidates Call for Campus Crackdowns Against Anti-Israel Speech,"Israel-Gaza War (2023- );Presidential Election of 2024;Colleges and Universities;Terrorism;Palestinians;Anti-Semitism;Freedom of Speech and Expression;Hamas;Republican Party;Students for Justice in Palestine;Scott, Timothy Eugene;Burgum, Douglas;George Washington University"
118,The filmmakers look back on its 30th anniversary and recall how uncomfortable it made executives. They didn’t expect the celebrations around it today.,"“What’s this?” Jack Skellington sings excitedly when he first comes across Santa Claus’s snowy, colorful village in “The Nightmare Before Christmas.” That’s also what Disney executives asked with concern about the idiosyncratic stop-motion animation musical when they saw a rough cut.",2023-10-25T19:26:05+0000,article,Movies,News,‘The Nightmare Before Christmas’: A Hit That Initially Unnerved Disney,"Movies;Selick, Henry;Burton, Tim;The Nightmare Before Christmas (Movie);Halloween"
119,A major lawsuit against Meta has placed a spotlight on our fraught relationship with online social information.,"A group of 41 states and the District of Columbia filed suit on Tuesday against Meta, the parent company of Facebook, Instagram, WhatsApp and Messenger, contending that the company knowingly used features on its platforms to cause children to use them compulsively, even as the company said that its social media sites were safe for young people.",2023-10-25T19:44:09+0000,article,Health,News,Is Social Media Addictive? Here’s What the Science Says.,Social Media;Computers and the Internet;Content Type: Service;Teenagers and Adolescence;Mental Health and Disorders;Addiction (Psychology);Facebook Inc;Meta Platforms Inc;Instagram Inc;your-feed-science;your-feed-health
