,abstract,lead_paragraph,pub_date,document_type,section_name,type_of_material,headline,keywords
43,Not everyone wants to rocket down a mountain on skis. But hot chocolate by a warm fire in a snug inn is another story. Here are six hotels in snowy settings.,"The season of mittens and hot chocolate is upon us and if you’d rather spend a tranquil afternoon beside a fire than brave the crowds at a big ski resort, these snowy getaways are for you. Picture yourself in a luxury treehouse in the woodlands of Vermont, or a quiet cottage in the Catskills, or a retro motor lodge near Grand Teton National Park. Consider a new boutique hotel in Rhode Island from which you can tour Gilded Age mansions trimmed for the holidays. Or check into a stately newcomer in Germany and browse Christmas markets in places you thought existed only in fairy tales. From Bavaria to Wyoming, winter wonderlands await.",2023-12-08T10:02:20+0000,article,Travel,News,Cozy Retreats for a Winter Getaway,Hotels and Travel Lodgings;Travel and Vacations;Winter (Season);Barnard (Vt);Catskills (NYS Area);Jackson (Wyo);Munich (Germany);Newport (RI)
44,The year was full of unlikely winners and exciting team competitions.,"There was no champagne courtside. So, as Matteo Berrettini embraced Jannik Sinner after Sinner’s victory over Alex de Minaur last month to clinch Italy’s first Davis Cup title in 47 years, their teammate, Matteo Arnaldi, did the next best thing: He shook a water bottle and poured it over Sinner and Berrettini.",2023-12-08T10:02:20+0000,article,Sports,News,"In Tennis, Bookends of Drama in 2023","Tennis;Assn of Tennis Professionals;Women's Tennis Assn;Australian Open (Tennis);French Open (Tennis);Wimbledon Tennis Tournament;United States Open (Tennis);Davis Cup;Records and Achievements;Alcaraz, Carlos (2003- );Djokovic, Novak;Gauff, Cori (2004- );Swiatek, Iga (2001- );Sinner, Jannik (2001- );Sabalenka, Aryna;Pegula, Jessica (1994- );Medvedev, Daniil (1996- );Two Thousand Twenty Three"
45,“We’re pretty much doing a bunk room in every house we work on.” Here’s how they do it.,"All of a sudden, bunk beds seem to be everywhere: You see them in upscale beach and ski homes, as well as boutique hotels like Freehand, Moxy and Proper.",2023-12-08T10:02:21+0000,article,Real Estate,News,Is This the Year of the Bunk Bed? Some Designers Think So.,Interior Design and Furnishings;Home Repairs and Improvements;Beds and Bedding
46,"When characters take flight in the films of the master animator, there is always a deeper meaning.","Few filmmakers can claim the same heights of whimsy, artistry and storytelling as writer-director Hayao Miyazaki, whose modern-day fables seem to prove that having one’s head in the clouds isn’t a fault, but a virtue — in more ways than one. From his 1988 breakthrough “My Neighbor Totoro” to his 2001 Oscar-winning animated feature, “Spirited Away,” the sky is one of Miyazaki’s favorite playgrounds, where flight is about more than just elevation; it’s about transcendence.",2023-12-08T10:02:38+0000,article,Movies,News,How Hayao Miyazaki’s Films Continue to Take Us to the Skies,"Animated Films;Miyazaki, Hayao;Spirited Away (Movie);Kiki's Delivery Service (Movie);Nausicaa of the Valley of the Wind (Movie);Castle in the Sky (Movie);The Wind Rises (Movie);PORCO ROSSO (MOVIE);HOWL'S MOVING CASTLE (MOVIE)"
47,A symposium at the Brooklyn Museum will celebrate the multifaceted writer and civil rights activist.,Good morning. It’s Friday. Today we’ll preview a symposium on the writer and civil rights activist James Baldwin. We’ll also find out why more than 500 tuba players are expected to gather in Rockefeller Center on Sunday.,2023-12-08T10:02:47+0000,article,New York,briefing,Honoring James Baldwin as More Than a Legend,"New York City;internal-storyline-no;Baldwin, James (1924-87);Classical Music;Books and Literature;Writing and Writers;Civil Rights and Liberties;Tubas;Black People;Blacks;Homosexuality and Bisexuality"
48,"“The Curse” has been described as cringe, but look closely and you’ll see it plays with the classic tropes of horror like jump scares.","There’s telling a bad joke. There’s bombing. And then there’s what happens to Nathan Fielder’s character, Asher Siegel, at the end of the fourth episode of “The Curse,” near the halfway point of a series that goes to disorienting extremes.",2023-12-08T10:02:54+0000,article,Arts,News,The Creepiest Moment Onscreen This Year Occurred in a Comedy,"Television;The Curse (TV Program);Comedy and Humor;Fielder, Nathan (1983- )"
49,The modern world’s true cultural divide is not between believers and unbelievers but between those who think life is a puzzle and those who believe it’s a mystery.,"I came to the work of the Norwegian writer Jon Fosse — who receives the Nobel Prize in Literature this week — by way of “Septology,” a novel cycle that began appearing in English just a few years ago.",2023-12-08T10:03:08+0000,article,Opinion,Op-Ed,The Mystical Catholic Tradition of Jon Fosse,"Fosse, Jon;Books and Literature;Nobel Prizes;Religion and Belief;Writing and Writers;Knausgaard, Karl Ove;Prayers and Prayer Books"
50,"The PGA Tour is looking at LIV Golf, and the L.P.G.A. and Ladies European Tour are on the cusp of joining together.","Golf is a sport where certain years stand out above others, and 2023 may prove to be one of those years. It’s a heady list.",2023-12-08T10:03:10+0000,article,Sports,News,"In 2023, Golf Mergers Were the Big Story","Golf;Mergers, Acquisitions and Divestitures;Ladies Professional Golf Assn;LIV Golf;PGA Tour Inc;Content Type: Service"
51,"Many of the most popular channels have largely ditched original dramas and comedies, morphing into vessels for endless reruns.","In 2015, the USA cable network was a force in original programming. Dramas like “Suits,” “Mr. Robot” and “Royal Pains” either won awards or attracted big audiences.",2023-12-08T10:03:15+0000,article,Business Day,News,Zombie TV Has Come for Cable,"Television;Cable Television;Video Recordings, Downloads and Streaming;Reality Television;Ratings (Audience Measurement);Advertising and Marketing;Comedy Central;Peacock Services;USA Network"
52,"As the climate crisis grows ever more urgent, the U.A.E. is championing a dangerously seductive approach to the problem.","On a recent trip to the United Arab Emirates, I felt as if I’d entered a fever dream of green exuberance. It was more than two months before COP28, the annual global climate meeting now in progress in Dubai, but the country was already awash in environmental hype. On the highway, banners for an event hosted by the Abu Dhabi National Oil Company, the fossil fuel behemoth known as Adnoc, read: “Decarbonizing. Faster. Together.” A placard in my hotel bathroom asked me to conserve water by using the two-tiered flush, although the flush had only one tier. A friend’s utility bill was labeled “green bill” — although U.A.E. households have some of the biggest carbon footprints in the world.",2023-12-08T10:03:18+0000,article,Opinion,Op-Ed,"In Dubai, a ‘Good Vibes Only’ Approach to Climate Change","United Nations Framework Convention on Climate Change;Global Warming;International Relations;Conflicts of Interest;Alternative and Renewable Energy;Oil (Petroleum) and Gasoline;Sustainable Living;Developing Countries;Al Jaber, Sultan (1973- );Saudi Arabia;United Arab Emirates"
53,"Luther Ford, a film student, had never acted in a big-budget production before being cast as the royal family’s most divisive recent figure in the Netflix show’s final season.","Playing Prince Harry in the final season of Netflix’s “The Crown,” Luther Ford said he felt like royalty.",2023-12-08T10:03:43+0000,article,Arts,News,"‘The Crown’: Playing Prince Harry, the Royal Black Sheep","Royal Families;Actors and Actresses;Television;Harry, Duke of Sussex;The Crown (TV Program)"
54,"Three new collections by Jeanette Winterson, Paul Yoon and Louise Kennedy.","For Jeanette Winterson, ghost stories are not old-fashioned or anachronistic in the modern world, but both cutting-edge and primal. In the introduction to her new collection, NIGHT SIDE OF THE RIVER: Ghost Stories (Grove, 306 pp., $27), she recalls some of her own inexplicable experiences with the uncanny, from the ghost of a writer friend materializing on her computer screen to her childhood premonition of her grandmother’s passing. Religion, and specifically faith in an afterlife, “can be considered as humankind’s first disruptive start-up,” she writes. “What’s being disrupted is death.”",2023-12-08T10:03:44+0000,article,Books,Review,"Ghost Stories, Both Literal and Figurative","Books and Literature;Night Side of the River: Ghost Stories (Book);Winterson, Jeanette;The Hive and the Honey: Stories (Book);Yoon, Paul;The End of the World Is a Cul de Sac: Stories (Book);Kennedy, Louise (Author)"
55,A writer and artist finds a path out of pain in the stacks of a library.,,2023-12-08T10:03:48+0000,article,Books,News,"A Graphic Tribute to Paula Fox, Therapy and the Power of Doing","Fox, Paula"
56,"Interest rate increases have taken the edge off labor demand, but unemployment dipped in November, and wages rose more than expected.","The U.S. economy continued to pump out jobs in November, suggesting there is still juice left in a labor market that has been slowing almost imperceptibly since last year’s pandemic rebound.",2023-12-08T10:03:50+0000,article,Business Day,News,U.S. Job Growth Holds Up as Economy Gradually Cools,Labor and Jobs;Strikes;Layoffs and Job Reductions;Hiring and Promotion;Wages and Salaries;Unemployment;United States Economy;Labor Department (US)
57,Did you follow the news this week? Take our quiz to see how well you stack up with other Times readers.,Did you follow the news this week? Take our quiz to see how well you stack up with other Times readers.,2023-12-08T10:03:53+0000,multimedia,Briefing,Interactive Feature,"The New York Times News Quiz, Dec. 8, 2023",Content Type: Quiz
58,Paola Cortellesi’s directorial debut is kindling discussions about domestic violence and women’s rights. It’s also become one of Italy’s highest-grossing films.,"A movie centered on domestic abuse isn’t an obvious crowd-pleaser, even when directed by and starring one of Italy’s most popular performers.",2023-12-08T10:03:56+0000,article,Movies,News,"A Beloved Comedian’s Film on Domestic Abuse Draws Italians, in Droves","Movies;Domestic Violence;Women's Rights;Cortellesi, Paola;Italy"
59,Set yourself up for all the merriment and none of the hangovers.,"Jancee Dunn is out this week. I’m Alisha Haridasani Gupta, a reporter on the Well desk, filling in today.",2023-12-08T10:03:56+0000,article,Well,News,4 Tips for Booze-Free Holiday Fun,internal-sub-only-nl;New Year;Content Type: Service;Holidays and Special Occasions
60,"Colleges have discovered the virtues of free speech only now, when the speech in question hurts Jews.","The presidents of Harvard, the Massachusetts Institute of Technology and the University of Pennsylvania testified before a House committee on Tuesday about the state of antisemitism on their campuses. It did not go well for them.",2023-12-08T10:03:57+0000,article,Opinion,Op-Ed,"Campus Antisemitism, Free Speech and Double Standards","Colleges and Universities;Freedom of Speech and Expression;Anti-Semitism;ACADEMIC FREEDOM;Harvard University;Massachusetts Institute of Technology;University of Pennsylvania;Gay, Claudine;Kornbluth, Sally A;Magill, Elizabeth"
61,"A selection of entertainment highlights this weekend, including the film “Poor Things.”","A selection of entertainment highlights this weekend, including the film “Poor Things.”",2023-12-08T10:03:57+0000,multimedia,Arts,Interactive Feature,5 Things to Do This Weekend,"Art;Movies;Computer and Video Games;Museums;Music;Nintendo Switch (Video Game System);Comedy and Humor;Inkle Ltd;Metropolitan Museum of Art;Terminal 5 (Manhattan, NY, Music Venue);Andre, Eric;Dafoe, Willem;Ruffalo, Mark;Stone, Emma;New York City;A Highland Song (Video Game)"
62,"Like the Cybertruck, this podcast is bulletproof.",Warning: this episode contains strong language.,2023-12-08T10:03:58+0000,article,Podcasts,News,"Google’s Next Top Model, Will the Cybertruck Crash? and This Week in A.I.","Science and Technology;Google Inc;Artificial Intelligence;Tesla Motors Inc;Musk, Elon;Panera Bread Company;Amazon.com Inc;Pichai, Sundar;Hassabis, Demis"
63,"Selected paperbacks from the Book Review, including titles by Dan Jones, Gaito Gazdanov, Ashleigh Bell Pedersen and more.","Selected paperbacks from the Book Review, including titles by Dan Jones, Gaito Gazdanov, Ashleigh Bell Pedersen and more.",2023-12-08T10:03:58+0000,multimedia,Books,Interactive Feature,6 Paperbacks to Read This Week ,Books and Literature;Child Abuse and Neglect;Crocodiles;Driverless and Semiautonomous Vehicles;Automobiles;Russian Language;Nineteen Hundred Twenties;Pesticides;Russia;Normandy (France)
64,The nonpartisan race to lead the nation’s fourth-largest city ends Saturday in a runoff between two longtime Democrats who have sparred over public safety.,"Leonard Wickers, a 73-year-old carpenter, took a break from building a new house in South Houston to cast a ballot during early voting this week for the city’s mayoral runoff election.",2023-12-08T10:04:37+0000,article,U.S.,News,Republican Voters May Decide Mayor’s Race in Democratic Houston,"Houston (Tex);Elections, Mayors;Jackson Lee, Sheila;Whitmire, John;Democratic Party;Republican Party;Campaign Finance;Polls and Public Opinion;Race and Ethnicity;Black People;Blacks;Hispanic-Americans;Crime and Criminals;Politics and Government"
65,Politicians used to feel shame over their scandals. Not anymore.,"Scandal, it seems, no longer stops politicians in their tracks.",2023-12-08T10:04:38+0000,article,Opinion,Op-Ed,"Sex, Money and Hypocrisy: The Recipe for a Scandal","audio-neutral-informative;United States Politics and Government;Ethics and Official Misconduct;Santos, George (1988- );Trump, Donald J;Nixon, Richard Milhous;Clinton, Bill"
66,Personal reflections abound in our critic’s picks for the best albums of 2023.,"The Times’s chief pop music critic, Jon Pareles, runs through some of his favorite albums of 2023:",2023-12-08T10:04:40+0000,article,Podcasts,News,Our Critic’s Favorite Pop Albums of 2023,"Culture (Arts);Music;SZA (Singer);Karol G (Singer);boygenius (Music Group);Simon, Paul;Rodrigo, Olivia (2003- )"
67,"Nimrod Novik, a former adviser to Shimon Peres, discusses how Israel could work toward a two-state solution.","Before Oct. 7, Israel appeared to many to be sliding into a “one-state reality,” where it had functional control over Gaza and the West Bank, but the Palestinians who lived there were denied full rights. In 2021, a group of hundreds of former senior defense and diplomatic officials in Israel published a report warning that this was a catastrophe — for Israel’s security, its democratic values, its international standing, and its very soul. And they argued that there was another way, that even without a Palestinian “partner for peace,” there was a huge amount Israel could do on its own to create the conditions for a two-state solution to emerge in the future.",2023-12-08T10:04:41+0000,article,Opinion,Op-Ed,A Different Path Israel Could Have Taken — and Maybe Still Can,"Novik, Nimrod;Israel-Gaza War (2023- );Peace Process;Israel;Defense and Military Forces;Peres, Shimon;Palestinians;Gaza Strip;West Bank;audio-neutral-informative"
68,"Ajay Banga, who took over the top job in June, has prioritized global warming issues in his first months on the job.","For years now, heads of state and government, academics and development experts have been calling on the World Bank to lead in the fight against climate change.",2023-12-08T10:04:44+0000,article,Business Day,News,The New World Bank Leader Has the Climate Crisis at the Top of His Agenda,"World Bank;Banga, Ajay;Global Warming;Greenhouse Gas Emissions;Developing Countries;Poverty;Banking and Financial Institutions;United Nations Framework Convention on Climate Change"
69,"Here are the year’s most notable picture, chapter and middle grade books, selected by our children’s books editor.","Alexander’s free verse and Coulter’s multitextured imagery, combining sculpture with painting and drawing, channel the story of Black Americans through a Black teacher grappling with how to honestly teach the hard history of slavery to her students.",2023-12-08T10:04:57+0000,article,Books,Review,The Best Children’s Books of 2023,"Two Thousand Twenty Three;Books and Literature;Children and Childhood;genre-books-childrens;An American Story (Book);Alexander, Kwame;Coulter, Dare;Big (Book);Harrison, Vashti;Smith, Sydney (Illustrator);Say, Allen;There Was a Party for Langston: King o' Letters (Book);Reynolds, Jason (Author);Pumphrey, Jerome;Pumphrey, Jarrett;Grimes, Nikki;Pinkney, Jerry;Pinkney, Brian;What If One Day... (Book);Handy, Bruce;Corrin, Ashleigh;The Skull: A Tyrolean Folktale (Book);Klassen, Jon;Croft, Jennifer;Alebrijes (Book);Higuera, Donna Barba;Alvarez, David (1994- );Big Tree (Book);Selznick, Brian;Eggers, Dave;Harris, Shawn (Artist);Piumini, Roberto;Janeczko, Leah;Martin, Pedro (Author);Woodson, Jacqueline;The Storyteller (Book);Hobson, Brandon (Author);Hatke, Ben;Lowry, Lois"
70,"Rory Stone, a Scottish cheesemaker, claims to have made the world’s stinkiest cheese. Customers can’t get enough.","There is a cheese that may stand alone. In proud fetidness, that is.",2023-12-08T10:18:18+0000,article,World,News,This May Be the World’s Smelliest Cheese,Cheese;Smells and Odors;Scotland;Supermarkets and Grocery Stores;Asda Stores Ltd;Great Britain
71,Hear the news in five minutes.,"The New York Times Audio app is home to journalism and storytelling, and provides news, depth and serendipity. If you haven’t already, download it here — available to Times news subscribers on iOS — and sign up for our weekly newsletter.",2023-12-08T11:00:10+0000,article,Podcasts,News,"Hunter Biden’s New Charges, and a Weight-Loss Surgery ‘Factory’",
72,What started as unwavering support has given way to growing skepticism and sometimes open disapproval.,"As the cease-fire in Gaza has ended and the fierce fighting there has resumed, the United States has issued sharper warnings to Israel’s leaders that they have a responsibility to avoid civilian casualties.",2023-12-08T11:00:16+0000,article,Podcasts,News,Biden Is Trying to Rein In Israel. Is It Working?,"Politics and Government;Palestinians;Presidential Transition (US);Hamas;Biden, Joseph R Jr;Gaza Strip;Israel"
73,The Iranian-backed militia in Yemen has launched drone and missile attacks on Israeli and American targets. American officials fear the group could go too far and incite a wider war.,"The Houthis, Iranian-backed rebels in Yemen who have launched recent drone and missile attacks on Israeli and American targets, are emerging as an unpredictable and dangerous wild card in the Middle East — the proxies that Iran considers most suited to widening the war with Israel.",2023-12-08T11:12:01+0000,article,World,News,Iran Looks to Houthi Proxies to Escalate Fight With Israel,Israel-Gaza War (2023- );Israel;Defense and Military Forces;Iran;Terrorism;Houthis;Hamas;Hezbollah;Yemen;United States Defense and Military Forces
74,We look at the recent history of A.I. and what to expect for the industry.,"Just before Thanksgiving, a Silicon Valley giant appeared to implode before our eyes. A boardroom coup at OpenAI, the world’s hottest artificial intelligence company, pushed out its charismatic leader, Sam Altman.",2023-12-08T11:31:14+0000,article,Briefing,briefing,The Race to Dominate A.I.,"internal-storyline-no;Altman, Samuel H;OpenAI Labs;Artificial Intelligence"
75,"The announcement was long expected after the Constitution was amended in 2020, effectively allowing the Russian leader to stay in power until 2036.","President Vladimir V. Putin said on Friday that he would run for re-election in March, seeking a fifth term, which would extend his rule to 2030 and, if served to completion, make him Russia’s longest-serving leader since Catherine the Great in the late 18th century.",2023-12-08T11:38:37+0000,article,World,News,"Putin, Bidding to Cement His Legacy, Will Seek Re-election as President","Politics and Government;Russian Invasion of Ukraine (2022);Elections;Putin, Vladimir V;Russia"
76,"This month’s picks embrace the holiday season, including an installment of the “Diary of a Wimpy Kid” franchise and a remake of “The Velveteen Rabbit.”","The latest release in Jeff Kinney’s mega-successful “Diary of a Wimpy Kid” franchise of books, movies and merchandise (Tote bags! Board games! Stress balls!) is this animated holiday tale in which a middle schooler, Greg Heffley (voiced by Wesley Kimmel from “The Mandalorian”), gets trapped in his house with his family when a blizzard blows into town. Just before he got snowed in, Greg and his BFF, Rowley (Spencer Howell), accidentally damaged a snowplow after sending a giant snowball rolling down a hill. Greg and Rowley flee the scene, and Greg spends his time cooped up worrying that he’ll be caught by the authorities and won’t get the video game he covets for Christmas. Luke Cormican (“Teen Titans Go!”) directed this animated film, and Kinney wrote the screenplay. There’s enough humor, tension and relatable family dynamics to keep both longtime “Wimpy Kid” fans and little ones who are new to the series entertained.",2023-12-08T12:00:07+0000,article,Movies,News,5 Children’s Movies to Stream Now,Movies;Children and Childhood;A Christmas Mystery (Movie)
77,Do you dance as much as you can or want to? Do you wish you did it more?,When was the last time you danced?,2023-12-08T12:24:41+0000,article,The Learning Network,News,Do You Like to Dance?,
78,"President Biden has welcomed Israel’s decision to allow some more fuel into Gaza, the White House said, but he stressed during a call with Prime Minister Benjamin Netanyahu on Thursday that more aid was urgently needed and called for corridors to allow people to flee for safer areas.","President Biden has welcomed Israel’s decision to allow some more fuel into Gaza, the White House said, but he stressed during a call with Prime Minister Benjamin Netanyahu on Thursday that more aid was urgently needed and called for corridors to allow people to flee for safer areas.",2023-12-08T12:34:10+0000,article,World,News,Biden urges more humanitarian aid for Gaza in a call with Netanyahu.,
79,"Emma Stone’s Whitney is constantly “on,” but this week’s installment offers a tiny peek into what is really going on inside her head.","Emma Stone’s performance as Whitney so far has been a master class in, well, performance. Whitney is a person who is nearly constantly “on.” She’s always trying to say and do what she perceives as correct in both her business and her relationship with Asher. It’s hard to tell if she ever really says what she means. Occasionally, Stone gets a glint behind her eyes that might suggest Whitney’s true feelings, but then she shakes it off, smiles, and goes on performing.",2023-12-08T12:41:46+0000,article,Arts,News,"‘The Curse’ Season 1, Episode 5 Recap: Performance Art",Television;The Curse (TV Program)
80,"Baked Brie, jalapeño poppers, sweet spiced pecans and, yes, figgy pudding.",Good morning. Hanukkah got underway last night; Christmas is looming and Kwanzaa’s right on its heels. In less than a month we’ll be in 2024. It’s the season of holiday parties. Be in good cheer.,2023-12-08T13:00:04+0000,article,Food,Letter,We Won’t Go Until We Get Some,Cooking and Cookbooks;Content Type: Service
81,"The heads of Harvard, M.I.T. and the University of Pennsylvania are under pressure after testifying to Congress about antisemitism on campus.","The leaders of Harvard, M.I.T. and the University of Pennsylvania face increasing pressure after their disastrous testimony before Congress this week regarding antisemitism on college campuses. At issue: their legalistic responses on whether students calling for the genocide of Jews should be disciplined. (Liz Magill of Penn and Claudine Gay of Harvard later apologized for their testimony.)",2023-12-08T13:06:43+0000,article,Business Day,News,Corporate Bosses Turn Up the Heat on University Presidents,Anti-Semitism;Harvard University;University of Pennsylvania;Massachusetts Institute of Technology
82,"Amy Hau, who rose through the ranks of the Noguchi Museum, returns to take the helm as it prepares for a campus expansion.","The Noguchi Museum in New York announced Friday that Amy Hau would be its next director. Hau, 59, currently the managing partner of the architecture and urban design firm WXY, is returning to the institution where she began her career, in 1986, as the assistant to the Japanese American sculptor Isamu Noguchi, who synthesized Eastern and Western influences and modernism with a respect for nature. She helped steward the museum, in Long Island City, Queens, for almost three decades after Noguchi’s death in 1988.",2023-12-08T13:30:11+0000,article,Arts,News,Noguchi Museum Selects Female Director With Deep Roots in Queens,"Museums;Art;Sculpture;Appointments and Executive Changes;Asian-Americans;Content Type: Personal Profile;Hau, Amy (Museum Executive);Noguchi Museum;Long Island City (Queens, NY);Queens (NYC)"
