,abstract,lead_paragraph,pub_date,document_type,section_name,type_of_material,headline,keywords
87,"With pledges already lagging badly for this year, the global organization said that it had been forced to pare down its request for 2024 to focus on only the most life-threatening cases.","The United Nations has cut its appeal for humanitarian aid in the coming year by nearly 20 percent, saying that it has to focus on only the most urgent cases, even as the number of people facing conflict and climate emergencies grows sharply.",2023-12-11T17:53:27+0000,article,World,News,"Despite Wars, Earthquakes and Hurricanes, U.N. Cuts Appeal for Aid","United Nations;International Relations;Global Warming;Disasters and Emergencies;Politics and Government;Refugees and Displaced Persons;Humanitarian Aid;Griffiths, Martin"
88,"As part of its New York City Center season, Alvin Ailey American Dance Theater presents premieres by Amy Hall Garner and Elizabeth Roxas-Dobrish.","The dancers don’t so much step onto the stage in Amy Hall Garner’s “Century” as burst within it like a glitter bomb, showering the space in pink and gold. For “Century,” her first work for Alvin Ailey American Dance Theater, performed on Friday at New York City Center, it’s clear that Garner doesn’t merely know a party when she sees one — she knows how to dream one up. A metallic curtain hangs in the back as dancers, looking like fuchsia flowers, vibrate from their shoulders to their feet like petals caught in a breeze.",2023-12-11T17:56:23+0000,article,Arts,News,Ailey Looks Back to Black Joy and Longing With 1930s Jazz,"Dancing;Ailey, Alvin, American Dance Theater;New York City Center Theater;Rebirth Brass Band;Garner, Amy Hall;Century (Dance);Revelations (Dance);Roxas-Dobrish, Elizabeth"
89,"The special counsel, Jack Smith, urged the justices to move with exceptional speed, and they quickly agreed to fast-track the first phase of the case.","Jack Smith, the special counsel prosecuting former President Donald J. Trump on charges of plotting to overturn the 2020 election, asked the Supreme Court on Monday to rule on Mr. Trump’s argument that he is immune from prosecution. The justices quickly agreed to fast-track the first phase of the case.",2023-12-11T18:09:41+0000,article,U.S.,News,Special Counsel Asks Supreme Court to Decide if Trump Is Immune From Prosecution,"Smith, Jack (Attorney);Federal Criminal Case Against Trump (2020 Election Case);Trump, Donald J;Supreme Court (US);Immunity from Prosecution;Presidential Election of 2024;Presidential Election of 2020;United States Politics and Government"
90,"On “Pink Friday 2,” the rapper remains a star navigating hip-hop on sometimes untested terms. But even as she’s receded from the center of the genre, her lessons remain.","Before the arrival of Nicki Minaj in the late 2000s, only a handful of female rappers had ever released platinum solo albums: Lauryn Hill, Missy Elliott, Lil’ Kim, Foxy Brown, Da Brat, Eve. Despite their innovations and artistry — or maybe because of them — the genre had narrow expectations and accommodations for the expression of women, and often pitted them against each other, as if the space for anyone but men was zero-sum.",2023-12-11T18:10:05+0000,article,Arts,Review,"Nicki Minaj, a Role Model for Herself, and Others","Rap and Hip-Hop;Minaj, Nicki"
91,"‘The Taste of Things’ with Juliette Binoche, a nonalcoholic sparkler in a magnum, holiday stollens and more food news.","“The Taste of Things,” a French food film, will be shown in theaters this week in order to qualify for the Oscars and to make you really, really hungry. The 145-minute film by Tran An Hung, starring Juliette Binoche and Benoit Magimel, is based on the 1920 novel “The Life and Passion of Dodin-Bouffant, Gourmet” by Marcel Rouff, inspired by the French gastronome Jean Anthelme Brillat-Savarin, who gave his name to a cheese and a cake. The film is set at a modest château in the Loire region, the centerpiece of which is the robust kitchen where Dodin-Bouffant and his cook, Eugénie, prepare sumptuous meal after meal for Dodin’s small coterie of gourmands, as their own love story gently simmers. The pièce de résistance is a classic pot-au-feu. The chef Pierre Gagnaire was the consultant for the cooking, and in an interview in New York he said “everything is real; there was no faking.” (Not quite: There was backup gas fuel for the wood-burning stove, and small quail stood in for ortolans, a delicacy that is illegal.) He said the stars knew how to cook and “jumped right in.” Ms. Binoche told me that the food “haute cuisine but not pretentious.”  From Dec. 13 through 20, there will be a menu at Frenchette, in TriBeCa, with three dishes from “The Taste of Things”: a ballotine of duck, pot-au-feu and baked Alaska ($90 or à la carte). ",2023-12-11T18:10:57+0000,article,Food,News,No Ortolans Were Hurt During the Making of This Film,Cooking and Cookbooks;Food;Movies
92,"For months, donors waged a campaign against the president and the chairman of the board. After the hearings on antisemitism, a dissident group of trustees had seen enough.",The dissident trustees of the University of Pennsylvania’s board had decided to meet in secret over the weekend.,2023-12-11T18:17:05+0000,article,U.S.,News,Inside the Chaotic Struggle for Power at Penn,"Magill, Elizabeth;University of Pennsylvania;Israel-Gaza War (2023- );Colleges and Universities;Anti-Semitism;Boards of Directors;Bok, Scott L;Rowan, Marc J;Shapiro, Josh (1973- );Philadelphia (Pa);Freedom of Speech and Expression"
93,"The eight-member boy band debuts atop the Billboard 200 this week, following Tomorrow X Together, NewJeans and Stray Kids.","This week on the music charts, Ateez becomes the latest K-pop act to score the top album with a menu of collectible packages, while Brenda Lee’s 65-year-old chestnut “Rockin’ Around the Christmas Tree” holds as the No. 1 single on her 79th birthday.",2023-12-11T18:38:22+0000,article,Arts,News,Ateez Is the Fourth K-Pop Group With a No. 1 Album in 2023,"Pop and Rock Music;K-Pop;Lee, Brenda;Rockin' Around the Christmas Tree (Song);Ateez (Music Group)"
94,Gov. Ron DeSantis escalated his attacks on the former president after Mr. Trump bragged about debating Hillary Clinton in 2016.,Gov. Ron DeSantis of Florida accused former President Donald J. Trump of “cowardice” for refusing to participate in the Republican presidential primary debates after Mr. Trump boasted about facing Hillary Clinton in 2016 following the release of the “Access Hollywood” tape.,2023-12-11T18:52:30+0000,article,U.S.,News,DeSantis Accuses Trump of ‘Cowardice’ for Refusing to Debate Rivals,"Presidential Election of 2024;United States Politics and Government;DeSantis, Ron;Trump, Donald J;Republican Party;Primaries and Caucuses;Debates (Political)"
95,"Octogenarian athletes are not completely unheard-of in ultrarunning, but Maros Mosehla’s speed has made him a local legend.","On June 11, Maros Mosehla lined up with 16,000 other runners on the start line of the Comrades, a 56-mile footrace that began outside the red brick City Hall in Pietermaritzburg, South Africa. Mosehla, a wispy runner, 5 feet 2 inches tall, did not stand out from the crowd of athletes who had gathered to run just farther than the equivalent of two marathons through the misty winter morning.",2023-12-11T19:00:16+0000,article,Sports,News,‘I Refuse to Be Old’: The 81-Year-Old Runner Who Became a South African Celebrity,"Ultramarathon Running;Elderly;Mosehla, Maros;South Africa;Content Type: Personal Profile"
96,The author and L.G.B.T.Q. rights advocate will take the helm of the free expression organization at a time when challenges to books and to free speech are on the rise.,"Jennifer Finney Boylan, an author and L.G.B.T.Q. rights advocate, was elected on Monday president of PEN America, one of the most significant organizations defending free speech in the country. She will lead the PEN board of trustees at a time when challenges to books and free expression are on the rise.",2023-12-11T19:01:41+0000,article,Books,News,Jennifer Finney Boylan to Lead PEN America,"Freedom of Speech and Expression;Book Bans;Books and Literature;Writing and Writers;Boylan, Jennifer Finney;PEN American Center;Appointments and Executive Changes"
97,"The NASA astronaut Frank Rubio grew a tomato in space, but then it disappeared. Suspicion trailed Mr. Rubio for months, but he was proved innocent.","The NASA astronaut Frank Rubio returned to Earth in September after completing the longest single spaceflight for an American astronaut and had to confront one small, red mark on his legacy: He had lost a tomato somewhere in the International Space Station.",2023-12-11T19:13:44+0000,article,Science,News,"Space Station to Earth: Houston, We Have Found the Tomato","International Space Station;Tomatoes;National Aeronautics and Space Administration;Moghbeli, Jasmin;Rubio, Frank (1975- )"
98,"The 1970s-era dish made with pistachio pudding mix, canned pineapple and mini marshmallows has caught the curious eye of the TikTok generation.","At an office Thanksgiving potluck in Dallas last month, employees showed off their home cooking (and their catered shortcuts): There was spicy mac and cheese and roasted brussels sprouts, candied bacon and gumbo.",2023-12-11T19:20:56+0000,article,Food,News,Watergate Salad Makes a Comeback,"Food;TikTok (ByteDance);Watergate Affair;Cooking and Cookbooks;Pudding;Social Media;Kraft Foods Group Inc;Shapiro, Laura (Journalist)"
99,"He served as Manhattan borough historian from 1997 to 2005. He also dug deeply into the history of Seneca Village, a mostly Black settlement in what became Central Park.","One day last year, Celedonia Jones, a charismatic, self-educated historian, stood on a patch of land in Manhattan that in the 19th century was within Seneca Village, a largely Black community of about 300 people that would become part of Central Park.",2023-12-11T19:35:28+0000,article,New York,Obituary (Obit),"Celedonia Jones, Self-Educated New York Historian, Dies at 93","Jones, Celedonia (1930-2023);History (Academic Subject);Race and Ethnicity;Central Park (Manhattan, NY);New York City;Seneca Village (Manhattan, NY);Deaths (Obituaries)"
100,"The principle is highly valued by many at American universities, but critics say it is sometimes invoked to dodge repercussions.","The petition that emerged on Sunday as Claudine Gay, the president of Harvard University, faced escalating pressure to resign took only two sentences to make its case to the institution’s leaders.",2023-12-11T19:59:08+0000,article,U.S.,News,Why Defenders of Harvard’s President Are Focused on Academic Freedom,"Colleges and Universities;ACADEMIC FREEDOM;Israel-Gaza War (2023- );Conservatism (US Politics);American Assn of University Professors;Harvard University;Gay, Claudine"
101,"Central bankers are plowing ahead with the technology, but the potential for backlash is high.","The world’s central banks are moving briskly, and it would seem inexorably, toward introducing digital forms of cash. But I think they are underestimating the backlash from people who worry that digital currencies issued by central banks will become instruments of government control over their lives.",2023-12-11T20:00:02+0000,article,Opinion,Op-Ed,Skepticism of Digital Currency Needs to Be Taken Seriously,"internal-sub-only-nl;Federal Reserve System;European Central Bank;People's Bank of China;Banking and Financial Institutions;Privacy;DeSantis, Ron;Ramaswamy, Vivek (1985- )"
102,"Hours before the ruling, a group representing the woman, whose fetus received a fatal diagnosis, said she was leaving Texas for an abortion.","The Texas Supreme Court on Monday overturned a lower court order allowing an abortion for a pregnant woman whose fetus was diagnosed with a fatal condition, hours after her lawyers said she had decided to leave Texas for the procedure in the face of the state’s abortion bans.",2023-12-11T20:14:18+0000,article,U.S.,News,Texas Supreme Court Rules Against Woman Who Sought Court-Approved Abortion,"Abortion;Cox, Kate (1992- );Paxton, Ken;Texas;Supreme Courts (State);Dobbs v Jackson Women's Health Organization (Supreme Court Decision);Suits and Litigation (Civil);Decisions and Verdicts"
103,Monika Sprüth and Philomene Magers built one of the art world’s most powerful businesses by not following conventional wisdom.,"For several weeks this past autumn, a fashionably dressed woman could be seen in the window of a London art gallery stooping to pick up a half-dozen designer shopping bags. A digital print on a mirror made by the artist Sylvie Fleury, the woman was permanently frozen in the act, her bare midriff impervious to the rain outside. A collection of real bags on the floor before her doubled the optical illusion for passers-by, who might have been carrying their own bags from the nearby Versace or Dolce & Gabbana stores. But the gallery, Sprüth Magers, is not the kind of place where most people can casually drop in and buy something; the artworks sold there fetch prices in the tens to the hundreds of thousands. If Fleury’s work poked fun at the view that art is just a commodity, it was also a nostalgic reflection on the moment the empty shopping bags were first shown by the gallery, in 1991 — a time when neither she nor her dealers could have afforded a permanent storefront in Mayfair.",2023-12-11T20:22:59+0000,article,T Magazine,News,The Gallery That Has Never Lost an Artist,"Art;Spruth Magers (Berlin, Germany, Gallery);Berlin (Germany);Holzer, Jenny;Kruger, Barbara;Imhof, Anne"
104,"Yale University leaders, elected officials and pro-Palestinian activists said the brief action during a weekend protest crossed a line.","Yale University leaders, elected officials and clergy in New Haven, Conn., condemned what they called the desecration of a public Hanukkah menorah after a protester briefly hung a Palestinian flag from it over the weekend.",2023-12-11T20:30:53+0000,article,New York,News,Yale Condemns Hanging of Palestinian Flag on New Haven Menorah,"Demonstrations, Protests and Riots;Colleges and Universities;Palestinians;Flags, Emblems and Insignia;Anti-Semitism;Police Department (New Haven, Conn);Yale University;Salovey, Peter;Blumenthal, Richard"
105,State and local leaders are proposing to roll back part of the nation’s pioneering drug decriminalization law and step up police enforcement.,"After years of rising overdoses and an exodus of business from central Portland, Gov. Tina Kotek of Oregon said on Monday that state and city officials are proposing to roll back a portion of the nation’s most wide-ranging drug decriminalization law in a bid to revive the troubled city.",2023-12-11T20:41:26+0000,article,U.S.,News,"To Revive Portland, Officials Seek to Ban Public Drug Use","Drug Abuse and Traffic;Law and Legislation;Portland (Ore);Kotek, Tina;Oregon"
106,"A week after declaring a drive to organize nonunion automakers, the United Automobile Workers union filed charges against three foreign manufacturers.","The United Automobile Workers union accused three foreign automakers on Monday of unfair labor practices, asserting that they had interfered with efforts by employees to build support for the union at U.S. plants.",2023-12-11T20:50:38+0000,article,Business Day,News,"U.A.W. Accuses Honda, Hyundai and Volkswagen of Labor Violations","United Automobile Workers;Hyundai Motor Co;Honda Motor Co Ltd;Volkswagen AG;Fain, Shawn;Workplace Hazards and Violations;National Labor Relations Board;Organized Labor;Automobiles"
107,A fight over an expiring national security law descended into disorder on the eve of an expected vote on rival bills to reauthorize and overhaul it.,"The House scrapped votes on rival bills late Monday that would narrow the scope of a powerful surveillance tool after an ugly fight broke out among Republicans, likely punting until next year on plans to renew but also limit an expiring wiretapping law at the heart of the program.",2023-12-11T20:58:06+0000,article,U.S.,News,House Plan to Vote on Extension of Disputed Surveillance Law Collapses,"Surveillance of Citizens by Government;United States Politics and Government;Espionage and Intelligence Services;Privacy;Foreign Intelligence Surveillance Act (FISA);Federal Bureau of Investigation;House Committee on Intelligence;House Committee on the Judiciary;House of Representatives;Senate;Johnson, Mike (1972- )"
108,"In this lesson, students will learn about the dangers of noise in daily life, and the health risks excessive noise can pose. Then, they will document the noise levels in their own communities.",Featured article: “Noise Could Take Years Off Your Life. Here’s Why.”,2023-12-11T21:01:11+0000,article,The Learning Network,News,Lesson Plan: ‘Noise Could Take Years Off Your Life. Here’s Why.’,
109,"Plus, the debate over who’s a “colonizer.”","Top Israeli officials have warned that increased Hezbollah attacks on northern Israel carried out from Lebanon could prompt a powerful response, as Israeli troops waged street battles against Hamas in Gaza. ",2023-12-11T21:09:21+0000,article,Briefing,briefing,Tuesday Briefing: An Israeli Warning to Hezbollah,
110,"Starting on the stove, then finishing in a low oven, ensures rosy meat with charred crusts, Genevieve Ko writes.","There’s an undeniable urge to roar — or at least growl — when setting a thick steak into a ripping hot pan. Hearing the hard hiss of the sizzling fat is satisfaction enough, but then the smell of charred meat follows fast, and it’s pure pleasure from there.",2023-12-11T21:12:38+0000,article,Food,News,The Best Way to Cook Steak for Holiday Parties,Cooking and Cookbooks;Recipes;Beef;Holidays and Special Occasions;Parties (Social);Christmas;internal-open-access
111,"After 14 years, a new interview suggests this dispute may keep giving us new chapters.",Alexander Hamilton and Aaron Burr. Joan Crawford and Bette Davis. Optimus Prime and Megatron.,2023-12-11T21:21:14+0000,article,Arts,News,Bad Blood: A Timeline of the Swift-West-Kardashian Feud,"Swift, Taylor;West, Kanye;Kardashian, Kim;Celebrities;Pop and Rock Music;Rap and Hip-Hop;MTV Video Music Awards;Famous (Song);1989 (Album);The Life of Pablo (Album);Reputation (Album)"
112,"Cold, wet weather combined with a lack of clean water, toilets and food have fueled a spike in respiratory, stomach and other ailments, and the sick are left struggling to recover, health officials say.","Infectious diseases are ravaging the population of Gaza, health officials and aid organizations said on Monday, citing cold, wet weather; overcrowding in shelters; scarce food; dirty water; and little medicine.",2023-12-11T21:39:28+0000,article,World,News,‘We Are All Sick’: Infectious Diseases Spread Across Gaza,Israel-Gaza War (2023- );Palestinians;Refugees and Displaced Persons;World Health Organization;Gaza Strip;Shortages;Disease Rates;Israel
113,The Biden administration said it would be asking questions about reports of Israel illegally using white phosphorus in Lebanon in October. Israel denied the claims.,The Biden administration said on Monday that it is looking into reports by Amnesty International and The Washington Post that Israel used white phosphorus supplied by the United States in violation of international law.,2023-12-11T21:51:30+0000,article,World,News,U.S. Raises Concern Over Israel’s Possible Use of U.S.-Supplied White Phosphorus,"Israel;Gaza Strip;Biden, Joseph R Jr;Kirby, John F;AMNESTY INTERNATIONAL;Washington Post;White Phosphorus;Israel-Gaza War (2023- )"
114,"The country’s lower house of Parliament unexpectedly passed a motion to reject a government immigration reform bill, leaving its future uncertain.","President Emmanuel Macron of France suffered an unexpected setback on Monday as lawmakers brought his government’s immigration overhaul bill to a screeching halt, casting fresh doubts on his ability to get key legislation through Parliament.",2023-12-11T21:56:40+0000,article,World,News,Macron Suffers Surprise Setback Over Immigration in France,"France;Macron, Emmanuel (1977- );Immigration and Emigration;Darmanin, Gerald;Le Pen, Marine;National Rally (France);Politics and Government;Republicans, The (France);La Republique en Marche"
115,Give us your best advice.,"Every day in The Evening newsletter, we try to bring to readers a collection of stories, recipes and things to do at the end of the day that will help them wind down. Now, as we head into the busy holiday season, we’re looking for advice. We’re asking readers: Do you have a unique way of unwinding during the holidays?",2023-12-11T22:10:24+0000,article,New York,News,How Do You Unwind During the Holidays?,internal-reader-callout
116,"President Volodymyr Zelensky arrived in Washington at a critical moment, both on the battlefield and on Capitol Hill.","American and Ukrainian military leaders are searching for a new strategy that they can begin executing early next year to revive Kyiv’s fortunes and flagging support for the country’s war against Russia, according to U.S. and Ukrainian officials.",2023-12-11T22:11:01+0000,article,U.S.,News,U.S. and Ukraine Search for a New Strategy After Failed Counteroffensive,"Russian Invasion of Ukraine (2022);United States International Relations;United States Defense and Military Forces;Biden, Joseph R Jr;Ukraine;Zelensky, Volodymyr;Crimea (Ukraine);Odessa (Ukraine);Robotyne (Ukraine);Foreign Aid"
117,Firefighters found no victims after searching the debris left by the corner of the building that collapsed. Two people had minor injuries.,"Firefighters said they had searched the 12-foot-tall pile of debris left by the collapse of a seven-story building in the Bronx on Monday afternoon, and found that no one had died or been severely injured.",2023-12-11T22:11:33+0000,article,New York,News,No Deaths Reported After 7-Story Bronx Apartment Partially Collapses,"Accidents and Safety;Buildings (Structures);Morris Heights (Bronx, NY);Real Estate and Housing (Residential);Buildings Department (NYC)"
118,Global leaders and especially the U.S. government must understand we cannot save lives in Gaza under these conditions.,"We are no strangers to human suffering — to conflict, to natural disasters, to some of the world’s largest and gravest catastrophes. We were there when fighting erupted in Khartoum, Sudan. As bombs rained down on Ukraine. When earthquakes leveled southern Turkey and northern Syria. As the Horn of Africa faced its worst drought in years. The list goes on.",2023-12-11T22:16:30+0000,article,Opinion,Op-Ed,"We Are No Strangers to Human Suffering, but We’ve Seen Nothing Like the Siege of Gaza",Israel-Gaza War (2023- );Gaza Strip;Israel;Humanitarian Aid;Civilian Casualties;United States International Relations;Palestinians;Shortages
119,"Israeli forces were engaged in intense battles on Monday in Khan Younis, Jabaliya and Shajaiye.","With Israel pressing its offensive in Gaza, its forces were engaged in intense battles on Monday in three parts of the strip where Israeli officials believe Hamas militants still have strongholds.",2023-12-11T22:17:36+0000,article,World,News,A Closer Look at Three Hamas Strongholds Targeted by Israel,Israel-Gaza War (2023- );Hamas;Khan Younis (Gaza Strip);Jabaliya Refugee Camp (Gaza Strip)
120,Dr. Gay is the first Black president and second woman to lead Harvard. She faced calls for her removal over her testimony on antisemitism.,"The president of Harvard, Claudine Gay, will remain in her job, the university announced on Tuesday, despite demands for her resignation because of her testimony in a congressional hearing on campus antisemitism.",2023-12-11T22:23:43+0000,article,U.S.,News,"What to Know About Claudine Gay, Harvard’s Embattled President","Colleges and Universities;Anti-Semitism;Black People;Blacks;Jews and Judaism;Harvard Crimson;Gay, Claudine;Kornbluth, Sally A;Magill, Elizabeth;Pritzker, Penny"
121,"Tyler Anderson of Dover was jailed and the authorities seized firearms after tracking the threatening texts to his phone and home address, officials said.","Federal authorities arrested a New Hampshire man, charging him with threatening to kill Vivek Ramaswamy and his supporters, the Justice Department said on Monday.",2023-12-11T22:39:02+0000,article,U.S.,News,Man Accused of Sending Death Threats to Ramaswamy Is Arrested in New Hampshire,"Presidential Election of 2024;Republican Party;Threats and Threatening Messages;Ramaswamy, Vivek (1985- )"
122,"Also, Trump’s immunity argument heads to the Supreme Court. Here’s the latest at the end of Monday.","At Harvard, students, faculty, alumni and donors debated today over the future of the school’s leadership. Claudine Gay, the university’s president, was facing calls to resign after widely criticized comments she made last week about antisemitism on campus.",2023-12-11T22:41:47+0000,article,Briefing,News,Elite Universities Face Turmoil Over Antisemitism Concerns,
123,Two Georgia election workers are seeking as much as $43 million for false assertions from Rudolph Giuliani that they had sought to swing the 2020 outcome against Donald Trump.,"Rudolph W. Giuliani’s lawyer told jurors on Monday that the tens of millions of dollars in damages two Georgia election workers are seeking from him in a defamation suit “will be the end of Mr. Giuliani,” likening an award of that scale to a civil death penalty.",2023-12-11T22:43:52+0000,article,U.S.,News,"In Court With the Women He Defamed, Giuliani Faces Millions in Damages","Giuliani, Rudolph W;Presidential Election of 2020;Freeman, Ruby;Moss, Shaye;Howell, Beryl A;Trump, Donald J;Libel and Slander;Compensation for Damages (Law);Voter Fraud (Election Fraud)"
