,abstract,lead_paragraph,pub_date,document_type,section_name,type_of_material,headline,keywords
80,"Two YouTube hosts have built a following by dissecting the psychology of movie characters. Here, they analyze some of this summer’s familiar faces.","Is Indiana Jones better at burying his feelings than digging up priceless artifacts? How might Scarlett Johansson and Adam Driver’s characters in “Marriage Story” have better navigated divorce and co-parenting? Hey, wait a minute: Does the hero of “The Lego Batman Movie” contain all the building blocks of a narcissist?",2023-08-01T15:01:47+0000,article,Movies,News,These Characters Need Therapists. ‘Cinema Therapy’ Is Here for Them.,"Movies;Decker, Jonathan;Seawright, Alan (Film Director);Cinema Therapy (Web-Original Program);Barbie (Movie);Oppenheimer (Movie);Indiana Jones and the Dial of Destiny (Movie);Spider-Man: Across the Spider-Verse (Movie)"
81,"Capped off with a raspberry-nectarine icebox cake, this menu from David Tanis is cool enough for the hottest of days.","This August menu is essentially designed for beating the heat on seriously sweltering summer days, when ice-cold everything seems appropriate. We’re on the right track, I think, with a chilled soup, followed by a room-temperature vegetable salad and a dessert straight from the refrigerator.",2023-08-01T15:11:45+0000,article,Food,News,A Soup and Salad That Beat the Heat,Cooking and Cookbooks;Recipes;Summer (Season);Vegetables;Heat and Heat Waves
82,The energy company offset a slide in profit by raising its dividend by 10 percent.,"BP reported on Tuesday a sharp slide in profits in the second quarter, with earnings falling about 70 percent from the record-breaking totals of a year earlier. Adjusted profits were $2.6 billion, compared with $8.5 billion in the same period a year earlier, BP said.",2023-08-01T15:13:48+0000,article,Business Day,News,BP Reports Sharply Lower Earnings as Oil Prices Slide,"Oil (Petroleum) and Gasoline;Company Reports;Alternative and Renewable Energy;Natural Gas;Energy and Power;BP Plc;Looney, Bernard (1970- )"
83,"“Joe” Petrsoric, the longtime bartender at Broadway’s go-to saloon, is finally retiring.","In 1968, Sardi’s was still enjoying its decades-long heyday, commanding the limelight as Broadway’s foremost hub of show folk, from big shots to wannabes to poignant has-beens. Playwrights, agents, publicists and newspaper columnists vied for strategic tables in the restaurant’s dining room, trading artful glances, gossip, poisoned barbs and air kisses. Elated tourists, always an ingredient of the Sardi’s experience, basked in the presence of Groucho Marx or Liza Minnelli entering to applause, a Sardi’s tradition.",2023-08-01T15:30:29+0000,article,New York,News,Favorite Drinks of All the Top Stars? He Has Them Memorized.,"Bars and Nightclubs;Sardi's (Manhattan, NY, Restaurant);Content Type: Personal Profile;Restaurants;Croatia;internal-sub-only;Petrsoric, Josip (Joe);Midtown Area (Manhattan, NY);internal-open-access-from-nl"
84,"A former Gallaghers chef opens a sandwich shop, a wine series pops up at the Noortwyck, and more restaurant news.","What does owning restaurants have in common with flying? Both are risky endeavors, and both are Akram Nassir’s careers. He’s a captain for Delta Air Lines and has just opened another Yemen Café. While achieving his dream of becoming a pilot, he went into the restaurant business with his father and uncle. He still flies, weaving his schedule  with his restaurant duties. His father, Muthamma Nassir, was a chef at Windows on the World and opened the original Yemen Café in 1986 with a relative, Yahya Alsubai, on the stretch of Atlantic Avenue bordering Brooklyn Heights, a neighborhood clustered with Middle Eastern restaurants and shops. Akram Nassir says it was the first Yemeni restaurant in New York, if not the United States. In 2011, he opened another in Bay Ridge, Brooklyn. Now, he and his partner, Mr. Alsubai, have branched out to Staten Island. There, they will again serve a Middle Eastern community, he said. The latest Yemen Café, a spacious room with a traditional fishing boat hanging on one wall, has outdoor seating. As at the other locations, the specialty is lamb more than a dozen ways, notably slow-cooked, succulent falling-off-the-bone cuts like shanks and shoulder. There are also chicken dishes and Middle Eastern appetizers. ",2023-08-01T15:43:27+0000,article,Food,News,"Yemen Café, a Brooklyn Standby, Expands to Staten Island","Restaurants;Chefs;Yemen Cafe (Staten Island, NY, Restaurant);New York City"
85,Speaking with the actor was an entirely different experience than watching him play his career-defining character.,"Pee-wee Herman was noisy. He was boisterous. He had a voice that would shoot up several decibels without warning, whether he was inviting his TV viewers to play a game of connect the dots or interrogating his friends about the whereabouts of his missing bicycle. The mysterious nature of his character — was he supposed to be a man, a child or a man pretending to be a child? — seemed to excuse his exuberant energy and excessive volumes, and he, in turn, gave that same permission to his audience. Like he told us on “Pee-wee’s Playhouse,” his kids’ show that wasn’t really just for kids, “You all know what to do when anyone says the secret word, right?” That’s right: “Scream real loud!”",2023-08-01T15:51:26+0000,article,Arts,News,Pee-wee Herman Was Exuberant. Paul Reubens Was Almost Serene.,"Television;Reubens, Paul;Pee-wee's Playhouse (TV Program);Content Type: Personal Profile;Actors and Actresses"
86,"An entrepreneur saw what others didn’t and now owns the unused set of stairs, which are attached to the back of a suburban building.","Even by the standards of London’s white-hot real estate market, it was a property with seemingly limited appeal: an unused stairwell, attached to the back of a suburban building, next to a parking garage.",2023-08-01T15:57:06+0000,article,World,News,"A Stairway to Nowhere Sells for $32,000 in London",Auctions;Real Estate and Housing (Residential);London (England);Entrepreneurship
87,"With minimalist branding and a higher price point, the salt brand is now chasing after “the aspiring home chef.”","On a recent Friday morning, the cookbook author Molly Baz put the finishing touch on a new recipe for shingled tomato toast with sesame mayo. Reaching into a wooden salt cellar, she grabbed a three-finger pinch of salt and showered her dish.",2023-08-01T16:17:51+0000,article,Food,News,What Happened to Diamond Crystal Kosher Salt?,Salt;Cargill Inc;Cooking and Cookbooks;Shopping and Retail;Advertising and Marketing;Kosher Foods and Products;Restaurants;Morton Salt Inc
88,"Ms. Lacks’s family had accused Thermo Fisher Scientific of profiting from her cells, which have contributed to revolutionary advances in medicine, without seeking their permission.","Henrietta Lacks, a Black mother of five, was dying of cervical cancer in 1951, when doctors at Johns Hopkins Hospital in Baltimore took a sample of her cells without her knowledge or consent.",2023-08-01T16:18:54+0000,article,Science,News,Family of Henrietta Lacks Settles With Biotech Company That Used Her Cells,"Lacks, Henrietta;Thermo Fisher Scientific Inc;Black People;Blacks;Compensation for Damages (Law);Suits and Litigation (Civil);Medicine and Health;Research;Biotechnology and Bioengineering;Cervical Cancer;Johns Hopkins Hospital (Baltimore, Md);Johns Hopkins University"
89,A gunman who killed Muslim train passengers and a Hindu march that turned riotous underscore how the partisan stances of India’s top Hindu leaders have given license to chaotic elements in the country.,"In the early hours of Monday, on a train bound for Mumbai, India’s commercial capital, a police officer took up his service rifle, fatally shot his superior and then killed three unarmed passengers. All three of the passengers were Muslim men, according to Indian news reports.",2023-08-01T16:27:15+0000,article,World,News,"Under Hindu Nationalist Leaders, Sectarian Violence Flares in India","India;Religion-State Relations;Hinduism;Muslims and Islam;Discrimination;Murders, Attempted Murders and Homicides;Nationalism (Theory and Philosophy);Politics and Government;Adityanath, Yogi;Modi, Narendra;Demonstrations, Protests and Riots;Freedom of Religion"
90,"The former American Ballet Theater star now leads the Australian Ballet. “When I am faced with difficulties, I lean into them,” he said.","It was March 2020, and David Hallberg, who had weathered more than two years of injury and physical rehabilitation, was back in the saddle, rehearsing “Swan Lake” with Natalia Osipova at the Royal Opera House in London. Then the world shut down as the Covid-19 pandemic and lockdowns became a new reality. Hallberg, a resident guest principal at the Royal Ballet and a principal dancer with American Ballet Theater, saw his packed schedule of performances collapse like a house of cards.",2023-08-01T16:42:02+0000,article,Arts,News,David Hallberg’s New Job: Decision Maker,"Hallberg, David;Dancing;Australian Ballet;AMERICAN BALLET THEATER;Melbourne (Australia);Content Type: Personal Profile"
91,"The start-up’s innovative business model has helped some renters save for a down payment on their home, but others have walked away frustrated by the company.","The three-bedroom house in suburban Atlanta on a quiet cul-de-sac seemed exactly what Jeneyha Wheatley-Frett and her husband, Shawn Frett, were looking for when they moved in about 15 months ago with their three children.",2023-08-01T16:49:09+0000,article,Business Day,News,Divvy Wants to Make Rent-to-Own Deals Easy. Many Customers Find Them Hard.,Divvy Homes Inc;Suits and Litigation (Civil);Real Estate and Housing (Residential);Mortgages;Renting and Leasing (Real Estate);Customer Relations;Consumer Protection;Senate Committee on Banking;United States
92,"Voters continue to rate the president poorly on economic issues, but there are signs the national mood is beginning to improve.","President Biden and his aides are basking in what is arguably the best run of economic data to date in his presidency. Inflation is cooling, business investment is rising, job growth is powering on and surveys suggest rising economic optimism among consumers and voters.",2023-08-01T16:50:59+0000,article,U.S.,News,A Run of Strong Data Buoys Biden on the Economy,"Biden, Joseph R Jr;Polls and Public Opinion;United States Economy;United States Politics and Government;Inflation (Economics);Prices (Fares, Fees and Rates);Factories and Manufacturing;Labor and Jobs;American Rescue Plan (2021);Inflation Reduction Act of 2022;Presidential Election of 2024;New York Times/Siena College Poll;Recession and Depression;Federal Reserve System"
93,Readers write about older politicians. Also: Donald Trump vs. Jack Smith; the photo of a dead Russian soldier; an AIDS program; the freedom to read.,To the Editor:,2023-08-01T16:57:38+0000,article,Opinion,Letter,The Aging and Health of Our Leaders,"Age, Chronological;United States Politics and Government;Feinstein, Dianne;McConnell, Mitch;Biden, Joseph R Jr;Medicine and Health;Trump, Donald J;Smith, Jack (Attorney);Federal Criminal Case Against Trump (Documents Case);Justice Department;Russian Invasion of Ukraine (2022);Putin, Vladimir V;President's Emergency Plan for AIDS Relief;Republican Party;Libraries and Librarians;Reading and Writing Skills (Education);Freedom of Speech and Expression"
94,"It’s sale season for swimwear, a great time to upgrade your basic old go-to.","August might seem a little late to shop for swimsuits, but it’s also the time of year when many of us may finally be on vacation — and, hopefully, in or near a body of water.",2023-08-01T17:00:20+0000,article,Style,News,It’s Not Too Late to Buy a Great One-Piece Swimsuit,Bathing Suits and Swimwear
95,"Ms. Oliver, 71, was the first Black woman to hold statewide elected office there, after a long tenure in the General Assembly.","Sheila Y. Oliver, New Jersey’s lieutenant governor and the first Black woman to hold statewide elected office there, died on Tuesday after being rushed to the hospital the day before. She was 71.",2023-08-01T17:07:11+0000,article,New York,News,"Sheila Oliver, New Jersey’s Trailblazing Lieutenant Governor, Has Died","Oliver, Sheila Y;Deaths (Obituaries);Murphy, Philip D (1957- );New Jersey;Politics and Government;Governors (US)"
96,"Ousmane Sonko, a fiery figure with a loyal youth following, was charged with fomenting insurrection, and his party dissolved.","Senegal’s government has dissolved the country’s main opposition party and detained its leader on charges of fomenting insurrection, setting off a new round of protests in which two people were killed on Monday.",2023-08-01T17:22:30+0000,article,World,News,Deadly Protests in Senegal as Opposition Party Is Dissolved and Leader Detained,"Senegal;Demonstrations, Protests and Riots;Sonko, Ousmane;Sall, Macky;AFRICA"
97,"The group behind Ron DeSantis had more money than those backing his rivals, including Donald J. Trump. But big spending has not helped his standing so far.","The super PAC supporting the presidential campaign of Gov. Ron DeSantis of Florida spent nearly $34 million in recent months, pouring money into voter outreach, advertising, polling, consultants and other expenses as his standing in the polls steadily slipped.",2023-08-01T17:23:54+0000,article,U.S.,News,DeSantis’s Super PAC Burned Through $34 Million as He Slid in Polls,"Presidential Election of 2024;Campaign Finance;Political Action Committees;Republican Party;Never Back Down Inc;DeSantis, Ron;Roe, Jeffrey B (1970- )"
98,"Or was it an early morning? However they looked at it, neither beer nor Bloody Marys could fully soothe the anxieties of fans hoping the United States would advance.",Fans of the Women’s World Cup in the United States on Tuesday had a critical decision to make based on a distinctive 3 a.m. kickoff: Stay up late or wake up early?,2023-08-01T17:37:27+0000,article,Sports,News,"For American Soccer Fans, a Late Night Was a Tense One","Women's World Cup (Soccer);Fans (Persons);Bars and Nightclubs;Sports Bra (Portland, Ore, Bar);Brooklyn (NYC)"
99,"Since the collapse of the Black Sea grain deal two weeks ago, small ports on the Danube River are the only shipping outlet for millions of tons of grain.","When Russia blockaded Ukrainian ports on the Black Sea after its full-scale invasion last year, grain that could feed millions worldwide piled up in silos. Crude iron that supplied some thirty percent of American steel makers stopped arriving. Roughly half the world’s supply of the neon used in lasers to make chips was taken off the market.",2023-08-01T17:45:50+0000,article,World,News,"Danube Ports, a Lifeline for Ukraine, Come Under Russian Threat",International Relations;Ships and Shipping;Defense and Military Forces;Grain;Agriculture and Farming;Black Sea;Danube River;Ukraine;Romania;Ports
100,"Senator Steve Daines of Montana, the Republican campaign chief, is taking aim at his home-state colleague Senator Jon Tester, a Democrat in one of 2024’s biggest races. It’s a bit awkward.","As the Senate wound down for the summer last week, Senator Steve Daines, Republican of Montana, issued a celebratory news release upon winning approval of a water-rights agreement that had been years in the making.",2023-08-01T17:47:04+0000,article,U.S.,News,"Friendly on the Senate Floor, Combatants on the Campaign Trail","Daines, Steve;Tester, Jon;Montana;Elections, Senate;Senate;United States Politics and Government;Democratic Party;Republican Party"
101,"The Aug. 1, 2023 episode of “The Ezra Klein Show.”","Every Tuesday and Friday, Ezra Klein invites you into a conversation about something that matters, like today’s episode, guest-hosted by Rogé Karma, with Martin Wolf. Listen wherever you get your podcasts.",2023-08-01T17:50:36+0000,article,Podcasts,Op-Ed,Transcript: Rogé Karma interviews Martin Wolf,"Wolf, Martin"
102,"At the festival that Wagner founded, a new “Parsifal” looks different depending on how you see it, and a workshop model refreshes revivals.","After the enormous risk of its beginning, the Bayreuth Festival in Germany was for a long time a place where the stagings of Richard Wagner’s operas were encased in amber.",2023-08-01T17:56:16+0000,article,Arts,News,"At Bayreuth, the Work on Wagner’s Operas Is Never Done","Opera;Bayreuth Wagner Festival;Kratzer, Tobias;Scheib, Jay;Schwarz, Valentin (Stage Director);Parsifal (Opera);Tannhauser (Opera);Der Ring des Nibelungen (Opera)"
103,The dog days are over. Here are some tunes to celebrate.,"Happy August. It’s the month of out-of-office auto replies, finally breaking heat waves, and — if the songs about August are to believed, anyway — waning summer romances.",2023-08-01T18:01:20+0000,article,Arts,News,8 Songs About August,"internal-sub-only-nl;Pop and Rock Music;Florence and the Machine;Rilo Kiley;Waxahatchee (Music Group);Crutchfield, Katie (1989- );Swift, Taylor;King, Carole;Morrison, Van;Gibb, Robin;Jennings, Waylon"
104,The stage is set for eight candidates. Donald J. Trump won’t be there.,The stage is set for eight candidates. Donald J. Trump won’t be there.,2023-08-01T18:04:35+0000,multimedia,U.S.,Interactive Feature,The Lineup for the First Republican Presidential Debate,"Presidential Election of 2024;Debates (Political);Primaries and Caucuses;United States Politics and Government;Republican National Committee;Republican Party;Trump, Donald J;Campaign Finance;Polls and Public Opinion;DeSantis, Ron;Christie, Christopher J;Haley, Nikki R;Ramaswamy, Vivek (1985- );Scott, Timothy Eugene"
105,"To celebrate the 50th anniversary of hip-hop, we asked the poet and author Mahogany L. Browne to write a love letter to the genre, composed entirely of lyrics both beloved and obscure.","To celebrate the 50th anniversary of hip-hop, we asked the poet and author Mahogany L. Browne to write a love letter to the genre, composed entirely of lyrics both beloved and obscure.",2023-08-01T18:07:55+0000,multimedia,Arts,Interactive Feature,A Hip-Hop Love Story in Lyrics,"Rap and Hip-Hop;Music;New York City;Love (Emotion);Poetry and Poets;Lil Wayne;Latto (Rapper);50 CENT;MC Lyte (1970- );Walters, Ricky (1965- );Eric B & Rakim (Music Group);Markie, Biz;Lil' Kim;West, Kanye;Cardi B (1992- );E-40;Mos Def;Killer Mike;Nas;Lil Baby (Rapper);Drake (Rapper);Jay-Z;J Cole;Fugees (Music Group);Hill, Lauryn;Tyler, the Creator;Haynes, Cornell Jr (Nelly);Ross, Rick (1976- );Miller, Mac;Missy Elliott (1971- );OutKast;Lupe Fiasco;TI (1980- );Wu-Tang Clan;Anderson .Paak;Lamar, Kendrick;Ice Spice (Rapper);Rihanna;Benjamin, Andre (Andre 3000);LL Cool J;Octave, Dieuson (Kodak Black);Dej Loaf (1991- );Ice Cube (1969- );Digable Planets (Music Group);Kweli, Talib;Snoop Dogg;Tribe Called Quest, A (Music Group);Public Enemy;Big Sean (1988- );Will.i.am (1975- );Wallace, Christopher G;Ross, Robert (Black Rob);G-Unit;Jenkins, Mick (1991- );Chance the Rapper;Macklemore & Ryan Lewis (Music Group);Kid Cudi;Minaj, Nicki;2 Chainz;Heavy D;internal-open-access-from-nl;src-reader-callout"
106,"“Some people think I look too human when I stand up,” the Hangzhou Zoo’s statement said, after a video prompted internet conspiracy theories. “I am a Malayan sun bear!”","Sun, moon, grizzly, black, spectacled, sloth: Bears all over the world can stand, shuffle, totter and walk on two legs, though they usually prefer four.",2023-08-01T18:08:42+0000,article,World,News,"Chinese Zoo Denies, in Voice of a Bear, That Sun Bear Is a Person in a Suit",Zoos;Bears;Social Media;Hangzhou (China);China;internal-open-access-from-nl
107,"New efficiency rules, more than a decade in the making, have taken effect, relegating Edison’s glowing orbs to the history books.","It’s the end of an era. In America, the incandescent light is no more (with a few exceptions).",2023-08-01T18:12:37+0000,article,Climate,News,It’s Official: Stores Can No Longer Sell Most Incandescent Lights,Energy Efficiency;Lighting;Electric Light Bulbs;Compact Fluorescent Light Bulbs;Greenhouse Gas Emissions;Global Warming;United States
108,"The changes are the biggest shake-up to Britain’s alcohol levies in 140 years, according to a government whose leader was clearly on the campaign trail in announcing them.","When Britain’s prime minister, Rishi Sunak, a teetotaler, dropped in on a west London beer festival on Tuesday, he was looking for votes rather than pints while promoting a government policy that he said would ease the financial squeeze on some of Britain’s drinkers.",2023-08-01T18:27:31+0000,article,World,News,U.K.’s New Alcohol Taxes Are Aimed at Keeping Pubs Open and Votes Flowing,"Great Britain;Sunak, Rishi (1980- );Politics and Government;Sales and Excise Taxes;Beer;Alcoholic Beverages;Bars and Nightclubs"
109,"Taylor Sade is the founder of Vertigo, which sells chokers, pendants and belts made of beads that look as if they were plucked from the beach.","By day, Taylor Sade, 24, is a marketing manager. But after work hours, she hand-strings beads and stones on her bed in her Lower East Side apartment, cradled next to her two Himalayan cats. Those creations eventually add up to Vertigo, the buzzy brand behind the accessory draping the necks and waists of many young women this summer.",2023-08-01T19:00:17+0000,article,Style,News,The Woman Behind the ‘Hot Girl Summer’ Necklace,"Jewels and Jewelry;Content Type: Personal Profile;Fashion and Apparel;Vertigo (Fashion Label);Sade, Taylor"
110,"Modern Love in miniature, featuring reader-submitted stories of no more than 100 words.","In the 11th summer of my life, I befriended a local boy on Ocracoke Island. Tall, soft-spoken, with a mop of red-blonde hair that sometimes hid his blue eyes, he was one of the few people who showed me sweet-tempered kindness while my family dissolved into alcoholism. I remember holding hands, the whooping calls of tree frogs and humid, inky-black evenings at the ocean’s edge — bioluminescent sand sparking as we kicked it up. On the cusp of adolescence, I felt like a particle of light, suspended in a love as platonic and gentle as the moon those summer nights. — Marie Koltchak",2023-08-01T19:00:17+0000,article,Style,News,Tiny Love Stories: ‘I Felt Like a Particle of Light’,Teenagers and Adolescence;Love (Emotion);Homosexuality and Bisexuality;Moon
111,Why the 2010s were an economic tragedy,"Today I want to talk about frying pans. No, I haven’t joined the staff of Wirecutter. I’m talking instead about a suddenly popular new type of economic chart, called “frying pan charts” by Alex Williams of Employ America. Here’s an example, depicting the percentage of Americans in their prime working years actually employed:",2023-08-01T19:14:53+0000,article,Opinion,Op-Ed,Frying Pans and Fiscal Policy,"Economics (Theory and Philosophy);internal-sub-only-nl;Labor and Jobs;United States Economy;Recession and Depression;Inflation (Economics);Stimulus (Economic);Coronavirus Aid, Relief, and Economic Security Act (2020);Two Thousand Tens (Decade)"
112,"At Artesano, the chef Rodrigo Fernandini is making artful versions of ceviches, tiraditos and other dishes.",A melody drifted across the dining room like a smoke ring: “Tall and tan and young and lovely. …”,2023-08-01T19:20:22+0000,article,Food,Review,Restaurant Review: Elegantly Dressed Peruvian Cuisine Makes Landfall in TriBeCa,"Restaurants;Chefs;Artesano (Manhattan, NY, Restaurant);Fernandini, Rodrigo;TriBeCa (Manhattan, NY)"
113,"We’ve rounded up the best of what’s leaving this month, which includes a lot of favorites, among them two Oscar winners. Catch them while you can.","Two recent (and worthy) Oscar winners lead the list of titles exiting Netflix in the United States this month, alongside two horror favorites, two action extravaganzas and one of the most beloved romantic comedies of its time. (Dates indicate the final day a title is available.)",2023-08-01T19:35:23+0000,article,Movies,News,Stream These 10 Movies Before They Leave Netflix in August,Movies;Television;Netflix Inc
114,"Rhea Perlman stars as a quintessential Upper West Sider in Zarina Shea’s snapshot of affluent, self-flagellating motherhood","She shops at Zabar’s, does Pilates on Columbus Avenue and resides comfortably in a prewar high rise between West End and Riverside, where she gossips about private lives as though they were front-page news.",2023-08-01T19:47:27+0000,article,Theater,Review,‘Let’s Call Her Patty’ Review: Unseen Depths of an Uptown Matriarch,"Theater;Perlman, Rhea;Robinson, Kristen;Bordelon, Margot (1980- );Theater (Off Broadway);Tow, Claire, Theater (Manhattan, NY);Let's Call Her Patty (Play)"
115,An Italian restaurant with a little elbow room? No problem.,"Hi friends, I hope you all made it through this weekend’s heat wave in good shape. (I ran straight to the beach.) I’m back with another edition of reader questions and, boy, do we have an interesting mix this month. There’s a visitor from the South searching for “decent Thai” — and we can do much better than decent. Another reader wants to know where to enjoy cozy Italian dining, minus the physical closeness to other diners. And finally, someone seeking bistro lunchtime options near the Metropolitan Museum of Art for a gossip session.",2023-08-01T20:00:03+0000,article,Food,News,"Where to Eat After Visiting the Metropolitan Museum of Art, and More Reader Questions",New York City;Restaurants;internal-sub-only-nl
