,abstract,lead_paragraph,pub_date,document_type,section_name,type_of_material,headline,keywords
43,Why is it that books found in giveaway piles cast such a spell on us?,"My life, like yours, I suspect, can feel like it has been ingeniously designed for the sole purpose of strangling serendipity. Work days are built around back-to-back meetings and video calls; evenings revolve around children’s bedtimes; date nights have to be scheduled weeks in advance; even phone calls to catch up with friends can take multiple rounds of back-and-forth coordination by text.",2024-02-24T11:34:27+0000,article,Briefing,briefing,The Joy of Stoop Books,internal-storyline-no;Books and Literature;Real Estate and Housing (Residential);Libraries and Librarians;New York City
44,Putting a weapon into orbit is not just a military threat. It’s also a risk to the billions of dollars pouring into the space economy.,"Just before the Russian-Ukrainian war reached its two-year milestone today, U.S. intelligence agencies warned that Russia might aim a nuclear weapon at an unusual target: not any place on Earth, but satellites orbiting in space.",2024-02-24T11:40:21+0000,article,Business Day,News,The Cost of Nuclear War in Space,Satellites;Embargoes and Sanctions;Russian Invasion of Ukraine (2022)
45,Your mother and I have something we want to talk with you about.,Your mother and I have something we want to talk with you about.,2024-02-24T11:42:25+0000,article,Podcasts,News,Family Meeting,Podcasts;This American Life (Radio Program)
46,So many mothers and daughters are on an unattainable quest for endless youth.,"When my best friend and I lived together 13 years ago, our shared bathroom had a handful of products: soap, tanning lotion, deodorant, toothpaste, potpourri and maybe, occasionally, a face cream that one of us found on sale at Walgreens. No serums, no toners, no anti-aging products. We never considered we wouldn’t be young forever. Our bank accounts were empty, our pores were clogged, our mascara wands were dry — but we were 22, and we were allowed to be messy. We were allowed to be young.",2024-02-24T12:00:07+0000,article,Opinion,Op-Ed,Toxic Beauty Standards Can Be Passed Down,Women and Girls;Beauty (Concept);Social Media;Parenting;Generation Z;Millennial Generation;Skin;Cosmetics and Toiletries;TikTok (ByteDance)
47,Nadya Tolokonnikova on the hope she still holds for Russia’s resistance movement.,"Aleksei Navalny spent most of his life working toward a free Russia. Since his death, the Pussy Riot founder Nadya Tolokonnikova has been reflecting on her friend’s legacy. In this audio essay, she calls on the West to take seriously the threat that Vladimir Putin poses to global peace.",2024-02-24T12:00:08+0000,article,Opinion,Op-Ed,Aleksei Navalny Inspired Me to Start Pussy Riot. His Vision Is Immortal.,"audio-neutral-informative;Politics and Government;Political Prisoners;Corruption (Institutional);Demonstrations, Protests and Riots;Navalny, Aleksei A;Putin, Vladimir V;Tolokonnikova, Nadya;Pussy Riot;Russia"
48,"Ms. Haley is performing about commensurate with how Pat Buchanan did in 1992 against George H.W. Bush. Mr. Buchanan, unlike Ms. Haley, was considered a contender.","In Rock Hill, S.C., last weekend, the biggest boom of a reaction came when Nikki Haley told the crowd, “Everybody’s telling me: Why don’t you just get out?” People basically responded with one long “no,” with one woman’s “Don’t give up!” sounding out above it. Ms. Haley responded instantly, “I will never give up,” and a big cheer went up.",2024-02-24T12:00:20+0000,article,Opinion,Op-Ed,Nikki Haley’s Republican Party of One,"Presidential Election of 2024;Primaries and Caucuses;Voting and Voters;Haley, Nikki R;Trump, Donald J;Republican Party"
49,"While there are no good options for the United States on the war in Gaza, Biden’s leadership is indispensable.","Vetoing a United Nations Security Council resolution calling for an immediate cease-fire in Gaza while circulating a softer hostages-for-cease-fire resolution of its own may have been the best of the bad options available to the Biden administration. President Biden is right to take this step. Given the scale of death and destruction in Gaza, and the prospect of more to come, he can take other measures as well that might lessen Palestinians’ suffering and loss of life.",2024-02-24T12:00:20+0000,article,Opinion,Editorial,A U.S. Call for a Humanitarian Cease-Fire in Gaza,"United States International Relations;Biden, Joseph R Jr;Israel-Gaza War (2023- );Israel;Defense and Military Forces;Gaza Strip;Rafah (Gaza Strip);Palestinians;Civilian Casualties;Hamas;Terrorism;Netanyahu, Benjamin;Peace Process;Security Council (UN);International Relations"
50,Why the latest entrant in the great artificial intelligence race raised some eyebrows.,"Imagine a short story from the golden age of science fiction, something that would appear in a pulp magazine in 1956. Our title is “The Truth Engine,” and the story envisions a future where computers, those hulking, floor-to-ceiling things, become potent enough to guide human beings to answers to any question they might ask, from the capital of Bolivia to the best way to marinade a steak.",2024-02-24T12:00:29+0000,article,Opinion,Op-Ed,Should We Fear the Woke A.I.?,Artificial Intelligence;Computers and the Internet;Race and Ethnicity;Google Inc
51,"While Joe Biden celebrates connubial sex, Republicans emblazon the Scarlet Letter.",“The Golden Bachelor” showed that sex is not just for spring chickens. Hearing aids and making out in a hot tub can go blissfully together.,2024-02-24T12:00:30+0000,article,Opinion,Op-Ed,Sex and the Capital City,"Biden, Joseph R Jr;Biden, Jill Tracy Jacobs;Sex;Presidential Election of 2024;United States Politics and Government;Religion-State Relations;Republican Party;Trump, Donald J;Abortion"
52,"Without much survey data, there’s little information about what issues matter to Asian Americans.",This article is also a weekly newsletter. Sign up for Race/Related here.,2024-02-24T12:00:35+0000,article,U.S.,News,Asian Americans Are Often Invisible in Polling. That’s Changing.,Polls and Public Opinion;Race and Ethnicity;Elections;Voting and Voters;Population
53,Former President Donald J. Trump has so far largely campaigned on a dark vision of the United States under President Biden. A speech on Saturday will take a different approach.,"As voters in South Carolina head to the polls in what is only the fifth nominating contest in the Republican presidential race, former President Donald J. Trump will give a speech on Saturday afternoon near Washington, where he is expected to focus largely on his anticipated general-election contest against President Biden.",2024-02-24T12:01:10+0000,article,U.S.,News,"In Speech at CPAC, Trump Will Outline a Thriving U.S. Amid a Second Term","Presidential Election of 2024;Conservative Political Action Conference;Trump, Donald J"
54,"At the annual show where the French countryside comes to the capital, President Emmanuel Macron’s efforts to calm a monthlong confrontation were met with anger.","France’s farmers vented their fury at President Emmanuel Macron on Saturday as he arrived at the annual agricultural show in Paris, a giant fair long seen as a test of presidents’ relationship with the countryside.",2024-02-24T12:23:34+0000,article,World,News,Farmers Clash With Police and Macron at Paris Agricultural Fair,"Agriculture and Farming;Politics and Government;Rural Areas;Global Warming;Demonstrations, Protests and Riots;Prices (Fares, Fees and Rates);International Trade and World Market;Macron, Emmanuel (1977- );European Union;France"
55,An overbearing mother; a vanished sister.,"Dear readers,",2024-02-24T12:50:02+0000,article,Books,News,Two Sun-Splashed Novels,Books and Literature
56,"Two years after Russia’s full-scale invasion, Ukrainian leaders are seeking a path forward in the face of ferocious assaults and daunting unknowns.","The forecasts are anything but optimistic: The best Ukraine can hope for in 2024, many Western officials and analysts say, is to simply hold the line.",2024-02-24T13:41:51+0000,article,World,News,Ukraine’s Deepening Fog of War,Russian Invasion of Ukraine (2022);Ukraine;Russia;Defense and Military Forces;United States International Relations
57,The conglomerate saw major gains in its insurance operations and in investment income. But revenues at its railroad and utility businesses declined from 2022.,"Berkshire Hathaway, the conglomerate run for decades by Warren E. Buffett, recorded its highest-ever annual profit last year. But its chief executive found reason to blame government regulation for hurting the results of some of its biggest businesses.",2024-02-24T15:04:51+0000,article,Business Day,News,"Berkshire Hathaway Reports Profit of $97 Billion Last Year, a Record","Company Reports;Regulation and Deregulation of Industry;Railroads;Automobile Insurance and Liability;Berkshire Hathaway Inc;Buffett, Warren E"
58,"The opening night of the pop star’s Guts World Tour had sparkle and abandon, but making her songs feel big didn’t require much besides the songs themselves.","As a pop star, Olivia Rodrigo wields a rather unusual arsenal of weapons. She is an acute writer and an un-self-conscious singer. She largely abhors artifice. She is modest, not salacious. In just three years, she has achieved something approaching stratospheric fame — a four-times platinum debut album and a Grammy for best new artist — while somehow remaining an underdog.",2024-02-24T15:38:45+0000,article,Arts,Review,"Onstage, a Feisty Olivia Rodrigo Tests Out Life After Girlhood","Pop and Rock Music;Women and Girls;Rodrigo, Olivia (2003- );Guts (Album)"
59,"European and other Western leaders gathered in Kyiv to pledge support for Ukraine amid U.S. reluctance, while its troops suffer growing losses on the battlefield, where the Russians have been gaining ground.","In solemn ceremonies and small vigils, state visits, stirring speeches and statements of solidarity, Ukraine and its allies marked the dawn of the third year of Russia’s unprovoked invasion with a single message: Believe.",2024-02-24T15:49:11+0000,article,World,News,"Ukraine Marks 2nd Anniversary of Russian Invasion, Determined Despite Setbacks","International Relations;Defense and Military Forces;United States International Relations;Russian Invasion of Ukraine (2022);European Union;Dronov, Yaroslav Y (Shaman);Syrsky, Oleksandr;von der Leyen, Ursula;Avdiivka (Ukraine);Bucha (Ukraine);Ukraine"
60,Tired of comfort cooking? Neither are we.,"We know that frozen peas are a freezer staple — they’re just as good as their fresh counterparts, and they’re always ready to add little pops of sweetness to skillet greens with runny eggs and vegetable pulao. But … what makes them such a good freezer staple? Why do they freeze better than, say, apples? A reader asked the cookbook author Kenji López-Alt for his new column titled, appropriately enough, Ask Kenji. You can read his full answer here while you boil water for his macaroni and peas, an easy and robust pasta dish that borrows from paglia e fieno (a heavy cream-sauced “straw and hay” pasta) and carbonara. (Kenji swaps some of the heavy cream for eggs to keep things light yet creamy.) Have a question for Kenji? Email him at askkenji@nytimes.com.",2024-02-24T16:00:07+0000,article,Food,Letter,"Macaroni and Peas, Buttermilk Roast Chicken and Shabu Shabu",Cooking and Cookbooks;Content Type: Service
61,"After losing two civil trials, the former president must find a bonding company that will vouch for him — or his real estate empire is threatened.",Donald J. Trump is on the clock.,2024-02-24T16:17:41+0000,article,New York,News,Donald J. Trump Is Racing Against Time to Find a Half-Billion Dollar Bond,"New York State Civil Case Against Trump (452564/2022);Decisions and Verdicts;Attorneys General;CARROLL, E JEAN;Libel and Slander;Engoron, Arthur F;James, Letitia;Trump, Donald J;Frauds and Swindling;Fines (Penalties);Compensation for Damages (Law)"
62,"Close to the action at a Knicks game, a writer gets some advice from Kenan Thompson of “Saturday Night Live.”","Madison Square Garden went very quiet when my face appeared on the giant screen above center court. The silence was noticeable. A few seconds earlier, Kenan Thompson’s face had brought down the house.",2024-02-24T16:20:07+0000,article,Style,News,How to Sit Courtside at Madison Square Garden,Celebrities;Madison Square Garden;Basketball;New York Knicks
63,"The Russian authorities have transferred the body, ending a grim battle for custody of his remains.","The Russian authorities have transferred the body of the opposition leader Aleksei A. Navalny to his mother, his spokeswoman said on Saturday, ending a grim battle for custody of his remains, but it is unclear whether he will get a funeral that the public can attend.",2024-02-24T16:25:38+0000,article,World,News,"Aleksei Navalny’s Body Was Returned to His Mother, Allies Say","Politics and Government;Political Prisoners;Navalnaya, Yulia B;Navalny, Aleksei A;Putin, Vladimir V;Russia"
64,Democrats could pay a heavy price for bypassing the primary process.,"In a recent episode of his podcast, my colleague Ezra Klein made the strongest case yet for replacing President Biden on the ticket with a new Democratic nominee. After listening to it, I disagreed with a few key points, and after discussing our differences, Ezra and I agreed that it would make sense to take this to the page, as it were.",2024-02-24T16:52:50+0000,article,Opinion,Op-Ed,It’s Not as Easy as Just Getting Biden to Drop Out,"internal-sub-only-nl;United States Politics and Government;Democratic National Convention;Appointments and Executive Changes;Primaries and Caucuses;Elections;Voting and Voters;Democratic Party;Biden, Joseph R Jr"
65,"The police released video of the student, Nex Benedict, recounting the altercation a day before their death, which has drawn national scrutiny.","An altercation at an Oklahoma public school involving a 16-year-old nonbinary student who died the next day began after the student “poured water” on girls who had been making fun of the teenager, according to a body camera video interview released by the Owasso Police Department late Friday.",2024-02-24T17:02:06+0000,article,U.S.,News,"In Video, Nonbinary Student Describes Fight in Oklahoma School Bathroom","Benedict, Nex (d 2024);Transgender;Discrimination;Bullies;Assaults;Deaths (Fatalities);Education (K-12);Owasso (Okla);Video Recordings, Downloads and Streaming"
66,"Buildings are a huge danger for birds. They also face other risks, including poisoning that can cloud their brains.","Flaco spent a year defying expectations, an owl born into captivity who quickly learned to hunt and fend for himself in the wilds of New York City. That ended on Friday when he flew into a building near Central Park. What went wrong?",2024-02-24T17:24:11+0000,article,Climate,News,Flaco’s Crash Might Have Been More Than Bad Luck. Here’s What We Know.,"Owls;Central Park (Manhattan, NY);Central Park Zoo;New York City"
67,Get live election results and maps from the 2024 South Carolina Republican primary.,Get live election results and maps from the 2024 South Carolina Republican primary.,2024-02-24T17:32:01+0000,multimedia,U.S.,Interactive Feature,South Carolina Republican Primary Results,Elections;Presidential Elections (US);Presidential Election of 2024;South Carolina;internal-open-access
68,"With Judson Dance Theater and as the founder of contact improvisation, he expanded the possibilities of what dance could be, developing works around basic tasks like walking.","Steve Paxton, who helped radically upend ideas about dance as a member of the 1960s collective Judson Dance Theater in New York City, and who developed contact improvisation, a movement form that is now practiced around the world, died on Tuesday at his home in East Charleston, Vt. He was 85.",2024-02-24T17:34:31+0000,article,Arts,Obituary (Obit),"Steve Paxton, Who Found Avant-Garde Dance in the Everyday, Dies at 85","Paxton, Steve (1939- );Deaths (Obituaries);Dancing;Judson Dance Theater;Grand Union (Dance Co);Cunningham, Merce"
69,See results from every precinct and demographic analysis of the vote in the South Carolina G.O.P. primary.,See results from every precinct and demographic analysis of the vote in the South Carolina G.O.P. primary.,2024-02-24T17:39:04+0000,multimedia,U.S.,Interactive Feature,Results: The Most Detailed Maps of the South Carolina Republican Primary,"South Carolina;Trump, Donald J;Haley, Nikki R;Elections;Primaries and Caucuses;internal-open-access;Presidential Election of 2024"
70,"At the first stop on the Guts World Tour, fans added punk accents to feminine butterflies and bows.","On Friday, just outside Palm Springs, Calif., you might have thought a strange mirage had appeared: One or two zillion tweens descended upon an arena, all wearing platform Doc Martens.",2024-02-24T18:14:44+0000,article,Style,News,"‘Mom, You’re Not Grunge Enough’: Olivia Rodrigo Fans Thrash in the Desert","Pop and Rock Music;Fans (Persons);Teenagers and Adolescence;Social Media;Dress Codes;Fashion and Apparel;Rodrigo, Olivia (2003- );Palm Springs (Calif);Costumes"
71,A fire that killed at least 10 people left many refugees from Ukraine without homes and others scrambling to rebuild their lives.,"Vladimir Likhvan fled Russia’s invasion of Ukraine, hoping to find safety in Europe, only to watch helplessly as his new home was destroyed in a fire that raged Thursday through a high-rise apartment complex in Valencia, killing at least 10 people.",2024-02-24T18:48:58+0000,article,World,News,"Fire in Valencia, Spain, Leaves Residents Homeless After Panicked Escapes",Fires and Firefighters;Accidents and Safety;Refugees and Displaced Persons;Spain;Valencia (Spain)
72,"Roman Sharf is one of the watch world’s best known dealers. Compared to the Patek on his wrist, the shoes were cheap.","When Donald J. Trump appeared at Sneaker Con in Philadelphia last weekend to promote a limited-edition line of gilded high-tops, there were a lot of boos in the crowd, but none coming from Roman Sharf.",2024-02-24T19:00:24+0000,article,Style,News,"This Man Paid $9,000 for a Pair of Donald Trump Sneakers","Trump, Donald J;Sneakers;Social Media;Luxury Goods and Services;Watches and Clocks;Content Type: Personal Profile"
73,"Twice denied Olympic glory by his nation’s boycotts of the Games, he wrote himself into track history in 1978 by breaking four records in just 81 days.","Henry Rono, a Kenyan distance runner who was unable to walk until he was 6 after a gruesome injury to his right leg when he was a toddler but went on to break four world records in just 81 days in 1978, died on Feb. 15 in Nairobi. He was 72.",2024-02-24T19:13:20+0000,article,Sports,Obituary (Obit),"Henry Rono, Record-Breaking Distance Runner From Kenya, Dies at 72","Rono, Henry;Deaths (Obituaries);Running;Track and Field;Records and Achievements;Olympic Games (1976);Olympic Games (1980);Kenya;Washington State University"
74,"During the Democratic primary earlier this month, nearly all ballots had been counted by 10:45 p.m. Eastern time.","Good news for political devotees hoping to get to bed early: Barring unexpected snags, we should know the results of the Republican primary in South Carolina well before midnight.",2024-02-24T19:30:07+0000,article,U.S.,News,South Carolina Results Should Arrive Quickly Tonight,"Presidential Election of 2024;Primaries and Caucuses;Republican Party;Haley, Nikki R;Trump, Donald J;South Carolina"
75,"Rape, killing, torture: A stark report offers new evidence of horrific abuses carried out by Sudan’s military and its enemy, the paramilitary Rapid Support Forces.","Bombs that struck houses, markets and bus stations across Sudan, often killing dozens of civilians at once. Ethnic rampages, accompanied by rape and looting, that killed thousands in the western region of Darfur.",2024-02-24T19:30:56+0000,article,World,News,"Atrocities Mount in Sudan as War Spirals, U.N. Says","Sudan;United Nations Human Rights Council;War and Armed Conflicts;Civilian Casualties;War Crimes, Genocide and Crimes Against Humanity;Rapid Support Forces (Sudan);Human Rights and Human Rights Violations;Politics and Government"
76,Wayne LaPierre led the National Rifle Association for more than three decades. A civil court jury’s verdict on Friday underscored the extent to which he had enriched himself at the expense of the organization’s members.,"Wayne LaPierre, who led the National Rifle Association for more than three decades, had long been the face of the American gun rights movement, a Beltway Clint Eastwood who insisted that “the only way to stop a bad guy with a gun is with a good guy with a gun.”",2024-02-24T19:55:27+0000,article,New York,News,"For N.R.A.’s LaPierre, a Legacy of Guns and Money","National Rifle Assn;LaPierre, Wayne;Phillips, Wilson H Jr;Frazer, John C (1966- );Embezzlement;James, Letitia;New York State;Gun Control;Decisions and Verdicts"
77,"Under Flaco’s favorite trees in Central Park and across the city, New Yorkers spoke of what the bird and his unlikely year of freedom meant to them.","Pjetar Nikac has been the superintendent at 267 West 89th Street, an eight-story apartment building near Riverside Park, for 30 years. What happened there Friday made it a day he wouldn’t forget.",2024-02-24T20:22:19+0000,article,New York,News,"New York Mourns Flaco, an Owl Who Inspired as He Made the City His Own","Owls;Central Park Zoo;Central Park (Manhattan, NY);Manhattan (NYC)"
78,"The Iran-backed group, which has been targeting global shipping routes, has proved especially difficult for the United States and its allies to restrain.","The United States and Britain carried out another round of large-scale military strikes Saturday against multiple sites in Yemen controlled by Houthi militants, U.S. officials said.",2024-02-24T21:32:31+0000,article,U.S.,News,U.S. and British Warplanes Again Strike Houthi-Linked Targets in Yemen,Palestinians;Israel-Gaza War (2023- );Defense and Military Forces;Terrorism;Ships and Shipping;Missiles and Missile Defense Systems;Fringe Groups and Movements;Houthis;Gaza Strip;Middle East;Red Sea;Yemen
79,"He used his speech to focus on a general-election contest between him and President Biden, not once mentioning his main Republican rival, Nikki Haley.","Former President Donald J. Trump laid out what’s in store for America should he or President Biden win the 2024 presidential election, using a Saturday speech at the Conservative Political Action Conference to cast one nearly utopian vision of the country’s future and one reminiscent of a postapocalyptic movie.",2024-02-24T21:43:12+0000,article,U.S.,News,"At CPAC, Trump Invokes Clashing Visions of America’s Future","Trump, Donald J;Presidential Election of 2024;Conservative Political Action Conference;Politics and Government;Biden, Joseph R Jr;Haley, Nikki R"
80,"The film took the top prize, and its stars Cillian Murphy and Robert Downey Jr. earned solo acting honors. Lily Gladstone and Da’Vine Joy Randolph also won.","Christopher Nolan’s “Oppenheimer” scored three big wins at the 30th Screen Actors Guild Awards on Saturday night, adding even more industry prizes to its formidable war chest.",2024-02-24T22:20:16+0000,article,Movies,News,SAG Awards 2024: ‘Oppenheimer’ Dominates the Night,"Movies;Television;Awards, Decorations and Honors;Screen Actors Guild;SAG-AFTRA"
81,His steadfast support of the Gaza war effort is angering young people and Arab Americans in an election year. But any change risks alienating Jewish voters.,"The Biden administration’s reversal of Trump-era policy on settlements in the occupied West Bank reflects not just its rising frustration with Israel, but the political bind the president finds himself in, just days before the Democratic primary in Michigan, where a large Arab American population is urging voters to register their anger by voting “uncommitted.”",2024-02-24T22:25:55+0000,article,World,News,Biden Caught in a Political Bind Over Israel Policy,"Biden, Joseph R Jr;Presidential Election of 2024;United States Politics and Government;United States International Relations;Blinken, Antony J;ARAB-AMERICANS;Palestinian-Americans;Jews and Judaism;Israel-Gaza War (2023- );Israel;Gaza Strip;Palestinians;Hamas;Palestinian Authority;Netanyahu, Benjamin;West Bank"
82,"Prosecutors said the man was upset that word about his sexual relationship with the victim, Dime Doe, was circulating in a South Carolina town.",A South Carolina man was found guilty on Friday in the killing of a transgender woman in what the authorities said was the first federal murder trial of someone charged with a hate crime based on gender identity.,2024-02-24T22:33:52+0000,article,U.S.,News,Man Convicted in Transgender Woman’s Killing in First Federal Trial of Its Kind,"Murders, Attempted Murders and Homicides;Hate Crimes;Transgender;Allendale (SC)"
83,"The documentary, directed by Mati Diop, was awarded the Golden Bear.","The top prize at this year’s Berlin International Film Festival was given to “Dahomey,” a documentary by the French Senegalese filmmaker Mati Diop about 26 looted artworks that were returned to Benin from France in 2021.",2024-02-24T22:42:32+0000,article,Movies,News,"‘Dahomey,’ Documentary About Looted Artwork, Wins Top Prize at Berlin Film Festival","Documentary Films and Programs;Dahomey (Movie);Diop, Mati;Berlin International Film Festival;Arts and Antiquities Looting;Benin;France"
