,abstract,lead_paragraph,pub_date,document_type,section_name,type_of_material,headline,keywords
82,"Soles of Duende, a percussive dance trio appearing at the Joyce Theater this week, situates tap, flamenco and Kathak in joyful and thrilling conversation.",“Can We Dance Here?” That’s the title of Soles of Duende’s signature work. But it’s also a question that the members of this percussive dance company often find themselves posing.,2024-01-09T15:39:25+0000,article,Arts,News,"Three Dancers and Three Traditions Converse, United by Rhythm","Dancing;Soles of Duende (Dance Group);Joyce Theater;Castro, Amanda (Dancer);Guha, Brinda;Rosales, Arielle;Can We Dance Here? (Dance)"
83,"I’m in cook mode right now. What I’m making: blistered broccoli pasta, chana masala and build-your-own poke bowls.","I’m in cook mode right now in this blissful post-holiday lull, staying in more often and making more food, too: waffles and squash soup, kimchi tuna salad and rainbow sprinkle cake. (And dinner, of course. There’s always dinner.)",2024-01-09T16:00:03+0000,article,Food,News,"Five (Easy, Fun, Quick and Completely Delicious) Weeknight Dishes",Cooking and Cookbooks;Content Type: Service;Recipes
84,A deadly airstrike,"The Israeli military said on Tuesday that it had killed a senior Hezbollah commander in an airstrike, further heightening tensions with the Iranian-backed militia after a day of back-and-forth attacks and the apparent Israeli killing of another Hezbollah commander on Monday.",2024-01-09T16:02:45+0000,article,World,News,Israel says it killed another Hezbollah commander after back-and-forth attacks.,"Israel-Gaza War (2023- );Hezbollah;Hamas;Lebanon;Funerals and Memorials;Netanyahu, Benjamin"
85,"The Jan. 9, 2023, episode of “The Ezra Klein Show.”","Every Tuesday and Friday, Ezra Klein invites you into a conversation about something that matters, like today’s episode with Kyle Chayka. Listen wherever you get your podcasts.",2024-01-09T16:23:52+0000,article,Podcasts,Op-Ed,Transcript: Ezra Klein Interviews Kyle Chayka,"Chayka, Kyle"
86,"A wave of elections coincides with state influence operations, a surge of extremism, A.I. advances and a pullback in social media protections.","Billions of people will vote in major elections this year — around half of the global population, by some estimates — in one of the largest and most consequential democratic exercises in living memory. The results will affect how the world is run for decades to come.",2024-01-09T16:30:13+0000,article,Business Day,News,Elections and Disinformation Are Colliding Like Never Before in 2024,Presidential Election of 2024;Social Media;Rumors and Misinformation;Artificial Intelligence;Politics and Government;Voter Fraud (Election Fraud);Computers and the Internet
87,Readers discuss an editorial that one called “the full-throated condemnation of Donald Trump that the facts demand.” Also: Taylor Swift; trucking; Canadian hockey.,To the Editor:,2024-01-09T16:38:23+0000,article,Opinion,Letter,A Sharp Warning About Donald Trump,"Trump, Donald J;Presidential Election of 2024;United States Politics and Government;Global Warming;Swift, Taylor;Pop and Rock Music;Homosexuality and Bisexuality;Trucks and Trucking;Quebec Nordiques;Canada;Hockey, Ice"
88,Why pop culture now flirts with extraterrestrials as much as it fears them.,"Every generation gets the extraterrestrial invasion its times demand. In 1938, conflicts simmering in Europe meant that a radio broadcast of “The War of the Worlds” became a panic-inducing news event in America. In the McCarthy era, manufactured paranoia about Communists led to movies like “Invasion of the Body Snatchers” (1956) and “I Married a Monster From Outer Space” (1958). The terrors of the Cold War coincided with the skittering xenomorph of “Alien” (1979), a conscienceless creature willing to destroy humanity to ensure its own survival.",2024-01-09T16:40:24+0000,article,T Magazine,News,Aliens Have Never Been More Alluring,Culture (Arts);Extraterrestrial Life;Unidentified Flying Objects (UFO);Movies;Art
89,"The Korean Chinese restaurant Octo opens in Koreatown, Bibliotheque brings a book-lined wine den to Mercer Street and more restaurant news.","Beef or chicken? The restaurateur Simon Kim now has you covered either way. An owner of the Korean steakhouse Cote is opening what he calls a “fried chicken cathedral,” with a dining room framed by glowing, barrel-vaulted arches that disappear to infinity, thanks to a rear wall mirror. The design is by the Rockwell Group, involving David Rockwell’s personal touch. But the food is Mr. Kim’s idea, more than four years in the making, with the executive chef Seung Kyu Kim in charge (no relation to the owner, though the two met while working at Jean-Georges). Simon Kim’s notion is to offer a mix of American and Korean approaches to fried chicken and give it glamour with (supposedly) more sustainable ingredients in a more elegant setting. At Coqodaq it’s one-size-fits-all, a $38 dinner that includes chicken soup; a bucket of chicken parts fried in a gluten-free batter based on rice flour, chicken glazed with gochujang or soy and garlic; a cold perilla noodle dish; banchan, small dishes, that include palate-cleansing white radish; and soft serve frozen yogurt. Starters (extra) include some seafood options. The chickens are pasture-raised in Pennsylvania Amish country, and triple-fried in oil produced in Iowa from fermented Brazilian sugar cane. The name of the restaurant blends French, American and Korean words for chicken. The sommelier, Victoria James, who also curates the wines at Cote, has a wine list that features Champagne, which she and Mr. Kim agree is the ideal beverage for fried chicken. Her list offers 400 of them, and other sparklers by the glass and the bottle. Considering that fried chicken is finger-food, in the front of the restaurant, there’s a hand-washing area with three sinks. Some high-top tables near the entrance are for walk-ins, there’s a long bar, and garage doors will open to an outside patio in warmer weather. Tables at the leather-upholstered booths beneath the arches in the 190-seat room have lazy susans, the better for sharing. (Opens Friday)",2024-01-09T16:57:45+0000,article,Food,News,"Coqodaq, From the Cote Team, Is a Temple of Fried Chicken","Restaurants;Chefs;Coqodaq (Manhattan, NY, Restaurant)"
90,Former President Trump said Monday night that he hoped any downturn would come before his possible re-election — under President Biden’s administration.,Former President Donald J. Trump said in an interview on Monday that he believed the economy would crash — and that he hoped it would happen in the next year so the blame would fall on President Biden’s administration.,2024-01-09T17:07:21+0000,article,U.S.,News,Trump says he hopes any economic crash happens in 2024 so he isn’t blamed.,"United States Economy;Trump, Donald J;Presidential Election of 2024;Biden, Joseph R Jr"
91,"The actor, Idan Amedi, underwent surgery to remove shrapnel from his body and was expected to recover, Israeli news media reported.","An Israeli soldier who is an actor in the popular Israeli series “Fauda” on Netflix was seriously wounded when a truck filled with explosives blew up in the Bureij area of central Gaza on Monday, the Israeli military said.",2024-01-09T17:41:36+0000,article,World,News,‘Fauda’ Actor Is Seriously Injured Fighting in Gaza,Netflix Inc;Fauda (TV Program);Israel-Gaza War (2023- );War and Armed Conflicts
92,"The temperature on Saturday evening, when the team will play the Miami Dolphins, will be around minus 3 degrees.","This weekend is the first round of the N.F.L. playoffs, and because there is a home game in Buffalo, the superlatives are coming out. It will be cold, as low as 9 degrees. The players and fans will be freezing. The game will be a war of attrition played out on the frozen tundra of …",2024-01-09T17:41:37+0000,article,U.S.,News,Brutal Cold Expected for Kansas City’s Playoff Game,Football;Snow and Snowstorms;Buffalo Bills;Kansas City Chiefs;Miami Dolphins;Chicago Cardinals;National Football League;Kansas City (Mo);Tampa (Fla);Buffalo (NY)
93,"With the Iowa caucuses likely to be a battle for second place, the next nominating state appears to offer the best chance of an upset defeat of Donald Trump.","With his usual bluntness, Chris Christie used a recent event in New Hampshire to lay out why he thought the state’s primary election was more important than the Iowa caucuses — and what he saw as its tremendous stakes.",2024-01-09T17:55:32+0000,article,U.S.,News,"For Anti-Trump Republicans, It All Might Come Down to New Hampshire","New Hampshire;Primaries and Caucuses;Presidential Election of 2024;Trump, Donald J;Haley, Nikki R;Christie, Christopher J;Republican Party;United States Politics and Government"
94,"The president learned only Tuesday that his defense secretary had been diagnosed with prostate cancer a month ago and had surgery under general anesthesia in December, aides said.",The White House was caught off guard once again on Tuesday when it learned that Defense Secretary Lloyd J. Austin III had been diagnosed with prostate cancer a month ago and had surgery to treat the disease under general anesthesia on Dec. 22 without notifying either President Biden or his staff.,2024-01-09T18:00:07+0000,article,U.S.,News,"Surprised by New Details About Austin’s Health, White House Orders Review","United States Politics and Government;United States Defense and Military Forces;Defense Department;Austin, Lloyd J III;Biden, Joseph R Jr"
95,"A town hall in Iowa on Wednesday is the network’s first live interview with the former president in nearly two years, the latest twist in a long-running drama.",One of television’s longest-running soap operas is about to start a new chapter.,2024-01-09T18:03:41+0000,article,Business Day,News,"After Years of Ups and Downs, Trump Is, Once Again, Live on Fox News","Trump, Donald J;Fox News Channel;Television;News and News Media;Presidential Election of 2024;Libel and Slander;Rumors and Misinformation;Baier, Bret;Murdoch, Rupert"
96,The court has already moved the case along at an exceptionally brisk pace and is expected to make its decision fairly quickly by the standards of a typical appeal.,A federal appeals court in Washington has now heard arguments on former President Donald J. Trump’s sweeping claim that he is immune from prosecution on charges of plotting to overturn the 2020 election.,2024-01-09T18:13:28+0000,article,U.S.,News,What happens next in Trump’s immunity case?,"Supreme Court (US);Federal Criminal Case Against Trump (2020 Election Case);Trump, Donald J"
97,"We invite students to explain how to do any task in 400 words or fewer. Contest dates: Jan. 10 - Feb. 14, 2024",Do you know how to fix a brake light? What about how to memorize Shakespeare? How to keep a goldfish alive? Spot a shooting star? Write a love letter? Forgive someone?,2024-01-09T18:18:41+0000,article,The Learning Network,News,How to … : An Informational Writing Contest for Teenagers,
98,"We walk you through how to brainstorm a topic, interview an expert and write your own original “How to ….”","“If you want to know how to do something, don’t just search the internet,” advises Malia Wollan, the longtime writer of Tip, a how-to column that ran weekly in The New York Times Magazine for seven years. “Instead, find a person who already knows how and ask them.”",2024-01-09T18:22:37+0000,article,The Learning Network,News,How to Write a ‘How-To’: A Step-by-Step Guide to Our Contest,
99,"The decision in Parliament, opposed by environmentalists, will allow prospectors to start surveying the country’s waters.","The Norwegian Parliament voted on Tuesday to authorize the opening of parts of the Norwegian Sea to seabed mining exploration, a move that reflects rising international demand for the metals needed to build batteries for electric vehicles worldwide.",2024-01-09T18:23:49+0000,article,Climate,News,Norway Moves to Allow Seabed Mining Exploration,Norway;Offshore Drilling and Exploration;Oceans and Seas;Metals and Minerals;Electric and Hybrid Vehicles;International Seabed Authority
100,"A Native-run studio, the Artspace is a beacon of hope, nurturing talent amid a resurgence of Indigenous traditions.","There is no word for art in the Lakota language. But the power of art, in every facet of life, has drawn a boisterous group of moccasin beaders, painters, regalia artists and producers of Native hip-hop down a two-lane road that undulates through the tawny hills of the Pine Ridge Indian Reservation, eight miles from the nearest intersection.",2024-01-09T18:26:09+0000,article,Arts,News,"For the Lakota, Creativity Thrives Where There’s No Word for Art",Native Americans;Art;Pine Ridge Indian Reservation (SD);South Dakota
101,"Kevin Merida, who took over the job in 2021, said in an internal note that his last day would be on Friday.","When he joined The Los Angeles Times as its top editor nearly three years ago, Kevin Merida was hailed as a leader who would restore calm to a newsroom that had been buffeted by cost-cutting and corporate ownership battles.",2024-01-09T18:26:20+0000,article,Business Day,News,Editor of The Los Angeles Times Steps Down,"Appointments and Executive Changes;Newspapers;Los Angeles Times;Merida, Kevin (1957- )"
102,"As a companion to our new “how to” contest, here are 10 questions to help you brainstorm some skills you’d like to learn — whether practical or just for fun.","Are you a karaoke enthusiast? If so, you might have a few tips to share about how to choose a song — for example, “just because you like it does not mean you should sing it.” (After all, not everybody has the vocal range for “Bohemian Rhapsody.”)",2024-01-09T18:26:38+0000,article,The Learning Network,News,What Do You Wish You Could Do Well?,
103,"Gov. Kathy Hochul, in her annual State of the State address, trumpeted her achievements while highlighting a series of intractable problems facing New York.","Gov. Kathy Hochul on Tuesday presented a stark view of New York’s challenges, highlighting crime, a failing mental health infrastructure and affordability concerns as vexing challenges that her administration was ready to tackle.",2024-01-09T18:35:42+0000,article,New York,News,"In New York, Hochul Says State of the State Is Concerning, but Fixable","Hochul, Kathleen C;New York State;Politics and Government;State Legislatures"
104,"Mr. Trump, speaking at a Washington hotel he once owned, said that “you have to have immunity” as president. It was a core element of Tuesday’s hearing.",The small courtroom was already packed when former President Donald J. Trump walked slowly inside.,2024-01-09T18:40:46+0000,article,U.S.,News,"Trump Shows Little Emotion During Hearing, Then Says He ‘Did Nothing Wrong’","Federal Criminal Case Against Trump (2020 Election Case);Immunity from Prosecution;Trump, Donald J"
105,The onetime Trump supporter was driven into hiding after Fox News and prominent Republicans spread a false narrative that he was a government agent who helped instigate the attack on the Capitol.,"Ray Epps, the former Trump supporter who became a target of a conspiracy theory that he was an undercover government agent who helped to instigate the Jan. 6, 2021, attack on the Capitol, was sentenced on Tuesday to a year of probation for his own small role in the riot instead of the six months in prison that prosecutors had requested.",2024-01-09T18:49:05+0000,article,U.S.,News,"Ray Epps, Target of Jan. 6 Conspiracy Theory, Is Sentenced to Probation","Storming of the US Capitol (Jan, 2021);Conspiracy Theories;United States Politics and Government;Federal Bureau of Investigation;Fox News Channel;Epps, Ray (1961- );Boasberg, James E;Trump, Donald J;Samsel, Ryan"
106,"The president’s re-election campaign is looking to rekindle support among a group that was pivotal to his 2020 victory, in a state that revived his candidacy.","As Democrats amplify their concerns about President Biden’s status with Black voters, South Carolina has emerged as a proving ground for his campaign: one where he can test his message to a predominantly Black electorate and use it as a largely ceremonial launchpad for his re-election.",2024-01-09T18:50:08+0000,article,U.S.,News,"In South Carolina, Biden and Harris Test Policy-Heavy Pitch to Black Voters","Biden, Joseph R Jr;Presidential Election of 2024;Harris, Kamala D;Clyburn, James E;Emanuel African Methodist Episcopal Church (Charleston, SC);Black People;Blacks;United States Politics and Government;South Carolina"
107,"Artemis II, a trip around the moon, will now occur no earlier than September 2025 while a moon landing, Artemis III, will move to 2026.","For NASA and its astronauts, the moon is no farther away in terms of distance, but it is slipping further into the future.",2024-01-09T18:58:31+0000,article,Science,News,NASA Delays Artemis Astronaut Moon Missions,National Aeronautics and Space Administration;Artemis Program;Moon;Space and Astronomy
108,"The soundtrack to Emerald Fennell’s movie has been a talker. Hear tracks by M.I.A., Girl Talk, Nelly Furtado and others that would have been a good fit.","Over the weekend, I finally watched “Saltburn,” the provocative, polarizing and occasionally downright icky coming-of-age thriller that no one can stop talking about right now.",2024-01-09T19:00:06+0000,article,Arts,News,What Songs Would ‘Saltburn’ Characters Have Spun in 2007?,"internal-sub-only-nl;Rap and Hip-Hop;Pop and Rock Music;Movies;Saltburn (Movie);Bloc Party;Hot Chip (Music Group);Spoon (Music Group);Fennell, Emerald;Furtado, Nelly;Keoghan, Barry;Krayzie Bone (1973- );M I A;Timbaland;Timberlake, Justin;MGMT;Girl Talk"
109,"On Tuesday, families with children had to pack up their belongings and either find somewhere else to live or line up to reapply for shelter beds.","Since arriving from Venezuela four months ago, Joana Rivas has slowly found some semblance of stability in New York City, picking up occasional cleaning jobs and enrolling her 9-year-old daughter at a public school in Manhattan.",2024-01-09T19:07:51+0000,article,New York,News,New York Begins Evicting Migrant Families Who Hit a Shelter Time Limit,"Children and Childhood;Immigration and Emigration;Homeless Persons;Roosevelt Hotel (Manhattan, NY);Abbott, Gregory W (1957- );Adams, Eric L;New York City;Immigration Detention"
110,"A win isn’t always win in the Iowa caucuses. In the final days, the candidates are scrambling to beat each other — and expectations.",It may feel as if there is little suspense over who is likely to win the Republican presidential caucuses in Iowa on Monday.,2024-01-09T19:18:58+0000,article,U.S.,News,A Weak Night for Trump? A DeSantis Flop? We Game Out Iowa.,"Primaries and Caucuses;Presidential Election of 2024;Politics and Government;United States Politics and Government;Democratic Party;DeSantis, Ron;Haley, Nikki R;Trump, Donald J;Des Moines (Iowa);Iowa"
111,Scientists are asking whether the planet’s warming is accelerating.,"It’s confirmed: 2023 was the planet’s warmest year on record and perhaps in the last 100,000 years. By far.",2024-01-09T19:29:45+0000,article,Climate,News,A New Era in Global Heat,Global Warming;Greenhouse Gas Emissions;Heat and Heat Waves
112,"Corrections that appeared in print on Tuesday, Jan. 9, 2024.","An article on Friday about the low use of Paxlovid among eligible patients misspelled the name of the pharmaceutical company that makes the medication ensitrelvir. It is Shionogi, not Shinogi.",2024-01-09T19:45:54+0000,article,Corrections,Correction,"Corrections: Jan. 9, 2024",
113,"A spokesman said the White House, which had been kept in the dark for three days about the defense secretary’s hospitalization, only learned of the diagnosis on Tuesday.","Defense Secretary Lloyd J. Austin III has been hospitalized for the past week because of complications after he had prostate cancer surgery, Walter Reed National Military Medical Center said in a statement on Tuesday.",2024-01-09T19:47:31+0000,article,U.S.,News,Austin Was Hospitalized for Complications From Prostate Cancer Surgery,"Austin, Lloyd J III;Prostate Cancer;Reed, Walter, National Military Medical Center;Defense Department;United States Politics and Government;Biden, Joseph R Jr"
114,Partisanship is having a huge effect on consumer surveys.,"The economy is good, but Americans feel bad about it. Or do they?",2024-01-09T19:50:13+0000,article,Opinion,Op-Ed,Is Poor Economic Sentiment All About MAGA?,International Trade and World Market;Economics (Theory and Philosophy);internal-sub-only-nl;United States Economy
115,A lawyer for the National Rifle Association said that Wayne LaPierre’s actions did not embody the organization. Mr. LaPierre announced his resignation as the group’s leader last week.,"A defense attorney for the National Rifle Association on Tuesday fought back against a civil suit by the State of New York, arguing that the actions of the N.R.A.’s leader, who spent fortunes on luxuries and travel, were not those of the organization itself.",2024-01-09T19:50:46+0000,article,New York,News,N.R.A. Lawyer Distances Gun Group From LaPierre’s Lavish Spending,"Gun Control;Ethics and Official Misconduct;Lobbying and Lobbyists;Suits and Litigation (Civil);Appointments and Executive Changes;National Rifle Assn;James, Letitia;LaPierre, Wayne;Manhattan (NYC)"
116,The American developer MSG Entertainment withdrew its bid to build a sister arena in Britain after opposition from Londoners and the city’s mayor.,"What happens in Vegas, it turns out, really does stay in Vegas.",2024-01-09T19:50:53+0000,article,World,News,A Giant Vegas-Style Sphere in London? Don’t Bet on It.,"Local Government;Outdoor Advertising;Parks and Other Recreation Areas;Sphere (Las Vegas, Nev);Dolan, James L;Khan, Sadiq;England;Europe;Great Britain;Las Vegas (Nev);London (England)"
117,The Federal Aviation Administration said that Boeing’s instructions for how airlines should check the planes were insufficient and that the company would revise them.,"Federal regulators on Tuesday said Boeing was revising its instructions for how airlines should inspect its 737 Max 9, delaying the manufacturer’s effort to get the jet back in the air after a panel in one of the planes blew out during a flight late last week.",2024-01-09T19:53:47+0000,article,Business Day,News,737 Max Inspections Delayed as Boeing Revises Guidance,"AIRLINES AND AIRPLANES;Aviation Accidents, Safety and Disasters;Boeing 737 Max Groundings and Safety Concerns (2019);ALASKA AIRLINES;Boeing Company;Federal Aviation Administration;United Airlines"
118,"A ruling by the court, and the timing of its decision, could be a major factor in determining when, or even whether, the former president will go to trial in the federal election case.",A three-judge panel of the federal appeals court in Washington heard arguments on Tuesday in a momentous case over former President Donald J. Trump’s claim that he is immune from criminal charges for the efforts he took to overturn the 2020 election.,2024-01-09T19:55:38+0000,article,U.S.,News,5 Takeaways From the Appeals Court Hearing on Trump’s Immunity Claim,"Federal Criminal Case Against Trump (2020 Election Case);Immunity from Prosecution;Presidential Election of 2024;Pan, Florence Y;Childs, J Michelle;Henderson, Karen LeCraft;Trump, Donald J;Presidential Election of 2020"
119,"Roundabout Theater Company, the biggest nonprofit on Broadway, said it would produce the three shows next season.","Roundabout Theater Company, the biggest nonprofit operating on Broadway, is planning to stage a jazz-inflected production of “The Pirates of Penzance,” Gilbert and Sullivan’s famed 19th-century comic operetta, in the spring of 2025, the organization said Tuesday.",2024-01-09T20:00:11+0000,article,Theater,News,"‘Pirates of Penzance,’ ‘English’ and ‘Yellow Face’ Bound for Broadway","Theater;Theater (Broadway);Theater (Off Broadway);Roundabout Theater Co;English (Play);The Pirates of Penzance (Opera);Toossi, Sanaz;Hwang, David Henry;Ellis, Scott (1957- );Karimloo, Ramin;Adams, Knud;Silverman, Leigh;Yellow Face (Play)"
120,"The renowned troupe will more than triple its footprint, growing its studio space and education programs.","The Paul Taylor Dance Company, founded in 1954 by the renowned choreographer, has long been one of the city’s most prominent troupes. But it has struggled in recent years to find space to match its ambitions for more performances, rehearsals, classes and community events.",2024-01-09T20:00:16+0000,article,Arts,News,Paul Taylor Dance Company to Move to Midtown in Major Expansion,"Dancing;Real Estate and Housing (Residential);Taylor, Paul, Dance Co;George Comfort & Sons;Tomlinson, John (Arts Executive);Taylor, Paul;Midtown Area (Manhattan, NY)"
121,"Modern Love in miniature, featuring reader-submitted stories of no more than 100 words.","I’d been a disobedient teenager, eager to rebel against authority. I resisted my parents and the church. But oddly, the one adult I could actually talk to was our Presbyterian minister, Dr. Moffatt. We reunited recently for his 99th birthday. He surprised me by saying he’d once considered becoming a politician to impact peoples’ lives. “But you’ve impacted plenty of lives,” I responded. “Take me; remember how obnoxious I was?” “Oh, yes,” he said, smiling. “Remember being the only person who made me feel accepted and OK?” He nodded. Then, looking at me straight on, he said, “Lee, it’s called love.” — Lee Guthrie",2024-01-09T20:00:17+0000,article,Style,News,Tiny Love Stories: ‘Remember How Obnoxious I Was?’,Love (Emotion);Modern Love (Times Column);Dating and Relationships
