,abstract,lead_paragraph,pub_date,document_type,section_name,type_of_material,headline,keywords
84,Scott Hogan and Katie Hale deliver a crossword that’s good for what ails you.,Jump to: Tricky Clues | Today’s Theme,2024-02-24T23:00:06+0000,article,Crosswords & Games,News,Special Treatment,"Hale, Katie (Crossword Constructor);Hogan, Scott (Crossword Constructor)"
85,"An 18-year-old Campbellsville University student was found unresponsive in his dorm room early Saturday and later pronounced dead at a hospital, officials said.","The police in Campbellsville, Ky., arrested a 21-year-old man who was wanted in connection with the killing of a Campbellsville University student on Saturday, officials said.",2024-02-24T23:02:50+0000,article,U.S.,News,Police in Kentucky Arrest Man in University Student’s Killing,"Murders, Attempted Murders and Homicides;Campbellsville (Ky);Colleges and Universities;Campbellsville University"
86,"The conservative gathering’s straw poll is hardly predictive, but it can show which way political winds are gusting on the far right.",Gov. Kristi Noem of South Dakota and the entrepreneur Vivek Ramaswamy tied for the top choice to be former President Donald J. Trump’s running mate in a straw poll on Saturday at a prominent gathering of conservative activists.,2024-02-24T23:12:50+0000,article,U.S.,News,Kristi Noem and Vivek Ramaswamy Are CPAC’s Choices for Trump’s Running Mate,"Conservative Political Action Conference;Trump, Donald J;Vice Presidents and Vice Presidency (US);Ramaswamy, Vivek (1985- )"
87,"Henry Barbour, a veteran R.N.C. member, is mounting a long-shot bid to keep the former president from taking control of the committee in order to block it from paying for his lawsuits.",A veteran Republican National Committee member has initiated a long-shot effort to prevent Donald J. Trump from taking over the party committee before he has enough delegates to become the presumptive presidential nominee in an effort to prevent the R.N.C. from paying his legal bills.,2024-02-24T23:27:58+0000,article,U.S.,News,Prominent Republican Seeks to Shield the Party From Paying Trump’s Legal Bills,"Republican National Committee;Presidential Election of 2024;Republican Party;Save America PAC;Barbour, Henry;Trump, Donald J;Trump, Lara (1982- );Whatley, Michael (1968- )"
88,"Lily Gladstone, Cillian Murphy and Margot Robbie led the celebrity fashion brigade.","A few short months ago, members of the Screen Actors Guild wore jeans, shorts and T-shirts while carrying picket signs in the last days of a lengthy strike. On Saturday, they were at their red-carpet best as they arrived at the Shrine Auditorium in Los Angeles for the 30th annual Screen Actors Guild Awards.",2024-02-24T23:59:18+0000,article,Style,News,All the Best Looks From the 2024 SAG Awards Red Carpet,"Fashion and Apparel;Awards, Decorations and Honors;Screen Actors Guild;Actors and Actresses;Celebrities;Television;Movies"
