,abstract,lead_paragraph,pub_date,document_type,section_name,type_of_material,headline,keywords
0,"The proposal, which calls for indefinite Israeli military control and buffer zones in the territory, rankled Arab nations and was rejected by Palestinians.","Prime Minister Benjamin Netanyahu of Israel released on Friday his most detailed proposal yet for a postwar Gaza, pledging to retain indefinite military control over the enclave, while ceding the administration of civilian life to Gazans without links to Hamas.",2024-02-24T00:00:16+0000,article,World,News,Netanyahu Issues First Plan for Postwar Gaza,"Israel-Gaza War (2023- );Israel;Netanyahu, Benjamin;Defense and Military Forces;Gaza Strip;West Bank;Palestinians;Hamas;Palestinian Authority;International Relations;United Nations Relief and Works Agency;Egypt;United States International Relations;Peace Process"
1,"In a letter, Joseph Ladapo said parents at an elementary school with confirmed measles cases can decide whether their children should attend school.","As a cluster of measles cases grew in an elementary school in southern Florida, the state’s surgeon general sent a letter to parents that contradicted widespread medical guidance about how to keep the disease from spreading.",2024-02-24T00:09:19+0000,article,Well,News,"Amid Florida’s Measles Outbreak, Surgeon General Goes Against Medical Guidance","Vaccination and Immunization;Children and Childhood;Measles;Disease Rates;Quarantines;Florida;Ladapo, Joseph A"
2,"His financial misdeeds may have led to conviction, but his extravagant sartorial tastes proved little help to the former N.R.A. chief’s case.","You’d think Wayne LaPierre would have read the playbook. After decades in the spotlight, the former chief executive of the National Rifle Association could have been expected to know that, for public figures, conspicuous consumption is always a bad look.",2024-02-24T00:15:03+0000,article,Style,News,Wayne LaPierre: Dapper as Charged,"LaPierre, Wayne;National Rifle Assn;Ethics and Official Misconduct;Fashion and Apparel;Suits (Apparel);Frauds and Swindling"
3,Evidence showed that the National Rifle Association’s leader lived well on donated money as he fought regulations on firearms.,"The case brought by New York’s attorney general, Letitia James, against the National Rifle Association aimed to show how it used donations from gun owners across the country to pay for luxuries and exotic travel for its executives.",2024-02-24T01:32:00+0000,article,New York,News,Guns and Goodies: How LaPierre Spent the N.R.A.’s Money,"LaPierre, Wayne;National Rifle Assn;Gun Control;Executive Compensation"
4,Cast an admiring eye on this scintillating themeless by Rebecca Goldstein and Rafael Musa.,"SATURDAY PUZZLE — Where to begin? I can’t be the only one who thought this after scanning this grid’s clues. I didn’t recognize a single factoid quickly, despite the specificity of most of the trivia questions; my mind didn’t click on any of the wordplay, either. Cue the cold sweat, which usually, and thankfully so, wakes up a few backup brain cells. In this case, they had a couple of ideas and good guesses, and then I slowly got rolling.",2024-02-24T03:00:06+0000,article,Crosswords & Games,News,Love Scene?,"Crossword Puzzles;Goldstein, Rebecca (Crossword Constructor);Musa, Rafael (Crossword Constructor)"
5,"Let loose by an act of vandalism, the Eurasian eagle-owl died after apparently striking an Upper West Side building, according to the zoo.","Flaco, the Eurasian eagle-owl whose escape from the Central Park Zoo and subsequent life on the loose in Manhattan captured the public’s attention, died Friday night after apparently striking a building on the Upper West Side, officials said.",2024-02-24T03:50:33+0000,article,New York,News,"Flaco, Escaped Central Park Zoo Owl and Defier of Doubts, Is Dead","Owls;Zoos;Central Park Zoo;Wildlife Conservation Society;Central Park (Manhattan, NY)"
6,"Quotation of the Day for Saturday, February 24, 2024.","“I’m not just an Ivy League kid who is smart in the classroom. I’m smart on the field, too.”",2024-02-24T05:00:00+0000,article,Corrections,Quote,"Quotation of the Day: Yale Tackle Isn’t the Best in the Draft, but Might Be the Most ‘Interesting’",
7,"Corrections that appeared in print on Saturday, Feb. 24, 2024.","A headline with an article on Friday about Senator Chuck Schumer’s visit to Ukraine misidentified the city that Mr. Schumer visited. He visited Lviv, not Kyiv.",2024-02-24T05:00:01+0000,article,Corrections,News,"Corrections: Feb. 24, 2024",
8,Nikki Haley trails Donald J. Trump by wide margins in her home state. Here are the things worth watching.,"South Carolina voters head to the polls on Saturday to cast ballots in a Republican presidential primary that could well determine the political fate of the state’s former governor, Nikki Haley, in her long-shot bid to derail former President Donald J. Trump’s march to the Republican nomination.",2024-02-24T05:01:14+0000,article,U.S.,News,What to Watch in the South Carolina G.O.P. Primary,"Presidential Election of 2024;United States Politics and Government;Primaries and Caucuses;Polls and Public Opinion;Republican Party;Haley, Nikki R;Trump, Donald J;South Carolina"
9,The costs of two years of war in Ukraine have been enormous. But many Russians are feeling optimistic.,The costs of two years of war in Ukraine have been enormous. But many Russians are feeling optimistic.,2024-02-24T05:05:01+0000,multimedia,World,Interactive Feature,Russia’s Brutal War Calculus,"Russia;Putin, Vladimir V;Ukraine"
10,"In a speech to the Black Conservative Federation, former President Donald J. Trump made express overtures to Black voters, whom he and his campaign are eager to win over.","Former President Donald J. Trump, in a speech to a Black conservative group on Friday night, said he believed that the four criminal cases he is facing have earned him support from Black voters because they saw the historic unfairness of the justice system reflected in his legal woes.",2024-02-24T07:02:24+0000,article,U.S.,News,"Trump Says Indictments, and His Mug Shot, Are Helping Him With Black Voters","Trump, Donald J;Mug Shots;Black People;Blacks;Discrimination;Conservatism (US Politics);Republican Party;Presidential Election of 2024;South Carolina;United States Politics and Government;Polls and Public Opinion"
11,"Surplus weed produced in states like Oklahoma is increasingly ending up in New York, fueling its illicit market and complicating the state’s efforts to expand legal cannabis sales.","In the dead of night last April, state drug agents in Oklahoma intercepted an 18-wheeler rumbling east toward the Arkansas border smuggling 7,000 pounds of marijuana hidden in security camera boxes.",2024-02-24T08:00:10+0000,article,New York,News,"Grown in Oklahoma, Smoked in New York: Illicit Marijuana’s Legal Roots",Marijuana;Black Markets;States (US);Drug Abuse and Traffic;Smuggling;Supply Chain;Medical Marijuana;Oklahoma;New York State;New York City
12,Feeling stuck on today’s puzzle? We can help.,"Hi busy bees! Welcome to today’s Spelling Bee forum. There are a number of terms that appear in both this article and other online discussions of the Spelling Bee; a glossary of those terms compiled by Monicat, a Times reader, can be found below.",2024-02-24T08:00:13+0000,article,Crosswords & Games,News,Spelling Bee Forum,Spelling Bee (Game);Crossword Puzzles
13,"Jose LaSalle is known as the Metropolitan Transportation Authority’s “weekend service czar.” That keeps him racing across the city on Sundays, and trying to grab lunch with his wife.","New Yorkers who take the subway on Sundays may not know the name Jose LaSalle, but they might have seen him around in his orange safety vest.",2024-02-24T08:00:14+0000,article,New York,News,How the Subway’s Weekend Problem Fixer Spends His Sundays,New York City;Subways;Delays (Transportation);Stations and Terminals (Passenger);Transit Systems;Metropolitan Transportation Authority;Content Type: Personal Profile
14,In case you need some puzzle help.,"Welcome to The Wordle Review. Be warned: This page contains spoilers for today’s puzzle. Solve Wordle first, or scroll at your own risk.",2024-02-24T08:00:16+0000,article,Crosswords & Games,News,Today’s Wordle Review,Wordle (Puzzle);Crossword Puzzles
15,In case you need some puzzle help.,"Good morning, dear connectors. Welcome to today’s Connections forum, where you can give and receive puzzle — and emotional — support.",2024-02-24T08:00:19+0000,article,Crosswords & Games,News,The Connections Companion,Crossword Puzzles;Connections (Game)
16,"A brooding biologist seeks transcendence in Martin MacInnes’s richly atmospheric, patiently unfurling novel “In Ascension.”","How to comprehend the vastness of the cosmos; how to comprehend not just the mystery of our place and purpose within it, but also our own lives as we live them on earth? Martin MacInnes’s Booker-longlisted third novel, “In Ascension,” is an elegiac voyage through these questions, a vaulting exploration of the interplay between the micro and the macro, the human and the otherworldly.",2024-02-24T10:00:08+0000,article,Books,Review,Cosmically Connected in a Journey From Deep Sea to Deep Space,"Books and Literature;In Ascension (Book);MacInnes, Martin (Author)"
17,Buying a small-town club offers a tempting entry to ownership. But the sport’s economics mean even multimillionaires can struggle to compete.,"Geoff Thompson knows there are plenty of people who want to buy what he has to sell. The phone calls and emails over the last few weeks have left no doubt. And really, that is no surprise. Few industries are quite as appealing or as prestigious as English soccer, and Mr. Thompson has a piece of it.",2024-02-24T10:00:27+0000,article,World,News,Why the Cost of Success in English Soccer’s Lower Leagues Keeps Going Up,Soccer;High Net Worth Individuals;English Premier League;Wrexham AFC (Soccer Team);England
18,The end of a pandemic-era policy that barred states from pushing people off Medicaid is threatening the financial stability of the U.S. safety net.,"Appointment cancellations and financial distress have become a constant at Bethesda Pediatrics, a nonprofit medical clinic in East Texas that is heavily dependent on Medicaid, the health insurance program for the poor.",2024-02-24T10:00:34+0000,article,Health,News,"As Medicaid Shrinks, Clinics for the Poor Are Trying to Survive",Medicaid;Poverty;Children and Childhood;Health Insurance and Managed Care;Texas;Tyler (Tex);United States;your-feed-science
19,"In “The Washington Book,” the Pulitzer Prize-winning critic Carlos Lozada mines a genre known for sanitized prose to revealing effect.","The nation’s capital is home to a dreary literary genre, the Washington book: political memoirs, campaign biographies, policy treatises and other works by politicians, government officials and D.C. hangers-on. They’re often self-aggrandizing, poorly written or crushingly boring. Many people buy and talk about these books, but fewer really read them (except to scan the index for their names).",2024-02-24T10:00:37+0000,article,Books,Review,Political Memoirs Are Mostly Junk. This Critic Finds the Morsels.,"Books and Literature;The Washington Book: How to Read Politics and Politicians (Book);Lozada, Carlos (Journalist);United States Politics and Government"
20,The filmmaker says it’s one of Marlon Brando’s: “To this day I don’t know that there’s as good a performance as that.”,Rob Reiner was well aware that the Christian nationalist movement had achieved considerable political clout.,2024-02-24T10:00:43+0000,article,Movies,News,Rob Reiner on ‘the Greatest Single Performance’ in U.S. Cinema,"Reiner, Rob;Movies;Content Type: Personal Profile"
21,"In “The Darkest White,” Eric Blehm chronicles the 2003 disaster that killed the pioneering snowboarder Craig Kelly and six others.","I have no shame in admitting to neither a scintilla of knowledge of, nor any potential ability in, the wildly popular sport of snowboarding. So the unfamiliar jargon and the curious cast of characters in Eric Blehm’s latest outdoor true adventure story passed right over my head.",2024-02-24T10:00:46+0000,article,Books,Review,"The Story of a Deadly Avalanche, and Those It Claimed","Books and Literature;The Darkest White: A Mountain Legend and the Avalanche That Took Him (Book);Blehm, Eric;Deaths (Fatalities);Avalanches;Mountains;Snowboarding;Kelly, Craig (1963- );Content Type: Personal Profile"
22,"Videos of people executing elaborate, logic-defying feats with household objects have found an avid following on social media.","There are nights when Michael Shields lies awake next to his wife and thinks about Ping-Pong balls. He muses on their arcs and speeds, the ways they bounce off a wooden plank or roll down a Hot Wheels track. In the mornings he often turns his visions into reality, and millions tune in to watch.",2024-02-24T10:01:05+0000,article,Style,News,35 Hours for a 10-Second Clip: The Art of the TikTok Trick Shot,"Social Media;Video Recordings, Downloads and Streaming;TikTok (ByteDance);YouTube.com"
23,"The Bodacious Belles, a women’s group in Beaufort, N.C., shows the difference a network of support can make in an aging America.","Martha Barnes’s home was buzzing. It was a Saturday in little Beaufort, N.C., time to get ready for the town’s Mardi Gras parade, and women were zigzagging around the house, applying makeup, laughing and calling out repeatedly for the Fireball Cinnamon Whisky sitting on the kitchen counter.",2024-02-24T10:01:07+0000,article,U.S.,News,"Their Weapons Against the Effects of Aging: Friendship, and Some Fancy Footwork","vis-photo;Organizations, Societies and Clubs;Women and Girls;Elderly;Longevity;Beaufort Sea"
24,"Nikki Haley and her onetime boss, former President Donald J. Trump, have used false and misleading claims about polls and tax proposals while exchanging jabs on the campaign trail.",Follow for live updates on the 2024 presidential election.,2024-02-24T10:02:12+0000,article,U.S.,News,Fact-Checking Trump and Haley’s War of Words,"United States Politics and Government;Presidential Election of 2024;Primaries and Caucuses;Republican Party;Haley, Nikki R;Trump, Donald J;Rumors and Misinformation;Prices (Fares, Fees and Rates);Polls and Public Opinion;International Trade and World Market;Income Tax;Gasoline Tax (US);Customs (Tariff);Immigration and Emigration;Border Barriers"
25,"“It is a public health concern,” one U.N. official said of the lack of toilets for displaced people in the territory. “But the second thing is simply just dignity.”","In a sprawling tent encampment in Gaza, the Israeli bombs fall close enough to hear and feel. But daily life is also a struggle against hunger, cold and a growing sanitation crisis.",2024-02-24T10:02:13+0000,article,World,News,Sanitation Crisis in Gaza Spreads Disease,Israel-Gaza War (2023- );Gaza Strip;Rafah (Gaza Strip);Palestinians;Refugees and Displaced Persons;Bathrooms and Toilets;Sewers and Sewage;Shortages;Water;Israel;Defense and Military Forces
26,"The beloved 1975 musical returns to Broadway this spring, with nods to Black culture like second-line parades and Underground Railroad quilts.","Schele Williams first saw “The Wiz” when a tour of the original Broadway production came through Dayton, Ohio. She was 7 years old, and recalled it being the most “beautiful reflection of Blackness that I had never seen.”",2024-02-24T10:02:29+0000,article,Theater,News,Reviving ‘The Wiz’ Through ‘the Blackest of Black Lenses’,"The Wiz (Play);Theater;Theater (Broadway);Black People;Blacks;Dancing;Music;Williams, Schele;Ruffin, Amber;Knight, JaQuel;Beachler, Hannah"
27,"An epidemic of auto thefts in Canada’s largest city has left many residents exasperated, with some getting creative about deterrence efforts, such as installing bollards in home driveways.","Whenever Dennis Wilson wants to take a drive in his new SUV, he has to set aside an extra 15 minutes. That’s about how long it takes to remove the car’s steering wheel club, undo four tire locks and lower a yellow bollard before backing out of his driveway.",2024-02-24T10:02:30+0000,article,World,News,"For Car Thieves, Toronto Is a ‘Candy Store,’ and Drivers Are Fed Up",Toronto (Ontario);Robberies and Thefts;Automobiles;Canada;Quebec Province (Canada);Organized Crime
28,These novels hinge on split-second decisions that change everything.,"This month’s thrillers pose intriguing questions. Can one seemingly unimportant decision change everything? What would happen if people could siphon time from the lives of others? And, most chilling: What awful things will parents do to protect their children?",2024-02-24T10:02:46+0000,article,Books,Review,"Three Riveting, Slow-Burn New Thrillers","Books and Literature;Frick, Kit (Author);Winters, Ben H;McTiernan, Dervla;genre-books-thriller"
29,"Robert Garland, Dance Theater’s new artistic director and longtime resident choreographer, presides over his first season at New York City Center.","Robert Garland has held many positions at Dance Theater of Harlem over many years — principal dancer, resident choreographer, school director, archivist and company webmaster. At long last, he has caught the prize title: artistic director.",2024-02-24T10:02:51+0000,article,Arts,News,"At Dance Theater of Harlem, a New Lease on History and Ballet","Dancing;Dance Theater of Harlem;Garland, Robert;Nichols, Kyra"
30,"Even if your rental arrangement is off the books, tenants have legal rights that you need to consider.","Q: I lease a three-bedroom market-rate apartment in Brooklyn. I rent out two of the bedrooms, but the situation with my roommates is deteriorating for personal and financial reasons. The rent I charge them is way below market rate, and I’ll have to raise it significantly or ask the occupants to leave. I don’t have a written agreement with them. My lease doesn’t permit me to rent out the other rooms, and my landlord is unaware of this situation. What recourse do I have if the occupants refuse to pay the increase, or refuse to leave?",2024-02-24T10:03:12+0000,article,Real Estate,News,How Do I Evict My Roommates?,Real Estate and Housing (Residential);Renting and Leasing (Real Estate);Roommates;Evictions;Landlords
31,"Tribeca Pediatrics made the unglamorous job of caring for kids into a replicable, exportable aesthetic — to the tune of millions.","In 1994, Dr. Michel Cohen, a 35-year-old Moroccan-French émigré, opened Tribeca Pediatrics in a storefront on Harrison Street in Manhattan’s TriBeCa neighborhood.",2024-02-24T10:03:13+0000,article,Fashion & Style,News,The Doctor’s Office as Status Symbol,"Tribeca Pediatrics;Doctors;Parenting;Real Estate (Commercial);Children and Childhood;TriBeCa (Manhattan, NY);Gentrification;New York City;Cohen, Michael (Doctor)"
32,"The new “Walking Dead” spinoff, premiering Sunday on AMC and AMC+, builds on more than a decade of back story. We’re here to help.","The new six-part mini-series “The Walking Dead: The Ones Who Live,” the latest installment in the sprawling “Walking Dead” universe, premieres Sunday on AMC and AMC+. It finds Andrew Lincoln and Danai Gurira reprising their longtime roles as Rick Grimes and Michonne, the weathered survivors of a postapocalyptic wasteland populated by flesh-devouring zombies.",2024-02-24T10:04:06+0000,article,Arts,News,‘The Ones Who Live’ Picks Up Where ‘The Walking Dead’ Left Off. Where Was That Again?,Television;The Walking Dead (TV Program);The Walking Dead: The Ones Who Live (TV Program);AMC (TV Network)
33,Wearables can now track everything from heart rate variability to stride length. But access to so much data does not always mean better health.,"Over the past few years, upping your exercise game has started to feel like getting a degree in data science.",2024-02-24T10:04:07+0000,article,Well,News,Can Fitness Trackers Really Make You Fitter?,Wearable Computing;Exercise;Running;Medical Devices;Watches and Clocks;Apple Inc;Garmin Ltd;Oura Health Oy;Whoop Inc
34,"A climate-conscious reporter tried an app that connects eaters and surplus restaurant food. She got bargains, no booze and some pleasant surprises.",Food waste and I have a history.,2024-02-24T10:04:17+0000,article,Climate,News,I Spent a Week Rescuing Food From the Trash. Here’s What I Ate.,Mobile Applications;Food;Too Good To Go Inc;Sustainable Living;Waste Materials and Disposal
35,"The F.D.A. recently approved the first therapy for patients in danger of losing their toes, fingers and other exposed parts of the body.","The first time Dr. Peter Hackett saw a patient with frostbite, the man died from his wounds. It was in Chicago in 1971, and the man had gotten drunk and passed out in the snow, his fingers so frozen that gangrene eventually set in.",2024-02-24T10:04:22+0000,article,Health,News,Severe Frostbite Gets a Treatment That May Prevent Amputation,FROSTBITE;Gangrene;AMPUTATION;Cold and Cold Spells;Homeless Persons;Drugs (Pharmaceuticals);Research;Food and Drug Administration;New England Journal of Medicine;your-feed-healthcare
36,"After nearly two years and only scraps of information, a Ukrainian family still hopes their son, a marine captured by the Russians in Mariupol, will come home soon.","His attempts to escape the Russian siege had failed. He and his fellow Ukrainian marines were surrounded, dozens of miles from friendly lines. They were nearly out of food and water. Some panicked, others quietly resigned themselves to what would come next.",2024-02-24T10:04:34+0000,article,World,News,Waiting for Serhiy,Defense and Military Forces;Russian Invasion of Ukraine (2022);Prisoners of War;Mariupol (Ukraine);Ukraine;Russia;Trostyanets (Ukraine);audio-neutral-informative;audio-negative-sad;audio-negative-tragedy
37,Her supporters tend to be moderate and college educated — precisely the type of voters who have helped decide recent presidential races. We spoke with nearly 40 to see where they’re leaning.,,2024-02-24T10:04:45+0000,article,U.S.,News,"If Trump Drives Haley From the Race, What Will Her Voters Do in November?","Haley, Nikki R;Trump, Donald J;Biden, Joseph R Jr;Presidential Election of 2024;United States Politics and Government;Voting and Voters;Polls and Public Opinion;South Carolina;Republican Party;Primaries and Caucuses"
38,"While Catholic teaching expressly forbids in vitro fertilization, Protestants tend to be more open.","The Alabama Supreme Court ruling that embryos should be considered children has forced Americans to grapple with a mess of complicated realities about law, infertility, medicine and politics.",2024-02-24T10:04:45+0000,article,U.S.,News,What Christian Traditions Say About I.V.F. Treatments,"In Vitro Fertilization;Conservatism (US Politics);Christians and Christianity;Abortion;Infertility;Roman Catholic Church;Southern Baptist Convention;Parker, Tom (1951- );Alabama"
39,"Western sanctions haven’t worked. Weapons from allies are running low. Pressure may build on Kyiv to seek a settlement, even from a weakened position.","Two years after Russia’s invasion of Ukraine, the United States has the capacity to keep Kyiv supplied with the weapons, technology and intelligence to fend off a takeover by Moscow. But Washington is now perceived around Europe to have lost its will.",2024-02-24T10:26:39+0000,article,World,News,Hard Lessons Make for Hard Choices 2 Years Into the War in Ukraine,"Russian Invasion of Ukraine (2022);Russia;Putin, Vladimir V;Ukraine;Zelensky, Volodymyr;Defense and Military Forces;International Relations;United States International Relations;Embargoes and Sanctions;Politics and Government;Foreign Aid;European Union;Biden, Joseph R Jr;Presidential Election of 2024"
40,"An economic analysis found that in several Canadian cities, prices would have to plummet, or incomes would have to soar improbably, to restore affordability.","Charles St-Arnaud, the chief economist at Alberta Central, the central bank for the province’s credit unions, started out his inquiry with a simple question: How far would prices need to fall, or would incomes need to rise, to make housing affordable again in Canada?",2024-02-24T11:00:07+0000,article,World,News,Few Good Solutions as Home Affordability Plummets,Real Estate and Housing (Residential);Canada
41,"If you voted in the Democratic primary this month, you can’t vote in the Republican one, too.","South Carolina has no formal party registration, so registered voters can participate in the primary regardless of whether they identify as Republicans, Democrats or independents.",2024-02-24T11:00:18+0000,article,U.S.,News,How to Vote in South Carolina,"United States Politics and Government;Voting Rights, Registration and Requirements;Primaries and Caucuses;Republican Party;South Carolina"
42,The polls are now closed in the South Carolina Republican primary and results should start flowing in momentarily.,The polls are now closed in the South Carolina Republican primary and results should start flowing in momentarily.,2024-02-24T11:00:18+0000,article,U.S.,News,Trump is the overwhelming front-runner in South Carolina. Here’s the latest.,
