,abstract,lead_paragraph,pub_date,document_type,section_name,type_of_material,headline,keywords
41,"In her speech, Gov. Kathy Hochul will propose providing leave for prenatal care, changing the way reading is taught and promoting artificial intelligence research.","Good morning. It’s Tuesday, the day Gov. Kathy Hochul is to deliver her State of the State address. We’ll find out what to listen for.",2024-01-09T10:00:53+0000,article,New York,briefing,State of the State: Hochul Unveils Her Agenda,"New York City;internal-storyline-no;State Legislatures;Politics and Government;Law and Legislation;Artificial Intelligence;Pregnancy and Childbirth;State of the State Message (NYS);Reading and Writing Skills (Education);Hochul, Kathleen C;Albany (NY)"
42,"In “Making It in America,” Rachel Slade examines the challenges of domestic production through the lens of one Maine company.","Is it possible to buy American in an age of offshoring? And is that the right goal — for workers, consumers or the planet? The journalist Rachel Slade explores these questions in “Making It in America,” which takes as a case study one small clothing manufacturer in Maine.",2024-01-09T10:00:55+0000,article,Books,Review,Buy American? Easier Said Than Done.,"Factories and Manufacturing;Books and Literature;Wages and Salaries;Fashion and Apparel;Labor and Jobs;International Trade and World Market;Organized Labor;Layoffs and Job Reductions;Making It in America: The Almost Impossible Quest to Manufacture in the U.S.A. (and How It Got That Way) (Book);Slade, Rachel;United States"
43,The system can be fixed to both benefit the country and provide order to the border.,The system can be fixed to both benefit the country and provide order to the border.,2024-01-09T10:00:55+0000,multimedia,Opinion,Interactive Feature,How to Fix America’s Immigration Crisis,"Immigration and Emigration;Democratic Party;Republican Party;Biden, Joseph R Jr;Customs and Border Protection (US)"
44,"A congressional committee made the demand of the Commerce Department after The Times reported on concerns among U.S. intelligence officials over the Emirati company, G42.",A U.S. congressional committee has asked the Commerce Department to look into whether a giant technology company controlled by the ruling family of the United Arab Emirates should be put under trade restrictions because of its ties to China.,2024-01-09T10:00:56+0000,article,U.S.,News,Lawmakers Push U.S. to Consider Trade Limits With A.I. Giant Tied to China,International Relations;Espionage and Intelligence Services;Computers and the Internet;Artificial Intelligence;Surveillance of Citizens by Government;Classified Information and State Secrets;Embargoes and Sanctions;Commerce Department;United Arab Emirates;China;House of Representatives;Yitu Technology;ToTok (Mobile App);Dark Matter LLC
45,"Local officials called for residents to deter the homeless in Kalispell, Mont., but unhoused residents said they were then accosted and attacked.","After watching a growing series of tents and other makeshift shelters spread into city parks and sidewalks, officials in northwestern Montana decided it was time for a crackdown on homelessness.",2024-01-09T10:00:57+0000,article,U.S.,News,A City’s Campaign Against Homelessness Brings Stories of Violence,Homeless Persons;Assaults;Local Government;Kalispell (Mont);Montana
46,"For those of us who have difficulty finding peace while sitting in one place, clamming can be an unexpected escape.","On these dark winter evenings, when the end of the day has crept up all too quickly and both of my children are speaking to me at once while I’m trying to follow a recipe and my laptop is still open with incomplete work, I find myself daydreaming of summer. I think of the one activity and place that quiets my mind and restores my drained reserves: clamming on Cape Cod, which is foraging for clams, from large quahogs that can be baked or used for chowder to — my favorite — smaller ones, the so-called littleneck clams, that you eat raw that same day at cocktail hour.",2024-01-09T10:01:05+0000,article,Magazine,News,Tired of Meditation? Try Looking for Clams.,Clams;Parenting;Cape Cod (Mass);Anxiety and Stress
47,"Inside the halls of power, his performance worked for a time. Outside, he’s a flop.","George Santos was expelled from Congress on a Friday in December. On the next business day, he announced a new role: as a kind of clown-for-hire on Cameo, an app and website where he offered his services recording personalized videos for fans. First he priced the messages at $75 each, but soon he was charging $200, then $400, then $500 a pop. But last week, the market contracted. The videos dropped to $350 apiece.",2024-01-09T10:01:07+0000,article,Arts,News,The Fading Online Celebrity of George Santos,"Santos, George (1988- );Social Media;Cameo (Mobile App);United States Politics and Government;House of Representatives"
48,An advice manual for navigating the “dates” we go on when we are looking for a job.,An advice manual for navigating the “dates” we go on when we are looking for a job.,2024-01-09T10:01:17+0000,multimedia,Business Day,Interactive Feature,What You Can Learn About Job-Hunting From Dating Apps. Really.,vis-design;Hiring and Promotion;Labor and Jobs;Online Dating;Dating and Relationships
49,"The film celebrates Leonard Bernstein’s musical duality, but fails to seriously engage with his bisexuality.","There’s a heartbreaking scene in Bradley Cooper’s “Maestro,” about the marriage of the composer and conductor Leonard Bernstein (Cooper) to the actress Felicia Montealegre (Carey Mulligan), in which, as the couple argue in the bedroom of their Upper West Side apartment, Macy’s parade inflatables glide past the windows. A giant Snoopy echoes a Snoopy we saw in a family scene; it also gestures at the awkward gulf between Bernstein’s private and public lives, as if the musician himself were yet another helium-propelled icon from the Thanksgiving pantheon. Montealegre’s accusation, “Your truth is a [expletive] lie!” nails Bernstein’s privilege, condemning the habits and appetites he expects his family to tolerate and support.",2024-01-09T10:01:18+0000,article,Magazine,News,The False Note in Bradley Cooper’s ‘Maestro’,"Movies;Homosexuality and Bisexuality;Classical Music;Maestro (Movie);Bernstein, Leonard;Cooper, Bradley"
50,Peter Beinart warns that the country is committing a sin that “cannot be atoned for.”,"What are Israel’s plans for Gaza if it succeeds in expelling Hamas? In this audio essay, Peter Beinart argues that the country’s goal is very clear: to force Palestinians to leave. Beinart believes America’s blanket support of Israel makes it complicit in crimes against humanity. “I want U.S. diplomats to understand that the forced expulsion of a population or part of a population is a war crime,” Beinart says. “I want U.S. government officials to fear that this will be their legacy and to ensure that it’s not.”",2024-01-09T10:01:19+0000,article,Opinion,Op-Ed,The Hard Truth of Israel’s Endgame in Gaza,"Israel;Israel-Gaza War (2023- );Palestinians;Hamas;Gaza Strip;Jews and Judaism;Politics and Government;Biden, Joseph R Jr;United States International Relations;Terrorism;War Crimes, Genocide and Crimes Against Humanity;audio-neutral-informative"
51,"Bruce Falck, who left Twitter during Elon Musk’s takeover bid, had something more important going on at the time: completing a longed-for family home.","Bruce Falck, who left Twitter during Elon Musk’s takeover bid, had something more important going on at the time: completing a longed-for family home.",2024-01-09T10:01:22+0000,multimedia,Real Estate,Slideshow,A Luxurious Lean-to in Sonoma County,"Real Estate and Housing (Residential);Interior Design and Furnishings;ARCHITECTURE;Healdsburg (Calif);Falck, Bruce"
52,"Once you see why, you may never want it to end.","Consider the plight of January, the sad sack of months.",2024-01-09T10:01:25+0000,article,Style,News,January’s Secret: It’s the Best Month,New Year;Winter (Season)
53,"Even if the war ends tomorrow, its effects will last a lifetime for new mothers and their children.","After Israel began its invasion of Gaza shortly after Hamas’s attack on Oct. 7, Aya Khrais — a pregnant 26-year-old dentist, wife of a doctor and mother of a 2-year-old girl living in Gaza City — lost contact with the doctors and health services she needed for prenatal care and for managing her diabetes.",2024-01-09T10:01:29+0000,article,Opinion,Op-Ed,"For Gaza’s Pregnant Women and Newborns, the War Will Never Be Over",Israel-Gaza War (2023- );Pregnancy and Childbirth;Infant Mortality;Babies and Infants;Women and Girls;Civilian Casualties;Hamas;World Health Organization;Israel;Gaza Strip
54,"A pair of idiosyncratic, ultraconservative House Republicans are risking the ire of the former president and his supporters to try to bolster the Florida governor.",Most House Republicans operate under an unspoken but ironclad rule: Do whatever you can to avoid provoking the wrath of former President Donald J. Trump.,2024-01-09T10:01:30+0000,article,U.S.,News,"Defying Trump, G.O.P. Congressmen Hit the Road for DeSantis","Iowa;United States Politics and Government;Presidential Election of 2024;Primaries and Caucuses;Massie, Thomas H;DeSantis, Ron;Roy, Chip (1972- );Trump, Donald J"
55,Resistance to his candidacy is not futile.,"The outcome of the 2016 presidential election was such a shocking event that for people of a certain cast of mind, Donald Trump is less a politician than a force of history.",2024-01-09T10:01:38+0000,article,Opinion,Op-Ed,Imagine if Trump Loses,"Presidential Election of 2024;Presidential Election of 2016;United States Politics and Government;Storming of the US Capitol (Jan, 2021);Fourteenth Amendment (US Constitution);Democracy (Theory and Philosophy);Supreme Court (US);Republican Party;Trump, Donald J;Primaries and Caucuses"
56,A three-judge panel appeared unlikely to grant the former president’s request that it throw out federal criminal charges that he plotted to overturn the 2020 election.,"A federal appeals court expressed deep skepticism on Tuesday about former President Donald J. Trump’s claim that he is immune from charges of plotting to subvert the 2020 election, suggesting that it is unlikely to rule in his favor on a central element of his defense.",2024-01-09T10:01:39+0000,article,U.S.,News,Appeals Court Seems Skeptical of Trump’s Immunity Claim,"Trump, Donald J;Federal Criminal Case Against Trump (2020 Election Case);Presidents and Presidency (US);Immunity from Prosecution;Justice Department;Appeals Courts (US);United States Politics and Government;Smith, Jack (Attorney)"
57,"With the former president busy defending himself in court from 91 felony charges, his campaign has deployed high-profile conservatives to help fill the gaps in Iowa.","Less than a week before Iowans decide whether to slingshot Donald J. Trump toward another presidential nomination, his schedule looks like this: Go to Washington for an appeals court hearing on Tuesday. Pop into Iowa for a Fox News town-hall event on Wednesday — and then make an expected return to court on Thursday, this time in New York.",2024-01-09T10:01:43+0000,article,U.S.,News,"To Win Iowa, Trump Turns to Allies Like Marjorie Taylor Greene","Trump, Donald J;Presidential Election of 2024;Republican Party;Primaries and Caucuses;Iowa;Right-Wing Extremism and Alt-Right;Conservatism (US Politics);Greene, Marjorie Taylor (1974- );Noem, Kristi;United States Politics and Government"
58,"Bruce Falck, who left Twitter during Elon Musk’s takeover bid, had other things on his mind: completing a longed-for family home in Northern California.","Bruce Falck long dreamed of following the example set by his father, who ran a construction company in Johannesburg, South Africa: He wanted to build a house designed specifically for his family.",2024-01-09T10:02:37+0000,article,Real Estate,News,A Former Twitter Exec Builds His Dream House in Wine Country,"Real Estate and Housing (Residential);Interior Design and Furnishings;ARCHITECTURE;Healdsburg (Calif);Falck, Bruce"
59,"Singulair, now a generic, is still used by millions of people in the United States even after thousands of patients and dozens of studies have described harm.","In early 2020, the Food and Drug Administration responded to decades of escalating concerns about a commonly prescribed drug for asthma and allergies by deploying one of its most potent tools: a stark warning on the drug’s label that it could cause aggression, agitation and even suicidal thoughts.",2024-01-09T10:03:03+0000,article,Health,News,The F.D.A. Warned an Asthma Drug Could Induce Despair. Many Were Never Told.,Suicides and Suicide Attempts;Asthma;Drugs (Pharmaceuticals);ALLERGIES;Obsessive-Compulsive Disorder;Food and Drug Administration;Merck & Company Inc;World Health Organization;United States;Children and Childhood;Organon Inc;audio-neutral-informative;audio-negative-sad
60,"In the ruins of two Gazan towns, New York Times journalists witnessed the sheer destruction that Israel’s war has wrought and the devastation of Hamas’s operations.","For a few fleeting moments, the two-story house on the edge of Bureij, a ruined town in central Gaza, still felt like a Palestinian home.",2024-01-09T10:28:10+0000,article,World,News,A Glimpse Inside a Devastated Gaza,Israel-Gaza War (2023- );Defense and Military Forces;Hamas;Gaza Strip;Israel;International Court of Justice (UN);Civilian Casualties;Palestinians;Refugees and Displaced Persons;Graffiti;Maghazi (Gaza Strip);Bureij (Gaza Strip);vis-photo
61,Wenheng Zhao pleaded guilty to charges that he sent photos of American military installations and details of U.S. military exercises to an intelligence officer working for China.,A United States Navy sailor who sent an intelligence officer working for the Chinese government photos of American military installations and details of naval training exercises in Asia was sentenced to more than two years in prison on Monday.,2024-01-09T10:58:17+0000,article,U.S.,News,U.S. Navy Sailor Who Helped China Is Sentenced to 2 Years in Prison,"United States Defense and Military Forces;Espionage and Intelligence Services;Decisions and Verdicts;Military Bases and Installations;Defense and Military Forces;Classified Information and State Secrets;Bribery and Kickbacks;Wei, Jinchao (Patrick);Zhao, Wenheng;Justice Department;United States Navy"
62,Hear the news in five minutes.,"The New York Times Audio app is home to journalism and storytelling, and provides news, depth and serendipity. If you haven’t already, download it here — available to Times news subscribers on iOS — and sign up for our weekly newsletter.",2024-01-09T11:00:08+0000,article,Podcasts,News,"Trump’s Immunity Claim in Court, and a Glimpse Inside Gaza","Immunity from Prosecution;Newspapers;New York State Criminal Case Against Trump (71543-23);Boeing Company;Trump, Donald J;Israel;Hamas;Gaza Strip"
63,How communities across the U.S. are fueling a secondary arms market with guns slated for destruction.,"Across the United States, hundreds of towns and cities are trying to get guns off the streets by turning them over to businesses that offer to destroy them.",2024-01-09T11:00:13+0000,article,Podcasts,News,The Afterlife of a Gun,"Arms Trade;Mcintire, Mike;United States;Gun Control"
64,"In meetings with Israeli leaders, the U.S. secretary of state held out the prospect of Saudi recognition to prod Israel to curb combat operations in Gaza and accept a path to Palestinian statehood.","Antony J. Blinken, the U.S. secretary of state, and a Saudi ambassador asserted on Tuesday the possibility of diplomatic recognition of Israel by Saudi Arabia if the Israeli government alleviates the suffering of residents of Gaza and puts Palestinians on a path toward statehood.",2024-01-09T11:12:48+0000,article,World,News,"Saudi-Israel Ties Depend on Steps Toward a Palestinian State, Blinken Says","Israel-Gaza War (2023- );Palestinians;International Relations;United States International Relations;Palestinian Authority;Hamas;Israel;Saudi Arabia;Gaza Strip;Blinken, Antony J;Biden, Joseph R Jr;Netanyahu, Benjamin;Mohammed bin Salman (1985- )"
65,"A warning from Taiwan about a satellite, erroneously called a missile in English, raised concerns about Chinese harassment days before an election.","Taiwan’s defense ministry issued an urgent alert Tuesday about a Chinese satellite launched on a rocket flying over the island, an alarming message that interrupted the final days of campaigning before a major election and spurred accusations of a political ploy.",2024-01-09T11:47:24+0000,article,World,News,"A Missile, a Rocket or a Satellite? Chinese Flyover Sows Confusion in Taiwan.",International Relations;Defense and Military Forces;Chinese Nationalist Party (Taiwan);Democratic Progressive Party (Taiwan);China;Taiwan;Satellites;Rumors and Misinformation;False Alarms;Security and Warning Systems
66,A case before an appeals court in Washington could influence how the former president’s trials will play out this year.,"Donald Trump’s four criminal trials can seem dizzying, including both federal and state cases, across Florida, Georgia, New York and Washington. But it’s worth remembering that the cases have different timetables. And any case that might produce a verdict before Election Day is probably more important than the others.",2024-01-09T11:48:25+0000,article,Briefing,briefing,A Major Trump Hearing,"internal-storyline-no;Trump, Donald J;Presidential Election of 2020;Presidential Election of 2024;Federal Criminal Case Against Trump (Documents Case);Georgia Criminal Case Against Trump (2020 Election);New York State Criminal Case Against Trump (71543-23);Federal Criminal Case Against Trump (2020 Election Case)"
67,"Month after month global temperatures didn’t just break records, they surpassed them by far. This year could be even warmer.","The numbers are in, and scientists can now confirm what month after month of extraordinary heat worldwide began signaling long ago. Last year was Earth’s warmest by far in a century and a half.",2024-01-09T12:00:04+0000,article,Climate,News,See How 2023 Shattered Records to Become the Hottest Year,Global Warming;Greenhouse Gas Emissions;Copernicus Climate Change Service;Heat and Heat Waves;Research;Two Thousand Twenty Three
68,"For a few fleeting moments, the two-story house on the edge of Bureij, a ruined town in central Gaza, still felt like a Palestinian home.","For a few fleeting moments, the two-story house on the edge of Bureij, a ruined town in central Gaza, still felt like a Palestinian home.",2024-01-09T12:02:36+0000,article,World,News,New York Times journalists get a glimpse inside a devastated Gaza.,
69,Authorities in New York and the surrounding area are warning residents to prepare for treacherous weather from Tuesday night into Wednesday.,"A major coastal storm will bring excessive rain and damaging winds to New York City and the surrounding area from late Tuesday until midday Wednesday, the National Weather Service said. The strongest winds were expected from 10 p.m. until 3 a.m., with gusts of up to 70 m.p.h. were along the coast. A citywide flood watch was in effect until noon Wednesday, and widespread power outages were expected",2024-01-09T12:38:09+0000,article,New York,News,New York Region Is Under High Wind Warning as Forecasters Warn of Flooding,"Floods;Rain;Weather;Wind;Power Failures and Blackouts;Hochul, Kathleen C;Murphy, Philip D (1957- );New York Metropolitan Area"
70,"Safety checks have uncovered loose bolts on the grounded jetliners, raising more questions for management over how the top-selling planes are built.","The trouble at Boeing is deepening after safety inspectors at Alaska Airlines and United Airlines found loose bolts on some grounded 737 Max jetliners, drawing scrutiny to the quality control process for one of the world’s best-selling aircraft models.",2024-01-09T12:57:43+0000,article,Business Day,News,Boeing’s Max 9 Crisis Deepens,"internal-storyline-no;Boeing Company;Calhoun, David L;Alaska Air Group Inc;United Airlines;AIRLINES AND AIRPLANES"
71,The panel includes a Republican appointee who is no stranger to cases involving Donald J. Trump.,,2024-01-09T13:51:18+0000,article,U.S.,News,Who are the judges hearing the appeal?,
72,"Stargaze in the desert, see elephant seals and more.",With the new year come wonderful new opportunities to explore the Golden State.,2024-01-09T14:00:12+0000,article,U.S.,briefing,The Best State Parks to Visit This Winter,California
73,Have you been paying attention to the news recently? See how many of these 10 questions you can get right.,Have you been paying attention to the news recently? See how many of these 10 questions you can get right.,2024-01-09T14:04:52+0000,multimedia,The Learning Network,Interactive Feature,"Weekly Student News Quiz: Primary Season, Football, Mickey Mouse",
74,"The Irish singer-songwriter, known for her powerful, evocative voice, died at 56 at a residence in London in July.",A London coroner’s office said Tuesday that the Irish singer Sinead O’Connor died from natural causes.,2024-01-09T14:07:45+0000,article,Arts,News,"Sinead O’Connor Died of Natural Causes, Coroner Says","Pop and Rock Music;O'Connor, Sinead;London (England);Ireland"
75,"Israeli officials have told foreign journalists that they are starting to slow military operations in Gaza, while assuring the Israeli public that the war against Hamas will go on.","With a vast chasm between how Israelis see the war in Gaza and how much of the world does, Israel’s leaders have taken to adopting different rhetoric when addressing the two audiences about how its military campaign against Hamas will be conducted over the year ahead.",2024-01-09T14:12:54+0000,article,World,News,"Israel, Shifting War Tempo, Tailors Its Messages for Home and Abroad","Israel-Gaza War (2023- );Israel;Defense and Military Forces;Hamas;United States International Relations;Politics and Government;News and News Media;Civilian Casualties;Terrorism;Palestinians;War Crimes, Genocide and Crimes Against Humanity;Polls and Public Opinion;Gaza Strip"
76,"With plagiarism in the news, here are five novels that show it's an engrossing plot device, too.","With plagiarism in the news, here are five novels that show it's an engrossing plot device, too.",2024-01-09T14:17:53+0000,multimedia,Books,Interactive Feature,5 Novels About Plagiarism,Books and Literature;Writing and Writers;Book Trade and Publishing;Plagiarism;Content Type: Service
77,"Gabriel Attal, 34, replaces Élisabeth Borne in a cabinet shuffle that President Emmanuel Macron hopes can reinvigorate a term marked by drift and division.","In a typically bold bid to revitalize his second term, President Emmanuel Macron named Gabriel Attal, 34, as his new prime minister, replacing Élisabeth Borne, 62, who made no secret of the fact that she was unhappy to be forced out.",2024-01-09T14:19:48+0000,article,World,News,France Gets Its Youngest and First Openly Gay Prime Minister,"France;Attal, Gabriel;Homosexuality and Bisexuality;Legislatures and Parliaments;Macron, Emmanuel (1977- );Borne, Elisabeth"
78,A new economic report predicted a year of weak growth and said the world faced a decade of “wasted opportunity.”,"The global economy is at risk of a “wasted” decade and the weakest stretch of growth in 30 years, the World Bank warned on Tuesday, saying a sluggish recovery from the pandemic and crippling wars in Ukraine and the Middle East are expected to weigh heavily on output.",2024-01-09T14:30:07+0000,article,Business Day,News,World Bank Warns of Energy Price Surge if Mideast War Spreads,Economic Conditions and Trends;Oil (Petroleum) and Gasoline;Inflation (Economics);United States Economy;Two Thousand Twenties (Decade);Israel-Gaza War (2023- );Russian Invasion of Ukraine (2022);Global Warming;World Bank;China;Europe;United States
79,"Arguing for the special counsel: James I. Pearce, a career federal prosecutor who played a role in some Jan. 6 cases; and for former President Donald Trump, D. John Sauer, a former solicitor general of Missouri.","The two lawyers who will be squaring off in court on Tuesday to debate the issue of whether former President Donald J. Trump is immune to charges of trying to overturn the 2020 election both have experience in high-profile appeals, but they come from different sides of the legal aisle.",2024-01-09T14:30:47+0000,article,U.S.,News,Here are the lawyers arguing the case.,
80,"It looks like the trailer for “Avatar: The Way of Water,” but it’s a natural phenomenon. And spotting it is getting increasingly popular.",California seems to be off to a glowing start to the year — and we’re not just talking about Hollywood stars assembling for awards season. We’re talking about bioluminescent algae.,2024-01-09T14:42:32+0000,article,Science,News,Why Are California’s Waters Lighting Up in Blue?,Algae;Bacteria;Fish and Other Marine Life;Water;Microbiology;Oceans and Seas;California;San Francisco Bay Area (Calif)
81,"Gusty winds ripped through the Florida Panhandle, downing power lines and trees.","At least four people died as severe thunderstorms, powerful winds and apparent tornadoes ripped across swaths of the southeastern United States on Tuesday, downing power lines and trees, and damaging buildings.",2024-01-09T15:14:01+0000,article,U.S.,News,4 Killed as Storms and Likely Tornadoes Tear Through Southeastern U.S.,Power Failures and Blackouts;Tornadoes;Rain;Florida;Florida Panhandle;Georgia;BAY COUNTY (FLA)
