,abstract,lead_paragraph,pub_date,document_type,section_name,type_of_material,headline,keywords
0,"The university also issued a historical study and announced steps to address this legacy, including new support for public education in New Haven, Conn.","Yale University on Friday issued a formal apology for its early leaders’ involvement with slavery, accompanied by the release of a detailed history of the university’s connections to slavery and a list of what it said were initial steps to make some amends.",2024-02-17T00:11:03+0000,article,Arts,News,Yale Apologizes for Its Connections to Slavery,"Colleges and Universities;Slavery (Historical);Black People;Blacks;Blight, David W;Salovey, Peter;Yale University;Apologies;Research;New Haven (Conn)"
1,"Justice Arthur F. Engoron’s decision could drain all of former President Donald J. Trump’s cash, and will set his family business reeling.","Donald J. Trump lost his civil fraud trial on Friday, as a judge found him liable for violating state laws and penalized him nearly $355 million plus interest. In total, Mr. Trump is expected to have to pay more than $450 million.",2024-02-17T00:24:41+0000,article,New York,News,What the Civil Fraud Ruling Means for Trump’s Finances and His Empire,"New York State Civil Case Against Trump (452564/2022);Decisions and Verdicts;Frauds and Swindling;Trump Organization;Engoron, Arthur F;James, Letitia;Trump, Donald J;New York State"
2,"A fast-moving storm over-performed in some places, leaving as much as a foot of snow in parts of New Jersey, New York and Pennsylvania, forecasters said.","A fast-moving storm system brought several inches of snow to parts of the Northeast and Mid-Atlantic regions for the second time this week, leaving two inches of snow in Central Park but double-digit accumulations in other areas, such as parts of Long Island.",2024-02-17T00:57:24+0000,article,U.S.,News,"Storm Brings Snow to Northeast and Mid-Atlantic, Again","Snow and Snowstorms;Central Park (Manhattan, NY);Maryland;New York City;Northeastern States (US);Pennsylvania;Philadelphia (Pa);West Virginia;Virginia"
3,"After a tumultuous hearing, the Fulton County district attorney earned plaudits for the way she stood firm under pressure but drew doubts about her judgment under the glare of the national spotlight.","It has been a rare point of consensus about the case brought by Georgia prosecutors against former President Donald J. Trump: the Fulton County district attorney, Fani T. Willis, probably made a mistake by having a romantic relationship with a co-worker.",2024-02-17T01:03:09+0000,article,U.S.,News,"After Testimony in Atlanta, Willis Receives Both Praise and Condemnation","Georgia Criminal Case Against Trump (2020 Election);Conflicts of Interest;Presidential Election of 2020;Legal Profession;Jackson, Reginald T;Wade, Nathan J;Willis, Fani T;Atlanta (Ga);Fulton County (Ga)"
4,"The base for up to 2,300 soldiers will establish a significant state law enforcement infrastructure in an area where Texas is contesting the federal government’s sole authority.","Gov. Greg Abbott of Texas said on Friday that the state would begin building a forward operating base in the border city of Eagle Pass for up to 2,300 soldiers, creating the most significant military infrastructure yet to support the state’s efforts to limit the number of people crossing illegally from Mexico.",2024-02-17T01:08:20+0000,article,U.S.,News,Texas Governor Announces New Military Base Camp on Border,"Illegal Immigration;Border Barriers;Federal-State Relations (US);Governors (US);Immigration and Emigration;National Guard;Border Patrol (US);Abbott, Gregory W (1957- );Paxton, Ken;Eagle Pass (Tex);Texas"
5,"Liz Johnson has taken over the former Chumley’s space after her messy split with her former co-chef, Will Aghajanian.","As would-be diners approached a nondescript door on a placid block in Greenwich Village on Wednesday night, they were stopped short by a tall, lean man wearing a black fur hat and red carnation boutonniere. He pressed stickers over the lenses of their phones. No photography was allowed, he insisted.",2024-02-17T02:00:26+0000,article,Food,News,What Scandal? A Chef of L.A.’s Horses Opens Frog Club in New York.,"Frog Club (Manhattan, NY, Restaurant);Restaurants;Johnson, Liz (Chef);Greenwich Village (Manhattan, NY);Chefs;Aghajanian, Will (Chef);Horses (Los Angeles, Calif, Restaurant)"
6,The African Methodist Episcopal Church Bishops Council says American financial assistance to help Israel fight its war in Gaza supports “mass genocide.”,"Leaders of the African Methodist Episcopal Church, one of the country’s oldest and most prominent Black Christian denominations, called this week for the United States to end its financial aid to Israel, saying the monthslong military campaign in Gaza amounted to “mass genocide.”",2024-02-17T02:10:23+0000,article,U.S.,News,Prominent Black Church Leaders Call for End of U.S. Aid to Israel,"Israel-Gaza War (2023- );Israel;Defense and Military Forces;Foreign Aid;Palestinians;Gaza Strip;War Crimes, Genocide and Crimes Against Humanity;AFRICAN METHODIST EPISCOPAL CHURCH;Black People;Blacks;Clergy;Emanuel African Methodist Episcopal Church (Charleston, SC);Biden, Joseph R Jr;United States International Relations"
7,"Corrections that appeared in print on Saturday, Feb. 17, 2024.","The picture captions with an article on Page 102 about pointy shoes are ordered incorrectly. The correct order is, clockwise from top left: Celine by Hedi Slimane, $1,050. Brunello Cucinelli, $995. Toteme, $630. Gianvito Rossi, price on request. Marni, $935. Manolo Blahnik, $775. Valentino Garavani, $990.",2024-02-17T02:37:49+0000,article,Corrections,Correction,"Corrections: Feb. 17, 2024",
8,"In the Super Bowl parade shooting, many of the wounded were children, and the two people charged so far in connection with the gunfire are also under 18.","After the shooting in Kansas City this week at a parade to celebrate the Super Bowl victory of the hometown Chiefs, children who had been struck by gunfire flooded into Children’s Mercy Hospital, less than a mile from Union Station, where the shooting occurred.",2024-02-17T02:41:55+0000,article,U.S.,News,"Young Victims, Young Suspects: The Kansas City Shooting and Gun Violence","Murders, Attempted Murders and Homicides;Children and Childhood;Football;Parades;Teenagers and Adolescence;Centers for Disease Control and Prevention;Gun Violence Archive;Kansas City Chiefs;Milwaukee (Wis)"
9,"Todd Michael Schultz, the longtime partner of the infamous author, had ambitions to run for office.","For nearly 40 years, the novelist Bret Easton Ellis has been chronicling noirish debauchery in best-selling books such as “American Psycho” and “Less Than Zero.” This week, his partner, Todd Michael Schultz, was arrested at the fancy Los Angeles condominium building where the couple lives, and was charged with burglary, according to Abraham Bedoyan, a sergeant at the West Hollywood sheriff’s station.",2024-02-17T02:47:14+0000,article,Style,News,Boyfriend of Bret Easton Ellis Arrested in Hollywood,"Ellis, Bret Easton;Robberies and Thefts;West Hollywood (Calif)"
10,"In remarks made at a Jewish philanthropy event, Gov. Kathy Hochul said that if Canada attacked the United States as Hamas did Israel, “there would be no Canada the next day.”",Gov. Kathy Hochul apologized on Friday night for remarks she made at a Jewish philanthropy event in New York City that implied that Israel would be justified in destroying Gaza because of the Oct. 7 Hamas attack.,2024-02-17T02:53:20+0000,article,New York,News,Hochul Apologizes After Implying Israel Has a Right to Destroy Gaza,"Israel-Gaza War (2023- );Palestinians;Terrorism;Apologies;Governors (US);Politics and Government;Threats and Threatening Messages;Jews and Judaism;Hamas;Hochul, Kathleen C"
11,Spencer Leach and Jem Burch team up on a thrilling themeless.,"SATURDAY PUZZLE — This is the first collaboration between Spencer Leach, who made two Saturday grids for The New York Times last year, and Jem Burch, who has constructed a Thursday puzzle and three Fridays since 2021.",2024-02-17T03:00:07+0000,article,Crosswords & Games,News,‘You’re Tempting Fate!’,Crossword Puzzles
12,The artist discusses Sade’s 1992 song “Kiss of Life.”,The artist discusses Sade’s 1992 song “Kiss of Life.”,2024-02-17T03:27:44+0000,multimedia,T Magazine,Video,My Favorite Song | Danielle Mckinney,"Mckinney, Danielle;Content Type: Personal Profile;Art;Sade;Music"
13,"Across 92 pages, the judge, Arthur F. Engoron, took Mr. Trump to task several times — both for his business practices and his comportment in the courtroom.","The judge who cut a broad swath through Donald J. Trump’s personal and corporate coffers on Friday, ordering him to pay a penalty in his civil fraud trial that will exceed $450 million, was both cutting and colorful in his characterization of the former president’s conduct.",2024-02-17T03:27:58+0000,article,New York,News,Highlights From the Decision in Trump’s Fraud Case,"New York State Civil Case Against Trump (452564/2022);Frauds and Swindling;Decisions and Verdicts;Courts and the Judiciary;Suits and Litigation (Civil);Engoron, Arthur F;Trump, Donald J"
14,"A stage adaptation of the film featured an all-Western cast, was performed in Chinese and raised questions about translation, both linguistic and cultural.","When a stage production of “The Shawshank Redemption” opened recently in China, it was cast entirely with Western actors speaking fluent Mandarin Chinese. But that may have been the least surprising part of the show.",2024-02-17T03:40:02+0000,article,World,News,"‘Shawshank’ in China, as You’ve Never Seen It Before","Movies;Theater;Actors and Actresses;Chinese Language;The Shawshank Redemption (Movie);Zhang Guoli (1955- );Rowswell, Mark (Dashan);Beijing (China);China"
15,"Fire crews were responding to reports of a gas leak in Sterling, a suburb of Washington, when the home exploded with firefighters inside.","A firefighter was killed after a house in Virginia exploded Friday night, injuring 13 other people and scattering pieces of the home across the neighborhood, officials said.",2024-02-17T05:43:40+0000,article,U.S.,News,Virginia House Explosion Kills Firefighter and Injures 13 Others,Fires and Firefighters;Deaths (Fatalities);Explosions (Accidental);Loudoun County (Va);Oil (Petroleum) and Gasoline
16,"With Ukraine’s forces at risk of encirclement, the top military commander ordered a retreat. In startlingly candid accounts, soldiers described disarray and despair.","Ukraine ordered the complete withdrawal from the decimated city of Avdiivka before dawn on Saturday, surrendering a position that had been a military stronghold for the better part of a decade, in the face of withering Russian assault.",2024-02-17T06:03:17+0000,article,World,News,"Avdiivka, Longtime Stronghold for Ukraine, Falls to Russians",Russian Invasion of Ukraine (2022);Avdiivka (Ukraine);Defense and Military Forces;Evacuations and Evacuees;Russia;Ukraine;Foreign Aid;United States International Relations
17,Feeling stuck on today’s puzzle? We can help.,"Hi busy bees! Welcome to today’s Spelling Bee forum. There are a number of terms that appear in both this article and other online discussions of the Spelling Bee; a glossary of those terms compiled by Monicat, a Times reader, can be found below.",2024-02-17T08:00:03+0000,article,Crosswords & Games,News,Spelling Bee Forum,Spelling Bee (Game);Crossword Puzzles
18,In case you need some puzzle help.,"Welcome to The Wordle Review. Be warned: This page contains spoilers for today’s puzzle. Solve Wordle first, or scroll at your own risk.",2024-02-17T08:00:24+0000,article,Crosswords & Games,News,Today’s Wordle Review,Wordle (Puzzle);Crossword Puzzles
19,"Scott Goldshine has worked at Zabar’s in Manhattan for decades. He roams the aisles on Sundays, snacks on rugelach and makes it home for dinner with his wife.",Scott Goldshine used to be a picky eater with a very short list of preferred foods.,2024-02-17T08:00:25+0000,article,New York,News,How the Manager of a Gourmet Grocery Store Spends His Sundays,"Zabar's;Supermarkets and Grocery Stores;Upper West Side (Manhattan, NY);Content Type: Personal Profile"
20,In case you need some puzzle help.,"Good morning, dear connectors. Welcome to today’s Connections forum, where you can give and receive puzzle — and emotional — support.",2024-02-17T08:00:28+0000,article,Crosswords & Games,News,The Connections Companion,Crossword Puzzles;Connections (Game)
21,"In the years before his death, the Run-DMC D.J. Jam Master Jay secretly turned to the drug trade to keep providing financial support to relatives and friends, according to testimony.","Before he was gunned down inside his recording studio in Queens in 2002, in what prosecutors say was a drug deal gone bad, Jam Master Jay of the New York hip-hop trio Run-DMC faced a predicament.",2024-02-17T08:00:43+0000,article,New York,News,Murder Trial Lays Bare a Hip-Hop Pioneer’s Double Life,"Rap and Hip-Hop;Drug Abuse and Traffic;Murders, Attempted Murders and Homicides;Content Type: Personal Profile;Run-DMC;Jam Master Jay;Washington, Ronald (October 30, 2002 Murder);Jordan, Karl Jr;Hollis (Queens, NY);Queens (NYC)"
22,"In 2010, the Apple iPad offered a new way to read the news. To prepare for its arrival, The Times needed a model.","Apple announced its new device, the iPad, in January 2010 and made the tablet available less than three months later. With its large screen, light weight and portability, the iPad promised to be a terrific way to read The New York Times online.",2024-02-17T08:00:56+0000,article,Times Insider,News,The Times and the Tablet,New York Times;iPad
23,"With more men choosing to stay at home with their kids, the stigma — and the notion that they’re just filling in for mom — could finally be fading.","As a father of two, Gerard Gousman enjoyed his career as a tour manager, working for artists like DMX, Salt-N-Pepa and Cat Power.",2024-02-17T10:00:44+0000,article,Style,Editorial,Leaving ‘Mr. Mom’ Behind,Labor and Jobs;Parenting;Families and Family Life;Child Care
24,"A student’s vow to overthrow one of Africa’s last ruling monarchs faces a roadblock: his own father, a soldier sworn to protect the throne.","The riot police appeared out of nowhere, charging furiously toward the young protesters trying to oust King Mswati III, who has ruled over the nation of Eswatini for 38 years. The pop of gunfire ricocheted through the streets, and the demonstrators started running for their lives.",2024-02-17T10:01:03+0000,article,World,News,"The Father, the Son and the Fight Over Their King","Eswatini;Mswati III;Politics and Government;Defense and Military Forces;Demonstrations, Protests and Riots;Age, Chronological;Youth;AFRICA;Royal Families;Communism (Theory and Philosophy);vis-photo"
25,"Even in countries where homophobia is pervasive and same-sex relationships are illegal, authors are pushing boundaries, finding an audience and winning awards.","As a queer teenager growing up in northern Nigeria, Arinze Ifeakandu often found himself searching for books that reflected what he felt.",2024-02-17T10:01:07+0000,article,Books,News,‘We’re Going to Stand Up’: Queer Literature is Booming in Africa,"Books and Literature;Homosexuality and Bisexuality;AFRICA;Kenya;Nigeria;Morocco;South Africa;Okparanta, Chinelo;Ifeakandu, Arinze;Taia, Abdellah;Rafiki (Movie)"
26,"In “The Other Profile,” a struggling grad school dropout starts to work for, and then becomes obsessed with and consumed by, a semi-famous content creator.","Kevin Systrom, a founder of Instagram, recently confessed that the platform he helped create had lost its soul. Gone are the days when friends and family shared photos with earnest and eager passion. Now, influencers reign supreme. No one is real. It’s “terrifying,” Systrom said on the journalist Kara Swisher’s podcast. “It’s this race to the bottom of who can be the most perfect.”",2024-02-17T10:02:09+0000,article,Books,Review,"She’s a Social Media Influencer’s Assistant, and She’s Spiraling","Books and Literature;The Other Profile: A Novel (Book);Graziosi, Irene;Rand, Lucy (Translator)"
27,"Jill Biden wanted to keep teaching. Melania Trump just wanted to go home. In nearly every way, the two women are a study in contrasts in their approach to the role of first lady.","The incoming first lady was arguing with her husband about whether she could keep working as an English professor, bucking concerns that it would be too much for her to handle. The outgoing first lady had taken to wearing terry cloth bathrobes during the day and sorting through an office aides referred to as her “swag room,” a locked room filled with key chains, crystal bookends and other trinkets from her time at the White House.",2024-02-17T10:02:09+0000,article,U.S.,News,How Two First Ladies Weathered a Most Unusual Presidential Transition,"First Ladies (US);Biden, Jill Tracy Jacobs;Trump, Melania;Content Type: Personal Profile;Biden, Joseph R Jr;Trump, Donald J;Northern Virginia Community College;White House Building (Washington, DC);Storming of the US Capitol (Jan, 2021);United States Politics and Government"
28,"“Hard Girls,” by J. Robert Lennon, delves into family lives built on deception and abandonment.","The twins Jane and Lila Pool are the “hard girls” at the center of J. Robert Lennon’s new thriller. They’ve earned the title. When we meet Jane, it’s “19 years after she ran away from home, 13 years after she married a stonemason, 12 years after her daughter was born and 11 years after she got out of prison and pretended to put the past behind her.”  Now, she’s working at a university in upstate New York, where her father, Harry, is a professor.",2024-02-17T10:02:17+0000,article,Books,Review,"In This Road-Trip Thriller, Twin Sisters Hunt for Their Missing Mom","Books and Literature;Lennon, J Robert;Hard Girls: A Novel (Book)"
29,"Spring’s most classic look requires just a few elements: a tailored trench, an oversize blazer, a clean-lined dress and some unapologetic confidence.",,2024-02-17T10:02:35+0000,article,T Magazine,News,Fashion That Sticks to the Bare Necessities,"Fashion and Apparel;Shoes and Boots;Alexander McQueen Ltd;Ferragamo, Salvatore, Italia SpA;Givenchy;Jil Sander AG;Proenza Schouler"
30,The Los Angeles-based artist and designer admires the Vespa and an early 20th-century typeface.,"“Nathalie, Javier Mariscal and I are some of the only non-architects of the Memphis Group [the design movement founded by the Italian architect Ettore Sottsass and others in Milan in 1980], and I’m astounded and delighted by the degree to which she’s managed to go off into the fine art realm. She does these walls with color-blocked borders for her exhibits [the one above is from 2017], and I’m so upset because they’re so good.”",2024-02-17T10:02:47+0000,article,T Magazine,News,Five Things Peter Shire Wishes He’d Made,"Shire, Peter (1947- );Art;Design;Content Type: Personal Profile"
31,"For a glorious decade or two, the drink was lauded as good for the heart. What happened?","In a 1991 segment of “60 Minutes,” the CBS correspondent Morley Safer asked how it could be that the French enjoyed high-fat foods like pâté, butter and triple crème Brie, yet had lower rates of heart disease than people in the United States.",2024-02-17T10:02:58+0000,article,Well,News,How Red Wine Lost Its Health Halo,Wines;Alcoholic Beverages;Heart;Cancer;Research;Resveratrol (Chemical)
32,"The artist, whose portraits explore leisure and repose, has suddenly found success in the notoriously fickle gallery world.","THE SUBJECTS OF Danielle Mckinney’s paintings are exclusively Black women, like the artist herself. They are generally posed inside darkly lit but nevertheless inviting domestic spaces. The effect is both casual and courtly: Her women lounge on couches and read magazines. They smoke gracefully but with what Mckinney, 42, described as “a worldly tension.” In person, she shares a kind of understated glamour with her subjects, and she paints the act of smoking with nostalgia and envy. She started smoking when she was 13; when I first visited her Jersey City, N.J., studio last April, she was trying not to fall off the wagon. “After the last one, it’s been 70 days,” she said. “But I had two in between there.”",2024-02-17T10:03:05+0000,article,T Magazine,News,Danielle Mckinney Never Thought Her Paintings Would Be Seen Like This,"Mckinney, Danielle;Content Type: Personal Profile;Art;Boesky, Marianne, Gallery;Chelsea (Manhattan, NY)"
33,The former president’s trials aren’t being aired. That isn’t stopping him from turning them into a political reality show.,"The civil-fraud case against Donald J. Trump’s businesses in New York, in which he was ordered to pay a penalty of $355 million, was not televised. Neither was his civil trial for the defamation of E. Jean Carroll. Nor — barring an unlikely change in federal court policy — will be his looming federal election-interference trial.",2024-02-17T10:03:07+0000,article,Arts,News,"For Donald Trump, the Recriminations Will Be Televised","Television;Trump, Donald J;Presidential Election of 2024;Georgia Criminal Case Against Trump (2020 Election);New York State Criminal Case Against Trump (71543-23);New York State Civil Case Against Trump (452564/2022);United States Politics and Government"
34,"The “Madame Web” actress unwinds with the help of Sudoku, Legos and the occasional psychology video on YouTube.","There is busy, and then there is Isabela Merced.",2024-02-17T10:03:16+0000,article,Arts,News,Isabela Merced Has a Trick to Keep Herself Off Her Phone,"Merced, Isabela (2001- );Actors and Actresses;Content Type: Personal Profile;Movies;Madame Web (Movie)"
35,"The choreographer’s contemplative “Deep River,” performed by Lines Ballet at Lincoln Center’s Rose Theater, swims along, brimming with hope and love.","The choreographer Alonzo King sees ballet differently. A dance is never just a dance. It’s a kind of faith, and the training necessary for it — day in and day out — is a way to keep that faith alive. His ballets have a way of sailing through sensations, of calming the nervous system, of realigning the body and mind.",2024-02-17T10:03:21+0000,article,Arts,News,Alonzo King Wants to Wake Up the World With Ballet,"Dancing;Lines (Dance Co);Lincoln Center for the Performing Arts;King, Alonzo;Fischer, Lisa (1958- )"
36,Asking for a friend.,"When the house is freezing and it’s still dark outside, it feels reasonable, even noble, to relish extra minutes in bed.",2024-02-17T10:03:24+0000,article,Well,News,How Long Is Too Long to Stay in Bed?,Content Type: Service;Sleep;Habits and Routines (Behavior)
37,"Fueled by once-low rates, more older Americans have mortgage debt, according to new research. But the downsides can be significant, some experts say.",Conventional wisdom dictates that retiring with debt — especially a debt as large and significant as a mortgage — is financially dicey at best and potentially ruinous at worst.,2024-02-17T10:03:32+0000,article,Business Day,News,Keeping a Mortgage After 65: A ‘No Brainer’ or a Big Risk?,"Real Estate and Housing (Residential);Mortgages;Retirement;Personal Finances;Interest Rates;Elderly;Age, Chronological;Prices (Fares, Fees and Rates);Content Type: Service;Income;Credit and Debt"
38,"Typically, condo owners are responsible for funding repairs to building systems. But if it’s a construction defect, that changes the playbook.","Q: In May 2019, I purchased a condominium from the sponsor in a brand-new building in Brooklyn. From the beginning there were issues with the heating, ventilation and air-conditioning system. The problems persist and affect the whole building. The repair cost is now $90,000. The company that installed the HVAC system filed for bankruptcy. The sponsor has taken repair funds out of the building’s operating budget, leaving the budget in the red. There is no reserve fund. The offering plan states that because the condo is new construction, “it is not anticipated that there should be any major capital repairs or replacements during the first five years of operation.” Who is responsible for the cost of the repair: the sponsor or the residents?",2024-02-17T10:03:40+0000,article,Real Estate,News,"When a New Condo Building Has Problems, Who Pays to Fix Them?","Real Estate and Housing (Residential);Condominiums;Heating, Ventilation and Cooling (HVAC);Home Repairs and Improvements;Content Type: Service"
39,"The change to planned rules was an election-year concession to labor unions and auto executives, according to people familiar with the plan.","In a concession to automakers and labor unions, the Biden administration intends to relax elements of one of its most ambitious strategies to combat climate change, limits on tailpipe emissions that are designed to get Americans to switch from gas-powered cars to electric vehicles, according to three people familiar with the plan.",2024-02-17T10:03:42+0000,article,Climate,News,Biden Administration Is Said to Slow Early Stage of Shift to Electric Cars,"Biden, Joseph R Jr;Automobiles;Fuel Emissions (Transportation);Electric and Hybrid Vehicles;Global Warming;Greenhouse Gas Emissions;Organized Labor;Regulation and Deregulation of Industry;Environmental Protection Agency;Alliance for Automotive Innovation;United Automobile Workers;Presidential Election of 2024;United States Politics and Government"
