,abstract,lead_paragraph,pub_date,document_type,section_name,type_of_material,headline,keywords
82,China’s tech firms were caught off guard by breakthroughs in generative artificial intelligence. Beijing’s regulations and a sagging economy aren’t helping.,"In November, a year after ChatGPT’s release, a relatively unknown Chinese start-up leaped to the top of a leaderboard that judged the abilities of open-source artificial intelligence systems.",2024-02-21T15:43:42+0000,article,Technology,News,China’s Rush to Dominate A.I. Comes With a Twist: It Depends on U.S. Technology,"China;Artificial Intelligence;Politics and Government;Foreign Investments;Computers and the Internet;Regulation and Deregulation of Industry;International Relations;Innovation;Start-ups;Computer Vision;ChatGPT;Open-Source Software;Computer Chips;Alibaba Group Holding Ltd;Beijing Bytedance Technology Co Ltd;Meta Platforms Inc;OpenAI Labs;Lee, Kai-Fu"
83,"Under intensifying scrutiny from U.S. lawmakers, top firms have pulled back from investing in Chinese start-ups.","DCM Ventures, a Silicon Valley venture capital firm, began investing in China’s start-ups in 1999. The move reaped such blockbuster returns that in 2021, DCM said it planned to “double down” on its strategy of investing in China, the United States and Japan.",2024-02-21T15:44:16+0000,article,Technology,News,Silicon Valley Venture Capitalists Are Breaking Up With China,Foreign Investments;United States Politics and Government;Venture Capital;Computers and the Internet;Politics and Government;Start-ups;International Relations;Surveillance of Citizens by Government;Facial Recognition Software;Communist Party of China;DCM (Venture Capital Firm);GGV Capital;Sequoia Capital;China;Silicon Valley (Calif)
84,"The tower, once used to send telecom traffic, has been sold and will be transformed by the company that turned the TWA terminal at Kennedy Airport into a hotel.","St. Paul’s Cathedral, the Tower of London and the London Eye are all important landmarks in Britain’s capital. Yet you can’t spend the night in any of them.",2024-02-21T15:56:54+0000,article,Business Day,News,"The BT Tower, a Once-Futuristic London Landmark, Will Become a Hotel","London (England);Historic Buildings and Sites;BT Group PLC;Hotels and Travel Lodgings;MCR Hotels;Mergers, Acquisitions and Divestitures;Real Estate (Commercial)"
85,"All the flavors and comfort of a classic lasagna in an easy, one-pot weeknight dinner.","Of all the wildly popular American takes on Italian cuisine (spaghetti and meatballs; fettuccine Alfredo; chicken Parmesan), the latest to go viral is lasagna soup, thanks to one TikTok user with a Lego set and a thing for pasta. Christina Morales got the whole story for The New York Times, and naturally we have the recipe. It retains everything you love about lasagna — the tomatoey marinara, spicy Italian sausage, soft sheets of pasta and milky ricotta cheese — and simmers it together with chicken stock to create the red sauced comfort food of your dreams.",2024-02-21T16:00:02+0000,article,Food,Letter,"If Garfield Made Soup, He’d Make This Soup",Cooking and Cookbooks;Content Type: Service
86,Unusual experiments on organs recovered from three carcasses suggest how baleen whales call out at sea.,"People have told stories of strange underwater sounds for thousands of years, but it took until the mid-20th century for scientists to pinpoint one of the causes: whales, singing and whistling and squeaking in the blue.",2024-02-21T16:00:08+0000,article,Science,News,These Whales Still Use Their Vocal Cords. But How?,your-feed-science;Whales and Whaling;Voice and Speech;Animal Behavior;Fish and Other Marine Life;Larynx;Research;Acoustics
87,"We invite students to create a short video that defines or teaches one of our recent Words of the Day. Contest dates: Feb. 28-March 27, 2024.",Do you love the magic of words? Do you enjoy showing off your vocabulary — or finding new ways to expand it? And do you appreciate brevity — keeping things short and sweet?,2024-02-21T16:07:46+0000,article,The Learning Network,News,Our 11th Annual 15-Second Vocabulary Video Challenge,
88,"A local town’s vote against the U.S. automaker’s proposed expansion is nonbinding, but citizens expect it to be honored.","Residents in the German community where Tesla has its only assembly plant in Europe overwhelming rejected the company’s plan to expand its facilities, dealing a blow to the U.S. automaker and local supporters.",2024-02-21T16:13:13+0000,article,Business Day,News,Let Tesla Expand? Germans Vote No.,Tesla Motors Inc;Local Government;Electric and Hybrid Vehicles;Automobiles;BRANDENBURG (GERMANY);Grunheide (Mark) (Germany);Factories and Manufacturing
89,"The president announced another $1.2 billion in forgiveness, bringing the total canceled to $138 billion. But the piecemeal efforts have garnered him little praise.","After the Supreme Court struck down President Biden’s plan to cancel billions of dollars in student loan debt, borrowers wondered how he would make good on his promise to tackle debt burdening millions of Americans.",2024-02-21T16:17:35+0000,article,U.S.,News,"Biden Chips Away at Student Loan Debt, Bit by Bit, Amid High Expectations","Biden, Joseph R Jr;Democratic Party;United States Politics and Government;Student Loans;Executive Orders and Memorandums;Colleges and Universities;Community Colleges"
90,Responses to an essay that suggested treating cultural spaces like infrastructure. Also: U.S. Steel; immigration; a no-victims defense; a shadow government.,To the Editor:,2024-02-21T16:50:03+0000,article,Opinion,Letter,Rethinking How We Fund the Arts in America,"Museums;Art;Infrastructure (Public Works);Finances;United States Steel Corporation;Nippon Steel Corporation;Steel and Iron;Global Warming;United States Politics and Government;Immigration and Emigration;Biden, Joseph R Jr;Trump, Donald J;Republican Party"
91,"After a dramatic rise in business and society, the art-world mogul Louise Blouin finds herself unloading a Hamptons dream home in bankruptcy court.","“I haven’t made many mistakes,” Louise Blouin said soon after her compound in the Hamptons was sold out from under her in a bankruptcy auction. “You can’t judge someone because they have an issue once in their life. I’m sure Steve Jobs didn’t have a perfect track record.”",2024-02-21T16:50:59+0000,article,Style,News,$89 Million Can’t Fix Her Mistakes,"Blouin, Louise T;Hamptons (NY);Real Estate and Housing (Residential);Auctions;Louise Blouin Media Inc;Sotheby's;Personal Bankruptcies;Art"
92,"The United States urged the International Court of Justice not to call for immediate withdrawal of Israel from Palestinian territories, and to consider the country’s security needs.","The United States urged the International Court of Justice not to call for immediate withdrawal of Israel from Palestinian territories, and to consider the country’s security needs.",2024-02-21T16:53:47+0000,multimedia,World,Video,U.S. Defends Israeli Occupation of Palestinian Territories,International Court of Justice (UN);United States;Israel;Palestinians
93,"In an effort to program contemporary works, the company will present recent operas by Jeanine Tesori, John Adams, Jake Heggie and Osvaldo Golijov.","Contemporary works will be front and center in the coming season, the Metropolitan Opera announced on Wednesday, with four company premieres among its six new productions.",2024-02-21T17:00:09+0000,article,Arts,News,The Met Opera’s New Season: What We Want to See,Opera;Metropolitan Opera;Antony and Cleopatra (2022) (Opera);Fidelio (Opera);Grounded (Opera);La Boheme (Opera);The Magic Flute (Opera);The Queen of Spades (Opera)
94,"With “Part Two” hitting theaters, they discuss another potential sequel, the impossible quest for onscreen perfection and those infamous popcorn buckets.","The director Denis Villeneuve and the actor Timothée Chalamet bound into the room talking at, and over, each other in rapid French. Villeneuve is from Quebec; Chalamet was born in New York City but has dual American and French citizenship. Together, they’re a dynamic tag team dressed near-identically in head-to-toe black, although Chalamet’s shiny leather layers have more swagger. The topic of the day is galactic genocide and dubious messiahs, central themes in “Dune: Part Two,” the second installment of their cerebral space epic based on the 1965 novel by Frank Herbert. Yet, the pair are prone to giggle fits.",2024-02-21T17:00:16+0000,article,Movies,News,Denis Villeneuve and Timothée Chalamet: ‘Dune’ Dynasty,"Movies;Actors and Actresses;Chalamet, Timothee (1995- );Villeneuve, Denis;Dune (Movie);Herbert, Frank;Dune: Part Two (Movie)"
95,His drumming lent spontaneity and imagination to the unfettered sound of seminal rock ’n’ roll records by Jerry Lee Lewis and others.,"Jimmy Van Eaton, who played drums on epoch-defining hits, including Jerry Lee Lewis’s “Great Balls of Fire” and “Whole Lotta Shakin’ Goin’ On,” and lent spontaneity and imagination to the unfettered sound of the influential Memphis label Sun Records, died on Feb. 9 at his home in Tuscumbia, Ala. He was 86.",2024-02-21T17:04:24+0000,article,Arts,Obituary (Obit),"Jimmy Van Eaton, Purveyor of the Sun Records Beat, Dies at 86","Van Eaton, Jimmy (1937-2024);Deaths (Obituaries);Pop and Rock Music;Drums;Sun Records;Lewis, Jerry Lee;Riley, Billy Lee"
96,The magazine’s Ethicist columnist on bookstore etiquette.,"At the local Barnes & Noble, the in-store coffee shop is next to the vast selection of magazines for sale. Many coffee drinkers grab multiple magazines and take them to their table with their coffee and read them. After coffee, most, but not all, put the magazines back in the racks without paying for them. They are “stealing” content that is meant to be purchased. Is this a form of shoplifting? — Name Withheld",2024-02-21T17:08:13+0000,article,Magazine,News,Are People Who Read Magazines Without Paying ‘Stealing’ Their Content?,Ethics (Personal);internal-sub-only-nl;Magazines;Barnes & Noble Inc;Books and Literature;Shoplifting and Employee Theft (Retail)
97,"Nearly 10 percent of South Carolina voters were not in the state when Nikki Haley left office in 2017, and many newcomers brought with them an affection for Donald Trump.",Follow for live updates on the 2024 presidential election.,2024-02-21T17:16:04+0000,article,U.S.,News,Nikki Haley Can’t Count on South Carolina’s Newcomers for Help,"United States Politics and Government;Presidential Election of 2024;Primaries and Caucuses;Haley, Nikki R;Trump, Donald J;South Carolina;Charleston (SC)"
98,"The ultranationalist blogger, Andrei Morozov, had described a campaign of intimidation against him and threatened to end his own life.","A pro-war Russian military blogger died on Wednesday, his lawyer said, after the blogger wrote the country’s military pressured him to remove a post exposing the scale of its losses in a recent battle in Ukraine.",2024-02-21T17:21:28+0000,article,World,News,A Russian Military Blogger Dies After Criticizing Army Losses,"Blogs and Blogging (Internet);Defense and Military Forces;Suicides and Suicide Attempts;Russian Invasion of Ukraine (2022);Politics and Government;Prigozhin, Yevgeny V;Navalny, Aleksei A;Strelkov, Igor (1970- );Wagner Group;Avdiivka (Ukraine);Russia"
99,This documentary about Ava DuVernay’s 2014 Martin Luther King drama “Selma” plays more like a David Oyelowo tribute than a proper look at the difficulties of making the film.,"“Becoming King,” a documentary on Paramount+, traces the actor David Oyelowo’s journey to playing the Rev. Dr. Martin Luther King Jr. in Ava DuVernay’s 2014 drama “Selma.”",2024-02-21T17:23:47+0000,article,Movies,Review,‘Becoming King’ Review: An Actor Marches On,"Documentary Films and Programs;Actors and Actresses;Becoming King (Movie);Oyelowo, Jessica;Oyelowo, David;DuVernay, Ava;King, Martin Luther Jr;Selma (Movie)"
100,"An unarmed Trident missile splashed into the sea close to its launch site, the U.K. government confirmed on Wednesday, fueling scrutiny of the state of Britain’s nuclear deterrent.","The British government confirmed on Wednesday that the test launch of an unarmed Trident missile from a Royal Navy submarine last month had failed, raising questions about the state of Britain’s nuclear deterrence capability.",2024-02-21T17:30:48+0000,article,World,News,"A British Nuclear Missile Test Fails, Again","Nuclear Weapons;Nuclear Tests;Defense and Military Forces;Submarines and Submersibles;Missiles and Missile Defense Systems;Conservative Party (Great Britain);Lockheed Martin Corporation;Lammy, David;Shapps, Grant;Great Britain"
101,An extraordinary exhibition of dissident and countercultural takes at the Brooklyn Museum shows the power of the copy machine.,"Before the internet, before the spicy comments sections on Instagram and Twitter or the outré subcultures on TikTok, like-minded strangers connected through zines. What is a zine?",2024-02-21T17:52:58+0000,article,Arts,Review,When Zines Walked the Earth,Brooklyn Museum;Magazines;Art;Freedom of Speech and Expression
102,"As she tries to find her place in Hollywood, the “Color Purple” stage and screen star bids an emotional goodbye to a character she has lived with for nearly a decade.","Was it an interview or an unburdening? As she wiped away tears, Danielle Brooks confessed she couldn’t tell the difference.",2024-02-21T17:57:53+0000,article,Movies,News,Danielle Brooks Has an Oscar Nomination. So Why Is She in Mourning?,"Brooks, Danielle;Content Type: Personal Profile;Actors and Actresses;The Color Purple (Movie);Academy Awards (Oscars);Movies;Theater"
103,"The summer’s Vail Dance Festival features Mearns, the New York City Ballet star, and the choreographer Roberts.","Fans of the intrepid New York City Ballet principal Sara Mearns and of the distinguished choreographer Jamar Roberts might want to mark their calendars. This year, they will be artists in residence at the Vail Dance Festival. Both will teach master classes and participate in community events, and Mearns will perform in a range of works, including debuts in George Balanchine’s “Elegie” and a new piece by Roberts.",2024-02-21T18:00:06+0000,article,Arts,News,Sara Mearns and Jamar Roberts to Be Resident Artists at Vail,"Dancing;Vail International Dance Festival;Mearns, Sara;Roberts, Jamar;Woetzel, Damian;Vail (Colo)"
104,Israel and Brazil have sparred this week over the Gaza war. Secretary of State Antony J. Blinken intervened on Wednesday.,"Secretary of State Antony J. Blinken confronted President Luiz Inácio Lula da Silva of Brazil on Wednesday about his recent sharp comments on Israel, including the Brazilian leader’s comparison of Israel’s attacks in Gaza to the Holocaust.",2024-02-21T18:07:01+0000,article,World,News,"Brazil, in Dispute with Israel, Shows Limits of U.S. Diplomacy","Israel-Gaza War (2023- );Palestinians;Civilian Casualties;International Relations;United States International Relations;Hamas;State Department;Blinken, Antony J;Da Silva, Luiz Inacio Lula;Brazil"
105,"Syrian state media blamed the strike, which it said had killed two people, on Israel. The Israeli military declined to comment.","Syrian state media blamed the strike, which it said had killed two people, on Israel. The Israeli military declined to comment.",2024-02-21T18:12:14+0000,multimedia,World,Video,"Deadly Airstrike Hits Neighborhood in Damascus, Syria",Syria;Israel;Damascus (Syria);Deaths (Fatalities)
106,"The man, a citizen of Georgia, and three others were charged with planning to assassinate Masih Alinejad, an Iranian American human rights activist in Brooklyn and a critic of Iran.","A man charged with participating in a plot hatched in Iran to assassinate Masih Alinejad, an Iranian American human rights activist and a sharp critic of Iran’s repression of women, has been extradited to the United States, American authorities said on Wednesday.",2024-02-21T18:15:53+0000,article,New York,News,Man Extradited to U.S. in Suspected Iranian Plot to Kill Activist,"Assassinations and Attempted Assassinations;Extradition;Human Rights and Human Rights Violations;Alinejad, Masih;Mehdiyev, Khalid;Omarov, Polad;Czech Republic;Iran;United States"
107,Her single “Texas Hold ’Em” debuted atop the country songs chart after its release during the Super Bowl.,"Beyoncé’s new country single “Texas Hold ’Em” reached No. 1 on the Billboard country songs chart this week, making her the first Black female artist to hold the top spot.",2024-02-21T18:16:32+0000,article,Arts,News,Beyoncé Becomes First Black Woman to Top Billboard Country Chart,"Knowles, Beyonce;Country Music;Women and Girls;Black People;Blacks"
108,The head of the factory making Max jets is leaving the company as it faces scrutiny of an incident that left a hole in a plane’s fuselage in flight.,Boeing said on Wednesday that it was shaking up the leadership in its commercial airplanes unit after a harrowing incident last month during which a piece fell off a 737 Max 9 jet in flight.,2024-02-21T18:30:45+0000,article,Business Day,News,Boeing 737 Max Official Is Out as Questions Linger on Mishap,"Boeing 737 Max Groundings and Safety Concerns (2019);AIRLINES AND AIRPLANES;Aviation Accidents, Safety and Disasters;Appointments and Executive Changes;Factories and Manufacturing;ALASKA AIRLINES;Boeing Company;Federal Aviation Administration"
109,"She dismissed speculation about her motives behind staying in the race, and has encouraged supporters to stick with her until the end, whenever that may be.","When Nikki Haley summoned the national media to Greenville, S.C., on Tuesday, she did something that was strikingly unusual even in this most bizarre of campaigns. She devoted an entire speech to explaining why she was not dropping out of the presidential race.",2024-02-21T18:43:30+0000,article,U.S.,News,Why Nikki Haley Isn’t Dropping Out,"Presidential Election of 2024;Haley, Nikki R;Trump, Donald J;Loomer, Laura;McMaster, Henry;Christie, Christopher J"
110,"Mr. Avlon, a Democrat who helped found the centrist political group No Labels, is seeking to unseat the Republican incumbent, Representative Nick LaLota.","John Avlon, a Democrat and former CNN political analyst, announced on Wednesday that he would enter a crowded congressional primary to try to flip a Republican-held swing seat on Long Island.",2024-02-21T18:56:26+0000,article,New York,News,"John Avlon, CNN Commentator, Enters Race for Long Island Swing Seat","Avlon, John;LaLota, Nicholas;Elections, House of Representatives;Primaries and Caucuses;Long Island (NY);Suffolk County (NY);Democratic Party;Republican Party;CNN;United States Politics and Government"
111,The tax collection agency’s scrutiny will involve new data analytics tools to find private jet owners who claim millions of dollars in deductions on planes being used for personal travel.,The Internal Revenue Service said on Wednesday that it would begin cracking down on corporate jet owners that abused the tax code by claiming millions of dollars in deductions on airplanes that were sometimes being used for personal travel.,2024-02-21T19:00:05+0000,article,Business Day,News,I.R.S. to Crack Down on Corporate Jet Users Who Abuse Tax Code,Internal Revenue Service;High Net Worth Individuals;Taxation;Tax Evasion
112,"Even under the most optimistic scenario, an immediate cease-fire, an additional 6,500 Gazans could perish, scientists estimated.","An escalation of the war in Gaza could lead to the deaths of 85,000 Palestinians from injuries and disease over the next six months, in the worst of three situations that prominent epidemiologists have modeled in an effort to understand the potential future death toll of the conflict.",2024-02-21T19:02:54+0000,article,Health,News,"War and Illness Could Kill 85,000 Gazans in 6 Months",Disease Rates;Deaths (Fatalities);Defense and Military Forces;Civilian Casualties;Epidemics;Johns Hopkins University;Israel;Gaza Strip
113,"A federal judge said the lawsuit, in which a California woman accused Simpson Imports of using “highly misleading” packaging, could proceed. The company says its labels do not call the product “San Marzano.”","San Marzano tomatoes are prized by chefs around the world for their intense flavor and are routinely recommended by recipe writers, but one woman in California said that her effort to make a sauce from these rich and balanced tomatoes was upset by a misleading label.",2024-02-21T19:03:34+0000,article,Business Day,News,"Woman Sues Tomato Company, Saying Those Weren’t San Marzanos in the Can",Tomatoes;Labeling and Labels (Product);Containers and Packaging;Rumors and Misinformation;Cooking and Cookbooks;Suits and Litigation (Civil);Simpson Imports Ltd;California;Pennsylvania
114,"Electric vehicles are booming as expected, a new analysis found, but renewable power isn’t growing as quickly as hoped.","A year and a half after President Biden signed into law a sweeping bill to tackle climate change, sales of electric vehicles have largely boomed in line with expectations, according to a new analysis by three groups tracking the impact of the law.",2024-02-21T19:07:51+0000,article,Climate,News,"Here’s Where Biden’s Climate Law Is Working, and Where It’s Falling Short","Inflation Reduction Act of 2022;Alternative and Renewable Energy;Tax Credits, Deductions and Exemptions;Electric and Hybrid Vehicles;Global Warming;Wind Power;Solar Energy;Energy and Power;Greenhouse Gas Emissions;Rhodium Group LLC;Biden, Joseph R Jr"
115,"Secretary of State Antony J. Blinken confronted President Luiz Inácio Lula da Silva of Brazil on Wednesday about his recent sharp comments on Israel, including the Brazilian leader’s comparison of Israel’s attacks in Gaza to the Holocaust.","Secretary of State Antony J. Blinken confronted President Luiz Inácio Lula da Silva of Brazil on Wednesday about his recent sharp comments on Israel, including the Brazilian leader’s comparison of Israel’s attacks in Gaza to the Holocaust.",2024-02-21T19:25:26+0000,article,World,News,"In Brazil, Blinken intervenes in a dispute with Israel.",
116,"The public university, the largest employer in the Tucson area, says it’s facing a $177 million shortfall. Critics worry that lower-tier workers and Arizona students will be hit hardest by efforts to cut back.","Like thousands of people in southern Arizona, Josh Ramos’s fate is intertwined with the University of Arizona. His mother’s job as a university accountant supports the family, and Mr. Ramos’s education, by qualifying him for a discount that cuts his tuition by 75 percent.",2024-02-21T19:32:58+0000,article,U.S.,News,"As U. of Arizona Confronts Budget Cuts, Workers and Students Brace for the Worst","University of Arizona;Arizona;Hobbs, Kathleen M;Colleges and Universities;United States Economy;Layoffs and Job Reductions"
117,University officials say they cannot afford to maintain one of the largest herbariums in the United States. Researchers are urging Duke to reconsider.,"Duke University has decided to close its herbarium, a collection of 825,000 specimens of plants, fungi and algae that was established more than a century ago. The collection, one of the largest and most diverse in the country, has helped scientists map the diversity of plant life and chronicle the impact of humans on the environment.",2024-02-21T19:45:33+0000,article,Science,News,"Duke Shuts Down Huge Plant Collection, Causing Scientific Uproar",Colleges and Universities;Collectors and Collections;Biodiversity;Endangered and Extinct Species;Biology and Biochemistry;Science and Technology;Global Warming;Flowers and Plants;Duke University;Durham (NC)
118,The Supreme Court declined to take up an appeal by a group of lawyers who challenged the 2020 election results in Michigan.,"Sidney Powell, L. Lin Wood and several other lawyers who advanced former President Donald J. Trump’s false claims of a stolen election will face legal penalties after the Supreme Court declined to take up their appeal.",2024-02-21T19:47:05+0000,article,U.S.,News,Sidney Powell and Other Trump-Aligned Lawyers Will Face Legal Penalties,"Georgia Criminal Case Against Trump (2020 Election);Suits and Litigation (Civil);Presidential Election of 2020;Powell, Sidney (Attorney);Wood, L Lin"
119,Minutes from the Federal Reserve’s Jan. 30-31 meeting showed policymakers thought that risks of an inflation pickup had “diminished.”,"Federal Reserve officials welcomed a recent inflation slowdown at their last meeting in late January but were intent on proceeding carefully as they tiptoe toward rate cuts, according to minutes from that gathering, which were released on Wednesday.",2024-02-21T19:56:45+0000,article,Business Day,News,Fed Minutes Show Embrace of Inflation Progress but No Hurry to Cut Rates,Banking and Financial Institutions;Government Bonds;Interest Rates;United States Economy;Price Gouging;Inflation (Economics);Federal Reserve System
120,Some lauded the idea. Others said it would play into OPEC’s hands.,"I got a lot of responses to my Friday newsletter on restricting the supply of fossil fuels, one of which said “oof no” in the subject line. It was from an economist named Benjamin Ho, who wrote that he usually likes my newsletter, “But, oh boy, was today’s off track.”",2024-02-21T20:00:02+0000,article,Opinion,Op-Ed,Ban Fossil Fuels? Readers Had Strong Thoughts.,internal-sub-only-nl;Oil (Petroleum) and Gasoline;Greenhouse Gas Emissions;Global Warming;Organization of the Petroleum Exporting Countries
