,abstract,lead_paragraph,pub_date,document_type,section_name,type_of_material,headline,keywords
0,Forewarned is forearmed: It will be bad-faith bullying.,"Interest rates are heading down. Maybe not today, and maybe not tomorrow, but soon, and for the rest of this year (at least).",2024-01-09T00:00:06+0000,article,Opinion,Op-Ed,Don’t Be Surprised if Trump Starts Attacking the Fed,"Interest Rates;Presidential Election of 2024;Inflation (Economics);Federal Reserve System;Biden, Joseph R Jr;Powell, Jerome H;United States Economy;Trump, Donald J"
1,"He turned running a dining room into a fine art at each of his restaurants over a 40-year career, most notably TBar on the Upper East Side.","Tony Fortuna, a longtime Manhattan restaurateur who turned running a dining room into a fine art as a consummate host who treated customers as friends, died on Friday at his home on the Upper East Side. He was 76.",2024-01-09T00:09:50+0000,article,Food,Obituary (Obit),"Tony Fortuna, Restaurateur With a Congenial Flair, Dies at 76","Fortuna, Tony;Restaurants;TBar (Manhattan, NY, Restaurant);Upper East Side (Manhattan, NY);Deaths (Obituaries)"
2,"No matter why you travel, our list offers inspiration.","No matter why you travel, our list offers inspiration.",2024-01-09T00:12:51+0000,multimedia,Travel,Interactive Feature,52 Places to Go in 2024,"Travel and Vacations;Two Thousand Twenty Four;Brasilia (Brazil);Eclipses;Paris (France);Japan;New Zealand;Maui (Hawaii);Grand Canyon (Ariz);Singapore;Chile;Ladakh (India);Geneva (Switzerland);Dominica;Manchester (England);Idaho;Baltimore (Md);Sri Lanka;Italy;Wales;Valencia (Spain);Kansas City (Mo);Madagascar;Yucatan Peninsula (Mexico);Indonesia;ALMATY (KAZAKHSTAN);Quito (Ecuador);Quebec Province (Canada);Montgomery (Ala);Tasmania (Australia);Waterford (Ireland);Kenya;El Salvador;Cambodia;Iceland;Montevideo (Uruguay);Mustang (Nepal);Vienna (Austria);Brisbane (Australia);Pasadena (Calif);Hurghada (Egypt);Boundary Waters Canoe Area (Minn);Thessaloniki (Greece);Normandy (France);Grenada;Costa Rica;ALBANIA;Whitehorse (Yukon Territory);Peru;Dresden (Germany);Monarch Butterfly Biosphere Reserve (Michoacan, Mexico);Everglades (Fla);Morocco;Morocco Earthquake (Sept 8, 2023);Bolivia;vis-design"
3,We need to stay outraged about the ex-president’s plot against America.,"After Joe Biden’s speech on Friday marking the anniversary of the Jan. 6 insurrection and laying out the democratic stakes of the next election, Mitt Romney pronounced himself unimpressed. “As a Biden campaign theme, I think the ‘threat to democracy’ pitch is a bust,” the Utah Republican told a New York Times reporter. “Biden needs fresh material, a new attack, rather than kicking a dead political horse.”",2024-01-09T00:19:50+0000,article,Opinion,Op-Ed,Biden Is Trying to Jolt Us Out of Learned Helplessness About Trump,"Presidential Election of 2024;United States Politics and Government;Storming of the US Capitol (Jan, 2021);Biden, Joseph R Jr;Trump, Donald J;Democracy (Theory and Philosophy)"
4,The cuts follow a tough year in which the tech industry laid off tens of thousands of workers.,"The videogame software provider Unity Software said on Monday that it would cut its work force by 25 percent, or roughly 1,800 jobs, in one of the first major tech industry layoffs this year.",2024-01-09T00:24:27+0000,article,Technology,News,Unity Software to Cut 25% of Its Work Force,"Computers and the Internet;Layoffs and Job Reductions;Labor and Jobs;Xerox Corporation;Riccitiello, John;San Francisco (Calif)"
5,Nikki Haley took pointed questions from both Iowans and Fox News hosts.,"Nikki Haley was repeatedly challenged over policy views that veer away from her more conservative rivals during an hourlong town-hall event on Fox News on Monday, but she stood her ground — and called Donald J. Trump an agent of chaos and Ron DeSantis a liar.",2024-01-09T00:43:06+0000,article,U.S.,News,"Challenged on Policy Views in Town-Hall Event, Haley Doesn’t Budge","Haley, Nikki R;Primaries and Caucuses;Presidential Election of 2024;United States Politics and Government;Iowa"
6,The latest strikes across Israel’s northern border came as the U.S. secretary of state made another trip to the Middle East in efforts to prevent a wider war.,"Israel launched strikes into southern Lebanon on Monday against Hezbollah, the Iranian-backed militia, which said one of its senior commanders had been killed there, adding to concerns that Israel’s fight against Hamas in Gaza could erupt into a wider regional war.",2024-01-09T01:00:08+0000,article,World,News,"Israeli Strikes in Lebanon Kill Hezbollah Commander, Militia Says","Israel-Gaza War (2023- );Defense and Military Forces;Assassinations and Attempted Assassinations;International Relations;United States International Relations;Israel;Gaza Strip;Lebanon;Iran;Hezbollah;Al-Tawil, Wissam Hassan;Hamas;Middle East"
7,The experts’ statement came after the United Nations had been the focus of months of frustrated accusations that it was ignoring the rape and mutilation of women during the Oct. 7 attacks.,"Violence that included sexual atrocities committed during the Hamas-led attacks on Oct. 7 in Israel amounts to war crimes and may also be crimes against humanity, two United Nations human rights experts said on Monday, following months of frustrated accusations from Israel and women’s groups that the U.N. was ignoring the rape and sexual mutilation of women during the Oct. 7 invasion.",2024-01-09T01:25:40+0000,article,World,News,"Oct. 7 Assaults, Including Sexual Violence, Could Be Crimes Against Humanity, 2 U.N. Experts Say","United Nations;Hamas;Israel-Gaza War (2023- );Sex Crimes;War Crimes, Genocide and Crimes Against Humanity"
8,A defendant in the election interference case is arguing that the district attorney overseeing it and a special prosecutor she hired should be disqualified.,"A lawyer for one of the defendants charged along with former President Donald J. Trump in the Georgia election interference case said in a court filing on Monday that the district attorney overseeing the case, Fani T. Willis, had engaged in a “clandestine” relationship with the special prosecutor she hired to help handle it.",2024-01-09T01:58:04+0000,article,U.S.,News,Filing in Georgia Trump Case Claims ‘Improper’ Relationship Between Prosecutors,"Georgia Criminal Case Against Trump (2020 Election);Willis, Fani T;Trump, Donald J;Presidential Election of 2020;Ethics and Official Misconduct;Fulton County (Ga)"
9,"The Secret Service said that the driver’s motives were still unclear, but that there was no threat to the White House complex or the public.","A driver crashed into an exterior gate near the White House shortly before 6 p.m. Monday and was taken into custody, the Secret Service said, adding that the agency was still investigating whether the crash was intentional.",2024-01-09T02:49:23+0000,article,U.S.,News,Driver in Custody After Crashing Into Gate Near the White House,"United States Politics and Government;White House Building (Washington, DC);Secret Service"
10,Adam Wagner reveals his hidden agenda.,Jump to: Today’s Theme | Tricky Clues,2024-01-09T03:00:06+0000,article,Crosswords & Games,News,Be Wide-Open,Crossword Puzzles;Games
11,"On the snowy campaign trail in Iowa, he said the “system” would keep Donald Trump from reaching the White House.","In northwestern Iowa on Monday, Vivek Ramaswamy addressed, unprompted, a question that has trailed him throughout his presidential bid: Why should voters choose him instead of Donald J. Trump, the former president whom he routinely and staunchly defends?",2024-01-09T03:15:34+0000,article,U.S.,News,"While Defending Trump, Ramaswamy Insists He’s More Electable in the Fall","Ramaswamy, Vivek (1985- );Trump, Donald J;Presidential Election of 2024;Primaries and Caucuses;Republican Party"
12,"The artificial intelligence start-up said that it collaborated with news organizations and that The Times, which accused it of copyright infringement, was not telling the full story.","OpenAI said on Monday that a New York Times lawsuit against it was “without merit” and that it supported and created opportunities for news organizations, as it waded further into a debate over the unauthorized use of published work to train artificial intelligence technologies.",2024-01-09T04:39:16+0000,article,Technology,News,OpenAI Says New York Times Lawsuit Against It Is ‘Without Merit’,Artificial Intelligence;News and News Media;Suits and Litigation (Civil);Copyrights and Copyright Violations;Computers and the Internet;ChatGPT;New York Times;OpenAI Labs;Microsoft Corp
13,"In Romania, a walk in the woods blossomed into a mission to safeguard centuries-old beeches and the history that shaped them.","The story of the Forest of Immortal Stories begins not so long ago, in 2019, when Elena-Mirela Cojocaru, beloved wife of Ion Cojocaru, mayor of the hamlet of Nucsoara, died after a struggle with cancer. Mr. Cojocaru himself soon fell ill with a heart ailment; as a remedy his doctor told him to walk in the countryside, 6,000 or more steps a day.",2024-01-09T05:01:23+0000,article,Science,News,‘The Trees Saved Me’,"Conservation of Resources;Forests and Forestry;Eco-Tourism;National Parks, Monuments and Seashores;Trees and Shrubs;3-D Devices and Effects;Carpathian Mountains;Romania;your-feed-science;internal-storyline-no"
14,Israel’s next phase of the war in Gaza.,"Israel said its military was starting to shift from a large-scale ground-and-air campaign in the Gaza Strip to a more targeted phase, with fewer troops and airstrikes, in its war against Hamas. Israeli officials have privately told their U.S. counterparts that they hoped the transition would be completed by the end of the month, U.S. officials said.",2024-01-09T05:31:14+0000,article,Briefing,briefing,Tuesday Briefing,
15,"Quotation of the Day for Tuesday, January 9, 2024.",“The rapid progress of A.I. will continue. It is inevitable.”,2024-01-09T05:50:10+0000,article,Corrections,Quote,Quotation of the Day:A ‘Leap Forward’ for A.I. May Occur in 2024,
16,"Secretary of State Antony J. Blinken was meeting with top Israeli officials on Tuesday, continuing diplomatic efforts to avert a broader war in the region.","Secretary of State Antony J. Blinken was meeting with top Israeli officials on Tuesday, continuing diplomatic efforts to avert a broader war in the region.",2024-01-09T06:35:37+0000,article,World,News,Blinken begins meetings in Israel amid deepening disagreements over the war.,
17,"Breeding, killing and selling dogs for their meat will be banned in a country where it has fallen out of favor. Hundreds of thousands of the animal were still being bred for human consumption.","South Korea’s lawmakers on Tuesday outlawed the breeding, slaughter and sale of dogs for human consumption, a centuries-old practice that is unpopular and rare today.",2024-01-09T06:36:06+0000,article,World,News,"South Korea Bans Dog Meat, a Now-Unpopular Food","Meat;Dogs;Breeding of Animals;Law and Legislation;Animal Abuse, Rights and Welfare;Humane Society International;Yoon Suk-yeol;South Korea"
18,This word has appeared in 27 articles on NYTimes.com in the past year. Can you use it in a sentence?,"The word portentous has appeared in 25 articles on NYTimes.com in the past year, including on Nov. 3 in “Is Fluminense the Team of the Future?” by Rory Smith:",2024-01-09T07:00:02+0000,article,The Learning Network,News,Word of the Day: portentous,
19,Earth’s stratosphere has never seen the amounts of emissions and waste from rockets and satellites that a booming space economy will leave behind.,"The high-altitude chase started over Cape Canaveral on Feb. 17, 2023, when a SpaceX Falcon 9 rocket launched. Thomas Parent, a NASA research pilot, was flying a WB-57 jet when the rocket ascended past the right wing — leaving him mesmerized before he hit the throttle to accelerate.",2024-01-09T07:59:25+0000,article,Science,News,The New Space Race Is Causing New Pollution Problems,Space and Astronomy;Private Spaceflight;Rocket Science and Propulsion;Satellites;Fuel Emissions (Transportation);Air Pollution;Ozone;Radiation;Waste Materials and Disposal;Research;Regulation and Deregulation of Industry;Starlink Satellite Constellation (SpaceX);Space Exploration Technologies Corp;Kuiper Systems (Amazon.com Inc);OneWeb Inc;audio-neutral-informative
20,Even the most powerful telescopes are in peril as orbits above Earth fill with thousands of new satellites. But scientists aren’t ready to give up the night sky.,"In December 2020, astronomers documented a burst of highly energetic light in one of the most distant galaxies ever observed. But less than a year later, the paper’s claims lay in limbo. Other scientists said it had merely been a passing satellite.",2024-01-09T07:59:25+0000,article,Science,News,How Astronomers Are Saving Astronomy From Satellites — For Now,Space and Astronomy;Satellites;Telescopes and Observatories;Regulation and Deregulation of Industry;Starlink Satellite Constellation (SpaceX);National Science Foundation;Space Exploration Technologies Corp;Kuiper Systems (Amazon.com Inc)
21,In case you need some puzzle help.,"Welcome to The Wordle Review. Be warned: This page contains spoilers for today’s puzzle. Solve Wordle first, or scroll at your own risk.",2024-01-09T08:00:02+0000,article,Crosswords & Games,News,Today’s Wordle Review,Wordle (Puzzle)
22,Feeling stuck on today’s puzzle? We can help.,"Hi busy bees! Welcome to today’s Spelling Bee forum. There are a number of terms that appear in both this article and other online discussions of the Spelling Bee; a glossary of those terms compiled by Monicat, a Times reader, can be found below.",2024-01-09T08:00:03+0000,article,Crosswords & Games,News,Spelling Bee Forum,Spelling Bee (Game)
23,In case you need some puzzle help.,"Good morning, dear connectors. Welcome to today’s Connections forum, where you can give and receive puzzle — and emotional — support.",2024-01-09T08:00:10+0000,article,Crosswords & Games,News,The Connections Companion,Crossword Puzzles;Connections (Game)
24,"Colleges across the United States have been roiled by controversy. Anemona Hartocollis, a reporter on the higher education beat, discussed how she approaches it all.","Anemona Hartocollis, a New York Times reporter who covers higher education, was at a holiday party when she overheard revelers talking about Claudine Gay, the president of Harvard University.",2024-01-09T08:00:15+0000,article,Times Insider,News,When ‘Contemporary Issues’ and Campus Politics Collide,"Colleges and Universities;Israel-Gaza War (2023- );Tuition;Cancel Culture;Harvard University;Gay, Claudine;Hartocollis, Anemona;Cambridge (Mass);Massachusetts"
25,Millions of asylum seekers have overwhelmed the immigration system. A confusing mix-up is keeping one family in limbo.,"Dyluis Rojas and his wife and children fled first from Venezuela and later from Colombia and Chile, crossing deserts, jungles and rivers with one goal: to make it to the United States and stay there.",2024-01-09T08:00:20+0000,article,New York,News,"This Venezuelan Family Won Asylum. Days Later, They Lost It.","Asylum, Right of;Immigration and Emigration;Citizenship and Immigration Services (US);Transactional Records Access Clearinghouse;New York City;Venezuela;Courts and the Judiciary"
26,Adm. Richard E. Byrd was once known around the world for his expeditions to Antarctica. His son was determined to preserve his legacy.,"It arrived without fanfare or explanation, marked Lot No. 313 at the J. James Auction House in Plymouth, Mass. A simple flag, bearing an “E” and a “C” alongside a compass star, against a red, white and blue background.",2024-01-09T08:00:22+0000,article,New York,News,"A Famous Explorer, an Obsessive Son and the Reappearance of Flag No. 98","Byrd, Richard E;Explorers Club;Exploration and Explorers;Organizations, Societies and Clubs;internal-sub-only;Flags, Emblems and Insignia;ANTARCTIC REGIONS;New York City;internal-great-read;Hoarding"
27,The latest phone? Special-edition sneakers? A trendy tumbler? What would you be willing to camp out — even fight — for?,"Have you heard about people camping out for and fighting over a special Valentine’s Day cup at Target stores? Yes, a cup!",2024-01-09T08:00:25+0000,article,The Learning Network,News,Coveted Cup,
28,"The singer did not promote a giveaway of the popular cookware, but an artificially generated version of her voice suggested otherwise.","Taylor Swift’s affinity for Le Creuset is real: Her collection of the cookware has been featured on a Tumblr account dedicated to the pop star’s home décor, showcased in her gift choices at a fan’s bridal shower and shown in a Netflix documentary that was highlighted by Le Creuset’s Facebook page.",2024-01-09T08:00:27+0000,article,Technology,News,"No, That’s Not Taylor Swift Peddling Le Creuset Cookware","Social Media;Artificial Intelligence;Celebrities;Online Advertising;Rumors and Misinformation;Frauds and Swindling;Video Recordings, Downloads and Streaming;Voice and Speech;Swift, Taylor;Le Creuset of America;Cookware"
29,"Kimmel said although the N.F.L. star may believe that Kimmel is linked to Jeffrey Epstein, it’s more likely that Rodgers “is mad at me for making fun of his topknot.”","Welcome to Best of Late Night, a rundown of the previous night’s highlights that lets you sleep — and lets us get paid to watch comedy. Here are the 50 best movies on Netflix right now.",2024-01-09T08:03:00+0000,article,Arts,News,Jimmy Kimmel Isn’t Expecting an Apology From Aaron Rodgers,"Television;Meyers, Seth;Jimmy Kimmel Live (TV Program);Kimmel, Jimmy;Fallon, Jimmy;Colbert, Stephen;Late Night with Seth Meyers (TV Program);Late Show with Stephen Colbert (TV Program);The Tonight Show (TV Program)"
30,"In this short film, Congolese artworks voice the poet and author Aimé Césaire’s words: “Colonization is thingification.”","In this short film, Congolese artworks voice the poet and author Aimé Césaire’s words: “Colonization is thingification.”",2024-01-09T09:55:01+0000,multimedia,Opinion,Video,Under the White Mask: The Film That Haesaerts Could Have Made,"Colonization;Belgium;Congo, Democratic Republic of (Congo-Kinshasa);Race and Ethnicity"
31,"In this short film, Congolese artworks voice the poet and author Aimé Césaire’s words: “Colonization is thingification.”","The idea for this film began when a friend was planning an exhibition featuring Congolese artwork. She was considering including the documentary “Under the Black Mask” (1958), by the Belgian filmmaker Paul Haesaerts, but was unsure how to present the piece, which contains voice-over and images that stereotype and exoticize Congolese culture. How could we adequately contextualize a work by a filmmaker from Belgium created in the final years of that country’s decades-long, brutal colonial occupation of what is now the Democratic Republic of Congo?",2024-01-09T10:00:06+0000,article,Opinion,Op-Ed,Art’s Colonial Legacy: ‘It Would Have Been Better Not to Have Needed Museums.’,"Documentary Films and Programs;Colonization;Belgium;Congo, Democratic Republic of (Congo-Kinshasa);AFRICA;Haesaerts, Paul;Cesaire, Aime;Art"
32,"These broken blood vessels can be unsightly, but they’re not a nuisance you have to live with.","Q: I’ve noticed some red, squiggly blood vessels just under the skin of my cheeks and around my nose. What are they, exactly? And is it possible to get rid of them?",2024-01-09T10:00:07+0000,article,Well,News,Can I Fix the Spider Veins on My Face?,Skin;Content Type: Service;Face;Laser (Light Amplification by Stimulated Emission of Radiation)
33,"As psychedelics move from the underground to mainstream medicine, clinicians aspiring to work in the field are inducing altered states with deep breathing.","The instructions were simple: Lying on cots while wearing eyeshades, participants were directed to take deep belly breaths without pause to the beat of fast-paced music booming from loudspeakers.",2024-01-09T10:00:25+0000,article,Style,News,Breathing Their Way to an Altered State,Psychedelic and Hallucinogenic Drugs;Therapy and Rehabilitation;Alternative and Complementary Medicine;Psychology and Psychologists;Brain;Center for Psychedelic Therapies and Research;California Institute of Integral Studies
34,A rash decision to attend an anti-Qaddafi protest in London reverberates in Hisham Matar’s poignant and quietly suspenseful third novel.,"In the works of the Libyan-born writer Hisham Matar, a few subjects take center stage again and again. There’s the violence of the Muammar el-Qaddafi regime: torture, assassination, disappearance, confessions broadcast on state television, government agents listening to phone calls. And there’s the experience of Libyans seeking safety in exile. Matar — himself one such exile — picks apart their psyches, analyzing at a microscopic level how violence and migration have altered how they think and feel and relate to the people closest to them. He has returned to this cluster of topics as if it’s a house he’s obsessed with, examining it from different angles, sneaking inside and finding new rooms, even new wings.",2024-01-09T10:00:29+0000,article,Books,Review,"In ‘My Friends’ an Exile Finds Himself Outside Libya, but Never Far Away","Books and Literature;Writing and Writers;Matar, Hisham;MY FRIENDS (BOOK)"
35,"When players buy games in early access, they can give studios both valuable feedback and a crucial revenue stream.","With the help of lightning rings, garlic and Bibles, players were outlasting waves of ghouls and beasts in Vampire Survivors long before the video game was released officially.",2024-01-09T10:00:29+0000,article,Arts,News,Unfinished Video Games Are Turning Into Hits,Computer and Video Games;Baldur's Gate 3 (Video Game);Vampire Survivors (Video Game);Astral Ascent (Video Game)
36,Kyle Chayka on the art of developing personal style in an age when algorithms loom over aesthetics and culture.,"Being on the internet just doesn’t feel as fun anymore. As more of our digital life is driven by algorithms, it’s become a lot easier to find movies or TV shows or music that fits our preferences pretty well. But it feels harder to find things that are strange and surprising — the kinds of culture that help you, as an individual, develop your own sense of taste.",2024-01-09T10:00:33+0000,article,Opinion,Op-Ed,How to Discover Your Own Taste,"audio-neutral-informative;Books and Literature;Taste;Computers and the Internet;Chayka, Kyle;Music;Design;Culture (Arts)"
37,The league’s successes and struggles are playing out in hundreds of companies that have emulated its Rooney Rule in trying to hire more people from underrepresented groups.,"The end of the National Football League’s regular season on Sunday triggered the start of two annual events: the playoffs, and the period when a wave of teams fire head coaches and general managers and start frenzied searches for their replacements.",2024-01-09T10:00:37+0000,article,Business Day,News,"In the N.F.L. and at Big Companies, Diversity Playbooks Face Hurdles",Football;Corporations;Hiring and Promotion;Diversity Initiatives;Race and Ethnicity;Coaches and Managers;National Football League;United States
38,"Cynthia Zarin’s first novel, “Inverno,” is a tale of a woman’s incurable longing and haunted past.","I once taught a seminar for graduate fiction writers called A Poet’s Prose. The reading list consisted of prose works written by distinguished contemporary poets. I was surprised to find that several students had registered for the course because they considered their own writing poetic. I was less surprised to find that what they meant by poetic was exactly the kind of strained, showy language I’d hoped exposure to writers with a poet’s essential skills would improve. I wanted my students to read good poets’ prose for the same reason I kept encouraging them to read poetry: to learn how effective concision of language, meticulous use of detail and sensitivity to cadence can be.",2024-01-09T10:00:40+0000,article,Books,Review,"Waiting in the Snow for a Phone Call, Mixing Memory and Desire","Books and Literature;Zarin, Cynthia"
39,Here’s how to confront your fears and seek out new perspectives this year — no therapist required.,The start of the new year often brings lofty ambitions.,2024-01-09T10:00:41+0000,article,Well,News,New Year’s Resolutions for the Anxious,Anxiety and Stress;Content Type: Service;New Year
40,"Babies generally are given the father’s last name in the United States, but  a small minority of families are making different choices. What do you think?","How did you get your last name? Was it passed down to you from your father’s side of the family? That is how last names are usually given to babies in the United States, but some families are taking different approaches. They may draw from the mother’s side instead, use both parents’ last names (sometimes placing a hyphen between them), choose a name that has family history or other significance — or come up with something wholly original.",2024-01-09T10:00:42+0000,article,The Learning Network,News,What Are Your Thoughts on Last Names?,
