,abstract,lead_paragraph,pub_date,document_type,section_name,type_of_material,headline,keywords
120,"Two Missouri residents, Dominic Miller and Lyndell Mays, were charged with murder in the shooting that erupted after the Super Bowl parade in Kansas City, Mo. Here are the charging documents against Dominic Miller.","Two Missouri residents, Dominic Miller and Lyndell Mays, were charged with murder in the shooting that erupted after the Super Bowl parade in Kansas City, Mo. Here are the charging documents against Dominic Miller.",2024-02-20T22:16:13+0000,multimedia,U.S.,Interactive Feature,Read the Charging Documents Against Dominic Miller,"Kansas City (Mo);Missouri;Mass Shootings;Kansas City, Mo, Shooting (Feb 14, 2024)"
121,"Lindsey Graham, J.D. Vance, Mike Johnson and other Republicans are waving the white flag of surrender on Ukraine, all at Trump’s behest.","I’ve got a suggestion for the next Trump-G.O.P. fund-raising scheme. You know how sports memorabilia stores sometimes sell basketballs autographed by an entire N.B.A. team? Well, I was imagining that Donald Trump could sell white flags at $1,000 a pop that say, “We surrendered Ukraine to Russia,” autographed by him and the House and Senate MAGA sycophants he’s assembled to deny Ukrainians the weapons they need to stave off Vladimir Putin’s onslaught.",2024-02-20T22:18:57+0000,article,Opinion,Op-Ed,Trump’s G.O.P. Is a Confederacy of Fakers,"Russian Invasion of Ukraine (2022);Trump, Donald J;Graham, Lindsey;Johnson, Mike (1972- );Putin, Vladimir V;Vance, J D;Republican Party;Presidential Election of 2024;United States International Relations;Ukraine;Russia"
122,"The United States said the resolution could have disrupted its negotiations to free hostages and secure a temporary cease-fire, but its vote drew outcry from many diplomats and aid workers.","The United States on Tuesday cast the sole vote against a United Nations Security Council resolution that would have called for an immediate cease-fire in the Gaza Strip, saying it feared it could disrupt hostage negotiations.",2024-02-20T22:30:17+0000,article,World,News,U.S. Vetoes Security Council Cease-Fire Resolution,Israel-Gaza War (2023- );United States International Relations;Security Council (UN);Israel;Defense and Military Forces;Gaza Strip;Hamas;Terrorism;Kidnapping and Hostages;Palestinians;Peace Process;Humanitarian Aid
123,"Also, the Supreme Court declined to hear a case on race and admissions. Here’s the latest at the end of Tuesday.","The fall of the eastern Ukrainian city of Avdiivka to Russia over the weekend was a major symbolic loss for Ukraine and the West. But while American officials initially argued that it was not a significant strategic setback, that calculus could soon change.",2024-02-20T22:30:31+0000,article,Briefing,News,Ukraine’s Latest Loss May Be Worse Than Expected,Russian Invasion of Ukraine (2022);Defense and Military Forces;Avdiivka (Ukraine);Russia;Ukraine
124,Political and legal risks are mounting for banks and asset managers.,Many of the world’s biggest financial firms spent the past several years burnishing their environmental images by pledging to use their financial muscle to fight climate change.,2024-02-20T22:47:17+0000,article,Climate,News,What’s behind Wall Street’s flip-flop on climate?,Banking and Financial Institutions;Corporate Social Responsibility;Environment;Global Warming
125,"As the director of salons at Henri Bendel, Bergdorf Goodman and Saks Fifth Avenue, she spent decades outfitting brides-to-be for their grand ceremonies.","Monica Hickey, who for decades swathed celebrities and socialites for their lavish nuptials in the haute bridal salons at the New York department stores Henri Bendel, Bergdorf Goodman and Saks Fifth Avenue, died on Jan. 26 in Valle de Elqui, Chile. She was 100.",2024-02-20T23:12:59+0000,article,Style,Obituary (Obit),"Monica Hickey, Doyenne of Bridal Gowns, Dies at 100","Deaths (Obituaries);Fashion and Apparel;Dresses;Weddings and Engagements;Shopping and Retail;Hickey, Monica (1923-2024);Bergdorf Goodman;Henri Bendel;Saks Fifth Avenue"
126,"The authorities said that genetic evidence was used to find Annie Anderson of Washington State. She will be charged with first-degree murder in the death of her child, who came to be known as Baby Skylar.","The dead baby girl was found in a trash bin in a women’s bathroom at main airport in Phoenix on Oct. 10, 2005. Wrapped in newspapers and a towel, the newborn had been stuffed into a plastic bag from a Marriott Hotel, the police said.",2024-02-20T23:15:31+0000,article,U.S.,News,A Dead Baby Was Found at an Airport in 2005. Her Mother Was Just Arrested.,"Forensic Science;Murders, Attempted Murders and Homicides;Maricopa County (Ariz);Phoenix (Ariz);Babies and Infants;Washington (State);Phoenix Sky Harbor International Airport;Airports"
127,"Mayor Eric Adams, an avowed technophile, said the drones would be used to assist lifeguards at Coney Island as part of a pilot program starting this summer.","This summer, struggling swimmers off Coney Island might be met not just by a young lifeguard in an orange suit but also by assistance from above, in the form of a buglike device delivering an inflatable float.",2024-02-20T23:32:23+0000,article,New York,News,N.Y.P.D. Drones Carrying Rafts Could Join Lifeguards in Beach Rescues,"Drownings;Lifeguards;Beaches;Adams, Eric L;Coney Island (Brooklyn, NY);New York City;Parks and Recreation Department (NYC);Drones (Pilotless Planes)"
